opposingHand,winningChance,drawChance,lostChance
CLUBS TWO HEARTS JACK,0.4412,0.0158,0.543
SPADES SEVEN DIAMONDS NINE,0.2702,0.2826,0.4472
SPADES SIX DIAMONDS NINE,0.2686,0.3602,0.3712
SPADES NINE DIAMONDS NINE,0.1432,0.0684,0.7884
SPADES EIGHT DIAMONDS NINE,0.2758,0.206,0.5182
SPADES TEN CLUBS KING,0.361,0.0058,0.6332
DIAMONDS NINE SPADES THREE,0.3778,0.4264,0.1958
SPADES JACK CLUBS KING,0.3634,0.0086,0.628
DIAMONDS NINE SPADES TWO,0.3556,0.4374,0.207
DIAMONDS NINE SPADES FIVE,0.0756,0.9012,0.0232
DIAMONDS NINE SPADES FOUR,0.369,0.4314,0.1996
CLUBS EIGHT DIAMONDS NINE,0.2406,0.2242,0.5352
CLUBS SIX DIAMONDS NINE,0.2468,0.3694,0.3838
SPADES JACK CLUBS FOUR,0.4448,0.0182,0.537
CLUBS SEVEN DIAMONDS NINE,0.26,0.2796,0.4604
SPADES TEN CLUBS FOUR,0.4462,0.026,0.5278
CLUBS FOUR DIAMONDS NINE,0.3508,0.445,0.2042
CLUBS TWO DIAMONDS NINE,0.3686,0.4312,0.2002
CLUBS THREE DIAMONDS NINE,0.356,0.4366,0.2074
DIAMONDS NINE HEARTS EIGHT,0.2724,0.2082,0.5194
DIAMONDS NINE HEARTS NINE,0.1476,0.0602,0.7922
HEARTS SIX DIAMONDS NINE,0.2736,0.3694,0.357
DIAMONDS NINE HEARTS SEVEN,0.2622,0.2828,0.455
DIAMONDS ACE DIAMONDS NINE,0.2828,0.022,0.6952
HEARTS FOUR DIAMONDS NINE,0.366,0.4306,0.2034
HEARTS FIVE DIAMONDS NINE,0.0688,0.9124,0.0188
CLUBS TWO HEARTS ACE,0.4192,0.0072,0.5736
SPADES ACE CLUBS FOUR,0.4276,0.006,0.5664
DIAMONDS QUEEN DIAMONDS NINE,0.2684,0.0432,0.6884
HEARTS TWO DIAMONDS NINE,0.3724,0.4288,0.1988
CLUBS TWO HEARTS KING,0.4436,0.0072,0.5492
SPADES KING CLUBS FOUR,0.4314,0.0082,0.5604
DIAMONDS KING DIAMONDS NINE,0.2722,0.0364,0.6914
HEARTS THREE DIAMONDS NINE,0.3744,0.4156,0.21
CLUBS TWO HEARTS QUEEN,0.435,0.0124,0.5526
SPADES QUEEN CLUBS FOUR,0.4328,0.0108,0.5564
DIAMONDS NINE DIAMONDS JACK,0.2772,0.054,0.6688
CLUBS EIGHT SPADES NINE,0.2514,0.2194,0.5292
DIAMONDS NINE DIAMONDS TEN,0.2564,0.07,0.6736
CLUBS EIGHT SPADES EIGHT,0.2966,0.0598,0.6436
CLUBS EIGHT SPADES SEVEN,0.5462,0.0408,0.413
CLUBS EIGHT SPADES SIX,0.5886,0.035,0.3764
CLUBS EIGHT SPADES FIVE,0.6682,0.0948,0.237
CLUBS EIGHT SPADES FOUR,0.6208,0.0434,0.3358
CLUBS EIGHT SPADES THREE,0.643,0.0436,0.3134
CLUBS EIGHT SPADES TWO,0.631,0.0416,0.3274
HEARTS SIX DIAMONDS TEN,0.401,0.024,0.575
DIAMONDS TEN HEARTS SEVEN,0.3812,0.0248,0.594
DIAMONDS TEN HEARTS EIGHT,0.3812,0.0244,0.5944
CLUBS JACK CLUBS FOUR,0.3882,0.0152,0.5966
DIAMONDS TEN HEARTS NINE,0.2638,0.0774,0.6588
CLUBS TEN CLUBS FOUR,0.3918,0.0286,0.5796
CLUBS FOUR CLUBS KING,0.3978,0.0092,0.593
CLUBS FOUR CLUBS QUEEN,0.39,0.0148,0.5952
CLUBS TWO DIAMONDS TEN,0.443,0.0256,0.5314
CLUBS THREE DIAMONDS TEN,0.44,0.0252,0.5348
CLUBS FOUR CLUBS ACE,0.3902,0.006,0.6038
DIAMONDS JACK DIAMONDS TEN,0.3346,0.013,0.6524
DIAMONDS QUEEN DIAMONDS TEN,0.3536,0.0094,0.637
HEARTS TWO DIAMONDS TEN,0.444,0.0304,0.5256
DIAMONDS KING DIAMONDS TEN,0.3436,0.0068,0.6496
HEARTS THREE DIAMONDS TEN,0.4396,0.0272,0.5332
DIAMONDS ACE DIAMONDS TEN,0.348,0.0042,0.6478
HEARTS FOUR DIAMONDS TEN,0.442,0.0262,0.5318
CLUBS EIGHT HEARTS JACK,0.3872,0.0162,0.5966
HEARTS FIVE DIAMONDS TEN,0.2972,0.0792,0.6236
CLUBS EIGHT HEARTS TEN,0.3698,0.025,0.6052
CLUBS EIGHT HEARTS QUEEN,0.3964,0.0116,0.592
CLUBS EIGHT HEARTS KING,0.4082,0.0072,0.5846
CLUBS EIGHT HEARTS ACE,0.4018,0.005,0.5932
CLUBS TEN HEARTS EIGHT,0.3572,0.0234,0.6194
CLUBS JACK HEARTS EIGHT,0.3744,0.018,0.6076
CLUBS QUEEN HEARTS EIGHT,0.3762,0.0134,0.6104
CLUBS KING HEARTS EIGHT,0.4002,0.0066,0.5932
CLUBS ACE HEARTS EIGHT,0.3836,0.0052,0.6112
SPADES KING CLUBS KING,0.1824,0.014,0.8036
SPADES QUEEN CLUBS KING,0.3512,0.0076,0.6412
SPADES ACE CLUBS KING,0.362,0.005,0.633
DIAMONDS ACE HEARTS TEN,0.3782,0.0044,0.6174
HEARTS FOUR HEARTS TEN,0.3942,0.0266,0.5792
DIAMONDS ACE HEARTS JACK,0.3824,0.0032,0.6144
HEARTS FOUR HEARTS JACK,0.4152,0.0184,0.5664
DIAMONDS JACK HEARTS SEVEN,0.3868,0.0154,0.5978
HEARTS SIX DIAMONDS JACK,0.4148,0.0204,0.5648
DIAMONDS JACK HEARTS NINE,0.2842,0.057,0.6588
DIAMONDS JACK HEARTS EIGHT,0.3784,0.0148,0.6068
DIAMONDS KING DIAMONDS JACK,0.3516,0.0074,0.641
HEARTS THREE DIAMONDS JACK,0.4422,0.0192,0.5386
SPADES ACE SPADES SIX,0.3848,0.006,0.6092
HEARTS ACE SPADES FOUR,0.4162,0.0054,0.5784
DIAMONDS QUEEN DIAMONDS JACK,0.3424,0.01,0.6476
HEARTS TWO DIAMONDS JACK,0.4418,0.0178,0.5404
HEARTS FIVE DIAMONDS JACK,0.2934,0.0604,0.6462
SPADES QUEEN SPADES SIX,0.3784,0.0136,0.608
SPADES FOUR HEARTS QUEEN,0.4358,0.0126,0.5516
DIAMONDS ACE DIAMONDS JACK,0.3556,0.0052,0.6392
HEARTS FOUR DIAMONDS JACK,0.4406,0.013,0.5464
SPADES KING SPADES SIX,0.3842,0.01,0.6058
HEARTS KING SPADES FOUR,0.4446,0.0092,0.5462
SPADES TEN SPADES SIX,0.3778,0.0232,0.599
SPADES JACK SPADES SIX,0.3856,0.0182,0.5962
SPADES FOUR DIAMONDS JACK,0.4346,0.0154,0.55
SPADES FIVE DIAMONDS JACK,0.2994,0.0526,0.648
DIAMONDS JACK SPADES TWO,0.442,0.0144,0.5436
DIAMONDS JACK SPADES THREE,0.438,0.0188,0.5432
SPADES ACE DIAMONDS THREE,0.435,0.0054,0.5596
SPADES QUEEN DIAMONDS THREE,0.4356,0.0112,0.5532
CLUBS EIGHT DIAMONDS JACK,0.3844,0.021,0.5946
SPADES KING DIAMONDS THREE,0.441,0.0104,0.5486
CLUBS SIX DIAMONDS JACK,0.4172,0.0184,0.5644
CLUBS SEVEN DIAMONDS JACK,0.3796,0.0168,0.6036
CLUBS FOUR DIAMONDS JACK,0.4142,0.021,0.5648
CLUBS TWO DIAMONDS JACK,0.4366,0.016,0.5474
CLUBS THREE DIAMONDS JACK,0.4316,0.022,0.5464
HEARTS SIX SPADES JACK,0.4104,0.0158,0.5738
HEARTS SIX SPADES TEN,0.3938,0.0266,0.5796
SPADES JACK DIAMONDS THREE,0.4366,0.0184,0.545
CLUBS SEVEN CLUBS ACE,0.3496,0.006,0.6444
DIAMONDS THREE SPADES TEN,0.4336,0.0304,0.536
CLUBS SEVEN CLUBS QUEEN,0.3538,0.0124,0.6338
CLUBS SEVEN CLUBS KING,0.3554,0.008,0.6366
SPADES NINE DIAMONDS JACK,0.2894,0.0562,0.6544
CLUBS TEN CLUBS SEVEN,0.3268,0.0278,0.6454
DIAMONDS ACE HEARTS ACE,0.1886,0.0046,0.8068
HEARTS FOUR HEARTS ACE,0.4048,0.0044,0.5908
SPADES EIGHT DIAMONDS JACK,0.3872,0.0178,0.595
SPADES ACE HEARTS SIX,0.4094,0.0046,0.586
CLUBS JACK CLUBS SEVEN,0.3552,0.018,0.6268
DIAMONDS ACE HEARTS KING,0.3814,0.0042,0.6144
HEARTS FOUR HEARTS KING,0.417,0.01,0.573
SPADES SEVEN DIAMONDS JACK,0.4034,0.0172,0.5794
SPADES KING HEARTS SIX,0.4032,0.008,0.5888
DIAMONDS ACE HEARTS QUEEN,0.3796,0.0048,0.6156
HEARTS FOUR HEARTS QUEEN,0.4052,0.0132,0.5816
SPADES QUEEN HEARTS SIX,0.4074,0.0104,0.5822
SPADES SIX DIAMONDS JACK,0.416,0.0196,0.5644
DIAMONDS TEN SPADES TWO,0.4432,0.0262,0.5306
SPADES THREE DIAMONDS TEN,0.4452,0.028,0.5268
SPADES FOUR DIAMONDS TEN,0.4376,0.0304,0.532
SPADES FIVE DIAMONDS TEN,0.307,0.069,0.624
SPADES SIX DIAMONDS TEN,0.4012,0.0228,0.576
SPADES SEVEN DIAMONDS TEN,0.3894,0.028,0.5826
SPADES EIGHT DIAMONDS TEN,0.3838,0.0238,0.5924
SPADES NINE DIAMONDS TEN,0.2784,0.0722,0.6494
CLUBS FOUR DIAMONDS TEN,0.4328,0.0294,0.5378
CLUBS SIX DIAMONDS TEN,0.3876,0.0246,0.5878
CLUBS SEVEN DIAMONDS TEN,0.376,0.0248,0.5992
CLUBS EIGHT DIAMONDS TEN,0.3702,0.023,0.6068
CLUBS JACK DIAMONDS THREE,0.4224,0.0166,0.561
CLUBS TEN DIAMONDS THREE,0.4214,0.0254,0.5532
DIAMONDS THREE CLUBS KING,0.422,0.0102,0.5678
DIAMONDS THREE CLUBS QUEEN,0.4346,0.0102,0.5552
DIAMONDS THREE CLUBS ACE,0.412,0.0044,0.5836
SPADES FOUR HEARTS JACK,0.434,0.0176,0.5484
SPADES FOUR HEARTS TEN,0.4278,0.0294,0.5428
SPADES FIVE SPADES TWO,0.6178,0.101,0.2812
SPADES FOUR SPADES TWO,0.603,0.0412,0.3558
SPADES THREE SPADES TWO,0.6006,0.0434,0.356
SPADES NINE SPADES TWO,0.3562,0.395,0.2488
SPADES EIGHT SPADES TWO,0.5984,0.038,0.3636
SPADES SEVEN SPADES TWO,0.602,0.0386,0.3594
SPADES SIX SPADES TWO,0.6076,0.0386,0.3538
DIAMONDS QUEEN CLUBS THREE,0.4288,0.0102,0.561
HEARTS TWO CLUBS THREE,0.629,0.0448,0.3262
DIAMONDS QUEEN CLUBS TWO,0.4378,0.0116,0.5506
CLUBS TWO HEARTS TWO,0.42,0.0786,0.5014
DIAMONDS QUEEN HEARTS SEVEN,0.4064,0.0082,0.5854
HEARTS TWO HEARTS SEVEN,0.6194,0.0368,0.3438
HEARTS SIX DIAMONDS QUEEN,0.4074,0.0114,0.5812
HEARTS SIX HEARTS TWO,0.584,0.0432,0.3728
DIAMONDS QUEEN HEARTS NINE,0.2884,0.0446,0.667
HEARTS TWO HEARTS NINE,0.3388,0.4058,0.2554
DIAMONDS QUEEN HEARTS EIGHT,0.4148,0.0132,0.572
HEARTS TWO HEARTS EIGHT,0.6012,0.0374,0.3614
CLUBS EIGHT HEARTS TWO,0.6248,0.0504,0.3248
CLUBS EIGHT DIAMONDS QUEEN,0.413,0.0122,0.5748
SPADES EIGHT HEARTS ACE,0.4114,0.0032,0.5854
CLUBS FOUR DIAMONDS QUEEN,0.428,0.0124,0.5596
CLUBS FOUR HEARTS TWO,0.6276,0.0476,0.3248
CLUBS SEVEN DIAMONDS QUEEN,0.4012,0.0112,0.5876
CLUBS SEVEN HEARTS TWO,0.6338,0.0424,0.3238
SPADES EIGHT HEARTS QUEEN,0.414,0.0104,0.5756
CLUBS SIX DIAMONDS QUEEN,0.4024,0.011,0.5866
CLUBS SIX HEARTS TWO,0.6224,0.0436,0.334
SPADES EIGHT HEARTS KING,0.4208,0.007,0.5722
HEARTS TWO SPADES SIX,0.6378,0.045,0.3172
DIAMONDS QUEEN SPADES SIX,0.4054,0.0132,0.5814
HEARTS FOUR CLUBS QUEEN,0.434,0.0106,0.5554
DIAMONDS ACE CLUBS QUEEN,0.3536,0.004,0.6424
DIAMONDS QUEEN SPADES SEVEN,0.408,0.0112,0.5808
HEARTS TWO SPADES SEVEN,0.635,0.0478,0.3172
HEARTS FOUR CLUBS KING,0.4192,0.0076,0.5732
DIAMONDS ACE CLUBS KING,0.3596,0.004,0.6364
DIAMONDS QUEEN SPADES EIGHT,0.4042,0.0124,0.5834
SPADES EIGHT HEARTS TWO,0.623,0.0454,0.3316
HEARTS FOUR CLUBS ACE,0.4202,0.0068,0.573
DIAMONDS ACE CLUBS ACE,0.174,0.006,0.82
SPADES NINE DIAMONDS QUEEN,0.2816,0.0346,0.6838
SPADES NINE HEARTS TWO,0.361,0.4224,0.2166
HEARTS TWO SPADES TWO,0.4186,0.083,0.4984
DIAMONDS QUEEN SPADES TWO,0.4424,0.0116,0.546
HEARTS TWO SPADES THREE,0.629,0.0466,0.3244
DIAMONDS QUEEN SPADES THREE,0.433,0.011,0.556
HEARTS TWO SPADES FOUR,0.634,0.0446,0.3214
DIAMONDS QUEEN SPADES FOUR,0.4424,0.0142,0.5434
CLUBS TEN HEARTS FOUR,0.4138,0.029,0.5572
CLUBS TEN DIAMONDS ACE,0.3694,0.004,0.6266
HEARTS TWO SPADES FIVE,0.6438,0.1118,0.2444
DIAMONDS QUEEN SPADES FIVE,0.3038,0.0414,0.6548
HEARTS FOUR CLUBS JACK,0.4248,0.0152,0.56
CLUBS JACK DIAMONDS ACE,0.3554,0.0056,0.639
SPADES KING CLUBS JACK,0.3684,0.0064,0.6252
CLUBS JACK SPADES QUEEN,0.3438,0.012,0.6442
SPADES ACE CLUBS JACK,0.3526,0.0032,0.6442
SPADES SIX CLUBS KING,0.3836,0.0074,0.609
SPADES SIX CLUBS QUEEN,0.3942,0.0122,0.5936
SPADES EIGHT HEARTS JACK,0.395,0.016,0.589
SPADES SIX CLUBS ACE,0.4032,0.0046,0.5922
SPADES EIGHT HEARTS TEN,0.3782,0.0222,0.5996
CLUBS JACK SPADES SIX,0.398,0.019,0.583
CLUBS TEN SPADES SIX,0.3864,0.0228,0.5908
CLUBS JACK SPADES TEN,0.3408,0.0152,0.644
CLUBS JACK SPADES JACK,0.1832,0.0324,0.7844
SPADES QUEEN CLUBS SEVEN,0.3872,0.014,0.5988
SPADES KING CLUBS SEVEN,0.4026,0.007,0.5904
SPADES ACE CLUBS SEVEN,0.3946,0.0042,0.6012
SPADES SIX HEARTS TEN,0.4086,0.0256,0.5658
SPADES SIX HEARTS JACK,0.405,0.0168,0.5782
SPADES SIX HEARTS ACE,0.3964,0.0038,0.5998
SPADES SIX HEARTS KING,0.4022,0.0066,0.5912
SPADES SIX HEARTS QUEEN,0.4068,0.0096,0.5836
CLUBS SEVEN SPADES JACK,0.3912,0.0174,0.5914
CLUBS SEVEN SPADES TEN,0.3852,0.0248,0.59
CLUBS TEN HEARTS SIX,0.3732,0.0284,0.5984
CLUBS JACK HEARTS SIX,0.408,0.0168,0.5752
CLUBS JACK CLUBS ACE,0.3098,0.006,0.6842
HEARTS SIX CLUBS QUEEN,0.3992,0.0086,0.5922
HEARTS SIX CLUBS KING,0.3866,0.0104,0.603
HEARTS SIX CLUBS ACE,0.3984,0.0034,0.5982
CLUBS JACK CLUBS QUEEN,0.3232,0.0086,0.6682
CLUBS JACK CLUBS KING,0.3306,0.0074,0.662
DIAMONDS THREE HEARTS ACE,0.4382,0.0044,0.5574
DIAMONDS THREE HEARTS QUEEN,0.4514,0.0132,0.5354
DIAMONDS THREE HEARTS KING,0.4504,0.0108,0.5388
SPADES TEN DIAMONDS ACE,0.371,0.0042,0.6248
HEARTS FOUR SPADES TEN,0.4308,0.0276,0.5416
HEARTS FOUR SPADES JACK,0.4356,0.0162,0.5482
SPADES JACK DIAMONDS ACE,0.379,0.0046,0.6164
SPADES ACE HEARTS FOUR,0.4332,0.0022,0.5646
SPADES ACE DIAMONDS ACE,0.1862,0.0032,0.8106
HEARTS FOUR SPADES QUEEN,0.4372,0.0118,0.551
SPADES QUEEN DIAMONDS ACE,0.388,0.0048,0.6072
CLUBS JACK SPADES FOUR,0.4286,0.0202,0.5512
SPADES KING DIAMONDS ACE,0.3798,0.0048,0.6154
HEARTS FOUR SPADES KING,0.4406,0.0088,0.5506
CLUBS TEN SPADES FOUR,0.4164,0.0242,0.5594
DIAMONDS QUEEN DIAMONDS ACE,0.3586,0.0048,0.6366
HEARTS TWO DIAMONDS ACE,0.431,0.0064,0.5626
HEARTS FOUR DIAMONDS QUEEN,0.4508,0.0122,0.537
HEARTS FOUR HEARTS TWO,0.585,0.0438,0.3712
DIAMONDS THREE HEARTS TEN,0.4256,0.021,0.5534
SPADES FOUR CLUBS KING,0.4346,0.0088,0.5566
HEARTS FIVE DIAMONDS QUEEN,0.2978,0.0418,0.6604
HEARTS FIVE HEARTS TWO,0.6242,0.1072,0.2686
DIAMONDS THREE HEARTS JACK,0.431,0.0168,0.5522
SPADES FOUR CLUBS QUEEN,0.423,0.0134,0.5636
DIAMONDS QUEEN HEARTS TWO,0.4584,0.0112,0.5304
DIAMONDS KING DIAMONDS QUEEN,0.3562,0.0052,0.6386
DIAMONDS KING HEARTS TWO,0.45,0.012,0.538
HEARTS THREE DIAMONDS QUEEN,0.432,0.012,0.556
HEARTS THREE HEARTS TWO,0.586,0.0432,0.3708
SPADES FOUR CLUBS ACE,0.4036,0.008,0.5884
HEARTS TWO CLUBS ACE,0.4004,0.0064,0.5932
DIAMONDS QUEEN CLUBS ACE,0.359,0.0058,0.6352
HEARTS TWO CLUBS QUEEN,0.4422,0.0152,0.5426
DIAMONDS QUEEN CLUBS QUEEN,0.1922,0.021,0.7868
HEARTS TWO CLUBS KING,0.4234,0.0096,0.567
DIAMONDS QUEEN CLUBS KING,0.3608,0.0086,0.6306
SPADES EIGHT SPADES FIVE,0.6088,0.0982,0.293
CLUBS TEN HEARTS TWO,0.4286,0.0262,0.5452
CLUBS TEN DIAMONDS QUEEN,0.3508,0.0104,0.6388
SPADES NINE SPADES FIVE,0.0746,0.8542,0.0712
CLUBS JACK HEARTS TWO,0.4448,0.0192,0.536
CLUBS JACK DIAMONDS QUEEN,0.3688,0.0114,0.6198
SPADES SIX SPADES FIVE,0.5888,0.1004,0.3108
SPADES SEVEN SPADES FIVE,0.607,0.0954,0.2976
DIAMONDS FIVE CLUBS QUEEN,0.2772,0.0418,0.681
SPADES EIGHT CLUBS ACE,0.3922,0.0036,0.6042
DIAMONDS FIVE CLUBS KING,0.2816,0.0388,0.6796
SPADES EIGHT CLUBS KING,0.392,0.008,0.6
DIAMONDS FIVE CLUBS ACE,0.287,0.0248,0.6882
SPADES EIGHT CLUBS QUEEN,0.3984,0.0118,0.5898
CLUBS JACK SPADES EIGHT,0.3806,0.0144,0.605
CLUBS TEN SPADES EIGHT,0.363,0.027,0.61
CLUBS TEN DIAMONDS FIVE,0.278,0.0778,0.6442
CLUBS JACK DIAMONDS FIVE,0.2852,0.0632,0.6516
HEARTS JACK DIAMONDS TEN,0.3488,0.0138,0.6374
DIAMONDS TEN HEARTS TEN,0.1972,0.0372,0.7656
HEARTS SIX HEARTS KING,0.3992,0.0094,0.5914
DIAMONDS KING SPADES SEVEN,0.4128,0.0054,0.5818
HEARTS THREE SPADES SEVEN,0.6284,0.045,0.3266
SPADES KING DIAMONDS SEVEN,0.4128,0.0068,0.5804
HEARTS SIX HEARTS QUEEN,0.3876,0.0126,0.5998
SPADES QUEEN DIAMONDS SEVEN,0.4164,0.0112,0.5724
HEARTS THREE SPADES SIX,0.6294,0.0404,0.3302
DIAMONDS KING SPADES SIX,0.4176,0.0076,0.5748
DIAMONDS KING SPADES NINE,0.2934,0.0314,0.6752
HEARTS THREE SPADES NINE,0.355,0.4336,0.2114
HEARTS SIX HEARTS ACE,0.3634,0.005,0.6316
DIAMONDS KING SPADES EIGHT,0.409,0.008,0.583
HEARTS THREE SPADES EIGHT,0.6446,0.04,0.3154
SPADES ACE DIAMONDS SEVEN,0.4078,0.0032,0.589
HEARTS THREE CLUBS EIGHT,0.6416,0.0414,0.317
CLUBS EIGHT DIAMONDS KING,0.4002,0.0084,0.5914
HEARTS THREE SPADES THREE,0.4082,0.0764,0.5154
DIAMONDS KING SPADES THREE,0.4404,0.0084,0.5512
HEARTS THREE SPADES TWO,0.6418,0.045,0.3132
DIAMONDS KING SPADES TWO,0.4422,0.0068,0.551
HEARTS THREE SPADES FIVE,0.6504,0.1002,0.2494
DIAMONDS KING SPADES FIVE,0.3032,0.0312,0.6656
HEARTS THREE SPADES FOUR,0.6236,0.0442,0.3322
DIAMONDS KING SPADES FOUR,0.4314,0.0098,0.5588
DIAMONDS KING CLUBS TWO,0.438,0.0086,0.5534
HEARTS THREE CLUBS TWO,0.6288,0.0506,0.3206
DIAMONDS KING CLUBS THREE,0.441,0.0082,0.5508
HEARTS THREE CLUBS THREE,0.4118,0.0814,0.5068
CLUBS FOUR DIAMONDS KING,0.437,0.0082,0.5548
HEARTS THREE CLUBS FOUR,0.6198,0.0456,0.3346
DIAMONDS KING CLUBS SIX,0.4028,0.0074,0.5898
HEARTS THREE CLUBS SIX,0.6202,0.0444,0.3354
CLUBS SEVEN DIAMONDS KING,0.3978,0.0078,0.5944
HEARTS THREE CLUBS SEVEN,0.6242,0.0468,0.329
HEARTS THREE DIAMONDS KING,0.4438,0.0084,0.5478
DIAMONDS KING DIAMONDS ACE,0.3614,0.0066,0.632
HEARTS THREE DIAMONDS ACE,0.4162,0.0046,0.5792
HEARTS FOUR DIAMONDS KING,0.4482,0.0092,0.5426
HEARTS FOUR HEARTS THREE,0.5882,0.0452,0.3666
HEARTS FIVE DIAMONDS KING,0.2984,0.033,0.6686
HEARTS THREE HEARTS FIVE,0.6018,0.0998,0.2984
HEARTS SIX DIAMONDS KING,0.413,0.0074,0.5796
HEARTS THREE HEARTS SIX,0.5824,0.037,0.3806
DIAMONDS KING HEARTS SEVEN,0.4118,0.006,0.5822
HEARTS THREE HEARTS SEVEN,0.5956,0.0364,0.368
DIAMONDS KING HEARTS EIGHT,0.3916,0.007,0.6014
HEARTS THREE HEARTS EIGHT,0.5986,0.0426,0.3588
HEARTS SIX HEARTS TEN,0.3744,0.023,0.6026
SPADES TEN DIAMONDS SEVEN,0.3894,0.027,0.5836
DIAMONDS KING HEARTS NINE,0.293,0.0366,0.6704
HEARTS THREE HEARTS NINE,0.3472,0.4126,0.2402
HEARTS SIX HEARTS JACK,0.3914,0.0184,0.5902
SPADES JACK DIAMONDS SEVEN,0.3976,0.0142,0.5882
HEARTS FIVE CLUBS FOUR,0.6318,0.1024,0.2658
SPADES SIX SPADES FOUR,0.572,0.0388,0.3892
SPADES SEVEN SPADES FOUR,0.5882,0.0414,0.3704
HEARTS FIVE CLUBS SIX,0.6362,0.0992,0.2646
SPADES EIGHT SPADES FOUR,0.5912,0.0388,0.37
CLUBS SEVEN HEARTS FIVE,0.631,0.1044,0.2646
SPADES NINE SPADES FOUR,0.3608,0.3976,0.2416
SPADES QUEEN DIAMONDS FIVE,0.2914,0.0422,0.6664
SPADES KING DIAMONDS FIVE,0.2878,0.0332,0.679
HEARTS FIVE CLUBS TWO,0.639,0.1158,0.2452
SPADES ACE DIAMONDS FIVE,0.2858,0.0224,0.6918
HEARTS FIVE CLUBS THREE,0.6368,0.1096,0.2536
SPADES FIVE SPADES FOUR,0.61,0.1038,0.2862
HEARTS FIVE SPADES TWO,0.6476,0.1118,0.2406
HEARTS FIVE SPADES THREE,0.6204,0.1186,0.261
HEARTS FIVE SPADES FOUR,0.6444,0.0992,0.2564
HEARTS FIVE SPADES FIVE,0.3274,0.0572,0.6154
CLUBS EIGHT HEARTS FIVE,0.651,0.1006,0.2484
HEARTS KING DIAMONDS TEN,0.3762,0.006,0.6178
HEARTS QUEEN DIAMONDS TEN,0.3602,0.0108,0.629
HEARTS ACE DIAMONDS TEN,0.3654,0.0058,0.6288
HEARTS FIVE HEARTS SEVEN,0.6086,0.0978,0.2936
HEARTS SIX HEARTS FIVE,0.6016,0.1026,0.2958
HEARTS FIVE HEARTS NINE,0.0734,0.856,0.0706
HEARTS FIVE HEARTS EIGHT,0.6166,0.1056,0.2778
CLUBS SIX DIAMONDS ACE,0.4004,0.0048,0.5948
HEARTS FOUR CLUBS SIX,0.613,0.0394,0.3476
SPADES EIGHT SPADES THREE,0.604,0.0384,0.3576
CLUBS SEVEN DIAMONDS ACE,0.3948,0.0058,0.5994
HEARTS FOUR CLUBS SEVEN,0.6192,0.0426,0.3382
SPADES NINE SPADES THREE,0.3596,0.3918,0.2486
CLUBS FOUR DIAMONDS ACE,0.4326,0.0046,0.5628
HEARTS FOUR CLUBS FOUR,0.4194,0.0814,0.4992
SPADES SIX SPADES THREE,0.5864,0.0378,0.3758
SPADES SEVEN SPADES THREE,0.5876,0.0382,0.3742
HEARTS FOUR CLUBS EIGHT,0.6156,0.0406,0.3438
CLUBS EIGHT DIAMONDS ACE,0.3968,0.0032,0.6
HEARTS FOUR SPADES FOUR,0.4232,0.0854,0.4914
DIAMONDS ACE SPADES FOUR,0.4302,0.0052,0.5646
HEARTS FOUR SPADES FIVE,0.63,0.1078,0.2622
DIAMONDS ACE SPADES FIVE,0.2874,0.0254,0.6872
HEARTS FOUR SPADES TWO,0.6378,0.0458,0.3164
DIAMONDS ACE SPADES TWO,0.425,0.0042,0.5708
HEARTS FOUR SPADES THREE,0.6134,0.0446,0.342
DIAMONDS ACE SPADES THREE,0.4232,0.0054,0.5714
SPADES EIGHT DIAMONDS ACE,0.3948,0.0044,0.6008
HEARTS FOUR SPADES EIGHT,0.6298,0.0356,0.3346
SPADES FOUR SPADES THREE,0.587,0.0436,0.3694
SPADES NINE DIAMONDS ACE,0.2834,0.0236,0.693
HEARTS FOUR SPADES NINE,0.3622,0.4304,0.2074
SPADES FIVE SPADES THREE,0.592,0.1062,0.3018
HEARTS FOUR SPADES SIX,0.5976,0.0404,0.362
DIAMONDS ACE SPADES SIX,0.4094,0.0026,0.588
SPADES SEVEN DIAMONDS ACE,0.4024,0.0024,0.5952
HEARTS FOUR SPADES SEVEN,0.6198,0.0406,0.3396
SPADES QUEEN SPADES EIGHT,0.383,0.0114,0.6056
CLUBS JACK DIAMONDS TEN,0.3332,0.0146,0.6522
CLUBS JACK DIAMONDS SEVEN,0.3816,0.0146,0.6038
SPADES KING SPADES EIGHT,0.3958,0.009,0.5952
CLUBS TEN DIAMONDS TEN,0.1914,0.0422,0.7664
CLUBS TEN DIAMONDS SEVEN,0.3794,0.0264,0.5942
SPADES ACE SPADES EIGHT,0.3832,0.0046,0.6122
HEARTS FIVE DIAMONDS ACE,0.307,0.0228,0.6702
HEARTS FOUR HEARTS FIVE,0.6084,0.1022,0.2894
HEARTS FOUR DIAMONDS ACE,0.4214,0.006,0.5726
DIAMONDS TEN CLUBS ACE,0.3632,0.004,0.6328
CLUBS ACE DIAMONDS SEVEN,0.3806,0.0064,0.613
DIAMONDS TEN CLUBS KING,0.3518,0.007,0.6412
CLUBS KING DIAMONDS SEVEN,0.3958,0.008,0.5962
DIAMONDS TEN CLUBS QUEEN,0.3556,0.0092,0.6352
DIAMONDS SEVEN CLUBS QUEEN,0.3922,0.0112,0.5966
DIAMONDS ACE HEARTS NINE,0.2866,0.0236,0.6898
HEARTS FOUR HEARTS NINE,0.3472,0.4072,0.2456
SPADES KING SPADES JACK,0.3436,0.008,0.6484
DIAMONDS ACE HEARTS EIGHT,0.3946,0.004,0.6014
HEARTS FOUR HEARTS EIGHT,0.579,0.0354,0.3856
SPADES QUEEN SPADES JACK,0.3514,0.0088,0.6398
DIAMONDS ACE HEARTS SEVEN,0.401,0.005,0.594
HEARTS FOUR HEARTS SEVEN,0.582,0.04,0.378
HEARTS SIX DIAMONDS ACE,0.408,0.004,0.588
HEARTS FOUR HEARTS SIX,0.5714,0.04,0.3886
SPADES ACE SPADES JACK,0.3494,0.0062,0.6444
HEARTS ACE HEARTS QUEEN,0.3486,0.0056,0.6458
CLUBS THREE DIAMONDS ACE,0.422,0.0064,0.5716
HEARTS FOUR CLUBS THREE,0.6156,0.0372,0.3472
SPADES JACK DIAMONDS FIVE,0.308,0.0568,0.6352
CLUBS TWO DIAMONDS ACE,0.4288,0.0054,0.5658
HEARTS FOUR CLUBS TWO,0.626,0.0454,0.3286
SPADES TEN DIAMONDS FIVE,0.3036,0.0674,0.629
SPADES TEN SPADES EIGHT,0.3624,0.021,0.6166
HEARTS KING HEARTS QUEEN,0.3428,0.0074,0.6498
SPADES JACK SPADES EIGHT,0.3688,0.0158,0.6154
DIAMONDS QUEEN HEARTS TEN,0.369,0.0118,0.6192
HEARTS TWO HEARTS TEN,0.4116,0.0254,0.563
DIAMONDS QUEEN HEARTS JACK,0.3644,0.0078,0.6278
HEARTS TWO HEARTS JACK,0.4188,0.0148,0.5664
DIAMONDS QUEEN HEARTS KING,0.375,0.0058,0.6192
HEARTS TWO HEARTS KING,0.4128,0.0094,0.5778
DIAMONDS QUEEN HEARTS QUEEN,0.194,0.0228,0.7832
HEARTS TWO HEARTS QUEEN,0.4182,0.0126,0.5692
DIAMONDS QUEEN HEARTS ACE,0.3834,0.0034,0.6132
HEARTS TWO HEARTS ACE,0.4144,0.0038,0.5818
SPADES ACE HEARTS ACE,0.1836,0.0036,0.8128
SPADES KING HEARTS ACE,0.383,0.005,0.612
SPADES QUEEN HEARTS ACE,0.3752,0.004,0.6208
SPADES JACK HEARTS ACE,0.3794,0.004,0.6166
HEARTS SIX SPADES FOUR,0.6048,0.0402,0.355
SPADES TEN HEARTS ACE,0.3684,0.0038,0.6278
SPADES KING SPADES QUEEN,0.3626,0.0056,0.6318
HEARTS SIX SPADES FIVE,0.641,0.0984,0.2606
SPADES ACE SPADES QUEEN,0.37,0.004,0.626
HEARTS SIX SPADES TWO,0.622,0.0416,0.3364
HEARTS SIX SPADES THREE,0.6124,0.046,0.3416
HEARTS SIX SPADES EIGHT,0.5756,0.0394,0.385
SPADES JACK CLUBS THREE,0.425,0.021,0.554
HEARTS SIX SPADES NINE,0.2706,0.3376,0.3918
SPADES NINE SPADES EIGHT,0.2622,0.2038,0.534
SPADES TEN CLUBS THREE,0.4384,0.023,0.5386
HEARTS SIX SPADES SIX,0.3292,0.0658,0.605
HEARTS SIX SPADES SEVEN,0.5668,0.0378,0.3954
SPADES ACE CLUBS THREE,0.4278,0.0064,0.5658
SPADES QUEEN CLUBS THREE,0.436,0.0126,0.5514
SPADES KING CLUBS THREE,0.4358,0.0064,0.5578
HEARTS SIX CLUBS FOUR,0.5976,0.045,0.3574
CLUBS SEVEN HEARTS SIX,0.5504,0.0422,0.4074
HEARTS SIX CLUBS SIX,0.307,0.0774,0.6156
HEARTS SIX CLUBS EIGHT,0.5606,0.045,0.3944
HEARTS SIX HEARTS SEVEN,0.5254,0.042,0.4326
HEARTS SIX HEARTS NINE,0.2506,0.3272,0.4222
HEARTS SIX HEARTS EIGHT,0.5474,0.0368,0.4158
HEARTS SIX CLUBS THREE,0.6148,0.045,0.3402
HEARTS SIX CLUBS TWO,0.6236,0.0408,0.3356
CLUBS JACK HEARTS QUEEN,0.3576,0.0098,0.6326
CLUBS TEN HEARTS QUEEN,0.359,0.0102,0.6308
HEARTS QUEEN CLUBS ACE,0.3716,0.006,0.6224
HEARTS QUEEN CLUBS KING,0.3522,0.008,0.6398
HEARTS QUEEN CLUBS QUEEN,0.1782,0.0204,0.8014
SPADES JACK DIAMONDS NINE,0.2968,0.0578,0.6454
SPADES TEN DIAMONDS NINE,0.2648,0.0766,0.6586
DIAMONDS EIGHT HEARTS TEN,0.37,0.0232,0.6068
DIAMONDS EIGHT HEARTS JACK,0.3892,0.0158,0.595
SPADES QUEEN DIAMONDS NINE,0.3018,0.0454,0.6528
HEARTS FIVE SPADES SIX,0.6394,0.0948,0.2658
HEARTS FIVE SPADES SEVEN,0.6492,0.1088,0.242
SPADES KING DIAMONDS NINE,0.2966,0.0348,0.6686
HEARTS FIVE SPADES EIGHT,0.6582,0.1082,0.2336
SPADES EIGHT SPADES SEVEN,0.5254,0.0332,0.4414
SPADES ACE DIAMONDS NINE,0.2956,0.0206,0.6838
HEARTS FIVE SPADES NINE,0.072,0.9058,0.0222
SPADES NINE SPADES SEVEN,0.2582,0.2552,0.4866
HEARTS QUEEN HEARTS SEVEN,0.3942,0.0086,0.5972
HEARTS KING DIAMONDS EIGHT,0.4186,0.0082,0.5732
DIAMONDS EIGHT HEARTS QUEEN,0.3972,0.0112,0.5916
HEARTS KING HEARTS SEVEN,0.3778,0.006,0.6162
HEARTS ACE HEARTS SEVEN,0.3798,0.006,0.6142
HEARTS ACE DIAMONDS EIGHT,0.3976,0.0044,0.598
HEARTS TEN HEARTS SEVEN,0.3624,0.0236,0.614
HEARTS JACK HEARTS SEVEN,0.3742,0.0166,0.6092
HEARTS JACK DIAMONDS SIX,0.4004,0.0184,0.5812
HEARTS TEN DIAMONDS SIX,0.4074,0.023,0.5696
HEARTS ACE HEARTS NINE,0.2624,0.0248,0.7128
HEARTS KING HEARTS NINE,0.2858,0.033,0.6812
HEARTS QUEEN HEARTS NINE,0.2744,0.0438,0.6818
HEARTS JACK HEARTS NINE,0.2662,0.0562,0.6776
HEARTS NINE HEARTS TEN,0.2654,0.0672,0.6674
HEARTS ACE CLUBS QUEEN,0.3688,0.0046,0.6266
HEARTS ACE CLUBS KING,0.3504,0.0052,0.6444
CLUBS EIGHT HEARTS SEVEN,0.5664,0.0388,0.3948
HEARTS ACE CLUBS ACE,0.1764,0.005,0.8186
SPADES QUEEN HEARTS QUEEN,0.1946,0.0198,0.7856
SPADES THREE HEARTS SEVEN,0.6288,0.041,0.3302
SPADES KING HEARTS QUEEN,0.385,0.007,0.608
SPADES TWO HEARTS SEVEN,0.6394,0.0432,0.3174
SPADES ACE HEARTS QUEEN,0.3856,0.0046,0.6098
SPADES FIVE HEARTS SEVEN,0.6328,0.1064,0.2608
CLUBS TEN HEARTS ACE,0.3664,0.0042,0.6294
SPADES FOUR HEARTS SEVEN,0.6274,0.0414,0.3312
CLUBS JACK HEARTS ACE,0.3568,0.0046,0.6386
SPADES SEVEN HEARTS SEVEN,0.32,0.062,0.618
SPADES KING DIAMONDS JACK,0.3802,0.0066,0.6132
SPADES QUEEN DIAMONDS JACK,0.3694,0.0088,0.6218
SPADES SIX HEARTS SEVEN,0.5766,0.0386,0.3848
SPADES NINE HEARTS SEVEN,0.2714,0.2826,0.446
SPADES TEN HEARTS QUEEN,0.3768,0.0106,0.6126
SPADES EIGHT HEARTS SEVEN,0.5654,0.0368,0.3978
SPADES ACE DIAMONDS JACK,0.3786,0.0042,0.6172
SPADES JACK HEARTS QUEEN,0.361,0.0108,0.6282
HEARTS QUEEN DIAMONDS SIX,0.4142,0.0094,0.5764
HEARTS KING DIAMONDS SIX,0.3998,0.0074,0.5928
HEARTS ACE DIAMONDS SIX,0.3944,0.0028,0.6028
SPADES TEN DIAMONDS JACK,0.3552,0.0126,0.6322
SPADES JACK DIAMONDS JACK,0.2016,0.0312,0.7672
SPADES NINE SPADES SIX,0.2492,0.3292,0.4216
SPADES EIGHT SPADES SIX,0.5362,0.0402,0.4236
SPADES SEVEN SPADES SIX,0.5428,0.0394,0.4178
HEARTS SEVEN HEARTS EIGHT,0.5392,0.0354,0.4254
HEARTS NINE HEARTS SEVEN,0.2592,0.2612,0.4796
SPADES JACK SPADES TEN,0.341,0.0146,0.6444
CLUBS SIX HEARTS SEVEN,0.5594,0.0448,0.3958
CLUBS SEVEN HEARTS SEVEN,0.2984,0.0644,0.6372
CLUBS FOUR HEARTS SEVEN,0.616,0.041,0.343
CLUBS TWO HEARTS SEVEN,0.6458,0.0464,0.3078
SPADES KING SPADES TEN,0.3506,0.0062,0.6432
CLUBS THREE HEARTS SEVEN,0.6238,0.0404,0.3358
SPADES QUEEN SPADES TEN,0.3472,0.009,0.6438
SPADES ACE SPADES TEN,0.3574,0.004,0.6386
SPADES KING HEARTS SEVEN,0.4128,0.0082,0.579
SPADES QUEEN HEARTS SEVEN,0.4306,0.0104,0.559
SPADES ACE HEARTS SEVEN,0.401,0.0038,0.5952
SPADES TEN HEARTS SEVEN,0.3998,0.028,0.5722
SPADES JACK HEARTS SEVEN,0.3954,0.0184,0.5862
CLUBS ACE HEARTS TEN,0.3538,0.0048,0.6414
CLUBS TEN HEARTS NINE,0.2526,0.0722,0.6752
SPADES ACE HEARTS THREE,0.428,0.0072,0.5648
SPADES ACE DIAMONDS KING,0.3712,0.0032,0.6256
CLUBS JACK HEARTS NINE,0.275,0.0592,0.6658
SPADES KING DIAMONDS KING,0.199,0.0108,0.7902
SPADES KING HEARTS THREE,0.444,0.0052,0.5508
HEARTS TEN CLUBS QUEEN,0.353,0.0094,0.6376
HEARTS THREE SPADES QUEEN,0.4306,0.012,0.5574
SPADES QUEEN DIAMONDS KING,0.3724,0.0064,0.6212
HEARTS TEN CLUBS KING,0.365,0.0086,0.6264
HEARTS NINE CLUBS ACE,0.2822,0.0276,0.6902
CLUBS TEN HEARTS TEN,0.1872,0.0414,0.7714
CLUBS JACK HEARTS TEN,0.3446,0.0136,0.6418
HEARTS NINE CLUBS QUEEN,0.286,0.0464,0.6676
HEARTS NINE CLUBS KING,0.2732,0.0376,0.6892
