opposingHand,winningChance,drawChance,lostChance
SPADES ACE HEARTS TEN,0.3468,0.004,0.6492
SPADES TEN HEARTS NINE,0.3508,0.025,0.6242
SPADES JACK HEARTS NINE,0.3506,0.0158,0.6336
SPADES TEN HEARTS TEN,0.1634,0.0688,0.7678
SPADES JACK HEARTS TEN,0.3438,0.0154,0.6408
SPADES SIX HEARTS EIGHT,0.335,0.0712,0.5938
SPADES SEVEN HEARTS EIGHT,0.3342,0.058,0.6078
CLUBS THREE HEARTS JACK,0.289,0.055,0.656
SPADES EIGHT HEARTS EIGHT,0.165,0.0918,0.7432
CLUBS THREE HEARTS TEN,0.2844,0.0686,0.647
SPADES NINE HEARTS EIGHT,0.3364,0.037,0.6266
SPADES KING HEARTS NINE,0.3508,0.0094,0.6398
SPADES TWO HEARTS EIGHT,0.4032,0.0718,0.525
SPADES QUEEN HEARTS NINE,0.3544,0.0128,0.6328
SPADES FOUR HEARTS EIGHT,0.3526,0.0674,0.58
SPADES ACE HEARTS NINE,0.3522,0.0048,0.643
SPADES FIVE HEARTS EIGHT,0.2364,0.1502,0.6134
CLUBS EIGHT HEARTS EIGHT,0.1566,0.101,0.7424
CLUBS NINE HEARTS EIGHT,0.3368,0.0362,0.627
CLUBS THREE HEARTS KING,0.292,0.0318,0.6762
CLUBS FOUR HEARTS EIGHT,0.3734,0.0702,0.5564
CLUBS THREE HEARTS QUEEN,0.272,0.0386,0.6894
CLUBS SIX HEARTS EIGHT,0.3342,0.0682,0.5976
CLUBS THREE HEARTS ACE,0.2748,0.0204,0.7048
CLUBS SEVEN HEARTS EIGHT,0.3224,0.067,0.6106
CLUBS THREE HEARTS EIGHT,0.2786,0.1526,0.5688
CLUBS TWO HEARTS EIGHT,0.4092,0.077,0.5138
SPADES TEN SPADES FOUR,0.371,0.03,0.599
SPADES JACK SPADES FOUR,0.3758,0.0194,0.6048
HEARTS NINE HEARTS EIGHT,0.3166,0.0382,0.6452
SPADES QUEEN SPADES FOUR,0.3698,0.0146,0.6156
SPADES KING SPADES FOUR,0.364,0.0114,0.6246
SPADES ACE SPADES FOUR,0.3518,0.0076,0.6406
HEARTS KING HEARTS TEN,0.3264,0.0066,0.667
HEARTS QUEEN HEARTS TEN,0.32,0.009,0.671
HEARTS ACE HEARTS TEN,0.342,0.0036,0.6544
HEARTS SEVEN CLUBS JACK,0.3528,0.0156,0.6316
CLUBS TEN HEARTS SEVEN,0.3344,0.029,0.6366
CLUBS KING HEARTS SEVEN,0.3666,0.0086,0.6248
CLUBS QUEEN HEARTS SEVEN,0.3436,0.0138,0.6426
CLUBS ACE HEARTS SEVEN,0.3658,0.0062,0.628
CLUBS SEVEN HEARTS ACE,0.3456,0.0058,0.6486
CLUBS SEVEN HEARTS KING,0.3548,0.009,0.6362
CLUBS SEVEN HEARTS QUEEN,0.366,0.0134,0.6206
CLUBS SEVEN HEARTS JACK,0.3528,0.0178,0.6294
CLUBS SEVEN HEARTS TEN,0.349,0.0236,0.6274
CLUBS TEN CLUBS THREE,0.268,0.0732,0.6588
CLUBS THREE CLUBS JACK,0.2738,0.052,0.6742
CLUBS THREE CLUBS ACE,0.248,0.0194,0.7326
CLUBS THREE CLUBS QUEEN,0.2782,0.0448,0.677
CLUBS THREE CLUBS KING,0.271,0.0282,0.7008
HEARTS JACK HEARTS TEN,0.331,0.0152,0.6538
SPADES ACE CLUBS ACE,0.1528,0.0062,0.841
SPADES KING CLUBS ACE,0.348,0.0066,0.6454
SPADES QUEEN CLUBS ACE,0.3564,0.006,0.6376
SPADES JACK CLUBS ACE,0.3564,0.0058,0.6378
SPADES TEN CLUBS ACE,0.3312,0.0066,0.6622
SPADES EIGHT HEARTS NINE,0.335,0.0384,0.6266
SPADES NINE HEARTS NINE,0.1734,0.0806,0.746
SPADES SIX HEARTS NINE,0.3454,0.046,0.6086
SPADES SEVEN HEARTS NINE,0.3476,0.04,0.6124
CLUBS SEVEN HEARTS NINE,0.3406,0.046,0.6134
CLUBS SIX HEARTS NINE,0.3476,0.041,0.6114
CLUBS FOUR HEARTS NINE,0.3922,0.045,0.5628
CLUBS THREE HEARTS NINE,0.283,0.1108,0.6062
CLUBS TWO HEARTS NINE,0.4162,0.0456,0.5382
SPADES FIVE HEARTS NINE,0.2712,0.1138,0.615
SPADES FOUR HEARTS NINE,0.3878,0.0434,0.5688
SPADES TWO HEARTS NINE,0.4122,0.045,0.5428
CLUBS NINE HEARTS NINE,0.1648,0.0862,0.749
CLUBS EIGHT HEARTS NINE,0.3462,0.0444,0.6094
