opposingHand,winningChance,drawChance,lostChance
SPADES QUEEN HEARTS TEN,0.3328,0.0096,0.6576
SPADES KING HEARTS TEN,0.3488,0.0074,0.6438
SPADES ACE HEARTS TEN,0.3412,0.0062,0.6526
SPADES TEN HEARTS NINE,0.3366,0.0276,0.6358
SPADES JACK HEARTS NINE,0.3264,0.0196,0.654
SPADES TEN HEARTS TEN,0.1546,0.061,0.7844
SPADES JACK HEARTS TEN,0.3286,0.0156,0.6558
SPADES SIX HEARTS EIGHT,0.223,0.147,0.63
SPADES SEVEN HEARTS EIGHT,0.3148,0.065,0.6202
CLUBS THREE HEARTS JACK,0.2688,0.0544,0.6768
SPADES EIGHT HEARTS EIGHT,0.1488,0.0896,0.7616
CLUBS THREE HEARTS TEN,0.2674,0.0748,0.6578
SPADES NINE HEARTS EIGHT,0.3156,0.0388,0.6456
SPADES KING HEARTS NINE,0.3556,0.0082,0.6362
SPADES TWO HEARTS EIGHT,0.4056,0.0706,0.5238
SPADES QUEEN HEARTS NINE,0.341,0.011,0.648
SPADES FOUR HEARTS EIGHT,0.3518,0.073,0.5752
SPADES ACE HEARTS NINE,0.3478,0.004,0.6482
SPADES FIVE HEARTS EIGHT,0.3512,0.0692,0.5796
CLUBS EIGHT HEARTS EIGHT,0.144,0.0896,0.7664
CLUBS NINE HEARTS EIGHT,0.3134,0.0374,0.6492
CLUBS THREE HEARTS KING,0.2748,0.0256,0.6996
CLUBS FOUR HEARTS EIGHT,0.371,0.0632,0.5658
CLUBS THREE HEARTS QUEEN,0.2642,0.0404,0.6954
CLUBS FIVE HEARTS EIGHT,0.349,0.0646,0.5864
CLUBS THREE HEARTS ACE,0.2364,0.016,0.7476
CLUBS SEVEN HEARTS EIGHT,0.3202,0.0572,0.6226
CLUBS THREE HEARTS EIGHT,0.2656,0.1368,0.5976
CLUBS TWO HEARTS EIGHT,0.3972,0.07,0.5328
SPADES TEN SPADES FOUR,0.3496,0.0334,0.617
SPADES JACK SPADES FOUR,0.3592,0.02,0.6208
HEARTS NINE HEARTS EIGHT,0.2928,0.0392,0.668
SPADES QUEEN SPADES FOUR,0.3496,0.0136,0.6368
SPADES KING SPADES FOUR,0.3596,0.0078,0.6326
SPADES ACE SPADES FOUR,0.3394,0.0054,0.6552
HEARTS KING HEARTS TEN,0.3232,0.0056,0.6712
HEARTS QUEEN HEARTS TEN,0.3108,0.0098,0.6794
HEARTS ACE HEARTS TEN,0.3252,0.0056,0.6692
HEARTS SEVEN CLUBS JACK,0.331,0.0202,0.6488
CLUBS TEN HEARTS SEVEN,0.3302,0.027,0.6428
CLUBS KING HEARTS SEVEN,0.3286,0.0062,0.6652
CLUBS QUEEN HEARTS SEVEN,0.3528,0.016,0.6312
CLUBS ACE HEARTS SEVEN,0.3416,0.0036,0.6548
CLUBS SEVEN HEARTS ACE,0.3256,0.004,0.6704
CLUBS SEVEN HEARTS KING,0.3362,0.0092,0.6546
CLUBS SEVEN HEARTS QUEEN,0.3532,0.0122,0.6346
CLUBS SEVEN HEARTS JACK,0.3456,0.0162,0.6382
CLUBS SEVEN HEARTS TEN,0.3308,0.0272,0.642
CLUBS TEN CLUBS THREE,0.2592,0.0742,0.6666
CLUBS THREE CLUBS JACK,0.2676,0.051,0.6814
CLUBS THREE CLUBS ACE,0.2412,0.0144,0.7444
CLUBS THREE CLUBS QUEEN,0.2484,0.0408,0.7108
CLUBS THREE CLUBS KING,0.2524,0.0258,0.7218
HEARTS JACK HEARTS TEN,0.3032,0.0122,0.6846
SPADES ACE CLUBS ACE,0.14,0.004,0.856
SPADES KING CLUBS ACE,0.3354,0.0052,0.6594
SPADES QUEEN CLUBS ACE,0.3424,0.0052,0.6524
SPADES JACK CLUBS ACE,0.333,0.0054,0.6616
SPADES TEN CLUBS ACE,0.329,0.0046,0.6664
SPADES EIGHT HEARTS NINE,0.3118,0.04,0.6482
SPADES NINE HEARTS NINE,0.146,0.077,0.777
SPADES SIX HEARTS NINE,0.2422,0.1084,0.6494
SPADES SEVEN HEARTS NINE,0.3162,0.0406,0.6432
CLUBS SEVEN HEARTS NINE,0.3262,0.039,0.6348
CLUBS FIVE HEARTS NINE,0.3604,0.045,0.5946
CLUBS FOUR HEARTS NINE,0.3704,0.052,0.5776
CLUBS THREE HEARTS NINE,0.2538,0.1034,0.6428
CLUBS TWO HEARTS NINE,0.4254,0.0484,0.5262
SPADES FIVE HEARTS NINE,0.3532,0.041,0.6058
SPADES FOUR HEARTS NINE,0.37,0.0432,0.5868
SPADES TWO HEARTS NINE,0.4038,0.0446,0.5516
CLUBS NINE HEARTS NINE,0.1488,0.0752,0.776
CLUBS EIGHT HEARTS NINE,0.3172,0.039,0.6438
