opposingHand,winningChance,drawChance,lostChance
SPADES QUEEN HEARTS TEN,0.3702,0.009,0.6208
SPADES KING HEARTS TEN,0.376,0.0076,0.6164
SPADES ACE HEARTS TEN,0.3788,0.0036,0.6176
SPADES TEN HEARTS NINE,0.2736,0.0766,0.6498
SPADES JACK HEARTS NINE,0.2824,0.0664,0.6512
SPADES TEN HEARTS TEN,0.1994,0.0394,0.7612
SPADES JACK HEARTS TEN,0.3464,0.0134,0.6402
SPADES SIX HEARTS EIGHT,0.5648,0.045,0.3902
SPADES SEVEN HEARTS EIGHT,0.5522,0.0368,0.411
CLUBS THREE HEARTS JACK,0.4346,0.0174,0.548
SPADES EIGHT HEARTS EIGHT,0.3038,0.0568,0.6394
CLUBS THREE HEARTS TEN,0.4314,0.0284,0.5402
SPADES NINE HEARTS EIGHT,0.268,0.2054,0.5266
SPADES KING HEARTS NINE,0.2868,0.0332,0.68
SPADES TWO HEARTS EIGHT,0.6434,0.0444,0.3122
SPADES QUEEN HEARTS NINE,0.2902,0.0412,0.6686
SPADES THREE HEARTS EIGHT,0.66,0.0356,0.3044
SPADES FOUR HEARTS EIGHT,0.6364,0.0414,0.3222
SPADES ACE HEARTS NINE,0.2794,0.0262,0.6944
SPADES FIVE HEARTS EIGHT,0.6588,0.1,0.2412
CLUBS EIGHT HEARTS EIGHT,0.2962,0.056,0.6478
CLUBS THREE HEARTS KING,0.4294,0.009,0.5616
CLUBS FOUR HEARTS EIGHT,0.628,0.0402,0.3318
CLUBS THREE HEARTS QUEEN,0.4426,0.0114,0.546
CLUBS SIX HEARTS EIGHT,0.5746,0.0428,0.3826
CLUBS THREE HEARTS ACE,0.4198,0.0058,0.5744
CLUBS SEVEN HEARTS EIGHT,0.5602,0.0404,0.3994
CLUBS THREE HEARTS EIGHT,0.635,0.0406,0.3244
CLUBS TWO HEARTS EIGHT,0.6306,0.0372,0.3322
SPADES TEN SPADES FOUR,0.4214,0.0258,0.5528
SPADES JACK SPADES FOUR,0.4226,0.0168,0.5606
HEARTS NINE HEARTS EIGHT,0.2464,0.2072,0.5464
SPADES QUEEN SPADES FOUR,0.4154,0.014,0.5706
SPADES KING SPADES FOUR,0.4142,0.0054,0.5804
SPADES ACE SPADES FOUR,0.4166,0.0046,0.5788
HEARTS KING HEARTS TEN,0.344,0.0058,0.6502
HEARTS QUEEN HEARTS TEN,0.34,0.0128,0.6472
HEARTS ACE HEARTS TEN,0.3594,0.0028,0.6378
CLUBS JACK HEARTS SEVEN,0.3918,0.02,0.5882
CLUBS TEN HEARTS SEVEN,0.3672,0.0278,0.605
CLUBS KING HEARTS SEVEN,0.3964,0.0094,0.5942
HEARTS SEVEN CLUBS QUEEN,0.3952,0.0118,0.593
CLUBS ACE HEARTS SEVEN,0.3958,0.0054,0.5988
CLUBS SEVEN HEARTS ACE,0.3916,0.0048,0.6036
CLUBS SEVEN HEARTS KING,0.3942,0.007,0.5988
CLUBS SEVEN HEARTS QUEEN,0.3984,0.0134,0.5882
CLUBS SEVEN HEARTS JACK,0.3904,0.0158,0.5938
CLUBS SEVEN HEARTS TEN,0.3906,0.0254,0.584
CLUBS TEN CLUBS THREE,0.382,0.027,0.591
CLUBS JACK CLUBS THREE,0.3814,0.024,0.5946
CLUBS THREE CLUBS ACE,0.3666,0.005,0.6284
CLUBS THREE CLUBS QUEEN,0.392,0.0114,0.5966
CLUBS THREE CLUBS KING,0.3892,0.01,0.6008
HEARTS JACK HEARTS TEN,0.344,0.0118,0.6442
SPADES ACE CLUBS ACE,0.1708,0.0052,0.824
SPADES KING CLUBS ACE,0.363,0.0046,0.6324
SPADES QUEEN CLUBS ACE,0.3706,0.0054,0.624
SPADES JACK CLUBS ACE,0.357,0.0044,0.6386
SPADES TEN CLUBS ACE,0.3564,0.0036,0.64
SPADES EIGHT HEARTS NINE,0.2708,0.2116,0.5176
SPADES NINE HEARTS NINE,0.1442,0.0658,0.79
SPADES SIX HEARTS NINE,0.2752,0.347,0.3778
SPADES SEVEN HEARTS NINE,0.2594,0.2842,0.4564
CLUBS SEVEN HEARTS NINE,0.257,0.2758,0.4672
CLUBS SIX HEARTS NINE,0.2514,0.3594,0.3892
CLUBS FOUR HEARTS NINE,0.3584,0.436,0.2056
CLUBS THREE HEARTS NINE,0.3644,0.432,0.2036
CLUBS TWO HEARTS NINE,0.3732,0.4256,0.2012
SPADES FIVE HEARTS NINE,0.072,0.906,0.022
SPADES FOUR HEARTS NINE,0.374,0.4252,0.2008
SPADES THREE HEARTS NINE,0.3646,0.4304,0.205
SPADES TWO HEARTS NINE,0.3608,0.4288,0.2104
CLUBS EIGHT HEARTS NINE,0.2544,0.2196,0.526
