opposingHand,winningChance,drawChance,lostChance
SPADES TEN CLUBS KING,0.2268,0.0372,0.736
DIAMONDS NINE SPADES THREE,0.6296,0.0244,0.346
SPADES JACK CLUBS KING,0.3166,0.0052,0.6782
DIAMONDS NINE SPADES TWO,0.6152,0.0286,0.3562
DIAMONDS NINE SPADES FIVE,0.683,0.083,0.234
DIAMONDS NINE SPADES FOUR,0.6226,0.0312,0.3462
CLUBS NINE DIAMONDS NINE,0.27,0.0426,0.6874
CLUBS EIGHT DIAMONDS NINE,0.5296,0.0276,0.4428
CLUBS SIX DIAMONDS NINE,0.5522,0.0238,0.424
SPADES JACK CLUBS FOUR,0.3898,0.0186,0.5916
CLUBS SEVEN DIAMONDS NINE,0.5396,0.0232,0.4372
SPADES TEN CLUBS FOUR,0.3076,0.4766,0.2158
CLUBS FOUR DIAMONDS NINE,0.6194,0.0254,0.3552
DIAMONDS NINE CLUBS TWO,0.6112,0.0266,0.3622
CLUBS THREE DIAMONDS NINE,0.625,0.026,0.349
DIAMONDS NINE HEARTS EIGHT,0.5512,0.0222,0.4266
DIAMONDS NINE HEARTS NINE,0.2786,0.041,0.6804
HEARTS SIX DIAMONDS NINE,0.5624,0.0248,0.4128
DIAMONDS NINE HEARTS SEVEN,0.5472,0.027,0.4258
CLUBS EIGHT CLUBS NINE,0.5034,0.0242,0.4724
DIAMONDS ACE DIAMONDS NINE,0.339,0.005,0.656
HEARTS FOUR DIAMONDS NINE,0.6228,0.0296,0.3476
HEARTS FIVE DIAMONDS NINE,0.6692,0.0798,0.251
HEARTS ACE CLUBS TWO,0.3946,0.0068,0.5986
SPADES ACE CLUBS FOUR,0.3878,0.003,0.6092
DIAMONDS QUEEN DIAMONDS NINE,0.321,0.0104,0.6686
HEARTS TWO DIAMONDS NINE,0.6158,0.0264,0.3578
CLUBS TWO HEARTS KING,0.3922,0.0108,0.597
SPADES KING CLUBS FOUR,0.3956,0.0066,0.5978
DIAMONDS KING DIAMONDS NINE,0.3372,0.0042,0.6586
HEARTS THREE DIAMONDS NINE,0.6226,0.0262,0.3512
CLUBS TWO HEARTS QUEEN,0.4024,0.0126,0.585
SPADES QUEEN CLUBS FOUR,0.383,0.011,0.606
DIAMONDS NINE DIAMONDS JACK,0.2996,0.0174,0.683
CLUBS EIGHT SPADES NINE,0.5392,0.023,0.4378
DIAMONDS NINE DIAMONDS TEN,0.209,0.1644,0.6266
CLUBS EIGHT SPADES EIGHT,0.2812,0.0442,0.6746
CLUBS EIGHT SPADES SEVEN,0.5304,0.03,0.4396
CLUBS EIGHT SPADES SIX,0.5446,0.022,0.4334
CLUBS EIGHT SPADES FIVE,0.6506,0.0744,0.275
CLUBS EIGHT SPADES FOUR,0.6072,0.03,0.3628
CLUBS EIGHT SPADES THREE,0.6048,0.033,0.3622
CLUBS EIGHT SPADES TWO,0.6266,0.028,0.3454
HEARTS SIX DIAMONDS TEN,0.2194,0.3974,0.3832
DIAMONDS TEN HEARTS SEVEN,0.2246,0.2882,0.4872
DIAMONDS TEN HEARTS EIGHT,0.2222,0.2214,0.5564
CLUBS JACK CLUBS FOUR,0.3704,0.0198,0.6098
DIAMONDS TEN HEARTS NINE,0.2262,0.1638,0.61
CLUBS TEN CLUBS FOUR,0.3008,0.459,0.2402
CLUBS FOUR CLUBS KING,0.3798,0.005,0.6152
CLUBS FOUR CLUBS QUEEN,0.3596,0.0112,0.6292
CLUBS TWO DIAMONDS TEN,0.3132,0.4774,0.2094
CLUBS THREE DIAMONDS TEN,0.3314,0.46,0.2086
CLUBS FOUR CLUBS ACE,0.3572,0.0048,0.638
DIAMONDS JACK DIAMONDS TEN,0.224,0.0572,0.7188
DIAMONDS QUEEN DIAMONDS TEN,0.2162,0.0428,0.741
HEARTS TWO DIAMONDS TEN,0.3144,0.4774,0.2082
DIAMONDS KING DIAMONDS TEN,0.212,0.0348,0.7532
HEARTS THREE DIAMONDS TEN,0.3234,0.4662,0.2104
DIAMONDS ACE DIAMONDS TEN,0.2268,0.0236,0.7496
HEARTS FOUR DIAMONDS TEN,0.314,0.4766,0.2094
CLUBS EIGHT HEARTS JACK,0.33,0.0188,0.6512
HEARTS FIVE DIAMONDS TEN,0.0194,0.9688,0.0118
CLUBS EIGHT HEARTS QUEEN,0.3494,0.0106,0.64
CLUBS EIGHT HEARTS KING,0.36,0.0078,0.6322
CLUBS EIGHT HEARTS ACE,0.3446,0.0042,0.6512
CLUBS NINE SPADES THREE,0.6114,0.0286,0.36
CLUBS NINE SPADES TWO,0.6132,0.0302,0.3566
CLUBS NINE SPADES FIVE,0.6764,0.0778,0.2458
CLUBS NINE SPADES FOUR,0.625,0.0236,0.3514
CLUBS NINE SPADES SEVEN,0.5414,0.0304,0.4282
CLUBS NINE SPADES SIX,0.569,0.029,0.402
CLUBS NINE SPADES NINE,0.2766,0.0416,0.6818
CLUBS TEN HEARTS EIGHT,0.2138,0.2228,0.5634
CLUBS NINE SPADES EIGHT,0.539,0.021,0.44
CLUBS JACK HEARTS EIGHT,0.3426,0.0208,0.6366
CLUBS QUEEN HEARTS EIGHT,0.3372,0.0108,0.652
CLUBS KING HEARTS EIGHT,0.3464,0.0094,0.6442
CLUBS ACE HEARTS EIGHT,0.3488,0.004,0.6472
SPADES KING CLUBS KING,0.135,0.009,0.856
SPADES QUEEN CLUBS KING,0.3086,0.0074,0.684
SPADES ACE CLUBS KING,0.3166,0.0036,0.6798
DIAMONDS ACE HEARTS JACK,0.3092,0.0048,0.686
HEARTS FOUR HEARTS JACK,0.3692,0.0172,0.6136
DIAMONDS JACK HEARTS SEVEN,0.3598,0.0194,0.6208
HEARTS SIX DIAMONDS JACK,0.3612,0.018,0.6208
DIAMONDS JACK HEARTS NINE,0.3312,0.019,0.6498
DIAMONDS JACK HEARTS EIGHT,0.3474,0.014,0.6386
DIAMONDS KING DIAMONDS JACK,0.2998,0.0062,0.694
HEARTS THREE DIAMONDS JACK,0.3988,0.0208,0.5804
SPADES ACE SPADES SIX,0.3386,0.0032,0.6582
HEARTS ACE SPADES FOUR,0.373,0.0044,0.6226
DIAMONDS QUEEN DIAMONDS JACK,0.2818,0.0092,0.709
HEARTS TWO DIAMONDS JACK,0.3984,0.02,0.5816
HEARTS FIVE DIAMONDS JACK,0.2398,0.0624,0.6978
SPADES QUEEN SPADES SIX,0.3466,0.0106,0.6428
SPADES FOUR HEARTS QUEEN,0.392,0.011,0.597
DIAMONDS ACE DIAMONDS JACK,0.2976,0.0042,0.6982
HEARTS FOUR DIAMONDS JACK,0.3938,0.017,0.5892
SPADES KING SPADES SIX,0.3218,0.007,0.6712
SPADES FOUR HEARTS KING,0.3862,0.0094,0.6044
SPADES TEN SPADES SIX,0.2172,0.3502,0.4326
SPADES JACK SPADES SIX,0.3286,0.0176,0.6538
SPADES FOUR DIAMONDS JACK,0.3894,0.015,0.5956
SPADES FIVE DIAMONDS JACK,0.2358,0.0586,0.7056
DIAMONDS JACK SPADES TWO,0.3924,0.0174,0.5902
DIAMONDS JACK SPADES THREE,0.3966,0.016,0.5874
SPADES ACE DIAMONDS THREE,0.3844,0.005,0.6106
CLUBS EIGHT DIAMONDS JACK,0.3384,0.0174,0.6442
SPADES QUEEN DIAMONDS THREE,0.3956,0.0126,0.5918
SPADES KING DIAMONDS THREE,0.4042,0.009,0.5868
CLUBS NINE DIAMONDS JACK,0.3362,0.0158,0.648
CLUBS SIX DIAMONDS JACK,0.3504,0.0204,0.6292
CLUBS SEVEN DIAMONDS JACK,0.333,0.0182,0.6488
CLUBS FOUR DIAMONDS JACK,0.3826,0.0156,0.6018
CLUBS TWO DIAMONDS JACK,0.402,0.0198,0.5782
CLUBS THREE DIAMONDS JACK,0.3954,0.0168,0.5878
HEARTS SIX SPADES JACK,0.362,0.016,0.622
HEARTS SIX SPADES TEN,0.223,0.3764,0.4006
SPADES JACK DIAMONDS THREE,0.3992,0.0158,0.585
CLUBS SEVEN CLUBS ACE,0.3388,0.0066,0.6546
DIAMONDS THREE SPADES TEN,0.3194,0.4626,0.218
CLUBS SEVEN CLUBS QUEEN,0.3394,0.012,0.6486
CLUBS SEVEN CLUBS KING,0.3402,0.01,0.6498
SPADES NINE DIAMONDS JACK,0.3274,0.0146,0.658
CLUBS TEN CLUBS SEVEN,0.2168,0.2766,0.5066
DIAMONDS ACE HEARTS ACE,0.1352,0.0026,0.8622
HEARTS FOUR HEARTS ACE,0.362,0.006,0.632
SPADES EIGHT DIAMONDS JACK,0.3508,0.0164,0.6328
SPADES ACE HEARTS SIX,0.3556,0.0034,0.641
CLUBS JACK CLUBS SEVEN,0.3266,0.0146,0.6588
DIAMONDS ACE HEARTS KING,0.3144,0.0042,0.6814
HEARTS FOUR HEARTS KING,0.368,0.009,0.623
SPADES SEVEN DIAMONDS JACK,0.3454,0.0172,0.6374
SPADES KING HEARTS SIX,0.344,0.0084,0.6476
DIAMONDS ACE HEARTS QUEEN,0.3252,0.0042,0.6706
HEARTS FOUR HEARTS QUEEN,0.3618,0.0132,0.625
SPADES QUEEN HEARTS SIX,0.361,0.0134,0.6256
SPADES SIX DIAMONDS JACK,0.362,0.0176,0.6204
DIAMONDS TEN SPADES TWO,0.323,0.4698,0.2072
SPADES THREE DIAMONDS TEN,0.3104,0.4578,0.2318
SPADES FOUR DIAMONDS TEN,0.3134,0.4584,0.2282
SPADES FIVE DIAMONDS TEN,0.0264,0.9528,0.0208
SPADES SIX DIAMONDS TEN,0.2066,0.3792,0.4142
SPADES SEVEN DIAMONDS TEN,0.2424,0.282,0.4756
SPADES EIGHT DIAMONDS TEN,0.2304,0.2164,0.5532
SPADES NINE DIAMONDS TEN,0.2234,0.169,0.6076
CLUBS FOUR DIAMONDS TEN,0.3192,0.4736,0.2072
CLUBS SIX DIAMONDS TEN,0.22,0.3742,0.4058
CLUBS SEVEN DIAMONDS TEN,0.225,0.2822,0.4928
CLUBS EIGHT DIAMONDS TEN,0.226,0.2214,0.5526
CLUBS NINE DIAMONDS TEN,0.2098,0.1784,0.6118
CLUBS JACK DIAMONDS THREE,0.389,0.0156,0.5954
CLUBS TEN DIAMONDS THREE,0.3094,0.463,0.2276
DIAMONDS THREE CLUBS KING,0.3946,0.0084,0.597
DIAMONDS THREE CLUBS QUEEN,0.3882,0.012,0.5998
DIAMONDS THREE CLUBS ACE,0.3824,0.0064,0.6112
SPADES FOUR HEARTS JACK,0.3818,0.0178,0.6004
SPADES FIVE SPADES TWO,0.6178,0.0762,0.306
SPADES FOUR SPADES TWO,0.5776,0.0314,0.391
SPADES THREE SPADES TWO,0.5776,0.0328,0.3896
SPADES NINE SPADES TWO,0.569,0.0242,0.4068
SPADES EIGHT SPADES TWO,0.5778,0.0236,0.3986
SPADES SEVEN SPADES TWO,0.5716,0.0294,0.399
SPADES SIX SPADES TWO,0.5702,0.0306,0.3992
DIAMONDS QUEEN CLUBS THREE,0.3882,0.0132,0.5986
CLUBS THREE HEARTS TWO,0.6254,0.033,0.3416
DIAMONDS QUEEN CLUBS TWO,0.3986,0.011,0.5904
HEARTS TWO CLUBS TWO,0.407,0.0622,0.5308
DIAMONDS QUEEN HEARTS SEVEN,0.3612,0.0134,0.6254
HEARTS TWO HEARTS SEVEN,0.5834,0.0302,0.3864
HEARTS SIX DIAMONDS QUEEN,0.3666,0.0104,0.623
HEARTS SIX HEARTS TWO,0.5822,0.0304,0.3874
DIAMONDS QUEEN HEARTS NINE,0.3412,0.0114,0.6474
HEARTS TWO HEARTS NINE,0.5886,0.0296,0.3818
DIAMONDS QUEEN HEARTS EIGHT,0.349,0.0108,0.6402
HEARTS TWO HEARTS EIGHT,0.5828,0.0294,0.3878
CLUBS NINE HEARTS TWO,0.6164,0.0316,0.352
CLUBS NINE DIAMONDS QUEEN,0.3266,0.0106,0.6628
CLUBS EIGHT DIAMONDS QUEEN,0.3312,0.0106,0.6582
CLUBS EIGHT HEARTS TWO,0.6136,0.0298,0.3566
SPADES EIGHT HEARTS ACE,0.347,0.0048,0.6482
DIAMONDS QUEEN CLUBS FOUR,0.3878,0.0128,0.5994
HEARTS TWO CLUBS FOUR,0.6372,0.0284,0.3344
CLUBS SEVEN DIAMONDS QUEEN,0.3638,0.0106,0.6256
CLUBS SEVEN HEARTS TWO,0.631,0.03,0.339
SPADES EIGHT HEARTS QUEEN,0.3542,0.0124,0.6334
CLUBS SIX DIAMONDS QUEEN,0.3554,0.009,0.6356
CLUBS SIX HEARTS TWO,0.6142,0.0338,0.352
SPADES EIGHT HEARTS KING,0.3624,0.0088,0.6288
HEARTS TWO SPADES SIX,0.607,0.0304,0.3626
DIAMONDS QUEEN SPADES SIX,0.3696,0.0136,0.6168
HEARTS FOUR CLUBS QUEEN,0.3726,0.0128,0.6146
DIAMONDS ACE CLUBS QUEEN,0.3202,0.0036,0.6762
DIAMONDS QUEEN SPADES SEVEN,0.3732,0.008,0.6188
HEARTS TWO SPADES SEVEN,0.6252,0.0328,0.342
HEARTS FOUR CLUBS KING,0.3944,0.0078,0.5978
DIAMONDS ACE CLUBS KING,0.3138,0.0046,0.6816
DIAMONDS QUEEN SPADES EIGHT,0.3576,0.0112,0.6312
SPADES EIGHT HEARTS TWO,0.6338,0.0276,0.3386
HEARTS FOUR CLUBS ACE,0.379,0.007,0.614
DIAMONDS ACE CLUBS ACE,0.1326,0.0034,0.864
SPADES NINE DIAMONDS QUEEN,0.3344,0.009,0.6566
SPADES NINE HEARTS TWO,0.6144,0.03,0.3556
HEARTS TWO SPADES TWO,0.4012,0.0646,0.5342
DIAMONDS QUEEN SPADES TWO,0.3864,0.0116,0.602
HEARTS TWO SPADES THREE,0.6288,0.028,0.3432
DIAMONDS QUEEN SPADES THREE,0.3896,0.0106,0.5998
HEARTS TWO SPADES FOUR,0.6306,0.029,0.3404
DIAMONDS QUEEN SPADES FOUR,0.3964,0.0112,0.5924
CLUBS TEN HEARTS FOUR,0.3172,0.4574,0.2254
CLUBS TEN DIAMONDS ACE,0.2258,0.0234,0.7508
HEARTS TWO SPADES FIVE,0.661,0.084,0.255
DIAMONDS QUEEN SPADES FIVE,0.245,0.043,0.712
HEARTS FOUR CLUBS JACK,0.3838,0.0176,0.5986
CLUBS JACK DIAMONDS ACE,0.3244,0.0036,0.672
SPADES KING CLUBS JACK,0.3126,0.008,0.6794
CLUBS JACK SPADES QUEEN,0.3,0.01,0.69
SPADES ACE CLUBS JACK,0.3192,0.005,0.6758
SPADES SIX CLUBS KING,0.368,0.0078,0.6242
SPADES SIX CLUBS QUEEN,0.359,0.0118,0.6292
SPADES EIGHT HEARTS JACK,0.3334,0.0112,0.6554
SPADES SIX CLUBS ACE,0.3626,0.0036,0.6338
CLUBS JACK SPADES SIX,0.3528,0.018,0.6292
CLUBS TEN SPADES SIX,0.2144,0.3822,0.4034
CLUBS JACK SPADES TEN,0.225,0.0592,0.7158
CLUBS JACK SPADES JACK,0.1418,0.0252,0.833
SPADES QUEEN CLUBS SEVEN,0.3412,0.0124,0.6464
SPADES KING CLUBS SEVEN,0.36,0.0072,0.6328
SPADES ACE CLUBS SEVEN,0.3558,0.005,0.6392
SPADES SIX HEARTS JACK,0.3552,0.0172,0.6276
SPADES SIX HEARTS ACE,0.3448,0.004,0.6512
SPADES SIX HEARTS KING,0.3592,0.0078,0.633
SPADES SIX HEARTS QUEEN,0.353,0.0118,0.6352
SPADES JACK CLUBS SEVEN,0.3464,0.0188,0.6348
SPADES TEN CLUBS SEVEN,0.2198,0.2894,0.4908
CLUBS TEN HEARTS SIX,0.2108,0.3842,0.405
CLUBS JACK HEARTS SIX,0.3582,0.0192,0.6226
CLUBS JACK CLUBS ACE,0.2994,0.0054,0.6952
HEARTS SIX CLUBS QUEEN,0.3602,0.0132,0.6266
HEARTS SIX CLUBS KING,0.3574,0.0072,0.6354
HEARTS SIX CLUBS ACE,0.359,0.0052,0.6358
CLUBS JACK CLUBS QUEEN,0.2904,0.0098,0.6998
CLUBS JACK CLUBS KING,0.3044,0.0048,0.6908
DIAMONDS THREE HEARTS ACE,0.373,0.004,0.623
DIAMONDS THREE HEARTS QUEEN,0.391,0.0084,0.6006
DIAMONDS THREE HEARTS KING,0.3932,0.0094,0.5974
SPADES TEN DIAMONDS ACE,0.2258,0.0268,0.7474
HEARTS FOUR SPADES TEN,0.3212,0.477,0.2018
HEARTS FOUR SPADES JACK,0.4,0.02,0.58
SPADES JACK DIAMONDS ACE,0.3168,0.003,0.6802
SPADES ACE HEARTS FOUR,0.3842,0.0048,0.611
SPADES ACE DIAMONDS ACE,0.1412,0.0034,0.8554
HEARTS FOUR SPADES QUEEN,0.392,0.0106,0.5974
SPADES QUEEN DIAMONDS ACE,0.3286,0.0036,0.6678
CLUBS JACK SPADES FOUR,0.3798,0.0158,0.6044
SPADES KING DIAMONDS ACE,0.3304,0.0028,0.6668
HEARTS FOUR SPADES KING,0.39,0.0088,0.6012
CLUBS TEN SPADES FOUR,0.307,0.4694,0.2236
DIAMONDS QUEEN DIAMONDS ACE,0.3034,0.0026,0.694
HEARTS TWO DIAMONDS ACE,0.3936,0.0056,0.6008
HEARTS FOUR DIAMONDS QUEEN,0.4016,0.0132,0.5852
HEARTS FOUR HEARTS TWO,0.6,0.0294,0.3706
SPADES FOUR CLUBS KING,0.3864,0.0072,0.6064
HEARTS FIVE DIAMONDS QUEEN,0.2326,0.0496,0.7178
HEARTS FIVE HEARTS TWO,0.6364,0.0828,0.2808
DIAMONDS THREE HEARTS JACK,0.373,0.0198,0.6072
SPADES FOUR CLUBS QUEEN,0.3836,0.0114,0.605
DIAMONDS QUEEN HEARTS TWO,0.4008,0.0134,0.5858
DIAMONDS KING DIAMONDS QUEEN,0.2934,0.0068,0.6998
DIAMONDS KING HEARTS TWO,0.3978,0.0106,0.5916
HEARTS THREE DIAMONDS QUEEN,0.4,0.0132,0.5868
HEARTS THREE HEARTS TWO,0.5978,0.0336,0.3686
SPADES FOUR CLUBS ACE,0.3752,0.0042,0.6206
HEARTS TWO CLUBS ACE,0.3778,0.0054,0.6168
DIAMONDS QUEEN CLUBS ACE,0.3216,0.0038,0.6746
HEARTS TWO CLUBS QUEEN,0.4024,0.012,0.5856
DIAMONDS QUEEN CLUBS QUEEN,0.147,0.018,0.835
HEARTS TWO CLUBS KING,0.3942,0.009,0.5968
DIAMONDS QUEEN CLUBS KING,0.3216,0.0074,0.671
SPADES EIGHT SPADES FIVE,0.613,0.0768,0.3102
CLUBS TEN HEARTS TWO,0.3134,0.4762,0.2104
CLUBS TEN DIAMONDS QUEEN,0.2316,0.0402,0.7282
SPADES NINE SPADES FIVE,0.629,0.079,0.292
CLUBS JACK HEARTS TWO,0.3798,0.0186,0.6016
CLUBS JACK DIAMONDS QUEEN,0.3008,0.0066,0.6926
SPADES SIX SPADES FIVE,0.5934,0.0706,0.336
SPADES SEVEN SPADES FIVE,0.6026,0.0704,0.327
DIAMONDS FIVE CLUBS QUEEN,0.2288,0.0488,0.7224
SPADES EIGHT CLUBS ACE,0.3508,0.0038,0.6454
DIAMONDS FIVE CLUBS KING,0.2298,0.037,0.7332
SPADES EIGHT CLUBS KING,0.3658,0.0072,0.627
DIAMONDS FIVE CLUBS ACE,0.2292,0.025,0.7458
SPADES EIGHT CLUBS QUEEN,0.355,0.0126,0.6324
CLUBS JACK SPADES EIGHT,0.338,0.0152,0.6468
CLUBS TEN SPADES EIGHT,0.2244,0.2242,0.5514
CLUBS TEN DIAMONDS FIVE,0.0106,0.973,0.0164
CLUBS JACK DIAMONDS FIVE,0.2394,0.0654,0.6952
DIAMONDS TEN HEARTS JACK,0.2264,0.0622,0.7114
SPADES ACE CLUBS NINE,0.3572,0.0046,0.6382
SPADES QUEEN CLUBS NINE,0.3372,0.0086,0.6542
SPADES KING CLUBS NINE,0.3566,0.0058,0.6376
HEARTS SIX HEARTS KING,0.339,0.007,0.654
DIAMONDS KING SPADES SEVEN,0.3578,0.0062,0.636
HEARTS THREE SPADES SEVEN,0.6142,0.0296,0.3562
SPADES KING DIAMONDS SEVEN,0.3538,0.0062,0.64
HEARTS SIX HEARTS QUEEN,0.3384,0.0112,0.6504
SPADES QUEEN DIAMONDS SEVEN,0.3632,0.0104,0.6264
HEARTS THREE SPADES SIX,0.6064,0.0282,0.3654
DIAMONDS KING SPADES SIX,0.3664,0.0082,0.6254
DIAMONDS KING SPADES NINE,0.3628,0.0084,0.6288
HEARTS THREE SPADES NINE,0.6204,0.0276,0.352
HEARTS SIX HEARTS ACE,0.334,0.005,0.661
DIAMONDS KING SPADES EIGHT,0.3612,0.0068,0.632
HEARTS THREE SPADES EIGHT,0.6154,0.0294,0.3552
SPADES ACE DIAMONDS SEVEN,0.3616,0.0024,0.636
HEARTS THREE CLUBS NINE,0.6222,0.0268,0.351
CLUBS NINE DIAMONDS KING,0.3512,0.0062,0.6426
CLUBS EIGHT DIAMONDS KING,0.367,0.0058,0.6272
HEARTS THREE CLUBS EIGHT,0.622,0.0308,0.3472
HEARTS THREE SPADES THREE,0.397,0.066,0.537
DIAMONDS KING SPADES THREE,0.3956,0.0078,0.5966
HEARTS THREE SPADES TWO,0.625,0.0322,0.3428
DIAMONDS KING SPADES TWO,0.4,0.0074,0.5926
HEARTS THREE SPADES FIVE,0.6446,0.0902,0.2652
DIAMONDS KING SPADES FIVE,0.2458,0.0378,0.7164
HEARTS THREE SPADES FOUR,0.6018,0.0324,0.3658
DIAMONDS KING SPADES FOUR,0.4008,0.007,0.5922
DIAMONDS KING CLUBS TWO,0.4034,0.0078,0.5888
HEARTS THREE CLUBS TWO,0.6266,0.031,0.3424
DIAMONDS KING CLUBS THREE,0.3998,0.0068,0.5934
HEARTS THREE CLUBS THREE,0.4038,0.0652,0.531
DIAMONDS KING CLUBS FOUR,0.405,0.01,0.585
HEARTS THREE CLUBS FOUR,0.617,0.0336,0.3494
CLUBS SIX DIAMONDS KING,0.3552,0.0068,0.638
HEARTS THREE CLUBS SIX,0.5922,0.0282,0.3796
DIAMONDS KING CLUBS SEVEN,0.3518,0.0066,0.6416
HEARTS THREE CLUBS SEVEN,0.6104,0.0348,0.3548
HEARTS THREE DIAMONDS KING,0.396,0.0078,0.5962
DIAMONDS KING DIAMONDS ACE,0.3086,0.0024,0.689
HEARTS THREE DIAMONDS ACE,0.3884,0.0036,0.608
HEARTS FOUR DIAMONDS KING,0.3932,0.009,0.5978
HEARTS FOUR HEARTS THREE,0.59,0.0252,0.3848
HEARTS FIVE DIAMONDS KING,0.2412,0.0372,0.7216
HEARTS THREE HEARTS FIVE,0.6314,0.0762,0.2924
HEARTS SIX DIAMONDS KING,0.3702,0.0086,0.6212
HEARTS THREE HEARTS SIX,0.5746,0.0294,0.396
DIAMONDS KING HEARTS SEVEN,0.3704,0.0082,0.6214
HEARTS THREE HEARTS SEVEN,0.5856,0.0274,0.387
DIAMONDS KING HEARTS EIGHT,0.3722,0.0076,0.6202
HEARTS THREE HEARTS EIGHT,0.5852,0.027,0.3878
SPADES TEN DIAMONDS SEVEN,0.2244,0.289,0.4866
DIAMONDS KING HEARTS NINE,0.346,0.0064,0.6476
HEARTS THREE HEARTS NINE,0.5942,0.0278,0.378
HEARTS SIX HEARTS JACK,0.345,0.016,0.639
SPADES JACK DIAMONDS SEVEN,0.3482,0.0166,0.6352
HEARTS FIVE CLUBS FOUR,0.6324,0.0906,0.277
SPADES SIX SPADES FOUR,0.5384,0.0276,0.434
SPADES SEVEN SPADES FOUR,0.5662,0.027,0.4068
HEARTS FIVE CLUBS SIX,0.638,0.076,0.286
SPADES EIGHT SPADES FOUR,0.5706,0.0276,0.4018
HEARTS FIVE CLUBS SEVEN,0.6448,0.0742,0.281
SPADES NINE SPADES FOUR,0.569,0.03,0.401
SPADES QUEEN DIAMONDS FIVE,0.2368,0.0474,0.7158
SPADES KING DIAMONDS FIVE,0.2462,0.033,0.7208
HEARTS FIVE CLUBS TWO,0.6702,0.09,0.2398
SPADES ACE DIAMONDS FIVE,0.2456,0.02,0.7344
HEARTS FIVE CLUBS THREE,0.6568,0.0848,0.2584
SPADES FIVE SPADES FOUR,0.6064,0.0826,0.311
HEARTS FIVE SPADES TWO,0.6592,0.0846,0.2562
HEARTS FIVE SPADES THREE,0.6456,0.0838,0.2706
HEARTS FIVE SPADES FOUR,0.6412,0.0832,0.2756
HEARTS FIVE SPADES FIVE,0.286,0.0588,0.6552
CLUBS EIGHT HEARTS FIVE,0.6604,0.0814,0.2582
CLUBS NINE HEARTS FIVE,0.675,0.0806,0.2444
HEARTS KING DIAMONDS TEN,0.2178,0.037,0.7452
HEARTS QUEEN DIAMONDS TEN,0.2304,0.0488,0.7208
HEARTS ACE DIAMONDS TEN,0.231,0.0254,0.7436
HEARTS FIVE HEARTS SEVEN,0.6086,0.0774,0.314
HEARTS SIX HEARTS FIVE,0.614,0.0814,0.3046
HEARTS FIVE HEARTS NINE,0.648,0.0776,0.2744
CLUBS NINE SPADES TEN,0.2206,0.1704,0.609
HEARTS FIVE HEARTS EIGHT,0.6272,0.0768,0.296
SPADES JACK CLUBS NINE,0.317,0.0162,0.6668
CLUBS SIX DIAMONDS ACE,0.3602,0.005,0.6348
HEARTS FOUR CLUBS SIX,0.5796,0.0288,0.3916
SPADES EIGHT SPADES THREE,0.5692,0.0286,0.4022
CLUBS SEVEN DIAMONDS ACE,0.343,0.0056,0.6514
HEARTS FOUR CLUBS SEVEN,0.5978,0.0326,0.3696
SPADES NINE SPADES THREE,0.5858,0.0258,0.3884
CLUBS FOUR DIAMONDS ACE,0.3816,0.0044,0.614
HEARTS FOUR CLUBS FOUR,0.3972,0.0666,0.5362
SPADES SIX SPADES THREE,0.5636,0.0262,0.4102
SPADES SEVEN SPADES THREE,0.5782,0.024,0.3978
CLUBS EIGHT DIAMONDS ACE,0.3562,0.0034,0.6404
HEARTS FOUR CLUBS EIGHT,0.62,0.0276,0.3524
HEARTS FOUR CLUBS NINE,0.6196,0.0282,0.3522
CLUBS NINE DIAMONDS ACE,0.354,0.0048,0.6412
HEARTS FOUR SPADES FOUR,0.4006,0.0586,0.5408
DIAMONDS ACE SPADES FOUR,0.383,0.004,0.613
HEARTS FOUR SPADES FIVE,0.6376,0.0804,0.282
DIAMONDS ACE SPADES FIVE,0.2392,0.0254,0.7354
HEARTS FOUR SPADES TWO,0.6146,0.0338,0.3516
DIAMONDS ACE SPADES TWO,0.3874,0.004,0.6086
HEARTS FOUR SPADES THREE,0.6074,0.0356,0.357
DIAMONDS ACE SPADES THREE,0.3938,0.0034,0.6028
SPADES EIGHT DIAMONDS ACE,0.361,0.0046,0.6344
HEARTS FOUR SPADES EIGHT,0.6142,0.0282,0.3576
SPADES FOUR SPADES THREE,0.5678,0.028,0.4042
SPADES NINE DIAMONDS ACE,0.3616,0.003,0.6354
HEARTS FOUR SPADES NINE,0.6188,0.0266,0.3546
SPADES FIVE SPADES THREE,0.6042,0.0762,0.3196
HEARTS FOUR SPADES SIX,0.5908,0.0324,0.3768
DIAMONDS ACE SPADES SIX,0.3646,0.0038,0.6316
SPADES SEVEN DIAMONDS ACE,0.3612,0.005,0.6338
HEARTS FOUR SPADES SEVEN,0.6028,0.0304,0.3668
SPADES QUEEN SPADES EIGHT,0.33,0.0098,0.6602
CLUBS JACK DIAMONDS TEN,0.2222,0.057,0.7208
CLUBS JACK DIAMONDS SEVEN,0.3554,0.0166,0.628
SPADES KING SPADES EIGHT,0.347,0.0064,0.6466
CLUBS TEN DIAMONDS TEN,0.0852,0.0578,0.857
CLUBS TEN DIAMONDS SEVEN,0.2172,0.2954,0.4874
SPADES ACE SPADES EIGHT,0.3222,0.004,0.6738
HEARTS FIVE DIAMONDS ACE,0.243,0.0242,0.7328
HEARTS FOUR HEARTS FIVE,0.5956,0.08,0.3244
HEARTS FOUR DIAMONDS ACE,0.3822,0.0048,0.613
DIAMONDS TEN CLUBS ACE,0.2246,0.0292,0.7462
CLUBS ACE DIAMONDS SEVEN,0.3504,0.0044,0.6452
DIAMONDS TEN CLUBS KING,0.237,0.034,0.729
CLUBS KING DIAMONDS SEVEN,0.3554,0.0096,0.635
DIAMONDS TEN CLUBS QUEEN,0.2218,0.044,0.7342
DIAMONDS SEVEN CLUBS QUEEN,0.3532,0.0106,0.6362
DIAMONDS ACE HEARTS NINE,0.368,0.0046,0.6274
HEARTS FOUR HEARTS NINE,0.5882,0.03,0.3818
SPADES KING SPADES JACK,0.2856,0.0074,0.707
CLUBS TEN CLUBS NINE,0.2034,0.1614,0.6352
DIAMONDS ACE HEARTS EIGHT,0.3668,0.0032,0.63
HEARTS FOUR HEARTS EIGHT,0.5976,0.0266,0.3758
SPADES QUEEN SPADES JACK,0.2804,0.0098,0.7098
CLUBS JACK CLUBS NINE,0.3224,0.0132,0.6644
DIAMONDS ACE HEARTS SEVEN,0.3598,0.004,0.6362
HEARTS FOUR HEARTS SEVEN,0.5646,0.027,0.4084
HEARTS SIX DIAMONDS ACE,0.3708,0.0046,0.6246
HEARTS FOUR HEARTS SIX,0.5554,0.0296,0.415
SPADES ACE SPADES JACK,0.2926,0.004,0.7034
HEARTS ACE HEARTS QUEEN,0.3096,0.0048,0.6856
CLUBS THREE DIAMONDS ACE,0.3848,0.0028,0.6124
HEARTS FOUR CLUBS THREE,0.619,0.0332,0.3478
SPADES JACK DIAMONDS FIVE,0.235,0.0634,0.7016
CLUBS NINE CLUBS ACE,0.3466,0.0054,0.648
DIAMONDS ACE CLUBS TWO,0.397,0.0044,0.5986
HEARTS FOUR CLUBS TWO,0.629,0.0342,0.3368
SPADES TEN DIAMONDS FIVE,0.02,0.9574,0.0226
SPADES TEN SPADES EIGHT,0.2104,0.2062,0.5834
CLUBS NINE CLUBS QUEEN,0.3136,0.0108,0.6756
HEARTS QUEEN HEARTS KING,0.2772,0.006,0.7168
SPADES JACK SPADES EIGHT,0.3176,0.0158,0.6666
CLUBS NINE CLUBS KING,0.3352,0.006,0.6588
DIAMONDS QUEEN HEARTS JACK,0.301,0.0102,0.6888
HEARTS TWO HEARTS JACK,0.3626,0.02,0.6174
DIAMONDS QUEEN HEARTS KING,0.3208,0.0076,0.6716
HEARTS TWO HEARTS KING,0.3764,0.0096,0.614
DIAMONDS QUEEN HEARTS QUEEN,0.1478,0.0154,0.8368
HEARTS TWO HEARTS QUEEN,0.3882,0.0136,0.5982
DIAMONDS QUEEN HEARTS ACE,0.332,0.0034,0.6646
HEARTS TWO HEARTS ACE,0.3774,0.0052,0.6174
SPADES ACE HEARTS ACE,0.1204,0.0032,0.8764
SPADES KING HEARTS ACE,0.3156,0.0044,0.68
SPADES QUEEN HEARTS ACE,0.3158,0.0058,0.6784
SPADES JACK HEARTS ACE,0.3238,0.004,0.6722
HEARTS SIX SPADES FOUR,0.5968,0.028,0.3752
SPADES TEN HEARTS ACE,0.2242,0.0278,0.748
SPADES KING SPADES QUEEN,0.3068,0.0078,0.6854
HEARTS SIX SPADES FIVE,0.6424,0.078,0.2796
SPADES ACE SPADES QUEEN,0.3014,0.004,0.6946
HEARTS SIX SPADES TWO,0.6048,0.0322,0.363
HEARTS SIX SPADES THREE,0.6006,0.0332,0.3662
HEARTS SIX SPADES EIGHT,0.5624,0.0298,0.4078
SPADES JACK CLUBS THREE,0.3976,0.0218,0.5806
HEARTS SIX SPADES NINE,0.5706,0.0266,0.4028
SPADES NINE SPADES EIGHT,0.505,0.0282,0.4668
SPADES TEN CLUBS THREE,0.3362,0.4562,0.2076
HEARTS SIX SPADES SIX,0.2844,0.0598,0.6558
HEARTS SIX SPADES SEVEN,0.5546,0.0264,0.419
SPADES ACE CLUBS THREE,0.388,0.0038,0.6082
SPADES QUEEN CLUBS THREE,0.3908,0.0116,0.5976
SPADES KING CLUBS THREE,0.3996,0.0108,0.5896
HEARTS SIX CLUBS FOUR,0.6054,0.0292,0.3654
HEARTS SIX CLUBS SEVEN,0.5668,0.0284,0.4048
HEARTS SIX CLUBS SIX,0.2892,0.0598,0.651
HEARTS SIX CLUBS NINE,0.5792,0.0204,0.4004
CLUBS EIGHT HEARTS SIX,0.5454,0.0252,0.4294
HEARTS SIX HEARTS SEVEN,0.5284,0.0284,0.4432
HEARTS SIX HEARTS NINE,0.539,0.0256,0.4354
HEARTS SIX HEARTS EIGHT,0.532,0.0286,0.4394
HEARTS SIX CLUBS THREE,0.6168,0.0264,0.3568
HEARTS SIX CLUBS TWO,0.6128,0.032,0.3552
CLUBS JACK HEARTS QUEEN,0.2982,0.0132,0.6886
CLUBS TEN HEARTS QUEEN,0.2086,0.051,0.7404
HEARTS QUEEN CLUBS ACE,0.3118,0.0046,0.6836
CLUBS NINE HEARTS ACE,0.3522,0.0036,0.6442
HEARTS QUEEN CLUBS KING,0.3102,0.0056,0.6842
CLUBS NINE HEARTS KING,0.3344,0.0066,0.659
HEARTS QUEEN CLUBS QUEEN,0.1362,0.0182,0.8456
CLUBS NINE HEARTS QUEEN,0.3388,0.01,0.6512
CLUBS NINE HEARTS JACK,0.3282,0.0166,0.6552
SPADES JACK DIAMONDS NINE,0.3362,0.0158,0.648
SPADES TEN DIAMONDS NINE,0.226,0.1638,0.6102
DIAMONDS EIGHT HEARTS JACK,0.3426,0.0134,0.644
SPADES QUEEN DIAMONDS NINE,0.3376,0.0122,0.6502
HEARTS FIVE SPADES SIX,0.628,0.0762,0.2958
HEARTS FIVE SPADES SEVEN,0.6458,0.0818,0.2724
SPADES KING DIAMONDS NINE,0.3518,0.0066,0.6416
HEARTS FIVE SPADES EIGHT,0.6482,0.0778,0.274
SPADES EIGHT SPADES SEVEN,0.5052,0.0278,0.467
SPADES ACE DIAMONDS NINE,0.3622,0.003,0.6348
HEARTS FIVE SPADES NINE,0.6792,0.0768,0.244
SPADES NINE SPADES SEVEN,0.5224,0.025,0.4526
HEARTS QUEEN HEARTS SEVEN,0.3422,0.0136,0.6442
DIAMONDS EIGHT HEARTS KING,0.355,0.008,0.637
DIAMONDS EIGHT HEARTS QUEEN,0.3404,0.0112,0.6484
HEARTS KING HEARTS SEVEN,0.3458,0.0096,0.6446
HEARTS ACE HEARTS SEVEN,0.3328,0.0042,0.663
HEARTS ACE DIAMONDS EIGHT,0.3586,0.0036,0.6378
HEARTS JACK HEARTS SEVEN,0.3362,0.018,0.6458
HEARTS JACK DIAMONDS SIX,0.3608,0.021,0.6182
HEARTS ACE HEARTS NINE,0.338,0.0052,0.6568
HEARTS KING HEARTS NINE,0.3368,0.0076,0.6556
HEARTS QUEEN HEARTS NINE,0.319,0.0146,0.6664
HEARTS NINE HEARTS JACK,0.3222,0.0174,0.6604
HEARTS ACE CLUBS QUEEN,0.3166,0.0072,0.6762
CLUBS NINE HEARTS SEVEN,0.5608,0.0286,0.4106
CLUBS EIGHT HEARTS SEVEN,0.5572,0.0304,0.4124
HEARTS ACE CLUBS KING,0.3236,0.0052,0.6712
HEARTS ACE CLUBS ACE,0.1192,0.0026,0.8782
SPADES QUEEN HEARTS QUEEN,0.1422,0.0174,0.8404
SPADES THREE HEARTS SEVEN,0.6096,0.028,0.3624
SPADES KING HEARTS QUEEN,0.3066,0.0068,0.6866
SPADES TWO HEARTS SEVEN,0.6302,0.0272,0.3426
SPADES ACE HEARTS QUEEN,0.3202,0.0028,0.677
SPADES FIVE HEARTS SEVEN,0.6466,0.0838,0.2696
CLUBS TEN HEARTS ACE,0.2116,0.0246,0.7638
SPADES FOUR HEARTS SEVEN,0.5966,0.0292,0.3742
CLUBS JACK HEARTS ACE,0.3084,0.004,0.6876
SPADES SEVEN HEARTS SEVEN,0.2896,0.0574,0.653
SPADES KING DIAMONDS JACK,0.3054,0.0068,0.6878
SPADES QUEEN DIAMONDS JACK,0.3248,0.0096,0.6656
SPADES SIX HEARTS SEVEN,0.562,0.0328,0.4052
SPADES NINE HEARTS SEVEN,0.565,0.025,0.41
SPADES TEN HEARTS QUEEN,0.221,0.0454,0.7336
SPADES EIGHT HEARTS SEVEN,0.5468,0.0258,0.4274
SPADES ACE DIAMONDS JACK,0.3226,0.0028,0.6746
SPADES JACK HEARTS QUEEN,0.308,0.0084,0.6836
HEARTS QUEEN DIAMONDS SIX,0.364,0.0106,0.6254
HEARTS KING DIAMONDS SIX,0.3614,0.0086,0.63
HEARTS ACE DIAMONDS SIX,0.3388,0.0054,0.6558
SPADES TEN DIAMONDS JACK,0.231,0.0628,0.7062
SPADES JACK DIAMONDS JACK,0.1554,0.0226,0.822
SPADES NINE SPADES SIX,0.528,0.0292,0.4428
SPADES EIGHT SPADES SIX,0.528,0.0298,0.4422
SPADES SEVEN SPADES SIX,0.5106,0.0244,0.465
HEARTS SEVEN HEARTS EIGHT,0.5182,0.026,0.4558
HEARTS NINE HEARTS SEVEN,0.542,0.0258,0.4322
SPADES JACK SPADES TEN,0.2174,0.0532,0.7294
CLUBS SIX HEARTS SEVEN,0.5474,0.0284,0.4242
CLUBS SEVEN HEARTS SEVEN,0.2824,0.0568,0.6608
CLUBS FOUR HEARTS SEVEN,0.601,0.0294,0.3696
CLUBS TWO HEARTS SEVEN,0.6382,0.031,0.3308
SPADES KING SPADES TEN,0.22,0.0328,0.7472
CLUBS THREE HEARTS SEVEN,0.635,0.0306,0.3344
SPADES QUEEN SPADES TEN,0.212,0.0442,0.7438
SPADES ACE SPADES TEN,0.203,0.0272,0.7698
SPADES KING HEARTS SEVEN,0.3636,0.0088,0.6276
SPADES QUEEN HEARTS SEVEN,0.3712,0.0102,0.6186
SPADES ACE HEARTS SEVEN,0.3612,0.0042,0.6346
SPADES TEN HEARTS SEVEN,0.2256,0.2978,0.4766
SPADES JACK HEARTS SEVEN,0.3564,0.0164,0.6272
CLUBS TEN HEARTS NINE,0.2204,0.1744,0.6052
SPADES ACE HEARTS THREE,0.3896,0.0036,0.6068
SPADES ACE DIAMONDS KING,0.3232,0.003,0.6738
