opposingHand,winningChance,drawChance,lostChance
SPADES KING HEARTS TEN,0.3946,0.0056,0.5998
SPADES ACE HEARTS TEN,0.4164,0.0036,0.58
SPADES TEN HEARTS NINE,0.6552,0.0126,0.3322
SPADES JACK HEARTS NINE,0.7114,0.04,0.2486
SPADES TEN HEARTS TEN,0.428,0.0118,0.5602
SPADES JACK HEARTS TEN,0.7214,0.0412,0.2374
SPADES SIX HEARTS EIGHT,0.6396,0.01,0.3504
SPADES SEVEN HEARTS EIGHT,0.6506,0.0104,0.339
CLUBS THREE HEARTS JACK,0.7414,0.05,0.2086
SPADES EIGHT HEARTS EIGHT,0.4578,0.0122,0.53
CLUBS THREE HEARTS TEN,0.7038,0.012,0.2842
SPADES NINE HEARTS EIGHT,0.6442,0.0092,0.3466
SPADES KING HEARTS NINE,0.4256,0.007,0.5674
SPADES TWO HEARTS EIGHT,0.6746,0.0128,0.3126
SPADES QUEEN HEARTS NINE,0.68,0.0894,0.2306
SPADES THREE HEARTS EIGHT,0.6894,0.014,0.2966
SPADES FOUR HEARTS EIGHT,0.6674,0.0088,0.3238
SPADES ACE HEARTS NINE,0.4408,0.0044,0.5548
SPADES FIVE HEARTS EIGHT,0.6608,0.009,0.3302
CLUBS EIGHT HEARTS EIGHT,0.4632,0.0134,0.5234
CLUBS NINE HEARTS EIGHT,0.6506,0.0094,0.34
CLUBS THREE HEARTS KING,0.4338,0.01,0.5562
CLUBS FOUR HEARTS EIGHT,0.6652,0.009,0.3258
CLUBS FIVE HEARTS EIGHT,0.6548,0.0124,0.3328
CLUBS SIX HEARTS EIGHT,0.6554,0.0108,0.3338
CLUBS THREE HEARTS ACE,0.4256,0.0052,0.5692
CLUBS SEVEN HEARTS EIGHT,0.6518,0.0102,0.338
CLUBS THREE HEARTS EIGHT,0.685,0.0116,0.3034
CLUBS TWO HEARTS EIGHT,0.6726,0.014,0.3134
SPADES TEN SPADES FOUR,0.6406,0.0102,0.3492
SPADES JACK SPADES FOUR,0.6924,0.037,0.2706
HEARTS NINE HEARTS EIGHT,0.616,0.0092,0.3748
SPADES QUEEN SPADES FOUR,0.6278,0.0856,0.2866
SPADES KING SPADES FOUR,0.4058,0.0064,0.5878
SPADES ACE SPADES FOUR,0.4066,0.0068,0.5866
HEARTS KING HEARTS TEN,0.38,0.0054,0.6146
HEARTS ACE HEARTS TEN,0.3888,0.0054,0.6058
CLUBS TEN HEARTS SEVEN,0.667,0.0118,0.3212
CLUBS KING HEARTS SEVEN,0.4338,0.005,0.5612
HEARTS SEVEN CLUBS QUEEN,0.6898,0.0924,0.2178
CLUBS ACE HEARTS SEVEN,0.4538,0.0044,0.5418
CLUBS SEVEN HEARTS ACE,0.4396,0.0038,0.5566
CLUBS SEVEN HEARTS KING,0.435,0.0062,0.5588
CLUBS SEVEN HEARTS JACK,0.7388,0.0478,0.2134
CLUBS SEVEN HEARTS TEN,0.6658,0.0104,0.3238
CLUBS TEN CLUBS THREE,0.6562,0.01,0.3338
CLUBS THREE CLUBS ACE,0.4154,0.0046,0.58
CLUBS THREE CLUBS QUEEN,0.6536,0.0882,0.2582
CLUBS THREE CLUBS KING,0.4134,0.0088,0.5778
HEARTS JACK HEARTS TEN,0.6862,0.0424,0.2714
SPADES ACE CLUBS ACE,0.1412,0.0042,0.8546
SPADES KING CLUBS ACE,0.3444,0.0046,0.651
SPADES QUEEN CLUBS ACE,0.253,0.0156,0.7314
SPADES JACK CLUBS ACE,0.269,0.0154,0.7156
SPADES TEN CLUBS ACE,0.3994,0.0058,0.5948
SPADES EIGHT HEARTS NINE,0.6352,0.009,0.3558
SPADES NINE HEARTS NINE,0.449,0.009,0.542
SPADES SIX HEARTS NINE,0.6588,0.008,0.3332
SPADES SEVEN HEARTS NINE,0.6458,0.0086,0.3456
CLUBS SEVEN HEARTS NINE,0.6672,0.0094,0.3234
CLUBS SIX HEARTS NINE,0.6634,0.0094,0.3272
CLUBS FIVE HEARTS NINE,0.6694,0.0132,0.3174
CLUBS FOUR HEARTS NINE,0.689,0.012,0.299
CLUBS THREE HEARTS NINE,0.6826,0.0084,0.309
CLUBS TWO HEARTS NINE,0.6902,0.0116,0.2982
SPADES FIVE HEARTS NINE,0.6558,0.0086,0.3356
SPADES FOUR HEARTS NINE,0.6854,0.0124,0.3022
SPADES THREE HEARTS NINE,0.6864,0.0098,0.3038
SPADES TWO HEARTS NINE,0.676,0.0088,0.3152
CLUBS NINE HEARTS NINE,0.4678,0.011,0.5212
CLUBS EIGHT HEARTS NINE,0.6488,0.0104,0.3408
