opposingHand,winningChance,drawChance,lostChance
HEARTS NINE CLUBS QUEEN,0.3368,0.0112,0.652
HEARTS NINE CLUBS KING,0.342,0.0068,0.6512
SPADES QUEEN HEARTS TEN,0.3336,0.0112,0.6552
SPADES KING HEARTS TEN,0.3408,0.008,0.6512
SPADES ACE HEARTS TEN,0.3528,0.0058,0.6414
SPADES TEN HEARTS NINE,0.542,0.0172,0.4408
SPADES JACK HEARTS NINE,0.2278,0.17,0.6022
SPADES TEN HEARTS TEN,0.2768,0.024,0.6992
SPADES JACK HEARTS TEN,0.2222,0.126,0.6518
SPADES SIX HEARTS EIGHT,0.5526,0.0192,0.4282
SPADES SEVEN HEARTS EIGHT,0.5288,0.0176,0.4536
SPADES EIGHT HEARTS EIGHT,0.2862,0.0276,0.6862
CLUBS THREE HEARTS TEN,0.5856,0.0204,0.394
SPADES NINE HEARTS EIGHT,0.5542,0.0148,0.431
SPADES KING HEARTS NINE,0.3522,0.0076,0.6402
SPADES TWO HEARTS EIGHT,0.7136,0.0582,0.2282
SPADES QUEEN HEARTS NINE,0.3464,0.012,0.6416
SPADES THREE HEARTS EIGHT,0.5998,0.0214,0.3788
SPADES FOUR HEARTS EIGHT,0.579,0.0226,0.3984
SPADES ACE HEARTS NINE,0.3482,0.0046,0.6472
SPADES FIVE HEARTS EIGHT,0.5698,0.0202,0.41
CLUBS EIGHT HEARTS EIGHT,0.2968,0.0318,0.6714
CLUBS NINE HEARTS EIGHT,0.5378,0.0174,0.4448
CLUBS THREE HEARTS KING,0.3478,0.0088,0.6434
CLUBS FOUR HEARTS EIGHT,0.5686,0.0202,0.4112
CLUBS THREE HEARTS QUEEN,0.3484,0.0148,0.6368
CLUBS FIVE HEARTS EIGHT,0.5668,0.0188,0.4144
CLUBS SIX HEARTS EIGHT,0.563,0.0212,0.4158
HEARTS ACE CLUBS THREE,0.348,0.0056,0.6464
CLUBS SEVEN HEARTS EIGHT,0.545,0.0174,0.4376
CLUBS THREE HEARTS EIGHT,0.5916,0.0206,0.3878
SPADES TEN SPADES FOUR,0.5448,0.0206,0.4346
SPADES JACK SPADES FOUR,0.2078,0.4742,0.318
HEARTS NINE HEARTS EIGHT,0.519,0.0154,0.4656
SPADES QUEEN SPADES FOUR,0.3394,0.0098,0.6508
SPADES KING SPADES FOUR,0.3422,0.0094,0.6484
SPADES ACE SPADES FOUR,0.325,0.005,0.67
HEARTS KING HEARTS TEN,0.3122,0.007,0.6808
HEARTS QUEEN HEARTS TEN,0.309,0.0114,0.6796
HEARTS ACE HEARTS TEN,0.3182,0.0068,0.675
CLUBS JACK HEARTS SEVEN,0.2172,0.3048,0.478
CLUBS TEN HEARTS SEVEN,0.5528,0.0198,0.4274
CLUBS KING HEARTS SEVEN,0.3602,0.009,0.6308
HEARTS SEVEN CLUBS QUEEN,0.352,0.0112,0.6368
CLUBS ACE HEARTS SEVEN,0.3616,0.0058,0.6326
CLUBS SEVEN HEARTS ACE,0.3372,0.0066,0.6562
CLUBS SEVEN HEARTS KING,0.347,0.0088,0.6442
CLUBS SEVEN HEARTS QUEEN,0.3528,0.0112,0.636
CLUBS SEVEN HEARTS TEN,0.5572,0.017,0.4258
CLUBS TEN CLUBS THREE,0.5542,0.0208,0.425
CLUBS JACK CLUBS THREE,0.2056,0.4876,0.3068
CLUBS THREE CLUBS ACE,0.3422,0.0056,0.6522
CLUBS THREE CLUBS QUEEN,0.3318,0.0128,0.6554
CLUBS THREE CLUBS KING,0.341,0.011,0.648
SPADES ACE CLUBS ACE,0.1122,0.0044,0.8834
SPADES KING CLUBS ACE,0.3064,0.0038,0.6898
SPADES QUEEN CLUBS ACE,0.312,0.0056,0.6824
SPADES JACK CLUBS ACE,0.2148,0.0206,0.7646
SPADES TEN CLUBS ACE,0.3406,0.0056,0.6538
SPADES EIGHT HEARTS NINE,0.5408,0.0212,0.438
SPADES NINE HEARTS NINE,0.284,0.0292,0.6868
SPADES SIX HEARTS NINE,0.56,0.0182,0.4218
SPADES SEVEN HEARTS NINE,0.5608,0.0218,0.4174
CLUBS SEVEN HEARTS NINE,0.5458,0.0182,0.436
CLUBS SIX HEARTS NINE,0.5786,0.0196,0.4018
CLUBS FIVE HEARTS NINE,0.5884,0.0168,0.3948
CLUBS FOUR HEARTS NINE,0.5856,0.0182,0.3962
CLUBS THREE HEARTS NINE,0.5892,0.0186,0.3922
SPADES FIVE HEARTS NINE,0.5746,0.0204,0.405
SPADES FOUR HEARTS NINE,0.5888,0.0186,0.3926
SPADES THREE HEARTS NINE,0.6088,0.02,0.3712
SPADES TWO HEARTS NINE,0.709,0.0554,0.2356
CLUBS NINE HEARTS NINE,0.2708,0.0296,0.6996
CLUBS EIGHT HEARTS NINE,0.5454,0.0156,0.439
