opposingHand,winningChance,drawChance,lostChance
HEARTS FIVE DIAMONDS NINE,0.571,0.0206,0.4084
SPADES ACE CLUBS FOUR,0.3428,0.0042,0.653
DIAMONDS QUEEN DIAMONDS NINE,0.3046,0.012,0.6834
HEARTS TWO DIAMONDS NINE,0.7018,0.0548,0.2434
SPADES KING CLUBS FOUR,0.3476,0.0078,0.6446
DIAMONDS KING DIAMONDS NINE,0.3314,0.0072,0.6614
HEARTS THREE DIAMONDS NINE,0.5898,0.018,0.3922
SPADES QUEEN CLUBS FOUR,0.3576,0.0092,0.6332
DIAMONDS NINE DIAMONDS JACK,0.2034,0.1668,0.6298
CLUBS EIGHT SPADES NINE,0.5324,0.0148,0.4528
DIAMONDS NINE DIAMONDS TEN,0.4856,0.0176,0.4968
CLUBS EIGHT SPADES EIGHT,0.288,0.0354,0.6766
CLUBS EIGHT SPADES SEVEN,0.5332,0.0188,0.448
CLUBS EIGHT SPADES SIX,0.5626,0.0172,0.4202
CLUBS EIGHT SPADES FIVE,0.5602,0.0166,0.4232
CLUBS EIGHT SPADES FOUR,0.5712,0.0204,0.4084
CLUBS EIGHT SPADES THREE,0.5954,0.0176,0.387
CLUBS EIGHT SPADES TWO,0.7054,0.0558,0.2388
HEARTS SIX DIAMONDS TEN,0.5732,0.017,0.4098
DIAMONDS TEN HEARTS SEVEN,0.5496,0.0148,0.4356
DIAMONDS TEN HEARTS EIGHT,0.5574,0.0162,0.4264
CLUBS JACK CLUBS FOUR,0.2068,0.4948,0.2984
DIAMONDS TEN HEARTS NINE,0.5472,0.0156,0.4372
CLUBS TEN CLUBS FOUR,0.5488,0.0186,0.4326
CLUBS FOUR CLUBS KING,0.3452,0.011,0.6438
CLUBS FOUR CLUBS QUEEN,0.3378,0.0114,0.6508
CLUBS THREE DIAMONDS TEN,0.5934,0.0166,0.39
CLUBS FOUR CLUBS ACE,0.339,0.005,0.656
DIAMONDS JACK DIAMONDS TEN,0.2206,0.1096,0.6698
DIAMONDS QUEEN DIAMONDS TEN,0.2984,0.0114,0.6902
HEARTS TWO DIAMONDS TEN,0.7016,0.0576,0.2408
DIAMONDS KING DIAMONDS TEN,0.3146,0.0068,0.6786
HEARTS THREE DIAMONDS TEN,0.6008,0.0228,0.3764
DIAMONDS ACE DIAMONDS TEN,0.3182,0.0056,0.6762
HEARTS FOUR DIAMONDS TEN,0.5878,0.0184,0.3938
HEARTS FIVE DIAMONDS TEN,0.5946,0.0174,0.388
CLUBS EIGHT HEARTS TEN,0.5492,0.0156,0.4352
CLUBS EIGHT HEARTS QUEEN,0.3364,0.0102,0.6534
CLUBS EIGHT HEARTS KING,0.348,0.0058,0.6462
CLUBS EIGHT HEARTS ACE,0.3412,0.0058,0.653
CLUBS NINE SPADES THREE,0.587,0.022,0.391
CLUBS NINE SPADES TWO,0.7096,0.0578,0.2326
CLUBS NINE SPADES FIVE,0.579,0.0226,0.3984
CLUBS NINE SPADES FOUR,0.5956,0.019,0.3854
CLUBS NINE SPADES SEVEN,0.5524,0.016,0.4316
CLUBS NINE SPADES SIX,0.564,0.0204,0.4156
CLUBS NINE SPADES NINE,0.2752,0.0276,0.6972
CLUBS TEN HEARTS EIGHT,0.549,0.016,0.435
CLUBS NINE SPADES EIGHT,0.5402,0.0156,0.4442
CLUBS JACK HEARTS EIGHT,0.2232,0.2298,0.547
CLUBS QUEEN HEARTS EIGHT,0.3486,0.013,0.6384
CLUBS KING HEARTS EIGHT,0.3708,0.0076,0.6216
CLUBS ACE HEARTS EIGHT,0.3522,0.0066,0.6412
SPADES KING CLUBS KING,0.1252,0.0082,0.8666
SPADES QUEEN CLUBS KING,0.3108,0.0072,0.682
SPADES ACE CLUBS KING,0.3044,0.0042,0.6914
DIAMONDS ACE HEARTS TEN,0.3454,0.0054,0.6492
HEARTS FOUR HEARTS TEN,0.5532,0.0212,0.4256
SPADES KING CLUBS FIVE,0.365,0.0082,0.6268
SPADES QUEEN CLUBS FIVE,0.3556,0.0126,0.6318
SPADES ACE CLUBS FIVE,0.3292,0.004,0.6668
DIAMONDS JACK HEARTS SEVEN,0.2212,0.2956,0.4832
HEARTS SIX DIAMONDS JACK,0.227,0.3872,0.3858
DIAMONDS JACK HEARTS NINE,0.226,0.1712,0.6028
DIAMONDS JACK HEARTS EIGHT,0.2278,0.2256,0.5466
DIAMONDS KING DIAMONDS JACK,0.2128,0.0324,0.7548
HEARTS THREE DIAMONDS JACK,0.2176,0.52,0.2624
SPADES ACE SPADES SIX,0.336,0.0032,0.6608
HEARTS ACE SPADES FOUR,0.334,0.0066,0.6594
DIAMONDS QUEEN DIAMONDS JACK,0.2154,0.0426,0.742
HEARTS TWO DIAMONDS JACK,0.018,0.9704,0.0116
HEARTS FIVE DIAMONDS JACK,0.2154,0.462,0.3226
SPADES QUEEN SPADES SIX,0.3416,0.0112,0.6472
SPADES FOUR HEARTS QUEEN,0.3546,0.0144,0.631
DIAMONDS ACE DIAMONDS JACK,0.2008,0.018,0.7812
HEARTS FOUR DIAMONDS JACK,0.214,0.5182,0.2678
SPADES KING SPADES SIX,0.3428,0.0068,0.6504
SPADES FOUR HEARTS KING,0.3566,0.009,0.6344
SPADES TEN SPADES SIX,0.5398,0.0198,0.4404
SPADES JACK SPADES SIX,0.2118,0.3608,0.4274
SPADES FOUR DIAMONDS JACK,0.2208,0.5124,0.2668
SPADES FIVE DIAMONDS JACK,0.219,0.4552,0.3258
DIAMONDS JACK SPADES TWO,0.0202,0.9604,0.0194
DIAMONDS JACK SPADES THREE,0.2258,0.5118,0.2624
SPADES ACE DIAMONDS THREE,0.3556,0.0058,0.6386
CLUBS EIGHT DIAMONDS JACK,0.2136,0.2134,0.573
SPADES QUEEN DIAMONDS THREE,0.3696,0.0142,0.6162
SPADES KING DIAMONDS THREE,0.363,0.007,0.63
CLUBS NINE DIAMONDS JACK,0.2122,0.1754,0.6124
CLUBS SIX DIAMONDS JACK,0.224,0.3888,0.3872
CLUBS SEVEN DIAMONDS JACK,0.219,0.2926,0.4884
CLUBS FOUR DIAMONDS JACK,0.2086,0.523,0.2684
CLUBS FIVE DIAMONDS JACK,0.2148,0.458,0.3272
CLUBS THREE DIAMONDS JACK,0.2154,0.5218,0.2628
SPADES TEN CLUBS FIVE,0.5792,0.019,0.4018
HEARTS SIX SPADES JACK,0.2194,0.3938,0.3868
HEARTS SIX SPADES TEN,0.5756,0.0192,0.4052
SPADES JACK CLUBS FIVE,0.2126,0.4708,0.3166
SPADES JACK DIAMONDS THREE,0.2214,0.5152,0.2634
CLUBS SEVEN CLUBS ACE,0.3258,0.0068,0.6674
DIAMONDS THREE SPADES TEN,0.5812,0.018,0.4008
CLUBS SEVEN CLUBS QUEEN,0.337,0.0114,0.6516
CLUBS SEVEN CLUBS KING,0.3368,0.009,0.6542
SPADES NINE DIAMONDS JACK,0.226,0.1566,0.6174
CLUBS TEN CLUBS SEVEN,0.5354,0.018,0.4466
DIAMONDS ACE HEARTS ACE,0.1188,0.0032,0.878
HEARTS FOUR HEARTS ACE,0.32,0.0048,0.6752
SPADES EIGHT DIAMONDS JACK,0.2328,0.2208,0.5464
SPADES ACE HEARTS SIX,0.3698,0.0032,0.627
CLUBS JACK CLUBS SEVEN,0.2094,0.285,0.5056
DIAMONDS ACE HEARTS KING,0.3132,0.0066,0.6802
HEARTS FOUR HEARTS KING,0.3314,0.0122,0.6564
SPADES SEVEN DIAMONDS JACK,0.2216,0.2832,0.4952
SPADES KING HEARTS SIX,0.3742,0.0102,0.6156
DIAMONDS ACE HEARTS QUEEN,0.3014,0.0048,0.6938
HEARTS FOUR HEARTS QUEEN,0.3326,0.0142,0.6532
SPADES QUEEN HEARTS SIX,0.3728,0.0106,0.6166
SPADES SIX DIAMONDS JACK,0.231,0.3832,0.3858
DIAMONDS TEN SPADES TWO,0.7098,0.0496,0.2406
SPADES THREE DIAMONDS TEN,0.5922,0.019,0.3888
SPADES FOUR DIAMONDS TEN,0.593,0.017,0.39
SPADES FIVE DIAMONDS TEN,0.5938,0.0164,0.3898
SPADES SIX DIAMONDS TEN,0.5752,0.0154,0.4094
SPADES SEVEN DIAMONDS TEN,0.555,0.0156,0.4294
SPADES EIGHT DIAMONDS TEN,0.5494,0.017,0.4336
SPADES NINE DIAMONDS TEN,0.5222,0.0154,0.4624
CLUBS FOUR DIAMONDS TEN,0.5778,0.0198,0.4024
CLUBS FIVE DIAMONDS TEN,0.5846,0.0166,0.3988
CLUBS SIX DIAMONDS TEN,0.5734,0.0188,0.4078
CLUBS SEVEN DIAMONDS TEN,0.5578,0.015,0.4272
CLUBS EIGHT DIAMONDS TEN,0.5434,0.0186,0.438
CLUBS NINE DIAMONDS TEN,0.527,0.0144,0.4586
CLUBS JACK DIAMONDS THREE,0.1988,0.5266,0.2746
CLUBS TEN DIAMONDS THREE,0.5804,0.0168,0.4028
DIAMONDS THREE CLUBS KING,0.358,0.008,0.634
DIAMONDS THREE CLUBS QUEEN,0.3488,0.0116,0.6396
DIAMONDS THREE CLUBS ACE,0.3308,0.0052,0.664
SPADES FOUR HEARTS TEN,0.5874,0.0156,0.397
SPADES FIVE SPADES TWO,0.641,0.0526,0.3064
SPADES FOUR SPADES TWO,0.6454,0.0504,0.3042
SPADES THREE SPADES TWO,0.6356,0.051,0.3134
SPADES NINE SPADES TWO,0.6534,0.0524,0.2942
SPADES EIGHT SPADES TWO,0.6694,0.051,0.2796
SPADES SEVEN SPADES TWO,0.6486,0.0564,0.295
SPADES SIX SPADES TWO,0.6448,0.048,0.3072
DIAMONDS QUEEN CLUBS THREE,0.3634,0.0148,0.6218
HEARTS TWO CLUBS THREE,0.6866,0.059,0.2544
DIAMONDS QUEEN HEARTS SEVEN,0.3638,0.0088,0.6274
HEARTS TWO HEARTS SEVEN,0.6728,0.0522,0.275
HEARTS SIX DIAMONDS QUEEN,0.362,0.0096,0.6284
HEARTS SIX HEARTS TWO,0.673,0.0472,0.2798
DIAMONDS QUEEN HEARTS NINE,0.3398,0.0106,0.6496
HEARTS TWO HEARTS NINE,0.6898,0.0528,0.2574
DIAMONDS QUEEN HEARTS EIGHT,0.3638,0.0112,0.625
HEARTS TWO HEARTS EIGHT,0.677,0.053,0.27
CLUBS NINE HEARTS TWO,0.7086,0.0556,0.2358
CLUBS NINE DIAMONDS QUEEN,0.35,0.012,0.638
CLUBS EIGHT DIAMONDS QUEEN,0.3486,0.0128,0.6386
CLUBS EIGHT HEARTS TWO,0.7168,0.055,0.2282
DIAMONDS QUEEN CLUBS FIVE,0.3496,0.0112,0.6392
HEARTS TWO CLUBS FIVE,0.6746,0.0602,0.2652
SPADES EIGHT HEARTS ACE,0.3496,0.006,0.6444
DIAMONDS QUEEN CLUBS FOUR,0.3444,0.0126,0.643
CLUBS FOUR HEARTS TWO,0.6864,0.0522,0.2614
CLUBS SEVEN DIAMONDS QUEEN,0.356,0.0108,0.6332
CLUBS SEVEN HEARTS TWO,0.7104,0.0478,0.2418
SPADES EIGHT HEARTS QUEEN,0.3404,0.0122,0.6474
CLUBS SIX DIAMONDS QUEEN,0.3598,0.0112,0.629
CLUBS SIX HEARTS TWO,0.703,0.0478,0.2492
SPADES EIGHT HEARTS KING,0.3438,0.008,0.6482
HEARTS TWO SPADES SIX,0.6942,0.048,0.2578
DIAMONDS QUEEN SPADES SIX,0.3672,0.01,0.6228
HEARTS FOUR CLUBS QUEEN,0.3584,0.0146,0.627
DIAMONDS ACE CLUBS QUEEN,0.3114,0.003,0.6856
DIAMONDS QUEEN SPADES SEVEN,0.369,0.01,0.621
HEARTS TWO SPADES SEVEN,0.7116,0.0512,0.2372
HEARTS FOUR CLUBS KING,0.3588,0.0076,0.6336
DIAMONDS ACE CLUBS KING,0.3154,0.0054,0.6792
DIAMONDS QUEEN SPADES EIGHT,0.3416,0.0088,0.6496
SPADES EIGHT HEARTS TWO,0.7172,0.051,0.2318
HEARTS FOUR CLUBS ACE,0.3448,0.0072,0.648
DIAMONDS ACE CLUBS ACE,0.1076,0.0042,0.8882
SPADES NINE DIAMONDS QUEEN,0.3356,0.011,0.6534
SPADES NINE HEARTS TWO,0.7138,0.0524,0.2338
HEARTS TWO SPADES TWO,0.2932,0.0366,0.6702
DIAMONDS QUEEN SPADES TWO,0.2454,0.0376,0.717
HEARTS TWO SPADES THREE,0.685,0.0582,0.2568
DIAMONDS QUEEN SPADES THREE,0.3414,0.0132,0.6454
HEARTS TWO SPADES FOUR,0.6902,0.0546,0.2552
DIAMONDS QUEEN SPADES FOUR,0.3504,0.0098,0.6398
CLUBS TEN HEARTS FOUR,0.5892,0.0202,0.3906
CLUBS TEN DIAMONDS ACE,0.339,0.004,0.657
HEARTS TWO SPADES FIVE,0.6772,0.0572,0.2656
DIAMONDS QUEEN SPADES FIVE,0.3584,0.0108,0.6308
HEARTS FOUR CLUBS JACK,0.203,0.5222,0.2748
CLUBS JACK DIAMONDS ACE,0.2222,0.0178,0.76
CLUBS FIVE CLUBS KING,0.3562,0.0094,0.6344
CLUBS FIVE CLUBS QUEEN,0.3366,0.0138,0.6496
CLUBS FIVE CLUBS ACE,0.3368,0.006,0.6572
CLUBS JACK CLUBS FIVE,0.2168,0.4356,0.3476
CLUBS TEN CLUBS FIVE,0.5468,0.0188,0.4344
SPADES KING CLUBS JACK,0.2176,0.0298,0.7526
CLUBS JACK SPADES QUEEN,0.226,0.0432,0.7308
SPADES ACE CLUBS JACK,0.2132,0.0194,0.7674
SPADES SIX CLUBS KING,0.355,0.0054,0.6396
SPADES SIX CLUBS QUEEN,0.362,0.0096,0.6284
SPADES SIX CLUBS ACE,0.3534,0.0044,0.6422
SPADES EIGHT HEARTS TEN,0.5404,0.019,0.4406
CLUBS JACK SPADES SIX,0.2142,0.3936,0.3922
CLUBS TEN SPADES SIX,0.5714,0.0174,0.4112
CLUBS JACK SPADES TEN,0.2138,0.1196,0.6666
CLUBS JACK SPADES JACK,0.0732,0.0386,0.8882
SPADES QUEEN CLUBS SEVEN,0.36,0.0096,0.6304
SPADES KING CLUBS SEVEN,0.3454,0.0096,0.645
SPADES ACE CLUBS SEVEN,0.3516,0.004,0.6444
SPADES SIX HEARTS TEN,0.5784,0.0156,0.406
SPADES SIX HEARTS ACE,0.3568,0.0064,0.6368
SPADES SIX HEARTS KING,0.3662,0.0082,0.6256
SPADES SIX HEARTS QUEEN,0.3496,0.0116,0.6388
SPADES JACK CLUBS SEVEN,0.2142,0.2928,0.493
SPADES TEN CLUBS SEVEN,0.5594,0.0166,0.424
CLUBS TEN HEARTS SIX,0.5756,0.0154,0.409
CLUBS JACK HEARTS SIX,0.2106,0.3948,0.3946
CLUBS JACK CLUBS ACE,0.2076,0.023,0.7694
HEARTS SIX CLUBS QUEEN,0.3506,0.0162,0.6332
HEARTS SIX CLUBS KING,0.3522,0.0058,0.642
HEARTS SIX CLUBS ACE,0.353,0.006,0.641
CLUBS JACK CLUBS QUEEN,0.2128,0.0428,0.7444
CLUBS JACK CLUBS KING,0.213,0.0364,0.7506
DIAMONDS THREE HEARTS ACE,0.343,0.0064,0.6506
DIAMONDS THREE HEARTS QUEEN,0.3472,0.0126,0.6402
DIAMONDS THREE HEARTS KING,0.365,0.008,0.627
SPADES TEN DIAMONDS ACE,0.3388,0.0042,0.657
HEARTS FOUR SPADES TEN,0.5822,0.0238,0.394
CLUBS FIVE HEARTS TEN,0.5886,0.018,0.3934
HEARTS FOUR SPADES JACK,0.2114,0.521,0.2676
SPADES JACK DIAMONDS ACE,0.2098,0.0222,0.768
SPADES ACE HEARTS FOUR,0.34,0.0058,0.6542
SPADES ACE DIAMONDS ACE,0.1272,0.003,0.8698
CLUBS FIVE HEARTS ACE,0.3336,0.0042,0.6622
CLUBS FIVE HEARTS KING,0.3492,0.0116,0.6392
HEARTS FOUR SPADES QUEEN,0.361,0.0112,0.6278
SPADES QUEEN DIAMONDS ACE,0.3114,0.0046,0.684
CLUBS JACK SPADES FOUR,0.207,0.5278,0.2652
CLUBS FIVE HEARTS QUEEN,0.352,0.0132,0.6348
SPADES KING DIAMONDS ACE,0.3154,0.0044,0.6802
HEARTS FOUR SPADES KING,0.3594,0.0086,0.632
CLUBS TEN SPADES FOUR,0.5936,0.019,0.3874
DIAMONDS QUEEN DIAMONDS ACE,0.2852,0.0034,0.7114
HEARTS TWO DIAMONDS ACE,0.2426,0.0182,0.7392
HEARTS FOUR DIAMONDS QUEEN,0.3358,0.0132,0.651
HEARTS FOUR HEARTS TWO,0.6558,0.0548,0.2894
DIAMONDS THREE HEARTS TEN,0.5818,0.0204,0.3978
SPADES FOUR CLUBS KING,0.352,0.0054,0.6426
HEARTS FIVE DIAMONDS QUEEN,0.363,0.0126,0.6244
HEARTS FIVE HEARTS TWO,0.6616,0.049,0.2894
SPADES FOUR CLUBS QUEEN,0.3572,0.0112,0.6316
DIAMONDS QUEEN HEARTS TWO,0.2456,0.0434,0.711
DIAMONDS KING DIAMONDS QUEEN,0.2832,0.0068,0.71
DIAMONDS KING HEARTS TWO,0.2342,0.0318,0.734
HEARTS THREE DIAMONDS QUEEN,0.3622,0.0132,0.6246
HEARTS THREE HEARTS TWO,0.6564,0.0582,0.2854
SPADES FOUR CLUBS ACE,0.3508,0.0024,0.6468
HEARTS TWO CLUBS ACE,0.2374,0.0176,0.745
DIAMONDS QUEEN CLUBS ACE,0.3194,0.0056,0.675
HEARTS TWO CLUBS QUEEN,0.2316,0.0442,0.7242
DIAMONDS QUEEN CLUBS QUEEN,0.1294,0.0096,0.861
HEARTS TWO CLUBS KING,0.231,0.0308,0.7382
DIAMONDS QUEEN CLUBS KING,0.307,0.006,0.687
SPADES EIGHT SPADES FIVE,0.5322,0.0208,0.447
CLUBS TEN HEARTS TWO,0.7128,0.0608,0.2264
CLUBS TEN DIAMONDS QUEEN,0.3196,0.0116,0.6688
SPADES NINE SPADES FIVE,0.5416,0.0224,0.436
CLUBS JACK HEARTS TWO,0.0058,0.9846,0.0096
CLUBS JACK DIAMONDS QUEEN,0.2074,0.046,0.7466
SPADES SIX SPADES FIVE,0.5166,0.0188,0.4646
SPADES SEVEN SPADES FIVE,0.5038,0.019,0.4772
DIAMONDS FIVE CLUBS QUEEN,0.3524,0.0106,0.637
SPADES EIGHT CLUBS ACE,0.3458,0.004,0.6502
DIAMONDS FIVE CLUBS KING,0.3546,0.0076,0.6378
SPADES EIGHT CLUBS KING,0.361,0.0088,0.6302
DIAMONDS FIVE CLUBS ACE,0.345,0.0048,0.6502
SPADES EIGHT CLUBS QUEEN,0.3406,0.0104,0.649
CLUBS JACK SPADES EIGHT,0.2164,0.2202,0.5634
CLUBS TEN SPADES EIGHT,0.5336,0.0186,0.4478
CLUBS TEN DIAMONDS FIVE,0.5876,0.0196,0.3928
CLUBS JACK DIAMONDS FIVE,0.2074,0.476,0.3166
DIAMONDS TEN HEARTS TEN,0.2748,0.0234,0.7018
SPADES ACE CLUBS NINE,0.3434,0.005,0.6516
SPADES QUEEN CLUBS NINE,0.3376,0.0116,0.6508
SPADES KING CLUBS NINE,0.3428,0.0076,0.6496
HEARTS SIX HEARTS KING,0.3532,0.0082,0.6386
DIAMONDS KING SPADES SEVEN,0.3708,0.0074,0.6218
HEARTS THREE SPADES SEVEN,0.5874,0.022,0.3906
SPADES KING DIAMONDS SEVEN,0.354,0.0092,0.6368
HEARTS SIX HEARTS QUEEN,0.3442,0.0092,0.6466
SPADES QUEEN DIAMONDS SEVEN,0.3568,0.01,0.6332
HEARTS THREE SPADES SIX,0.5836,0.0232,0.3932
DIAMONDS KING SPADES SIX,0.3616,0.0078,0.6306
DIAMONDS KING SPADES NINE,0.3542,0.0082,0.6376
HEARTS THREE SPADES NINE,0.5886,0.0186,0.3928
HEARTS SIX HEARTS ACE,0.343,0.0054,0.6516
DIAMONDS KING SPADES EIGHT,0.3622,0.0062,0.6316
HEARTS THREE SPADES EIGHT,0.5892,0.0172,0.3936
SPADES ACE DIAMONDS SEVEN,0.3532,0.0034,0.6434
HEARTS THREE CLUBS NINE,0.5978,0.02,0.3822
CLUBS NINE DIAMONDS KING,0.346,0.007,0.647
CLUBS EIGHT DIAMONDS KING,0.3504,0.0076,0.642
HEARTS THREE CLUBS EIGHT,0.5962,0.0228,0.381
HEARTS THREE SPADES THREE,0.325,0.0554,0.6196
DIAMONDS KING SPADES THREE,0.3556,0.0098,0.6346
HEARTS THREE SPADES TWO,0.6908,0.0582,0.251
DIAMONDS KING SPADES TWO,0.2456,0.0268,0.7276
HEARTS THREE SPADES FIVE,0.5672,0.0224,0.4104
DIAMONDS KING SPADES FIVE,0.3542,0.0082,0.6376
HEARTS THREE SPADES FOUR,0.5552,0.0208,0.424
DIAMONDS KING SPADES FOUR,0.3732,0.01,0.6168
DIAMONDS KING CLUBS THREE,0.3568,0.0068,0.6364
HEARTS THREE CLUBS THREE,0.3006,0.057,0.6424
DIAMONDS KING CLUBS FOUR,0.3522,0.0078,0.64
HEARTS THREE CLUBS FOUR,0.5678,0.0268,0.4054
DIAMONDS KING CLUBS FIVE,0.352,0.0088,0.6392
HEARTS THREE CLUBS FIVE,0.5588,0.0248,0.4164
CLUBS SIX DIAMONDS KING,0.357,0.0094,0.6336
HEARTS THREE CLUBS SIX,0.5844,0.02,0.3956
DIAMONDS KING CLUBS SEVEN,0.3528,0.0086,0.6386
HEARTS THREE CLUBS SEVEN,0.5736,0.0238,0.4026
HEARTS THREE DIAMONDS KING,0.3628,0.0104,0.6268
DIAMONDS KING DIAMONDS ACE,0.291,0.0052,0.7038
HEARTS THREE DIAMONDS ACE,0.3442,0.0046,0.6512
HEARTS FOUR DIAMONDS KING,0.3612,0.0074,0.6314
HEARTS FOUR HEARTS THREE,0.5414,0.0222,0.4364
HEARTS FIVE DIAMONDS KING,0.3732,0.0092,0.6176
HEARTS THREE HEARTS FIVE,0.5486,0.022,0.4294
HEARTS SIX DIAMONDS KING,0.3754,0.0112,0.6134
HEARTS THREE HEARTS SIX,0.5538,0.021,0.4252
DIAMONDS KING HEARTS SEVEN,0.3582,0.0094,0.6324
HEARTS THREE HEARTS SEVEN,0.564,0.0224,0.4136
DIAMONDS KING HEARTS EIGHT,0.374,0.0078,0.6182
HEARTS THREE HEARTS EIGHT,0.5694,0.0248,0.4058
HEARTS SIX HEARTS TEN,0.5502,0.0184,0.4314
SPADES TEN DIAMONDS SEVEN,0.5512,0.018,0.4308
DIAMONDS KING HEARTS NINE,0.3464,0.007,0.6466
HEARTS THREE HEARTS NINE,0.5582,0.0208,0.421
SPADES JACK DIAMONDS SEVEN,0.2226,0.296,0.4814
HEARTS FIVE CLUBS FOUR,0.5408,0.021,0.4382
SPADES SIX SPADES FOUR,0.5266,0.0198,0.4536
HEARTS FIVE CLUBS FIVE,0.3032,0.0478,0.649
SPADES SEVEN SPADES FOUR,0.5366,0.019,0.4444
HEARTS FIVE CLUBS SIX,0.5616,0.0178,0.4206
SPADES EIGHT SPADES FOUR,0.5506,0.0166,0.4328
HEARTS FIVE CLUBS SEVEN,0.5564,0.0192,0.4244
SPADES NINE SPADES FOUR,0.5566,0.0174,0.426
SPADES QUEEN DIAMONDS FIVE,0.3598,0.013,0.6272
SPADES KING DIAMONDS FIVE,0.3444,0.0092,0.6464
SPADES ACE DIAMONDS FIVE,0.3442,0.0048,0.651
HEARTS FIVE CLUBS THREE,0.563,0.0234,0.4136
SPADES FIVE SPADES FOUR,0.5118,0.024,0.4642
HEARTS FIVE SPADES TWO,0.6756,0.053,0.2714
HEARTS FIVE SPADES THREE,0.5768,0.0224,0.4008
HEARTS FIVE SPADES FOUR,0.5518,0.02,0.4282
HEARTS FIVE SPADES FIVE,0.3042,0.0498,0.646
CLUBS EIGHT HEARTS FIVE,0.5572,0.0174,0.4254
CLUBS NINE HEARTS FIVE,0.571,0.0186,0.4104
HEARTS KING DIAMONDS TEN,0.3374,0.0068,0.6558
HEARTS QUEEN DIAMONDS TEN,0.324,0.0096,0.6664
HEARTS ACE DIAMONDS TEN,0.34,0.0044,0.6556
HEARTS FIVE HEARTS SEVEN,0.5192,0.0212,0.4596
HEARTS SIX HEARTS FIVE,0.5262,0.0232,0.4506
HEARTS FIVE HEARTS NINE,0.5532,0.0206,0.4262
CLUBS NINE SPADES TEN,0.5284,0.0162,0.4554
HEARTS FIVE HEARTS EIGHT,0.541,0.0214,0.4376
SPADES JACK CLUBS NINE,0.2182,0.1704,0.6114
CLUBS SIX DIAMONDS ACE,0.365,0.0056,0.6294
HEARTS FOUR CLUBS SIX,0.5674,0.021,0.4116
SPADES EIGHT SPADES THREE,0.559,0.017,0.424
CLUBS SEVEN DIAMONDS ACE,0.3504,0.0048,0.6448
HEARTS FOUR CLUBS SEVEN,0.5676,0.0226,0.4098
SPADES NINE SPADES THREE,0.5436,0.0204,0.436
CLUBS FOUR DIAMONDS ACE,0.3474,0.0042,0.6484
HEARTS FOUR CLUBS FOUR,0.312,0.0496,0.6384
SPADES SIX SPADES THREE,0.5464,0.0164,0.4372
CLUBS FIVE DIAMONDS ACE,0.3396,0.0054,0.655
HEARTS FOUR CLUBS FIVE,0.5318,0.0262,0.442
SPADES SEVEN SPADES THREE,0.543,0.0228,0.4342
CLUBS EIGHT DIAMONDS ACE,0.3456,0.003,0.6514
HEARTS FOUR CLUBS EIGHT,0.5764,0.0216,0.402
HEARTS FOUR CLUBS NINE,0.5966,0.0208,0.3826
CLUBS NINE DIAMONDS ACE,0.354,0.0048,0.6412
HEARTS FOUR SPADES FOUR,0.3016,0.0518,0.6466
DIAMONDS ACE SPADES FOUR,0.3488,0.0036,0.6476
HEARTS FOUR SPADES FIVE,0.5562,0.0212,0.4226
DIAMONDS ACE SPADES FIVE,0.3488,0.0068,0.6444
HEARTS FOUR SPADES TWO,0.6978,0.051,0.2512
DIAMONDS ACE SPADES TWO,0.237,0.0154,0.7476
HEARTS FOUR SPADES THREE,0.5736,0.0246,0.4018
DIAMONDS ACE SPADES THREE,0.3556,0.0036,0.6408
SPADES EIGHT DIAMONDS ACE,0.353,0.0044,0.6426
HEARTS FOUR SPADES EIGHT,0.5896,0.0214,0.389
SPADES FOUR SPADES THREE,0.5354,0.0192,0.4454
SPADES NINE DIAMONDS ACE,0.3584,0.0024,0.6392
HEARTS FOUR SPADES NINE,0.5934,0.0202,0.3864
SPADES FIVE SPADES THREE,0.5342,0.0188,0.447
HEARTS FOUR SPADES SIX,0.559,0.0218,0.4192
DIAMONDS ACE SPADES SIX,0.3658,0.004,0.6302
SPADES SEVEN DIAMONDS ACE,0.354,0.0038,0.6422
HEARTS FOUR SPADES SEVEN,0.5618,0.022,0.4162
SPADES QUEEN SPADES EIGHT,0.3098,0.0098,0.6804
CLUBS JACK DIAMONDS TEN,0.2124,0.1326,0.655
CLUBS JACK DIAMONDS SEVEN,0.2124,0.2972,0.4904
SPADES KING SPADES EIGHT,0.34,0.007,0.653
CLUBS TEN DIAMONDS TEN,0.2598,0.0204,0.7198
CLUBS TEN DIAMONDS SEVEN,0.5562,0.017,0.4268
SPADES ACE SPADES EIGHT,0.33,0.0058,0.6642
HEARTS FIVE DIAMONDS ACE,0.3526,0.0052,0.6422
HEARTS FOUR HEARTS FIVE,0.535,0.022,0.443
HEARTS FOUR DIAMONDS ACE,0.3506,0.0056,0.6438
DIAMONDS TEN CLUBS ACE,0.3346,0.0054,0.66
CLUBS ACE DIAMONDS SEVEN,0.3552,0.0036,0.6412
DIAMONDS TEN CLUBS KING,0.3202,0.0072,0.6726
CLUBS KING DIAMONDS SEVEN,0.3506,0.0068,0.6426
DIAMONDS TEN CLUBS QUEEN,0.3212,0.0104,0.6684
DIAMONDS SEVEN CLUBS QUEEN,0.3598,0.0142,0.626
DIAMONDS ACE HEARTS NINE,0.36,0.0058,0.6342
HEARTS FOUR HEARTS NINE,0.5604,0.0236,0.416
SPADES KING SPADES JACK,0.2174,0.0292,0.7534
CLUBS TEN CLUBS NINE,0.502,0.0122,0.4858
DIAMONDS ACE HEARTS EIGHT,0.341,0.0046,0.6544
HEARTS FOUR HEARTS EIGHT,0.5556,0.016,0.4284
SPADES QUEEN SPADES JACK,0.212,0.0452,0.7428
CLUBS JACK CLUBS NINE,0.2076,0.1656,0.6268
DIAMONDS ACE HEARTS SEVEN,0.3424,0.0064,0.6512
HEARTS FOUR HEARTS SEVEN,0.5312,0.0194,0.4494
HEARTS SIX DIAMONDS ACE,0.3604,0.0036,0.636
HEARTS FOUR HEARTS SIX,0.5352,0.0196,0.4452
SPADES ACE SPADES JACK,0.1996,0.0192,0.7812
HEARTS ACE HEARTS QUEEN,0.3078,0.0056,0.6866
DIAMONDS ACE CLUBS THREE,0.345,0.0066,0.6484
HEARTS FOUR CLUBS THREE,0.5568,0.0228,0.4204
SPADES JACK DIAMONDS FIVE,0.2138,0.4538,0.3324
CLUBS NINE CLUBS ACE,0.3408,0.005,0.6542
SPADES TEN DIAMONDS FIVE,0.585,0.0164,0.3986
SPADES TEN SPADES EIGHT,0.5214,0.018,0.4606
CLUBS NINE CLUBS QUEEN,0.3262,0.0108,0.663
HEARTS QUEEN HEARTS KING,0.2912,0.009,0.6998
SPADES JACK SPADES EIGHT,0.213,0.209,0.578
CLUBS NINE CLUBS KING,0.3288,0.009,0.6622
DIAMONDS QUEEN HEARTS TEN,0.3406,0.0086,0.6508
HEARTS TWO HEARTS TEN,0.684,0.056,0.26
DIAMONDS QUEEN HEARTS KING,0.3052,0.0096,0.6852
HEARTS TWO HEARTS KING,0.2228,0.029,0.7482
DIAMONDS QUEEN HEARTS QUEEN,0.1338,0.0102,0.856
HEARTS TWO HEARTS QUEEN,0.2284,0.0328,0.7388
DIAMONDS QUEEN HEARTS ACE,0.2942,0.0042,0.7016
HEARTS TWO HEARTS ACE,0.2258,0.0176,0.7566
SPADES ACE HEARTS ACE,0.1124,0.006,0.8816
SPADES KING HEARTS ACE,0.3038,0.0042,0.692
SPADES QUEEN HEARTS ACE,0.3144,0.0032,0.6824
SPADES JACK HEARTS ACE,0.2096,0.0206,0.7698
HEARTS SIX SPADES FOUR,0.5712,0.018,0.4108
SPADES TEN HEARTS ACE,0.3318,0.0042,0.664
SPADES KING SPADES QUEEN,0.285,0.0058,0.7092
HEARTS SIX SPADES FIVE,0.5596,0.0234,0.417
SPADES ACE SPADES QUEEN,0.2992,0.0044,0.6964
HEARTS SIX SPADES TWO,0.7054,0.052,0.2426
HEARTS SIX SPADES THREE,0.5738,0.0242,0.402
HEARTS SIX SPADES EIGHT,0.5468,0.0196,0.4336
SPADES JACK CLUBS THREE,0.2054,0.536,0.2586
HEARTS SIX SPADES NINE,0.568,0.0216,0.4104
SPADES NINE SPADES EIGHT,0.5032,0.0198,0.477
SPADES TEN CLUBS THREE,0.58,0.0212,0.3988
HEARTS SIX SPADES SIX,0.3058,0.045,0.6492
HEARTS SIX SPADES SEVEN,0.532,0.0198,0.4482
SPADES ACE CLUBS THREE,0.3446,0.0036,0.6518
SPADES QUEEN CLUBS THREE,0.3542,0.0148,0.631
SPADES KING CLUBS THREE,0.3536,0.0114,0.635
HEARTS SIX CLUBS FIVE,0.5548,0.021,0.4242
HEARTS SIX CLUBS FOUR,0.5674,0.0204,0.4122
HEARTS SIX CLUBS SEVEN,0.5474,0.0186,0.434
HEARTS SIX CLUBS SIX,0.3008,0.0428,0.6564
HEARTS SIX CLUBS NINE,0.5442,0.0196,0.4362
CLUBS EIGHT HEARTS SIX,0.5618,0.0168,0.4214
HEARTS SIX HEARTS SEVEN,0.527,0.0204,0.4526
HEARTS SIX HEARTS NINE,0.5334,0.018,0.4486
HEARTS SIX HEARTS EIGHT,0.5286,0.0168,0.4546
HEARTS SIX CLUBS THREE,0.5798,0.022,0.3982
CLUBS JACK HEARTS QUEEN,0.2066,0.0508,0.7426
CLUBS TEN HEARTS QUEEN,0.3154,0.0122,0.6724
HEARTS QUEEN CLUBS ACE,0.303,0.0086,0.6884
CLUBS NINE HEARTS ACE,0.3396,0.0058,0.6546
HEARTS QUEEN CLUBS KING,0.2944,0.0094,0.6962
CLUBS NINE HEARTS KING,0.343,0.0076,0.6494
HEARTS QUEEN CLUBS QUEEN,0.1218,0.013,0.8652
CLUBS NINE HEARTS QUEEN,0.3212,0.0108,0.668
CLUBS NINE HEARTS TEN,0.5334,0.0172,0.4494
SPADES JACK DIAMONDS NINE,0.2396,0.1648,0.5956
SPADES TEN DIAMONDS NINE,0.5432,0.0138,0.443
DIAMONDS EIGHT HEARTS TEN,0.5552,0.0234,0.4214
SPADES QUEEN DIAMONDS NINE,0.3392,0.0114,0.6494
HEARTS FIVE SPADES SIX,0.5528,0.0216,0.4256
HEARTS FIVE SPADES SEVEN,0.5626,0.019,0.4184
SPADES KING DIAMONDS NINE,0.3538,0.0068,0.6394
HEARTS FIVE SPADES EIGHT,0.5708,0.022,0.4072
SPADES EIGHT SPADES SEVEN,0.4942,0.0196,0.4862
SPADES ACE DIAMONDS NINE,0.36,0.0046,0.6354
HEARTS FIVE SPADES NINE,0.5762,0.0152,0.4086
SPADES NINE SPADES SEVEN,0.5196,0.0146,0.4658
HEARTS QUEEN HEARTS SEVEN,0.3434,0.014,0.6426
DIAMONDS EIGHT HEARTS KING,0.367,0.0066,0.6264
DIAMONDS EIGHT HEARTS QUEEN,0.352,0.011,0.637
HEARTS KING HEARTS SEVEN,0.3358,0.0084,0.6558
HEARTS ACE HEARTS SEVEN,0.3416,0.0052,0.6532
HEARTS ACE DIAMONDS EIGHT,0.3466,0.0044,0.649
HEARTS TEN HEARTS SEVEN,0.5334,0.018,0.4486
HEARTS TEN DIAMONDS SIX,0.5686,0.0184,0.413
HEARTS ACE HEARTS NINE,0.3304,0.0044,0.6652
HEARTS KING HEARTS NINE,0.3322,0.0094,0.6584
HEARTS QUEEN HEARTS NINE,0.3292,0.0102,0.6606
HEARTS NINE HEARTS TEN,0.5178,0.0166,0.4656
HEARTS ACE CLUBS QUEEN,0.3024,0.005,0.6926
CLUBS NINE HEARTS SEVEN,0.5428,0.0204,0.4368
CLUBS EIGHT HEARTS SEVEN,0.555,0.0156,0.4294
HEARTS ACE CLUBS KING,0.3086,0.0058,0.6856
HEARTS ACE CLUBS ACE,0.114,0.0046,0.8814
SPADES QUEEN HEARTS QUEEN,0.1266,0.0112,0.8622
SPADES THREE HEARTS SEVEN,0.5754,0.0238,0.4008
SPADES KING HEARTS QUEEN,0.3022,0.0074,0.6904
SPADES TWO HEARTS SEVEN,0.7126,0.0518,0.2356
SPADES ACE HEARTS QUEEN,0.3078,0.0058,0.6864
SPADES FIVE HEARTS SEVEN,0.5556,0.019,0.4254
CLUBS TEN HEARTS ACE,0.326,0.006,0.668
SPADES FOUR HEARTS SEVEN,0.5672,0.0208,0.412
CLUBS JACK HEARTS ACE,0.2092,0.0238,0.767
SPADES SEVEN HEARTS SEVEN,0.287,0.0398,0.6732
SPADES KING DIAMONDS JACK,0.2244,0.0312,0.7444
SPADES QUEEN DIAMONDS JACK,0.2346,0.0412,0.7242
SPADES SIX HEARTS SEVEN,0.5432,0.0204,0.4364
SPADES NINE HEARTS SEVEN,0.5488,0.0178,0.4334
SPADES TEN HEARTS QUEEN,0.32,0.0098,0.6702
SPADES EIGHT HEARTS SEVEN,0.5542,0.0172,0.4286
SPADES ACE DIAMONDS JACK,0.2192,0.0206,0.7602
SPADES JACK HEARTS QUEEN,0.221,0.0416,0.7374
HEARTS QUEEN DIAMONDS SIX,0.3574,0.0118,0.6308
HEARTS KING DIAMONDS SIX,0.3532,0.01,0.6368
HEARTS ACE DIAMONDS SIX,0.352,0.006,0.642
SPADES TEN DIAMONDS JACK,0.2264,0.1214,0.6522
SPADES JACK DIAMONDS JACK,0.0856,0.0372,0.8772
SPADES NINE SPADES SIX,0.5258,0.0146,0.4596
SPADES EIGHT SPADES SIX,0.516,0.0172,0.4668
SPADES SEVEN SPADES SIX,0.5006,0.0218,0.4776
HEARTS SEVEN HEARTS EIGHT,0.5076,0.0192,0.4732
HEARTS NINE HEARTS SEVEN,0.5306,0.017,0.4524
SPADES JACK SPADES TEN,0.2152,0.1214,0.6634
CLUBS SIX HEARTS SEVEN,0.543,0.0202,0.4368
CLUBS SEVEN HEARTS SEVEN,0.2988,0.041,0.6602
CLUBS FOUR HEARTS SEVEN,0.565,0.0226,0.4124
CLUBS FIVE HEARTS SEVEN,0.5546,0.0186,0.4268
SPADES KING SPADES TEN,0.323,0.006,0.671
CLUBS THREE HEARTS SEVEN,0.58,0.0192,0.4008
SPADES QUEEN SPADES TEN,0.311,0.0094,0.6796
SPADES ACE SPADES TEN,0.3246,0.0054,0.67
SPADES KING HEARTS SEVEN,0.3726,0.0072,0.6202
SPADES QUEEN HEARTS SEVEN,0.3734,0.0134,0.6132
SPADES ACE HEARTS SEVEN,0.3602,0.0048,0.635
SPADES TEN HEARTS SEVEN,0.5606,0.017,0.4224
SPADES JACK HEARTS SEVEN,0.2174,0.3112,0.4714
CLUBS ACE HEARTS TEN,0.3418,0.0062,0.652
CLUBS TEN HEARTS NINE,0.5352,0.0144,0.4504
SPADES ACE HEARTS THREE,0.3504,0.0046,0.645
SPADES ACE DIAMONDS KING,0.3222,0.003,0.6748
CLUBS JACK HEARTS NINE,0.2142,0.167,0.6188
SPADES KING DIAMONDS KING,0.1266,0.0078,0.8656
SPADES KING HEARTS THREE,0.3726,0.0088,0.6186
HEARTS TEN CLUBS QUEEN,0.3152,0.0106,0.6742
HEARTS THREE SPADES QUEEN,0.3598,0.013,0.6272
SPADES QUEEN DIAMONDS KING,0.3142,0.0042,0.6816
HEARTS TEN CLUBS KING,0.3314,0.0064,0.6622
HEARTS NINE CLUBS ACE,0.3628,0.0074,0.6298
CLUBS TEN HEARTS TEN,0.2534,0.0242,0.7224
CLUBS JACK HEARTS TEN,0.2246,0.118,0.6574
