opposingHand,winningChance,drawChance,lostChance
CLUBS JACK HEARTS NINE,0.3158,0.0192,0.665
SPADES KING DIAMONDS KING,0.1392,0.0102,0.8506
SPADES KING HEARTS THREE,0.3984,0.009,0.5926
HEARTS THREE SPADES QUEEN,0.3974,0.0138,0.5888
SPADES QUEEN DIAMONDS KING,0.3214,0.005,0.6736
HEARTS NINE CLUBS ACE,0.3654,0.005,0.6296
HEARTS NINE CLUBS QUEEN,0.3428,0.0112,0.646
HEARTS NINE CLUBS KING,0.3722,0.0086,0.6192
SPADES TEN HEARTS NINE,0.2194,0.1746,0.606
SPADES JACK HEARTS NINE,0.3152,0.0166,0.6682
SPADES SIX HEARTS EIGHT,0.5492,0.0278,0.423
SPADES SEVEN HEARTS EIGHT,0.544,0.0256,0.4304
CLUBS THREE HEARTS JACK,0.3906,0.0216,0.5878
SPADES EIGHT HEARTS EIGHT,0.2844,0.0468,0.6688
SPADES NINE HEARTS EIGHT,0.547,0.023,0.43
SPADES KING HEARTS NINE,0.3508,0.0064,0.6428
SPADES TWO HEARTS EIGHT,0.6204,0.0298,0.3498
SPADES QUEEN HEARTS NINE,0.3502,0.0074,0.6424
SPADES THREE HEARTS EIGHT,0.6286,0.024,0.3474
SPADES FOUR HEARTS EIGHT,0.6092,0.031,0.3598
SPADES ACE HEARTS NINE,0.3688,0.0046,0.6266
SPADES FIVE HEARTS EIGHT,0.6584,0.0764,0.2652
CLUBS EIGHT HEARTS EIGHT,0.2802,0.0528,0.667
CLUBS NINE HEARTS EIGHT,0.5472,0.0244,0.4284
CLUBS THREE HEARTS KING,0.3946,0.0084,0.597
CLUBS FOUR HEARTS EIGHT,0.6056,0.0294,0.365
CLUBS THREE HEARTS QUEEN,0.3838,0.0138,0.6024
CLUBS SIX HEARTS EIGHT,0.554,0.0302,0.4158
CLUBS THREE HEARTS ACE,0.3844,0.0052,0.6104
CLUBS SEVEN HEARTS EIGHT,0.5458,0.0324,0.4218
CLUBS THREE HEARTS EIGHT,0.6442,0.027,0.3288
CLUBS TWO HEARTS EIGHT,0.6194,0.0298,0.3508
SPADES TEN SPADES FOUR,0.2968,0.4334,0.2698
SPADES JACK SPADES FOUR,0.3744,0.0136,0.612
HEARTS NINE HEARTS EIGHT,0.5082,0.027,0.4648
SPADES QUEEN SPADES FOUR,0.3792,0.0118,0.609
SPADES KING SPADES FOUR,0.3738,0.0066,0.6196
SPADES ACE SPADES FOUR,0.35,0.0036,0.6464
CLUBS JACK HEARTS SEVEN,0.341,0.0178,0.6412
CLUBS TEN HEARTS SEVEN,0.2222,0.296,0.4818
CLUBS KING HEARTS SEVEN,0.362,0.0076,0.6304
HEARTS SEVEN CLUBS QUEEN,0.3586,0.0112,0.6302
CLUBS ACE HEARTS SEVEN,0.3548,0.0052,0.64
CLUBS SEVEN HEARTS ACE,0.3446,0.0046,0.6508
CLUBS SEVEN HEARTS KING,0.3412,0.008,0.6508
CLUBS SEVEN HEARTS QUEEN,0.3512,0.0132,0.6356
CLUBS SEVEN HEARTS JACK,0.3466,0.0206,0.6328
CLUBS TEN CLUBS THREE,0.306,0.438,0.256
CLUBS JACK CLUBS THREE,0.3652,0.0168,0.618
CLUBS THREE CLUBS ACE,0.3594,0.0026,0.638
CLUBS THREE CLUBS QUEEN,0.3706,0.012,0.6174
CLUBS THREE CLUBS KING,0.3742,0.0076,0.6182
SPADES ACE CLUBS ACE,0.1222,0.0056,0.8722
SPADES KING CLUBS ACE,0.3186,0.0046,0.6768
SPADES QUEEN CLUBS ACE,0.3106,0.0034,0.686
SPADES JACK CLUBS ACE,0.3066,0.0036,0.6898
SPADES TEN CLUBS ACE,0.2182,0.0256,0.7562
SPADES EIGHT HEARTS NINE,0.5392,0.0274,0.4334
SPADES NINE HEARTS NINE,0.2906,0.0416,0.6678
SPADES SIX HEARTS NINE,0.5746,0.0258,0.3996
SPADES SEVEN HEARTS NINE,0.5434,0.0266,0.43
CLUBS SEVEN HEARTS NINE,0.5514,0.0234,0.4252
CLUBS SIX HEARTS NINE,0.5706,0.0278,0.4016
CLUBS FOUR HEARTS NINE,0.6282,0.0266,0.3452
CLUBS THREE HEARTS NINE,0.6362,0.0316,0.3322
CLUBS TWO HEARTS NINE,0.6218,0.0312,0.347
SPADES FIVE HEARTS NINE,0.6726,0.079,0.2484
SPADES FOUR HEARTS NINE,0.6218,0.0314,0.3468
SPADES THREE HEARTS NINE,0.6214,0.0316,0.347
SPADES TWO HEARTS NINE,0.6138,0.0292,0.357
CLUBS NINE HEARTS NINE,0.269,0.0416,0.6894
CLUBS EIGHT HEARTS NINE,0.5292,0.0246,0.4462
