opposingHand,winningChance,drawChance,lostChance
HEARTS NINE CLUBS QUEEN,0.336,0.0106,0.6534
HEARTS NINE CLUBS KING,0.353,0.0074,0.6396
SPADES QUEEN HEARTS TEN,0.2224,0.0502,0.7274
SPADES KING HEARTS TEN,0.2344,0.0332,0.7324
SPADES ACE HEARTS TEN,0.2166,0.0242,0.7592
SPADES TEN HEARTS NINE,0.232,0.1634,0.6046
SPADES JACK HEARTS NINE,0.3282,0.0146,0.6572
SPADES TEN HEARTS TEN,0.0798,0.0592,0.861
SPADES JACK HEARTS TEN,0.2222,0.0556,0.7222
SPADES SIX HEARTS EIGHT,0.5384,0.03,0.4316
SPADES SEVEN HEARTS EIGHT,0.5406,0.0232,0.4362
CLUBS THREE HEARTS JACK,0.4102,0.017,0.5728
SPADES EIGHT HEARTS EIGHT,0.2634,0.046,0.6906
CLUBS THREE HEARTS TEN,0.3214,0.4678,0.2108
SPADES NINE HEARTS EIGHT,0.5342,0.0252,0.4406
SPADES KING HEARTS NINE,0.3446,0.007,0.6484
SPADES TWO HEARTS EIGHT,0.6172,0.0268,0.356
SPADES QUEEN HEARTS NINE,0.3336,0.0116,0.6548
SPADES THREE HEARTS EIGHT,0.6198,0.028,0.3522
SPADES FOUR HEARTS EIGHT,0.6198,0.0272,0.353
SPADES ACE HEARTS NINE,0.359,0.0044,0.6366
CLUBS EIGHT HEARTS EIGHT,0.28,0.0494,0.6706
CLUBS NINE HEARTS EIGHT,0.5444,0.0244,0.4312
CLUBS THREE HEARTS KING,0.386,0.0094,0.6046
CLUBS FOUR HEARTS EIGHT,0.6172,0.028,0.3548
CLUBS THREE HEARTS QUEEN,0.3894,0.0112,0.5994
CLUBS FIVE HEARTS EIGHT,0.6546,0.075,0.2704
CLUBS SIX HEARTS EIGHT,0.5696,0.025,0.4054
CLUBS THREE HEARTS ACE,0.3954,0.0044,0.6002
CLUBS SEVEN HEARTS EIGHT,0.5494,0.0262,0.4244
CLUBS THREE HEARTS EIGHT,0.6284,0.0298,0.3418
CLUBS TWO HEARTS EIGHT,0.6274,0.029,0.3436
SPADES TEN SPADES FOUR,0.303,0.4496,0.2474
SPADES JACK SPADES FOUR,0.3766,0.0178,0.6056
HEARTS NINE HEARTS EIGHT,0.509,0.0218,0.4692
SPADES QUEEN SPADES FOUR,0.3736,0.0108,0.6156
SPADES KING SPADES FOUR,0.3594,0.0088,0.6318
SPADES ACE SPADES FOUR,0.3636,0.0054,0.631
HEARTS KING HEARTS TEN,0.2178,0.0322,0.75
HEARTS QUEEN HEARTS TEN,0.2246,0.042,0.7334
HEARTS ACE HEARTS TEN,0.2118,0.0202,0.768
HEARTS SEVEN CLUBS JACK,0.3432,0.0182,0.6386
CLUBS KING HEARTS SEVEN,0.3584,0.0072,0.6344
CLUBS QUEEN HEARTS SEVEN,0.3588,0.0098,0.6314
CLUBS ACE HEARTS SEVEN,0.3598,0.0038,0.6364
CLUBS SEVEN HEARTS ACE,0.3568,0.0042,0.639
CLUBS SEVEN HEARTS KING,0.3552,0.0082,0.6366
CLUBS SEVEN HEARTS QUEEN,0.3474,0.0142,0.6384
CLUBS SEVEN HEARTS JACK,0.3418,0.0184,0.6398
CLUBS SEVEN HEARTS TEN,0.2294,0.2878,0.4828
CLUBS THREE CLUBS JACK,0.3646,0.0192,0.6162
CLUBS THREE CLUBS ACE,0.352,0.0066,0.6414
CLUBS THREE CLUBS QUEEN,0.3848,0.0094,0.6058
CLUBS THREE CLUBS KING,0.3876,0.007,0.6054
HEARTS JACK HEARTS TEN,0.2058,0.0552,0.739
SPADES ACE CLUBS ACE,0.1146,0.0058,0.8796
SPADES KING CLUBS ACE,0.3036,0.0052,0.6912
SPADES QUEEN CLUBS ACE,0.3262,0.0032,0.6706
SPADES JACK CLUBS ACE,0.3148,0.0062,0.679
SPADES TEN CLUBS ACE,0.2186,0.03,0.7514
SPADES EIGHT HEARTS NINE,0.5344,0.0222,0.4434
SPADES NINE HEARTS NINE,0.2762,0.0422,0.6816
SPADES SIX HEARTS NINE,0.5572,0.0244,0.4184
SPADES SEVEN HEARTS NINE,0.5382,0.0256,0.4362
CLUBS SEVEN HEARTS NINE,0.5458,0.0288,0.4254
CLUBS SIX HEARTS NINE,0.5692,0.0256,0.4052
CLUBS FIVE HEARTS NINE,0.6754,0.0774,0.2472
CLUBS FOUR HEARTS NINE,0.6204,0.0258,0.3538
CLUBS THREE HEARTS NINE,0.6244,0.0254,0.3502
CLUBS TWO HEARTS NINE,0.6102,0.0256,0.3642
SPADES FOUR HEARTS NINE,0.629,0.0264,0.3446
SPADES THREE HEARTS NINE,0.6118,0.0276,0.3606
SPADES TWO HEARTS NINE,0.6272,0.0274,0.3454
CLUBS NINE HEARTS NINE,0.2728,0.0376,0.6896
CLUBS EIGHT HEARTS NINE,0.5462,0.0298,0.424
