opposingHand,winningChance,drawChance,lostChance
SPADES EIGHT DIAMONDS NINE,0.6378,0.0092,0.353
SPADES TEN CLUBS KING,0.3878,0.0072,0.605
DIAMONDS NINE SPADES THREE,0.679,0.0086,0.3124
SPADES JACK CLUBS KING,0.2386,0.0252,0.7362
DIAMONDS NINE SPADES TWO,0.6736,0.0082,0.3182
DIAMONDS NINE SPADES FIVE,0.6534,0.01,0.3366
DIAMONDS NINE SPADES FOUR,0.6778,0.0114,0.3108
CLUBS NINE DIAMONDS NINE,0.4406,0.0104,0.549
CLUBS EIGHT DIAMONDS NINE,0.656,0.0058,0.3382
CLUBS SIX DIAMONDS NINE,0.6556,0.0082,0.3362
SPADES JACK CLUBS FOUR,0.7302,0.0432,0.2266
CLUBS SEVEN DIAMONDS NINE,0.6562,0.0086,0.3352
SPADES TEN CLUBS FOUR,0.6874,0.0086,0.304
CLUBS FOUR DIAMONDS NINE,0.6734,0.0088,0.3178
CLUBS FIVE DIAMONDS NINE,0.6674,0.0132,0.3194
DIAMONDS NINE CLUBS TWO,0.688,0.007,0.305
CLUBS THREE DIAMONDS NINE,0.6754,0.009,0.3156
DIAMONDS NINE HEARTS EIGHT,0.6288,0.0096,0.3616
DIAMONDS NINE HEARTS NINE,0.449,0.0128,0.5382
HEARTS SIX DIAMONDS NINE,0.6492,0.0094,0.3414
DIAMONDS NINE HEARTS SEVEN,0.6424,0.008,0.3496
CLUBS NINE CLUBS EIGHT,0.6038,0.0094,0.3868
DIAMONDS ACE DIAMONDS NINE,0.4078,0.0036,0.5886
HEARTS FOUR DIAMONDS NINE,0.6692,0.0086,0.3222
HEARTS FIVE DIAMONDS NINE,0.6674,0.0102,0.3224
HEARTS ACE CLUBS TWO,0.4348,0.0052,0.56
SPADES ACE CLUBS FOUR,0.4382,0.0046,0.5572
DIAMONDS QUEEN DIAMONDS NINE,0.6318,0.0866,0.2816
HEARTS TWO DIAMONDS NINE,0.6944,0.0114,0.2942
CLUBS TWO HEARTS KING,0.4222,0.0068,0.571
SPADES KING CLUBS FOUR,0.4412,0.0072,0.5516
DIAMONDS KING DIAMONDS NINE,0.3824,0.0074,0.6102
HEARTS THREE DIAMONDS NINE,0.6668,0.01,0.3232
SPADES QUEEN CLUBS FOUR,0.6806,0.0926,0.2268
DIAMONDS NINE DIAMONDS JACK,0.674,0.0414,0.2846
CLUBS EIGHT SPADES NINE,0.649,0.0102,0.3408
DIAMONDS NINE DIAMONDS TEN,0.617,0.0092,0.3738
CLUBS EIGHT SPADES EIGHT,0.463,0.0104,0.5266
CLUBS EIGHT SPADES SEVEN,0.6456,0.011,0.3434
CLUBS EIGHT SPADES SIX,0.6518,0.0076,0.3406
CLUBS EIGHT SPADES FIVE,0.654,0.0124,0.3336
CLUBS EIGHT SPADES FOUR,0.6536,0.0094,0.337
CLUBS EIGHT SPADES THREE,0.672,0.0098,0.3182
CLUBS EIGHT SPADES TWO,0.6794,0.0098,0.3108
HEARTS SIX DIAMONDS TEN,0.6704,0.0122,0.3174
DIAMONDS TEN HEARTS SEVEN,0.6718,0.0088,0.3194
DIAMONDS TEN HEARTS EIGHT,0.6564,0.0076,0.336
DIAMONDS TEN HEARTS NINE,0.659,0.0116,0.3294
CLUBS TEN CLUBS FOUR,0.6544,0.008,0.3376
CLUBS FOUR CLUBS KING,0.4202,0.0068,0.573
CLUBS FOUR CLUBS QUEEN,0.6424,0.0926,0.265
CLUBS TWO DIAMONDS TEN,0.6942,0.0136,0.2922
CLUBS THREE DIAMONDS TEN,0.6842,0.0104,0.3054
CLUBS FOUR CLUBS ACE,0.419,0.0044,0.5766
DIAMONDS JACK DIAMONDS TEN,0.664,0.0408,0.2952
DIAMONDS QUEEN DIAMONDS TEN,0.636,0.0874,0.2766
HEARTS TWO DIAMONDS TEN,0.6852,0.0074,0.3074
DIAMONDS KING DIAMONDS TEN,0.397,0.0074,0.5956
HEARTS THREE DIAMONDS TEN,0.6916,0.0062,0.3022
DIAMONDS ACE DIAMONDS TEN,0.375,0.0042,0.6208
HEARTS FOUR DIAMONDS TEN,0.6764,0.0102,0.3134
CLUBS EIGHT HEARTS JACK,0.723,0.0372,0.2398
HEARTS FIVE DIAMONDS TEN,0.7014,0.0086,0.29
CLUBS EIGHT HEARTS TEN,0.6688,0.0106,0.3206
CLUBS EIGHT HEARTS KING,0.417,0.0064,0.5766
CLUBS EIGHT HEARTS ACE,0.4364,0.004,0.5596
CLUBS NINE SPADES THREE,0.6886,0.0088,0.3026
CLUBS NINE SPADES TWO,0.6952,0.0102,0.2946
CLUBS NINE SPADES FIVE,0.6658,0.0084,0.3258
CLUBS NINE SPADES FOUR,0.6864,0.0112,0.3024
CLUBS NINE SPADES SEVEN,0.6542,0.0094,0.3364
CLUBS NINE SPADES SIX,0.6524,0.01,0.3376
CLUBS NINE SPADES NINE,0.4432,0.012,0.5448
CLUBS TEN HEARTS EIGHT,0.6648,0.0076,0.3276
CLUBS NINE SPADES EIGHT,0.646,0.0108,0.3432
CLUBS QUEEN HEARTS EIGHT,0.6784,0.083,0.2386
CLUBS KING HEARTS EIGHT,0.4412,0.006,0.5528
CLUBS ACE HEARTS EIGHT,0.425,0.005,0.57
SPADES KING CLUBS KING,0.1498,0.0036,0.8466
SPADES QUEEN CLUBS KING,0.2436,0.0238,0.7326
SPADES ACE CLUBS KING,0.3586,0.0052,0.6362
DIAMONDS ACE HEARTS TEN,0.4094,0.0054,0.5852
HEARTS FOUR HEARTS TEN,0.6578,0.0094,0.3328
DIAMONDS ACE HEARTS JACK,0.273,0.0148,0.7122
HEARTS FOUR HEARTS JACK,0.703,0.0444,0.2526
SPADES KING CLUBS FIVE,0.4256,0.0052,0.5692
SPADES QUEEN CLUBS FIVE,0.6768,0.0866,0.2366
SPADES ACE CLUBS FIVE,0.4424,0.0052,0.5524
DIAMONDS JACK HEARTS SEVEN,0.7338,0.0428,0.2234
HEARTS SIX DIAMONDS JACK,0.734,0.0422,0.2238
DIAMONDS JACK HEARTS NINE,0.7294,0.0412,0.2294
DIAMONDS JACK HEARTS EIGHT,0.7178,0.0482,0.234
DIAMONDS KING DIAMONDS JACK,0.2416,0.0242,0.7342
HEARTS THREE DIAMONDS JACK,0.7432,0.042,0.2148
SPADES ACE SPADES SIX,0.424,0.0058,0.5702
HEARTS ACE SPADES FOUR,0.442,0.0046,0.5534
DIAMONDS QUEEN DIAMONDS JACK,0.0198,0.9096,0.0706
HEARTS TWO DIAMONDS JACK,0.737,0.0382,0.2248
HEARTS FIVE DIAMONDS JACK,0.7314,0.0408,0.2278
SPADES QUEEN SPADES SIX,0.638,0.078,0.284
DIAMONDS ACE DIAMONDS JACK,0.2558,0.0126,0.7316
HEARTS FOUR DIAMONDS JACK,0.7412,0.038,0.2208
SPADES KING SPADES SIX,0.4196,0.0052,0.5752
SPADES FOUR HEARTS KING,0.4406,0.0048,0.5546
SPADES TEN SPADES SIX,0.6368,0.0086,0.3546
SPADES JACK SPADES SIX,0.6682,0.0458,0.286
SPADES FOUR DIAMONDS JACK,0.7354,0.0394,0.2252
SPADES FIVE DIAMONDS JACK,0.7356,0.0326,0.2318
DIAMONDS JACK SPADES TWO,0.7368,0.0386,0.2246
DIAMONDS JACK SPADES THREE,0.7314,0.037,0.2316
SPADES ACE DIAMONDS THREE,0.4362,0.0068,0.557
SPADES QUEEN DIAMONDS THREE,0.6802,0.0944,0.2254
CLUBS EIGHT DIAMONDS JACK,0.7252,0.0392,0.2356
SPADES KING DIAMONDS THREE,0.4304,0.0066,0.563
CLUBS NINE DIAMONDS JACK,0.7132,0.042,0.2448
CLUBS SIX DIAMONDS JACK,0.7362,0.042,0.2218
CLUBS SEVEN DIAMONDS JACK,0.7354,0.0442,0.2204
CLUBS FOUR DIAMONDS JACK,0.7342,0.043,0.2228
CLUBS FIVE DIAMONDS JACK,0.7324,0.0422,0.2254
CLUBS TWO DIAMONDS JACK,0.7352,0.041,0.2238
CLUBS THREE DIAMONDS JACK,0.7344,0.0388,0.2268
SPADES TEN CLUBS FIVE,0.6978,0.0092,0.293
HEARTS SIX SPADES JACK,0.7304,0.0412,0.2284
HEARTS SIX SPADES TEN,0.6672,0.0098,0.323
SPADES JACK CLUBS FIVE,0.7378,0.0468,0.2154
SPADES JACK DIAMONDS THREE,0.723,0.0482,0.2288
CLUBS SEVEN CLUBS ACE,0.4238,0.0046,0.5716
DIAMONDS THREE SPADES TEN,0.684,0.0114,0.3046
CLUBS SEVEN CLUBS QUEEN,0.6424,0.0894,0.2682
CLUBS SEVEN CLUBS KING,0.433,0.0076,0.5594
SPADES NINE DIAMONDS JACK,0.7088,0.0396,0.2516
CLUBS TEN CLUBS SEVEN,0.6406,0.0078,0.3516
DIAMONDS ACE HEARTS ACE,0.1526,0.0044,0.843
HEARTS FOUR HEARTS ACE,0.4092,0.0056,0.5852
SPADES EIGHT DIAMONDS JACK,0.7142,0.038,0.2478
SPADES ACE HEARTS SIX,0.4418,0.0038,0.5544
DIAMONDS ACE HEARTS KING,0.3632,0.0042,0.6326
HEARTS FOUR HEARTS KING,0.414,0.0062,0.5798
SPADES SEVEN DIAMONDS JACK,0.7336,0.0394,0.227
SPADES KING HEARTS SIX,0.4384,0.0074,0.5542
SPADES QUEEN HEARTS SIX,0.6762,0.085,0.2388
SPADES SIX DIAMONDS JACK,0.7264,0.0392,0.2344
DIAMONDS TEN SPADES TWO,0.6982,0.0098,0.292
SPADES THREE DIAMONDS TEN,0.6836,0.0096,0.3068
SPADES FOUR DIAMONDS TEN,0.6836,0.0096,0.3068
SPADES FIVE DIAMONDS TEN,0.689,0.008,0.303
SPADES SIX DIAMONDS TEN,0.6762,0.0084,0.3154
SPADES SEVEN DIAMONDS TEN,0.66,0.0066,0.3334
SPADES EIGHT DIAMONDS TEN,0.6572,0.0082,0.3346
SPADES NINE DIAMONDS TEN,0.6434,0.0098,0.3468
CLUBS FOUR DIAMONDS TEN,0.6858,0.0082,0.306
CLUBS FIVE DIAMONDS TEN,0.6966,0.0092,0.2942
CLUBS SIX DIAMONDS TEN,0.6804,0.0094,0.3102
CLUBS SEVEN DIAMONDS TEN,0.6666,0.0092,0.3242
CLUBS EIGHT DIAMONDS TEN,0.6674,0.0094,0.3232
CLUBS NINE DIAMONDS TEN,0.6516,0.0098,0.3386
CLUBS TEN DIAMONDS THREE,0.6924,0.0096,0.298
DIAMONDS THREE CLUBS KING,0.4486,0.0064,0.545
DIAMONDS THREE CLUBS QUEEN,0.6718,0.0942,0.234
DIAMONDS THREE CLUBS ACE,0.4326,0.0044,0.563
SPADES FOUR HEARTS JACK,0.7344,0.0404,0.2252
SPADES FOUR HEARTS TEN,0.6946,0.0102,0.2952
SPADES FIVE SPADES TWO,0.5892,0.0118,0.399
SPADES FOUR SPADES TWO,0.5934,0.0108,0.3958
SPADES THREE SPADES TWO,0.619,0.011,0.37
SPADES NINE SPADES TWO,0.6456,0.0092,0.3452
SPADES EIGHT SPADES TWO,0.6472,0.009,0.3438
SPADES SEVEN SPADES TWO,0.6324,0.0078,0.3598
SPADES SIX SPADES TWO,0.6318,0.0094,0.3588
DIAMONDS QUEEN CLUBS THREE,0.6778,0.0914,0.2308
CLUBS THREE HEARTS TWO,0.656,0.0136,0.3304
DIAMONDS QUEEN CLUBS TWO,0.678,0.093,0.229
HEARTS TWO CLUBS TWO,0.4872,0.016,0.4968
DIAMONDS QUEEN HEARTS SEVEN,0.6692,0.0912,0.2396
HEARTS TWO HEARTS SEVEN,0.6434,0.011,0.3456
HEARTS SIX DIAMONDS QUEEN,0.6788,0.0862,0.235
HEARTS SIX HEARTS TWO,0.6296,0.0106,0.3598
DIAMONDS QUEEN HEARTS NINE,0.673,0.0916,0.2354
HEARTS TWO HEARTS NINE,0.6478,0.0102,0.342
DIAMONDS QUEEN HEARTS EIGHT,0.6694,0.0956,0.235
HEARTS TWO HEARTS EIGHT,0.6494,0.0102,0.3404
CLUBS NINE HEARTS TWO,0.6922,0.0088,0.299
CLUBS NINE DIAMONDS QUEEN,0.6892,0.0858,0.225
CLUBS EIGHT HEARTS TWO,0.6842,0.0122,0.3036
CLUBS EIGHT DIAMONDS QUEEN,0.691,0.082,0.227
CLUBS FIVE DIAMONDS QUEEN,0.672,0.0912,0.2368
CLUBS FIVE HEARTS TWO,0.6572,0.0136,0.3292
SPADES EIGHT HEARTS ACE,0.425,0.004,0.571
DIAMONDS QUEEN CLUBS FOUR,0.6784,0.0908,0.2308
HEARTS TWO CLUBS FOUR,0.6574,0.0132,0.3294
CLUBS SEVEN DIAMONDS QUEEN,0.6856,0.0924,0.222
CLUBS SEVEN HEARTS TWO,0.6808,0.0102,0.309
CLUBS SIX DIAMONDS QUEEN,0.6822,0.0882,0.2296
CLUBS SIX HEARTS TWO,0.6776,0.013,0.3094
SPADES EIGHT HEARTS KING,0.4274,0.0072,0.5654
HEARTS TWO SPADES SIX,0.6666,0.0094,0.324
DIAMONDS QUEEN SPADES SIX,0.6726,0.0904,0.237
HEARTS FOUR CLUBS QUEEN,0.682,0.0902,0.2278
DIAMONDS ACE CLUBS QUEEN,0.2452,0.0122,0.7426
DIAMONDS QUEEN SPADES SEVEN,0.6672,0.0934,0.2394
HEARTS TWO SPADES SEVEN,0.6878,0.0092,0.303
HEARTS FOUR CLUBS KING,0.4278,0.0082,0.564
DIAMONDS ACE CLUBS KING,0.3464,0.0038,0.6498
DIAMONDS QUEEN SPADES EIGHT,0.681,0.089,0.23
SPADES EIGHT HEARTS TWO,0.6772,0.0092,0.3136
HEARTS FOUR CLUBS ACE,0.4214,0.0044,0.5742
DIAMONDS ACE CLUBS ACE,0.1516,0.0042,0.8442
SPADES NINE DIAMONDS QUEEN,0.6724,0.089,0.2386
SPADES NINE HEARTS TWO,0.6766,0.0114,0.312
HEARTS TWO SPADES TWO,0.4884,0.0172,0.4944
DIAMONDS QUEEN SPADES TWO,0.6876,0.097,0.2154
HEARTS TWO SPADES THREE,0.6636,0.0102,0.3262
DIAMONDS QUEEN SPADES THREE,0.678,0.089,0.233
HEARTS TWO SPADES FOUR,0.6454,0.0126,0.342
DIAMONDS QUEEN SPADES FOUR,0.68,0.0918,0.2282
HEARTS FOUR CLUBS TEN,0.69,0.0118,0.2982
CLUBS TEN DIAMONDS ACE,0.4162,0.0048,0.579
HEARTS TWO SPADES FIVE,0.645,0.0106,0.3444
DIAMONDS QUEEN SPADES FIVE,0.6648,0.0898,0.2454
CLUBS FIVE CLUBS KING,0.416,0.0078,0.5762
CLUBS FIVE CLUBS QUEEN,0.641,0.089,0.27
CLUBS FIVE CLUBS ACE,0.4126,0.0062,0.5812
CLUBS TEN CLUBS FIVE,0.663,0.0116,0.3254
SPADES SIX CLUBS KING,0.4294,0.009,0.5616
SPADES SIX CLUBS QUEEN,0.6788,0.0842,0.237
SPADES EIGHT HEARTS JACK,0.7158,0.0386,0.2456
SPADES SIX CLUBS ACE,0.4444,0.0048,0.5508
SPADES EIGHT HEARTS TEN,0.6466,0.0084,0.345
CLUBS TEN SPADES SIX,0.6754,0.0096,0.315
SPADES QUEEN CLUBS SEVEN,0.675,0.0934,0.2316
SPADES KING CLUBS SEVEN,0.4396,0.0096,0.5508
SPADES ACE CLUBS SEVEN,0.4344,0.0026,0.563
SPADES SIX HEARTS TEN,0.6692,0.0102,0.3206
SPADES SIX HEARTS JACK,0.7268,0.045,0.2282
SPADES SIX HEARTS ACE,0.4416,0.004,0.5544
SPADES SIX HEARTS KING,0.4346,0.0072,0.5582
CLUBS SEVEN SPADES JACK,0.7374,0.0428,0.2198
CLUBS SEVEN SPADES TEN,0.6692,0.009,0.3218
CLUBS TEN HEARTS SIX,0.6794,0.0118,0.3088
HEARTS SIX CLUBS QUEEN,0.67,0.0946,0.2354
HEARTS SIX CLUBS KING,0.4458,0.0084,0.5458
HEARTS SIX CLUBS ACE,0.4436,0.0038,0.5526
DIAMONDS THREE HEARTS ACE,0.4266,0.0052,0.5682
DIAMONDS THREE HEARTS KING,0.4346,0.0086,0.5568
CLUBS FIVE HEARTS JACK,0.7336,0.0432,0.2232
SPADES TEN DIAMONDS ACE,0.413,0.0028,0.5842
HEARTS FOUR SPADES TEN,0.6872,0.0122,0.3006
CLUBS FIVE HEARTS TEN,0.6818,0.0104,0.3078
HEARTS FOUR SPADES JACK,0.7278,0.043,0.2292
SPADES JACK DIAMONDS ACE,0.2716,0.0118,0.7166
SPADES ACE HEARTS FOUR,0.4426,0.0054,0.552
SPADES ACE DIAMONDS ACE,0.1552,0.0028,0.842
CLUBS FIVE HEARTS ACE,0.4278,0.0072,0.565
CLUBS FIVE HEARTS KING,0.4334,0.0068,0.5598
HEARTS FOUR SPADES QUEEN,0.685,0.0954,0.2196
SPADES QUEEN DIAMONDS ACE,0.2662,0.0144,0.7194
SPADES KING DIAMONDS ACE,0.3582,0.0032,0.6386
HEARTS FOUR SPADES KING,0.4374,0.0072,0.5554
CLUBS TEN SPADES FOUR,0.6878,0.0092,0.303
DIAMONDS QUEEN DIAMONDS ACE,0.2432,0.0128,0.744
HEARTS TWO DIAMONDS ACE,0.4332,0.004,0.5628
HEARTS FOUR DIAMONDS QUEEN,0.6702,0.0954,0.2344
HEARTS FOUR HEARTS TWO,0.6258,0.0096,0.3646
DIAMONDS THREE HEARTS TEN,0.6872,0.0124,0.3004
SPADES FOUR CLUBS KING,0.4228,0.009,0.5682
HEARTS FIVE DIAMONDS QUEEN,0.668,0.0952,0.2368
HEARTS FIVE HEARTS TWO,0.6262,0.0112,0.3626
DIAMONDS THREE HEARTS JACK,0.734,0.0446,0.2214
SPADES FOUR CLUBS QUEEN,0.6616,0.1008,0.2376
DIAMONDS QUEEN HEARTS TWO,0.683,0.0858,0.2312
DIAMONDS KING DIAMONDS QUEEN,0.223,0.0204,0.7566
DIAMONDS KING HEARTS TWO,0.4438,0.008,0.5482
HEARTS THREE DIAMONDS QUEEN,0.6836,0.0884,0.228
HEARTS THREE HEARTS TWO,0.6136,0.0116,0.3748
SPADES FOUR CLUBS ACE,0.4176,0.005,0.5774
HEARTS TWO CLUBS ACE,0.4206,0.0056,0.5738
DIAMONDS QUEEN CLUBS ACE,0.2566,0.0162,0.7272
HEARTS TWO CLUBS QUEEN,0.6818,0.0994,0.2188
DIAMONDS QUEEN CLUBS QUEEN,0.1272,0.0226,0.8502
HEARTS TWO CLUBS KING,0.4438,0.0064,0.5498
DIAMONDS QUEEN CLUBS KING,0.2322,0.0248,0.743
SPADES EIGHT SPADES FIVE,0.609,0.0102,0.3808
CLUBS TEN HEARTS TWO,0.7032,0.0116,0.2852
CLUBS TEN DIAMONDS QUEEN,0.6816,0.0912,0.2272
SPADES NINE SPADES FIVE,0.6324,0.0116,0.356
SPADES SIX SPADES FIVE,0.5824,0.0094,0.4082
SPADES SEVEN SPADES FIVE,0.5892,0.0094,0.4014
DIAMONDS FIVE CLUBS QUEEN,0.6744,0.0868,0.2388
SPADES EIGHT CLUBS ACE,0.4182,0.0042,0.5776
DIAMONDS FIVE CLUBS KING,0.431,0.0058,0.5632
SPADES EIGHT CLUBS KING,0.427,0.0074,0.5656
DIAMONDS FIVE CLUBS ACE,0.43,0.0044,0.5656
SPADES EIGHT CLUBS QUEEN,0.6768,0.0854,0.2378
CLUBS TEN SPADES EIGHT,0.6506,0.0092,0.3402
CLUBS TEN DIAMONDS FIVE,0.6778,0.012,0.3102
HEARTS JACK DIAMONDS TEN,0.718,0.0358,0.2462
DIAMONDS TEN HEARTS TEN,0.429,0.0106,0.5604
SPADES ACE CLUBS NINE,0.4354,0.0044,0.5602
CLUBS NINE SPADES QUEEN,0.6704,0.0908,0.2388
CLUBS NINE SPADES KING,0.4298,0.0068,0.5634
HEARTS SIX HEARTS KING,0.4128,0.0076,0.5796
DIAMONDS KING SPADES SEVEN,0.4386,0.007,0.5544
HEARTS THREE SPADES SEVEN,0.6746,0.008,0.3174
SPADES KING DIAMONDS SEVEN,0.4246,0.0064,0.569
SPADES QUEEN DIAMONDS SEVEN,0.6744,0.0866,0.239
HEARTS THREE SPADES SIX,0.66,0.0106,0.3294
DIAMONDS KING SPADES SIX,0.4384,0.0062,0.5554
DIAMONDS KING SPADES NINE,0.4194,0.005,0.5756
HEARTS THREE SPADES NINE,0.682,0.01,0.308
HEARTS SIX HEARTS ACE,0.424,0.006,0.57
DIAMONDS KING SPADES EIGHT,0.4296,0.008,0.5624
HEARTS THREE SPADES EIGHT,0.6814,0.01,0.3086
SPADES ACE DIAMONDS SEVEN,0.4332,0.0028,0.564
CLUBS NINE HEARTS THREE,0.6882,0.0116,0.3002
CLUBS NINE DIAMONDS KING,0.416,0.0054,0.5786
HEARTS THREE CLUBS EIGHT,0.6756,0.011,0.3134
CLUBS EIGHT DIAMONDS KING,0.431,0.0042,0.5648
HEARTS THREE SPADES THREE,0.4836,0.0156,0.5008
DIAMONDS KING SPADES THREE,0.4336,0.0072,0.5592
HEARTS THREE SPADES TWO,0.6648,0.0146,0.3206
DIAMONDS KING SPADES TWO,0.4334,0.0056,0.561
HEARTS THREE SPADES FIVE,0.6322,0.0112,0.3566
DIAMONDS KING SPADES FIVE,0.4336,0.005,0.5614
HEARTS THREE SPADES FOUR,0.6406,0.0102,0.3492
DIAMONDS KING SPADES FOUR,0.432,0.0044,0.5636
DIAMONDS KING CLUBS TWO,0.4406,0.0066,0.5528
HEARTS THREE CLUBS TWO,0.6528,0.0112,0.336
DIAMONDS KING CLUBS THREE,0.442,0.0064,0.5516
HEARTS THREE CLUBS THREE,0.4884,0.0166,0.495
DIAMONDS KING CLUBS FOUR,0.4524,0.0054,0.5422
HEARTS THREE CLUBS FOUR,0.6418,0.0126,0.3456
CLUBS FIVE DIAMONDS KING,0.4442,0.0076,0.5482
HEARTS THREE CLUBS FIVE,0.6282,0.0112,0.3606
DIAMONDS KING CLUBS SIX,0.4268,0.0066,0.5666
HEARTS THREE CLUBS SIX,0.6556,0.0128,0.3316
CLUBS SEVEN DIAMONDS KING,0.4396,0.0078,0.5526
HEARTS THREE CLUBS SEVEN,0.6778,0.0096,0.3126
HEARTS THREE DIAMONDS KING,0.4418,0.0074,0.5508
DIAMONDS KING DIAMONDS ACE,0.3414,0.0026,0.656
HEARTS THREE DIAMONDS ACE,0.441,0.0052,0.5538
HEARTS FOUR DIAMONDS KING,0.4466,0.0074,0.546
HEARTS FOUR HEARTS THREE,0.6102,0.0116,0.3782
HEARTS FIVE DIAMONDS KING,0.4456,0.0056,0.5488
HEARTS THREE HEARTS FIVE,0.6062,0.0112,0.3826
HEARTS SIX DIAMONDS KING,0.4386,0.0072,0.5542
HEARTS THREE HEARTS SIX,0.6236,0.0132,0.3632
DIAMONDS KING HEARTS SEVEN,0.4318,0.0082,0.56
HEARTS THREE HEARTS SEVEN,0.6316,0.0112,0.3572
DIAMONDS KING HEARTS EIGHT,0.4394,0.0066,0.554
HEARTS THREE HEARTS EIGHT,0.6416,0.0096,0.3488
HEARTS SIX HEARTS TEN,0.6434,0.01,0.3466
SPADES TEN DIAMONDS SEVEN,0.6686,0.007,0.3244
DIAMONDS KING HEARTS NINE,0.4174,0.006,0.5766
HEARTS THREE HEARTS NINE,0.6574,0.0108,0.3318
HEARTS SIX HEARTS JACK,0.701,0.043,0.256
SPADES JACK DIAMONDS SEVEN,0.733,0.0414,0.2256
HEARTS FIVE CLUBS FOUR,0.6172,0.0116,0.3712
SPADES SIX SPADES FOUR,0.6004,0.012,0.3876
HEARTS FIVE CLUBS FIVE,0.478,0.016,0.506
SPADES SEVEN SPADES FOUR,0.6016,0.0082,0.3902
HEARTS FIVE CLUBS SIX,0.6372,0.0102,0.3526
SPADES EIGHT SPADES FOUR,0.6102,0.012,0.3778
CLUBS SEVEN HEARTS FIVE,0.6374,0.01,0.3526
SPADES NINE SPADES FOUR,0.6436,0.0108,0.3456
SPADES QUEEN DIAMONDS FIVE,0.6696,0.0904,0.24
SPADES KING DIAMONDS FIVE,0.4322,0.0082,0.5596
HEARTS FIVE CLUBS TWO,0.67,0.0122,0.3178
SPADES ACE DIAMONDS FIVE,0.4422,0.0028,0.555
HEARTS FIVE CLUBS THREE,0.6366,0.01,0.3534
SPADES FIVE SPADES FOUR,0.5858,0.0088,0.4054
HEARTS FIVE SPADES TWO,0.653,0.0128,0.3342
HEARTS FIVE SPADES THREE,0.6366,0.0108,0.3526
HEARTS FIVE SPADES FOUR,0.623,0.0106,0.3664
HEARTS FIVE SPADES FIVE,0.471,0.0138,0.5152
CLUBS EIGHT HEARTS FIVE,0.6454,0.0098,0.3448
CLUBS NINE HEARTS FIVE,0.6824,0.0132,0.3044
HEARTS KING DIAMONDS TEN,0.4046,0.0074,0.588
HEARTS ACE DIAMONDS TEN,0.4124,0.0054,0.5822
HEARTS FIVE HEARTS SEVEN,0.6144,0.012,0.3736
HEARTS SIX HEARTS FIVE,0.5964,0.0098,0.3938
HEARTS FIVE HEARTS NINE,0.6396,0.0112,0.3492
CLUBS NINE SPADES TEN,0.6514,0.0078,0.3408
HEARTS FIVE HEARTS EIGHT,0.6148,0.0096,0.3756
CLUBS NINE SPADES JACK,0.7198,0.0342,0.246
CLUBS SIX DIAMONDS ACE,0.4382,0.0024,0.5594
HEARTS FOUR CLUBS SIX,0.6416,0.0066,0.3518
SPADES EIGHT SPADES THREE,0.6264,0.0062,0.3674
CLUBS SEVEN DIAMONDS ACE,0.4492,0.0028,0.548
HEARTS FOUR CLUBS SEVEN,0.6488,0.0092,0.342
SPADES NINE SPADES THREE,0.6346,0.01,0.3554
CLUBS FOUR DIAMONDS ACE,0.4304,0.0056,0.564
HEARTS FOUR CLUBS FOUR,0.4894,0.0168,0.4938
SPADES SIX SPADES THREE,0.6102,0.0104,0.3794
CLUBS FIVE DIAMONDS ACE,0.4296,0.0024,0.568
HEARTS FOUR CLUBS FIVE,0.6316,0.0098,0.3586
SPADES SEVEN SPADES THREE,0.6162,0.0092,0.3746
HEARTS FOUR CLUBS EIGHT,0.6722,0.01,0.3178
CLUBS EIGHT DIAMONDS ACE,0.4378,0.0042,0.558
CLUBS NINE HEARTS FOUR,0.706,0.0086,0.2854
CLUBS NINE DIAMONDS ACE,0.431,0.004,0.565
HEARTS FOUR SPADES FOUR,0.4742,0.013,0.5128
DIAMONDS ACE SPADES FOUR,0.4334,0.0036,0.563
HEARTS FOUR SPADES FIVE,0.6272,0.0102,0.3626
DIAMONDS ACE SPADES FIVE,0.438,0.0038,0.5582
HEARTS FOUR SPADES TWO,0.6522,0.0134,0.3344
DIAMONDS ACE SPADES TWO,0.438,0.0054,0.5566
HEARTS FOUR SPADES THREE,0.633,0.013,0.354
DIAMONDS ACE SPADES THREE,0.4424,0.004,0.5536
SPADES EIGHT DIAMONDS ACE,0.4432,0.0026,0.5542
HEARTS FOUR SPADES EIGHT,0.6612,0.0096,0.3292
SPADES FOUR SPADES THREE,0.6014,0.0102,0.3884
SPADES NINE DIAMONDS ACE,0.4222,0.0028,0.575
HEARTS FOUR SPADES NINE,0.6836,0.0102,0.3062
SPADES FIVE SPADES THREE,0.6002,0.0112,0.3886
HEARTS FOUR SPADES SIX,0.6414,0.0112,0.3474
DIAMONDS ACE SPADES SIX,0.4456,0.0034,0.551
SPADES SEVEN DIAMONDS ACE,0.4376,0.0024,0.56
HEARTS FOUR SPADES SEVEN,0.659,0.0092,0.3318
SPADES QUEEN SPADES EIGHT,0.6336,0.083,0.2834
SPADES KING SPADES EIGHT,0.413,0.0046,0.5824
CLUBS TEN DIAMONDS TEN,0.4358,0.0092,0.555
CLUBS TEN DIAMONDS SEVEN,0.6808,0.0118,0.3074
SPADES ACE SPADES EIGHT,0.404,0.0044,0.5916
HEARTS FIVE DIAMONDS ACE,0.429,0.0044,0.5666
HEARTS FOUR HEARTS FIVE,0.5848,0.0092,0.406
HEARTS FOUR DIAMONDS ACE,0.4406,0.005,0.5544
DIAMONDS TEN CLUBS ACE,0.4,0.0044,0.5956
CLUBS ACE DIAMONDS SEVEN,0.4414,0.0028,0.5558
DIAMONDS TEN CLUBS KING,0.3868,0.0078,0.6054
CLUBS KING DIAMONDS SEVEN,0.4418,0.0056,0.5526
DIAMONDS TEN CLUBS QUEEN,0.6756,0.0886,0.2358
DIAMONDS SEVEN CLUBS QUEEN,0.6706,0.0912,0.2382
DIAMONDS ACE HEARTS NINE,0.4272,0.0032,0.5696
HEARTS FOUR HEARTS NINE,0.6592,0.0102,0.3306
SPADES KING SPADES JACK,0.2372,0.0252,0.7376
CLUBS NINE CLUBS TEN,0.6136,0.0098,0.3766
DIAMONDS ACE HEARTS EIGHT,0.431,0.0038,0.5652
HEARTS FOUR HEARTS EIGHT,0.629,0.0108,0.3602
SPADES QUEEN SPADES JACK,0.0196,0.9146,0.0658
DIAMONDS ACE HEARTS SEVEN,0.4574,0.0036,0.539
HEARTS FOUR HEARTS SEVEN,0.6112,0.012,0.3768
HEARTS SIX DIAMONDS ACE,0.4282,0.0044,0.5674
HEARTS FOUR HEARTS SIX,0.6162,0.0086,0.3752
SPADES ACE SPADES JACK,0.2556,0.0094,0.735
CLUBS THREE DIAMONDS ACE,0.4426,0.0052,0.5522
HEARTS FOUR CLUBS THREE,0.641,0.0126,0.3464
SPADES JACK DIAMONDS FIVE,0.7292,0.0404,0.2304
CLUBS NINE CLUBS ACE,0.4154,0.0042,0.5804
DIAMONDS ACE CLUBS TWO,0.4424,0.0052,0.5524
HEARTS FOUR CLUBS TWO,0.6658,0.0102,0.324
SPADES TEN DIAMONDS FIVE,0.6878,0.0076,0.3046
SPADES TEN SPADES EIGHT,0.617,0.0092,0.3738
CLUBS NINE CLUBS QUEEN,0.6552,0.0858,0.259
SPADES JACK SPADES EIGHT,0.6756,0.0406,0.2838
CLUBS NINE CLUBS KING,0.385,0.007,0.608
DIAMONDS QUEEN HEARTS TEN,0.6874,0.0882,0.2244
HEARTS TWO HEARTS TEN,0.655,0.0104,0.3346
DIAMONDS QUEEN HEARTS JACK,0.0186,0.9722,0.0092
HEARTS TWO HEARTS JACK,0.7004,0.0404,0.2592
DIAMONDS QUEEN HEARTS KING,0.2292,0.0272,0.7436
HEARTS TWO HEARTS KING,0.4306,0.0076,0.5618
DIAMONDS QUEEN HEARTS ACE,0.2594,0.012,0.7286
HEARTS TWO HEARTS ACE,0.4014,0.006,0.5926
SPADES ACE HEARTS ACE,0.1532,0.003,0.8438
SPADES KING HEARTS ACE,0.3452,0.005,0.6498
SPADES QUEEN HEARTS ACE,0.2438,0.0132,0.743
SPADES JACK HEARTS ACE,0.258,0.0168,0.7252
HEARTS SIX SPADES FOUR,0.6448,0.0106,0.3446
SPADES TEN HEARTS ACE,0.3878,0.0056,0.6066
SPADES KING SPADES QUEEN,0.2356,0.026,0.7384
HEARTS SIX SPADES FIVE,0.6318,0.0082,0.36
SPADES ACE SPADES QUEEN,0.2428,0.0138,0.7434
HEARTS SIX SPADES TWO,0.667,0.01,0.323
HEARTS SIX SPADES THREE,0.663,0.012,0.325
HEARTS SIX SPADES EIGHT,0.6394,0.0104,0.3502
SPADES JACK CLUBS THREE,0.743,0.0432,0.2138
HEARTS SIX SPADES NINE,0.6714,0.0094,0.3192
SPADES NINE SPADES EIGHT,0.5866,0.0084,0.405
SPADES TEN CLUBS THREE,0.6868,0.0102,0.303
HEARTS SIX SPADES SIX,0.4764,0.0116,0.512
HEARTS SIX SPADES SEVEN,0.6376,0.0104,0.352
SPADES ACE CLUBS THREE,0.4366,0.0044,0.559
SPADES QUEEN CLUBS THREE,0.6782,0.0964,0.2254
SPADES KING CLUBS THREE,0.4402,0.0066,0.5532
HEARTS SIX CLUBS FIVE,0.6398,0.01,0.3502
HEARTS SIX CLUBS FOUR,0.639,0.013,0.348
CLUBS SEVEN HEARTS SIX,0.6508,0.0124,0.3368
HEARTS SIX CLUBS SIX,0.495,0.0118,0.4932
CLUBS NINE HEARTS SIX,0.664,0.0108,0.3252
HEARTS SIX CLUBS EIGHT,0.6544,0.011,0.3346
HEARTS SIX HEARTS SEVEN,0.613,0.0082,0.3788
HEARTS SIX HEARTS NINE,0.6104,0.0106,0.379
HEARTS SIX HEARTS EIGHT,0.6066,0.0096,0.3838
HEARTS SIX CLUBS THREE,0.6646,0.0116,0.3238
HEARTS SIX CLUBS TWO,0.6676,0.011,0.3214
CLUBS NINE HEARTS ACE,0.4318,0.0042,0.564
CLUBS NINE HEARTS KING,0.4088,0.0088,0.5824
CLUBS NINE HEARTS JACK,0.7096,0.0408,0.2496
CLUBS NINE HEARTS TEN,0.6516,0.0114,0.337
SPADES JACK DIAMONDS NINE,0.7236,0.039,0.2374
SPADES TEN DIAMONDS NINE,0.6432,0.0078,0.349
DIAMONDS EIGHT HEARTS TEN,0.6708,0.0094,0.3198
DIAMONDS EIGHT HEARTS JACK,0.725,0.0384,0.2366
SPADES QUEEN DIAMONDS NINE,0.6634,0.0956,0.241
HEARTS FIVE SPADES SIX,0.6244,0.0098,0.3658
HEARTS FIVE SPADES SEVEN,0.6396,0.0094,0.351
SPADES KING DIAMONDS NINE,0.4168,0.0052,0.578
HEARTS FIVE SPADES EIGHT,0.6382,0.011,0.3508
SPADES EIGHT SPADES SEVEN,0.5876,0.008,0.4044
SPADES ACE DIAMONDS NINE,0.4252,0.0028,0.572
HEARTS FIVE SPADES NINE,0.6676,0.0112,0.3212
SPADES NINE SPADES SEVEN,0.6212,0.008,0.3708
DIAMONDS EIGHT HEARTS KING,0.435,0.007,0.558
HEARTS KING HEARTS SEVEN,0.4134,0.0068,0.5798
HEARTS ACE HEARTS SEVEN,0.4198,0.0048,0.5754
HEARTS ACE DIAMONDS EIGHT,0.4294,0.003,0.5676
HEARTS TEN HEARTS SEVEN,0.6388,0.0102,0.351
HEARTS JACK HEARTS SEVEN,0.7096,0.0432,0.2472
HEARTS JACK DIAMONDS SIX,0.724,0.0378,0.2382
HEARTS TEN DIAMONDS SIX,0.6922,0.0092,0.2986
HEARTS ACE HEARTS NINE,0.409,0.0056,0.5854
HEARTS KING HEARTS NINE,0.4046,0.0062,0.5892
HEARTS JACK HEARTS NINE,0.6844,0.0422,0.2734
HEARTS NINE HEARTS TEN,0.6238,0.0122,0.364
HEARTS ACE CLUBS QUEEN,0.2388,0.015,0.7462
CLUBS NINE HEARTS SEVEN,0.6544,0.011,0.3346
HEARTS ACE CLUBS KING,0.3474,0.0054,0.6472
CLUBS EIGHT HEARTS SEVEN,0.6434,0.0132,0.3434
HEARTS ACE CLUBS ACE,0.1354,0.0056,0.859
SPADES THREE HEARTS SEVEN,0.6726,0.0104,0.317
SPADES TWO HEARTS SEVEN,0.6744,0.0088,0.3168
SPADES FIVE HEARTS SEVEN,0.6484,0.012,0.3396
CLUBS TEN HEARTS ACE,0.4022,0.006,0.5918
SPADES FOUR HEARTS SEVEN,0.6602,0.0108,0.329
SPADES SEVEN HEARTS SEVEN,0.4636,0.0112,0.5252
SPADES KING DIAMONDS JACK,0.2572,0.0214,0.7214
SPADES QUEEN DIAMONDS JACK,0.0218,0.9588,0.0194
SPADES SIX HEARTS SEVEN,0.6542,0.0112,0.3346
SPADES NINE HEARTS SEVEN,0.6476,0.0096,0.3428
SPADES EIGHT HEARTS SEVEN,0.6336,0.0102,0.3562
SPADES ACE DIAMONDS JACK,0.2706,0.011,0.7184
HEARTS KING DIAMONDS SIX,0.4282,0.0042,0.5676
HEARTS ACE DIAMONDS SIX,0.4284,0.005,0.5666
SPADES TEN DIAMONDS JACK,0.7156,0.0378,0.2466
SPADES JACK DIAMONDS JACK,0.3108,0.018,0.6712
SPADES NINE SPADES SIX,0.6164,0.0098,0.3738
SPADES EIGHT SPADES SIX,0.5986,0.0088,0.3926
SPADES SEVEN SPADES SIX,0.5958,0.0078,0.3964
HEARTS SEVEN HEARTS EIGHT,0.6028,0.0102,0.387
HEARTS NINE HEARTS SEVEN,0.6192,0.0092,0.3716
SPADES JACK SPADES TEN,0.6788,0.0384,0.2828
CLUBS SIX HEARTS SEVEN,0.6494,0.0106,0.34
CLUBS SEVEN HEARTS SEVEN,0.4748,0.0152,0.51
CLUBS FOUR HEARTS SEVEN,0.6586,0.0114,0.33
CLUBS FIVE HEARTS SEVEN,0.6444,0.0102,0.3454
CLUBS TWO HEARTS SEVEN,0.6852,0.0132,0.3016
SPADES KING SPADES TEN,0.369,0.0062,0.6248
CLUBS THREE HEARTS SEVEN,0.6726,0.0128,0.3146
SPADES QUEEN SPADES TEN,0.6346,0.0814,0.284
SPADES ACE SPADES TEN,0.3858,0.0038,0.6104
SPADES KING HEARTS SEVEN,0.4402,0.0062,0.5536
SPADES QUEEN HEARTS SEVEN,0.6784,0.0916,0.23
SPADES ACE HEARTS SEVEN,0.447,0.006,0.547
SPADES TEN HEARTS SEVEN,0.6786,0.0078,0.3136
SPADES JACK HEARTS SEVEN,0.7322,0.0378,0.23
CLUBS ACE HEARTS TEN,0.3934,0.0052,0.6014
CLUBS TEN HEARTS NINE,0.6644,0.0118,0.3238
SPADES ACE HEARTS THREE,0.4394,0.0054,0.5552
SPADES ACE DIAMONDS KING,0.3554,0.0036,0.641
SPADES KING DIAMONDS KING,0.1642,0.0024,0.8334
SPADES KING HEARTS THREE,0.4526,0.0078,0.5396
HEARTS TEN CLUBS QUEEN,0.6826,0.0888,0.2286
HEARTS THREE SPADES QUEEN,0.6834,0.0948,0.2218
SPADES QUEEN DIAMONDS KING,0.242,0.0248,0.7332
HEARTS TEN CLUBS KING,0.3982,0.0094,0.5924
HEARTS NINE CLUBS ACE,0.4066,0.0068,0.5866
CLUBS TEN HEARTS TEN,0.4318,0.0096,0.5586
HEARTS NINE CLUBS QUEEN,0.6772,0.0874,0.2354
HEARTS NINE CLUBS KING,0.4032,0.0074,0.5894
SPADES QUEEN HEARTS TEN,0.6624,0.091,0.2466
