opposingHand,winningChance,drawChance,lostChance
CLUBS NINE DIAMONDS SEVEN,0.6636,0.011,0.3254
HEARTS THREE DIAMONDS NINE,0.6926,0.0116,0.2958
SPADES KING DIAMONDS NINE,0.441,0.0074,0.5516
SPADES QUEEN CLUBS NINE,0.6782,0.0888,0.233
DIAMONDS EIGHT DIAMONDS FOUR,0.673,0.0122,0.3148
SPADES KING SPADES EIGHT,0.4472,0.0046,0.5482
HEARTS SEVEN SPADES EIGHT,0.6574,0.0132,0.3294
DIAMONDS ACE DIAMONDS FOUR,0.4242,0.0042,0.5716
SPADES ACE SPADES EIGHT,0.4508,0.0038,0.5454
CLUBS NINE SPADES JACK,0.724,0.0392,0.2368
SPADES SEVEN SPADES FIVE,0.6126,0.0092,0.3782
DIAMONDS TWO DIAMONDS NINE,0.6926,0.0136,0.2938
CLUBS SIX DIAMONDS TEN,0.7068,0.0088,0.2844
DIAMONDS TWO SPADES FOUR,0.6736,0.0114,0.315
CLUBS TEN HEARTS SEVEN,0.6768,0.0076,0.3156
SPADES JACK SPADES TWO,0.704,0.038,0.258
HEARTS EIGHT SPADES JACK,0.7312,0.0378,0.231
CLUBS SEVEN SPADES FIVE,0.6618,0.007,0.3312
SPADES SIX DIAMONDS FIVE,0.6438,0.0096,0.3466
CLUBS JACK SPADES JACK,0.3644,0.0186,0.617
DIAMONDS KING CLUBS TWO,0.4668,0.0068,0.5264
SPADES SEVEN DIAMONDS SIX,0.6536,0.0098,0.3366
HEARTS FOUR HEARTS NINE,0.6498,0.0084,0.3418
SPADES QUEEN HEARTS TEN,0.6722,0.0848,0.243
SPADES SEVEN HEARTS QUEEN,0.6962,0.0894,0.2144
HEARTS SIX SPADES SIX,0.5146,0.011,0.4744
DIAMONDS THREE DIAMONDS FIVE,0.655,0.0104,0.3346
SPADES KING SPADES NINE,0.4386,0.0068,0.5546
SPADES KING DIAMONDS TWO,0.4626,0.0102,0.5272
DIAMONDS NINE HEARTS JACK,0.7196,0.04,0.2404
CLUBS JACK CLUBS ACE,0.2904,0.0134,0.6962
CLUBS FIVE DIAMONDS KING,0.4676,0.0086,0.5238
DIAMONDS EIGHT DIAMONDS SEVEN,0.6488,0.0134,0.3378
SPADES QUEEN DIAMONDS TEN,0.6964,0.0834,0.2202
HEARTS SIX DIAMONDS KING,0.4602,0.0086,0.5312
SPADES JACK SPADES THREE,0.6976,0.0418,0.2606
DIAMONDS ACE HEARTS JACK,0.2814,0.0138,0.7048
HEARTS TWO SPADES FIVE,0.6602,0.0146,0.3252
CLUBS EIGHT HEARTS TEN,0.6722,0.0088,0.319
HEARTS ACE CLUBS KING,0.3888,0.0042,0.607
HEARTS SEVEN HEARTS JACK,0.715,0.0364,0.2486
SPADES QUEEN CLUBS THREE,0.6954,0.0888,0.2158
CLUBS EIGHT HEARTS QUEEN,0.7042,0.0788,0.217
SPADES JACK HEARTS FOUR,0.7438,0.0434,0.2128
SPADES TEN CLUBS FOUR,0.702,0.0104,0.2876
SPADES FOUR HEARTS JACK,0.7284,0.042,0.2296
SPADES TWO HEARTS NINE,0.6926,0.011,0.2964
SPADES ACE SPADES TWO,0.4352,0.0052,0.5596
SPADES KING DIAMONDS TEN,0.4246,0.0062,0.5692
SPADES QUEEN HEARTS NINE,0.6828,0.0836,0.2336
SPADES SEVEN SPADES THREE,0.6484,0.0096,0.342
SPADES SIX DIAMONDS EIGHT,0.6632,0.0102,0.3266
CLUBS JACK DIAMONDS TEN,0.7234,0.0434,0.2332
DIAMONDS SIX HEARTS NINE,0.6758,0.0098,0.3144
CLUBS FOUR CLUBS ACE,0.4338,0.0042,0.562
CLUBS NINE DIAMONDS FOUR,0.687,0.0114,0.3016
SPADES JACK HEARTS QUEEN,0.0788,0.8998,0.0214
CLUBS EIGHT CLUBS QUEEN,0.6418,0.0932,0.265
HEARTS SIX HEARTS TWO,0.638,0.0096,0.3524
SPADES ACE DIAMONDS TEN,0.4442,0.0052,0.5506
CLUBS SIX CLUBS QUEEN,0.6454,0.0812,0.2734
SPADES NINE HEARTS QUEEN,0.6874,0.0834,0.2292
HEARTS FIVE HEARTS JACK,0.7088,0.038,0.2532
CLUBS SEVEN CLUBS FIVE,0.613,0.0092,0.3778
DIAMONDS THREE DIAMONDS EIGHT,0.6872,0.0134,0.2994
HEARTS FIVE CLUBS SEVEN,0.6602,0.0078,0.332
SPADES FIVE SPADES THREE,0.6214,0.0112,0.3674
SPADES FOUR HEARTS KING,0.4762,0.0072,0.5166
HEARTS SEVEN SPADES FOUR,0.67,0.0096,0.3204
HEARTS TWO DIAMONDS FOUR,0.6684,0.0102,0.3214
SPADES SIX SPADES FIVE,0.6034,0.0086,0.388
SPADES EIGHT HEARTS TEN,0.6802,0.0086,0.3112
CLUBS TEN DIAMONDS EIGHT,0.6578,0.0098,0.3324
HEARTS SIX SPADES FOUR,0.6648,0.0096,0.3256
HEARTS FIVE CLUBS ACE,0.4758,0.0034,0.5208
DIAMONDS THREE DIAMONDS SIX,0.6716,0.0152,0.3132
CLUBS JACK HEARTS NINE,0.7372,0.0388,0.224
DIAMONDS TEN SPADES THREE,0.7094,0.0072,0.2834
HEARTS FIVE DIAMONDS ACE,0.4572,0.0036,0.5392
HEARTS THREE HEARTS TWO,0.6304,0.0118,0.3578
HEARTS EIGHT SPADES TEN,0.6646,0.0102,0.3252
CLUBS SEVEN CLUBS ACE,0.442,0.0046,0.5534
SPADES ACE DIAMONDS ACE,0.1832,0.0038,0.813
DIAMONDS ACE CLUBS TWO,0.4644,0.007,0.5286
CLUBS NINE HEARTS THREE,0.6894,0.0106,0.3
HEARTS SIX CLUBS FOUR,0.6456,0.0112,0.3432
HEARTS ACE DIAMONDS EIGHT,0.4634,0.0038,0.5328
HEARTS FIVE HEARTS NINE,0.657,0.0094,0.3336
HEARTS SEVEN CLUBS SIX,0.6668,0.01,0.3232
CLUBS FIVE DIAMONDS SEVEN,0.6512,0.0094,0.3394
HEARTS FOUR CLUBS FIVE,0.6444,0.0094,0.3462
HEARTS FIVE HEARTS TEN,0.6614,0.0086,0.33
SPADES SEVEN CLUBS THREE,0.6774,0.012,0.3106
CLUBS JACK HEARTS JACK,0.3552,0.0192,0.6256
SPADES NINE DIAMONDS TEN,0.66,0.012,0.328
HEARTS EIGHT SPADES SIX,0.6698,0.0086,0.3216
CLUBS JACK HEARTS FIVE,0.7368,0.0392,0.224
CLUBS EIGHT HEARTS ACE,0.4646,0.0046,0.5308
SPADES JACK HEARTS ACE,0.3084,0.0188,0.6728
DIAMONDS SEVEN CLUBS QUEEN,0.7114,0.0812,0.2074
CLUBS TEN SPADES QUEEN,0.6922,0.0836,0.2242
CLUBS FOUR DIAMONDS SEVEN,0.6794,0.0078,0.3128
CLUBS JACK HEARTS SIX,0.737,0.044,0.219
CLUBS FIVE CLUBS FOUR,0.6024,0.0088,0.3888
CLUBS TEN CLUBS QUEEN,0.6592,0.0814,0.2594
HEARTS THREE HEARTS KING,0.447,0.0076,0.5454
SPADES KING CLUBS ACE,0.4046,0.0036,0.5918
SPADES THREE SPADES TWO,0.6396,0.0084,0.352
CLUBS EIGHT CLUBS KING,0.4318,0.009,0.5592
SPADES QUEEN SPADES SIX,0.6528,0.0782,0.269
CLUBS EIGHT DIAMONDS SEVEN,0.6536,0.0096,0.3368
CLUBS SEVEN HEARTS TEN,0.6806,0.0106,0.3088
DIAMONDS TWO CLUBS SIX,0.6742,0.0088,0.317
SPADES NINE SPADES THREE,0.643,0.0134,0.3436
SPADES EIGHT DIAMONDS SEVEN,0.6548,0.0078,0.3374
CLUBS SEVEN DIAMONDS ACE,0.4636,0.0044,0.532
HEARTS FOUR CLUBS TWO,0.676,0.0096,0.3144
CLUBS FIVE SPADES THREE,0.653,0.0094,0.3376
SPADES ACE CLUBS EIGHT,0.4654,0.0036,0.531
CLUBS TWO HEARTS JACK,0.7542,0.0426,0.2032
SPADES QUEEN HEARTS FIVE,0.6836,0.083,0.2334
CLUBS NINE DIAMONDS FIVE,0.6714,0.0088,0.3198
CLUBS FIVE DIAMONDS FIVE,0.4884,0.015,0.4966
DIAMONDS TWO HEARTS JACK,0.7458,0.0452,0.209
HEARTS THREE SPADES TWO,0.6758,0.0118,0.3124
CLUBS NINE DIAMONDS SIX,0.6716,0.009,0.3194
CLUBS TEN SPADES EIGHT,0.6768,0.0098,0.3134
DIAMONDS THREE CLUBS KING,0.471,0.0088,0.5202
SPADES KING CLUBS EIGHT,0.4684,0.0058,0.5258
DIAMONDS TWO SPADES QUEEN,0.6958,0.086,0.2182
SPADES FIVE HEARTS NINE,0.6854,0.0078,0.3068
SPADES NINE DIAMONDS KING,0.4494,0.008,0.5426
DIAMONDS KING SPADES TWO,0.4592,0.0068,0.534
HEARTS THREE HEARTS NINE,0.651,0.0102,0.3388
DIAMONDS THREE SPADES FIVE,0.649,0.0118,0.3392
CLUBS KING DIAMONDS FOUR,0.4682,0.008,0.5238
HEARTS THREE SPADES EIGHT,0.7026,0.0076,0.2898
HEARTS NINE DIAMONDS FOUR,0.6762,0.01,0.3138
DIAMONDS THREE HEARTS NINE,0.6876,0.0098,0.3026
CLUBS SEVEN SPADES THREE,0.674,0.0078,0.3182
SPADES FOUR HEARTS NINE,0.6884,0.0102,0.3014
DIAMONDS THREE SPADES TEN,0.7016,0.0104,0.288
DIAMONDS SEVEN HEARTS TEN,0.683,0.0102,0.3068
SPADES TEN SPADES NINE,0.638,0.0102,0.3518
HEARTS SIX HEARTS ACE,0.4584,0.0044,0.5372
HEARTS EIGHT CLUBS THREE,0.6932,0.0102,0.2966
HEARTS SEVEN HEARTS THREE,0.6462,0.0096,0.3442
CLUBS JACK DIAMONDS NINE,0.7236,0.041,0.2354
CLUBS NINE CLUBS QUEEN,0.6584,0.0764,0.2652
DIAMONDS THREE SPADES KING,0.4676,0.0082,0.5242
HEARTS SIX CLUBS TWO,0.682,0.0102,0.3078
HEARTS SEVEN CLUBS QUEEN,0.6956,0.086,0.2184
DIAMONDS TWO SPADES SIX,0.6718,0.0116,0.3166
DIAMONDS ACE SPADES FIVE,0.4468,0.0064,0.5468
CLUBS THREE HEARTS QUEEN,0.6924,0.0822,0.2254
SPADES JACK DIAMONDS ACE,0.2862,0.0154,0.6984
HEARTS SEVEN DIAMONDS KING,0.471,0.0068,0.5222
SPADES TEN HEARTS QUEEN,0.6804,0.0846,0.235
SPADES THREE HEARTS KING,0.475,0.006,0.519
CLUBS SEVEN HEARTS TWO,0.7054,0.0106,0.284
HEARTS TWO SPADES SIX,0.6826,0.0106,0.3068
SPADES TEN DIAMONDS NINE,0.6674,0.0084,0.3242
HEARTS QUEEN DIAMONDS FIVE,0.6796,0.085,0.2354
CLUBS EIGHT HEARTS FIVE,0.656,0.0098,0.3342
SPADES ACE CLUBS SEVEN,0.4664,0.0052,0.5284
HEARTS SEVEN HEARTS NINE,0.6272,0.009,0.3638
HEARTS FIVE CLUBS KING,0.4786,0.007,0.5144
SPADES KING SPADES TWO,0.4488,0.0096,0.5416
SPADES TEN DIAMONDS FOUR,0.6918,0.0108,0.2974
DIAMONDS ACE CLUBS THREE,0.462,0.0054,0.5326
SPADES JACK DIAMONDS SIX,0.7398,0.0388,0.2214
DIAMONDS SIX DIAMONDS FIVE,0.638,0.011,0.351
SPADES FIVE DIAMONDS FOUR,0.645,0.009,0.346
DIAMONDS THREE CLUBS ACE,0.4594,0.0056,0.535
HEARTS SEVEN SPADES NINE,0.669,0.0094,0.3216
HEARTS SEVEN HEARTS FOUR,0.6414,0.0094,0.3492
CLUBS SIX HEARTS KING,0.4834,0.0054,0.5112
CLUBS SEVEN SPADES SEVEN,0.4976,0.011,0.4914
SPADES SIX CLUBS TWO,0.6852,0.0096,0.3052
CLUBS NINE CLUBS FOUR,0.6616,0.009,0.3294
CLUBS NINE DIAMONDS EIGHT,0.6588,0.0104,0.3308
HEARTS FOUR CLUBS FOUR,0.4952,0.0172,0.4876
CLUBS THREE DIAMONDS KING,0.4654,0.0052,0.5294
SPADES TWO HEARTS QUEEN,0.701,0.0858,0.2132
HEARTS QUEEN DIAMONDS SIX,0.6852,0.0874,0.2274
SPADES JACK SPADES SIX,0.7102,0.037,0.2528
HEARTS EIGHT HEARTS SEVEN,0.6252,0.0082,0.3666
HEARTS TWO CLUBS ACE,0.4764,0.005,0.5186
CLUBS FIVE SPADES FOUR,0.6402,0.012,0.3478
DIAMONDS NINE DIAMONDS FOUR,0.6838,0.0094,0.3068
DIAMONDS KING DIAMONDS SIX,0.4284,0.006,0.5656
CLUBS FOUR DIAMONDS KING,0.4588,0.0088,0.5324
SPADES NINE DIAMONDS FIVE,0.6802,0.0128,0.307
SPADES NINE DIAMONDS SIX,0.6584,0.0086,0.333
HEARTS SEVEN DIAMONDS FIVE,0.6378,0.0098,0.3524
CLUBS FOUR DIAMONDS FIVE,0.6456,0.0104,0.344
HEARTS SEVEN SPADES THREE,0.6716,0.008,0.3204
HEARTS EIGHT HEARTS THREE,0.6662,0.0104,0.3234
HEARTS ACE HEARTS QUEEN,0.2954,0.013,0.6916
SPADES FIVE HEARTS JACK,0.744,0.0376,0.2184
HEARTS FOUR DIAMONDS FIVE,0.649,0.0142,0.3368
HEARTS JACK CLUBS QUEEN,0.0708,0.9068,0.0224
DIAMONDS TEN DIAMONDS SIX,0.6808,0.01,0.3092
HEARTS EIGHT SPADES QUEEN,0.6884,0.0892,0.2224
CLUBS THREE HEARTS JACK,0.7326,0.045,0.2224
DIAMONDS ACE DIAMONDS NINE,0.418,0.0074,0.5746
SPADES FOUR CLUBS KING,0.482,0.0054,0.5126
CLUBS NINE SPADES TWO,0.7008,0.0108,0.2884
CLUBS THREE SPADES TWO,0.6692,0.0102,0.3206
HEARTS TWO CLUBS TWO,0.5124,0.017,0.4706
SPADES JACK HEARTS KING,0.2982,0.0252,0.6766
DIAMONDS TWO DIAMONDS SIX,0.6668,0.013,0.3202
HEARTS SEVEN CLUBS THREE,0.6746,0.0078,0.3176
SPADES KING HEARTS THREE,0.4552,0.0064,0.5384
SPADES FIVE DIAMONDS SEVEN,0.6554,0.0106,0.334
SPADES SEVEN DIAMONDS SEVEN,0.485,0.0174,0.4976
DIAMONDS THREE SPADES FOUR,0.6498,0.0102,0.34
HEARTS SIX CLUBS EIGHT,0.6658,0.008,0.3262
HEARTS EIGHT DIAMONDS TWO,0.6924,0.0088,0.2988
SPADES FIVE DIAMONDS NINE,0.6844,0.01,0.3056
CLUBS THREE HEARTS KING,0.48,0.0082,0.5118
CLUBS FOUR SPADES FOUR,0.4944,0.0172,0.4884
HEARTS QUEEN DIAMONDS FOUR,0.6808,0.0922,0.227
HEARTS KING CLUBS QUEEN,0.287,0.0232,0.6898
DIAMONDS NINE SPADES TWO,0.6968,0.0102,0.293
CLUBS FIVE DIAMONDS TEN,0.6952,0.0108,0.294
HEARTS SIX CLUBS SIX,0.4968,0.015,0.4882
SPADES NINE CLUBS FOUR,0.7012,0.0076,0.2912
CLUBS FIVE SPADES FIVE,0.5042,0.016,0.4798
SPADES TWO DIAMONDS SIX,0.67,0.0116,0.3184
SPADES NINE HEARTS THREE,0.6922,0.0098,0.298
CLUBS KING HEARTS NINE,0.4512,0.0086,0.5402
SPADES QUEEN HEARTS JACK,0.0732,0.9056,0.0212
DIAMONDS ACE CLUBS QUEEN,0.2788,0.0158,0.7054
DIAMONDS NINE SPADES THREE,0.6986,0.0118,0.2896
CLUBS SIX HEARTS TWO,0.6824,0.0108,0.3068
HEARTS ACE CLUBS ACE,0.1946,0.0038,0.8016
SPADES SEVEN DIAMONDS TEN,0.683,0.0102,0.3068
CLUBS THREE SPADES THREE,0.5072,0.014,0.4788
CLUBS TWO DIAMONDS SIX,0.6816,0.012,0.3064
CLUBS FIVE SPADES SIX,0.639,0.0056,0.3554
DIAMONDS ACE SPADES SIX,0.4594,0.0052,0.5354
HEARTS EIGHT DIAMONDS NINE,0.6582,0.0096,0.3322
HEARTS FOUR CLUBS KING,0.4676,0.0082,0.5242
HEARTS EIGHT HEARTS NINE,0.6156,0.011,0.3734
CLUBS EIGHT CLUBS THREE,0.6472,0.0092,0.3436
CLUBS KING DIAMONDS FIVE,0.4602,0.0084,0.5314
HEARTS TWO HEARTS JACK,0.7032,0.0378,0.259
HEARTS FOUR SPADES SEVEN,0.6676,0.0112,0.3212
CLUBS EIGHT HEARTS THREE,0.691,0.0088,0.3002
HEARTS THREE HEARTS TEN,0.659,0.0078,0.3332
CLUBS NINE SPADES SIX,0.6712,0.0084,0.3204
SPADES KING CLUBS TEN,0.4356,0.0076,0.5568
DIAMONDS TEN HEARTS JACK,0.716,0.0422,0.2418
DIAMONDS THREE SPADES QUEEN,0.6748,0.0918,0.2334
HEARTS SIX HEARTS NINE,0.6384,0.009,0.3526
SPADES NINE HEARTS TWO,0.696,0.01,0.294
CLUBS EIGHT SPADES SEVEN,0.659,0.009,0.332
HEARTS SIX CLUBS ACE,0.4602,0.0058,0.534
CLUBS NINE DIAMONDS NINE,0.474,0.0122,0.5138
CLUBS FOUR HEARTS KING,0.4768,0.006,0.5172
HEARTS TWO DIAMONDS FIVE,0.6634,0.012,0.3246
HEARTS TWO CLUBS QUEEN,0.7048,0.0824,0.2128
DIAMONDS NINE HEARTS QUEEN,0.6932,0.0846,0.2222
HEARTS SEVEN HEARTS KING,0.4446,0.0064,0.549
SPADES JACK CLUBS QUEEN,0.0744,0.9072,0.0184
DIAMONDS KING DIAMONDS EIGHT,0.4232,0.0074,0.5694
DIAMONDS NINE CLUBS QUEEN,0.6896,0.083,0.2274
SPADES ACE CLUBS THREE,0.4742,0.0048,0.521
DIAMONDS NINE CLUBS ACE,0.4486,0.0044,0.547
CLUBS SEVEN CLUBS THREE,0.6444,0.011,0.3446
HEARTS FIVE DIAMONDS FIVE,0.4996,0.0158,0.4846
CLUBS ACE CLUBS KING,0.379,0.004,0.617
SPADES ACE SPADES SEVEN,0.4494,0.0048,0.5458
SPADES NINE HEARTS ACE,0.4544,0.0054,0.5402
SPADES TEN DIAMONDS EIGHT,0.6764,0.0112,0.3124
SPADES EIGHT HEARTS ACE,0.463,0.004,0.533
HEARTS THREE SPADES FIVE,0.6558,0.0058,0.3384
HEARTS FIVE CLUBS TWO,0.6656,0.01,0.3244
HEARTS ACE HEARTS KING,0.3778,0.0068,0.6154
HEARTS TEN HEARTS NINE,0.632,0.009,0.359
CLUBS ACE DIAMONDS FOUR,0.453,0.006,0.541
CLUBS EIGHT DIAMONDS FOUR,0.6776,0.0112,0.3112
HEARTS FIVE HEARTS THREE,0.6266,0.0098,0.3636
SPADES SIX SPADES THREE,0.6402,0.0112,0.3486
DIAMONDS EIGHT HEARTS NINE,0.6512,0.0098,0.339
CLUBS TEN HEARTS THREE,0.7086,0.01,0.2814
DIAMONDS THREE DIAMONDS SEVEN,0.679,0.0118,0.3092
HEARTS FOUR DIAMONDS ACE,0.4642,0.0056,0.5302
SPADES JACK SPADES FIVE,0.6894,0.041,0.2696
CLUBS JACK SPADES SIX,0.7442,0.0406,0.2152
HEARTS EIGHT CLUBS TWO,0.6916,0.01,0.2984
HEARTS KING CLUBS KING,0.1952,0.0034,0.8014
CLUBS FOUR HEARTS ACE,0.4752,0.003,0.5218
CLUBS THREE CLUBS TWO,0.6288,0.01,0.3612
HEARTS SEVEN SPADES SIX,0.6688,0.0092,0.322
SPADES TEN CLUBS QUEEN,0.6852,0.0766,0.2382
SPADES TEN CLUBS SEVEN,0.6816,0.0106,0.3078
DIAMONDS TWO HEARTS NINE,0.7032,0.0118,0.285
CLUBS FOUR CLUBS THREE,0.6244,0.0094,0.3662
CLUBS ACE HEARTS NINE,0.4566,0.0026,0.5408
SPADES JACK HEARTS TEN,0.7308,0.0376,0.2316
DIAMONDS THREE SPADES TWO,0.6684,0.0098,0.3218
HEARTS THREE HEARTS QUEEN,0.6512,0.0864,0.2624
SPADES SIX DIAMONDS NINE,0.673,0.0098,0.3172
HEARTS JACK DIAMONDS FIVE,0.735,0.0466,0.2184
SPADES KING DIAMONDS SIX,0.4728,0.0072,0.52
HEARTS JACK CLUBS KING,0.2946,0.0248,0.6806
CLUBS JACK HEARTS FOUR,0.7306,0.0414,0.228
DIAMONDS KING SPADES FOUR,0.4742,0.0084,0.5174
SPADES FIVE CLUBS TWO,0.6696,0.0118,0.3186
SPADES ACE HEARTS EIGHT,0.4708,0.0046,0.5246
HEARTS FOUR SPADES FOUR,0.5158,0.0132,0.471
CLUBS TEN CLUBS FIVE,0.662,0.008,0.33
CLUBS SIX SPADES TWO,0.6862,0.0104,0.3034
DIAMONDS TWO SPADES THREE,0.6686,0.0112,0.3202
DIAMONDS KING HEARTS JACK,0.2814,0.022,0.6966
SPADES TEN CLUBS THREE,0.6964,0.0122,0.2914
HEARTS SEVEN SPADES FIVE,0.66,0.011,0.329
HEARTS KING DIAMONDS FOUR,0.467,0.0056,0.5274
SPADES JACK CLUBS FOUR,0.7454,0.0438,0.2108
CLUBS FOUR HEARTS NINE,0.6912,0.0102,0.2986
DIAMONDS NINE CLUBS KING,0.4578,0.0078,0.5344
CLUBS TEN HEARTS NINE,0.6496,0.009,0.3414
DIAMONDS NINE DIAMONDS SEVEN,0.6582,0.0114,0.3304
DIAMONDS TEN DIAMONDS FIVE,0.7016,0.0108,0.2876
SPADES JACK CLUBS FIVE,0.7434,0.0392,0.2174
HEARTS FIVE SPADES FOUR,0.628,0.009,0.363
CLUBS TEN SPADES TEN,0.468,0.0098,0.5222
DIAMONDS ACE HEARTS QUEEN,0.2836,0.0114,0.705
CLUBS NINE HEARTS TEN,0.6634,0.0076,0.329
DIAMONDS EIGHT SPADES TWO,0.6856,0.0122,0.3022
HEARTS THREE CLUBS TWO,0.6664,0.0136,0.32
SPADES FOUR HEARTS QUEEN,0.682,0.0866,0.2314
CLUBS TEN CLUBS SEVEN,0.6416,0.0078,0.3506
SPADES SIX DIAMONDS SEVEN,0.6448,0.0122,0.343
SPADES THREE DIAMONDS FOUR,0.6546,0.0116,0.3338
HEARTS THREE CLUBS FIVE,0.6682,0.0086,0.3232
SPADES NINE SPADES FIVE,0.6514,0.0108,0.3378
DIAMONDS THREE DIAMONDS KING,0.424,0.0082,0.5678
CLUBS NINE HEARTS ACE,0.466,0.005,0.529
DIAMONDS KING DIAMONDS FOUR,0.4248,0.0082,0.567
HEARTS KING DIAMONDS SIX,0.4736,0.0082,0.5182
SPADES QUEEN SPADES JACK,0.0664,0.8592,0.0744
SPADES JACK SPADES FOUR,0.6982,0.0388,0.263
CLUBS TWO SPADES FOUR,0.664,0.0122,0.3238
CLUBS JACK HEARTS ACE,0.3066,0.0124,0.681
HEARTS EIGHT DIAMONDS FOUR,0.6652,0.012,0.3228
CLUBS SEVEN HEARTS THREE,0.6808,0.0108,0.3084
SPADES QUEEN HEARTS QUEEN,0.1752,0.017,0.8078
HEARTS EIGHT CLUBS SIX,0.6516,0.0088,0.3396
SPADES QUEEN CLUBS FIVE,0.692,0.0836,0.2244
DIAMONDS KING DIAMONDS SEVEN,0.4262,0.0064,0.5674
CLUBS NINE HEARTS QUEEN,0.6936,0.0836,0.2228
CLUBS THREE HEARTS TEN,0.7118,0.0096,0.2786
HEARTS TWO CLUBS THREE,0.667,0.0114,0.3216
HEARTS THREE HEARTS ACE,0.4376,0.0036,0.5588
CLUBS JACK CLUBS KING,0.2734,0.0236,0.703
DIAMONDS THREE SPADES SEVEN,0.6856,0.0108,0.3036
SPADES SEVEN DIAMONDS ACE,0.4772,0.0046,0.5182
SPADES TWO DIAMONDS FIVE,0.6684,0.0114,0.3202
CLUBS FIVE DIAMONDS NINE,0.6946,0.0106,0.2948
SPADES ACE CLUBS ACE,0.194,0.0028,0.8032
DIAMONDS TWO HEARTS ACE,0.4706,0.0036,0.5258
SPADES TEN HEARTS TWO,0.7074,0.0106,0.282
SPADES THREE DIAMONDS SIX,0.664,0.0134,0.3226
SPADES NINE SPADES SEVEN,0.6242,0.0092,0.3666
DIAMONDS THREE CLUBS EIGHT,0.6882,0.0114,0.3004
SPADES NINE HEARTS KING,0.4432,0.0072,0.5496
HEARTS QUEEN DIAMONDS SEVEN,0.6916,0.0872,0.2212
SPADES SIX CLUBS QUEEN,0.6952,0.082,0.2228
SPADES KING CLUBS QUEEN,0.2924,0.0276,0.68
CLUBS SIX DIAMONDS SEVEN,0.6594,0.0096,0.331
HEARTS TWO DIAMONDS KING,0.4588,0.0092,0.532
SPADES QUEEN CLUBS SEVEN,0.6874,0.0928,0.2198
DIAMONDS TWO DIAMONDS ACE,0.4174,0.0048,0.5778
CLUBS EIGHT CLUBS ACE,0.4392,0.0034,0.5574
SPADES SEVEN SPADES SIX,0.616,0.009,0.375
SPADES KING CLUBS SIX,0.4824,0.005,0.5126
CLUBS NINE SPADES FOUR,0.7058,0.0118,0.2824
SPADES QUEEN DIAMONDS FIVE,0.688,0.085,0.227
SPADES NINE CLUBS THREE,0.6976,0.0102,0.2922
HEARTS THREE CLUBS KING,0.4688,0.008,0.5232
HEARTS FIVE HEARTS QUEEN,0.646,0.0806,0.2734
SPADES FIVE HEARTS ACE,0.4662,0.005,0.5288
HEARTS FOUR CLUBS THREE,0.6572,0.009,0.3338
SPADES NINE CLUBS SIX,0.67,0.009,0.321
SPADES NINE HEARTS NINE,0.468,0.0122,0.5198
CLUBS TEN DIAMONDS NINE,0.671,0.0096,0.3194
SPADES ACE HEARTS QUEEN,0.3132,0.0152,0.6716
HEARTS FIVE SPADES TEN,0.7042,0.0102,0.2856
SPADES JACK CLUBS TWO,0.7434,0.0424,0.2142
DIAMONDS THREE DIAMONDS TWO,0.6674,0.0108,0.3218
CLUBS NINE CLUBS TWO,0.6578,0.0102,0.332
SPADES SEVEN DIAMONDS FIVE,0.65,0.0092,0.3408
CLUBS SEVEN HEARTS KING,0.4862,0.0054,0.5084
CLUBS TWO HEARTS TEN,0.7112,0.0098,0.279
HEARTS SIX CLUBS SEVEN,0.6646,0.0074,0.328
SPADES EIGHT CLUBS THREE,0.6932,0.0102,0.2966
DIAMONDS TEN HEARTS ACE,0.4474,0.0066,0.546
HEARTS FOUR HEARTS TWO,0.6298,0.0092,0.361
SPADES ACE HEARTS JACK,0.3078,0.0116,0.6806
CLUBS TEN HEARTS KING,0.4382,0.0064,0.5554
SPADES QUEEN DIAMONDS NINE,0.699,0.0828,0.2182
SPADES QUEEN HEARTS FOUR,0.6864,0.0894,0.2242
CLUBS SIX CLUBS THREE,0.6394,0.01,0.3506
DIAMONDS TWO CLUBS KING,0.4644,0.006,0.5296
CLUBS EIGHT DIAMONDS ACE,0.4564,0.0054,0.5382
HEARTS FOUR HEARTS KING,0.4582,0.0092,0.5326
CLUBS EIGHT CLUBS FIVE,0.6316,0.0104,0.358
SPADES EIGHT DIAMONDS TEN,0.6616,0.0128,0.3256
CLUBS TEN CLUBS THREE,0.6558,0.009,0.3352
SPADES EIGHT CLUBS ACE,0.4778,0.003,0.5192
CLUBS JACK CLUBS FIVE,0.6956,0.0336,0.2708
SPADES FOUR HEARTS ACE,0.4636,0.0048,0.5316
CLUBS FIVE HEARTS NINE,0.6894,0.0074,0.3032
HEARTS FIVE DIAMONDS EIGHT,0.6606,0.0096,0.3298
HEARTS FOUR DIAMONDS SIX,0.651,0.0098,0.3392
SPADES FIVE DIAMONDS EIGHT,0.664,0.0128,0.3232
CLUBS SIX DIAMONDS SIX,0.5008,0.013,0.4862
HEARTS SIX SPADES EIGHT,0.6592,0.0108,0.33
CLUBS TEN DIAMONDS FIVE,0.6982,0.0096,0.2922
DIAMONDS TWO CLUBS SEVEN,0.6954,0.0112,0.2934
SPADES SEVEN CLUBS QUEEN,0.701,0.0838,0.2152
HEARTS TWO DIAMONDS ACE,0.439,0.0066,0.5544
HEARTS THREE SPADES FOUR,0.6526,0.008,0.3394
CLUBS FOUR SPADES FIVE,0.6468,0.0106,0.3426
SPADES SIX CLUBS KING,0.4554,0.005,0.5396
SPADES KING HEARTS TWO,0.478,0.0082,0.5138
CLUBS JACK SPADES TWO,0.7494,0.0416,0.209
SPADES SIX SPADES TWO,0.6558,0.011,0.3332
CLUBS SEVEN HEARTS ACE,0.4716,0.0044,0.524
SPADES ACE HEARTS FOUR,0.4776,0.004,0.5184
CLUBS EIGHT HEARTS TWO,0.6872,0.008,0.3048
HEARTS SIX CLUBS KING,0.4714,0.0074,0.5212
CLUBS JACK CLUBS FOUR,0.6994,0.039,0.2616
DIAMONDS THREE HEARTS SIX,0.6722,0.0088,0.319
CLUBS SIX DIAMONDS KING,0.4628,0.0064,0.5308
SPADES ACE HEARTS KING,0.392,0.0044,0.6036
SPADES TEN DIAMONDS FIVE,0.6958,0.0112,0.293
DIAMONDS TWO CLUBS FIVE,0.664,0.0108,0.3252
HEARTS THREE DIAMONDS ACE,0.4448,0.0056,0.5496
CLUBS EIGHT CLUBS FOUR,0.643,0.0104,0.3466
CLUBS TEN SPADES THREE,0.7004,0.0082,0.2914
CLUBS JACK SPADES TEN,0.7324,0.0362,0.2314
CLUBS TWO HEARTS QUEEN,0.6972,0.0888,0.214
HEARTS THREE DIAMONDS EIGHT,0.6908,0.011,0.2982
HEARTS FIVE SPADES EIGHT,0.67,0.0102,0.3198
DIAMONDS ACE SPADES TWO,0.452,0.0038,0.5442
CLUBS SIX HEARTS TEN,0.6918,0.0068,0.3014
CLUBS SIX HEARTS NINE,0.673,0.009,0.318
HEARTS FOUR DIAMONDS TEN,0.697,0.0104,0.2926
DIAMONDS FIVE CLUBS QUEEN,0.6794,0.091,0.2296
CLUBS SIX HEARTS QUEEN,0.6908,0.081,0.2282
CLUBS SIX SPADES EIGHT,0.6614,0.0086,0.33
SPADES JACK HEARTS TWO,0.7462,0.0394,0.2144
DIAMONDS TWO CLUBS TWO,0.5048,0.014,0.4812
DIAMONDS TEN DIAMONDS NINE,0.6632,0.0128,0.324
CLUBS SIX SPADES FIVE,0.6346,0.01,0.3554
SPADES QUEEN HEARTS TWO,0.7014,0.085,0.2136
CLUBS TEN SPADES SEVEN,0.6834,0.009,0.3076
CLUBS FIVE DIAMONDS SIX,0.634,0.0102,0.3558
SPADES THREE HEARTS TEN,0.7012,0.01,0.2888
SPADES TWO CLUBS ACE,0.463,0.0056,0.5314
SPADES THREE DIAMONDS EIGHT,0.6964,0.0096,0.294
SPADES KING SPADES FIVE,0.4404,0.0074,0.5522
DIAMONDS THREE DIAMONDS TEN,0.6972,0.008,0.2948
SPADES NINE DIAMONDS NINE,0.4646,0.0108,0.5246
HEARTS SEVEN DIAMONDS NINE,0.659,0.0104,0.3306
HEARTS ACE DIAMONDS FIVE,0.4708,0.004,0.5252
DIAMONDS KING HEARTS TEN,0.4254,0.0072,0.5674
SPADES KING CLUBS TWO,0.4614,0.0082,0.5304
HEARTS SIX SPADES TEN,0.6906,0.01,0.2994
HEARTS FOUR SPADES NINE,0.6934,0.0128,0.2938
HEARTS SIX HEARTS KING,0.4422,0.006,0.5518
HEARTS EIGHT DIAMONDS SEVEN,0.6604,0.0088,0.3308
CLUBS NINE SPADES TEN,0.6832,0.01,0.3068
DIAMONDS ACE DIAMONDS TEN,0.4076,0.0042,0.5882
SPADES KING SPADES SEVEN,0.4508,0.0076,0.5416
SPADES NINE CLUBS FIVE,0.6762,0.0076,0.3162
SPADES EIGHT DIAMONDS KING,0.4664,0.0044,0.5292
CLUBS JACK CLUBS SEVEN,0.7032,0.0382,0.2586
CLUBS THREE DIAMONDS FOUR,0.645,0.0124,0.3426
DIAMONDS TWO DIAMONDS KING,0.4224,0.0074,0.5702
CLUBS EIGHT DIAMONDS SIX,0.6594,0.0096,0.331
HEARTS TWO HEARTS KING,0.4408,0.0068,0.5524
CLUBS SEVEN DIAMONDS FOUR,0.6748,0.0128,0.3124
DIAMONDS TWO DIAMONDS SEVEN,0.6916,0.01,0.2984
SPADES FIVE CLUBS KING,0.4706,0.0046,0.5248
SPADES THREE HEARTS JACK,0.7416,0.044,0.2144
CLUBS TEN DIAMONDS ACE,0.4346,0.0054,0.56
DIAMONDS TWO HEARTS FOUR,0.6682,0.01,0.3218
HEARTS SEVEN DIAMONDS TEN,0.6798,0.0108,0.3094
SPADES ACE SPADES TEN,0.427,0.0056,0.5674
SPADES SEVEN HEARTS ACE,0.4846,0.0036,0.5118
HEARTS ACE CLUBS QUEEN,0.3056,0.011,0.6834
SPADES TEN SPADES SIX,0.6474,0.0102,0.3424
HEARTS SEVEN CLUBS FOUR,0.6704,0.0098,0.3198
HEARTS FOUR HEARTS THREE,0.6176,0.0128,0.3696
HEARTS FOUR SPADES TWO,0.6694,0.0118,0.3188
CLUBS SIX DIAMONDS EIGHT,0.6526,0.009,0.3384
HEARTS SEVEN CLUBS TWO,0.6858,0.0094,0.3048
SPADES FIVE CLUBS QUEEN,0.672,0.0894,0.2386
DIAMONDS THREE CLUBS SIX,0.6612,0.0116,0.3272
DIAMONDS SEVEN CLUBS KING,0.4734,0.0074,0.5192
CLUBS SEVEN CLUBS TWO,0.6416,0.0118,0.3466
HEARTS FIVE HEARTS FOUR,0.5988,0.0128,0.3884
SPADES JACK HEARTS NINE,0.7294,0.0354,0.2352
HEARTS THREE SPADES SEVEN,0.6862,0.0112,0.3026
CLUBS EIGHT HEARTS FOUR,0.6914,0.0102,0.2984
SPADES QUEEN SPADES EIGHT,0.6492,0.0822,0.2686
SPADES TEN HEARTS NINE,0.667,0.0078,0.3252
CLUBS THREE DIAMONDS SEVEN,0.683,0.0112,0.3058
CLUBS TEN CLUBS EIGHT,0.6422,0.011,0.3468
CLUBS THREE CLUBS KING,0.4568,0.008,0.5352
SPADES KING HEARTS JACK,0.3068,0.0232,0.67
DIAMONDS KING HEARTS NINE,0.438,0.007,0.555
SPADES ACE DIAMONDS SEVEN,0.4586,0.0044,0.537
SPADES JACK SPADES EIGHT,0.685,0.0382,0.2768
HEARTS TWO SPADES THREE,0.675,0.01,0.315
CLUBS SEVEN DIAMONDS TEN,0.6862,0.0084,0.3054
CLUBS FIVE HEARTS JACK,0.7294,0.0448,0.2258
CLUBS TEN DIAMONDS KING,0.4378,0.0072,0.555
HEARTS SEVEN DIAMONDS SIX,0.6516,0.0086,0.3398
SPADES FOUR DIAMONDS NINE,0.6796,0.0118,0.3086
SPADES EIGHT CLUBS FIVE,0.6616,0.0084,0.33
HEARTS JACK HEARTS TEN,0.691,0.0378,0.2712
SPADES KING HEARTS TEN,0.4352,0.0066,0.5582
SPADES QUEEN DIAMONDS SIX,0.683,0.0858,0.2312
SPADES JACK DIAMONDS EIGHT,0.7332,0.0392,0.2276
SPADES TWO DIAMONDS FOUR,0.6614,0.014,0.3246
SPADES TEN SPADES EIGHT,0.6328,0.0104,0.3568
SPADES EIGHT HEARTS NINE,0.6558,0.0112,0.333
HEARTS KING HEARTS JACK,0.288,0.0236,0.6884
SPADES KING SPADES THREE,0.4374,0.0068,0.5558
CLUBS TWO HEARTS ACE,0.466,0.0058,0.5282
SPADES EIGHT SPADES FOUR,0.636,0.0116,0.3524
HEARTS THREE DIAMONDS FIVE,0.6462,0.0104,0.3434
HEARTS EIGHT DIAMONDS THREE,0.6922,0.0102,0.2976
DIAMONDS SEVEN DIAMONDS FOUR,0.6562,0.0124,0.3314
CLUBS NINE HEARTS NINE,0.4772,0.0082,0.5146
CLUBS JACK CLUBS THREE,0.6982,0.0418,0.26
HEARTS FIVE CLUBS QUEEN,0.6966,0.0814,0.222
CLUBS SEVEN DIAMONDS EIGHT,0.6562,0.0096,0.3342
DIAMONDS EIGHT DIAMONDS SIX,0.6598,0.0096,0.3306
HEARTS SEVEN DIAMONDS EIGHT,0.6498,0.0096,0.3406
HEARTS SIX HEARTS THREE,0.632,0.0098,0.3582
HEARTS EIGHT HEARTS ACE,0.445,0.0052,0.5498
HEARTS SIX DIAMONDS TEN,0.7054,0.0092,0.2854
SPADES SIX DIAMONDS KING,0.4644,0.0062,0.5294
CLUBS THREE HEARTS ACE,0.4716,0.0032,0.5252
SPADES TEN DIAMONDS ACE,0.4156,0.0048,0.5796
HEARTS TEN DIAMONDS FOUR,0.7032,0.0082,0.2886
HEARTS EIGHT SPADES SEVEN,0.65,0.0142,0.3358
CLUBS FIVE CLUBS KING,0.4484,0.0056,0.546
CLUBS NINE SPADES NINE,0.4712,0.0114,0.5174
HEARTS EIGHT HEARTS SIX,0.625,0.0076,0.3674
DIAMONDS TWO SPADES FIVE,0.6758,0.01,0.3142
SPADES TEN CLUBS SIX,0.6976,0.0098,0.2926
DIAMONDS THREE DIAMONDS NINE,0.681,0.0106,0.3084
SPADES KING SPADES JACK,0.2844,0.0248,0.6908
SPADES JACK DIAMONDS FIVE,0.7404,0.038,0.2216
CLUBS JACK DIAMONDS SEVEN,0.743,0.0414,0.2156
SPADES SEVEN HEARTS JACK,0.7436,0.0386,0.2178
SPADES QUEEN DIAMONDS KING,0.2688,0.0226,0.7086
HEARTS SEVEN CLUBS EIGHT,0.6596,0.0102,0.3302
HEARTS SIX DIAMONDS FIVE,0.6416,0.0104,0.348
CLUBS EIGHT SPADES EIGHT,0.498,0.0102,0.4918
SPADES NINE DIAMONDS ACE,0.4394,0.0064,0.5542
SPADES ACE SPADES FIVE,0.439,0.0046,0.5564
HEARTS FIVE CLUBS FIVE,0.4926,0.014,0.4934
DIAMONDS THREE HEARTS TWO,0.6664,0.012,0.3216
SPADES TEN HEARTS TEN,0.4728,0.0096,0.5176
HEARTS EIGHT CLUBS KING,0.4752,0.0072,0.5176
DIAMONDS TWO HEARTS SIX,0.6886,0.0082,0.3032
SPADES TWO DIAMONDS SEVEN,0.691,0.011,0.298
DIAMONDS TWO HEARTS TWO,0.5228,0.0152,0.462
SPADES QUEEN SPADES FOUR,0.6446,0.0824,0.273
HEARTS TWO CLUBS FOUR,0.6736,0.0098,0.3166
CLUBS THREE CLUBS QUEEN,0.6446,0.087,0.2684
