opposingHand,winningChance,drawChance,lostChance
DIAMONDS ACE DIAMONDS TEN
CLUBS TEN HEARTS SIX,0.7534,0.018,0.2286
DIAMONDS THREE SPADES NINE,0.6842,0.0068,0.309
CLUBS ACE CLUBS KING,0.2738,0.0442,0.682
DIAMONDS THREE CLUBS NINE,0.6956,0.0054,0.299
CLUBS EIGHT HEARTS KING,0.686,0.005,0.309
SPADES NINE SPADES FOUR,0.6602,0.0044,0.3354
HEARTS SEVEN DIAMONDS KING,0.661,0.0044,0.3346
CLUBS TWO CLUBS QUEEN,0.6288,0.0058,0.3654
SPADES SEVEN DIAMONDS SIX,0.6414,0.005,0.3536
SPADES TEN SPADES NINE,0.6898,0.0164,0.2938
DIAMONDS JACK HEARTS JACK,0.339,0.004,0.657
CLUBS JACK SPADES QUEEN,0.608,0.0038,0.3882
SPADES JACK HEARTS THREE,0.6682,0.0046,0.3272
DIAMONDS TWO SPADES TEN,0.7738,0.026,0.2002
DIAMONDS EIGHT HEARTS QUEEN,0.6508,0.0048,0.3444
HEARTS SEVEN SPADES NINE,0.6588,0.003,0.3382
HEARTS SIX SPADES FOUR,0.6506,0.0048,0.3446
SPADES ACE HEARTS QUEEN,0.2944,0.0666,0.639
HEARTS EIGHT HEARTS JACK,0.616,0.0042,0.3798
SPADES TEN CLUBS FOUR,0.7608,0.025,0.2142
CLUBS EIGHT CLUBS KING,0.6336,0.005,0.3614
HEARTS FIVE HEARTS FOUR,0.6138,0.0066,0.3796
HEARTS SIX HEARTS TEN,0.7052,0.0202,0.2746
SPADES ACE SPADES SEVEN,0.6264,0.1082,0.2654
CLUBS TEN DIAMONDS FOUR,0.7548,0.0248,0.2204
SPADES ACE DIAMONDS QUEEN,0.2768,0.067,0.6562
DIAMONDS THREE CLUBS ACE,0.6574,0.1072,0.2354
CLUBS FIVE CLUBS THREE,0.6202,0.0058,0.374
SPADES TEN CLUBS QUEEN,0.7468,0.017,0.2362
CLUBS SEVEN HEARTS THREE,0.6744,0.0058,0.3198
DIAMONDS TWO DIAMONDS KING,0.661,0.0052,0.3338
SPADES QUEEN CLUBS TWO,0.6684,0.0042,0.3274
CLUBS SEVEN DIAMONDS FOUR,0.6772,0.0042,0.3186
CLUBS TEN HEARTS SEVEN,0.7454,0.0236,0.231
DIAMONDS THREE DIAMONDS SIX,0.6652,0.006,0.3288
HEARTS EIGHT HEARTS FOUR,0.654,0.0042,0.3418
CLUBS JACK SPADES TEN,0.7082,0.0178,0.274
CLUBS QUEEN DIAMONDS FOUR,0.662,0.0056,0.3324
CLUBS FOUR SPADES THREE,0.6566,0.0048,0.3386
DIAMONDS KING HEARTS JACK,0.6138,0.0044,0.3818
HEARTS FOUR DIAMONDS NINE,0.6914,0.0046,0.304
CLUBS ACE DIAMONDS FIVE,0.653,0.1086,0.2384
DIAMONDS THREE CLUBS FIVE,0.6574,0.0052,0.3374
CLUBS SEVEN HEARTS NINE,0.6588,0.0024,0.3388
SPADES SIX SPADES THREE,0.643,0.0038,0.3532
SPADES FIVE DIAMONDS NINE,0.6778,0.006,0.3162
CLUBS TEN CLUBS SIX,0.7118,0.0242,0.264
SPADES FOUR DIAMONDS EIGHT,0.671,0.0044,0.3246
SPADES NINE SPADES EIGHT,0.6176,0.0062,0.3762
SPADES THREE HEARTS TEN,0.769,0.0256,0.2054
SPADES TEN CLUBS SIX,0.7626,0.0202,0.2172
CLUBS EIGHT DIAMONDS NINE,0.6566,0.0052,0.3382
CLUBS SIX DIAMONDS NINE,0.66,0.004,0.336
HEARTS FIVE SPADES EIGHT,0.6634,0.0036,0.333
HEARTS THREE CLUBS ACE,0.6556,0.116,0.2284
SPADES KING CLUBS NINE,0.6592,0.004,0.3368
SPADES QUEEN HEARTS KING,0.6278,0.006,0.3662
DIAMONDS JACK CLUBS ACE,0.2708,0.0852,0.644
CLUBS NINE HEARTS FOUR,0.6848,0.0044,0.3108
DIAMONDS THREE DIAMONDS NINE,0.7054,0.0056,0.289
CLUBS SIX DIAMONDS KING,0.653,0.0066,0.3404
DIAMONDS KING HEARTS ACE,0.2734,0.0506,0.676
SPADES SIX SPADES FOUR,0.6236,0.0042,0.3722
SPADES TEN DIAMONDS EIGHT,0.7292,0.0212,0.2496
SPADES ACE HEARTS FOUR,0.6452,0.1088,0.246
HEARTS KING SPADES TWO,0.6786,0.0046,0.3168
CLUBS TWO HEARTS KING,0.6744,0.0052,0.3204
CLUBS TWO HEARTS ACE,0.654,0.1174,0.2286
DIAMONDS THREE SPADES KING,0.656,0.0056,0.3384
HEARTS FOUR CLUBS QUEEN,0.667,0.0042,0.3288
SPADES NINE CLUBS KING,0.668,0.0038,0.3282
HEARTS SIX SPADES SIX,0.5034,0.0034,0.4932
SPADES KING SPADES TEN,0.714,0.02,0.266
HEARTS EIGHT SPADES FIVE,0.6648,0.004,0.3312
SPADES ACE SPADES FIVE,0.611,0.1094,0.2796
HEARTS SIX HEARTS FIVE,0.6034,0.0028,0.3938
SPADES JACK CLUBS SIX,0.6686,0.0048,0.3266
HEARTS FOUR DIAMONDS EIGHT,0.6762,0.0046,0.3192
DIAMONDS THREE HEARTS TWO,0.6714,0.0058,0.3228
DIAMONDS NINE CLUBS QUEEN,0.6512,0.0054,0.3434
CLUBS FIVE SPADES SIX,0.6374,0.0046,0.358
HEARTS SEVEN SPADES FOUR,0.6778,0.0044,0.3178
CLUBS SIX DIAMONDS FOUR,0.6576,0.0048,0.3376
CLUBS NINE HEARTS JACK,0.6488,0.004,0.3472
SPADES JACK SPADES SIX,0.6494,0.0028,0.3478
HEARTS TEN HEARTS NINE,0.6856,0.0188,0.2956
SPADES TEN HEARTS QUEEN,0.725,0.0168,0.2582
SPADES KING SPADES TWO,0.6452,0.006,0.3488
HEARTS TWO CLUBS QUEEN,0.679,0.006,0.315
CLUBS NINE CLUBS SEVEN,0.6108,0.0046,0.3846
HEARTS EIGHT CLUBS THREE,0.677,0.006,0.317
HEARTS TWO HEARTS ACE,0.6202,0.1076,0.2722
HEARTS SEVEN CLUBS SEVEN,0.498,0.0028,0.4992
DIAMONDS KING HEARTS TEN,0.7348,0.0192,0.246
DIAMONDS THREE CLUBS QUEEN,0.6554,0.0062,0.3384
SPADES ACE DIAMONDS FIVE,0.6452,0.119,0.2358
HEARTS FOUR SPADES FOUR,0.5106,0.0042,0.4852
CLUBS TWO DIAMONDS EIGHT,0.686,0.0042,0.3098
CLUBS TWO HEARTS TEN,0.767,0.023,0.21
SPADES ACE SPADES TWO,0.6146,0.1116,0.2738
SPADES THREE CLUBS ACE,0.653,0.1086,0.2384
DIAMONDS KING CLUBS KING,0.3328,0.006,0.6612
SPADES ACE DIAMONDS SEVEN,0.663,0.117,0.22
SPADES NINE HEARTS KING,0.6496,0.0052,0.3452
HEARTS SEVEN CLUBS KING,0.6632,0.0046,0.3322
HEARTS EIGHT HEARTS NINE,0.6206,0.0034,0.376
SPADES EIGHT HEARTS KING,0.6694,0.0036,0.327
CLUBS JACK HEARTS THREE,0.6792,0.0042,0.3166
HEARTS KING HEARTS TEN,0.7028,0.0182,0.279
DIAMONDS TWO SPADES TWO,0.5,0.0066,0.4934
DIAMONDS KING DIAMONDS NINE,0.6542,0.0062,0.3396
SPADES JACK CLUBS TWO,0.6914,0.0034,0.3052
CLUBS NINE SPADES FOUR,0.71,0.0046,0.2854
HEARTS FOUR HEARTS THREE,0.6226,0.0062,0.3712
HEARTS FOUR CLUBS TWO,0.674,0.0034,0.3226
SPADES TWO DIAMONDS FOUR,0.6686,0.0066,0.3248
DIAMONDS TWO CLUBS ACE,0.6534,0.1132,0.2334
HEARTS THREE CLUBS TWO,0.6812,0.0058,0.313
DIAMONDS SEVEN HEARTS JACK,0.654,0.005,0.341
CLUBS FOUR DIAMONDS SEVEN,0.6662,0.0044,0.3294
CLUBS SEVEN CLUBS THREE,0.639,0.005,0.356
HEARTS SIX HEARTS NINE,0.6248,0.0038,0.3714
CLUBS THREE DIAMONDS FOUR,0.6514,0.0052,0.3434
CLUBS TEN SPADES TEN,0.352,0.021,0.627
SPADES FIVE CLUBS TWO,0.6706,0.0064,0.323
CLUBS TEN HEARTS QUEEN,0.735,0.017,0.248
HEARTS JACK DIAMONDS FOUR,0.659,0.0038,0.3372
HEARTS FOUR SPADES SEVEN,0.657,0.005,0.338
CLUBS SEVEN SPADES EIGHT,0.6534,0.0038,0.3428
CLUBS TEN HEARTS ACE,0.0712,0.9076,0.0212
CLUBS JACK HEARTS KING,0.6222,0.0064,0.3714
CLUBS JACK HEARTS TWO,0.6754,0.0044,0.3202
HEARTS FIVE CLUBS SEVEN,0.6582,0.0046,0.3372
CLUBS FOUR DIAMONDS QUEEN,0.6634,0.005,0.3316
SPADES FIVE CLUBS KING,0.6676,0.005,0.3274
SPADES NINE SPADES THREE,0.6486,0.0058,0.3456
HEARTS FOUR CLUBS KING,0.6722,0.004,0.3238
HEARTS SIX CLUBS FOUR,0.6602,0.0034,0.3364
HEARTS EIGHT CLUBS FIVE,0.669,0.0038,0.3272
DIAMONDS KING SPADES FIVE,0.6644,0.0036,0.332
HEARTS ACE HEARTS QUEEN,0.2716,0.0518,0.6766
DIAMONDS TWO HEARTS THREE,0.6758,0.0058,0.3184
SPADES QUEEN CLUBS EIGHT,0.6532,0.0034,0.3434
SPADES THREE HEARTS JACK,0.6814,0.0034,0.3152
HEARTS KING DIAMONDS SEVEN,0.6712,0.0034,0.3254
HEARTS SIX HEARTS THREE,0.6398,0.0046,0.3556
SPADES SIX DIAMONDS SIX,0.5042,0.0046,0.4912
SPADES ACE HEARTS SEVEN,0.675,0.108,0.217
CLUBS SEVEN SPADES NINE,0.6494,0.0032,0.3474
CLUBS SIX SPADES FIVE,0.6612,0.0038,0.335
DIAMONDS KING DIAMONDS QUEEN,0.6162,0.0064,0.3774
DIAMONDS THREE DIAMONDS JACK,0.6652,0.0062,0.3286
SPADES FIVE HEARTS QUEEN,0.6748,0.0054,0.3198
CLUBS TEN SPADES SIX,0.759,0.021,0.22
CLUBS EIGHT CLUBS TWO,0.6536,0.0058,0.3406
CLUBS JACK CLUBS FOUR,0.6294,0.0044,0.3662
HEARTS FOUR HEARTS TWO,0.6328,0.0056,0.3616
SPADES FIVE HEARTS KING,0.6708,0.0044,0.3248
HEARTS TWO DIAMONDS KING,0.672,0.0066,0.3214
HEARTS TWO CLUBS THREE,0.67,0.0058,0.3242
HEARTS SIX SPADES SEVEN,0.644,0.0036,0.3524
SPADES ACE CLUBS TEN,0.069,0.9094,0.0216
SPADES EIGHT DIAMONDS FOUR,0.6852,0.0042,0.3106
HEARTS THREE CLUBS KING,0.6696,0.0076,0.3228
DIAMONDS THREE HEARTS SEVEN,0.6898,0.0056,0.3046
SPADES KING DIAMONDS FOUR,0.6538,0.004,0.3422
HEARTS THREE SPADES TWO,0.682,0.0048,0.3132
SPADES NINE SPADES FIVE,0.6418,0.0038,0.3544
CLUBS JACK CLUBS TWO,0.6432,0.0046,0.3522
CLUBS NINE DIAMONDS NINE,0.4826,0.0048,0.5126
DIAMONDS JACK HEARTS ACE,0.2748,0.0908,0.6344
SPADES SEVEN SPADES FIVE,0.6118,0.0052,0.383
SPADES THREE CLUBS KING,0.6718,0.0056,0.3226
HEARTS EIGHT HEARTS ACE,0.6238,0.1086,0.2676
SPADES ACE CLUBS FIVE,0.6544,0.1132,0.2324
SPADES THREE HEARTS QUEEN,0.6674,0.0068,0.3258
DIAMONDS JACK DIAMONDS EIGHT,0.6436,0.006,0.3504
SPADES NINE CLUBS THREE,0.706,0.0032,0.2908
CLUBS FIVE HEARTS NINE,0.6902,0.0046,0.3052
SPADES ACE SPADES NINE,0.6182,0.1092,0.2726
SPADES KING SPADES FIVE,0.6472,0.0046,0.3482
SPADES JACK SPADES THREE,0.6412,0.0052,0.3536
CLUBS SEVEN CLUBS QUEEN,0.6472,0.0034,0.3494
HEARTS TWO DIAMONDS SEVEN,0.6978,0.0046,0.2976
HEARTS FOUR SPADES NINE,0.695,0.004,0.301
HEARTS FOUR HEARTS JACK,0.6386,0.0046,0.3568
SPADES EIGHT HEARTS ACE,0.6702,0.1174,0.2124
SPADES FIVE HEARTS NINE,0.6818,0.0032,0.315
SPADES TEN HEARTS ACE,0.0758,0.9002,0.024
SPADES KING DIAMONDS QUEEN,0.6246,0.0054,0.37
HEARTS THREE DIAMONDS FOUR,0.649,0.0044,0.3466
DIAMONDS TWO SPADES NINE,0.703,0.006,0.291
HEARTS THREE SPADES FOUR,0.658,0.0078,0.3342
SPADES ACE SPADES FOUR,0.605,0.1052,0.2898
SPADES TEN SPADES THREE,0.7228,0.027,0.2502
SPADES NINE DIAMONDS JACK,0.6506,0.0044,0.345
DIAMONDS JACK SPADES TWO,0.6674,0.0052,0.3274
HEARTS FIVE CLUBS FIVE,0.5082,0.004,0.4878
SPADES KING CLUBS ACE,0.3044,0.0402,0.6554
DIAMONDS THREE HEARTS ACE,0.6562,0.1168,0.227
HEARTS EIGHT SPADES THREE,0.7024,0.0044,0.2932
CLUBS FOUR CLUBS ACE,0.6182,0.1012,0.2806
CLUBS JACK DIAMONDS FOUR,0.673,0.0044,0.3226
DIAMONDS QUEEN SPADES THREE,0.663,0.005,0.332
CLUBS FIVE HEARTS KING,0.659,0.0052,0.3358
HEARTS SEVEN DIAMONDS EIGHT,0.643,0.0042,0.3528
SPADES NINE SPADES TWO,0.6546,0.0052,0.3402
CLUBS EIGHT DIAMONDS KING,0.6618,0.0038,0.3344
HEARTS ACE SPADES TWO,0.6592,0.1122,0.2286
DIAMONDS TWO SPADES EIGHT,0.6976,0.006,0.2964
DIAMONDS TWO HEARTS SIX,0.692,0.0054,0.3026
SPADES JACK SPADES FOUR,0.638,0.0042,0.3578
SPADES SEVEN CLUBS FOUR,0.6742,0.0042,0.3216
SPADES THREE SPADES TWO,0.6366,0.0046,0.3588
CLUBS TEN DIAMONDS JACK,0.7266,0.0216,0.2518
SPADES ACE DIAMONDS KING,0.2778,0.0442,0.678
SPADES FIVE HEARTS JACK,0.6634,0.0052,0.3314
HEARTS EIGHT CLUBS SEVEN,0.6434,0.004,0.3526
SPADES FIVE CLUBS ACE,0.6514,0.1194,0.2292
SPADES ACE SPADES KING,0.2808,0.0436,0.6756
HEARTS FIVE DIAMONDS KING,0.6584,0.0086,0.333
HEARTS ACE DIAMONDS SIX,0.6532,0.108,0.2388
DIAMONDS THREE HEARTS SIX,0.6686,0.0056,0.3258
SPADES JACK HEARTS NINE,0.6366,0.0052,0.3582
CLUBS QUEEN HEARTS NINE,0.6628,0.0048,0.3324
CLUBS SEVEN SPADES SEVEN,0.5016,0.0024,0.496
CLUBS FOUR DIAMONDS SIX,0.6508,0.0042,0.345
HEARTS FOUR DIAMONDS JACK,0.6762,0.004,0.3198
SPADES SIX DIAMONDS JACK,0.6688,0.0056,0.3256
CLUBS JACK SPADES TWO,0.6784,0.0042,0.3174
CLUBS JACK CLUBS THREE,0.6404,0.0052,0.3544
DIAMONDS KING CLUBS QUEEN,0.6044,0.0032,0.3924
HEARTS EIGHT HEARTS KING,0.6346,0.005,0.3604
DIAMONDS TWO SPADES SIX,0.6838,0.0044,0.3118
HEARTS EIGHT CLUBS QUEEN,0.6664,0.0038,0.3298
CLUBS SEVEN HEARTS TWO,0.698,0.0038,0.2982
CLUBS NINE HEARTS QUEEN,0.654,0.0042,0.3418
DIAMONDS SIX CLUBS QUEEN,0.6594,0.0062,0.3344
CLUBS SEVEN HEARTS KING,0.6648,0.006,0.3292
SPADES ACE DIAMONDS JACK,0.2648,0.0878,0.6474
SPADES KING SPADES JACK,0.5846,0.0038,0.4116
CLUBS SEVEN CLUBS FIVE,0.6204,0.0036,0.376
HEARTS SEVEN CLUBS FIVE,0.6572,0.0052,0.3376
SPADES THREE DIAMONDS FOUR,0.6562,0.0048,0.339
SPADES THREE HEARTS NINE,0.6976,0.0046,0.2978
SPADES TEN HEARTS FOUR,0.768,0.0238,0.2082
SPADES SIX CLUBS KING,0.6736,0.0036,0.3228
HEARTS EIGHT SPADES QUEEN,0.6766,0.005,0.3184
CLUBS FOUR HEARTS TEN,0.7638,0.0214,0.2148
CLUBS FOUR SPADES TWO,0.6902,0.005,0.3048
CLUBS TWO HEARTS QUEEN,0.6702,0.0036,0.3262
HEARTS FOUR SPADES THREE,0.6578,0.007,0.3352
SPADES KING CLUBS SEVEN,0.6702,0.0038,0.326
SPADES JACK CLUBS SEVEN,0.6456,0.0032,0.3512
CLUBS FIVE DIAMONDS SEVEN,0.66,0.0068,0.3332
DIAMONDS KING CLUBS ACE,0.2748,0.0456,0.6796
SPADES QUEEN DIAMONDS EIGHT,0.6656,0.003,0.3314
CLUBS FOUR DIAMONDS FOUR,0.5016,0.008,0.4904
CLUBS JACK HEARTS SIX,0.6614,0.0028,0.3358
SPADES QUEEN CLUBS FIVE,0.676,0.0044,0.3196
CLUBS SIX DIAMONDS SIX,0.4984,0.0058,0.4958
DIAMONDS EIGHT SPADES TWO,0.6718,0.0082,0.32
SPADES TEN DIAMONDS KING,0.7434,0.0246,0.232
SPADES SIX HEARTS ACE,0.6598,0.1134,0.2268
CLUBS FOUR CLUBS KING,0.6204,0.0054,0.3742
DIAMONDS NINE DIAMONDS FIVE,0.6748,0.0046,0.3206
HEARTS SEVEN CLUBS SIX,0.65,0.003,0.347
CLUBS SEVEN SPADES THREE,0.6924,0.0042,0.3034
CLUBS THREE CLUBS TWO,0.6342,0.006,0.3598
CLUBS EIGHT HEARTS THREE,0.688,0.0046,0.3074
HEARTS FIVE DIAMONDS NINE,0.6826,0.005,0.3124
CLUBS SIX DIAMONDS SEVEN,0.6512,0.0056,0.3432
DIAMONDS TWO CLUBS SEVEN,0.6916,0.0044,0.304
SPADES ACE CLUBS KING,0.2908,0.0472,0.662
CLUBS TWO SPADES THREE,0.6974,0.0042,0.2984
HEARTS SIX DIAMONDS FOUR,0.6522,0.0058,0.342
SPADES TEN HEARTS THREE,0.767,0.0236,0.2094
HEARTS SIX SPADES TWO,0.6934,0.0038,0.3028
HEARTS TEN CLUBS QUEEN,0.734,0.0186,0.2474
SPADES QUEEN DIAMONDS NINE,0.6426,0.0058,0.3516
SPADES JACK HEARTS KING,0.6236,0.0034,0.373
CLUBS SIX SPADES SIX,0.5116,0.0038,0.4846
HEARTS TWO DIAMONDS SIX,0.688,0.0058,0.3062
DIAMONDS TWO HEARTS TWO,0.5082,0.0074,0.4844
CLUBS THREE SPADES TWO,0.6798,0.0078,0.3124
CLUBS JACK HEARTS NINE,0.6266,0.0052,0.3682
CLUBS EIGHT CLUBS FOUR,0.6472,0.0042,0.3486
CLUBS TEN DIAMONDS SEVEN,0.731,0.0242,0.2448
HEARTS FIVE CLUBS QUEEN,0.6618,0.0034,0.3348
DIAMONDS NINE DIAMONDS SIX,0.6768,0.0056,0.3176
HEARTS FIVE HEARTS QUEEN,0.6254,0.0048,0.3698
DIAMONDS QUEEN DIAMONDS SIX,0.6642,0.0044,0.3314
SPADES QUEEN HEARTS QUEEN,0.3414,0.0024,0.6562
DIAMONDS THREE DIAMONDS EIGHT,0.689,0.0056,0.3054
DIAMONDS KING DIAMONDS FOUR,0.6596,0.0054,0.335
SPADES ACE HEARTS FIVE,0.6562,0.1094,0.2344
CLUBS ACE HEARTS NINE,0.687,0.1096,0.2034
SPADES FOUR DIAMONDS NINE,0.695,0.006,0.299
DIAMONDS TWO CLUBS EIGHT,0.685,0.0048,0.3102
HEARTS FIVE HEARTS ACE,0.6154,0.1084,0.2762
CLUBS FOUR SPADES FOUR,0.5144,0.0054,0.4802
CLUBS JACK HEARTS ACE,0.278,0.0808,0.6412
DIAMONDS TWO HEARTS KING,0.6712,0.0042,0.3246
SPADES EIGHT DIAMONDS SEVEN,0.659,0.0032,0.3378
CLUBS NINE CLUBS TWO,0.653,0.0044,0.3426
CLUBS EIGHT DIAMONDS SIX,0.6586,0.005,0.3364
CLUBS SIX DIAMONDS EIGHT,0.6556,0.0052,0.3392
CLUBS THREE CLUBS QUEEN,0.628,0.005,0.367
SPADES SEVEN HEARTS TEN,0.733,0.0244,0.2426
DIAMONDS EIGHT DIAMONDS SEVEN,0.6374,0.0054,0.3572
CLUBS EIGHT DIAMONDS SEVEN,0.6428,0.0044,0.3528
SPADES KING CLUBS KING,0.3242,0.004,0.6718
HEARTS EIGHT DIAMONDS FOUR,0.6914,0.0052,0.3034
CLUBS TEN HEARTS KING,0.7412,0.0164,0.2424
SPADES FOUR HEARTS NINE,0.6968,0.0038,0.2994
HEARTS TWO CLUBS FOUR,0.6848,0.0038,0.3114
DIAMONDS JACK HEARTS TEN,0.7102,0.0172,0.2726
CLUBS EIGHT HEARTS QUEEN,0.6544,0.0048,0.3408
HEARTS FIVE SPADES NINE,0.6854,0.0048,0.3098
SPADES SIX HEARTS KING,0.67,0.0032,0.3268
SPADES QUEEN CLUBS SEVEN,0.672,0.0038,0.3242
SPADES QUEEN DIAMONDS KING,0.6132,0.0052,0.3816
CLUBS JACK HEARTS QUEEN,0.6158,0.0036,0.3806
SPADES NINE CLUBS FOUR,0.704,0.0042,0.2918
HEARTS THREE SPADES EIGHT,0.6944,0.004,0.3016
SPADES TEN DIAMONDS NINE,0.7264,0.024,0.2496
SPADES NINE CLUBS SIX,0.6746,0.0036,0.3218
DIAMONDS THREE SPADES TEN,0.7664,0.0256,0.208
HEARTS KING CLUBS KING,0.3188,0.0056,0.6756
DIAMONDS KING SPADES TWO,0.6702,0.0066,0.3232
DIAMONDS TWO HEARTS FOUR,0.685,0.0064,0.3086
CLUBS SEVEN DIAMONDS JACK,0.663,0.0044,0.3326
SPADES SIX HEARTS JACK,0.6686,0.0044,0.327
HEARTS EIGHT SPADES TEN,0.7222,0.019,0.2588
SPADES EIGHT SPADES SEVEN,0.6076,0.0056,0.3868
HEARTS SEVEN SPADES SEVEN,0.494,0.0028,0.5032
CLUBS JACK DIAMONDS TWO,0.6724,0.0068,0.3208
CLUBS SIX DIAMONDS QUEEN,0.6714,0.0044,0.3242
HEARTS EIGHT SPADES NINE,0.65,0.0034,0.3466
SPADES ACE CLUBS NINE,0.6694,0.1164,0.2142
HEARTS SEVEN DIAMONDS SEVEN,0.4884,0.0038,0.5078
SPADES EIGHT DIAMONDS QUEEN,0.6562,0.0036,0.3402
CLUBS JACK DIAMONDS SIX,0.6694,0.004,0.3266
HEARTS SIX CLUBS SEVEN,0.6584,0.0038,0.3378
HEARTS SEVEN DIAMONDS SIX,0.6496,0.0048,0.3456
HEARTS EIGHT HEARTS TEN,0.6904,0.0202,0.2894
DIAMONDS SIX HEARTS TEN,0.7536,0.0254,0.221
SPADES KING CLUBS EIGHT,0.667,0.0028,0.3302
SPADES JACK SPADES FIVE,0.6298,0.0048,0.3654
HEARTS SIX CLUBS THREE,0.6716,0.0042,0.3242
CLUBS TEN DIAMONDS FIVE,0.7548,0.0246,0.2206
DIAMONDS THREE CLUBS SIX,0.671,0.005,0.324
SPADES SEVEN DIAMONDS NINE,0.6696,0.0044,0.326
SPADES NINE DIAMONDS SEVEN,0.64,0.0044,0.3556
SPADES ACE HEARTS ACE,0.1292,0.0118,0.859
SPADES EIGHT DIAMONDS FIVE,0.6646,0.0048,0.3306
SPADES SIX DIAMONDS FOUR,0.6422,0.005,0.3528
SPADES FOUR HEARTS TEN,0.7652,0.0238,0.211
SPADES TEN SPADES TWO,0.7234,0.0242,0.2524
SPADES THREE CLUBS QUEEN,0.6588,0.0038,0.3374
CLUBS THREE DIAMONDS FIVE,0.6566,0.0046,0.3388
SPADES SIX SPADES TWO,0.6428,0.0046,0.3526
CLUBS TWO HEARTS JACK,0.6754,0.0062,0.3184
SPADES ACE SPADES JACK,0.2628,0.0828,0.6544
SPADES JACK SPADES EIGHT,0.6106,0.0044,0.385
CLUBS KING DIAMONDS FIVE,0.6694,0.0036,0.327
CLUBS KING DIAMONDS FOUR,0.6456,0.0062,0.3482
HEARTS EIGHT HEARTS THREE,0.6554,0.0042,0.3404
CLUBS TEN CLUBS QUEEN,0.6898,0.0166,0.2936
SPADES SEVEN SPADES FOUR,0.6418,0.0036,0.3546
HEARTS QUEEN CLUBS QUEEN,0.3408,0.0048,0.6544
DIAMONDS THREE SPADES SIX,0.6746,0.0056,0.3198
CLUBS NINE SPADES TWO,0.6944,0.0034,0.3022
CLUBS THREE SPADES THREE,0.508,0.0052,0.4868
CLUBS SIX HEARTS TWO,0.6818,0.0054,0.3128
CLUBS TWO DIAMONDS JACK,0.6714,0.0052,0.3234
SPADES SEVEN CLUBS QUEEN,0.6652,0.0032,0.3316
CLUBS TWO SPADES TWO,0.5164,0.0074,0.4762
SPADES QUEEN DIAMONDS FIVE,0.6542,0.0054,0.3404
CLUBS FIVE DIAMONDS QUEEN,0.6644,0.0062,0.3294
SPADES KING DIAMONDS SEVEN,0.668,0.0042,0.3278
CLUBS TWO DIAMONDS SIX,0.6892,0.0054,0.3054
CLUBS TWO DIAMONDS FOUR,0.6682,0.0056,0.3262
HEARTS SEVEN CLUBS QUEEN,0.6798,0.0024,0.3178
HEARTS TWO DIAMONDS JACK,0.6782,0.0064,0.3154
SPADES ACE DIAMONDS SIX,0.674,0.1052,0.2208
CLUBS SEVEN CLUBS FOUR,0.6336,0.0044,0.362
HEARTS FOUR CLUBS THREE,0.661,0.0056,0.3334
DIAMONDS QUEEN DIAMONDS FOUR,0.6564,0.0074,0.3362
SPADES KING HEARTS JACK,0.615,0.0048,0.3802
SPADES KING DIAMONDS NINE,0.6618,0.006,0.3322
CLUBS JACK SPADES SEVEN,0.6628,0.0028,0.3344
HEARTS EIGHT CLUBS EIGHT,0.4902,0.0034,0.5064
SPADES TEN DIAMONDS FIVE,0.76,0.0238,0.2162
CLUBS JACK HEARTS TEN,0.7226,0.0138,0.2636
SPADES EIGHT DIAMONDS EIGHT,0.4856,0.0032,0.5112
SPADES NINE HEARTS NINE,0.4996,0.0034,0.497
CLUBS SIX SPADES SEVEN,0.6452,0.005,0.3498
DIAMONDS NINE HEARTS QUEEN,0.644,0.0058,0.3502
SPADES TEN SPADES SEVEN,0.6918,0.0188,0.2894
SPADES THREE DIAMONDS SEVEN,0.674,0.005,0.321
CLUBS NINE HEARTS KING,0.6522,0.0044,0.3434
SPADES JACK DIAMONDS FIVE,0.6638,0.0054,0.3308
CLUBS THREE HEARTS TEN,0.7628,0.0234,0.2138
HEARTS SIX HEARTS KING,0.6232,0.0046,0.3722
SPADES ACE HEARTS THREE,0.6646,0.1112,0.2242
CLUBS TEN DIAMONDS EIGHT,0.722,0.0238,0.2542
CLUBS SEVEN HEARTS QUEEN,0.666,0.0052,0.3288
SPADES EIGHT CLUBS FIVE,0.6726,0.0032,0.3242
SPADES KING SPADES SEVEN,0.628,0.0038,0.3682
CLUBS TEN CLUBS THREE,0.716,0.0226,0.2614
DIAMONDS SIX DIAMONDS FIVE,0.643,0.0062,0.3508
SPADES QUEEN SPADES SEVEN,0.6358,0.0044,0.3598
DIAMONDS KING DIAMONDS SEVEN,0.661,0.0044,0.3346
CLUBS FIVE DIAMONDS FOUR,0.646,0.0042,0.3498
HEARTS ACE SPADES THREE,0.6416,0.1174,0.241
DIAMONDS TWO DIAMONDS EIGHT,0.6814,0.0096,0.309
CLUBS NINE CLUBS ACE,0.6308,0.1048,0.2644
CLUBS FIVE HEARTS ACE,0.657,0.1064,0.2366
SPADES QUEEN SPADES FOUR,0.6292,0.0042,0.3666
CLUBS SIX CLUBS FOUR,0.6184,0.005,0.3766
CLUBS TEN DIAMONDS KING,0.7442,0.0202,0.2356
HEARTS FIVE DIAMONDS SIX,0.65,0.0044,0.3456
HEARTS FOUR DIAMONDS FIVE,0.6428,0.0072,0.35
SPADES JACK CLUBS KING,0.627,0.0054,0.3676
CLUBS KING HEARTS TEN,0.7336,0.0192,0.2472
CLUBS NINE CLUBS SIX,0.6408,0.004,0.3552
DIAMONDS QUEEN DIAMONDS JACK,0.6208,0.0056,0.3736
HEARTS SIX DIAMONDS SEVEN,0.6312,0.0046,0.3642
DIAMONDS THREE HEARTS NINE,0.6922,0.0042,0.3036
SPADES FIVE DIAMONDS SIX,0.6414,0.0048,0.3538
CLUBS THREE HEARTS JACK,0.6796,0.006,0.3144
HEARTS FOUR DIAMONDS SEVEN,0.6624,0.004,0.3336
SPADES SEVEN CLUBS KING,0.67,0.0034,0.3266
CLUBS EIGHT DIAMONDS JACK,0.6476,0.0046,0.3478
CLUBS THREE CLUBS ACE,0.6074,0.1148,0.2778
CLUBS THREE CLUBS KING,0.6548,0.0046,0.3406
CLUBS FIVE SPADES FIVE,0.4914,0.006,0.5026
SPADES JACK SPADES TWO,0.6312,0.0056,0.3632
CLUBS FOUR CLUBS THREE,0.6348,0.0048,0.3604
CLUBS SEVEN CLUBS ACE,0.6292,0.108,0.2628
DIAMONDS QUEEN DIAMONDS EIGHT,0.6416,0.0058,0.3526
SPADES QUEEN DIAMONDS QUEEN,0.3384,0.0046,0.657
DIAMONDS QUEEN HEARTS QUEEN,0.3242,0.006,0.6698
CLUBS FIVE DIAMONDS JACK,0.671,0.0046,0.3244
SPADES ACE HEARTS NINE,0.6702,0.117,0.2128
DIAMONDS FIVE HEARTS NINE,0.6844,0.004,0.3116
SPADES QUEEN HEARTS THREE,0.6686,0.007,0.3244
SPADES SIX DIAMONDS SEVEN,0.642,0.0036,0.3544
CLUBS FIVE HEARTS QUEEN,0.6716,0.004,0.3244
SPADES ACE CLUBS ACE,0.1274,0.012,0.8606
SPADES SIX DIAMONDS FIVE,0.6586,0.0044,0.337
SPADES FOUR DIAMONDS SIX,0.6588,0.005,0.3362
DIAMONDS KING HEARTS QUEEN,0.6226,0.0046,0.3728
SPADES ACE CLUBS TWO,0.643,0.116,0.241
SPADES FOUR HEARTS KING,0.6882,0.0062,0.3056
HEARTS FOUR CLUBS FOUR,0.5148,0.005,0.4802
SPADES QUEEN SPADES TEN,0.6844,0.017,0.2986
HEARTS FIVE CLUBS TWO,0.6764,0.0048,0.3188
SPADES SEVEN DIAMONDS JACK,0.643,0.0056,0.3514
CLUBS SIX HEARTS QUEEN,0.673,0.003,0.324
CLUBS NINE CLUBS FIVE,0.6434,0.0048,0.3518
SPADES JACK CLUBS ACE,0.2772,0.0862,0.6366
HEARTS EIGHT SPADES JACK,0.6616,0.0044,0.334
HEARTS THREE CLUBS THREE,0.5032,0.0054,0.4914
DIAMONDS THREE SPADES SEVEN,0.6762,0.0054,0.3184
CLUBS JACK CLUBS NINE,0.5994,0.0044,0.3962
DIAMONDS THREE CLUBS SEVEN,0.6758,0.0056,0.3186
CLUBS NINE DIAMONDS SEVEN,0.6498,0.0058,0.3444
HEARTS JACK CLUBS KING,0.625,0.0038,0.3712
CLUBS SEVEN CLUBS KING,0.6182,0.004,0.3778
HEARTS TWO CLUBS KING,0.6682,0.0052,0.3266
HEARTS FOUR SPADES SIX,0.6588,0.0048,0.3364
HEARTS SIX HEARTS FOUR,0.63,0.0032,0.3668
DIAMONDS KING CLUBS THREE,0.6636,0.006,0.3304
HEARTS SIX DIAMONDS JACK,0.67,0.006,0.324
SPADES ACE CLUBS SEVEN,0.6576,0.117,0.2254
SPADES SEVEN HEARTS ACE,0.6594,0.113,0.2276
HEARTS SEVEN DIAMONDS FOUR,0.6666,0.0042,0.3292
SPADES NINE DIAMONDS FIVE,0.674,0.004,0.322
SPADES NINE DIAMONDS QUEEN,0.6444,0.0056,0.35
HEARTS EIGHT HEARTS QUEEN,0.6114,0.005,0.3836
HEARTS FOUR HEARTS TEN,0.7164,0.0226,0.261
DIAMONDS QUEEN HEARTS TEN,0.718,0.017,0.265
HEARTS EIGHT CLUBS ACE,0.659,0.1188,0.2222
CLUBS EIGHT CLUBS FIVE,0.6292,0.0052,0.3656
HEARTS FIVE SPADES FIVE,0.5084,0.0048,0.4868
SPADES FIVE DIAMONDS FOUR,0.6332,0.0082,0.3586
SPADES EIGHT SPADES TWO,0.647,0.0052,0.3478
CLUBS JACK DIAMONDS JACK,0.3348,0.0038,0.6614
SPADES JACK DIAMONDS KING,0.6184,0.0046,0.377
SPADES FIVE DIAMONDS EIGHT,0.674,0.0048,0.3212
CLUBS SIX CLUBS THREE,0.6442,0.0052,0.3506
HEARTS FOUR HEARTS ACE,0.6032,0.1112,0.2856
SPADES SIX HEARTS TEN,0.7546,0.0244,0.221
DIAMONDS JACK SPADES THREE,0.6588,0.0056,0.3356
HEARTS THREE DIAMONDS EIGHT,0.6978,0.007,0.2952
SPADES QUEEN CLUBS SIX,0.6744,0.0036,0.322
DIAMONDS THREE CLUBS FOUR,0.6426,0.0052,0.3522
DIAMONDS THREE SPADES FOUR,0.6568,0.008,0.3352
HEARTS SEVEN SPADES FIVE,0.655,0.0046,0.3404
CLUBS EIGHT CLUBS QUEEN,0.6364,0.0048,0.3588
HEARTS QUEEN CLUBS KING,0.6224,0.0056,0.372
SPADES QUEEN DIAMONDS JACK,0.6026,0.0048,0.3926
SPADES EIGHT SPADES FOUR,0.6416,0.0046,0.3538
DIAMONDS QUEEN SPADES FOUR,0.6658,0.0044,0.3298
HEARTS TWO HEARTS QUEEN,0.6358,0.0052,0.359
DIAMONDS TWO CLUBS FOUR,0.6798,0.0054,0.3148
HEARTS SIX HEARTS ACE,0.6302,0.1168,0.253
CLUBS EIGHT SPADES NINE,0.6498,0.0034,0.3468
CLUBS NINE CLUBS QUEEN,0.6122,0.005,0.3828
HEARTS THREE HEARTS QUEEN,0.6278,0.0044,0.3678
DIAMONDS SIX CLUBS KING,0.6744,0.0036,0.322
SPADES QUEEN HEARTS FIVE,0.6686,0.0038,0.3276
CLUBS SEVEN HEARTS FOUR,0.6688,0.0042,0.327
SPADES NINE CLUBS FIVE,0.6848,0.0032,0.312
SPADES NINE DIAMONDS EIGHT,0.6406,0.0048,0.3546
CLUBS TWO DIAMONDS SEVEN,0.7038,0.0046,0.2916
HEARTS SEVEN CLUBS THREE,0.6844,0.0044,0.3112
SPADES NINE CLUBS TWO,0.7038,0.0058,0.2904
DIAMONDS EIGHT DIAMONDS FIVE,0.656,0.0066,0.3374
SPADES ACE SPADES SIX,0.626,0.1022,0.2718
CLUBS FIVE DIAMONDS NINE,0.68,0.0038,0.3162
SPADES QUEEN CLUBS KING,0.6232,0.0034,0.3734
CLUBS EIGHT SPADES SEVEN,0.6434,0.0032,0.3534
CLUBS NINE HEARTS FIVE,0.6758,0.0052,0.319
HEARTS ACE DIAMONDS NINE,0.6678,0.1094,0.2228
HEARTS ACE CLUBS KING,0.2954,0.0474,0.6572
CLUBS THREE HEARTS NINE,0.6918,0.0026,0.3056
HEARTS KING HEARTS QUEEN,0.5802,0.0058,0.414
SPADES SEVEN DIAMONDS SEVEN,0.4918,0.003,0.5052
CLUBS SEVEN HEARTS TEN,0.7354,0.0218,0.2428
CLUBS TEN DIAMONDS SIX,0.7548,0.0248,0.2204
HEARTS SEVEN SPADES THREE,0.68,0.005,0.315
DIAMONDS TWO CLUBS KING,0.6778,0.004,0.3182
HEARTS EIGHT DIAMONDS TWO,0.6962,0.003,0.3008
SPADES KING SPADES EIGHT,0.6264,0.0036,0.37
HEARTS FIVE CLUBS FOUR,0.6476,0.0042,0.3482
SPADES JACK CLUBS QUEEN,0.631,0.004,0.365
HEARTS SIX SPADES TEN,0.7474,0.023,0.2296
CLUBS EIGHT SPADES FOUR,0.694,0.0032,0.3028
HEARTS THREE SPADES SIX,0.6688,0.004,0.3272
SPADES TEN DIAMONDS JACK,0.7284,0.0168,0.2548
CLUBS TEN HEARTS THREE,0.7574,0.0236,0.219
SPADES ACE CLUBS EIGHT,0.6646,0.1106,0.2248
HEARTS FOUR HEARTS NINE,0.6538,0.0044,0.3418
HEARTS THREE CLUBS FIVE,0.6476,0.0088,0.3436
CLUBS NINE DIAMONDS KING,0.6668,0.0046,0.3286
DIAMONDS EIGHT HEARTS JACK,0.6544,0.0048,0.3408
HEARTS FIVE SPADES SEVEN,0.6638,0.0036,0.3326
DIAMONDS THREE HEARTS KING,0.6794,0.0058,0.3148
CLUBS FOUR DIAMONDS EIGHT,0.6876,0.0054,0.307
HEARTS SIX HEARTS TWO,0.6672,0.0046,0.3282
DIAMONDS SEVEN CLUBS QUEEN,0.6676,0.0036,0.3288
SPADES EIGHT HEARTS JACK,0.6506,0.0032,0.3462
SPADES TWO CLUBS ACE,0.659,0.1206,0.2204
SPADES QUEEN SPADES TWO,0.6282,0.0038,0.368
SPADES NINE SPADES SEVEN,0.6314,0.0042,0.3644
DIAMONDS TWO DIAMONDS FIVE,0.666,0.0084,0.3256
CLUBS JACK CLUBS SIX,0.6478,0.0046,0.3476
CLUBS JACK SPADES EIGHT,0.6452,0.0032,0.3516
DIAMONDS TWO HEARTS ACE,0.6494,0.1136,0.237
HEARTS THREE DIAMONDS SIX,0.6694,0.0054,0.3252
SPADES ACE HEARTS KING,0.2864,0.0508,0.6628
SPADES ACE DIAMONDS FOUR,0.646,0.1198,0.2342
SPADES EIGHT CLUBS TWO,0.693,0.0036,0.3034
HEARTS SIX SPADES NINE,0.6722,0.0046,0.3232
SPADES ACE HEARTS SIX,0.6632,0.1056,0.2312
HEARTS FIVE SPADES TEN,0.7712,0.0244,0.2044
SPADES TEN HEARTS TWO,0.7818,0.0226,0.1956
SPADES FOUR CLUBS QUEEN,0.6802,0.0034,0.3164
CLUBS TEN SPADES FOUR,0.7604,0.021,0.2186
CLUBS FIVE DIAMONDS EIGHT,0.678,0.0074,0.3146
DIAMONDS TWO CLUBS SIX,0.6816,0.0058,0.3126
CLUBS FIVE DIAMONDS SIX,0.641,0.005,0.354
CLUBS FIVE DIAMONDS FIVE,0.4964,0.0054,0.4982
HEARTS SEVEN DIAMONDS TWO,0.688,0.0056,0.3064
SPADES SIX DIAMONDS EIGHT,0.6462,0.0048,0.349
HEARTS FIVE HEARTS TEN,0.7228,0.0236,0.2536
