opposingHand,winningChance,drawChance,lostChance
HEARTS THREE CLUBS ACE,0.4764,0.0066,0.517
HEARTS ACE DIAMONDS NINE,0.4576,0.006,0.5364
SPADES JACK SPADES SEVEN,0.696,0.0378,0.2662
CLUBS JACK SPADES THREE,0.7598,0.0396,0.2006
DIAMONDS ACE DIAMONDS KING,0.3294,0.0062,0.6644
HEARTS FIVE SPADES TWO,0.6634,0.0126,0.324
CLUBS SEVEN CLUBS FOUR,0.6308,0.0108,0.3584
SPADES JACK HEARTS JACK,0.3618,0.0184,0.6198
HEARTS FOUR SPADES SIX,0.6614,0.0096,0.329
CLUBS SEVEN SPADES NINE,0.6586,0.009,0.3324
HEARTS TWO DIAMONDS NINE,0.6908,0.0102,0.299
DIAMONDS EIGHT HEARTS TEN,0.678,0.0086,0.3134
SPADES JACK SPADES NINE,0.688,0.035,0.277
SPADES THREE CLUBS ACE,0.471,0.0058,0.5232
HEARTS THREE SPADES SIX,0.6722,0.008,0.3198
DIAMONDS EIGHT HEARTS JACK,0.7272,0.04,0.2328
DIAMONDS TWO HEARTS TEN,0.697,0.0102,0.2928
DIAMONDS THREE CLUBS THREE,0.4992,0.0128,0.488
CLUBS FIVE DIAMONDS ACE,0.461,0.005,0.534
HEARTS QUEEN HEARTS TEN,0.658,0.081,0.261
HEARTS SIX SPADES SEVEN,0.6582,0.0086,0.3332
SPADES ACE HEARTS FIVE,0.4698,0.0044,0.5258
CLUBS EIGHT SPADES NINE,0.6518,0.0072,0.341
SPADES JACK CLUBS KING,0.2938,0.0244,0.6818
CLUBS SIX CLUBS ACE,0.4504,0.0058,0.5438
DIAMONDS THREE HEARTS THREE,0.5012,0.0144,0.4844
SPADES TEN SPADES TWO,0.6634,0.0084,0.3282
HEARTS EIGHT DIAMONDS FIVE,0.6624,0.0108,0.3268
DIAMONDS ACE CLUBS ACE,0.1882,0.0034,0.8084
CLUBS ACE DIAMONDS SIX,0.4698,0.0028,0.5274
SPADES NINE HEARTS TEN,0.6694,0.0086,0.322
CLUBS SIX CLUBS FOUR,0.61,0.011,0.379
SPADES NINE DIAMONDS SEVEN,0.6646,0.0116,0.3238
SPADES EIGHT SPADES TWO,0.6544,0.0102,0.3354
DIAMONDS TWO DIAMONDS EIGHT,0.6998,0.0102,0.29
CLUBS NINE SPADES EIGHT,0.6648,0.0092,0.326
SPADES KING CLUBS FOUR,0.4694,0.006,0.5246
CLUBS JACK DIAMONDS TWO,0.7504,0.0402,0.2094
DIAMONDS TWO CLUBS QUEEN,0.6932,0.0888,0.218
SPADES SIX HEARTS KING,0.4768,0.008,0.5152
SPADES FIVE DIAMONDS FIVE,0.4956,0.0118,0.4926
CLUBS EIGHT SPADES THREE,0.6948,0.0094,0.2958
HEARTS KING HEARTS TEN,0.4018,0.0088,0.5894
HEARTS EIGHT HEARTS QUEEN,0.6612,0.083,0.2558
HEARTS EIGHT SPADES FIVE,0.6692,0.0108,0.32
SPADES QUEEN HEARTS ACE,0.3046,0.015,0.6804
HEARTS SEVEN SPADES QUEEN,0.6898,0.0878,0.2224
SPADES TEN SPADES SEVEN,0.639,0.0122,0.3488
HEARTS SIX SPADES THREE,0.6826,0.0108,0.3066
DIAMONDS SIX CLUBS QUEEN,0.6888,0.0816,0.2296
CLUBS TWO SPADES TWO,0.516,0.0172,0.4668
HEARTS TWO CLUBS KING,0.4854,0.0086,0.506
CLUBS JACK SPADES FIVE,0.7462,0.0362,0.2176
SPADES KING DIAMONDS FIVE,0.4696,0.0066,0.5238
DIAMONDS TEN DIAMONDS SEVEN,0.6736,0.01,0.3164
SPADES NINE CLUBS QUEEN,0.696,0.0876,0.2164
CLUBS TEN DIAMONDS SIX,0.6858,0.0094,0.3048
DIAMONDS TWO HEARTS KING,0.4692,0.0086,0.5222
HEARTS FIVE HEARTS KING,0.4426,0.0052,0.5522
HEARTS SIX DIAMONDS SEVEN,0.6608,0.0086,0.3306
CLUBS JACK HEARTS QUEEN,0.0624,0.9122,0.0254
HEARTS KING SPADES TWO,0.487,0.006,0.507
HEARTS EIGHT HEARTS JACK,0.691,0.04,0.269
SPADES FIVE DIAMONDS TEN,0.703,0.01,0.287
