opposingHand,winningChance,drawChance,lostChance
SPADES SIX HEARTS EIGHT,0.5724,0.0128,0.4148
SPADES SEVEN HEARTS EIGHT,0.5662,0.0116,0.4222
CLUBS THREE HEARTS JACK,0.632,0.0144,0.3536
SPADES EIGHT HEARTS EIGHT,0.3152,0.018,0.6668
CLUBS THREE HEARTS TEN,0.6366,0.0154,0.348
SPADES NINE HEARTS EIGHT,0.5448,0.0146,0.4406
SPADES KING HEARTS NINE,0.3666,0.0048,0.6286
SPADES TWO HEARTS EIGHT,0.6218,0.013,0.3652
SPADES QUEEN HEARTS NINE,0.2326,0.1588,0.6086
SPADES THREE HEARTS EIGHT,0.629,0.0154,0.3556
SPADES FOUR HEARTS EIGHT,0.69,0.0422,0.2678
SPADES ACE HEARTS NINE,0.3512,0.004,0.6448
SPADES FIVE HEARTS EIGHT,0.5898,0.0104,0.3998
CLUBS EIGHT HEARTS EIGHT,0.3218,0.0226,0.6556
CLUBS NINE HEARTS EIGHT,0.5498,0.0116,0.4386
CLUBS THREE HEARTS KING,0.4062,0.0082,0.5856
CLUBS FOUR HEARTS EIGHT,0.7192,0.0394,0.2414
CLUBS THREE HEARTS QUEEN,0.2674,0.5142,0.2184
CLUBS FIVE HEARTS EIGHT,0.5896,0.0104,0.4
CLUBS SIX HEARTS EIGHT,0.5596,0.0134,0.427
CLUBS THREE HEARTS ACE,0.394,0.0046,0.6014
CLUBS SEVEN HEARTS EIGHT,0.5718,0.0116,0.4166
CLUBS THREE HEARTS EIGHT,0.63,0.014,0.356
CLUBS TWO HEARTS EIGHT,0.6338,0.0148,0.3514
SPADES TEN SPADES FOUR,0.6856,0.043,0.2714
SPADES JACK SPADES FOUR,0.6772,0.049,0.2738
HEARTS EIGHT HEARTS NINE,0.5002,0.0112,0.4886
SPADES QUEEN SPADES FOUR,0.0244,0.9098,0.0658
SPADES KING SPADES FOUR,0.2326,0.039,0.7284
SPADES ACE SPADES FOUR,0.2128,0.0218,0.7654
HEARTS KING HEARTS TEN,0.3122,0.0076,0.6802
HEARTS QUEEN HEARTS TEN,0.2252,0.1082,0.6666
HEARTS ACE HEARTS TEN,0.3282,0.0028,0.669
HEARTS SEVEN CLUBS JACK,0.584,0.01,0.406
CLUBS TEN HEARTS SEVEN,0.571,0.0104,0.4186
HEARTS SEVEN CLUBS KING,0.3562,0.0094,0.6344
HEARTS SEVEN CLUBS ACE,0.3558,0.0048,0.6394
CLUBS SEVEN HEARTS ACE,0.3732,0.005,0.6218
CLUBS SEVEN HEARTS KING,0.3672,0.0086,0.6242
CLUBS SEVEN HEARTS QUEEN,0.2272,0.295,0.4778
CLUBS SEVEN HEARTS JACK,0.5826,0.0086,0.4088
CLUBS SEVEN HEARTS TEN,0.5774,0.0118,0.4108
CLUBS TEN CLUBS THREE,0.6012,0.0126,0.3862
CLUBS THREE CLUBS JACK,0.6034,0.0118,0.3848
CLUBS THREE CLUBS ACE,0.357,0.0062,0.6368
CLUBS THREE CLUBS KING,0.3608,0.0076,0.6316
HEARTS TEN HEARTS JACK,0.4966,0.0086,0.4948
SPADES ACE CLUBS ACE,0.1142,0.004,0.8818
SPADES KING CLUBS ACE,0.3218,0.0056,0.6726
SPADES QUEEN CLUBS ACE,0.2158,0.017,0.7672
SPADES JACK CLUBS ACE,0.3378,0.005,0.6572
SPADES TEN CLUBS ACE,0.342,0.0026,0.6554
SPADES EIGHT HEARTS NINE,0.5328,0.0132,0.454
SPADES NINE HEARTS NINE,0.2976,0.017,0.6854
SPADES SIX HEARTS NINE,0.558,0.013,0.429
SPADES SEVEN HEARTS NINE,0.567,0.01,0.423
CLUBS SEVEN HEARTS NINE,0.5514,0.0126,0.436
CLUBS SIX HEARTS NINE,0.5748,0.0122,0.413
CLUBS FIVE HEARTS NINE,0.5876,0.0154,0.397
CLUBS FOUR HEARTS NINE,0.7238,0.0468,0.2294
CLUBS THREE HEARTS NINE,0.635,0.0144,0.3506
CLUBS TWO HEARTS NINE,0.6282,0.0136,0.3582
SPADES FIVE HEARTS NINE,0.5866,0.0128,0.4006
SPADES FOUR HEARTS NINE,0.7222,0.04,0.2378
SPADES THREE HEARTS NINE,0.6222,0.0148,0.363
SPADES TWO HEARTS NINE,0.6234,0.0128,0.3638
CLUBS NINE HEARTS NINE,0.304,0.018,0.678
CLUBS EIGHT HEARTS NINE,0.5466,0.0096,0.4438
