opposingHand,winningChance,drawChance,lostChance
HEARTS KING HEARTS NINE,0.6148,0.006,0.3792
HEARTS THREE DIAMONDS JACK,0.6634,0.0058,0.3308
CLUBS TEN CLUBS EIGHT,0.6856,0.022,0.2924
DIAMONDS NINE DIAMONDS EIGHT,0.648,0.0052,0.3468
SPADES EIGHT DIAMONDS SIX,0.6504,0.0044,0.3452
HEARTS SIX DIAMONDS KING,0.6602,0.0064,0.3334
CLUBS NINE HEARTS SIX,0.6774,0.0044,0.3182
SPADES EIGHT DIAMONDS KING,0.6718,0.0032,0.325
SPADES ACE CLUBS FOUR,0.6554,0.1092,0.2354
SPADES KING HEARTS SIX,0.6738,0.0038,0.3224
SPADES EIGHT CLUBS KING,0.673,0.0052,0.3218
SPADES ACE DIAMONDS TWO,0.6558,0.116,0.2282
SPADES QUEEN CLUBS ACE,0.289,0.0486,0.6624
CLUBS NINE SPADES EIGHT,0.6464,0.0036,0.35
DIAMONDS THREE CLUBS KING,0.6588,0.006,0.3352
DIAMONDS JACK HEARTS QUEEN,0.6124,0.0046,0.383
HEARTS SEVEN HEARTS QUEEN,0.6192,0.0038,0.377
DIAMONDS JACK DIAMONDS FOUR,0.6516,0.0072,0.3412
DIAMONDS THREE SPADES QUEEN,0.662,0.0048,0.3332
CLUBS TEN HEARTS FOUR,0.7656,0.0206,0.2138
CLUBS JACK CLUBS ACE,0.2638,0.0914,0.6448
CLUBS FIVE HEARTS TWO,0.6924,0.0046,0.303
SPADES KING CLUBS FOUR,0.675,0.0054,0.3196
HEARTS FIVE CLUBS THREE,0.6602,0.0054,0.3344
SPADES KING CLUBS TWO,0.6676,0.0048,0.3276
DIAMONDS TWO SPADES FOUR,0.671,0.0046,0.3244
HEARTS KING CLUBS ACE,0.3084,0.0446,0.647
CLUBS NINE CLUBS THREE,0.6626,0.0046,0.3328
HEARTS JACK DIAMONDS SIX,0.6476,0.0032,0.3492
CLUBS TEN SPADES QUEEN,0.73,0.017,0.253
DIAMONDS THREE DIAMONDS KING,0.6792,0.004,0.3168
HEARTS TWO DIAMONDS NINE,0.6908,0.006,0.3032
DIAMONDS TWO HEARTS JACK,0.6628,0.006,0.3312
SPADES SEVEN HEARTS KING,0.6682,0.0046,0.3272
SPADES SEVEN CLUBS THREE,0.6828,0.0034,0.3138
SPADES JACK HEARTS TEN,0.7172,0.0184,0.2644
SPADES EIGHT CLUBS QUEEN,0.6598,0.0026,0.3376
SPADES KING SPADES THREE,0.6412,0.0042,0.3546
HEARTS THREE HEARTS JACK,0.6392,0.005,0.3558
SPADES SEVEN DIAMONDS FIVE,0.6504,0.0044,0.3452
SPADES SIX CLUBS ACE,0.6636,0.1174,0.219
SPADES SIX DIAMONDS QUEEN,0.6742,0.004,0.3218
CLUBS FIVE CLUBS TWO,0.641,0.0042,0.3548
DIAMONDS TWO DIAMONDS QUEEN,0.6618,0.0064,0.3318
SPADES NINE HEARTS TWO,0.6966,0.005,0.2984
CLUBS TEN SPADES FIVE,0.764,0.0238,0.2122
SPADES JACK DIAMONDS SIX,0.6826,0.0052,0.3122
SPADES KING SPADES NINE,0.6316,0.0066,0.3618
SPADES FIVE HEARTS ACE,0.6548,0.1084,0.2368
CLUBS NINE SPADES TEN,0.725,0.0224,0.2526
SPADES JACK DIAMONDS EIGHT,0.645,0.0054,0.3496
HEARTS EIGHT DIAMONDS THREE,0.695,0.006,0.299
CLUBS FOUR CLUBS QUEEN,0.6448,0.0044,0.3508
CLUBS EIGHT HEARTS TEN,0.73,0.0194,0.2506
CLUBS FOUR CLUBS TWO,0.6484,0.0058,0.3458
CLUBS FOUR HEARTS QUEEN,0.673,0.0052,0.3218
HEARTS SEVEN DIAMONDS JACK,0.6544,0.0048,0.3408
DIAMONDS KING DIAMONDS FIVE,0.66,0.0066,0.3334
HEARTS SIX SPADES EIGHT,0.6538,0.0046,0.3416
CLUBS TEN SPADES NINE,0.7192,0.02,0.2608
HEARTS SIX SPADES THREE,0.677,0.0066,0.3164
HEARTS EIGHT HEARTS FIVE,0.6202,0.0062,0.3736
CLUBS SIX CLUBS KING,0.6214,0.0044,0.3742
HEARTS ACE HEARTS TEN,0.066,0.8678,0.0662
HEARTS FIVE SPADES FOUR,0.641,0.004,0.355
HEARTS FOUR DIAMONDS FOUR,0.504,0.0036,0.4924
DIAMONDS TWO HEARTS TEN,0.7624,0.0294,0.2082
CLUBS EIGHT HEARTS JACK,0.6556,0.0042,0.3402
