opposingHand,winningChance,drawChance,lostChance
SPADES NINE CLUBS KING,0.429,0.0042,0.5668
HEARTS SEVEN CLUBS KING,0.452,0.0056,0.5424
HEARTS FIVE SPADES FOUR,0.6256,0.0104,0.364
CLUBS JACK DIAMONDS SEVEN,0.6652,0.0076,0.3272
CLUBS SIX CLUBS QUEEN,0.6258,0.112,0.2622
DIAMONDS NINE DIAMONDS SEVEN,0.6128,0.0118,0.3754
SPADES ACE HEARTS SEVEN,0.4582,0.0038,0.538
SPADES FIVE HEARTS QUEEN,0.6456,0.1208,0.2336
SPADES FOUR CLUBS KING,0.4498,0.0042,0.546
HEARTS SIX CLUBS FOUR,0.6422,0.0094,0.3484
DIAMONDS ACE SPADES SIX,0.4322,0.0042,0.5636
CLUBS TEN SPADES JACK,0.7108,0.0354,0.2538
SPADES SIX SPADES FOUR,0.5894,0.0094,0.4012
DIAMONDS ACE HEARTS ACE,0.1542,0.0024,0.8434
SPADES TWO HEARTS QUEEN,0.6574,0.1138,0.2288
HEARTS TWO DIAMONDS KING,0.4338,0.0082,0.558
SPADES NINE DIAMONDS FIVE,0.6734,0.0098,0.3168
CLUBS TEN DIAMONDS NINE,0.6952,0.045,0.2598
CLUBS SEVEN DIAMONDS FOUR,0.6676,0.0114,0.321
SPADES TWO HEARTS NINE,0.6846,0.0138,0.3016
CLUBS JACK SPADES QUEEN,0.2328,0.0822,0.685
SPADES JACK DIAMONDS EIGHT,0.657,0.0088,0.3342
HEARTS THREE HEARTS NINE,0.6452,0.0084,0.3464
SPADES KING SPADES FOUR,0.413,0.0072,0.5798
SPADES TEN SPADES SIX,0.676,0.0398,0.2842
HEARTS FOUR SPADES SIX,0.6364,0.009,0.3546
CLUBS FIVE SPADES TWO,0.6484,0.0136,0.338
SPADES SEVEN HEARTS QUEEN,0.6498,0.1228,0.2274
SPADES ACE HEARTS THREE,0.4448,0.0044,0.5508
SPADES NINE SPADES SIX,0.61,0.0108,0.3792
CLUBS FIVE CLUBS QUEEN,0.6072,0.1104,0.2824
SPADES SEVEN HEARTS EIGHT,0.639,0.0102,0.3508
HEARTS KING DIAMONDS SEVEN,0.4348,0.0068,0.5584
CLUBS TEN HEARTS ACE,0.262,0.0222,0.7158
CLUBS SIX CLUBS TWO,0.6212,0.0078,0.371
HEARTS TWO SPADES TWO,0.463,0.0212,0.5158
SPADES NINE DIAMONDS SIX,0.6536,0.0106,0.3358
SPADES SIX HEARTS EIGHT,0.6478,0.0098,0.3424
DIAMONDS EIGHT DIAMONDS FIVE,0.6222,0.0106,0.3672
CLUBS THREE CLUBS ACE,0.404,0.0048,0.5912
CLUBS EIGHT CLUBS ACE,0.4026,0.0034,0.594
SPADES THREE DIAMONDS FIVE,0.6404,0.0114,0.3482
SPADES ACE CLUBS FIVE,0.4384,0.0036,0.558
DIAMONDS JACK HEARTS QUEEN,0.2242,0.0934,0.6824
CLUBS TWO CLUBS ACE,0.4064,0.0046,0.589
SPADES QUEEN CLUBS EIGHT,0.6486,0.1178,0.2336
HEARTS THREE DIAMONDS SEVEN,0.6678,0.0118,0.3204
SPADES ACE SPADES FOUR,0.3966,0.0038,0.5996
HEARTS SEVEN CLUBS FOUR,0.6476,0.0102,0.3422
SPADES EIGHT CLUBS ACE,0.4344,0.0028,0.5628
SPADES SIX HEARTS QUEEN,0.6444,0.1208,0.2348
CLUBS FIVE HEARTS KING,0.4272,0.0068,0.566
HEARTS KING DIAMONDS SIX,0.4378,0.0066,0.5556
DIAMONDS THREE HEARTS QUEEN,0.6454,0.1302,0.2244
SPADES JACK DIAMONDS FIVE,0.663,0.011,0.326
HEARTS QUEEN CLUBS KING,0.2316,0.0262,0.7422
CLUBS THREE HEARTS QUEEN,0.6508,0.12,0.2292
CLUBS FOUR SPADES FOUR,0.4786,0.016,0.5054
SPADES QUEEN SPADES TWO,0.6252,0.1106,0.2642
HEARTS SIX DIAMONDS KING,0.437,0.0064,0.5566
SPADES KING SPADES TEN,0.25,0.0324,0.7176
CLUBS SIX DIAMONDS NINE,0.6556,0.0096,0.3348
DIAMONDS THREE HEARTS TWO,0.66,0.0136,0.3264
SPADES SEVEN DIAMONDS FOUR,0.6468,0.0092,0.344
SPADES SIX CLUBS ACE,0.4448,0.0032,0.552
SPADES QUEEN CLUBS SEVEN,0.658,0.1202,0.2218
HEARTS SEVEN HEARTS FIVE,0.62,0.0074,0.3726
HEARTS FIVE SPADES JACK,0.6702,0.0092,0.3206
DIAMONDS JACK SPADES TWO,0.6762,0.0114,0.3124
HEARTS THREE CLUBS KING,0.4364,0.008,0.5556
CLUBS ACE HEARTS JACK,0.3674,0.004,0.6286
HEARTS FOUR DIAMONDS TEN,0.7338,0.0452,0.221
HEARTS TWO HEARTS KING,0.4186,0.0068,0.5746
HEARTS FOUR SPADES TEN,0.7172,0.0478,0.235
SPADES TEN DIAMONDS SIX,0.7098,0.0466,0.2436
SPADES SEVEN DIAMONDS TEN,0.7206,0.0444,0.235
CLUBS FIVE HEARTS JACK,0.6562,0.0118,0.332
DIAMONDS ACE DIAMONDS FIVE,0.4118,0.0066,0.5816
CLUBS SEVEN DIAMONDS KING,0.4326,0.0046,0.5628
SPADES JACK CLUBS ACE,0.3846,0.0036,0.6118
SPADES ACE DIAMONDS NINE,0.4222,0.0042,0.5736
HEARTS ACE SPADES THREE,0.43,0.0024,0.5676
CLUBS EIGHT HEARTS THREE,0.6922,0.0132,0.2946
SPADES EIGHT DIAMONDS KING,0.4252,0.0058,0.569
HEARTS FIVE CLUBS THREE,0.6368,0.012,0.3512
CLUBS SIX SPADES EIGHT,0.6288,0.0082,0.363
HEARTS FOUR SPADES SEVEN,0.6432,0.0106,0.3462
SPADES TEN SPADES SEVEN,0.6666,0.044,0.2894
CLUBS SEVEN CLUBS FOUR,0.6074,0.013,0.3796
CLUBS SIX DIAMONDS JACK,0.6666,0.01,0.3234
SPADES KING DIAMONDS ACE,0.3442,0.0046,0.6512
HEARTS SEVEN HEARTS KING,0.4184,0.0054,0.5762
HEARTS SEVEN DIAMONDS FIVE,0.645,0.013,0.342
SPADES THREE HEARTS KING,0.4288,0.0082,0.563
SPADES KING CLUBS SEVEN,0.4324,0.0048,0.5628
CLUBS SEVEN HEARTS EIGHT,0.636,0.0084,0.3556
SPADES SEVEN DIAMONDS SIX,0.62,0.0128,0.3672
HEARTS ACE CLUBS ACE,0.1502,0.0024,0.8474
HEARTS SIX DIAMONDS SIX,0.4896,0.0138,0.4966
CLUBS SIX CLUBS ACE,0.395,0.004,0.601
HEARTS TWO CLUBS KING,0.4532,0.0066,0.5402
HEARTS FIVE CLUBS ACE,0.4326,0.0042,0.5632
SPADES TEN DIAMONDS FOUR,0.734,0.0422,0.2238
SPADES NINE SPADES FIVE,0.63,0.0096,0.3604
SPADES JACK SPADES EIGHT,0.6026,0.0104,0.387
CLUBS FOUR SPADES FIVE,0.6132,0.0112,0.3756
SPADES TEN CLUBS SIX,0.6988,0.0502,0.251
SPADES FOUR DIAMONDS NINE,0.689,0.012,0.299
SPADES EIGHT DIAMONDS TEN,0.7014,0.0438,0.2548
HEARTS SIX CLUBS SEVEN,0.6272,0.009,0.3638
DIAMONDS KING DIAMONDS FOUR,0.421,0.0064,0.5726
CLUBS THREE DIAMONDS NINE,0.6786,0.0114,0.31
SPADES KING DIAMONDS TWO,0.4372,0.0088,0.554
HEARTS SIX SPADES FIVE,0.622,0.009,0.369
HEARTS TWO DIAMONDS SEVEN,0.6842,0.0086,0.3072
SPADES TEN HEARTS EIGHT,0.7122,0.0442,0.2436
HEARTS FIVE HEARTS NINE,0.6384,0.0114,0.3502
CLUBS SEVEN SPADES FOUR,0.6546,0.0094,0.336
HEARTS KING DIAMONDS EIGHT,0.419,0.0064,0.5746
CLUBS JACK HEARTS THREE,0.65,0.01,0.34
CLUBS TEN DIAMONDS TEN,0.3102,0.0254,0.6644
DIAMONDS TEN DIAMONDS SEVEN,0.688,0.0464,0.2656
DIAMONDS TWO DIAMONDS SEVEN,0.6382,0.0114,0.3504
SPADES SEVEN HEARTS ACE,0.4324,0.0032,0.5644
DIAMONDS ACE DIAMONDS KING,0.3438,0.0058,0.6504
DIAMONDS THREE DIAMONDS KING,0.418,0.007,0.575
CLUBS FOUR SPADES THREE,0.6358,0.0104,0.3538
HEARTS ACE HEARTS NINE,0.4058,0.005,0.5892
SPADES ACE SPADES TWO,0.4136,0.004,0.5824
DIAMONDS TWO SPADES JACK,0.6878,0.0084,0.3038
DIAMONDS ACE SPADES FIVE,0.4272,0.004,0.5688
SPADES QUEEN HEARTS QUEEN,0.13,0.0236,0.8464
CLUBS TEN SPADES THREE,0.731,0.0496,0.2194
DIAMONDS KING SPADES TWO,0.4392,0.0086,0.5522
SPADES THREE CLUBS KING,0.438,0.0058,0.5562
SPADES NINE DIAMONDS JACK,0.6376,0.0102,0.3522
CLUBS JACK DIAMONDS JACK,0.295,0.01,0.695
DIAMONDS THREE SPADES SEVEN,0.6668,0.0096,0.3236
HEARTS ACE SPADES TWO,0.436,0.0056,0.5584
HEARTS ACE DIAMONDS FIVE,0.4242,0.0066,0.5692
HEARTS SIX HEARTS NINE,0.6192,0.0084,0.3724
SPADES QUEEN CLUBS QUEEN,0.1362,0.0188,0.845
DIAMONDS THREE CLUBS THREE,0.4884,0.0174,0.4942
CLUBS FOUR HEARTS JACK,0.6732,0.01,0.3168
CLUBS JACK HEARTS QUEEN,0.2286,0.0926,0.6788
HEARTS NINE DIAMONDS FIVE,0.6664,0.0098,0.3238
SPADES ACE CLUBS SIX,0.4392,0.0036,0.5572
HEARTS FOUR HEARTS THREE,0.6094,0.0112,0.3794
HEARTS FIVE DIAMONDS SIX,0.6322,0.01,0.3578
CLUBS NINE CLUBS THREE,0.6362,0.0084,0.3554
SPADES KING CLUBS TWO,0.4406,0.006,0.5534
CLUBS JACK DIAMONDS ACE,0.3782,0.0044,0.6174
HEARTS FIVE HEARTS FOUR,0.596,0.013,0.391
HEARTS KING SPADES TWO,0.4382,0.0072,0.5546
HEARTS FOUR SPADES EIGHT,0.6638,0.0106,0.3256
DIAMONDS JACK SPADES FOUR,0.6556,0.0104,0.334
DIAMONDS ACE CLUBS ACE,0.1502,0.0028,0.847
SPADES ACE SPADES JACK,0.3502,0.0064,0.6434
DIAMONDS ACE SPADES SEVEN,0.4354,0.0042,0.5604
SPADES THREE HEARTS QUEEN,0.6418,0.1226,0.2356
CLUBS EIGHT CLUBS THREE,0.6252,0.0108,0.364
DIAMONDS TWO CLUBS FOUR,0.6506,0.0126,0.3368
SPADES JACK HEARTS THREE,0.6678,0.0122,0.32
SPADES TEN CLUBS FOUR,0.7166,0.0472,0.2362
SPADES QUEEN DIAMONDS SIX,0.6426,0.1208,0.2366
SPADES SIX DIAMONDS NINE,0.662,0.0122,0.3258
CLUBS TEN DIAMONDS FOUR,0.7232,0.0458,0.231
CLUBS JACK DIAMONDS EIGHT,0.6528,0.0108,0.3364
HEARTS SEVEN CLUBS TEN,0.724,0.0458,0.2302
CLUBS FOUR DIAMONDS NINE,0.6914,0.0102,0.2984
SPADES ACE CLUBS ACE,0.165,0.004,0.831
CLUBS FOUR CLUBS TWO,0.6184,0.0114,0.3702
HEARTS SEVEN DIAMONDS THREE,0.681,0.0106,0.3084
DIAMONDS THREE CLUBS FOUR,0.6494,0.0112,0.3394
DIAMONDS THREE DIAMONDS FIVE,0.61,0.0118,0.3782
HEARTS FOUR CLUBS FOUR,0.4894,0.0184,0.4922
HEARTS THREE CLUBS THREE,0.4788,0.0168,0.5044
SPADES KING CLUBS FIVE,0.4352,0.0074,0.5574
HEARTS SEVEN CLUBS NINE,0.6578,0.0084,0.3338
DIAMONDS EIGHT HEARTS NINE,0.6538,0.0094,0.3368
CLUBS NINE DIAMONDS FIVE,0.6648,0.0112,0.324
DIAMONDS TWO DIAMONDS FIVE,0.6204,0.0126,0.367
HEARTS FIVE DIAMONDS NINE,0.6784,0.0108,0.3108
SPADES SIX SPADES THREE,0.6074,0.0128,0.3798
CLUBS KING DIAMONDS FIVE,0.4488,0.0068,0.5444
CLUBS SIX DIAMONDS ACE,0.4324,0.004,0.5636
SPADES ACE DIAMONDS EIGHT,0.4442,0.0046,0.5512
DIAMONDS THREE HEARTS EIGHT,0.682,0.014,0.304
HEARTS SIX DIAMONDS TEN,0.7296,0.0446,0.2258
SPADES SIX HEARTS KING,0.438,0.006,0.556
DIAMONDS NINE CLUBS ACE,0.4318,0.0046,0.5636
CLUBS FIVE CLUBS THREE,0.59,0.0116,0.3984
DIAMONDS JACK CLUBS TWO,0.6668,0.0102,0.323
HEARTS SIX CLUBS KING,0.4336,0.0066,0.5598
CLUBS FIVE SPADES FOUR,0.6166,0.0102,0.3732
DIAMONDS ACE CLUBS THREE,0.4328,0.004,0.5632
CLUBS TEN SPADES SIX,0.7158,0.0448,0.2394
HEARTS SEVEN SPADES NINE,0.6338,0.0104,0.3558
HEARTS SEVEN SPADES JACK,0.6604,0.0084,0.3312
CLUBS JACK HEARTS ACE,0.3706,0.0044,0.625
SPADES TWO CLUBS QUEEN,0.6416,0.1286,0.2298
CLUBS JACK HEARTS SEVEN,0.649,0.0084,0.3426
DIAMONDS NINE HEARTS QUEEN,0.6448,0.125,0.2302
HEARTS FOUR DIAMONDS SIX,0.6352,0.0112,0.3536
CLUBS SIX HEARTS QUEEN,0.6466,0.122,0.2314
SPADES QUEEN DIAMONDS FIVE,0.6694,0.1078,0.2228
CLUBS SIX DIAMONDS FIVE,0.6302,0.0116,0.3582
HEARTS NINE DIAMONDS FOUR,0.7036,0.0128,0.2836
DIAMONDS THREE HEARTS KING,0.4428,0.005,0.5522
HEARTS FOUR DIAMONDS FIVE,0.6166,0.0126,0.3708
DIAMONDS THREE DIAMONDS ACE,0.4248,0.0044,0.5708
DIAMONDS KING HEARTS JACK,0.3558,0.0056,0.6386
SPADES QUEEN HEARTS NINE,0.6388,0.1266,0.2346
HEARTS THREE HEARTS QUEEN,0.6212,0.1182,0.2606
HEARTS THREE DIAMONDS KING,0.4322,0.0068,0.561
SPADES KING SPADES THREE,0.4134,0.0066,0.58
SPADES EIGHT CLUBS KING,0.4392,0.0076,0.5532
SPADES NINE HEARTS TWO,0.6926,0.0108,0.2966
DIAMONDS TWO CLUBS NINE,0.67,0.0082,0.3218
SPADES ACE SPADES SEVEN,0.4076,0.0034,0.589
HEARTS SEVEN DIAMONDS EIGHT,0.6384,0.011,0.3506
CLUBS TWO DIAMONDS TEN,0.733,0.0532,0.2138
DIAMONDS TWO CLUBS QUEEN,0.6584,0.1154,0.2262
CLUBS ACE DIAMONDS SIX,0.4374,0.004,0.5586
HEARTS SIX SPADES THREE,0.647,0.0108,0.3422
DIAMONDS TEN CLUBS KING,0.2564,0.0288,0.7148
SPADES KING HEARTS TWO,0.447,0.0046,0.5484
SPADES ACE CLUBS KING,0.3652,0.0042,0.6306
SPADES KING DIAMONDS FIVE,0.4372,0.0084,0.5544
SPADES NINE SPADES EIGHT,0.597,0.0084,0.3946
SPADES NINE SPADES THREE,0.6308,0.0112,0.358
DIAMONDS NINE HEARTS NINE,0.4472,0.0166,0.5362
SPADES SIX CLUBS KING,0.4448,0.0064,0.5488
DIAMONDS TWO HEARTS EIGHT,0.679,0.01,0.311
CLUBS SEVEN SPADES SEVEN,0.4622,0.016,0.5218
SPADES FIVE SPADES FOUR,0.597,0.0102,0.3928
SPADES SEVEN CLUBS FOUR,0.637,0.0082,0.3548
CLUBS NINE HEARTS FOUR,0.6802,0.0108,0.309
HEARTS QUEEN DIAMONDS SIX,0.6302,0.1294,0.2404
CLUBS SIX CLUBS THREE,0.6078,0.0086,0.3836
HEARTS FOUR HEARTS JACK,0.6334,0.0104,0.3562
SPADES JACK HEARTS FOUR,0.6736,0.0104,0.316
HEARTS QUEEN CLUBS ACE,0.2726,0.0162,0.7112
HEARTS SIX CLUBS NINE,0.6678,0.011,0.3212
SPADES SIX DIAMONDS TEN,0.7206,0.0414,0.238
HEARTS QUEEN CLUBS QUEEN,0.122,0.0196,0.8584
SPADES THREE HEARTS EIGHT,0.681,0.0122,0.3068
SPADES NINE HEARTS ACE,0.4186,0.0054,0.576
CLUBS NINE CLUBS KING,0.3902,0.0046,0.6052
DIAMONDS TWO HEARTS NINE,0.7024,0.012,0.2856
SPADES TEN SPADES FIVE,0.6934,0.039,0.2676
CLUBS JACK HEARTS EIGHT,0.6506,0.0098,0.3396
CLUBS SIX CLUBS FOUR,0.6016,0.0102,0.3882
SPADES KING DIAMONDS EIGHT,0.4258,0.009,0.5652
SPADES SEVEN CLUBS TWO,0.6806,0.0092,0.3102
CLUBS TWO DIAMONDS EIGHT,0.678,0.009,0.313
SPADES JACK CLUBS KING,0.3768,0.0058,0.6174
HEARTS THREE SPADES THREE,0.4832,0.0176,0.4992
CLUBS EIGHT SPADES EIGHT,0.4588,0.0152,0.526
CLUBS FOUR SPADES SIX,0.6356,0.0108,0.3536
HEARTS FIVE DIAMONDS ACE,0.4284,0.0034,0.5682
DIAMONDS KING CLUBS QUEEN,0.2476,0.0234,0.729
DIAMONDS JACK HEARTS KING,0.3682,0.0092,0.6226
SPADES KING CLUBS EIGHT,0.4298,0.0066,0.5636
CLUBS EIGHT SPADES SIX,0.6306,0.0092,0.3602
HEARTS SIX HEARTS THREE,0.6354,0.0088,0.3558
HEARTS THREE CLUBS FIVE,0.6346,0.0142,0.3512
CLUBS FIVE DIAMONDS EIGHT,0.651,0.0114,0.3376
CLUBS FOUR DIAMONDS KING,0.43,0.0088,0.5612
CLUBS SIX CLUBS FIVE,0.5782,0.008,0.4138
HEARTS THREE CLUBS SIX,0.6646,0.0088,0.3266
HEARTS SIX HEARTS FIVE,0.6058,0.0108,0.3834
SPADES KING DIAMONDS SIX,0.4366,0.0078,0.5556
SPADES JACK DIAMONDS ACE,0.3788,0.0034,0.6178
DIAMONDS KING SPADES FIVE,0.4516,0.0064,0.542
HEARTS SIX HEARTS FOUR,0.606,0.0116,0.3824
SPADES EIGHT DIAMONDS FIVE,0.6442,0.011,0.3448
SPADES QUEEN HEARTS FOUR,0.6534,0.1192,0.2274
CLUBS TEN SPADES TWO,0.7202,0.0494,0.2304
HEARTS SIX HEARTS ACE,0.422,0.005,0.573
DIAMONDS THREE DIAMONDS SEVEN,0.6338,0.0096,0.3566
HEARTS THREE HEARTS TWO,0.6264,0.0156,0.358
CLUBS ACE DIAMONDS FOUR,0.4312,0.0054,0.5634
DIAMONDS TWO SPADES EIGHT,0.6684,0.0102,0.3214
CLUBS NINE DIAMONDS NINE,0.4398,0.0124,0.5478
HEARTS TWO DIAMONDS TEN,0.7394,0.0504,0.2102
SPADES TEN CLUBS QUEEN,0.0204,0.957,0.0226
HEARTS SEVEN HEARTS ACE,0.4182,0.004,0.5778
DIAMONDS TEN DIAMONDS EIGHT,0.6684,0.0474,0.2842
SPADES KING CLUBS SIX,0.444,0.0046,0.5514
CLUBS FOUR SPADES TWO,0.6472,0.0156,0.3372
CLUBS TEN CLUBS KING,0.2426,0.0272,0.7302
HEARTS SIX CLUBS QUEEN,0.6656,0.1128,0.2216
SPADES FIVE DIAMONDS FOUR,0.6356,0.0118,0.3526
SPADES TWO HEARTS JACK,0.671,0.0114,0.3176
HEARTS SEVEN DIAMONDS SIX,0.6254,0.0122,0.3624
CLUBS FIVE CLUBS FOUR,0.5814,0.0094,0.4092
HEARTS THREE HEARTS ACE,0.4152,0.0072,0.5776
HEARTS SIX HEARTS TWO,0.6258,0.0098,0.3644
CLUBS NINE DIAMONDS EIGHT,0.6452,0.0114,0.3434
HEARTS TWO DIAMONDS ACE,0.4378,0.0048,0.5574
SPADES THREE DIAMONDS EIGHT,0.6856,0.0108,0.3036
CLUBS SEVEN DIAMONDS SEVEN,0.4782,0.016,0.5058
CLUBS THREE HEARTS JACK,0.6702,0.0106,0.3192
HEARTS ACE HEARTS KING,0.3258,0.0042,0.67
HEARTS TWO CLUBS FOUR,0.6622,0.0104,0.3274
SPADES KING CLUBS NINE,0.4162,0.0072,0.5766
DIAMONDS TWO HEARTS QUEEN,0.6572,0.1198,0.223
HEARTS SIX SPADES SIX,0.4766,0.0158,0.5076
SPADES QUEEN DIAMONDS NINE,0.658,0.1188,0.2232
CLUBS JACK CLUBS SEVEN,0.6164,0.0092,0.3744
CLUBS NINE CLUBS QUEEN,0.6056,0.1158,0.2786
SPADES JACK SPADES TEN,0.6716,0.0382,0.2902
CLUBS THREE CLUBS QUEEN,0.6028,0.1192,0.278
CLUBS SEVEN DIAMONDS TEN,0.7364,0.0438,0.2198
DIAMONDS THREE DIAMONDS JACK,0.6252,0.0116,0.3632
CLUBS NINE SPADES THREE,0.6796,0.0098,0.3106
HEARTS FOUR HEARTS KING,0.4316,0.0088,0.5596
DIAMONDS KING HEARTS QUEEN,0.2452,0.0234,0.7314
CLUBS THREE CLUBS TWO,0.6014,0.0112,0.3874
CLUBS SEVEN CLUBS KING,0.413,0.0082,0.5788
DIAMONDS JACK DIAMONDS SEVEN,0.6168,0.0088,0.3744
HEARTS SEVEN DIAMONDS TEN,0.7166,0.0492,0.2342
SPADES ACE HEARTS JACK,0.3726,0.004,0.6234
SPADES JACK HEARTS ACE,0.3704,0.0048,0.6248
DIAMONDS THREE SPADES EIGHT,0.6878,0.0104,0.3018
HEARTS FOUR CLUBS QUEEN,0.6542,0.1252,0.2206
DIAMONDS SEVEN DIAMONDS SIX,0.6094,0.0102,0.3804
SPADES QUEEN DIAMONDS KING,0.2386,0.0242,0.7372
SPADES KING HEARTS SIX,0.4416,0.005,0.5534
DIAMONDS JACK DIAMONDS EIGHT,0.6094,0.0108,0.3798
DIAMONDS THREE HEARTS JACK,0.6638,0.0108,0.3254
HEARTS TWO DIAMONDS FIVE,0.6492,0.0148,0.336
HEARTS THREE SPADES SEVEN,0.666,0.0092,0.3248
DIAMONDS TEN HEARTS ACE,0.2626,0.0218,0.7156
SPADES TEN HEARTS NINE,0.6946,0.0412,0.2642
CLUBS JACK CLUBS FIVE,0.6264,0.0092,0.3644
HEARTS TWO SPADES SEVEN,0.6762,0.01,0.3138
HEARTS SEVEN CLUBS ACE,0.4392,0.005,0.5558
DIAMONDS TWO DIAMONDS NINE,0.6472,0.0142,0.3386
HEARTS FOUR CLUBS SEVEN,0.65,0.0098,0.3402
SPADES THREE SPADES TWO,0.5986,0.012,0.3894
HEARTS QUEEN DIAMONDS FOUR,0.655,0.117,0.228
SPADES SEVEN DIAMONDS JACK,0.6546,0.0102,0.3352
HEARTS FOUR CLUBS ACE,0.4392,0.0038,0.557
CLUBS THREE DIAMONDS SIX,0.6674,0.0114,0.3212
DIAMONDS KING SPADES SIX,0.4342,0.0076,0.5582
SPADES FIVE SPADES TWO,0.6024,0.0098,0.3878
CLUBS JACK SPADES TWO,0.6722,0.0098,0.318
CLUBS JACK DIAMONDS SIX,0.667,0.0088,0.3242
SPADES ACE SPADES THREE,0.4054,0.005,0.5896
SPADES JACK HEARTS EIGHT,0.6544,0.0098,0.3358
SPADES QUEEN HEARTS FIVE,0.643,0.1274,0.2296
DIAMONDS NINE SPADES TWO,0.6902,0.0088,0.301
CLUBS THREE HEARTS ACE,0.4358,0.0052,0.559
DIAMONDS KING DIAMONDS EIGHT,0.4118,0.0076,0.5806
SPADES NINE HEARTS KING,0.4042,0.007,0.5888
DIAMONDS ACE DIAMONDS FOUR,0.3984,0.0058,0.5958
SPADES ACE CLUBS NINE,0.4336,0.004,0.5624
HEARTS FIVE CLUBS SEVEN,0.6268,0.0124,0.3608
CLUBS TEN SPADES FIVE,0.7198,0.0466,0.2336
SPADES EIGHT SPADES FIVE,0.6022,0.0102,0.3876
DIAMONDS THREE CLUBS SEVEN,0.6688,0.0114,0.3198
CLUBS SEVEN CLUBS QUEEN,0.6124,0.116,0.2716
HEARTS SIX SPADES EIGHT,0.6418,0.0106,0.3476
CLUBS TEN CLUBS TWO,0.6808,0.0472,0.272
CLUBS FOUR CLUBS KING,0.4054,0.0072,0.5874
DIAMONDS TEN HEARTS KING,0.2442,0.0278,0.728
DIAMONDS SEVEN HEARTS EIGHT,0.6358,0.01,0.3542
HEARTS SEVEN HEARTS FOUR,0.6214,0.0126,0.366
CLUBS NINE DIAMONDS SIX,0.6554,0.0086,0.336
SPADES SEVEN SPADES TWO,0.635,0.0098,0.3552
CLUBS SIX SPADES TWO,0.6672,0.0092,0.3236
CLUBS NINE SPADES TEN,0.6984,0.0436,0.258
SPADES KING HEARTS JACK,0.3634,0.0068,0.6298
CLUBS EIGHT CLUBS KING,0.4066,0.0056,0.5878
CLUBS JACK DIAMONDS THREE,0.6644,0.009,0.3266
CLUBS EIGHT HEARTS KING,0.4266,0.0036,0.5698
CLUBS FIVE DIAMONDS JACK,0.6544,0.009,0.3366
CLUBS JACK HEARTS SIX,0.671,0.01,0.319
HEARTS SIX DIAMONDS FOUR,0.6424,0.011,0.3466
CLUBS TEN HEARTS TWO,0.7394,0.0476,0.213
CLUBS SEVEN SPADES EIGHT,0.6332,0.0112,0.3556
CLUBS FIVE SPADES THREE,0.6286,0.0102,0.3612
SPADES SIX DIAMONDS SEVEN,0.6356,0.0128,0.3516
DIAMONDS JACK CLUBS ACE,0.382,0.0052,0.6128
CLUBS JACK DIAMONDS FOUR,0.6622,0.0104,0.3274
DIAMONDS KING CLUBS TWO,0.4388,0.0074,0.5538
DIAMONDS SIX CLUBS KING,0.4312,0.0076,0.5612
HEARTS THREE DIAMONDS EIGHT,0.6938,0.012,0.2942
DIAMONDS TEN DIAMONDS SIX,0.6798,0.0468,0.2734
SPADES KING HEARTS NINE,0.418,0.0064,0.5756
DIAMONDS THREE HEARTS FIVE,0.653,0.0122,0.3348
CLUBS FIVE DIAMONDS KING,0.4292,0.0074,0.5634
SPADES JACK SPADES SIX,0.6214,0.0096,0.369
HEARTS FIVE CLUBS FIVE,0.4964,0.0174,0.4862
SPADES KING CLUBS FOUR,0.4448,0.0078,0.5474
SPADES KING SPADES NINE,0.3862,0.0068,0.607
CLUBS EIGHT CLUBS SIX,0.5982,0.0096,0.3922
CLUBS TEN HEARTS JACK,0.7152,0.0378,0.247
SPADES ACE DIAMONDS KING,0.3562,0.0052,0.6386
HEARTS FOUR CLUBS THREE,0.637,0.0128,0.3502
CLUBS TEN HEARTS SIX,0.7028,0.0466,0.2506
CLUBS TEN HEARTS KING,0.2408,0.0264,0.7328
CLUBS NINE HEARTS NINE,0.4536,0.0156,0.5308
CLUBS KING DIAMONDS FOUR,0.4418,0.0038,0.5544
DIAMONDS TWO SPADES TEN,0.7312,0.0424,0.2264
DIAMONDS TWO HEARTS KING,0.4412,0.007,0.5518
SPADES NINE CLUBS QUEEN,0.6542,0.1232,0.2226
SPADES JACK DIAMONDS SEVEN,0.6602,0.011,0.3288
SPADES JACK SPADES NINE,0.5996,0.0076,0.3928
DIAMONDS NINE DIAMONDS EIGHT,0.6188,0.0102,0.371
CLUBS EIGHT DIAMONDS JACK,0.6508,0.0088,0.3404
SPADES QUEEN DIAMONDS TEN,0.0206,0.9668,0.0126
DIAMONDS KING HEARTS EIGHT,0.4278,0.009,0.5632
CLUBS SIX HEARTS ACE,0.4346,0.0034,0.562
CLUBS NINE CLUBS FIVE,0.6276,0.0108,0.3616
HEARTS SIX CLUBS SIX,0.4704,0.0176,0.512
DIAMONDS JACK SPADES FIVE,0.6608,0.0106,0.3286
SPADES NINE HEARTS NINE,0.4476,0.0126,0.5398
DIAMONDS KING CLUBS THREE,0.437,0.0086,0.5544
SPADES JACK CLUBS TWO,0.6656,0.01,0.3244
CLUBS EIGHT SPADES SEVEN,0.6256,0.0092,0.3652
CLUBS THREE SPADES FOUR,0.6368,0.0114,0.3518
DIAMONDS THREE SPADES TEN,0.7354,0.0454,0.2192
CLUBS EIGHT HEARTS FOUR,0.6604,0.0098,0.3298
CLUBS FIVE CLUBS ACE,0.4006,0.0048,0.5946
CLUBS EIGHT DIAMONDS FOUR,0.6678,0.0088,0.3234
DIAMONDS JACK CLUBS KING,0.382,0.0062,0.6118
HEARTS FIVE HEARTS THREE,0.6124,0.0134,0.3742
SPADES NINE DIAMONDS ACE,0.4122,0.0044,0.5834
SPADES EIGHT DIAMONDS ACE,0.4184,0.0034,0.5782
DIAMONDS NINE DIAMONDS SIX,0.6276,0.0092,0.3632
DIAMONDS JACK DIAMONDS SIX,0.635,0.0116,0.3534
HEARTS FIVE SPADES TWO,0.6602,0.0152,0.3246
DIAMONDS ACE DIAMONDS EIGHT,0.4018,0.0058,0.5924
HEARTS SIX DIAMONDS TWO,0.67,0.009,0.321
SPADES THREE CLUBS ACE,0.4402,0.0038,0.556
SPADES KING SPADES EIGHT,0.406,0.0078,0.5862
CLUBS NINE DIAMONDS SEVEN,0.6546,0.0092,0.3362
HEARTS TWO DIAMONDS JACK,0.6668,0.0116,0.3216
DIAMONDS TWO CLUBS SEVEN,0.6662,0.0134,0.3204
HEARTS FOUR SPADES THREE,0.6248,0.0128,0.3624
SPADES FIVE CLUBS QUEEN,0.6502,0.1234,0.2264
CLUBS TEN CLUBS NINE,0.6626,0.0414,0.296
SPADES QUEEN SPADES NINE,0.61,0.1154,0.2746
HEARTS THREE HEARTS EIGHT,0.63,0.0138,0.3562
CLUBS TEN SPADES NINE,0.6944,0.0406,0.265
SPADES QUEEN SPADES FIVE,0.5942,0.12,0.2858
SPADES TEN CLUBS SEVEN,0.715,0.0424,0.2426
HEARTS TWO SPADES SIX,0.6566,0.0122,0.3312
HEARTS FIVE HEARTS TWO,0.6216,0.0116,0.3668
HEARTS SIX CLUBS TWO,0.6584,0.0136,0.328
HEARTS FIVE DIAMONDS TEN,0.7392,0.0486,0.2122
CLUBS TWO DIAMONDS SEVEN,0.6846,0.0098,0.3056
HEARTS FIVE CLUBS KING,0.4456,0.0088,0.5456
SPADES JACK HEARTS JACK,0.2906,0.011,0.6984
HEARTS SEVEN SPADES FIVE,0.639,0.0122,0.3488
CLUBS SEVEN SPADES SIX,0.6228,0.009,0.3682
DIAMONDS ACE SPADES THREE,0.439,0.0038,0.5572
HEARTS FIVE CLUBS EIGHT,0.644,0.01,0.346
SPADES KING SPADES JACK,0.3458,0.0066,0.6476
DIAMONDS KING HEARTS NINE,0.4188,0.006,0.5752
DIAMONDS TEN SPADES TWO,0.7374,0.049,0.2136
SPADES JACK DIAMONDS SIX,0.6598,0.0106,0.3296
HEARTS JACK CLUBS KING,0.3674,0.006,0.6266
DIAMONDS TWO DIAMONDS FOUR,0.624,0.0126,0.3634
CLUBS JACK DIAMONDS FIVE,0.666,0.0114,0.3226
HEARTS SIX SPADES SEVEN,0.6344,0.0106,0.355
HEARTS SEVEN HEARTS NINE,0.6104,0.0108,0.3788
HEARTS JACK CLUBS QUEEN,0.2288,0.0932,0.678
SPADES FIVE DIAMONDS SEVEN,0.6428,0.0088,0.3484
DIAMONDS TWO DIAMONDS TEN,0.709,0.0396,0.2514
DIAMONDS THREE CLUBS EIGHT,0.6888,0.0108,0.3004
SPADES KING CLUBS KING,0.159,0.0038,0.8372
CLUBS SEVEN DIAMONDS JACK,0.6358,0.0092,0.355
CLUBS SIX DIAMONDS EIGHT,0.6306,0.0106,0.3588
DIAMONDS ACE DIAMONDS NINE,0.4112,0.005,0.5838
SPADES FOUR HEARTS QUEEN,0.6492,0.1212,0.2296
SPADES ACE DIAMONDS FIVE,0.435,0.004,0.561
SPADES NINE SPADES FOUR,0.6448,0.0084,0.3468
DIAMONDS THREE CLUBS TEN,0.734,0.0484,0.2176
SPADES TEN DIAMONDS EIGHT,0.7002,0.0442,0.2556
CLUBS JACK SPADES NINE,0.6352,0.0082,0.3566
SPADES THREE HEARTS JACK,0.657,0.0106,0.3324
SPADES KING DIAMONDS KING,0.1482,0.0046,0.8472
SPADES FOUR HEARTS EIGHT,0.661,0.0094,0.3296
HEARTS FIVE CLUBS TWO,0.6384,0.0112,0.3504
SPADES SEVEN SPADES FOUR,0.6078,0.0088,0.3834
HEARTS QUEEN DIAMONDS FIVE,0.6448,0.1298,0.2254
SPADES TWO DIAMONDS FIVE,0.66,0.0104,0.3296
SPADES SEVEN CLUBS KING,0.4434,0.0056,0.551
CLUBS EIGHT HEARTS NINE,0.6466,0.0124,0.341
CLUBS EIGHT DIAMONDS ACE,0.434,0.0034,0.5626
DIAMONDS ACE HEARTS EIGHT,0.4306,0.0048,0.5646
CLUBS SIX DIAMONDS FOUR,0.641,0.0116,0.3474
CLUBS FIVE DIAMONDS ACE,0.4324,0.0064,0.5612
CLUBS NINE DIAMONDS FOUR,0.6804,0.011,0.3086
HEARTS SEVEN CLUBS SEVEN,0.4726,0.016,0.5114
SPADES ACE DIAMONDS SEVEN,0.4512,0.0036,0.5452
SPADES SIX DIAMONDS JACK,0.6614,0.0092,0.3294
DIAMONDS NINE HEARTS JACK,0.645,0.0098,0.3452
HEARTS QUEEN HEARTS EIGHT,0.629,0.1142,0.2568
CLUBS NINE HEARTS JACK,0.6284,0.0106,0.361
SPADES ACE CLUBS FOUR,0.4334,0.0056,0.561
CLUBS SEVEN DIAMONDS EIGHT,0.6264,0.0074,0.3662
SPADES EIGHT DIAMONDS EIGHT,0.4628,0.014,0.5232
DIAMONDS SEVEN CLUBS QUEEN,0.6628,0.1194,0.2178
DIAMONDS TWO HEARTS FOUR,0.672,0.0122,0.3158
SPADES SIX CLUBS THREE,0.6584,0.0088,0.3328
SPADES FIVE HEARTS ACE,0.4284,0.0044,0.5672
SPADES QUEEN HEARTS THREE,0.668,0.1176,0.2144
SPADES FIVE DIAMONDS NINE,0.666,0.0094,0.3246
HEARTS ACE DIAMONDS FOUR,0.4192,0.0056,0.5752
SPADES SIX DIAMONDS SIX,0.4662,0.0178,0.516
CLUBS TEN DIAMONDS TWO,0.7544,0.0436,0.202
HEARTS THREE SPADES EIGHT,0.6752,0.0092,0.3156
DIAMONDS ACE HEARTS NINE,0.4302,0.006,0.5638
SPADES KING DIAMONDS JACK,0.3886,0.006,0.6054
HEARTS SEVEN SPADES FOUR,0.646,0.0118,0.3422
CLUBS TEN HEARTS FOUR,0.7348,0.0456,0.2196
DIAMONDS THREE DIAMONDS NINE,0.636,0.014,0.35
CLUBS EIGHT SPADES FOUR,0.6548,0.011,0.3342
CLUBS FIVE HEARTS EIGHT,0.655,0.0096,0.3354
SPADES ACE HEARTS QUEEN,0.2552,0.0178,0.727
CLUBS NINE HEARTS KING,0.3962,0.0058,0.598
SPADES JACK CLUBS FOUR,0.6684,0.0082,0.3234
CLUBS TEN CLUBS FIVE,0.6794,0.0438,0.2768
SPADES TEN CLUBS THREE,0.7296,0.0466,0.2238
DIAMONDS ACE CLUBS FOUR,0.4252,0.004,0.5708
DIAMONDS TWO SPADES THREE,0.659,0.0104,0.3306
HEARTS SIX SPADES TEN,0.7152,0.045,0.2398
HEARTS SEVEN DIAMONDS TWO,0.6728,0.0128,0.3144
CLUBS EIGHT DIAMONDS TEN,0.6972,0.0476,0.2552
CLUBS TEN DIAMONDS ACE,0.2552,0.0182,0.7266
CLUBS ACE HEARTS NINE,0.4136,0.004,0.5824
CLUBS NINE CLUBS TWO,0.6358,0.0094,0.3548
DIAMONDS TEN DIAMONDS FOUR,0.7034,0.039,0.2576
HEARTS FIVE DIAMONDS KING,0.4438,0.0068,0.5494
DIAMONDS TWO HEARTS ACE,0.438,0.0072,0.5548
DIAMONDS ACE HEARTS KING,0.3444,0.0056,0.65
CLUBS FOUR HEARTS NINE,0.6874,0.0076,0.305
CLUBS TWO SPADES FOUR,0.6438,0.0126,0.3436
HEARTS SEVEN SPADES KING,0.4358,0.006,0.5582
HEARTS KING HEARTS QUEEN,0.2324,0.0262,0.7414
HEARTS FOUR CLUBS KING,0.4484,0.0072,0.5444
SPADES JACK SPADES FOUR,0.6192,0.0066,0.3742
DIAMONDS ACE HEARTS JACK,0.3606,0.0052,0.6342
CLUBS SIX SPADES FIVE,0.6062,0.0076,0.3862
HEARTS THREE SPADES TWO,0.6562,0.0122,0.3316
HEARTS ACE CLUBS QUEEN,0.261,0.0122,0.7268
DIAMONDS THREE HEARTS NINE,0.6844,0.0112,0.3044
HEARTS FIVE SPADES TEN,0.7318,0.0446,0.2236
DIAMONDS EIGHT CLUBS ACE,0.4388,0.0036,0.5576
HEARTS FIVE DIAMONDS FIVE,0.4966,0.0202,0.4832
SPADES FIVE DIAMONDS SIX,0.6264,0.014,0.3596
CLUBS JACK HEARTS FOUR,0.6652,0.01,0.3248
HEARTS SIX DIAMONDS NINE,0.6636,0.0102,0.3262
HEARTS SEVEN HEARTS THREE,0.6348,0.0108,0.3544
DIAMONDS KING DIAMONDS FIVE,0.428,0.0064,0.5656
DIAMONDS TWO HEARTS THREE,0.6614,0.0128,0.3258
HEARTS FOUR CLUBS FIVE,0.633,0.0114,0.3556
SPADES KING SPADES SIX,0.4006,0.007,0.5924
HEARTS SEVEN HEARTS EIGHT,0.6032,0.0114,0.3854
SPADES KING CLUBS TEN,0.2558,0.0266,0.7176
SPADES ACE SPADES EIGHT,0.3914,0.0044,0.6042
CLUBS FIVE DIAMONDS TEN,0.716,0.0464,0.2376
HEARTS SEVEN DIAMONDS JACK,0.6596,0.0098,0.3306
SPADES JACK SPADES SEVEN,0.6054,0.0082,0.3864
SPADES QUEEN DIAMONDS JACK,0.239,0.0914,0.6696
DIAMONDS THREE DIAMONDS FOUR,0.615,0.0122,0.3728
CLUBS TEN SPADES QUEEN,0.0244,0.956,0.0196
HEARTS FIVE DIAMONDS EIGHT,0.6604,0.01,0.3296
DIAMONDS TEN DIAMONDS FIVE,0.7066,0.0436,0.2498
HEARTS SEVEN SPADES QUEEN,0.6676,0.117,0.2154
DIAMONDS NINE CLUBS KING,0.4308,0.0066,0.5626
SPADES FOUR DIAMONDS SEVEN,0.6416,0.0102,0.3482
HEARTS JACK HEARTS EIGHT,0.6128,0.0124,0.3748
