opposingHand,winningChance,drawChance,lostChance
CLUBS EIGHT SPADES NINE,0.328,0.0394,0.6326
CLUBS FOUR CLUBS KING,0.24,0.0344,0.7256
HEARTS EIGHT SPADES EIGHT,0.1448,0.1004,0.7548
CLUBS TEN SPADES TEN,0.158,0.064,0.778
DIAMONDS ACE DIAMONDS SEVEN,0.328,0.005,0.667
HEARTS EIGHT HEARTS SEVEN,0.3048,0.0564,0.6388
CLUBS SEVEN DIAMONDS FIVE,0.3232,0.1048,0.572
SPADES EIGHT HEARTS KING,0.3624,0.0096,0.628
HEARTS EIGHT HEARTS THREE,0.3534,0.0698,0.5768
DIAMONDS THREE HEARTS QUEEN,0.3776,0.0134,0.609
SPADES NINE CLUBS QUEEN,0.3508,0.011,0.6382
CLUBS EIGHT SPADES THREE,0.3832,0.0682,0.5486
HEARTS JACK DIAMONDS SEVEN,0.3384,0.0196,0.642
DIAMONDS QUEEN HEARTS JACK,0.3286,0.0098,0.6616
SPADES FIVE HEARTS QUEEN,0.3412,0.0136,0.6452
SPADES ACE CLUBS QUEEN,0.352,0.004,0.644
CLUBS EIGHT SPADES TEN,0.332,0.027,0.641
DIAMONDS TEN CLUBS ACE,0.3322,0.0046,0.6632
HEARTS SEVEN CLUBS QUEEN,0.3474,0.0114,0.6412
CLUBS SEVEN DIAMONDS EIGHT,0.3158,0.066,0.6182
CLUBS NINE CLUBS QUEEN,0.3156,0.011,0.6734
CLUBS FOUR CLUBS QUEEN,0.2362,0.0434,0.7204
DIAMONDS THREE SPADES EIGHT,0.3646,0.0662,0.5692
CLUBS FOUR CLUBS THREE,0.2104,0.4744,0.3152
SPADES ACE DIAMONDS FIVE,0.3214,0.0068,0.6718
SPADES THREE DIAMONDS FIVE,0.3328,0.2478,0.4194
HEARTS KING SPADES TWO,0.2478,0.0292,0.723
SPADES NINE DIAMONDS SEVEN,0.338,0.0382,0.6238
DIAMONDS KING DIAMONDS QUEEN,0.3232,0.0096,0.6672
CLUBS JACK DIAMONDS FIVE,0.3368,0.025,0.6382
HEARTS EIGHT DIAMONDS KING,0.3374,0.0094,0.6532
DIAMONDS FOUR SPADES KING,0.2462,0.0376,0.7162
SPADES QUEEN DIAMONDS FIVE,0.3462,0.0172,0.6366
HEARTS EIGHT CLUBS QUEEN,0.3528,0.0128,0.6344
CLUBS NINE DIAMONDS QUEEN,0.3396,0.012,0.6484
SPADES NINE DIAMONDS JACK,0.3318,0.0192,0.649
CLUBS NINE CLUBS KING,0.3144,0.0106,0.675
SPADES SIX SPADES FIVE,0.286,0.1442,0.5698
SPADES NINE SPADES SEVEN,0.305,0.0366,0.6584
DIAMONDS TEN DIAMONDS SIX,0.3196,0.0278,0.6526
DIAMONDS FOUR DIAMONDS NINE,0.2424,0.1112,0.6464
SPADES NINE DIAMONDS FIVE,0.3448,0.0454,0.6098
HEARTS TWO DIAMONDS KING,0.258,0.0264,0.7156
SPADES SEVEN HEARTS KING,0.3388,0.0096,0.6516
SPADES EIGHT CLUBS ACE,0.3546,0.005,0.6404
DIAMONDS JACK HEARTS JACK,0.1338,0.0502,0.816
CLUBS TEN CLUBS NINE,0.31,0.0242,0.6658
HEARTS FIVE HEARTS TEN,0.339,0.0298,0.6312
SPADES TEN HEARTS QUEEN,0.3378,0.0116,0.6506
DIAMONDS THREE SPADES FOUR,0.2072,0.512,0.2808
SPADES EIGHT HEARTS JACK,0.341,0.0184,0.6406
HEARTS FIVE SPADES SEVEN,0.3214,0.1042,0.5744
SPADES SEVEN DIAMONDS QUEEN,0.3426,0.0138,0.6436
CLUBS FOUR CLUBS ACE,0.2188,0.0226,0.7586
SPADES KING CLUBS NINE,0.3316,0.0082,0.6602
CLUBS FIVE DIAMONDS FIVE,0.1098,0.148,0.7422
DIAMONDS THREE HEARTS ACE,0.343,0.007,0.65
DIAMONDS THREE HEARTS TEN,0.3712,0.033,0.5958
SPADES EIGHT SPADES SEVEN,0.2994,0.0552,0.6454
CLUBS JACK DIAMONDS NINE,0.3314,0.019,0.6496
CLUBS EIGHT SPADES TWO,0.2632,0.1418,0.595
HEARTS SEVEN CLUBS FOUR,0.2294,0.2024,0.5682
SPADES EIGHT DIAMONDS FIVE,0.3288,0.067,0.6042
HEARTS SIX DIAMONDS KING,0.346,0.011,0.643
DIAMONDS THREE SPADES TEN,0.362,0.0272,0.6108
HEARTS FIVE CLUBS QUEEN,0.3474,0.0136,0.639
HEARTS THREE DIAMONDS SIX,0.333,0.1732,0.4938
