opposingHand,winningChance,drawChance,lostChance
CLUBS THREE HEARTS EIGHT,0.6852,0.0128,0.302
HEARTS SIX SPADES NINE,0.658,0.0102,0.3318
HEARTS FOUR CLUBS SIX,0.6356,0.0098,0.3546
SPADES JACK CLUBS EIGHT,0.6372,0.0096,0.3532
SPADES NINE DIAMONDS SEVEN,0.6558,0.0094,0.3348
DIAMONDS THREE SPADES JACK,0.6608,0.0108,0.3284
CLUBS TEN DIAMONDS SEVEN,0.7226,0.0444,0.233
CLUBS FOUR HEARTS EIGHT,0.6648,0.0106,0.3246
CLUBS FIVE HEARTS ACE,0.438,0.0046,0.5574
SPADES EIGHT CLUBS QUEEN,0.6458,0.118,0.2362
HEARTS TWO SPADES THREE,0.654,0.0134,0.3326
SPADES FOUR SPADES THREE,0.5958,0.0118,0.3924
SPADES QUEEN CLUBS SIX,0.6622,0.1118,0.226
CLUBS JACK CLUBS QUEEN,0.2216,0.092,0.6864
SPADES TEN DIAMONDS KING,0.2498,0.0346,0.7156
SPADES TEN SPADES TWO,0.679,0.045,0.276
CLUBS TEN SPADES SEVEN,0.7208,0.0428,0.2364
CLUBS JACK SPADES SIX,0.655,0.009,0.336
HEARTS FIVE DIAMONDS JACK,0.667,0.0096,0.3234
SPADES QUEEN HEARTS JACK,0.2332,0.0894,0.6774
DIAMONDS KING SPADES FOUR,0.438,0.0062,0.5558
SPADES KING HEARTS FIVE,0.4342,0.0076,0.5582
SPADES QUEEN CLUBS THREE,0.6568,0.1146,0.2286
CLUBS NINE HEARTS FIVE,0.6698,0.0094,0.3208
SPADES SIX HEARTS JACK,0.6544,0.0102,0.3354
SPADES NINE DIAMONDS TEN,0.7026,0.0438,0.2536
CLUBS SIX HEARTS NINE,0.6548,0.0078,0.3374
CLUBS TEN DIAMONDS SIX,0.7178,0.0418,0.2404
SPADES TEN DIAMONDS JACK,0.7206,0.0374,0.242
SPADES FOUR HEARTS NINE,0.678,0.0102,0.3118
SPADES SIX SPADES TWO,0.6274,0.0098,0.3628
DIAMONDS TEN DIAMONDS NINE,0.6704,0.0456,0.284
DIAMONDS KING CLUBS KING,0.16,0.0022,0.8378
SPADES QUEEN DIAMONDS SEVEN,0.6706,0.1166,0.2128
CLUBS NINE CLUBS ACE,0.3912,0.0042,0.6046
DIAMONDS KING HEARTS KING,0.1482,0.0062,0.8456
SPADES JACK SPADES THREE,0.6118,0.011,0.3772
HEARTS SEVEN CLUBS THREE,0.6572,0.0116,0.3312
HEARTS TWO CLUBS THREE,0.6566,0.0128,0.3306
CLUBS JACK CLUBS SIX,0.617,0.0102,0.3728
HEARTS FOUR HEARTS EIGHT,0.642,0.0114,0.3466
SPADES SEVEN HEARTS KING,0.4364,0.0074,0.5562
SPADES NINE DIAMONDS NINE,0.4402,0.0116,0.5482
CLUBS SIX HEARTS JACK,0.6614,0.0106,0.328
CLUBS QUEEN HEARTS EIGHT,0.6542,0.116,0.2298
CLUBS SEVEN DIAMONDS FIVE,0.6438,0.0116,0.3446
CLUBS TEN SPADES TEN,0.3244,0.0224,0.6532
SPADES SIX HEARTS ACE,0.4494,0.003,0.5476
HEARTS SIX HEARTS EIGHT,0.6108,0.0114,0.3778
HEARTS FOUR DIAMONDS SEVEN,0.6572,0.0096,0.3332
HEARTS SEVEN HEARTS TWO,0.6616,0.0096,0.3288
DIAMONDS THREE DIAMONDS EIGHT,0.6466,0.0108,0.3426
DIAMONDS JACK SPADES THREE,0.6608,0.0072,0.332
SPADES SEVEN CLUBS QUEEN,0.6468,0.124,0.2292
HEARTS FOUR SPADES NINE,0.682,0.0104,0.3076
DIAMONDS SIX CLUBS QUEEN,0.649,0.1162,0.2348
CLUBS TEN HEARTS EIGHT,0.7062,0.0388,0.255
SPADES KING CLUBS QUEEN,0.247,0.024,0.729
CLUBS JACK CLUBS FOUR,0.622,0.0098,0.3682
SPADES ACE HEARTS ACE,0.1486,0.004,0.8474
CLUBS JACK SPADES FIVE,0.6578,0.0102,0.332
DIAMONDS TEN CLUBS ACE,0.2764,0.0184,0.7052
CLUBS NINE CLUBS SIX,0.6136,0.008,0.3784
HEARTS EIGHT DIAMONDS FOUR,0.6758,0.0108,0.3134
SPADES EIGHT SPADES SIX,0.6066,0.0082,0.3852
HEARTS QUEEN DIAMONDS SEVEN,0.6604,0.1076,0.232
SPADES FIVE CLUBS TWO,0.6524,0.0118,0.3358
DIAMONDS TEN HEARTS JACK,0.7038,0.0414,0.2548
DIAMONDS THREE HEARTS THREE,0.4762,0.0172,0.5066
