opposingHand,winningChance,drawChance,lostChance
CLUBS FOUR DIAMONDS JACK,0.3988,0.0202,0.581
CLUBS JACK DIAMONDS THREE,0.4,0.02,0.58
HEARTS SEVEN HEARTS FOUR,0.5178,0.0628,0.4194
CLUBS JACK SPADES SIX,0.3984,0.016,0.5856
HEARTS FOUR CLUBS ACE,0.3946,0.0056,0.5998
CLUBS THREE DIAMONDS SEVEN,0.554,0.0686,0.3774
SPADES QUEEN HEARTS TEN,0.3612,0.013,0.6258
CLUBS JACK DIAMONDS SEVEN,0.3788,0.0192,0.602
CLUBS SEVEN CLUBS FIVE,0.502,0.0622,0.4358
CLUBS SEVEN DIAMONDS KING,0.3806,0.0084,0.611
DIAMONDS QUEEN SPADES THREE,0.3994,0.0138,0.5868
HEARTS FOUR CLUBS TWO,0.6156,0.1296,0.2548
SPADES FOUR HEARTS QUEEN,0.4008,0.0132,0.586
CLUBS FIVE CLUBS KING,0.3656,0.0074,0.627
HEARTS SEVEN CLUBS SIX,0.5356,0.0616,0.4028
DIAMONDS TEN CLUBS KING,0.3522,0.0078,0.64
HEARTS KING CLUBS QUEEN,0.3628,0.0046,0.6326
SPADES THREE HEARTS KING,0.395,0.0092,0.5958
CLUBS SEVEN CLUBS THREE,0.5234,0.0642,0.4124
CLUBS FIVE HEARTS QUEEN,0.406,0.0116,0.5824
CLUBS SIX HEARTS TWO,0.6296,0.1338,0.2366
SPADES NINE SPADES FIVE,0.3734,0.0378,0.5888
HEARTS QUEEN CLUBS QUEEN,0.1768,0.024,0.7992
CLUBS TEN HEARTS THREE,0.42,0.0228,0.5572
CLUBS JACK SPADES JACK,0.1754,0.0398,0.7848
HEARTS FOUR DIAMONDS FIVE,0.521,0.0662,0.4128
CLUBS EIGHT SPADES FIVE,0.2658,0.4192,0.315
HEARTS TEN CLUBS QUEEN,0.366,0.0088,0.6252
DIAMONDS SEVEN HEARTS NINE,0.3478,0.0414,0.6108
SPADES TEN SPADES FIVE,0.3658,0.0256,0.6086
CLUBS EIGHT SPADES TWO,0.0642,0.9152,0.0206
CLUBS JACK HEARTS KING,0.3628,0.0064,0.6308
HEARTS EIGHT HEARTS FIVE,0.2504,0.3916,0.358
CLUBS JACK DIAMONDS SIX,0.3904,0.0182,0.5914
DIAMONDS JACK SPADES THREE,0.3792,0.0178,0.603
CLUBS TEN DIAMONDS JACK,0.33,0.0168,0.6532
DIAMONDS THREE CLUBS THREE,0.308,0.1076,0.5844
SPADES KING SPADES EIGHT,0.26,0.0322,0.7078
SPADES JACK DIAMONDS JACK,0.1666,0.0402,0.7932
CLUBS FOUR HEARTS JACK,0.3946,0.0148,0.5906
DIAMONDS KING DIAMONDS SEVEN,0.3396,0.0082,0.6522
DIAMONDS NINE DIAMONDS FIVE,0.3304,0.0432,0.6264
CLUBS THREE CLUBS QUEEN,0.3748,0.0114,0.6138
HEARTS SEVEN DIAMONDS SEVEN,0.274,0.0758,0.6502
SPADES KING HEARTS ACE,0.3724,0.0034,0.6242
SPADES FOUR DIAMONDS TEN,0.3968,0.0296,0.5736
HEARTS SEVEN DIAMONDS THREE,0.5608,0.0682,0.371
DIAMONDS FOUR SPADES SIX,0.5306,0.0594,0.41
HEARTS THREE DIAMONDS ACE,0.3722,0.0066,0.6212
DIAMONDS QUEEN SPADES FOUR,0.3874,0.016,0.5966
HEARTS SIX SPADES THREE,0.5504,0.0672,0.3824
HEARTS SEVEN SPADES SEVEN,0.2892,0.0802,0.6306
CLUBS SIX CLUBS KING,0.3764,0.01,0.6136
SPADES SEVEN HEARTS JACK,0.3906,0.017,0.5924
DIAMONDS SEVEN CLUBS KING,0.3824,0.0084,0.6092
CLUBS FOUR HEARTS ACE,0.3694,0.0038,0.6268
HEARTS KING DIAMONDS SEVEN,0.3954,0.0088,0.5958
HEARTS EIGHT HEARTS JACK,0.2586,0.0566,0.6848
CLUBS FOUR SPADES SIX,0.5516,0.0618,0.3866
DIAMONDS KING CLUBS TWO,0.2638,0.0312,0.705
SPADES QUEEN DIAMONDS SEVEN,0.3822,0.0136,0.6042
SPADES EIGHT CLUBS THREE,0.2678,0.4982,0.234
SPADES NINE SPADES SEVEN,0.3422,0.0328,0.625
DIAMONDS THREE DIAMONDS KING,0.3506,0.0076,0.6418
