opposingHand,winningChance,drawChance,lostChance
CLUBS EIGHT SPADES FIVE,0.5852,0.0116,0.4032
CLUBS EIGHT SPADES FOUR,0.7036,0.0434,0.253
CLUBS EIGHT SPADES THREE,0.6456,0.0114,0.343
CLUBS EIGHT SPADES TWO,0.6356,0.0136,0.3508
HEARTS SIX DIAMONDS TEN,0.5794,0.0128,0.4078
HEARTS SEVEN DIAMONDS TEN,0.5758,0.0134,0.4108
DIAMONDS TEN HEARTS EIGHT,0.5572,0.0094,0.4334
CLUBS FOUR CLUBS JACK,0.6878,0.046,0.2662
DIAMONDS TEN HEARTS NINE,0.5436,0.0108,0.4456
CLUBS TEN CLUBS FOUR,0.6762,0.0498,0.274
CLUBS FOUR CLUBS KING,0.2246,0.0326,0.7428
DIAMONDS TEN CLUBS TWO,0.644,0.0112,0.3448
CLUBS THREE DIAMONDS TEN,0.6262,0.0164,0.3574
CLUBS FOUR CLUBS ACE,0.2138,0.0314,0.7548
DIAMONDS TEN DIAMONDS JACK,0.509,0.0104,0.4806
DIAMONDS TEN DIAMONDS QUEEN,0.2238,0.1122,0.664
HEARTS TWO DIAMONDS TEN,0.6164,0.0124,0.3712
DIAMONDS KING DIAMONDS TEN,0.3262,0.0054,0.6684
HEARTS THREE DIAMONDS TEN,0.6288,0.014,0.3572
DIAMONDS ACE DIAMONDS TEN,0.3282,0.006,0.6658
HEARTS FOUR DIAMONDS TEN,0.7132,0.0482,0.2386
CLUBS EIGHT HEARTS JACK,0.5708,0.0118,0.4174
HEARTS FIVE DIAMONDS TEN,0.5888,0.013,0.3982
CLUBS EIGHT HEARTS TEN,0.5694,0.0128,0.4178
CLUBS EIGHT HEARTS QUEEN,0.2272,0.223,0.5498
CLUBS EIGHT HEARTS KING,0.3626,0.0066,0.6308
CLUBS EIGHT HEARTS ACE,0.3734,0.0038,0.6228
CLUBS NINE SPADES THREE,0.6286,0.0166,0.3548
CLUBS NINE SPADES TWO,0.624,0.0142,0.3618
CLUBS NINE SPADES FIVE,0.5886,0.0124,0.399
CLUBS NINE SPADES FOUR,0.7196,0.0478,0.2326
CLUBS NINE SPADES SEVEN,0.571,0.0122,0.4168
CLUBS NINE SPADES SIX,0.5728,0.0108,0.4164
CLUBS NINE SPADES NINE,0.305,0.0214,0.6736
CLUBS TEN HEARTS EIGHT,0.5748,0.0104,0.4148
CLUBS NINE SPADES EIGHT,0.5482,0.0124,0.4394
HEARTS EIGHT CLUBS JACK,0.5792,0.0102,0.4106
CLUBS KING HEARTS EIGHT,0.3572,0.0064,0.6364
CLUBS ACE HEARTS EIGHT,0.363,0.0028,0.6342
SPADES KING CLUBS KING,0.136,0.004,0.86
SPADES QUEEN CLUBS KING,0.2276,0.027,0.7454
SPADES ACE CLUBS KING,0.318,0.0054,0.6766
DIAMONDS ACE HEARTS TEN,0.3456,0.0044,0.65
HEARTS FOUR HEARTS TEN,0.6658,0.0508,0.2834
DIAMONDS ACE HEARTS JACK,0.3438,0.0054,0.6508
HEARTS FOUR HEARTS JACK,0.6842,0.0456,0.2702
SPADES KING CLUBS FIVE,0.3626,0.0092,0.6282
SPADES QUEEN CLUBS FIVE,0.2276,0.4686,0.3038
SPADES ACE CLUBS FIVE,0.3428,0.0052,0.652
HEARTS SEVEN DIAMONDS JACK,0.579,0.0098,0.4112
HEARTS SIX DIAMONDS JACK,0.5926,0.0106,0.3968
DIAMONDS JACK HEARTS NINE,0.5608,0.0088,0.4304
DIAMONDS JACK HEARTS EIGHT,0.5678,0.0088,0.4234
DIAMONDS KING DIAMONDS JACK,0.321,0.0056,0.6734
HEARTS THREE DIAMONDS JACK,0.638,0.0136,0.3484
SPADES ACE SPADES SIX,0.347,0.0046,0.6484
HEARTS ACE SPADES FOUR,0.2256,0.0232,0.7512
DIAMONDS QUEEN DIAMONDS JACK,0.2252,0.0854,0.6894
HEARTS TWO DIAMONDS JACK,0.637,0.0106,0.3524
HEARTS FIVE DIAMONDS JACK,0.5832,0.0118,0.405
SPADES QUEEN SPADES SIX,0.2082,0.3464,0.4454
SPADES FOUR HEARTS QUEEN,0.0228,0.955,0.0222
DIAMONDS ACE DIAMONDS JACK,0.3252,0.005,0.6698
HEARTS FOUR DIAMONDS JACK,0.7178,0.0446,0.2376
SPADES KING SPADES SIX,0.3434,0.0082,0.6484
SPADES FOUR HEARTS KING,0.24,0.0372,0.7228
SPADES TEN SPADES SIX,0.5546,0.01,0.4354
SPADES JACK SPADES SIX,0.5612,0.0094,0.4294
SPADES FOUR DIAMONDS JACK,0.707,0.0502,0.2428
SPADES FIVE DIAMONDS JACK,0.5942,0.0118,0.394
DIAMONDS JACK SPADES TWO,0.6216,0.0138,0.3646
SPADES THREE DIAMONDS JACK,0.6192,0.0124,0.3684
SPADES ACE DIAMONDS THREE,0.379,0.0042,0.6168
SPADES QUEEN DIAMONDS THREE,0.271,0.5204,0.2086
CLUBS EIGHT DIAMONDS JACK,0.5732,0.0096,0.4172
SPADES KING DIAMONDS THREE,0.3934,0.0078,0.5988
CLUBS NINE DIAMONDS JACK,0.5494,0.011,0.4396
CLUBS SIX DIAMONDS JACK,0.591,0.0132,0.3958
CLUBS SEVEN DIAMONDS JACK,0.5732,0.0134,0.4134
CLUBS FOUR DIAMONDS JACK,0.7156,0.053,0.2314
CLUBS FIVE DIAMONDS JACK,0.6052,0.0124,0.3824
CLUBS TWO DIAMONDS JACK,0.6456,0.0126,0.3418
CLUBS THREE DIAMONDS JACK,0.628,0.0136,0.3584
SPADES TEN CLUBS FIVE,0.5934,0.0098,0.3968
SPADES JACK HEARTS SIX,0.5934,0.0124,0.3942
HEARTS SIX SPADES TEN,0.5838,0.0104,0.4058
SPADES JACK CLUBS FIVE,0.6074,0.0092,0.3834
SPADES JACK DIAMONDS THREE,0.6306,0.0128,0.3566
CLUBS SEVEN CLUBS ACE,0.3404,0.0052,0.6544
DIAMONDS THREE SPADES TEN,0.6258,0.012,0.3622
CLUBS SEVEN CLUBS KING,0.3446,0.0076,0.6478
SPADES NINE DIAMONDS JACK,0.5516,0.011,0.4374
CLUBS TEN CLUBS SEVEN,0.5432,0.0118,0.445
DIAMONDS ACE HEARTS ACE,0.1162,0.0044,0.8794
HEARTS FOUR HEARTS ACE,0.221,0.027,0.752
SPADES EIGHT DIAMONDS JACK,0.5638,0.0114,0.4248
SPADES ACE HEARTS SIX,0.3646,0.004,0.6314
CLUBS SEVEN CLUBS JACK,0.5544,0.0098,0.4358
DIAMONDS ACE HEARTS KING,0.3054,0.005,0.6896
HEARTS FOUR HEARTS KING,0.2198,0.0356,0.7446
SPADES SEVEN DIAMONDS JACK,0.579,0.0116,0.4094
SPADES KING HEARTS SIX,0.3654,0.0068,0.6278
DIAMONDS ACE HEARTS QUEEN,0.2304,0.017,0.7526
HEARTS FOUR HEARTS QUEEN,0.0238,0.9062,0.07
SPADES QUEEN HEARTS SIX,0.2288,0.383,0.3882
SPADES SIX DIAMONDS JACK,0.591,0.0112,0.3978
DIAMONDS TEN SPADES TWO,0.625,0.014,0.361
DIAMONDS TEN SPADES THREE,0.617,0.014,0.369
DIAMONDS TEN SPADES FOUR,0.7126,0.048,0.2394
DIAMONDS TEN SPADES FIVE,0.5996,0.0144,0.386
SPADES SIX DIAMONDS TEN,0.5808,0.0104,0.4088
SPADES SEVEN DIAMONDS TEN,0.5802,0.0096,0.4102
SPADES EIGHT DIAMONDS TEN,0.5462,0.0118,0.442
SPADES NINE DIAMONDS TEN,0.5472,0.0104,0.4424
CLUBS FOUR DIAMONDS TEN,0.7072,0.0474,0.2454
CLUBS FIVE DIAMONDS TEN,0.613,0.0118,0.3752
CLUBS SIX DIAMONDS TEN,0.5914,0.0128,0.3958
CLUBS SEVEN DIAMONDS TEN,0.5636,0.0156,0.4208
CLUBS EIGHT DIAMONDS TEN,0.5642,0.0126,0.4232
CLUBS NINE DIAMONDS TEN,0.5462,0.0096,0.4442
DIAMONDS THREE CLUBS JACK,0.6478,0.0116,0.3406
CLUBS TEN DIAMONDS THREE,0.644,0.0142,0.3418
DIAMONDS THREE CLUBS KING,0.4006,0.0104,0.589
DIAMONDS THREE CLUBS ACE,0.37,0.006,0.624
SPADES FOUR HEARTS JACK,0.7174,0.0456,0.237
SPADES FOUR HEARTS TEN,0.7156,0.0486,0.2358
SPADES FIVE SPADES TWO,0.5706,0.0148,0.4146
SPADES FOUR SPADES TWO,0.6452,0.0486,0.3062
SPADES THREE SPADES TWO,0.6092,0.0148,0.376
SPADES NINE SPADES TWO,0.5806,0.015,0.4044
SPADES EIGHT SPADES TWO,0.5696,0.0142,0.4162
SPADES SEVEN SPADES TWO,0.5936,0.0142,0.3922
SPADES SIX SPADES TWO,0.5882,0.0128,0.399
CLUBS THREE DIAMONDS QUEEN,0.2606,0.5352,0.2042
CLUBS THREE HEARTS TWO,0.6554,0.0162,0.3284
CLUBS TWO DIAMONDS QUEEN,0.2574,0.5236,0.219
HEARTS TWO CLUBS TWO,0.4216,0.0404,0.538
HEARTS SEVEN DIAMONDS QUEEN,0.218,0.3052,0.4768
HEARTS SEVEN HEARTS TWO,0.5904,0.0146,0.395
HEARTS SIX DIAMONDS QUEEN,0.2166,0.3824,0.401
HEARTS SIX HEARTS TWO,0.5694,0.0164,0.4142
DIAMONDS QUEEN HEARTS NINE,0.2192,0.1648,0.616
HEARTS TWO HEARTS NINE,0.5722,0.0118,0.416
DIAMONDS QUEEN HEARTS EIGHT,0.2206,0.2306,0.5488
HEARTS TWO HEARTS EIGHT,0.573,0.013,0.414
CLUBS NINE HEARTS TWO,0.6244,0.0156,0.36
CLUBS NINE DIAMONDS QUEEN,0.2278,0.166,0.6062
CLUBS EIGHT HEARTS TWO,0.625,0.0156,0.3594
CLUBS EIGHT DIAMONDS QUEEN,0.2218,0.2226,0.5556
CLUBS FIVE DIAMONDS QUEEN,0.2178,0.4704,0.3118
CLUBS FIVE HEARTS TWO,0.6194,0.0174,0.3632
SPADES EIGHT HEARTS ACE,0.3552,0.0032,0.6416
CLUBS FOUR DIAMONDS QUEEN,0.008,0.9836,0.0084
CLUBS FOUR HEARTS TWO,0.713,0.0516,0.2354
CLUBS SEVEN DIAMONDS QUEEN,0.2242,0.3094,0.4664
CLUBS SEVEN HEARTS TWO,0.6478,0.014,0.3382
SPADES EIGHT HEARTS QUEEN,0.2264,0.2244,0.5492
CLUBS SIX DIAMONDS QUEEN,0.2198,0.397,0.3832
CLUBS SIX HEARTS TWO,0.6162,0.0138,0.37
SPADES EIGHT HEARTS KING,0.382,0.008,0.61
HEARTS TWO SPADES SIX,0.6224,0.0132,0.3644
SPADES SIX DIAMONDS QUEEN,0.2164,0.3904,0.3932
SPADES SEVEN DIAMONDS QUEEN,0.2238,0.3098,0.4664
SPADES SEVEN HEARTS TWO,0.6344,0.0154,0.3502
HEARTS FOUR CLUBS KING,0.2196,0.04,0.7404
DIAMONDS ACE CLUBS KING,0.3068,0.0062,0.687
SPADES EIGHT DIAMONDS QUEEN,0.2182,0.2252,0.5566
SPADES EIGHT HEARTS TWO,0.64,0.0162,0.3438
HEARTS FOUR CLUBS ACE,0.2318,0.0234,0.7448
DIAMONDS ACE CLUBS ACE,0.1118,0.004,0.8842
SPADES NINE DIAMONDS QUEEN,0.2236,0.1616,0.6148
SPADES NINE HEARTS TWO,0.6392,0.0116,0.3492
HEARTS TWO SPADES TWO,0.4206,0.0314,0.548
DIAMONDS QUEEN SPADES TWO,0.259,0.5268,0.2142
HEARTS TWO SPADES THREE,0.6414,0.0148,0.3438
DIAMONDS QUEEN SPADES THREE,0.2568,0.5298,0.2134
HEARTS TWO SPADES FOUR,0.7016,0.0442,0.2542
SPADES FOUR DIAMONDS QUEEN,0.0102,0.9732,0.0166
CLUBS TEN HEARTS FOUR,0.7062,0.0514,0.2424
CLUBS TEN DIAMONDS ACE,0.3422,0.0052,0.6526
HEARTS TWO SPADES FIVE,0.6224,0.0146,0.363
SPADES FIVE DIAMONDS QUEEN,0.2086,0.4708,0.3206
HEARTS FOUR CLUBS JACK,0.7198,0.045,0.2352
DIAMONDS ACE CLUBS JACK,0.3538,0.0038,0.6424
CLUBS FIVE CLUBS KING,0.3376,0.0084,0.654
CLUBS FIVE CLUBS ACE,0.3344,0.0052,0.6604
CLUBS FIVE CLUBS JACK,0.5758,0.0128,0.4114
CLUBS TEN CLUBS FIVE,0.5722,0.0124,0.4154
SPADES KING CLUBS JACK,0.3448,0.0062,0.649
SPADES QUEEN CLUBS JACK,0.2292,0.0886,0.6822
SPADES ACE CLUBS JACK,0.347,0.0038,0.6492
SPADES SIX CLUBS KING,0.3586,0.007,0.6344
SPADES EIGHT HEARTS JACK,0.5612,0.0122,0.4266
SPADES SIX CLUBS ACE,0.3554,0.0048,0.6398
SPADES EIGHT HEARTS TEN,0.5544,0.0122,0.4334
SPADES SIX CLUBS JACK,0.5974,0.012,0.3906
CLUBS TEN SPADES SIX,0.5834,0.011,0.4056
SPADES TEN CLUBS JACK,0.54,0.011,0.449
SPADES JACK CLUBS JACK,0.2844,0.0078,0.7078
SPADES QUEEN CLUBS SEVEN,0.229,0.313,0.458
SPADES KING CLUBS SEVEN,0.3698,0.0074,0.6228
SPADES ACE CLUBS SEVEN,0.3732,0.0046,0.6222
SPADES SIX HEARTS TEN,0.5996,0.0128,0.3876
SPADES SIX HEARTS JACK,0.5914,0.0118,0.3968
SPADES SIX HEARTS ACE,0.3646,0.0032,0.6322
SPADES SIX HEARTS KING,0.356,0.007,0.637
SPADES SIX HEARTS QUEEN,0.2308,0.3714,0.3978
CLUBS SEVEN SPADES JACK,0.589,0.0116,0.3994
CLUBS SEVEN SPADES TEN,0.5712,0.013,0.4158
CLUBS TEN HEARTS SIX,0.5844,0.0136,0.402
HEARTS SIX CLUBS JACK,0.5892,0.0118,0.399
CLUBS ACE CLUBS JACK,0.3288,0.0058,0.6654
HEARTS SIX CLUBS KING,0.3544,0.008,0.6376
HEARTS SIX CLUBS ACE,0.3538,0.0062,0.64
CLUBS KING CLUBS JACK,0.3206,0.0092,0.6702
DIAMONDS THREE HEARTS ACE,0.3668,0.0052,0.628
DIAMONDS THREE HEARTS QUEEN,0.2714,0.5164,0.2122
DIAMONDS THREE HEARTS KING,0.3922,0.008,0.5998
CLUBS FIVE HEARTS JACK,0.5986,0.0106,0.3908
SPADES TEN DIAMONDS ACE,0.349,0.0028,0.6482
HEARTS FOUR SPADES TEN,0.7192,0.044,0.2368
CLUBS FIVE HEARTS TEN,0.5954,0.0104,0.3942
HEARTS FOUR SPADES JACK,0.7158,0.0474,0.2368
SPADES JACK DIAMONDS ACE,0.3508,0.005,0.6442
SPADES ACE HEARTS FOUR,0.2272,0.0224,0.7504
SPADES ACE DIAMONDS ACE,0.1164,0.005,0.8786
CLUBS FIVE HEARTS ACE,0.3566,0.004,0.6394
CLUBS FIVE HEARTS KING,0.3534,0.0078,0.6388
HEARTS FOUR SPADES QUEEN,0.0214,0.9578,0.0208
SPADES QUEEN DIAMONDS ACE,0.2218,0.0184,0.7598
SPADES FOUR CLUBS JACK,0.7148,0.0468,0.2384
CLUBS FIVE HEARTS QUEEN,0.2236,0.4682,0.3082
SPADES KING DIAMONDS ACE,0.3144,0.0054,0.6802
SPADES KING HEARTS FOUR,0.236,0.0416,0.7224
CLUBS TEN SPADES FOUR,0.7298,0.0456,0.2246
DIAMONDS ACE DIAMONDS QUEEN,0.2158,0.018,0.7662
DIAMONDS ACE HEARTS TWO,0.3824,0.0058,0.6118
HEARTS FOUR DIAMONDS QUEEN,0.0106,0.9726,0.0168
HEARTS FOUR HEARTS TWO,0.645,0.0486,0.3064
DIAMONDS THREE HEARTS TEN,0.6184,0.0134,0.3682
SPADES FOUR CLUBS KING,0.2284,0.0378,0.7338
HEARTS FIVE DIAMONDS QUEEN,0.2232,0.4546,0.3222
HEARTS FIVE HEARTS TWO,0.575,0.0142,0.4108
DIAMONDS THREE HEARTS JACK,0.6302,0.012,0.3578
HEARTS TWO DIAMONDS QUEEN,0.2632,0.5122,0.2246
DIAMONDS KING DIAMONDS QUEEN,0.2282,0.0252,0.7466
DIAMONDS KING HEARTS TWO,0.3848,0.0102,0.605
HEARTS THREE DIAMONDS QUEEN,0.256,0.53,0.214
HEARTS THREE HEARTS TWO,0.613,0.0142,0.3728
SPADES FOUR CLUBS ACE,0.2292,0.0248,0.746
HEARTS TWO CLUBS ACE,0.3798,0.0074,0.6128
DIAMONDS QUEEN CLUBS ACE,0.2254,0.0192,0.7554
HEARTS TWO CLUBS KING,0.3754,0.0122,0.6124
DIAMONDS QUEEN CLUBS KING,0.2186,0.0292,0.7522
SPADES EIGHT SPADES FIVE,0.5354,0.0132,0.4514
CLUBS TEN HEARTS TWO,0.6254,0.0126,0.362
CLUBS TEN DIAMONDS QUEEN,0.2348,0.119,0.6462
SPADES NINE SPADES FIVE,0.539,0.0114,0.4496
HEARTS TWO CLUBS JACK,0.6404,0.0134,0.3462
DIAMONDS QUEEN CLUBS JACK,0.2304,0.0968,0.6728
SPADES SIX SPADES FIVE,0.5328,0.0126,0.4546
SPADES SEVEN SPADES FIVE,0.5328,0.0102,0.457
SPADES EIGHT CLUBS ACE,0.3566,0.005,0.6384
DIAMONDS FIVE CLUBS KING,0.347,0.008,0.645
SPADES EIGHT CLUBS KING,0.3574,0.0082,0.6344
CLUBS ACE DIAMONDS FIVE,0.3332,0.0064,0.6604
SPADES EIGHT CLUBS JACK,0.5704,0.009,0.4206
CLUBS TEN SPADES EIGHT,0.5624,0.0102,0.4274
CLUBS TEN DIAMONDS FIVE,0.609,0.0146,0.3764
DIAMONDS FIVE CLUBS JACK,0.595,0.0126,0.3924
DIAMONDS TEN HEARTS JACK,0.5348,0.01,0.4552
DIAMONDS TEN HEARTS TEN,0.2892,0.0144,0.6964
SPADES ACE CLUBS NINE,0.3654,0.0042,0.6304
CLUBS NINE SPADES QUEEN,0.2346,0.1622,0.6032
CLUBS NINE SPADES KING,0.3604,0.0076,0.632
HEARTS SIX HEARTS KING,0.3316,0.0086,0.6598
DIAMONDS KING SPADES SEVEN,0.3492,0.009,0.6418
HEARTS THREE SPADES SEVEN,0.6244,0.0134,0.3622
SPADES KING DIAMONDS SEVEN,0.367,0.008,0.625
HEARTS SIX HEARTS QUEEN,0.2014,0.3616,0.437
SPADES QUEEN DIAMONDS SEVEN,0.2202,0.3116,0.4682
HEARTS THREE SPADES SIX,0.617,0.0146,0.3684
DIAMONDS KING SPADES SIX,0.3554,0.008,0.6366
SPADES NINE DIAMONDS KING,0.3528,0.0064,0.6408
SPADES NINE HEARTS THREE,0.6242,0.0104,0.3654
HEARTS SIX HEARTS ACE,0.3454,0.0064,0.6482
DIAMONDS KING SPADES EIGHT,0.3556,0.0092,0.6352
SPADES EIGHT HEARTS THREE,0.6136,0.0158,0.3706
SPADES ACE DIAMONDS SEVEN,0.3602,0.004,0.6358
CLUBS NINE HEARTS THREE,0.6336,0.0122,0.3542
CLUBS NINE DIAMONDS KING,0.3526,0.0094,0.638
CLUBS EIGHT HEARTS THREE,0.632,0.0132,0.3548
CLUBS EIGHT DIAMONDS KING,0.3566,0.0066,0.6368
HEARTS THREE SPADES THREE,0.425,0.0288,0.5462
DIAMONDS KING SPADES THREE,0.3932,0.0104,0.5964
HEARTS THREE SPADES TWO,0.6454,0.012,0.3426
DIAMONDS KING SPADES TWO,0.389,0.0074,0.6036
HEARTS THREE SPADES FIVE,0.609,0.012,0.379
DIAMONDS KING SPADES FIVE,0.3584,0.0052,0.6364
HEARTS THREE SPADES FOUR,0.6782,0.043,0.2788
DIAMONDS KING SPADES FOUR,0.2232,0.0372,0.7396
DIAMONDS KING CLUBS TWO,0.3998,0.0088,0.5914
HEARTS THREE CLUBS TWO,0.6404,0.014,0.3456
DIAMONDS KING CLUBS THREE,0.3858,0.0106,0.6036
CLUBS THREE HEARTS THREE,0.4248,0.032,0.5432
DIAMONDS KING CLUBS FOUR,0.2176,0.042,0.7404
HEARTS THREE CLUBS FOUR,0.6806,0.0478,0.2716
CLUBS FIVE DIAMONDS KING,0.3624,0.0098,0.6278
CLUBS FIVE HEARTS THREE,0.6094,0.0132,0.3774
CLUBS SIX DIAMONDS KING,0.3746,0.008,0.6174
CLUBS SIX HEARTS THREE,0.6082,0.0142,0.3776
CLUBS SEVEN DIAMONDS KING,0.3622,0.0078,0.63
CLUBS SEVEN HEARTS THREE,0.6358,0.0142,0.35
DIAMONDS KING HEARTS THREE,0.393,0.0092,0.5978
DIAMONDS ACE DIAMONDS KING,0.2976,0.0056,0.6968
DIAMONDS ACE HEARTS THREE,0.3712,0.0062,0.6226
HEARTS FOUR DIAMONDS KING,0.224,0.038,0.738
HEARTS FOUR HEARTS THREE,0.6362,0.0436,0.3202
HEARTS FIVE DIAMONDS KING,0.3572,0.0072,0.6356
HEARTS FIVE HEARTS THREE,0.5576,0.0142,0.4282
HEARTS SIX DIAMONDS KING,0.357,0.0058,0.6372
HEARTS SIX HEARTS THREE,0.5694,0.0158,0.4148
HEARTS SEVEN DIAMONDS KING,0.3592,0.0078,0.633
HEARTS SEVEN HEARTS THREE,0.5846,0.0124,0.403
DIAMONDS KING HEARTS EIGHT,0.366,0.0066,0.6274
HEARTS THREE HEARTS EIGHT,0.5872,0.0128,0.4
HEARTS SIX HEARTS TEN,0.5512,0.0106,0.4382
SPADES TEN DIAMONDS SEVEN,0.5776,0.0126,0.4098
DIAMONDS KING HEARTS NINE,0.3482,0.008,0.6438
HEARTS THREE HEARTS NINE,0.5726,0.0128,0.4146
HEARTS SIX HEARTS JACK,0.5514,0.0116,0.437
SPADES JACK DIAMONDS SEVEN,0.583,0.0134,0.4036
HEARTS FIVE CLUBS FOUR,0.6516,0.0482,0.3002
SPADES SIX SPADES FOUR,0.6324,0.0396,0.328
HEARTS FIVE CLUBS FIVE,0.336,0.0336,0.6304
SPADES SEVEN SPADES FOUR,0.659,0.0382,0.3028
HEARTS FIVE CLUBS SIX,0.5742,0.0108,0.415
SPADES EIGHT SPADES FOUR,0.6548,0.0404,0.3048
HEARTS FIVE CLUBS SEVEN,0.581,0.013,0.406
SPADES NINE SPADES FOUR,0.6694,0.0428,0.2878
SPADES QUEEN DIAMONDS FIVE,0.2104,0.4628,0.3268
SPADES KING DIAMONDS FIVE,0.3462,0.007,0.6468
HEARTS FIVE CLUBS TWO,0.6112,0.0148,0.374
SPADES ACE DIAMONDS FIVE,0.3482,0.0054,0.6464
HEARTS FIVE CLUBS THREE,0.6048,0.0146,0.3806
SPADES FIVE SPADES FOUR,0.6268,0.0448,0.3284
HEARTS FIVE SPADES TWO,0.611,0.014,0.375
HEARTS FIVE SPADES THREE,0.5858,0.0148,0.3994
HEARTS FIVE SPADES FOUR,0.661,0.0452,0.2938
HEARTS FIVE SPADES FIVE,0.3322,0.0296,0.6382
HEARTS FIVE CLUBS EIGHT,0.5844,0.016,0.3996
CLUBS NINE HEARTS FIVE,0.5776,0.0118,0.4106
DIAMONDS TEN HEARTS KING,0.3358,0.0074,0.6568
DIAMONDS TEN HEARTS QUEEN,0.23,0.1214,0.6486
HEARTS ACE DIAMONDS TEN,0.336,0.0052,0.6588
HEARTS FIVE HEARTS SEVEN,0.548,0.0158,0.4362
HEARTS FIVE HEARTS SIX,0.5336,0.0078,0.4586
HEARTS FIVE HEARTS NINE,0.5498,0.0118,0.4384
CLUBS NINE SPADES TEN,0.5494,0.0094,0.4412
HEARTS FIVE HEARTS EIGHT,0.5412,0.0124,0.4464
CLUBS NINE SPADES JACK,0.5562,0.0106,0.4332
DIAMONDS ACE CLUBS SIX,0.357,0.005,0.638
HEARTS FOUR CLUBS SIX,0.6928,0.0418,0.2654
SPADES EIGHT SPADES THREE,0.5986,0.0122,0.3892
CLUBS SEVEN DIAMONDS ACE,0.354,0.0064,0.6396
HEARTS FOUR CLUBS SEVEN,0.691,0.0426,0.2664
SPADES NINE SPADES THREE,0.581,0.013,0.406
DIAMONDS ACE CLUBS FOUR,0.2336,0.0248,0.7416
HEARTS FOUR CLUBS FOUR,0.3014,0.0364,0.6622
SPADES SIX SPADES THREE,0.5662,0.0134,0.4204
CLUBS FIVE DIAMONDS ACE,0.3362,0.0038,0.66
HEARTS FOUR CLUBS FIVE,0.6712,0.0444,0.2844
SPADES SEVEN SPADES THREE,0.5788,0.0152,0.406
HEARTS FOUR CLUBS EIGHT,0.699,0.0462,0.2548
CLUBS EIGHT DIAMONDS ACE,0.3626,0.0046,0.6328
CLUBS NINE HEARTS FOUR,0.7262,0.0432,0.2306
CLUBS NINE DIAMONDS ACE,0.3532,0.006,0.6408
HEARTS FOUR SPADES FOUR,0.307,0.035,0.658
DIAMONDS ACE SPADES FOUR,0.2292,0.0226,0.7482
HEARTS FOUR SPADES FIVE,0.6474,0.0436,0.309
DIAMONDS ACE SPADES FIVE,0.3434,0.0048,0.6518
HEARTS FOUR SPADES TWO,0.7008,0.0476,0.2516
DIAMONDS ACE SPADES TWO,0.3878,0.0064,0.6058
HEARTS FOUR SPADES THREE,0.6818,0.0428,0.2754
DIAMONDS ACE SPADES THREE,0.3714,0.004,0.6246
DIAMONDS ACE SPADES EIGHT,0.3544,0.0046,0.641
HEARTS FOUR SPADES EIGHT,0.7106,0.0342,0.2552
SPADES FOUR SPADES THREE,0.6516,0.0414,0.307
DIAMONDS ACE SPADES NINE,0.3628,0.0036,0.6336
HEARTS FOUR SPADES NINE,0.7102,0.0492,0.2406
SPADES FIVE SPADES THREE,0.5678,0.0146,0.4176
HEARTS FOUR SPADES SIX,0.6842,0.041,0.2748
DIAMONDS ACE SPADES SIX,0.3538,0.005,0.6412
DIAMONDS ACE SPADES SEVEN,0.3646,0.0048,0.6306
HEARTS FOUR SPADES SEVEN,0.6902,0.0382,0.2716
SPADES QUEEN SPADES EIGHT,0.216,0.2086,0.5754
DIAMONDS TEN CLUBS JACK,0.5414,0.0098,0.4488
CLUBS JACK DIAMONDS SEVEN,0.5802,0.0106,0.4092
SPADES KING SPADES EIGHT,0.3314,0.0066,0.662
CLUBS TEN DIAMONDS TEN,0.2868,0.0148,0.6984
CLUBS TEN DIAMONDS SEVEN,0.571,0.0118,0.4172
SPADES ACE SPADES EIGHT,0.3338,0.0032,0.663
HEARTS FIVE DIAMONDS ACE,0.343,0.0054,0.6516
HEARTS FIVE HEARTS FOUR,0.6168,0.0388,0.3444
HEARTS FOUR DIAMONDS ACE,0.2226,0.0264,0.751
DIAMONDS TEN CLUBS ACE,0.3486,0.0044,0.647
CLUBS ACE DIAMONDS SEVEN,0.3598,0.0066,0.6336
DIAMONDS TEN CLUBS KING,0.3422,0.0072,0.6506
CLUBS KING DIAMONDS SEVEN,0.3506,0.0078,0.6416
DIAMONDS ACE HEARTS NINE,0.3552,0.0046,0.6402
HEARTS FOUR HEARTS NINE,0.6648,0.0388,0.2964
SPADES KING SPADES JACK,0.329,0.0046,0.6664
CLUBS NINE CLUBS TEN,0.5028,0.009,0.4882
DIAMONDS ACE HEARTS EIGHT,0.3576,0.0048,0.6376
HEARTS FOUR HEARTS EIGHT,0.6654,0.0392,0.2954
SPADES QUEEN SPADES JACK,0.225,0.0846,0.6904
CLUBS NINE CLUBS JACK,0.5264,0.011,0.4626
HEARTS SEVEN DIAMONDS ACE,0.348,0.0046,0.6474
HEARTS FOUR HEARTS SEVEN,0.6476,0.043,0.3094
HEARTS SIX DIAMONDS ACE,0.3492,0.004,0.6468
HEARTS FOUR HEARTS SIX,0.6426,0.0426,0.3148
SPADES ACE SPADES JACK,0.3314,0.003,0.6656
HEARTS ACE HEARTS QUEEN,0.221,0.0154,0.7636
DIAMONDS ACE CLUBS THREE,0.3738,0.005,0.6212
HEARTS FOUR CLUBS THREE,0.6858,0.0526,0.2616
SPADES JACK DIAMONDS FIVE,0.596,0.0112,0.3928
CLUBS NINE CLUBS ACE,0.3316,0.0038,0.6646
DIAMONDS ACE CLUBS TWO,0.375,0.0072,0.6178
HEARTS FOUR CLUBS TWO,0.6976,0.0458,0.2566
SPADES TEN DIAMONDS FIVE,0.5968,0.0112,0.392
SPADES TEN SPADES EIGHT,0.514,0.0108,0.4752
HEARTS QUEEN HEARTS KING,0.2172,0.025,0.7578
SPADES JACK SPADES EIGHT,0.5252,0.0124,0.4624
CLUBS NINE CLUBS KING,0.3388,0.0082,0.653
DIAMONDS QUEEN HEARTS TEN,0.215,0.1194,0.6656
HEARTS TWO HEARTS TEN,0.595,0.012,0.393
DIAMONDS QUEEN HEARTS JACK,0.2332,0.0898,0.677
HEARTS TWO HEARTS JACK,0.5878,0.0114,0.4008
DIAMONDS QUEEN HEARTS KING,0.2306,0.0278,0.7416
HEARTS TWO HEARTS KING,0.371,0.008,0.621
HEARTS QUEEN DIAMONDS QUEEN,0.0728,0.0242,0.903
HEARTS TWO HEARTS QUEEN,0.2546,0.4874,0.258
HEARTS ACE DIAMONDS QUEEN,0.2248,0.0166,0.7586
HEARTS TWO HEARTS ACE,0.3558,0.0042,0.64
SPADES ACE HEARTS ACE,0.1268,0.0026,0.8706
SPADES KING HEARTS ACE,0.325,0.0038,0.6712
SPADES QUEEN HEARTS ACE,0.2328,0.0166,0.7506
SPADES JACK HEARTS ACE,0.3422,0.0038,0.654
HEARTS SIX SPADES FOUR,0.6778,0.0422,0.28
SPADES TEN HEARTS ACE,0.3466,0.0036,0.6498
SPADES KING SPADES QUEEN,0.2126,0.0242,0.7632
HEARTS SIX SPADES FIVE,0.5554,0.0154,0.4292
SPADES ACE SPADES QUEEN,0.2196,0.016,0.7644
HEARTS SIX SPADES TWO,0.6276,0.0124,0.36
HEARTS SIX SPADES THREE,0.613,0.0116,0.3754
HEARTS SIX SPADES EIGHT,0.5598,0.0116,0.4286
SPADES JACK CLUBS THREE,0.634,0.0118,0.3542
HEARTS SIX SPADES NINE,0.5634,0.0102,0.4264
SPADES NINE SPADES EIGHT,0.5128,0.0114,0.4758
SPADES TEN CLUBS THREE,0.624,0.0164,0.3596
HEARTS SIX SPADES SIX,0.3192,0.0266,0.6542
HEARTS SIX SPADES SEVEN,0.561,0.0122,0.4268
SPADES ACE CLUBS THREE,0.3782,0.006,0.6158
SPADES QUEEN CLUBS THREE,0.2628,0.532,0.2052
SPADES KING CLUBS THREE,0.3788,0.0096,0.6116
HEARTS SIX CLUBS FIVE,0.5648,0.0146,0.4206
HEARTS SIX CLUBS FOUR,0.6802,0.0452,0.2746
CLUBS SEVEN HEARTS SIX,0.5574,0.012,0.4306
HEARTS SIX CLUBS SIX,0.3332,0.028,0.6388
CLUBS NINE HEARTS SIX,0.5586,0.0128,0.4286
CLUBS EIGHT HEARTS SIX,0.582,0.0082,0.4098
HEARTS SEVEN HEARTS SIX,0.5328,0.0152,0.452
HEARTS SIX HEARTS NINE,0.5382,0.0098,0.452
HEARTS SIX HEARTS EIGHT,0.5336,0.0118,0.4546
HEARTS SIX CLUBS THREE,0.6194,0.0144,0.3662
HEARTS SIX CLUBS TWO,0.6294,0.0132,0.3574
HEARTS QUEEN CLUBS JACK,0.2376,0.0986,0.6638
CLUBS TEN HEARTS QUEEN,0.2308,0.1218,0.6474
HEARTS QUEEN CLUBS ACE,0.2178,0.018,0.7642
CLUBS NINE HEARTS ACE,0.3542,0.0062,0.6396
HEARTS QUEEN CLUBS KING,0.234,0.0246,0.7414
CLUBS NINE HEARTS KING,0.3668,0.0064,0.6268
CLUBS NINE HEARTS QUEEN,0.2376,0.1662,0.5962
CLUBS NINE HEARTS JACK,0.5608,0.0142,0.425
CLUBS NINE HEARTS TEN,0.5376,0.0124,0.45
SPADES JACK DIAMONDS NINE,0.5478,0.0112,0.441
SPADES TEN DIAMONDS NINE,0.5362,0.0106,0.4532
HEARTS TEN DIAMONDS EIGHT,0.5368,0.0124,0.4508
HEARTS JACK DIAMONDS EIGHT,0.566,0.0122,0.4218
SPADES QUEEN DIAMONDS NINE,0.2312,0.1698,0.599
HEARTS FIVE SPADES SIX,0.566,0.0112,0.4228
HEARTS FIVE SPADES SEVEN,0.5552,0.0122,0.4326
SPADES KING DIAMONDS NINE,0.3424,0.008,0.6496
HEARTS FIVE SPADES EIGHT,0.5906,0.0114,0.398
SPADES EIGHT SPADES SEVEN,0.5184,0.0128,0.4688
SPADES ACE DIAMONDS NINE,0.3604,0.0032,0.6364
HEARTS FIVE SPADES NINE,0.5818,0.013,0.4052
SPADES NINE SPADES SEVEN,0.51,0.0132,0.4768
HEARTS SEVEN HEARTS QUEEN,0.2104,0.2782,0.5114
HEARTS KING DIAMONDS EIGHT,0.3718,0.0076,0.6206
HEARTS QUEEN DIAMONDS EIGHT,0.2188,0.2226,0.5586
HEARTS SEVEN HEARTS KING,0.3366,0.009,0.6544
HEARTS SEVEN HEARTS ACE,0.3334,0.003,0.6636
HEARTS ACE DIAMONDS EIGHT,0.356,0.0048,0.6392
HEARTS SEVEN HEARTS TEN,0.5254,0.0096,0.465
HEARTS SEVEN HEARTS JACK,0.5522,0.0112,0.4366
DIAMONDS SIX HEARTS JACK,0.5934,0.011,0.3956
HEARTS TEN DIAMONDS SIX,0.5822,0.0138,0.404
HEARTS ACE HEARTS NINE,0.3342,0.0052,0.6606
HEARTS KING HEARTS NINE,0.333,0.0064,0.6606
HEARTS QUEEN HEARTS NINE,0.2256,0.1478,0.6266
HEARTS JACK HEARTS NINE,0.5104,0.01,0.4796
HEARTS TEN HEARTS NINE,0.5052,0.0108,0.484
CLUBS NINE HEARTS SEVEN,0.5706,0.0148,0.4146
HEARTS ACE CLUBS KING,0.3182,0.0042,0.6776
HEARTS SEVEN CLUBS EIGHT,0.5524,0.0126,0.435
HEARTS ACE CLUBS ACE,0.1154,0.0054,0.8792
SPADES QUEEN HEARTS QUEEN,0.0942,0.0248,0.881
HEARTS SEVEN SPADES THREE,0.6252,0.015,0.3598
SPADES KING HEARTS QUEEN,0.2286,0.0254,0.746
HEARTS SEVEN SPADES TWO,0.6354,0.011,0.3536
SPADES ACE HEARTS QUEEN,0.2132,0.0166,0.7702
HEARTS SEVEN SPADES FIVE,0.569,0.0122,0.4188
CLUBS TEN HEARTS ACE,0.3624,0.0048,0.6328
HEARTS SEVEN SPADES FOUR,0.689,0.0424,0.2686
HEARTS ACE CLUBS JACK,0.351,0.0056,0.6434
HEARTS SEVEN SPADES SEVEN,0.3206,0.0266,0.6528
SPADES KING DIAMONDS JACK,0.338,0.0056,0.6564
SPADES QUEEN DIAMONDS JACK,0.2326,0.089,0.6784
HEARTS SEVEN SPADES SIX,0.5618,0.0124,0.4258
HEARTS SEVEN SPADES NINE,0.5516,0.0108,0.4376
SPADES TEN HEARTS QUEEN,0.23,0.1174,0.6526
HEARTS SEVEN SPADES EIGHT,0.5584,0.0106,0.431
SPADES ACE DIAMONDS JACK,0.3472,0.0054,0.6474
SPADES JACK HEARTS QUEEN,0.245,0.0826,0.6724
HEARTS QUEEN DIAMONDS SIX,0.2132,0.3786,0.4082
HEARTS KING DIAMONDS SIX,0.3488,0.0076,0.6436
HEARTS ACE DIAMONDS SIX,0.3478,0.0038,0.6484
SPADES TEN DIAMONDS JACK,0.5416,0.0094,0.449
SPADES JACK DIAMONDS JACK,0.2786,0.01,0.7114
SPADES NINE SPADES SIX,0.5306,0.0094,0.46
SPADES EIGHT SPADES SIX,0.529,0.0134,0.4576
SPADES SEVEN SPADES SIX,0.5278,0.0106,0.4616
HEARTS SEVEN HEARTS EIGHT,0.5334,0.0132,0.4534
HEARTS SEVEN HEARTS NINE,0.5154,0.0146,0.47
SPADES JACK SPADES TEN,0.4998,0.0084,0.4918
HEARTS SEVEN CLUBS SIX,0.5556,0.0146,0.4298
CLUBS SEVEN HEARTS SEVEN,0.3268,0.0224,0.6508
HEARTS SEVEN CLUBS FOUR,0.6864,0.0448,0.2688
HEARTS SEVEN CLUBS FIVE,0.5786,0.014,0.4074
HEARTS SEVEN CLUBS TWO,0.6436,0.0102,0.3462
SPADES KING SPADES TEN,0.3178,0.0072,0.675
HEARTS SEVEN CLUBS THREE,0.6296,0.0144,0.356
SPADES QUEEN SPADES TEN,0.2134,0.123,0.6636
SPADES ACE SPADES TEN,0.3318,0.0036,0.6646
SPADES KING HEARTS SEVEN,0.3578,0.0062,0.636
SPADES QUEEN HEARTS SEVEN,0.2214,0.3024,0.4762
SPADES ACE HEARTS SEVEN,0.3604,0.0046,0.635
HEARTS SEVEN SPADES TEN,0.5718,0.0094,0.4188
HEARTS SEVEN SPADES JACK,0.589,0.0098,0.4012
HEARTS TEN CLUBS ACE,0.3414,0.0048,0.6538
CLUBS TEN HEARTS NINE,0.543,0.0104,0.4466
SPADES ACE HEARTS THREE,0.3776,0.0048,0.6176
SPADES ACE DIAMONDS KING,0.3138,0.0054,0.6808
CLUBS JACK HEARTS NINE,0.5594,0.0096,0.431
SPADES KING DIAMONDS KING,0.132,0.0044,0.8636
SPADES KING HEARTS THREE,0.3872,0.0072,0.6056
SPADES QUEEN HEARTS THREE,0.2578,0.529,0.2132
SPADES QUEEN DIAMONDS KING,0.2304,0.0242,0.7454
HEARTS TEN CLUBS KING,0.3384,0.006,0.6556
CLUBS ACE HEARTS NINE,0.354,0.0046,0.6414
CLUBS TEN HEARTS TEN,0.2906,0.013,0.6964
HEARTS TEN CLUBS JACK,0.5478,0.008,0.4442
CLUBS KING HEARTS NINE,0.348,0.0068,0.6452
SPADES QUEEN HEARTS TEN,0.2382,0.1106,0.6512
SPADES KING HEARTS TEN,0.345,0.0078,0.6472
SPADES ACE HEARTS TEN,0.3586,0.0032,0.6382
SPADES TEN HEARTS NINE,0.5272,0.008,0.4648
SPADES JACK HEARTS NINE,0.5494,0.0106,0.44
SPADES TEN HEARTS TEN,0.2792,0.0144,0.7064
SPADES JACK HEARTS TEN,0.5468,0.0104,0.4428
