opposingHand,winningChance,drawChance,lostChance
SPADES TEN HEARTS TEN,0.187,0.0638,0.7492
SPADES JACK HEARTS TEN,0.354,0.0154,0.6306
SPADES SEVEN HEARTS EIGHT,0.3402,0.064,0.5958
CLUBS THREE HEARTS JACK,0.4306,0.0186,0.5508
SPADES EIGHT HEARTS EIGHT,0.156,0.088,0.756
CLUBS THREE HEARTS TEN,0.4216,0.0278,0.5506
SPADES NINE HEARTS EIGHT,0.357,0.0324,0.6106
SPADES KING HEARTS NINE,0.3798,0.0078,0.6124
SPADES TWO HEARTS EIGHT,0.4362,0.0644,0.4994
SPADES QUEEN HEARTS NINE,0.3692,0.0104,0.6204
SPADES THREE HEARTS EIGHT,0.4308,0.0652,0.504
SPADES FOUR HEARTS EIGHT,0.4152,0.0648,0.52
SPADES ACE HEARTS NINE,0.37,0.0034,0.6266
SPADES FIVE HEARTS EIGHT,0.2556,0.1454,0.599
CLUBS EIGHT HEARTS EIGHT,0.1714,0.0844,0.7442
CLUBS NINE HEARTS EIGHT,0.3532,0.0342,0.6126
CLUBS THREE HEARTS KING,0.426,0.0088,0.5652
CLUBS FOUR HEARTS EIGHT,0.407,0.0688,0.5242
CLUBS THREE HEARTS QUEEN,0.4306,0.0122,0.5572
CLUBS FIVE HEARTS EIGHT,0.2634,0.1444,0.5922
CLUBS SIX HEARTS EIGHT,0.2694,0.141,0.5896
CLUBS THREE HEARTS ACE,0.4176,0.003,0.5794
CLUBS SEVEN HEARTS EIGHT,0.334,0.0568,0.6092
CLUBS THREE HEARTS EIGHT,0.4416,0.0632,0.4952
CLUBS TWO HEARTS EIGHT,0.4318,0.0626,0.5056
SPADES TEN SPADES FOUR,0.4118,0.0236,0.5646
SPADES JACK SPADES FOUR,0.4016,0.0184,0.58
HEARTS EIGHT HEARTS NINE,0.3322,0.0382,0.6296
SPADES QUEEN SPADES FOUR,0.404,0.0106,0.5854
SPADES KING SPADES FOUR,0.3898,0.009,0.6012
SPADES ACE SPADES FOUR,0.3974,0.0054,0.5972
HEARTS KING HEARTS TEN,0.3522,0.0084,0.6394
HEARTS QUEEN HEARTS TEN,0.3308,0.0108,0.6584
HEARTS ACE HEARTS TEN,0.348,0.0038,0.6482
HEARTS SEVEN CLUBS JACK,0.3858,0.0216,0.5926
CLUBS TEN HEARTS SEVEN,0.3544,0.0274,0.6182
HEARTS SEVEN CLUBS KING,0.375,0.0076,0.6174
HEARTS SEVEN CLUBS QUEEN,0.383,0.0116,0.6054
HEARTS SEVEN CLUBS ACE,0.364,0.004,0.632
CLUBS SEVEN HEARTS ACE,0.3762,0.004,0.6198
CLUBS SEVEN HEARTS KING,0.369,0.0082,0.6228
CLUBS SEVEN HEARTS QUEEN,0.3886,0.0094,0.602
CLUBS SEVEN HEARTS JACK,0.3702,0.015,0.6148
CLUBS SEVEN HEARTS TEN,0.374,0.0272,0.5988
CLUBS TEN CLUBS THREE,0.3976,0.0256,0.5768
CLUBS THREE CLUBS JACK,0.4086,0.0194,0.572
CLUBS THREE CLUBS ACE,0.4002,0.004,0.5958
CLUBS THREE CLUBS QUEEN,0.4138,0.0128,0.5734
CLUBS THREE CLUBS KING,0.4056,0.0078,0.5866
HEARTS TEN HEARTS JACK,0.3236,0.0122,0.6642
SPADES ACE CLUBS ACE,0.181,0.0034,0.8156
SPADES KING CLUBS ACE,0.3694,0.003,0.6276
SPADES QUEEN CLUBS ACE,0.3788,0.006,0.6152
SPADES JACK CLUBS ACE,0.3676,0.0058,0.6266
SPADES TEN CLUBS ACE,0.358,0.0022,0.6398
SPADES EIGHT HEARTS NINE,0.3384,0.0404,0.6212
SPADES NINE HEARTS NINE,0.1798,0.0798,0.7404
SPADES SEVEN HEARTS NINE,0.3454,0.0378,0.6168
CLUBS SEVEN HEARTS NINE,0.3508,0.0372,0.612
CLUBS SIX HEARTS NINE,0.2766,0.112,0.6114
CLUBS FIVE HEARTS NINE,0.28,0.0934,0.6266
CLUBS FOUR HEARTS NINE,0.4308,0.0406,0.5286
CLUBS THREE HEARTS NINE,0.4306,0.0416,0.5278
CLUBS TWO HEARTS NINE,0.4456,0.045,0.5094
SPADES FIVE HEARTS NINE,0.2752,0.1156,0.6092
SPADES FOUR HEARTS NINE,0.432,0.04,0.528
SPADES THREE HEARTS NINE,0.4416,0.039,0.5194
SPADES TWO HEARTS NINE,0.4438,0.0388,0.5174
CLUBS NINE HEARTS NINE,0.1852,0.0738,0.741
CLUBS EIGHT HEARTS NINE,0.3476,0.0394,0.613
