opposingHand,winningChance,drawChance,lostChance
SPADES KING HEARTS TWO,0.2738,0.0276,0.6986
SPADES KING SPADES NINE,0.3332,0.0072,0.6596
HEARTS EIGHT DIAMONDS NINE,0.2516,0.104,0.6444
SPADES JACK CLUBS ACE,0.3682,0.0042,0.6276
CLUBS JACK CLUBS EIGHT,0.2582,0.0548,0.687
SPADES KING CLUBS FOUR,0.3988,0.0076,0.5936
CLUBS FIVE CLUBS ACE,0.3658,0.0046,0.6296
HEARTS THREE DIAMONDS JACK,0.3814,0.0238,0.5948
SPADES ACE HEARTS JACK,0.3618,0.0032,0.635
HEARTS THREE SPADES SEVEN,0.5632,0.0658,0.371
DIAMONDS FOUR HEARTS THREE,0.5354,0.0674,0.3972
CLUBS NINE HEARTS NINE,0.1792,0.053,0.7678
DIAMONDS THREE CLUBS ACE,0.393,0.0056,0.6014
HEARTS SIX SPADES TWO,0.6304,0.1326,0.237
CLUBS EIGHT DIAMONDS KING,0.2512,0.0398,0.709
CLUBS ACE DIAMONDS SEVEN,0.3808,0.0052,0.614
CLUBS SEVEN SPADES SEVEN,0.2806,0.0808,0.6386
HEARTS FIVE SPADES NINE,0.3844,0.0464,0.5692
SPADES QUEEN SPADES SIX,0.3822,0.0116,0.6062
SPADES NINE DIAMONDS ACE,0.353,0.005,0.642
HEARTS SEVEN CLUBS FIVE,0.5424,0.0608,0.3968
SPADES QUEEN CLUBS TWO,0.2884,0.0386,0.673
SPADES TWO CLUBS ACE,0.285,0.0156,0.6994
CLUBS NINE DIAMONDS KING,0.3518,0.0078,0.6404
DIAMONDS THREE SPADES FOUR,0.5396,0.063,0.3974
HEARTS EIGHT SPADES THREE,0.2724,0.4862,0.2414
HEARTS SIX DIAMONDS FIVE,0.5212,0.0652,0.4136
CLUBS FOUR HEARTS QUEEN,0.3984,0.0126,0.589
CLUBS EIGHT DIAMONDS SEVEN,0.2468,0.291,0.4622
HEARTS TWO CLUBS FOUR,0.6174,0.1438,0.2388
SPADES KING DIAMONDS QUEEN,0.349,0.0084,0.6426
HEARTS FIVE DIAMONDS SEVEN,0.5294,0.0632,0.4074
SPADES ACE CLUBS KING,0.3694,0.005,0.6256
SPADES ACE CLUBS SEVEN,0.4018,0.0046,0.5936
SPADES KING CLUBS FIVE,0.388,0.0086,0.6034
HEARTS EIGHT CLUBS KING,0.2818,0.0416,0.6766
CLUBS SEVEN CLUBS QUEEN,0.3778,0.0118,0.6104
CLUBS NINE HEARTS THREE,0.3944,0.0362,0.5694
CLUBS TEN HEARTS TEN,0.1834,0.0506,0.766
HEARTS SIX CLUBS KING,0.3888,0.0072,0.604
SPADES NINE HEARTS JACK,0.355,0.0182,0.6268
HEARTS THREE HEARTS NINE,0.367,0.04,0.593
SPADES THREE DIAMONDS NINE,0.3952,0.0408,0.564
SPADES QUEEN SPADES FOUR,0.3884,0.0114,0.6002
HEARTS FIVE HEARTS QUEEN,0.362,0.0156,0.6224
HEARTS TWO SPADES TWO,0.3132,0.07,0.6168
CLUBS EIGHT HEARTS TWO,0.0696,0.9086,0.0218
CLUBS NINE SPADES TWO,0.2834,0.1022,0.6144
CLUBS QUEEN HEARTS NINE,0.361,0.0104,0.6286
CLUBS JACK DIAMONDS QUEEN,0.3336,0.0098,0.6566
SPADES TEN CLUBS SEVEN,0.363,0.0264,0.6106
CLUBS FIVE HEARTS TWO,0.6126,0.15,0.2374
SPADES NINE CLUBS FIVE,0.3964,0.0364,0.5672
CLUBS EIGHT SPADES THREE,0.2612,0.5006,0.2382
SPADES JACK HEARTS ACE,0.373,0.0038,0.6232
SPADES SEVEN HEARTS QUEEN,0.3964,0.0108,0.5928
SPADES FOUR HEARTS NINE,0.3912,0.0456,0.5632
DIAMONDS FOUR SPADES SEVEN,0.5364,0.0616,0.402
HEARTS THREE HEARTS TEN,0.3714,0.0246,0.604
SPADES ACE CLUBS JACK,0.3792,0.0036,0.6172
CLUBS TEN CLUBS EIGHT,0.2582,0.0758,0.666
CLUBS ACE DIAMONDS FIVE,0.3776,0.0082,0.6142
SPADES KING CLUBS TWO,0.288,0.0266,0.6854
CLUBS KING DIAMONDS SIX,0.3872,0.0096,0.6032
DIAMONDS FOUR CLUBS SEVEN,0.5444,0.0638,0.3918
HEARTS QUEEN HEARTS JACK,0.35,0.0104,0.6396
SPADES TEN SPADES SEVEN,0.3468,0.0226,0.6306
SPADES KING CLUBS QUEEN,0.3678,0.0042,0.628
SPADES QUEEN CLUBS QUEEN,0.179,0.0262,0.7948
CLUBS ACE CLUBS KING,0.3344,0.006,0.6596
CLUBS THREE DIAMONDS NINE,0.3744,0.0426,0.583
DIAMONDS THREE HEARTS KING,0.3912,0.0096,0.5992
SPADES SEVEN HEARTS NINE,0.372,0.0368,0.5912
CLUBS JACK CLUBS TEN,0.336,0.0118,0.6522
SPADES SIX CLUBS ACE,0.4024,0.0044,0.5932
CLUBS SEVEN SPADES FIVE,0.5394,0.0604,0.4002
CLUBS TEN CLUBS QUEEN,0.339,0.011,0.65
CLUBS THREE SPADES THREE,0.3206,0.1004,0.579
HEARTS SEVEN DIAMONDS KING,0.379,0.0096,0.6114
SPADES QUEEN CLUBS KING,0.3628,0.0058,0.6314
SPADES JACK SPADES FOUR,0.3792,0.0188,0.602
HEARTS FIVE SPADES THREE,0.5506,0.0658,0.3836
SPADES TWO CLUBS QUEEN,0.2966,0.0376,0.6658
SPADES JACK DIAMONDS NINE,0.3346,0.017,0.6484
HEARTS SIX DIAMONDS SEVEN,0.5272,0.06,0.4128
SPADES EIGHT CLUBS FOUR,0.259,0.4842,0.2568
CLUBS JACK CLUBS KING,0.3298,0.0082,0.662
DIAMONDS ACE SPADES FOUR,0.3772,0.006,0.6168
CLUBS EIGHT HEARTS ACE,0.2676,0.029,0.7034
HEARTS FIVE CLUBS SIX,0.5296,0.071,0.3994
CLUBS NINE HEARTS FOUR,0.409,0.0478,0.5432
DIAMONDS QUEEN CLUBS QUEEN,0.1682,0.0236,0.8082
DIAMONDS QUEEN HEARTS KING,0.347,0.0078,0.6452
HEARTS FIVE HEARTS THREE,0.516,0.061,0.423
SPADES NINE DIAMONDS SEVEN,0.3578,0.0402,0.602
DIAMONDS JACK CLUBS ACE,0.3574,0.0058,0.6368
CLUBS TEN DIAMONDS SEVEN,0.3554,0.0258,0.6188
CLUBS JACK DIAMONDS JACK,0.1688,0.0376,0.7936
HEARTS THREE DIAMONDS KING,0.3866,0.01,0.6034
HEARTS ACE SPADES THREE,0.401,0.0052,0.5938
DIAMONDS FOUR DIAMONDS SEVEN,0.5372,0.0642,0.3986
CLUBS NINE DIAMONDS QUEEN,0.339,0.0094,0.6516
DIAMONDS THREE DIAMONDS NINE,0.3378,0.0444,0.6178
SPADES KING HEARTS TEN,0.365,0.0066,0.6284
SPADES JACK HEARTS FOUR,0.395,0.0182,0.5868
HEARTS FOUR HEARTS ACE,0.37,0.006,0.624
DIAMONDS FOUR DIAMONDS NINE,0.3376,0.0424,0.62
SPADES NINE DIAMONDS QUEEN,0.35,0.0128,0.6372
HEARTS KING CLUBS ACE,0.3722,0.0038,0.624
HEARTS TEN HEARTS NINE,0.3092,0.021,0.6698
SPADES ACE SPADES QUEEN,0.349,0.0042,0.6468
CLUBS FIVE SPADES TWO,0.6144,0.1308,0.2548
SPADES SEVEN CLUBS QUEEN,0.3806,0.0132,0.6062
CLUBS TEN HEARTS SIX,0.3864,0.0276,0.586
DIAMONDS FOUR DIAMONDS KING,0.34,0.013,0.647
SPADES ACE SPADES NINE,0.346,0.0044,0.6496
DIAMONDS THREE CLUBS KING,0.3896,0.0094,0.601
DIAMONDS KING CLUBS QUEEN,0.3454,0.0072,0.6474
HEARTS TEN DIAMONDS SIX,0.3806,0.0304,0.589
DIAMONDS TEN SPADES TWO,0.2672,0.079,0.6538
HEARTS KING HEARTS NINE,0.3386,0.0098,0.6516
SPADES SEVEN SPADES FOUR,0.5272,0.0602,0.4126
SPADES NINE CLUBS KING,0.3586,0.0056,0.6358
CLUBS TEN CLUBS KING,0.3522,0.0084,0.6394
SPADES KING DIAMONDS SEVEN,0.3794,0.01,0.6106
SPADES QUEEN DIAMONDS ACE,0.3538,0.0042,0.642
HEARTS SIX SPADES TEN,0.3842,0.0296,0.5862
HEARTS SEVEN HEARTS TWO,0.5976,0.1254,0.277
DIAMONDS FOUR SPADES NINE,0.3886,0.0416,0.5698
DIAMONDS KING HEARTS JACK,0.3476,0.0084,0.644
SPADES EIGHT HEARTS JACK,0.2688,0.0608,0.6704
SPADES FOUR SPADES TWO,0.5816,0.1404,0.278
CLUBS SIX CLUBS QUEEN,0.3766,0.011,0.6124
CLUBS SEVEN HEARTS TEN,0.3806,0.0274,0.592
HEARTS THREE CLUBS QUEEN,0.4078,0.0136,0.5786
CLUBS FIVE DIAMONDS FIVE,0.2786,0.1044,0.617
HEARTS FIVE SPADES SEVEN,0.5408,0.061,0.3982
HEARTS ACE DIAMONDS SIX,0.3936,0.0034,0.603
HEARTS ACE HEARTS JACK,0.341,0.0072,0.6518
HEARTS KING DIAMONDS FIVE,0.3806,0.0084,0.611
HEARTS SIX DIAMONDS ACE,0.3682,0.0028,0.629
CLUBS SIX HEARTS QUEEN,0.3954,0.0102,0.5944
HEARTS TWO SPADES FIVE,0.5942,0.143,0.2628
DIAMONDS THREE SPADES TEN,0.3882,0.0288,0.583
DIAMONDS SEVEN CLUBS QUEEN,0.3854,0.0096,0.605
SPADES KING CLUBS KING,0.1642,0.0176,0.8182
CLUBS JACK SPADES TWO,0.2942,0.0488,0.657
CLUBS NINE DIAMONDS FIVE,0.3766,0.0448,0.5786
SPADES FOUR DIAMONDS JACK,0.3844,0.0208,0.5948
CLUBS SIX CLUBS FIVE,0.4894,0.0622,0.4484
SPADES ACE HEARTS SIX,0.3766,0.004,0.6194
CLUBS SEVEN HEARTS ACE,0.3872,0.0046,0.6082
CLUBS THREE HEARTS JACK,0.4044,0.0194,0.5762
HEARTS FOUR CLUBS SIX,0.553,0.0684,0.3786
SPADES NINE HEARTS THREE,0.4054,0.0426,0.552
CLUBS JACK DIAMONDS FOUR,0.3882,0.0202,0.5916
HEARTS THREE CLUBS THREE,0.3066,0.1144,0.579
CLUBS JACK HEARTS FOUR,0.3954,0.0228,0.5818
HEARTS QUEEN HEARTS TEN,0.3308,0.009,0.6602
CLUBS SIX CLUBS THREE,0.5268,0.0636,0.4096
SPADES FOUR CLUBS KING,0.3942,0.0092,0.5966
SPADES QUEEN CLUBS EIGHT,0.278,0.0462,0.6758
HEARTS EIGHT CLUBS FIVE,0.2592,0.4254,0.3154
DIAMONDS ACE SPADES FIVE,0.369,0.0048,0.6262
HEARTS EIGHT SPADES EIGHT,0.1242,0.0788,0.797
DIAMONDS THREE CLUBS FIVE,0.5382,0.0692,0.3926
SPADES ACE CLUBS THREE,0.3974,0.0056,0.597
HEARTS KING DIAMONDS SIX,0.3866,0.008,0.6054
DIAMONDS NINE CLUBS ACE,0.3466,0.0044,0.649
SPADES FOUR CLUBS QUEEN,0.408,0.0136,0.5784
CLUBS FIVE DIAMONDS SIX,0.5262,0.0626,0.4112
SPADES FOUR DIAMONDS SIX,0.533,0.0656,0.4014
CLUBS TEN HEARTS TWO,0.2778,0.0698,0.6524
DIAMONDS KING HEARTS TEN,0.339,0.0074,0.6536
DIAMONDS QUEEN CLUBS KING,0.3552,0.007,0.6378
CLUBS TEN HEARTS JACK,0.3284,0.0114,0.6602
HEARTS FIVE DIAMONDS QUEEN,0.39,0.014,0.596
HEARTS SEVEN SPADES EIGHT,0.2546,0.2834,0.462
SPADES JACK SPADES SEVEN,0.3642,0.0178,0.618
HEARTS SEVEN CLUBS KING,0.3946,0.0084,0.597
HEARTS FIVE CLUBS SEVEN,0.5454,0.0656,0.389
CLUBS SIX CLUBS TWO,0.5956,0.1266,0.2778
CLUBS NINE SPADES THREE,0.3952,0.0436,0.5612
DIAMONDS JACK HEARTS QUEEN,0.3504,0.0098,0.6398
SPADES FIVE DIAMONDS SEVEN,0.5336,0.064,0.4024
CLUBS EIGHT CLUBS FIVE,0.2486,0.3938,0.3576
SPADES EIGHT DIAMONDS NINE,0.246,0.1052,0.6488
HEARTS TWO DIAMONDS QUEEN,0.273,0.0394,0.6876
DIAMONDS SIX HEARTS NINE,0.368,0.045,0.587
DIAMONDS THREE HEARTS THREE,0.2922,0.1106,0.5972
CLUBS TWO SPADES THREE,0.6026,0.1514,0.246
SPADES ACE DIAMONDS TEN,0.3378,0.0036,0.6586
HEARTS THREE HEARTS TWO,0.5808,0.1332,0.286
SPADES QUEEN DIAMONDS TEN,0.3442,0.0122,0.6436
SPADES TEN HEARTS KING,0.3688,0.0066,0.6246
DIAMONDS ACE SPADES THREE,0.378,0.0064,0.6156
HEARTS FIVE HEARTS FOUR,0.5072,0.0628,0.43
SPADES QUEEN CLUBS SEVEN,0.3918,0.0138,0.5944
DIAMONDS THREE SPADES SEVEN,0.5636,0.0644,0.372
SPADES QUEEN DIAMONDS NINE,0.3432,0.0116,0.6452
HEARTS JACK HEARTS TEN,0.3352,0.0146,0.6502
HEARTS TWO DIAMONDS NINE,0.255,0.1042,0.6408
CLUBS EIGHT HEARTS FIVE,0.2626,0.4178,0.3196
SPADES FOUR DIAMONDS NINE,0.381,0.0412,0.5778
SPADES SEVEN DIAMONDS SIX,0.5152,0.0656,0.4192
HEARTS SIX HEARTS KING,0.3866,0.0074,0.606
SPADES QUEEN CLUBS THREE,0.409,0.016,0.575
SPADES EIGHT HEARTS NINE,0.2698,0.1002,0.63
HEARTS ACE DIAMONDS FIVE,0.3764,0.0062,0.6174
SPADES KING SPADES FOUR,0.381,0.0112,0.6078
DIAMONDS THREE SPADES SIX,0.5554,0.0632,0.3814
SPADES ACE DIAMONDS FOUR,0.3736,0.0042,0.6222
CLUBS NINE SPADES NINE,0.1702,0.0556,0.7742
DIAMONDS SEVEN DIAMONDS SIX,0.5066,0.059,0.4344
CLUBS TWO HEARTS ACE,0.288,0.0144,0.6976
DIAMONDS ACE DIAMONDS FIVE,0.3266,0.0068,0.6666
SPADES TEN DIAMONDS TEN,0.1626,0.0504,0.787
DIAMONDS THREE HEARTS TWO,0.6082,0.1388,0.253
SPADES JACK CLUBS EIGHT,0.2706,0.0602,0.6692
CLUBS SIX DIAMONDS TEN,0.3672,0.0254,0.6074
CLUBS FIVE CLUBS FOUR,0.4868,0.0658,0.4474
HEARTS ACE DIAMONDS TEN,0.347,0.0038,0.6492
DIAMONDS FOUR CLUBS TEN,0.3866,0.0276,0.5858
SPADES QUEEN DIAMONDS JACK,0.3404,0.0086,0.651
HEARTS EIGHT HEARTS SIX,0.239,0.341,0.42
CLUBS JACK SPADES FIVE,0.409,0.0188,0.5722
DIAMONDS KING HEARTS ACE,0.3512,0.0062,0.6426
CLUBS SEVEN SPADES FOUR,0.5496,0.0612,0.3892
HEARTS EIGHT HEARTS THREE,0.2416,0.4736,0.2848
SPADES JACK CLUBS THREE,0.4054,0.0206,0.574
DIAMONDS ACE CLUBS QUEEN,0.345,0.0056,0.6494
DIAMONDS FOUR CLUBS ACE,0.3812,0.004,0.6148
CLUBS ACE HEARTS TEN,0.359,0.005,0.636
DIAMONDS KING DIAMONDS FIVE,0.3464,0.0084,0.6452
CLUBS NINE CLUBS TWO,0.2702,0.0998,0.63
HEARTS THREE SPADES SIX,0.5536,0.068,0.3784
CLUBS ACE HEARTS JACK,0.3746,0.0046,0.6208
CLUBS JACK CLUBS FOUR,0.3762,0.0216,0.6022
SPADES QUEEN SPADES EIGHT,0.2602,0.0422,0.6976
CLUBS SIX HEARTS ACE,0.3888,0.0046,0.6066
SPADES FIVE HEARTS NINE,0.379,0.0382,0.5828
CLUBS FOUR SPADES TWO,0.6114,0.1412,0.2474
HEARTS ACE CLUBS ACE,0.1654,0.0032,0.8314
CLUBS JACK HEARTS SEVEN,0.3824,0.0174,0.6002
CLUBS TWO DIAMONDS SIX,0.6166,0.1398,0.2436
SPADES QUEEN SPADES NINE,0.3366,0.0118,0.6516
SPADES TEN HEARTS THREE,0.4,0.0284,0.5716
DIAMONDS TEN DIAMONDS FIVE,0.339,0.0316,0.6294
SPADES KING DIAMONDS TEN,0.3372,0.0062,0.6566
SPADES SEVEN DIAMONDS KING,0.3798,0.0078,0.6124
HEARTS SIX SPADES FIVE,0.527,0.0576,0.4154
SPADES TEN HEARTS JACK,0.3454,0.0154,0.6392
HEARTS FIVE HEARTS KING,0.3706,0.0112,0.6182
HEARTS FOUR SPADES THREE,0.5454,0.061,0.3936
SPADES ACE DIAMONDS FIVE,0.3866,0.0044,0.609
SPADES TWO DIAMONDS SEVEN,0.6426,0.1376,0.2198
CLUBS TEN DIAMONDS ACE,0.3436,0.0056,0.6508
HEARTS FIVE SPADES SIX,0.5326,0.0614,0.406
HEARTS FIVE CLUBS FOUR,0.5348,0.0628,0.4024
SPADES TEN SPADES SIX,0.3598,0.0244,0.6158
CLUBS NINE HEARTS TEN,0.3416,0.0258,0.6326
DIAMONDS THREE HEARTS ACE,0.383,0.0064,0.6106
SPADES NINE CLUBS TWO,0.2842,0.1014,0.6144
SPADES ACE CLUBS SIX,0.4082,0.0042,0.5876
SPADES ACE HEARTS NINE,0.3704,0.0048,0.6248
HEARTS EIGHT SPADES FOUR,0.2588,0.4792,0.262
SPADES NINE CLUBS ACE,0.358,0.002,0.64
CLUBS JACK HEARTS QUEEN,0.3544,0.0088,0.6368
HEARTS FIVE SPADES FOUR,0.5306,0.0702,0.3992
DIAMONDS THREE CLUBS SIX,0.5642,0.06,0.3758
DIAMONDS THREE HEARTS SIX,0.555,0.0674,0.3776
SPADES QUEEN CLUBS FIVE,0.3872,0.0106,0.6022
CLUBS EIGHT SPADES FOUR,0.271,0.476,0.253
HEARTS SEVEN HEARTS FIVE,0.5096,0.0572,0.4332
SPADES KING DIAMONDS NINE,0.34,0.0076,0.6524
SPADES ACE CLUBS FOUR,0.3822,0.005,0.6128
SPADES ACE DIAMONDS SEVEN,0.3802,0.0038,0.616
CLUBS NINE SPADES FOUR,0.3884,0.0434,0.5682
CLUBS NINE CLUBS THREE,0.3872,0.0422,0.5706
HEARTS EIGHT DIAMONDS FIVE,0.2366,0.4288,0.3346
SPADES ACE HEARTS KING,0.3692,0.0044,0.6264
SPADES ACE DIAMONDS SIX,0.3898,0.0032,0.607
SPADES NINE DIAMONDS NINE,0.1818,0.0606,0.7576
CLUBS JACK HEARTS FIVE,0.4072,0.0186,0.5742
CLUBS SIX DIAMONDS ACE,0.375,0.0044,0.6206
CLUBS EIGHT DIAMONDS SIX,0.2348,0.365,0.4002
SPADES THREE HEARTS QUEEN,0.4134,0.0168,0.5698
SPADES TWO HEARTS JACK,0.2854,0.05,0.6646
CLUBS FIVE SPADES FOUR,0.5458,0.065,0.3892
HEARTS JACK DIAMONDS SIX,0.3916,0.0158,0.5926
SPADES KING HEARTS QUEEN,0.3528,0.0062,0.641
HEARTS TWO DIAMONDS TEN,0.2688,0.075,0.6562
DIAMONDS FOUR CLUBS TWO,0.6062,0.1462,0.2476
CLUBS THREE CLUBS TWO,0.574,0.1394,0.2866
SPADES EIGHT CLUBS TWO,0.07,0.9098,0.0202
DIAMONDS FOUR DIAMONDS JACK,0.3404,0.0222,0.6374
SPADES KING HEARTS FOUR,0.391,0.0088,0.6002
HEARTS JACK CLUBS QUEEN,0.364,0.009,0.627
HEARTS THREE CLUBS ACE,0.3818,0.005,0.6132
HEARTS EIGHT DIAMONDS FOUR,0.2546,0.4858,0.2596
CLUBS EIGHT HEARTS NINE,0.2758,0.1046,0.6196
DIAMONDS THREE CLUBS EIGHT,0.2504,0.497,0.2526
SPADES ACE SPADES TEN,0.3566,0.0044,0.639
DIAMONDS KING DIAMONDS JACK,0.3098,0.0066,0.6836
DIAMONDS THREE DIAMONDS FIVE,0.5348,0.0668,0.3984
HEARTS EIGHT SPADES SIX,0.2578,0.3414,0.4008
HEARTS THREE DIAMONDS SEVEN,0.5606,0.0632,0.3762
SPADES EIGHT CLUBS FIVE,0.2652,0.4138,0.321
HEARTS EIGHT CLUBS THREE,0.272,0.4862,0.2418
SPADES SEVEN SPADES THREE,0.528,0.0636,0.4084
DIAMONDS JACK HEARTS JACK,0.1558,0.039,0.8052
SPADES SEVEN CLUBS FOUR,0.5428,0.0634,0.3938
SPADES ACE SPADES EIGHT,0.259,0.0246,0.7164
SPADES EIGHT SPADES FIVE,0.245,0.3886,0.3664
HEARTS TWO HEARTS KING,0.2586,0.029,0.7124
DIAMONDS KING SPADES THREE,0.3712,0.0092,0.6196
HEARTS SEVEN SPADES NINE,0.3592,0.0364,0.6044
HEARTS TWO SPADES THREE,0.619,0.1364,0.2446
DIAMONDS THREE SPADES EIGHT,0.2524,0.4982,0.2494
SPADES ACE DIAMONDS QUEEN,0.3542,0.0052,0.6406
SPADES NINE CLUBS THREE,0.39,0.037,0.573
CLUBS JACK HEARTS TEN,0.3398,0.0124,0.6478
HEARTS EIGHT HEARTS TEN,0.2618,0.0794,0.6588
CLUBS TEN CLUBS NINE,0.3184,0.0208,0.6608
HEARTS FOUR DIAMONDS ACE,0.3786,0.0068,0.6146
HEARTS SEVEN SPADES TEN,0.3796,0.0286,0.5918
HEARTS QUEEN CLUBS ACE,0.3628,0.0036,0.6336
HEARTS SEVEN CLUBS FOUR,0.561,0.0602,0.3788
DIAMONDS JACK DIAMONDS TEN,0.297,0.0178,0.6852
CLUBS QUEEN DIAMONDS FIVE,0.3904,0.0134,0.5962
HEARTS ACE HEARTS KING,0.3456,0.0068,0.6476
HEARTS FIVE SPADES TWO,0.6092,0.1278,0.263
SPADES SEVEN DIAMONDS JACK,0.37,0.0194,0.6106
SPADES TEN DIAMONDS ACE,0.3474,0.004,0.6486
SPADES EIGHT CLUBS KING,0.2796,0.035,0.6854
HEARTS SIX HEARTS ACE,0.3688,0.0032,0.628
SPADES TEN DIAMONDS NINE,0.3298,0.023,0.6472
SPADES QUEEN HEARTS SIX,0.392,0.0118,0.5962
DIAMONDS THREE CLUBS QUEEN,0.4004,0.0122,0.5874
HEARTS THREE CLUBS FIVE,0.548,0.0618,0.3902
HEARTS SEVEN SPADES FIVE,0.5424,0.065,0.3926
DIAMONDS FOUR DIAMONDS SIX,0.5288,0.0692,0.402
HEARTS FOUR DIAMONDS TEN,0.3814,0.0304,0.5882
DIAMONDS THREE SPADES NINE,0.3882,0.046,0.5658
CLUBS TEN HEARTS NINE,0.3256,0.0252,0.6492
SPADES KING CLUBS SIX,0.3814,0.0088,0.6098
SPADES JACK DIAMONDS ACE,0.3606,0.0046,0.6348
CLUBS TEN CLUBS SIX,0.3734,0.0276,0.599
DIAMONDS FOUR CLUBS EIGHT,0.2524,0.4932,0.2544
SPADES NINE SPADES TWO,0.2638,0.0946,0.6416
CLUBS JACK SPADES TEN,0.3376,0.0144,0.648
CLUBS SIX SPADES FOUR,0.5548,0.0598,0.3854
CLUBS FOUR DIAMONDS FIVE,0.5216,0.0676,0.4108
CLUBS ACE HEARTS NINE,0.3684,0.0062,0.6254
CLUBS SEVEN HEARTS TWO,0.6426,0.1352,0.2222
CLUBS NINE SPADES SIX,0.3748,0.042,0.5832
CLUBS EIGHT DIAMONDS FIVE,0.2424,0.4268,0.3308
CLUBS JACK CLUBS FIVE,0.369,0.0192,0.6118
CLUBS NINE HEARTS ACE,0.3706,0.0032,0.6262
CLUBS EIGHT DIAMONDS ACE,0.2392,0.0254,0.7354
CLUBS TEN SPADES SIX,0.3992,0.0286,0.5722
DIAMONDS THREE CLUBS FOUR,0.5472,0.0618,0.391
CLUBS JACK HEARTS ACE,0.3608,0.0036,0.6356
CLUBS FIVE DIAMONDS SEVEN,0.5354,0.058,0.4066
SPADES ACE CLUBS QUEEN,0.3676,0.0044,0.628
HEARTS QUEEN DIAMONDS NINE,0.3454,0.0128,0.6418
DIAMONDS FOUR HEARTS QUEEN,0.391,0.0124,0.5966
HEARTS SIX HEARTS THREE,0.5346,0.0598,0.4056
SPADES TEN CLUBS FOUR,0.4034,0.028,0.5686
DIAMONDS ACE HEARTS KING,0.355,0.004,0.641
HEARTS EIGHT SPADES FIVE,0.2648,0.417,0.3182
HEARTS TWO CLUBS ACE,0.2786,0.0158,0.7056
SPADES ACE CLUBS FIVE,0.3946,0.0046,0.6008
CLUBS TEN SPADES FIVE,0.3866,0.027,0.5864
CLUBS TEN DIAMONDS KING,0.3492,0.006,0.6448
CLUBS SIX HEARTS NINE,0.3694,0.0418,0.5888
SPADES TEN DIAMONDS FIVE,0.3852,0.026,0.5888
SPADES TEN SPADES NINE,0.3232,0.0224,0.6544
DIAMONDS THREE SPADES TWO,0.6188,0.1348,0.2464
HEARTS FIVE HEARTS TWO,0.5744,0.1396,0.286
HEARTS TWO HEARTS TEN,0.2754,0.0704,0.6542
HEARTS TWO HEARTS NINE,0.2602,0.0974,0.6424
DIAMONDS KING HEARTS QUEEN,0.356,0.003,0.641
SPADES ACE SPADES JACK,0.3428,0.0036,0.6536
DIAMONDS KING DIAMONDS TEN,0.3062,0.0088,0.685
SPADES THREE DIAMONDS SEVEN,0.5568,0.0726,0.3706
HEARTS EIGHT DIAMONDS SIX,0.2388,0.3484,0.4128
CLUBS EIGHT CLUBS SEVEN,0.2418,0.2602,0.498
DIAMONDS TEN CLUBS ACE,0.3522,0.0036,0.6442
DIAMONDS FOUR CLUBS SIX,0.5426,0.0674,0.39
DIAMONDS NINE HEARTS TEN,0.3236,0.0244,0.652
SPADES JACK CLUBS FIVE,0.3902,0.0196,0.5902
HEARTS THREE SPADES TWO,0.6242,0.1274,0.2484
SPADES NINE HEARTS KING,0.3508,0.0068,0.6424
HEARTS SIX DIAMONDS TEN,0.3762,0.0276,0.5962
CLUBS JACK CLUBS THREE,0.3724,0.0212,0.6064
CLUBS SEVEN HEARTS KING,0.3982,0.0084,0.5934
HEARTS FIVE CLUBS TWO,0.6112,0.1352,0.2536
HEARTS QUEEN DIAMONDS SEVEN,0.3928,0.0146,0.5926
CLUBS EIGHT DIAMONDS JACK,0.2584,0.0568,0.6848
CLUBS SIX SPADES FIVE,0.5338,0.0618,0.4044
HEARTS SIX HEARTS JACK,0.372,0.0162,0.6118
CLUBS TEN DIAMONDS THREE,0.4046,0.0296,0.5658
CLUBS FIVE HEARTS JACK,0.3906,0.0166,0.5928
DIAMONDS ACE SPADES SIX,0.383,0.0044,0.6126
HEARTS SEVEN DIAMONDS ACE,0.3746,0.0056,0.6198
SPADES KING SPADES JACK,0.3416,0.0052,0.6532
SPADES QUEEN HEARTS FIVE,0.4042,0.0116,0.5842
HEARTS FOUR CLUBS THREE,0.5484,0.0654,0.3862
SPADES TWO HEARTS NINE,0.2832,0.0914,0.6254
CLUBS JACK HEARTS TWO,0.2844,0.0532,0.6624
CLUBS FOUR DIAMONDS SEVEN,0.5536,0.0588,0.3876
CLUBS NINE DIAMONDS NINE,0.1598,0.0566,0.7836
HEARTS FOUR DIAMONDS SEVEN,0.5412,0.069,0.3898
DIAMONDS QUEEN HEARTS TEN,0.3388,0.011,0.6502
SPADES KING CLUBS SEVEN,0.3902,0.007,0.6028
SPADES KING SPADES THREE,0.3686,0.0084,0.623
HEARTS SIX SPADES EIGHT,0.259,0.3528,0.3882
CLUBS NINE CLUBS SEVEN,0.3502,0.0412,0.6086
CLUBS TEN CLUBS ACE,0.3516,0.0048,0.6436
CLUBS SEVEN DIAMONDS FIVE,0.5268,0.061,0.4122
HEARTS EIGHT DIAMONDS THREE,0.2568,0.5012,0.242
CLUBS TEN DIAMONDS NINE,0.336,0.0264,0.6376
HEARTS FIVE SPADES FIVE,0.298,0.09,0.612
CLUBS JACK CLUBS SEVEN,0.368,0.016,0.616
SPADES FIVE DIAMONDS FIVE,0.2964,0.0888,0.6148
DIAMONDS FOUR SPADES QUEEN,0.3964,0.0106,0.593
DIAMONDS KING SPADES FOUR,0.3928,0.0084,0.5988
DIAMONDS FOUR CLUBS THREE,0.5446,0.0628,0.3926
HEARTS FOUR DIAMONDS QUEEN,0.3876,0.0128,0.5996
HEARTS TWO CLUBS QUEEN,0.2886,0.0382,0.6732
SPADES SEVEN DIAMONDS ACE,0.3776,0.0048,0.6176
CLUBS THREE HEARTS TEN,0.3924,0.0296,0.578
SPADES EIGHT DIAMONDS KING,0.2618,0.0364,0.7018
SPADES SEVEN DIAMONDS SEVEN,0.2734,0.0902,0.6364
SPADES SIX HEARTS TEN,0.3864,0.0296,0.584
SPADES SEVEN HEARTS ACE,0.3794,0.006,0.6146
SPADES FIVE DIAMONDS TEN,0.3734,0.0236,0.603
SPADES SIX CLUBS THREE,0.5656,0.0578,0.3766
CLUBS THREE HEARTS NINE,0.3966,0.0436,0.5598
HEARTS EIGHT DIAMONDS ACE,0.2428,0.0312,0.726
DIAMONDS THREE DIAMONDS SEVEN,0.5508,0.063,0.3862
HEARTS SIX CLUBS ACE,0.3952,0.0038,0.601
HEARTS SEVEN HEARTS QUEEN,0.3718,0.011,0.6172
SPADES FOUR HEARTS ACE,0.3932,0.0056,0.6012
DIAMONDS TEN HEARTS TEN,0.1642,0.0536,0.7822
SPADES EIGHT DIAMONDS TEN,0.2522,0.0696,0.6782
CLUBS TWO DIAMONDS QUEEN,0.2654,0.037,0.6976
SPADES QUEEN SPADES SEVEN,0.3778,0.0122,0.61
SPADES FIVE DIAMONDS NINE,0.369,0.0416,0.5894
SPADES TEN HEARTS TWO,0.2804,0.069,0.6506
SPADES KING HEARTS SIX,0.3842,0.008,0.6078
SPADES TWO DIAMONDS SIX,0.6332,0.1312,0.2356
CLUBS SEVEN DIAMONDS TEN,0.3526,0.0256,0.6218
SPADES TEN HEARTS ACE,0.358,0.0038,0.6382
SPADES ACE SPADES FIVE,0.352,0.0048,0.6432
CLUBS SEVEN CLUBS FOUR,0.5128,0.0606,0.4266
DIAMONDS QUEEN CLUBS ACE,0.3564,0.0064,0.6372
HEARTS FIVE HEARTS JACK,0.3734,0.0178,0.6088
CLUBS FOUR CLUBS KING,0.378,0.01,0.612
CLUBS NINE HEARTS QUEEN,0.3568,0.0108,0.6324
HEARTS JACK DIAMONDS SEVEN,0.3844,0.0186,0.597
SPADES QUEEN CLUBS ACE,0.3678,0.0048,0.6274
HEARTS FOUR SPADES EIGHT,0.2712,0.477,0.2518
SPADES SEVEN CLUBS ACE,0.3914,0.0042,0.6044
SPADES ACE SPADES KING,0.3396,0.0044,0.656
SPADES JACK SPADES NINE,0.3282,0.0128,0.659
CLUBS NINE SPADES JACK,0.3494,0.0166,0.634
CLUBS SEVEN HEARTS JACK,0.3894,0.019,0.5916
SPADES THREE CLUBS QUEEN,0.4014,0.0152,0.5834
HEARTS SIX CLUBS FIVE,0.528,0.0684,0.4036
HEARTS SEVEN HEARTS SIX,0.5004,0.058,0.4416
SPADES JACK HEARTS FIVE,0.3906,0.02,0.5894
HEARTS SEVEN CLUBS QUEEN,0.396,0.0092,0.5948
DIAMONDS JACK HEARTS TEN,0.3346,0.0142,0.6512
SPADES SIX DIAMONDS NINE,0.3616,0.0438,0.5946
CLUBS TEN SPADES THREE,0.3926,0.026,0.5814
SPADES TEN CLUBS QUEEN,0.3598,0.0106,0.6296
HEARTS FOUR HEARTS TEN,0.377,0.027,0.596
SPADES FIVE DIAMONDS QUEEN,0.3812,0.0114,0.6074
SPADES QUEEN HEARTS FOUR,0.3972,0.0134,0.5894
CLUBS NINE SPADES FIVE,0.384,0.0424,0.5736
SPADES FOUR DIAMONDS FIVE,0.533,0.0618,0.4052
DIAMONDS FOUR CLUBS NINE,0.4076,0.0406,0.5518
SPADES FOUR HEARTS KING,0.3964,0.008,0.5956
SPADES NINE DIAMONDS JACK,0.3276,0.0156,0.6568
CLUBS FOUR HEARTS TEN,0.3944,0.0276,0.578
DIAMONDS QUEEN DIAMONDS SIX,0.334,0.013,0.653
DIAMONDS KING SPADES FIVE,0.3888,0.0094,0.6018
CLUBS JACK SPADES THREE,0.3974,0.0174,0.5852
CLUBS EIGHT SPADES EIGHT,0.1324,0.0786,0.789
SPADES KING HEARTS FIVE,0.4004,0.0082,0.5914
HEARTS EIGHT HEARTS SEVEN,0.2436,0.265,0.4914
DIAMONDS SEVEN DIAMONDS FIVE,0.5176,0.0664,0.416
SPADES EIGHT CLUBS QUEEN,0.2712,0.046,0.6828
HEARTS FIVE CLUBS QUEEN,0.389,0.0122,0.5988
SPADES THREE HEARTS NINE,0.3854,0.0494,0.5652
SPADES JACK CLUBS SIX,0.3918,0.021,0.5872
SPADES QUEEN HEARTS QUEEN,0.1718,0.0212,0.807
DIAMONDS ACE CLUBS KING,0.3486,0.0058,0.6456
SPADES SEVEN HEARTS TEN,0.3684,0.0308,0.6008
DIAMONDS FOUR HEARTS SEVEN,0.5428,0.0634,0.3938
CLUBS NINE HEARTS TWO,0.2762,0.1086,0.6152
HEARTS ACE DIAMONDS SEVEN,0.3762,0.005,0.6188
SPADES JACK DIAMONDS FIVE,0.3856,0.0214,0.593
HEARTS NINE DIAMONDS FIVE,0.3806,0.0374,0.582
SPADES ACE SPADES TWO,0.264,0.0146,0.7214
CLUBS SEVEN SPADES SIX,0.5272,0.0616,0.4112
SPADES NINE HEARTS ACE,0.3614,0.004,0.6346
SPADES SEVEN SPADES FIVE,0.496,0.057,0.447
DIAMONDS ACE DIAMONDS JACK,0.314,0.0044,0.6816
HEARTS SEVEN SPADES THREE,0.566,0.0652,0.3688
HEARTS TWO DIAMONDS SIX,0.6348,0.1384,0.2268
DIAMONDS SIX DIAMONDS FIVE,0.5246,0.0696,0.4058
SPADES SIX CLUBS QUEEN,0.3958,0.0134,0.5908
CLUBS JACK SPADES NINE,0.35,0.014,0.636
CLUBS NINE SPADES EIGHT,0.2704,0.1074,0.6222
DIAMONDS ACE CLUBS ACE,0.1534,0.0056,0.841
CLUBS FOUR DIAMONDS ACE,0.3786,0.0058,0.6156
HEARTS EIGHT SPADES JACK,0.2724,0.06,0.6676
CLUBS JACK SPADES KING,0.369,0.007,0.624
SPADES ACE HEARTS SEVEN,0.3886,0.0032,0.6082
CLUBS SEVEN SPADES TWO,0.6372,0.135,0.2278
CLUBS EIGHT CLUBS FOUR,0.2444,0.452,0.3036
HEARTS SIX DIAMONDS JACK,0.3846,0.0192,0.5962
HEARTS SIX DIAMONDS KING,0.3842,0.0074,0.6084
SPADES TWO CLUBS KING,0.2802,0.03,0.6898
SPADES QUEEN HEARTS TWO,0.2832,0.0432,0.6736
HEARTS EIGHT CLUBS FOUR,0.2628,0.4714,0.2658
CLUBS TEN SPADES NINE,0.3278,0.024,0.6482
CLUBS FIVE DIAMONDS TEN,0.388,0.027,0.585
SPADES ACE HEARTS TEN,0.3624,0.004,0.6336
CLUBS JACK HEARTS THREE,0.4008,0.017,0.5822
CLUBS THREE CLUBS ACE,0.3706,0.0052,0.6242
SPADES TEN DIAMONDS SEVEN,0.366,0.022,0.612
HEARTS THREE DIAMONDS TEN,0.3918,0.0334,0.5748
SPADES ACE HEARTS TWO,0.2864,0.016,0.6976
CLUBS KING HEARTS TEN,0.364,0.0074,0.6286
CLUBS JACK DIAMONDS KING,0.3604,0.009,0.6306
HEARTS FOUR HEARTS QUEEN,0.3838,0.0158,0.6004
DIAMONDS ACE HEARTS TEN,0.3602,0.0036,0.6362
CLUBS TEN CLUBS THREE,0.3812,0.0238,0.595
HEARTS QUEEN DIAMONDS FIVE,0.3892,0.0162,0.5946
DIAMONDS FOUR HEARTS TEN,0.3836,0.0258,0.5906
CLUBS TEN DIAMONDS TEN,0.1698,0.0482,0.782
HEARTS FIVE CLUBS THREE,0.5472,0.0664,0.3864
SPADES EIGHT SPADES SEVEN,0.2384,0.2704,0.4912
SPADES KING DIAMONDS FIVE,0.3802,0.0088,0.611
DIAMONDS JACK HEARTS NINE,0.3308,0.02,0.6492
SPADES JACK HEARTS JACK,0.1746,0.0362,0.7892
CLUBS TEN SPADES TWO,0.2856,0.0776,0.6368
CLUBS FIVE CLUBS TWO,0.57,0.1408,0.2892
SPADES FIVE CLUBS KING,0.3938,0.0064,0.5998
HEARTS ACE DIAMONDS NINE,0.3542,0.0054,0.6404
CLUBS FOUR SPADES FIVE,0.54,0.065,0.395
DIAMONDS QUEEN DIAMONDS NINE,0.302,0.012,0.686
DIAMONDS FOUR HEARTS NINE,0.3824,0.043,0.5746
SPADES NINE SPADES SIX,0.3552,0.0374,0.6074
SPADES QUEEN HEARTS JACK,0.3508,0.01,0.6392
SPADES TEN HEARTS FOUR,0.3836,0.022,0.5944
CLUBS EIGHT SPADES TEN,0.2658,0.0848,0.6494
CLUBS FOUR HEARTS NINE,0.4008,0.0358,0.5634
SPADES ACE DIAMONDS KING,0.351,0.0032,0.6458
HEARTS SEVEN DIAMONDS SIX,0.5244,0.0604,0.4152
DIAMONDS SIX CLUBS QUEEN,0.3904,0.0116,0.598
CLUBS TEN CLUBS TWO,0.2684,0.0676,0.664
HEARTS SIX DIAMONDS SIX,0.2874,0.0888,0.6238
DIAMONDS TEN DIAMONDS SEVEN,0.3166,0.0292,0.6542
CLUBS TWO HEARTS JACK,0.2838,0.055,0.6612
HEARTS THREE CLUBS FOUR,0.5568,0.0666,0.3766
CLUBS JACK DIAMONDS NINE,0.3298,0.0158,0.6544
CLUBS EIGHT DIAMONDS QUEEN,0.253,0.049,0.698
HEARTS FOUR SPADES FIVE,0.5322,0.0636,0.4042
DIAMONDS JACK CLUBS QUEEN,0.3344,0.012,0.6536
SPADES ACE SPADES FOUR,0.3758,0.0036,0.6206
DIAMONDS NINE HEARTS NINE,0.1608,0.0624,0.7768
CLUBS TEN SPADES SEVEN,0.369,0.0252,0.6058
SPADES FOUR CLUBS ACE,0.3866,0.0058,0.6076
DIAMONDS FOUR SPADES KING,0.3906,0.009,0.6004
HEARTS SEVEN HEARTS KING,0.377,0.0092,0.6138
SPADES NINE DIAMONDS FIVE,0.376,0.0438,0.5802
