opposingHand,winningChance,drawChance,lostChance
HEARTS EIGHT DIAMONDS EIGHT
SPADES THREE HEARTS TEN,0.6848,0.0412,0.274
SPADES SIX DIAMONDS FIVE,0.7562,0.0862,0.1576
HEARTS SIX SPADES SEVEN,0.7672,0.079,0.1538
HEARTS FOUR CLUBS KING,0.6708,0.0122,0.317
HEARTS FOUR DIAMONDS TEN,0.675,0.0472,0.2778
SPADES QUEEN CLUBS KING,0.5356,0.0048,0.4596
SPADES KING HEARTS QUEEN,0.5192,0.0052,0.4756
SPADES JACK SPADES TWO,0.632,0.0338,0.3342
SPADES FOUR SPADES THREE,0.7024,0.0928,0.2048
SPADES ACE DIAMONDS ACE,0.198,0.0042,0.7978
CLUBS JACK CLUBS TWO,0.653,0.0318,0.3152
SPADES JACK SPADES TEN,0.4964,0.0238,0.4798
HEARTS SEVEN SPADES EIGHT,0.7906,0.0792,0.1302
CLUBS ACE HEARTS JACK,0.525,0.004,0.471
SPADES FIVE DIAMONDS TEN,0.6784,0.0428,0.2788
HEARTS SEVEN SPADES THREE,0.7812,0.0772,0.1416
CLUBS NINE CLUBS THREE,0.6434,0.0586,0.298
HEARTS FOUR DIAMONDS FIVE,0.7308,0.1008,0.1684
CLUBS SIX DIAMONDS QUEEN,0.666,0.0212,0.3128
HEARTS TWO HEARTS QUEEN,0.642,0.0206,0.3374
SPADES JACK HEARTS NINE,0.5392,0.0268,0.434
SPADES NINE CLUBS THREE,0.685,0.0574,0.2576
HEARTS FOUR DIAMONDS QUEEN,0.6634,0.0244,0.3122
DIAMONDS TWO SPADES SEVEN,0.7922,0.083,0.1248
SPADES EIGHT DIAMONDS TEN,0.6334,0.0484,0.3182
HEARTS TWO SPADES THREE,0.7526,0.104,0.1434
SPADES TWO DIAMONDS SIX,0.7784,0.09,0.1316
DIAMONDS TWO CLUBS ACE,0.6482,0.0046,0.3472
SPADES TEN CLUBS TWO,0.6614,0.0534,0.2852
CLUBS TWO SPADES TWO,0.6316,0.1812,0.1872
DIAMONDS THREE DIAMONDS KING,0.641,0.0102,0.3488
SPADES ACE HEARTS SEVEN,0.6552,0.002,0.3428
HEARTS FIVE SPADES JACK,0.6738,0.0316,0.2946
CLUBS EIGHT SPADES FIVE,0.8052,0.0872,0.1076
SPADES NINE HEARTS KING,0.5356,0.009,0.4554
SPADES KING SPADES JACK,0.5,0.0062,0.4938
HEARTS SEVEN CLUBS EIGHT,0.79,0.0746,0.1354
HEARTS SIX HEARTS TWO,0.7366,0.0984,0.165
DIAMONDS QUEEN DIAMONDS TEN,0.5038,0.0128,0.4834
CLUBS EIGHT CLUBS QUEEN,0.6202,0.0302,0.3496
CLUBS EIGHT SPADES THREE,0.8374,0.085,0.0776
DIAMONDS SIX HEARTS NINE,0.682,0.0582,0.2598
HEARTS FIVE SPADES THREE,0.7538,0.0974,0.1488
CLUBS SIX CLUBS QUEEN,0.6298,0.0228,0.3474
SPADES TEN SPADES THREE,0.6418,0.0444,0.3138
DIAMONDS JACK CLUBS ACE,0.5268,0.0042,0.469
CLUBS TEN SPADES EIGHT,0.6424,0.0418,0.3158
HEARTS FIVE HEARTS FOUR,0.7024,0.093,0.2046
HEARTS QUEEN CLUBS ACE,0.5264,0.003,0.4706
DIAMONDS THREE CLUBS TWO,0.7498,0.1044,0.1458
HEARTS FIVE DIAMONDS JACK,0.674,0.0308,0.2952
HEARTS FIVE SPADES FIVE,0.6404,0.1714,0.1882
DIAMONDS TEN DIAMONDS SIX,0.636,0.0456,0.3184
SPADES QUEEN SPADES SIX,0.626,0.0242,0.3498
SPADES JACK HEARTS QUEEN,0.5222,0.0094,0.4684
SPADES ACE DIAMONDS FIVE,0.6538,0.0042,0.342
HEARTS JACK HEARTS TEN,0.4768,0.0238,0.4994
CLUBS TWO HEARTS QUEEN,0.6836,0.0224,0.294
DIAMONDS KING HEARTS KING,0.1852,0.0318,0.783
HEARTS FOUR HEARTS THREE,0.7048,0.1004,0.1948
DIAMONDS KING DIAMONDS TEN,0.5028,0.0068,0.4904
SPADES ACE DIAMONDS QUEEN,0.5292,0.0036,0.4672
DIAMONDS SIX CLUBS QUEEN,0.673,0.0198,0.3072
SPADES KING DIAMONDS TEN,0.5334,0.008,0.4586
SPADES SIX HEARTS JACK,0.664,0.0314,0.3046
SPADES TEN HEARTS THREE,0.6808,0.047,0.2722
DIAMONDS THREE SPADES JACK,0.6752,0.0334,0.2914
CLUBS SIX DIAMONDS FOUR,0.7588,0.0856,0.1556
HEARTS SEVEN HEARTS JACK,0.6388,0.0332,0.328
DIAMONDS TEN HEARTS JACK,0.5068,0.0252,0.468
DIAMONDS THREE SPADES KING,0.6652,0.0122,0.3226
DIAMONDS THREE HEARTS JACK,0.6732,0.0348,0.292
SPADES TWO HEARTS TEN,0.6768,0.0518,0.2714
CLUBS THREE CLUBS ACE,0.6212,0.0042,0.3746
CLUBS JACK CLUBS ACE,0.511,0.003,0.486
CLUBS TEN DIAMONDS SIX,0.6696,0.0468,0.2836
DIAMONDS KING SPADES SIX,0.6576,0.0094,0.333
HEARTS FIVE DIAMONDS FIVE,0.6328,0.1926,0.1746
SPADES ACE SPADES TEN,0.508,0.0036,0.4884
CLUBS FOUR CLUBS QUEEN,0.644,0.0222,0.3338
HEARTS QUEEN DIAMONDS SEVEN,0.6744,0.0222,0.3034
SPADES ACE HEARTS QUEEN,0.548,0.002,0.45
DIAMONDS THREE SPADES TEN,0.6836,0.0438,0.2726
CLUBS EIGHT HEARTS QUEEN,0.6828,0.0306,0.2866
HEARTS SIX HEARTS JACK,0.634,0.0348,0.3312
SPADES ACE HEARTS TWO,0.6542,0.0054,0.3404
HEARTS TWO CLUBS FIVE,0.7532,0.099,0.1478
CLUBS FOUR HEARTS JACK,0.6684,0.0326,0.299
DIAMONDS THREE HEARTS TWO,0.7724,0.1006,0.127
SPADES KING DIAMONDS FIVE,0.6558,0.0116,0.3326
CLUBS SEVEN SPADES SIX,0.7674,0.0808,0.1518
SPADES SEVEN DIAMONDS FOUR,0.7726,0.0802,0.1472
DIAMONDS ACE CLUBS ACE,0.1996,0.0028,0.7976
DIAMONDS FIVE DIAMONDS FOUR,0.7046,0.0984,0.197
CLUBS THREE HEARTS KING,0.664,0.0124,0.3236
CLUBS FOUR DIAMONDS FOUR,0.6378,0.1748,0.1874
HEARTS QUEEN HEARTS NINE,0.5292,0.015,0.4558
SPADES SIX HEARTS ACE,0.6612,0.0046,0.3342
SPADES QUEEN SPADES TEN,0.493,0.0134,0.4936
SPADES SEVEN DIAMONDS FIVE,0.7642,0.0778,0.158
SPADES JACK CLUBS SEVEN,0.67,0.0278,0.3022
SPADES ACE SPADES QUEEN,0.5034,0.0036,0.493
DIAMONDS JACK DIAMONDS FIVE,0.6344,0.0348,0.3308
DIAMONDS THREE DIAMONDS SIX,0.7364,0.0896,0.174
SPADES KING DIAMONDS KING,0.1996,0.037,0.7634
HEARTS JACK DIAMONDS FIVE,0.6832,0.0314,0.2854
CLUBS FOUR HEARTS NINE,0.6786,0.0606,0.2608
SPADES SIX HEARTS KING,0.66,0.0122,0.3278
DIAMONDS TWO CLUBS QUEEN,0.6838,0.021,0.2952
SPADES EIGHT DIAMONDS FIVE,0.815,0.0822,0.1028
DIAMONDS KING SPADES TWO,0.6776,0.0148,0.3076
CLUBS FIVE HEARTS JACK,0.6658,0.0348,0.2994
HEARTS FOUR CLUBS QUEEN,0.6792,0.0216,0.2992
HEARTS TWO CLUBS THREE,0.7596,0.1026,0.1378
CLUBS FIVE SPADES FIVE,0.625,0.1758,0.1992
CLUBS THREE SPADES THREE,0.6274,0.1776,0.195
CLUBS FIVE DIAMONDS SEVEN,0.7662,0.085,0.1488
HEARTS THREE DIAMONDS FOUR,0.7438,0.1062,0.15
SPADES EIGHT HEARTS KING,0.6876,0.0228,0.2896
HEARTS FOUR SPADES TWO,0.7508,0.1052,0.144
SPADES ACE DIAMONDS FOUR,0.6532,0.0042,0.3426
CLUBS EIGHT HEARTS THREE,0.8438,0.0876,0.0686
SPADES ACE SPADES EIGHT,0.6228,0.0248,0.3524
CLUBS TWO HEARTS ACE,0.6538,0.0052,0.341
CLUBS FOUR HEARTS ACE,0.6372,0.0048,0.358
CLUBS TEN SPADES FOUR,0.66,0.0456,0.2944
CLUBS NINE DIAMONDS FOUR,0.687,0.0586,0.2544
SPADES QUEEN DIAMONDS KING,0.5246,0.006,0.4694
DIAMONDS FIVE CLUBS QUEEN,0.6766,0.0238,0.2996
SPADES SEVEN DIAMONDS TEN,0.6582,0.0448,0.297
CLUBS TEN CLUBS THREE,0.646,0.0448,0.3092
HEARTS SIX SPADES QUEEN,0.6716,0.019,0.3094
CLUBS FIVE DIAMONDS KING,0.6668,0.0122,0.321
HEARTS TWO SPADES FIVE,0.7582,0.0972,0.1446
HEARTS SEVEN CLUBS NINE,0.664,0.0594,0.2766
CLUBS EIGHT DIAMONDS NINE,0.6248,0.0546,0.3206
HEARTS TWO CLUBS KING,0.678,0.0152,0.3068
SPADES FOUR HEARTS ACE,0.6362,0.0032,0.3606
CLUBS SIX CLUBS FIVE,0.6988,0.0856,0.2156
DIAMONDS TWO HEARTS QUEEN,0.6666,0.0218,0.3116
CLUBS SIX DIAMONDS JACK,0.6756,0.0306,0.2938
SPADES SIX DIAMONDS QUEEN,0.6568,0.0212,0.322
SPADES TEN DIAMONDS QUEEN,0.525,0.014,0.461
DIAMONDS THREE HEARTS THREE,0.6476,0.1876,0.1648
SPADES SIX HEARTS QUEEN,0.663,0.0202,0.3168
CLUBS SEVEN SPADES FOUR,0.7696,0.0768,0.1536
CLUBS FOUR DIAMONDS NINE,0.6698,0.0612,0.269
CLUBS NINE DIAMONDS NINE,0.1896,0.1578,0.6526
HEARTS FIVE DIAMONDS SIX,0.7638,0.0866,0.1496
SPADES ACE DIAMONDS JACK,0.5258,0.0054,0.4688
CLUBS JACK HEARTS SIX,0.681,0.027,0.292
SPADES ACE DIAMONDS THREE,0.6484,0.0028,0.3488
HEARTS SIX HEARTS THREE,0.7314,0.0844,0.1842
SPADES TEN DIAMONDS TEN,0.1844,0.1256,0.69
DIAMONDS ACE HEARTS NINE,0.5582,0.0052,0.4366
SPADES ACE CLUBS ACE,0.1968,0.0018,0.8014
SPADES QUEEN CLUBS NINE,0.5498,0.018,0.4322
CLUBS SEVEN HEARTS JACK,0.6724,0.0386,0.289
SPADES KING HEARTS SIX,0.667,0.0102,0.3228
CLUBS TWO DIAMONDS SEVEN,0.7928,0.0918,0.1154
CLUBS TEN DIAMONDS TWO,0.6904,0.0444,0.2652
CLUBS NINE DIAMONDS QUEEN,0.5348,0.0184,0.4468
HEARTS FOUR DIAMONDS JACK,0.6762,0.0374,0.2864
HEARTS TWO DIAMONDS FIVE,0.7578,0.104,0.1382
CLUBS THREE SPADES TWO,0.7436,0.1036,0.1528
SPADES EIGHT CLUBS THREE,0.829,0.096,0.075
SPADES SIX DIAMONDS SEVEN,0.7716,0.081,0.1474
DIAMONDS KING CLUBS KING,0.1926,0.0298,0.7776
DIAMONDS THREE CLUBS FOUR,0.7508,0.0958,0.1534
DIAMONDS ACE DIAMONDS FOUR,0.6118,0.0046,0.3836
SPADES JACK DIAMONDS JACK,0.1918,0.0938,0.7144
SPADES TEN DIAMONDS SIX,0.6816,0.0424,0.276
DIAMONDS ACE CLUBS FOUR,0.637,0.003,0.36
CLUBS TEN DIAMONDS ACE,0.5442,0.0018,0.454
CLUBS EIGHT CLUBS FIVE,0.7616,0.0806,0.1578
SPADES FIVE HEARTS ACE,0.6402,0.0038,0.356
SPADES QUEEN CLUBS ACE,0.5382,0.0028,0.459
CLUBS FIVE DIAMONDS FIVE,0.642,0.182,0.176
SPADES SEVEN HEARTS KING,0.6554,0.0136,0.331
SPADES TWO DIAMONDS FIVE,0.7496,0.0944,0.156
HEARTS THREE CLUBS KING,0.6792,0.014,0.3068
SPADES FIVE HEARTS NINE,0.6596,0.0648,0.2756
CLUBS ACE DIAMONDS FOUR,0.643,0.005,0.352
SPADES TEN CLUBS ACE,0.5364,0.0038,0.4598
HEARTS THREE HEARTS TEN,0.643,0.0438,0.3132
CLUBS JACK DIAMONDS FIVE,0.6746,0.0348,0.2906
DIAMONDS THREE SPADES NINE,0.689,0.064,0.247
DIAMONDS THREE DIAMONDS SEVEN,0.7404,0.0828,0.1768
DIAMONDS TWO DIAMONDS TEN,0.6442,0.0456,0.3102
CLUBS JACK DIAMONDS QUEEN,0.5186,0.0136,0.4678
SPADES SIX SPADES FOUR,0.7224,0.0804,0.1972
HEARTS SIX CLUBS QUEEN,0.6652,0.0188,0.316
CLUBS SIX HEARTS QUEEN,0.6576,0.0216,0.3208
CLUBS TWO DIAMONDS SIX,0.776,0.0892,0.1348
DIAMONDS TWO SPADES FIVE,0.7606,0.0956,0.1438
DIAMONDS THREE HEARTS FOUR,0.7556,0.1024,0.142
CLUBS FIVE CLUBS ACE,0.6148,0.0044,0.3808
CLUBS JACK HEARTS QUEEN,0.514,0.011,0.475
SPADES QUEEN CLUBS QUEEN,0.2038,0.0622,0.734
SPADES JACK HEARTS TEN,0.5278,0.0238,0.4484
SPADES KING HEARTS TEN,0.518,0.0084,0.4736
SPADES KING CLUBS FOUR,0.6622,0.011,0.3268
DIAMONDS THREE DIAMONDS JACK,0.641,0.0302,0.3288
SPADES JACK SPADES FOUR,0.6304,0.0306,0.339
CLUBS FOUR DIAMONDS SIX,0.755,0.0894,0.1556
DIAMONDS QUEEN HEARTS ACE,0.5294,0.0068,0.4638
DIAMONDS THREE HEARTS FIVE,0.7338,0.1014,0.1648
DIAMONDS TWO SPADES NINE,0.6948,0.0622,0.243
CLUBS JACK CLUBS EIGHT,0.6154,0.038,0.3466
CLUBS THREE DIAMONDS NINE,0.6796,0.058,0.2624
SPADES TEN CLUBS FOUR,0.672,0.047,0.281
HEARTS FOUR SPADES FIVE,0.7392,0.0948,0.166
CLUBS ACE CLUBS QUEEN,0.503,0.0044,0.4926
DIAMONDS SEVEN HEARTS JACK,0.6782,0.034,0.2878
HEARTS FIVE HEARTS QUEEN,0.636,0.0202,0.3438
DIAMONDS ACE HEARTS KING,0.5166,0.004,0.4794
HEARTS FOUR SPADES SEVEN,0.7784,0.0828,0.1388
SPADES KING SPADES TEN,0.4856,0.009,0.5054
SPADES KING HEARTS ACE,0.5296,0.0038,0.4666
DIAMONDS ACE SPADES SIX,0.653,0.0042,0.3428
DIAMONDS THREE DIAMONDS FIVE,0.7092,0.0922,0.1986
SPADES QUEEN CLUBS SEVEN,0.6768,0.0176,0.3056
CLUBS SIX HEARTS NINE,0.664,0.0604,0.2756
HEARTS SEVEN SPADES FOUR,0.7696,0.0776,0.1528
SPADES TEN SPADES SIX,0.638,0.0432,0.3188
HEARTS SEVEN SPADES NINE,0.676,0.0556,0.2684
CLUBS SIX CLUBS ACE,0.6156,0.0016,0.3828
CLUBS THREE HEARTS TEN,0.6666,0.0476,0.2858
CLUBS TEN HEARTS THREE,0.6804,0.0454,0.2742
CLUBS FIVE HEARTS QUEEN,0.6606,0.02,0.3194
CLUBS EIGHT CLUBS SIX,0.7384,0.0826,0.179
HEARTS SIX DIAMONDS NINE,0.6626,0.0596,0.2778
DIAMONDS QUEEN DIAMONDS FIVE,0.639,0.0208,0.3402
SPADES SIX HEARTS NINE,0.662,0.0604,0.2776
CLUBS QUEEN HEARTS NINE,0.5404,0.0194,0.4402
HEARTS FIVE DIAMONDS TEN,0.6806,0.044,0.2754
SPADES KING SPADES TWO,0.6354,0.0104,0.3542
CLUBS EIGHT DIAMONDS QUEEN,0.6656,0.0346,0.2998
DIAMONDS THREE CLUBS KING,0.6694,0.0094,0.3212
CLUBS SEVEN SPADES SEVEN,0.6286,0.1882,0.1832
SPADES EIGHT DIAMONDS NINE,0.6116,0.0582,0.3302
CLUBS SEVEN SPADES FIVE,0.7614,0.0756,0.163
SPADES ACE CLUBS EIGHT,0.6674,0.0282,0.3044
CLUBS EIGHT CLUBS ACE,0.6274,0.0294,0.3432
HEARTS FIVE CLUBS FIVE,0.618,0.1848,0.1972
CLUBS TWO DIAMONDS FOUR,0.7608,0.0994,0.1398
CLUBS SIX SPADES FIVE,0.7378,0.0868,0.1754
CLUBS JACK HEARTS FIVE,0.682,0.0382,0.2798
DIAMONDS JACK HEARTS ACE,0.5374,0.0036,0.459
HEARTS THREE SPADES THREE,0.641,0.188,0.171
CLUBS JACK CLUBS NINE,0.5152,0.0252,0.4596
HEARTS QUEEN CLUBS QUEEN,0.1956,0.0694,0.735
CLUBS TWO HEARTS NINE,0.6828,0.0568,0.2604
SPADES QUEEN HEARTS TEN,0.5394,0.0164,0.4442
DIAMONDS NINE DIAMONDS FIVE,0.6316,0.067,0.3014
CLUBS NINE CLUBS FOUR,0.645,0.0588,0.2962
SPADES TWO HEARTS QUEEN,0.6632,0.023,0.3138
DIAMONDS TEN CLUBS KING,0.5266,0.0094,0.464
DIAMONDS KING DIAMONDS QUEEN,0.4964,0.0046,0.499
CLUBS TWO CLUBS ACE,0.6104,0.0042,0.3854
DIAMONDS THREE CLUBS EIGHT,0.8474,0.0862,0.0664
SPADES EIGHT DIAMONDS ACE,0.6522,0.0288,0.319
DIAMONDS SEVEN HEARTS NINE,0.649,0.059,0.292
SPADES QUEEN CLUBS EIGHT,0.6622,0.0278,0.31
CLUBS FIVE CLUBS TWO,0.7062,0.0902,0.2036
SPADES EIGHT DIAMONDS QUEEN,0.673,0.0272,0.2998
SPADES ACE DIAMONDS TEN,0.5242,0.0036,0.4722
HEARTS ACE HEARTS JACK,0.5,0.0036,0.4964
DIAMONDS JACK CLUBS KING,0.533,0.0048,0.4622
HEARTS THREE CLUBS THREE,0.6316,0.1856,0.1828
CLUBS TEN SPADES JACK,0.5224,0.0242,0.4534
SPADES ACE HEARTS SIX,0.6602,0.0036,0.3362
HEARTS FIVE SPADES TWO,0.755,0.097,0.148
SPADES NINE HEARTS JACK,0.5444,0.0248,0.4308
DIAMONDS NINE CLUBS QUEEN,0.5472,0.0162,0.4366
DIAMONDS TEN CLUBS QUEEN,0.5234,0.0144,0.4622
SPADES THREE CLUBS KING,0.656,0.0114,0.3326
HEARTS FOUR HEARTS KING,0.6382,0.0082,0.3536
CLUBS ACE HEARTS TEN,0.5416,0.0028,0.4556
SPADES EIGHT SPADES TWO,0.7906,0.0796,0.1298
DIAMONDS JACK HEARTS KING,0.536,0.006,0.458
HEARTS SIX DIAMONDS QUEEN,0.6796,0.0206,0.2998
HEARTS FOUR HEARTS TEN,0.6426,0.0388,0.3186
HEARTS FIVE CLUBS ACE,0.6458,0.004,0.3502
CLUBS TEN HEARTS QUEEN,0.532,0.0154,0.4526
HEARTS ACE HEARTS TEN,0.5008,0.0046,0.4946
SPADES KING SPADES QUEEN,0.4962,0.0056,0.4982
CLUBS TEN HEARTS FOUR,0.6758,0.0462,0.278
CLUBS TEN DIAMONDS TEN,0.1776,0.1312,0.6912
HEARTS SEVEN SPADES FIVE,0.7696,0.076,0.1544
DIAMONDS TWO DIAMONDS SIX,0.7518,0.086,0.1622
SPADES JACK DIAMONDS SEVEN,0.6708,0.0352,0.294
SPADES QUEEN HEARTS NINE,0.5352,0.0196,0.4452
SPADES JACK CLUBS FIVE,0.6682,0.028,0.3038
DIAMONDS ACE CLUBS KING,0.523,0.0042,0.4728
CLUBS JACK HEARTS NINE,0.549,0.0264,0.4246
CLUBS FIVE CLUBS FOUR,0.6748,0.0942,0.231
CLUBS SEVEN DIAMONDS FOUR,0.7622,0.083,0.1548
HEARTS TEN HEARTS NINE,0.5088,0.0376,0.4536
HEARTS THREE HEARTS JACK,0.6422,0.0388,0.319
HEARTS FIVE SPADES SIX,0.738,0.0944,0.1676
SPADES NINE DIAMONDS FOUR,0.6788,0.0596,0.2616
CLUBS TEN CLUBS EIGHT,0.6074,0.0452,0.3474
SPADES JACK CLUBS FOUR,0.6672,0.0344,0.2984
HEARTS TEN DIAMONDS FIVE,0.6814,0.0468,0.2718
SPADES QUEEN DIAMONDS TEN,0.5294,0.015,0.4556
SPADES SEVEN CLUBS QUEEN,0.6802,0.019,0.3008
DIAMONDS SEVEN CLUBS QUEEN,0.6726,0.0216,0.3058
CLUBS TEN HEARTS ACE,0.518,0.0028,0.4792
SPADES TEN HEARTS QUEEN,0.527,0.0158,0.4572
HEARTS FIVE CLUBS KING,0.662,0.0128,0.3252
DIAMONDS TWO DIAMONDS NINE,0.647,0.0598,0.2932
SPADES NINE SPADES SIX,0.6272,0.0564,0.3164
DIAMONDS QUEEN CLUBS ACE,0.5356,0.0036,0.4608
HEARTS FOUR CLUBS FOUR,0.6218,0.1856,0.1926
CLUBS SIX SPADES FOUR,0.7392,0.0926,0.1682
CLUBS JACK SPADES FOUR,0.6488,0.0334,0.3178
HEARTS FIVE DIAMONDS KING,0.659,0.0124,0.3286
CLUBS EIGHT SPADES NINE,0.626,0.0476,0.3264
HEARTS KING HEARTS QUEEN,0.4944,0.0064,0.4992
SPADES EIGHT HEARTS TEN,0.6262,0.0504,0.3234
HEARTS TWO DIAMONDS KING,0.6714,0.012,0.3166
CLUBS TWO HEARTS JACK,0.6734,0.0368,0.2898
SPADES SIX HEARTS TEN,0.6576,0.0502,0.2922
HEARTS THREE DIAMONDS TEN,0.6892,0.045,0.2658
SPADES ACE CLUBS SIX,0.6508,0.0032,0.346
SPADES QUEEN SPADES NINE,0.5214,0.0142,0.4644
HEARTS FIVE SPADES FOUR,0.7294,0.0914,0.1792
CLUBS EIGHT CLUBS KING,0.6404,0.0238,0.3358
SPADES THREE SPADES TWO,0.72,0.092,0.188
DIAMONDS THREE SPADES FOUR,0.7466,0.1022,0.1512
DIAMONDS TWO DIAMONDS KING,0.6548,0.0116,0.3336
SPADES JACK HEARTS THREE,0.6784,0.0284,0.2932
HEARTS SEVEN DIAMONDS KING,0.6688,0.013,0.3182
SPADES TEN DIAMONDS ACE,0.5306,0.0038,0.4656
DIAMONDS JACK CLUBS QUEEN,0.5294,0.0116,0.459
CLUBS SIX CLUBS FOUR,0.7044,0.0932,0.2024
HEARTS SIX CLUBS TWO,0.7718,0.0952,0.133
CLUBS NINE DIAMONDS JACK,0.5326,0.0274,0.44
CLUBS SIX DIAMONDS ACE,0.6588,0.0036,0.3376
HEARTS SEVEN HEARTS FOUR,0.7388,0.0814,0.1798
HEARTS THREE DIAMONDS QUEEN,0.6742,0.0214,0.3044
CLUBS NINE HEARTS ACE,0.5438,0.0036,0.4526
SPADES FIVE CLUBS KING,0.6602,0.0102,0.3296
HEARTS FIVE CLUBS FOUR,0.7282,0.0984,0.1734
HEARTS SEVEN SPADES SEVEN,0.6336,0.1746,0.1918
CLUBS SIX DIAMONDS SIX,0.6368,0.1812,0.182
SPADES TEN SPADES TWO,0.6452,0.0422,0.3126
HEARTS FOUR HEARTS ACE,0.623,0.0064,0.3706
CLUBS SEVEN CLUBS TWO,0.7498,0.0758,0.1744
SPADES JACK SPADES THREE,0.6416,0.0334,0.325
HEARTS SEVEN HEARTS NINE,0.63,0.062,0.308
DIAMONDS QUEEN SPADES FOUR,0.6692,0.0196,0.3112
DIAMONDS TEN DIAMONDS SEVEN,0.6398,0.0508,0.3094
SPADES JACK SPADES SIX,0.6376,0.0308,0.3316
HEARTS FIVE HEARTS TWO,0.7212,0.0976,0.1812
SPADES JACK SPADES FIVE,0.6402,0.0314,0.3284
DIAMONDS THREE DIAMONDS TWO,0.7308,0.0974,0.1718
SPADES QUEEN DIAMONDS FOUR,0.6778,0.019,0.3032
DIAMONDS SIX DIAMONDS FOUR,0.719,0.0948,0.1862
SPADES SEVEN HEARTS ACE,0.6608,0.0052,0.334
SPADES QUEEN HEARTS TWO,0.6688,0.021,0.3102
SPADES THREE DIAMONDS NINE,0.6842,0.0602,0.2556
DIAMONDS JACK DIAMONDS SIX,0.6452,0.0384,0.3164
HEARTS FOUR CLUBS ACE,0.6484,0.003,0.3486
CLUBS THREE CLUBS TWO,0.7156,0.0984,0.186
SPADES ACE HEARTS KING,0.5322,0.0048,0.463
DIAMONDS ACE SPADES SEVEN,0.6478,0.0042,0.348
DIAMONDS QUEEN DIAMONDS SIX,0.64,0.0212,0.3388
SPADES FOUR HEARTS QUEEN,0.6564,0.024,0.3196
SPADES TWO CLUBS ACE,0.647,0.0042,0.3488
CLUBS JACK HEARTS TEN,0.5324,0.023,0.4446
DIAMONDS QUEEN HEARTS KING,0.509,0.0072,0.4838
SPADES EIGHT HEARTS JACK,0.6448,0.0406,0.3146
CLUBS JACK HEARTS JACK,0.1802,0.089,0.7308
DIAMONDS THREE CLUBS FIVE,0.747,0.0992,0.1538
CLUBS EIGHT HEARTS FOUR,0.8296,0.0892,0.0812
SPADES EIGHT CLUBS FIVE,0.808,0.0784,0.1136
CLUBS TEN CLUBS FIVE,0.643,0.0434,0.3136
DIAMONDS JACK SPADES FOUR,0.679,0.0316,0.2894
HEARTS THREE CLUBS FOUR,0.7444,0.0992,0.1564
DIAMONDS QUEEN CLUBS TWO,0.663,0.0224,0.3146
SPADES SIX DIAMONDS SIX,0.6262,0.1848,0.189
SPADES KING DIAMONDS SEVEN,0.6636,0.0114,0.325
SPADES JACK DIAMONDS KING,0.5218,0.0078,0.4704
HEARTS FIVE SPADES TEN,0.6782,0.0484,0.2734
HEARTS FIVE HEARTS TEN,0.635,0.04,0.325
CLUBS NINE HEARTS TWO,0.6992,0.0538,0.247
DIAMONDS TWO CLUBS FOUR,0.7608,0.0956,0.1436
HEARTS FIVE HEARTS ACE,0.6084,0.0044,0.3872
HEARTS FOUR DIAMONDS KING,0.6776,0.0168,0.3056
HEARTS FOUR HEARTS TWO,0.7306,0.0898,0.1796
SPADES SEVEN HEARTS TEN,0.658,0.0474,0.2946
CLUBS NINE HEARTS JACK,0.5478,0.0226,0.4296
HEARTS SIX SPADES NINE,0.6704,0.0538,0.2758
DIAMONDS KING DIAMONDS JACK,0.4898,0.0058,0.5044
SPADES TWO HEARTS JACK,0.6732,0.0332,0.2936
CLUBS TWO HEARTS TEN,0.6662,0.0468,0.287
DIAMONDS TEN DIAMONDS NINE,0.5098,0.0374,0.4528
CLUBS FIVE HEARTS TEN,0.6624,0.0476,0.29
SPADES ACE HEARTS NINE,0.5486,0.003,0.4484
DIAMONDS SIX DIAMONDS FIVE,0.7204,0.0848,0.1948
HEARTS ACE DIAMONDS NINE,0.5454,0.0038,0.4508
SPADES NINE HEARTS QUEEN,0.5556,0.018,0.4264
HEARTS SIX SPADES EIGHT,0.792,0.0942,0.1138
DIAMONDS QUEEN HEARTS JACK,0.5192,0.0116,0.4692
SPADES ACE CLUBS QUEEN,0.5424,0.0018,0.4558
CLUBS EIGHT CLUBS FOUR,0.7732,0.0822,0.1446
DIAMONDS TWO DIAMONDS QUEEN,0.6286,0.022,0.3494
SPADES NINE DIAMONDS FIVE,0.665,0.0628,0.2722
CLUBS FOUR HEARTS TEN,0.6536,0.047,0.2994
SPADES NINE HEARTS TWO,0.6842,0.0554,0.2604
CLUBS JACK SPADES SIX,0.68,0.0382,0.2818
SPADES TEN CLUBS FIVE,0.6768,0.0476,0.2756
CLUBS JACK CLUBS QUEEN,0.4902,0.0144,0.4954
DIAMONDS NINE HEARTS QUEEN,0.5368,0.0214,0.4418
DIAMONDS ACE SPADES THREE,0.6492,0.0032,0.3476
HEARTS FOUR CLUBS SEVEN,0.7602,0.087,0.1528
HEARTS SEVEN CLUBS THREE,0.783,0.0882,0.1288
HEARTS TWO CLUBS QUEEN,0.6686,0.024,0.3074
HEARTS SIX DIAMONDS ACE,0.6646,0.0046,0.3308
DIAMONDS QUEEN HEARTS NINE,0.5456,0.021,0.4334
DIAMONDS ACE SPADES FIVE,0.6294,0.004,0.3666
HEARTS TWO CLUBS ACE,0.658,0.0032,0.3388
CLUBS NINE SPADES FIVE,0.6696,0.0626,0.2678
CLUBS TWO DIAMONDS TEN,0.6818,0.0446,0.2736
SPADES QUEEN HEARTS ACE,0.533,0.0024,0.4646
SPADES FIVE DIAMONDS NINE,0.6772,0.0542,0.2686
CLUBS TEN SPADES THREE,0.6944,0.0416,0.264
SPADES QUEEN DIAMONDS QUEEN,0.1864,0.0716,0.742
SPADES JACK DIAMONDS FIVE,0.6638,0.0316,0.3046
CLUBS TEN HEARTS SIX,0.6858,0.043,0.2712
SPADES KING HEARTS THREE,0.6888,0.011,0.3002
CLUBS EIGHT DIAMONDS SEVEN,0.7888,0.0766,0.1346
CLUBS SEVEN DIAMONDS QUEEN,0.6774,0.0218,0.3008
HEARTS SIX DIAMONDS FIVE,0.7554,0.0916,0.153
DIAMONDS SEVEN DIAMONDS FOUR,0.7302,0.0838,0.186
CLUBS SEVEN DIAMONDS KING,0.6716,0.0106,0.3178
SPADES TEN SPADES FOUR,0.6316,0.0476,0.3208
CLUBS TEN CLUBS FOUR,0.6312,0.0454,0.3234
CLUBS NINE CLUBS SEVEN,0.6246,0.0554,0.32
CLUBS FIVE CLUBS THREE,0.698,0.09,0.212
CLUBS FOUR DIAMONDS KING,0.657,0.0082,0.3348
CLUBS EIGHT SPADES TEN,0.6382,0.042,0.3198
SPADES FIVE SPADES TWO,0.7138,0.0934,0.1928
SPADES SEVEN SPADES FIVE,0.7242,0.0786,0.1972
HEARTS THREE DIAMONDS JACK,0.6834,0.0316,0.285
HEARTS THREE DIAMONDS NINE,0.6824,0.058,0.2596
CLUBS EIGHT HEARTS TWO,0.8508,0.0892,0.06
HEARTS FIVE CLUBS SEVEN,0.7698,0.08,0.1502
CLUBS THREE HEARTS ACE,0.6494,0.0034,0.3472
HEARTS SEVEN DIAMONDS NINE,0.6728,0.057,0.2702
SPADES KING DIAMONDS FOUR,0.6624,0.0132,0.3244
SPADES EIGHT CLUBS QUEEN,0.6578,0.0266,0.3156
SPADES EIGHT CLUBS ACE,0.6658,0.0266,0.3076
CLUBS THREE SPADES FOUR,0.7318,0.1052,0.163
DIAMONDS QUEEN HEARTS TEN,0.5188,0.0176,0.4636
HEARTS SIX DIAMONDS FOUR,0.76,0.0858,0.1542
CLUBS SEVEN HEARTS THREE,0.7872,0.0844,0.1284
SPADES KING SPADES THREE,0.6428,0.0134,0.3438
HEARTS SEVEN CLUBS SEVEN,0.6344,0.1864,0.1792
DIAMONDS THREE DIAMONDS TEN,0.6408,0.0498,0.3094
HEARTS KING CLUBS KING,0.1944,0.0314,0.7742
DIAMONDS TWO SPADES TEN,0.6758,0.0438,0.2804
SPADES SEVEN CLUBS TWO,0.7934,0.0764,0.1302
SPADES ACE DIAMONDS TWO,0.6472,0.0032,0.3496
CLUBS FIVE HEARTS ACE,0.6432,0.0048,0.352
SPADES KING CLUBS THREE,0.6566,0.0162,0.3272
SPADES FOUR DIAMONDS SIX,0.7504,0.0938,0.1558
SPADES QUEEN SPADES THREE,0.6294,0.0192,0.3514
SPADES THREE DIAMONDS FIVE,0.7354,0.0972,0.1674
CLUBS NINE HEARTS NINE,0.1792,0.1632,0.6576
CLUBS KING DIAMONDS FIVE,0.6748,0.0114,0.3138
DIAMONDS TEN HEARTS NINE,0.519,0.0394,0.4416
CLUBS FOUR DIAMONDS JACK,0.675,0.0318,0.2932
CLUBS THREE HEARTS JACK,0.6684,0.0346,0.297
DIAMONDS KING DIAMONDS FOUR,0.6294,0.0118,0.3588
SPADES JACK CLUBS ACE,0.5242,0.0018,0.474
DIAMONDS TEN HEARTS TEN,0.172,0.1266,0.7014
SPADES SIX SPADES THREE,0.7136,0.0922,0.1942
DIAMONDS JACK HEARTS JACK,0.1756,0.0944,0.73
HEARTS FOUR SPADES EIGHT,0.825,0.0854,0.0896
CLUBS TWO DIAMONDS JACK,0.6634,0.037,0.2996
CLUBS SEVEN HEARTS NINE,0.6548,0.0628,0.2824
CLUBS SIX HEARTS TWO,0.7766,0.0974,0.126
CLUBS TWO CLUBS KING,0.6272,0.0104,0.3624
CLUBS NINE SPADES SIX,0.6684,0.0536,0.278
HEARTS ACE DIAMONDS FOUR,0.6498,0.0044,0.3458
SPADES JACK SPADES NINE,0.5168,0.0242,0.459
CLUBS THREE SPADES FIVE,0.7316,0.0896,0.1788
SPADES NINE HEARTS ACE,0.5564,0.004,0.4396
SPADES SEVEN CLUBS THREE,0.7728,0.0788,0.1484
CLUBS NINE CLUBS QUEEN,0.5176,0.0182,0.4642
HEARTS SEVEN CLUBS SIX,0.7662,0.0784,0.1554
SPADES SEVEN CLUBS ACE,0.6522,0.002,0.3458
DIAMONDS THREE DIAMONDS NINE,0.6594,0.061,0.2796
SPADES FIVE DIAMONDS JACK,0.6786,0.0316,0.2898
CLUBS JACK DIAMONDS NINE,0.527,0.0284,0.4446
SPADES SEVEN HEARTS NINE,0.6654,0.054,0.2806
DIAMONDS ACE CLUBS THREE,0.629,0.005,0.366
DIAMONDS TWO HEARTS JACK,0.6792,0.0374,0.2834
CLUBS SEVEN CLUBS KING,0.6314,0.0122,0.3564
CLUBS SIX SPADES SEVEN,0.7606,0.0806,0.1588
DIAMONDS JACK SPADES TWO,0.67,0.0318,0.2982
DIAMONDS TWO DIAMONDS SEVEN,0.766,0.0802,0.1538
SPADES TEN HEARTS ACE,0.526,0.0038,0.4702
DIAMONDS SEVEN CLUBS KING,0.6858,0.0124,0.3018
CLUBS JACK DIAMONDS ACE,0.5174,0.0038,0.4788
DIAMONDS THREE HEARTS TEN,0.6898,0.0466,0.2636
CLUBS JACK DIAMONDS THREE,0.6722,0.036,0.2918
SPADES NINE DIAMONDS SIX,0.6678,0.0628,0.2694
SPADES FOUR HEARTS NINE,0.6866,0.0554,0.258
HEARTS KING HEARTS NINE,0.5252,0.0114,0.4634
CLUBS FOUR DIAMONDS TEN,0.6762,0.0472,0.2766
DIAMONDS ACE DIAMONDS TEN,0.523,0.0034,0.4736
SPADES SIX DIAMONDS FOUR,0.7636,0.0862,0.1502
CLUBS THREE HEARTS QUEEN,0.6686,0.0208,0.3106
CLUBS TEN SPADES QUEEN,0.5406,0.013,0.4464
CLUBS EIGHT DIAMONDS TEN,0.6352,0.0444,0.3204
SPADES TEN DIAMONDS NINE,0.5344,0.0414,0.4242
HEARTS SEVEN CLUBS FIVE,0.7618,0.081,0.1572
HEARTS THREE DIAMONDS FIVE,0.7484,0.0938,0.1578
CLUBS TWO DIAMONDS NINE,0.6782,0.0612,0.2606
CLUBS FIVE DIAMONDS JACK,0.6592,0.0368,0.304
DIAMONDS THREE HEARTS SIX,0.7588,0.0984,0.1428
SPADES TEN CLUBS KING,0.5436,0.0048,0.4516
SPADES SIX DIAMONDS NINE,0.6608,0.0594,0.2798
CLUBS FIVE DIAMONDS QUEEN,0.6658,0.0242,0.31
CLUBS EIGHT HEARTS ACE,0.6594,0.0282,0.3124
SPADES EIGHT DIAMONDS JACK,0.6606,0.0398,0.2996
CLUBS NINE DIAMONDS ACE,0.5448,0.004,0.4512
SPADES JACK HEARTS FOUR,0.6686,0.0322,0.2992
SPADES QUEEN HEARTS KING,0.526,0.0052,0.4688
SPADES SIX CLUBS TWO,0.7722,0.0876,0.1402
DIAMONDS JACK DIAMONDS TEN,0.5018,0.0222,0.476
CLUBS TEN CLUBS SEVEN,0.6384,0.0416,0.32
SPADES KING CLUBS TEN,0.5376,0.0062,0.4562
HEARTS SEVEN SPADES QUEEN,0.6752,0.0188,0.306
CLUBS NINE HEARTS KING,0.5552,0.0094,0.4354
DIAMONDS THREE SPADES SIX,0.7648,0.086,0.1492
HEARTS SEVEN HEARTS TEN,0.6336,0.0436,0.3228
SPADES ACE SPADES TWO,0.604,0.004,0.392
HEARTS FOUR HEARTS NINE,0.6486,0.0556,0.2958
DIAMONDS NINE DIAMONDS FOUR,0.6544,0.0618,0.2838
DIAMONDS TWO CLUBS THREE,0.7652,0.096,0.1388
CLUBS EIGHT CLUBS THREE,0.7936,0.0816,0.1248
HEARTS THREE CLUBS TWO,0.7664,0.102,0.1316
HEARTS TWO HEARTS ACE,0.6172,0.0066,0.3762
CLUBS NINE HEARTS FOUR,0.6844,0.0596,0.256
HEARTS TWO CLUBS TWO,0.646,0.1792,0.1748
DIAMONDS KING CLUBS THREE,0.6592,0.0136,0.3272
DIAMONDS ACE HEARTS ACE,0.1854,0.0046,0.81
CLUBS NINE CLUBS FIVE,0.6392,0.0606,0.3002
HEARTS SEVEN CLUBS KING,0.6668,0.0122,0.321
CLUBS NINE CLUBS KING,0.5244,0.0104,0.4652
HEARTS SIX CLUBS FIVE,0.7466,0.0954,0.158
HEARTS THREE CLUBS ACE,0.6494,0.0056,0.345
DIAMONDS ACE DIAMONDS SEVEN,0.6202,0.0044,0.3754
HEARTS THREE DIAMONDS SIX,0.7688,0.0888,0.1424
HEARTS SIX SPADES JACK,0.6814,0.0248,0.2938
SPADES TEN DIAMONDS SEVEN,0.6642,0.0408,0.295
CLUBS THREE DIAMONDS FIVE,0.74,0.0988,0.1612
SPADES TWO CLUBS KING,0.6724,0.0094,0.3182
DIAMONDS TWO SPADES THREE,0.7514,0.1094,0.1392
HEARTS THREE HEARTS TWO,0.7384,0.0968,0.1648
HEARTS KING DIAMONDS SEVEN,0.6654,0.0138,0.3208
HEARTS THREE HEARTS KING,0.6346,0.0142,0.3512
HEARTS SEVEN DIAMONDS FIVE,0.7824,0.0762,0.1414
DIAMONDS SEVEN HEARTS TEN,0.675,0.0458,0.2792
HEARTS SEVEN SPADES TEN,0.6702,0.0466,0.2832
CLUBS JACK DIAMONDS SEVEN,0.6758,0.0352,0.289
HEARTS FOUR CLUBS TWO,0.7582,0.1004,0.1414
HEARTS FOUR SPADES FOUR,0.629,0.1876,0.1834
SPADES THREE CLUBS ACE,0.6532,0.004,0.3428
CLUBS EIGHT DIAMONDS FIVE,0.8168,0.0806,0.1026
CLUBS NINE CLUBS EIGHT,0.5894,0.0568,0.3538
CLUBS FOUR DIAMONDS QUEEN,0.6748,0.0202,0.305
DIAMONDS TEN HEARTS QUEEN,0.521,0.0152,0.4638
SPADES FOUR DIAMONDS SEVEN,0.764,0.0826,0.1534
