opposingHand,winningChance,drawChance,lostChance
HEARTS SEVEN SPADES KING,0.673,0.0082,0.3188
SPADES SIX CLUBS QUEEN,0.6752,0.0218,0.303
CLUBS SIX CLUBS KING,0.6404,0.0104,0.3492
CLUBS TEN DIAMONDS SEVEN,0.6622,0.0476,0.2902
SPADES ACE CLUBS FOUR,0.6446,0.0024,0.353
DIAMONDS TWO HEARTS ACE,0.6532,0.0054,0.3414
HEARTS SIX SPADES TWO,0.7848,0.0912,0.124
HEARTS SEVEN DIAMONDS JACK,0.6704,0.0344,0.2952
CLUBS JACK SPADES NINE,0.54,0.0306,0.4294
CLUBS JACK SPADES QUEEN,0.538,0.0104,0.4516
DIAMONDS NINE DIAMONDS SEVEN,0.6206,0.0592,0.3202
SPADES TEN HEARTS JACK,0.5156,0.02,0.4644
CLUBS SIX SPADES EIGHT,0.7984,0.0746,0.127
SPADES QUEEN HEARTS JACK,0.541,0.0124,0.4466
DIAMONDS JACK DIAMONDS FOUR,0.649,0.0312,0.3198
HEARTS SIX CLUBS SEVEN,0.766,0.0898,0.1442
SPADES ACE SPADES FIVE,0.6004,0.0032,0.3964
CLUBS TEN SPADES FIVE,0.677,0.0482,0.2748
CLUBS NINE DIAMONDS KING,0.555,0.01,0.435
CLUBS JACK SPADES JACK,0.1922,0.0966,0.7112
SPADES NINE CLUBS QUEEN,0.5532,0.0162,0.4306
SPADES SIX SPADES FIVE,0.706,0.0884,0.2056
HEARTS KING SPADES TWO,0.6634,0.0142,0.3224
SPADES KING DIAMONDS TWO,0.6654,0.0114,0.3232
CLUBS JACK CLUBS SEVEN,0.6522,0.0276,0.3202
HEARTS TWO HEARTS NINE,0.6464,0.0576,0.296
SPADES FIVE CLUBS ACE,0.6442,0.0032,0.3526
CLUBS EIGHT DIAMONDS ACE,0.6604,0.027,0.3126
HEARTS FOUR DIAMONDS SEVEN,0.7802,0.0764,0.1434
CLUBS ACE HEARTS NINE,0.5538,0.0028,0.4434
SPADES KING SPADES SIX,0.6378,0.0096,0.3526
DIAMONDS JACK HEARTS NINE,0.5382,0.0282,0.4336
SPADES EIGHT HEARTS NINE,0.6136,0.0576,0.3288
SPADES ACE HEARTS TEN,0.5188,0.0028,0.4784
DIAMONDS SIX CLUBS KING,0.6678,0.007,0.3252
SPADES TEN HEARTS KING,0.5272,0.0072,0.4656
SPADES TEN CLUBS QUEEN,0.537,0.0114,0.4516
CLUBS SIX HEARTS KING,0.6482,0.0116,0.3402
SPADES NINE SPADES EIGHT,0.5914,0.048,0.3606
CLUBS ACE DIAMONDS SIX,0.6686,0.0024,0.329
CLUBS JACK SPADES SEVEN,0.6554,0.0346,0.31
DIAMONDS THREE DIAMONDS FOUR,0.7108,0.1016,0.1876
HEARTS SIX HEARTS NINE,0.643,0.056,0.301
HEARTS SEVEN SPADES SIX,0.76,0.0862,0.1538
CLUBS TEN DIAMONDS QUEEN,0.5236,0.016,0.4604
CLUBS NINE HEARTS THREE,0.6814,0.065,0.2536
CLUBS THREE DIAMONDS TEN,0.672,0.05,0.278
DIAMONDS TEN HEARTS KING,0.526,0.0086,0.4654
HEARTS TWO DIAMONDS SEVEN,0.8014,0.0862,0.1124
SPADES EIGHT SPADES SIX,0.753,0.076,0.171
HEARTS SEVEN HEARTS TWO,0.769,0.0794,0.1516
SPADES FOUR CLUBS QUEEN,0.6552,0.0194,0.3254
HEARTS FOUR DIAMONDS ACE,0.6554,0.005,0.3396
CLUBS FIVE SPADES FOUR,0.7142,0.0926,0.1932
DIAMONDS NINE HEARTS JACK,0.5418,0.0278,0.4304
SPADES KING CLUBS SIX,0.6544,0.0124,0.3332
SPADES JACK DIAMONDS ACE,0.545,0.0032,0.4518
CLUBS FOUR CLUBS KING,0.6184,0.01,0.3716
SPADES JACK CLUBS TWO,0.6744,0.0348,0.2908
DIAMONDS KING HEARTS QUEEN,0.5132,0.007,0.4798
DIAMONDS THREE HEARTS ACE,0.6512,0.0046,0.3442
SPADES TEN DIAMONDS KING,0.5258,0.0076,0.4666
CLUBS JACK CLUBS FOUR,0.6392,0.0304,0.3304
HEARTS FOUR DIAMONDS FOUR,0.6438,0.1814,0.1748
SPADES QUEEN HEARTS THREE,0.686,0.0212,0.2928
HEARTS SIX DIAMONDS TWO,0.7752,0.0994,0.1254
