opposingHand,winningChance,drawChance,lostChance
HEARTS TWO DIAMONDS NINE,0.6314,0.0296,0.339
HEARTS FIVE DIAMONDS FIVE,0.4194,0.0546,0.526
SPADES KING SPADES THREE,0.378,0.006,0.616
SPADES THREE DIAMONDS SIX,0.6674,0.0836,0.249
CLUBS TEN SPADES TEN,0.1142,0.049,0.8368
HEARTS EIGHT SPADES EIGHT,0.2628,0.0496,0.6876
SPADES KING CLUBS TWO,0.4006,0.009,0.5904
SPADES SEVEN HEARTS NINE,0.5624,0.024,0.4136
CLUBS NINE HEARTS JACK,0.3446,0.0134,0.642
CLUBS SIX CLUBS ACE,0.2346,0.026,0.7394
SPADES TEN CLUBS THREE,0.4038,0.3786,0.2176
CLUBS JACK DIAMONDS JACK,0.1604,0.022,0.8176
HEARTS ACE HEARTS JACK,0.3176,0.0074,0.675
CLUBS FOUR SPADES THREE,0.6074,0.0296,0.363
HEARTS FIVE SPADES EIGHT,0.604,0.027,0.369
SPADES FOUR SPADES TWO,0.5842,0.0274,0.3884
HEARTS FOUR CLUBS ACE,0.3962,0.0036,0.6002
HEARTS TWO CLUBS FOUR,0.6324,0.028,0.3396
SPADES FOUR HEARTS KING,0.3958,0.0076,0.5966
SPADES THREE HEARTS QUEEN,0.4056,0.0112,0.5832
CLUBS ACE DIAMONDS FOUR,0.4106,0.0042,0.5852
SPADES QUEEN CLUBS FIVE,0.4122,0.0096,0.5782
SPADES QUEEN HEARTS QUEEN,0.1428,0.0174,0.8398
HEARTS EIGHT SPADES FIVE,0.6058,0.0254,0.3688
SPADES ACE DIAMONDS QUEEN,0.3224,0.0028,0.6748
DIAMONDS ACE SPADES SEVEN,0.3474,0.0038,0.6488
HEARTS EIGHT HEARTS THREE,0.5878,0.0262,0.386
SPADES SIX HEARTS TEN,0.012,0.969,0.019
DIAMONDS ACE HEARTS ACE,0.1306,0.0042,0.8652
SPADES ACE SPADES QUEEN,0.32,0.0034,0.6766
CLUBS NINE SPADES FOUR,0.6266,0.0284,0.345
HEARTS KING HEARTS TEN,0.2286,0.0314,0.74
SPADES FIVE SPADES TWO,0.5854,0.0266,0.388
SPADES FOUR DIAMONDS FIVE,0.6042,0.0312,0.3646
SPADES NINE DIAMONDS SIX,0.6756,0.0698,0.2546
DIAMONDS SEVEN HEARTS NINE,0.5662,0.0266,0.4072
CLUBS ACE CLUBS KING,0.303,0.0032,0.6938
CLUBS NINE HEARTS FIVE,0.619,0.0266,0.3544
HEARTS SEVEN SPADES TEN,0.207,0.3018,0.4912
SPADES TEN CLUBS TWO,0.4048,0.3682,0.227
HEARTS FIVE DIAMONDS FOUR,0.6016,0.0318,0.3666
SPADES NINE CLUBS QUEEN,0.3572,0.008,0.6348
CLUBS TWO DIAMONDS SEVEN,0.6428,0.0312,0.326
SPADES SEVEN HEARTS TEN,0.2314,0.2994,0.4692
DIAMONDS TWO SPADES SEVEN,0.632,0.0282,0.3398
HEARTS SEVEN HEARTS TEN,0.2148,0.2828,0.5024
HEARTS SEVEN CLUBS ACE,0.3678,0.004,0.6282
HEARTS FIVE DIAMONDS NINE,0.616,0.0268,0.3572
SPADES KING DIAMONDS FIVE,0.4048,0.0098,0.5854
CLUBS ACE DIAMONDS SIX,0.2548,0.0208,0.7244
CLUBS SIX HEARTS NINE,0.6724,0.0798,0.2478
HEARTS TWO DIAMONDS QUEEN,0.4136,0.0104,0.576
SPADES NINE DIAMONDS KING,0.3538,0.0066,0.6396
HEARTS EIGHT DIAMONDS QUEEN,0.3468,0.0114,0.6418
SPADES NINE DIAMONDS JACK,0.3318,0.0152,0.653
CLUBS FOUR HEARTS KING,0.3886,0.0064,0.605
CLUBS SIX HEARTS KING,0.2402,0.0372,0.7226
CLUBS ACE HEARTS TEN,0.2318,0.019,0.7492
SPADES KING DIAMONDS SEVEN,0.3708,0.0076,0.6216
CLUBS JACK CLUBS KING,0.3218,0.0058,0.6724
DIAMONDS THREE DIAMONDS FOUR,0.596,0.0254,0.3786
CLUBS FOUR SPADES FOUR,0.4146,0.059,0.5264
SPADES SIX HEARTS ACE,0.2526,0.0238,0.7236
CLUBS JACK HEARTS JACK,0.1504,0.0216,0.828
CLUBS FIVE HEARTS TEN,0.395,0.3698,0.2352
SPADES TEN CLUBS KING,0.2414,0.0264,0.7322
HEARTS FIVE SPADES SIX,0.6446,0.0836,0.2718
DIAMONDS NINE HEARTS QUEEN,0.3556,0.0116,0.6328
DIAMONDS EIGHT HEARTS NINE,0.5494,0.0246,0.426
DIAMONDS ACE DIAMONDS FOUR,0.3786,0.0042,0.6172
