opposingHand,winningChance,drawChance,lostChance
SPADES NINE SPADES FOUR,0.6358,0.0644,0.2998
DIAMONDS SIX HEARTS TEN,0.6676,0.0466,0.2858
CLUBS THREE DIAMONDS JACK,0.6822,0.029,0.2888
SPADES NINE SPADES THREE,0.6474,0.0574,0.2952
HEARTS SIX DIAMONDS SEVEN,0.769,0.0798,0.1512
SPADES FOUR CLUBS ACE,0.6518,0.0018,0.3464
CLUBS FIVE HEARTS NINE,0.6644,0.0616,0.274
CLUBS FOUR CLUBS ACE,0.5966,0.0052,0.3982
HEARTS KING DIAMONDS NINE,0.5374,0.012,0.4506
SPADES ACE HEARTS ACE,0.1978,0.0024,0.7998
SPADES THREE HEARTS JACK,0.6824,0.0328,0.2848
DIAMONDS KING HEARTS TEN,0.5274,0.0088,0.4638
SPADES KING SPADES SEVEN,0.6244,0.0126,0.363
SPADES QUEEN DIAMONDS ACE,0.517,0.005,0.478
SPADES QUEEN DIAMONDS FIVE,0.6608,0.0244,0.3148
SPADES KING HEARTS FOUR,0.6658,0.011,0.3232
DIAMONDS QUEEN HEARTS QUEEN,0.191,0.0644,0.7446
CLUBS JACK DIAMONDS JACK,0.1886,0.0956,0.7158
CLUBS TWO HEARTS KING,0.6658,0.0122,0.322
SPADES QUEEN DIAMONDS JACK,0.5246,0.012,0.4634
SPADES KING CLUBS ACE,0.5484,0.0026,0.449
DIAMONDS TWO HEARTS KING,0.6616,0.0128,0.3256
CLUBS THREE DIAMONDS SEVEN,0.779,0.083,0.138
HEARTS TWO SPADES EIGHT,0.8378,0.0962,0.066
CLUBS KING CLUBS QUEEN,0.5084,0.005,0.4866
HEARTS ACE DIAMONDS SIX,0.663,0.004,0.333
SPADES KING DIAMONDS QUEEN,0.5226,0.0064,0.471
SPADES NINE CLUBS SIX,0.6658,0.0576,0.2766
CLUBS TEN CLUBS NINE,0.5092,0.036,0.4548
SPADES THREE DIAMONDS SEVEN,0.7706,0.0848,0.1446
CLUBS FIVE SPADES SIX,0.7476,0.0826,0.1698
CLUBS SIX HEARTS ACE,0.6608,0.002,0.3372
SPADES FOUR DIAMONDS FOUR,0.6262,0.19,0.1838
SPADES NINE CLUBS FOUR,0.6696,0.0588,0.2716
SPADES KING CLUBS QUEEN,0.5252,0.0062,0.4686
HEARTS SEVEN CLUBS ACE,0.6498,0.0042,0.346
DIAMONDS KING SPADES THREE,0.6596,0.0096,0.3308
DIAMONDS TWO SPADES SIX,0.7896,0.0872,0.1232
CLUBS SIX SPADES TWO,0.7708,0.0876,0.1416
SPADES KING HEARTS KING,0.1906,0.0334,0.776
CLUBS FIVE DIAMONDS SIX,0.737,0.0968,0.1662
CLUBS JACK SPADES TEN,0.524,0.018,0.458
SPADES FOUR SPADES TWO,0.7088,0.0998,0.1914
HEARTS THREE HEARTS NINE,0.6526,0.0588,0.2886
SPADES TEN HEARTS NINE,0.5344,0.0354,0.4302
SPADES EIGHT CLUBS FOUR,0.8124,0.0864,0.1012
HEARTS FIVE DIAMONDS ACE,0.6476,0.004,0.3484
HEARTS FIVE SPADES NINE,0.6722,0.0646,0.2632
DIAMONDS TWO CLUBS SEVEN,0.801,0.0788,0.1202
HEARTS SIX SPADES TEN,0.6798,0.0424,0.2778
CLUBS KING HEARTS TEN,0.537,0.0054,0.4576
HEARTS THREE HEARTS QUEEN,0.6344,0.0184,0.3472
SPADES JACK DIAMONDS SIX,0.6874,0.0284,0.2842
HEARTS SIX DIAMONDS JACK,0.695,0.0308,0.2742
SPADES SIX CLUBS THREE,0.754,0.0838,0.1622
HEARTS THREE SPADES NINE,0.6912,0.059,0.2498
HEARTS ACE HEARTS QUEEN,0.5098,0.0052,0.485
SPADES EIGHT HEARTS ACE,0.6678,0.0238,0.3084
DIAMONDS FIVE HEARTS NINE,0.6622,0.0648,0.273
CLUBS JACK CLUBS KING,0.502,0.0058,0.4922
SPADES TWO CLUBS QUEEN,0.6652,0.025,0.3098
HEARTS FIVE SPADES EIGHT,0.8114,0.0858,0.1028
SPADES FOUR HEARTS TEN,0.6646,0.0518,0.2836
HEARTS JACK HEARTS NINE,0.5216,0.0292,0.4492
CLUBS SEVEN DIAMONDS SEVEN,0.63,0.1944,0.1756
CLUBS FOUR SPADES FOUR,0.6258,0.1842,0.19
DIAMONDS TWO HEARTS TEN,0.6772,0.0478,0.275
SPADES KING CLUBS SEVEN,0.6538,0.0132,0.333
DIAMONDS TWO HEARTS TWO,0.6418,0.1756,0.1826
HEARTS ACE SPADES TWO,0.664,0.0056,0.3304
DIAMONDS ACE DIAMONDS SIX,0.6224,0.0028,0.3748
SPADES ACE CLUBS TWO,0.6448,0.0048,0.3504
SPADES JACK CLUBS QUEEN,0.5474,0.0092,0.4434
DIAMONDS THREE SPADES SEVEN,0.7792,0.0892,0.1316
CLUBS SEVEN HEARTS KING,0.65,0.0128,0.3372
DIAMONDS QUEEN DIAMONDS NINE,0.5126,0.0156,0.4718
SPADES ACE CLUBS THREE,0.6568,0.0052,0.338
CLUBS EIGHT HEARTS TEN,0.6314,0.0432,0.3254
CLUBS TWO SPADES FOUR,0.76,0.0926,0.1474
DIAMONDS KING HEARTS ACE,0.5224,0.0066,0.471
DIAMONDS SEVEN DIAMONDS FIVE,0.7258,0.0816,0.1926
HEARTS SEVEN DIAMONDS ACE,0.6592,0.0028,0.338
SPADES TEN CLUBS THREE,0.68,0.0402,0.2798
CLUBS SIX CLUBS THREE,0.7012,0.088,0.2108
DIAMONDS TEN SPADES THREE,0.6748,0.0494,0.2758
DIAMONDS THREE DIAMONDS QUEEN,0.6458,0.019,0.3352
HEARTS TEN CLUBS QUEEN,0.5294,0.0172,0.4534
DIAMONDS KING DIAMONDS FIVE,0.622,0.0128,0.3652
DIAMONDS TWO DIAMONDS FIVE,0.7156,0.1,0.1844
CLUBS FOUR HEARTS KING,0.657,0.0112,0.3318
DIAMONDS TWO SPADES QUEEN,0.6696,0.0224,0.308
CLUBS NINE SPADES THREE,0.6846,0.06,0.2554
SPADES ACE DIAMONDS KING,0.546,0.003,0.451
DIAMONDS THREE HEARTS NINE,0.686,0.058,0.256
CLUBS JACK SPADES TWO,0.6746,0.0338,0.2916
SPADES SEVEN SPADES TWO,0.7428,0.076,0.1812
SPADES SIX DIAMONDS TEN,0.6664,0.0442,0.2894
SPADES EIGHT CLUBS TWO,0.8404,0.0858,0.0738
SPADES THREE DIAMONDS SIX,0.7602,0.0892,0.1506
SPADES THREE DIAMONDS FOUR,0.7448,0.0988,0.1564
SPADES QUEEN DIAMONDS NINE,0.5376,0.0196,0.4428
SPADES SEVEN HEARTS QUEEN,0.6704,0.0188,0.3108
SPADES FIVE HEARTS QUEEN,0.6576,0.0186,0.3238
CLUBS SEVEN SPADES TWO,0.779,0.0896,0.1314
CLUBS SEVEN HEARTS TWO,0.7918,0.0796,0.1286
CLUBS JACK CLUBS THREE,0.6346,0.032,0.3334
DIAMONDS TWO HEARTS NINE,0.685,0.0596,0.2554
CLUBS FIVE CLUBS QUEEN,0.6284,0.0222,0.3494
HEARTS SIX DIAMONDS SIX,0.6336,0.1978,0.1686
HEARTS TWO DIAMONDS ACE,0.6526,0.0038,0.3436
SPADES ACE CLUBS TEN,0.5426,0.0018,0.4556
CLUBS THREE DIAMONDS SIX,0.7636,0.092,0.1444
SPADES QUEEN CLUBS SIX,0.665,0.0206,0.3144
SPADES NINE CLUBS ACE,0.5394,0.0026,0.458
SPADES FIVE DIAMONDS FOUR,0.7254,0.0992,0.1754
HEARTS ACE DIAMONDS TEN,0.5328,0.0052,0.462
CLUBS SEVEN HEARTS ACE,0.6494,0.0046,0.346
SPADES FIVE DIAMONDS SIX,0.7492,0.092,0.1588
HEARTS THREE SPADES FOUR,0.7558,0.0984,0.1458
SPADES KING HEARTS JACK,0.5274,0.0092,0.4634
SPADES TEN CLUBS SIX,0.6594,0.045,0.2956
CLUBS QUEEN DIAMONDS FOUR,0.669,0.0166,0.3144
SPADES JACK SPADES SEVEN,0.634,0.0342,0.3318
CLUBS TEN SPADES TWO,0.6836,0.0426,0.2738
DIAMONDS TWO SPADES FOUR,0.7536,0.106,0.1404
HEARTS FIVE HEARTS KING,0.6302,0.0118,0.358
CLUBS EIGHT CLUBS TWO,0.7948,0.086,0.1192
CLUBS KING DIAMONDS FOUR,0.6608,0.012,0.3272
SPADES EIGHT SPADES SEVEN,0.7446,0.0774,0.178
CLUBS JACK DIAMONDS SIX,0.6846,0.0306,0.2848
HEARTS FOUR HEARTS JACK,0.6356,0.032,0.3324
CLUBS JACK HEARTS THREE,0.6746,0.0312,0.2942
DIAMONDS THREE CLUBS SIX,0.7598,0.0912,0.149
SPADES SEVEN CLUBS KING,0.6662,0.0096,0.3242
DIAMONDS TEN CLUBS ACE,0.5472,0.0034,0.4494
CLUBS TWO DIAMONDS FIVE,0.7524,0.0954,0.1522
SPADES QUEEN HEARTS FOUR,0.6716,0.021,0.3074
SPADES SEVEN DIAMONDS QUEEN,0.6712,0.0216,0.3072
CLUBS SIX SPADES SIX,0.6228,0.1844,0.1928
DIAMONDS THREE DIAMONDS ACE,0.6224,0.0054,0.3722
DIAMONDS NINE HEARTS NINE,0.1642,0.1636,0.6722
SPADES SIX CLUBS KING,0.6616,0.01,0.3284
HEARTS FIVE CLUBS QUEEN,0.6656,0.0212,0.3132
SPADES EIGHT SPADES THREE,0.7798,0.0894,0.1308
SPADES EIGHT SPADES FOUR,0.7746,0.0894,0.136
DIAMONDS TWO CLUBS TWO,0.6312,0.1904,0.1784
DIAMONDS NINE CLUBS ACE,0.548,0.0046,0.4474
CLUBS TEN DIAMONDS FIVE,0.678,0.047,0.275
HEARTS FOUR HEARTS QUEEN,0.6242,0.026,0.3498
HEARTS SEVEN HEARTS KING,0.6336,0.0116,0.3548
HEARTS QUEEN HEARTS TEN,0.4996,0.0164,0.484
SPADES JACK DIAMONDS NINE,0.5464,0.0282,0.4254
SPADES FIVE SPADES FOUR,0.6856,0.0888,0.2256
HEARTS THREE DIAMONDS KING,0.6712,0.0138,0.315
CLUBS EIGHT DIAMONDS KING,0.68,0.025,0.295
CLUBS ACE CLUBS KING,0.4996,0.0048,0.4956
HEARTS ACE HEARTS KING,0.4968,0.0044,0.4988
CLUBS SIX SPADES THREE,0.7642,0.0868,0.149
DIAMONDS QUEEN DIAMONDS FOUR,0.633,0.0258,0.3412
DIAMONDS ACE HEARTS JACK,0.5358,0.0026,0.4616
HEARTS SIX HEARTS TEN,0.6402,0.047,0.3128
CLUBS JACK HEARTS ACE,0.525,0.004,0.471
DIAMONDS TWO DIAMONDS ACE,0.6196,0.0038,0.3766
CLUBS TEN SPADES SEVEN,0.6566,0.0418,0.3016
SPADES SEVEN SPADES SIX,0.7308,0.0766,0.1926
SPADES TEN SPADES NINE,0.5004,0.035,0.4646
HEARTS JACK DIAMONDS SIX,0.677,0.0342,0.2888
SPADES FIVE SPADES THREE,0.6976,0.0976,0.2048
SPADES NINE HEARTS TEN,0.5216,0.0366,0.4418
CLUBS TEN HEARTS KING,0.5336,0.0088,0.4576
CLUBS SEVEN CLUBS QUEEN,0.6426,0.0232,0.3342
CLUBS TEN HEARTS NINE,0.5272,0.0402,0.4326
CLUBS FIVE DIAMONDS TEN,0.6642,0.0458,0.29
HEARTS SIX DIAMONDS TEN,0.6588,0.0464,0.2948
HEARTS SEVEN DIAMONDS TEN,0.6762,0.048,0.2758
HEARTS TWO HEARTS JACK,0.6386,0.036,0.3254
CLUBS SEVEN DIAMONDS TEN,0.6676,0.0472,0.2852
CLUBS THREE DIAMONDS QUEEN,0.677,0.0212,0.3018
DIAMONDS ACE HEARTS TEN,0.5246,0.0028,0.4726
SPADES ACE HEARTS FIVE,0.6498,0.0028,0.3474
CLUBS NINE SPADES TEN,0.5338,0.0432,0.423
CLUBS NINE CLUBS SIX,0.6276,0.0586,0.3138
HEARTS THREE SPADES SEVEN,0.775,0.0884,0.1366
SPADES JACK DIAMONDS QUEEN,0.5248,0.013,0.4622
CLUBS FIVE SPADES TWO,0.7476,0.0974,0.155
SPADES KING DIAMONDS JACK,0.5362,0.0062,0.4576
SPADES QUEEN SPADES FIVE,0.6424,0.0178,0.3398
SPADES NINE SPADES FIVE,0.6346,0.0592,0.3062
DIAMONDS TWO SPADES JACK,0.6712,0.033,0.2958
SPADES SEVEN DIAMONDS JACK,0.6592,0.0342,0.3066
CLUBS NINE DIAMONDS FIVE,0.6766,0.056,0.2674
DIAMONDS TWO HEARTS THREE,0.7572,0.1038,0.139
DIAMONDS KING SPADES FOUR,0.668,0.0108,0.3212
SPADES ACE CLUBS JACK,0.5396,0.003,0.4574
SPADES KING CLUBS KING,0.1936,0.0322,0.7742
CLUBS JACK SPADES FIVE,0.657,0.0332,0.3098
CLUBS NINE DIAMONDS TEN,0.5252,0.0418,0.433
CLUBS SEVEN DIAMONDS SIX,0.7744,0.0742,0.1514
SPADES KING SPADES FIVE,0.6332,0.0108,0.356
HEARTS KING CLUBS QUEEN,0.5336,0.0052,0.4612
CLUBS JACK CLUBS TEN,0.4898,0.0244,0.4858
SPADES TEN HEARTS TEN,0.1792,0.1214,0.6994
DIAMONDS ACE DIAMONDS FIVE,0.6146,0.0052,0.3802
HEARTS FIVE DIAMONDS QUEEN,0.6602,0.023,0.3168
HEARTS KING DIAMONDS FOUR,0.6662,0.0118,0.322
HEARTS FOUR DIAMONDS NINE,0.6904,0.0648,0.2448
CLUBS EIGHT CLUBS SEVEN,0.7368,0.0746,0.1886
CLUBS TEN DIAMONDS FOUR,0.6798,0.0436,0.2766
HEARTS NINE DIAMONDS FOUR,0.6788,0.064,0.2572
DIAMONDS TWO DIAMONDS FOUR,0.7224,0.1008,0.1768
SPADES EIGHT DIAMONDS SIX,0.7972,0.0824,0.1204
CLUBS EIGHT SPADES SIX,0.794,0.081,0.125
DIAMONDS TWO SPADES TWO,0.6324,0.186,0.1816
SPADES NINE CLUBS TWO,0.6834,0.0648,0.2518
HEARTS JACK CLUBS KING,0.5224,0.007,0.4706
CLUBS SIX HEARTS TEN,0.6696,0.0434,0.287
DIAMONDS SEVEN CLUBS ACE,0.651,0.0026,0.3464
SPADES TEN SPADES EIGHT,0.6104,0.0388,0.3508
HEARTS FIVE DIAMONDS NINE,0.6658,0.0672,0.267
DIAMONDS NINE SPADES TWO,0.685,0.0662,0.2488
CLUBS SEVEN CLUBS SIX,0.7236,0.0774,0.199
HEARTS SIX SPADES THREE,0.7682,0.092,0.1398
DIAMONDS KING CLUBS ACE,0.5318,0.0022,0.466
DIAMONDS KING HEARTS JACK,0.5288,0.007,0.4642
SPADES ACE SPADES SIX,0.6152,0.0022,0.3826
SPADES KING CLUBS EIGHT,0.6674,0.0246,0.308
SPADES SIX SPADES TWO,0.7314,0.0888,0.1798
SPADES FIVE HEARTS JACK,0.6738,0.0334,0.2928
SPADES FOUR DIAMONDS NINE,0.6712,0.0584,0.2704
CLUBS THREE HEARTS NINE,0.6804,0.0624,0.2572
SPADES FIVE DIAMONDS FIVE,0.6312,0.1928,0.176
SPADES THREE CLUBS QUEEN,0.6712,0.0226,0.3062
CLUBS NINE SPADES JACK,0.5414,0.023,0.4356
HEARTS THREE SPADES SIX,0.7614,0.0874,0.1512
HEARTS ACE CLUBS QUEEN,0.5236,0.0036,0.4728
HEARTS SIX CLUBS THREE,0.752,0.1004,0.1476
SPADES FIVE CLUBS QUEEN,0.662,0.0198,0.3182
SPADES KING DIAMONDS NINE,0.5336,0.0096,0.4568
CLUBS EIGHT SPADES EIGHT,0.0226,0.957,0.0204
DIAMONDS KING DIAMONDS SIX,0.6404,0.0124,0.3472
CLUBS FIVE DIAMONDS ACE,0.6472,0.0042,0.3486
HEARTS SEVEN DIAMONDS THREE,0.7828,0.08,0.1372
SPADES FOUR CLUBS KING,0.6616,0.0104,0.328
CLUBS SEVEN CLUBS ACE,0.6228,0.0014,0.3758
SPADES QUEEN SPADES JACK,0.5028,0.01,0.4872
DIAMONDS TWO CLUBS NINE,0.6736,0.0624,0.264
SPADES KING CLUBS TWO,0.6694,0.0084,0.3222
CLUBS FOUR DIAMONDS SEVEN,0.764,0.0832,0.1528
SPADES ACE SPADES THREE,0.6096,0.0058,0.3846
SPADES SEVEN CLUBS FOUR,0.7666,0.0774,0.156
HEARTS THREE CLUBS QUEEN,0.6858,0.02,0.2942
SPADES KING DIAMONDS ACE,0.525,0.0032,0.4718
SPADES QUEEN DIAMONDS SEVEN,0.6708,0.0214,0.3078
CLUBS THREE CLUBS QUEEN,0.6326,0.02,0.3474
HEARTS SIX DIAMONDS KING,0.6726,0.0106,0.3168
SPADES FIVE CLUBS TWO,0.7558,0.0942,0.15
HEARTS SIX HEARTS QUEEN,0.6464,0.0194,0.3342
CLUBS TEN HEARTS TEN,0.1696,0.1324,0.698
DIAMONDS TEN DIAMONDS FIVE,0.6334,0.0444,0.3222
SPADES KING DIAMONDS SIX,0.6704,0.0092,0.3204
DIAMONDS QUEEN DIAMONDS SEVEN,0.662,0.0168,0.3212
SPADES TWO HEARTS NINE,0.6706,0.0612,0.2682
HEARTS TWO SPADES SIX,0.7826,0.092,0.1254
HEARTS FIVE HEARTS NINE,0.6454,0.0612,0.2934
SPADES ACE SPADES JACK,0.51,0.0024,0.4876
CLUBS EIGHT HEARTS NINE,0.6242,0.0558,0.32
DIAMONDS ACE DIAMONDS KING,0.5124,0.0022,0.4854
CLUBS TEN CLUBS QUEEN,0.5134,0.0132,0.4734
HEARTS TWO SPADES SEVEN,0.7916,0.0884,0.12
DIAMONDS TWO CLUBS SIX,0.7802,0.0886,0.1312
HEARTS ACE DIAMONDS FIVE,0.6424,0.006,0.3516
SPADES SEVEN HEARTS JACK,0.6778,0.0338,0.2884
CLUBS FOUR DIAMONDS FIVE,0.737,0.0958,0.1672
CLUBS FIVE SPADES SEVEN,0.7548,0.0764,0.1688
HEARTS FOUR SPADES SIX,0.7574,0.0866,0.156
CLUBS NINE HEARTS QUEEN,0.5502,0.0162,0.4336
HEARTS FOUR CLUBS THREE,0.7388,0.1034,0.1578
SPADES NINE DIAMONDS NINE,0.1784,0.1542,0.6674
SPADES NINE SPADES SEVEN,0.617,0.0606,0.3224
HEARTS TWO DIAMONDS TEN,0.6764,0.0544,0.2692
HEARTS FOUR CLUBS SIX,0.75,0.0926,0.1574
CLUBS EIGHT HEARTS KING,0.6818,0.0224,0.2958
HEARTS TWO HEARTS KING,0.6472,0.0102,0.3426
HEARTS TWO DIAMONDS SIX,0.78,0.091,0.129
HEARTS SIX HEARTS ACE,0.6278,0.0042,0.368
HEARTS SEVEN CLUBS QUEEN,0.6758,0.0194,0.3048
SPADES NINE DIAMONDS TEN,0.5282,0.0416,0.4302
SPADES ACE CLUBS KING,0.5296,0.0024,0.468
CLUBS JACK HEARTS FOUR,0.664,0.0326,0.3034
HEARTS THREE DIAMONDS ACE,0.6472,0.0038,0.349
HEARTS SIX CLUBS EIGHT,0.8034,0.0838,0.1128
CLUBS EIGHT HEARTS JACK,0.6386,0.0348,0.3266
CLUBS TEN DIAMONDS JACK,0.5262,0.0256,0.4482
HEARTS KING HEARTS JACK,0.5134,0.007,0.4796
SPADES SIX DIAMONDS JACK,0.6746,0.0344,0.291
HEARTS KING CLUBS ACE,0.5408,0.0024,0.4568
SPADES KING CLUBS FIVE,0.658,0.0102,0.3318
CLUBS TEN CLUBS KING,0.5052,0.0072,0.4876
CLUBS TEN SPADES SIX,0.6782,0.0468,0.275
SPADES THREE HEARTS KING,0.6578,0.0122,0.33
SPADES QUEEN SPADES EIGHT,0.6356,0.0246,0.3398
CLUBS JACK DIAMONDS KING,0.5294,0.006,0.4646
SPADES ACE SPADES SEVEN,0.6236,0.0044,0.372
CLUBS NINE SPADES EIGHT,0.6336,0.051,0.3154
HEARTS SIX SPADES FIVE,0.74,0.0972,0.1628
DIAMONDS QUEEN DIAMONDS JACK,0.511,0.01,0.479
DIAMONDS KING SPADES FIVE,0.657,0.0084,0.3346
DIAMONDS KING CLUBS QUEEN,0.5358,0.0062,0.458
HEARTS SEVEN HEARTS QUEEN,0.6258,0.0218,0.3524
DIAMONDS TEN SPADES TWO,0.669,0.049,0.282
CLUBS SEVEN CLUBS FOUR,0.722,0.0756,0.2024
DIAMONDS ACE DIAMONDS QUEEN,0.5198,0.0044,0.4758
SPADES ACE DIAMONDS SIX,0.6664,0.0028,0.3308
DIAMONDS NINE DIAMONDS SIX,0.6356,0.0582,0.3062
SPADES FOUR HEARTS KING,0.6584,0.0106,0.331
DIAMONDS JACK DIAMONDS SEVEN,0.641,0.0296,0.3294
SPADES SEVEN SPADES THREE,0.7334,0.0806,0.186
CLUBS THREE DIAMONDS FOUR,0.7468,0.0958,0.1574
HEARTS SEVEN CLUBS FOUR,0.7684,0.0798,0.1518
CLUBS FOUR SPADES FIVE,0.7244,0.0944,0.1812
SPADES JACK HEARTS KING,0.5188,0.0058,0.4754
DIAMONDS THREE SPADES TWO,0.7678,0.1048,0.1274
CLUBS NINE DIAMONDS SIX,0.6588,0.0548,0.2864
SPADES TEN DIAMONDS FOUR,0.67,0.0472,0.2828
HEARTS SIX CLUBS ACE,0.6704,0.0032,0.3264
SPADES NINE SPADES TWO,0.6452,0.0552,0.2996
CLUBS THREE CLUBS KING,0.631,0.0114,0.3576
SPADES NINE CLUBS FIVE,0.6704,0.0572,0.2724
CLUBS NINE HEARTS FIVE,0.6718,0.0542,0.274
CLUBS FIVE CLUBS KING,0.6278,0.0088,0.3634
SPADES SEVEN DIAMONDS NINE,0.6546,0.061,0.2844
SPADES JACK CLUBS THREE,0.6828,0.0384,0.2788
HEARTS SIX SPADES FOUR,0.7604,0.0828,0.1568
SPADES QUEEN SPADES TWO,0.6376,0.0176,0.3448
SPADES TWO DIAMONDS SEVEN,0.7912,0.0838,0.125
HEARTS FIVE HEARTS THREE,0.7194,0.0936,0.187
HEARTS TWO DIAMONDS QUEEN,0.688,0.0216,0.2904
SPADES THREE HEARTS QUEEN,0.6744,0.0222,0.3034
CLUBS FOUR SPADES TWO,0.7398,0.1038,0.1564
HEARTS SEVEN SPADES TWO,0.8106,0.077,0.1124
HEARTS SEVEN CLUBS TWO,0.7952,0.0848,0.12
DIAMONDS ACE HEARTS QUEEN,0.5306,0.0046,0.4648
SPADES ACE HEARTS FOUR,0.6598,0.0046,0.3356
SPADES JACK CLUBS EIGHT,0.6526,0.0318,0.3156
SPADES TWO DIAMONDS FOUR,0.748,0.1014,0.1506
DIAMONDS TEN DIAMONDS FOUR,0.6206,0.049,0.3304
HEARTS ACE DIAMONDS SEVEN,0.6616,0.0058,0.3326
CLUBS TEN DIAMONDS NINE,0.5386,0.0364,0.425
CLUBS EIGHT DIAMONDS JACK,0.6528,0.0354,0.3118
CLUBS SEVEN DIAMONDS ACE,0.6548,0.0052,0.34
HEARTS QUEEN DIAMONDS FOUR,0.67,0.0244,0.3056
SPADES EIGHT DIAMONDS KING,0.665,0.028,0.307
DIAMONDS ACE SPADES FOUR,0.6422,0.0034,0.3544
HEARTS KING HEARTS TEN,0.516,0.0066,0.4774
CLUBS KING HEARTS NINE,0.5482,0.012,0.4398
CLUBS FOUR CLUBS THREE,0.7016,0.0946,0.2038
DIAMONDS NINE CLUBS KING,0.5446,0.0086,0.4468
SPADES ACE HEARTS THREE,0.6514,0.0046,0.344
CLUBS TEN CLUBS ACE,0.5156,0.0026,0.4818
CLUBS SEVEN HEARTS QUEEN,0.665,0.0212,0.3138
HEARTS ACE HEARTS NINE,0.5166,0.0044,0.479
SPADES KING SPADES EIGHT,0.633,0.026,0.341
SPADES NINE HEARTS NINE,0.1794,0.1524,0.6682
DIAMONDS THREE CLUBS SEVEN,0.7854,0.0836,0.131
HEARTS QUEEN DIAMONDS FIVE,0.6608,0.0256,0.3136
DIAMONDS ACE SPADES TWO,0.6474,0.005,0.3476
SPADES QUEEN HEARTS FIVE,0.6582,0.0226,0.3192
HEARTS TWO DIAMONDS NINE,0.6934,0.0558,0.2508
CLUBS TEN HEARTS FIVE,0.6804,0.0446,0.275
SPADES JACK HEARTS JACK,0.1866,0.0962,0.7172
SPADES KING SPADES NINE,0.5148,0.0088,0.4764
HEARTS FIVE DIAMONDS SEVEN,0.7738,0.0818,0.1444
DIAMONDS KING DIAMONDS NINE,0.5312,0.0098,0.459
SPADES FIVE DIAMONDS SEVEN,0.7676,0.0746,0.1578
HEARTS FOUR CLUBS FIVE,0.7266,0.0982,0.1752
SPADES KING SPADES FOUR,0.6306,0.0092,0.3602
DIAMONDS ACE DIAMONDS NINE,0.5198,0.005,0.4752
SPADES NINE DIAMONDS JACK,0.5416,0.0264,0.432
CLUBS NINE CLUBS TWO,0.642,0.0574,0.3006
HEARTS THREE CLUBS SIX,0.7546,0.0958,0.1496
CLUBS TWO SPADES THREE,0.7498,0.0998,0.1504
CLUBS FOUR SPADES SIX,0.739,0.0908,0.1702
DIAMONDS JACK SPADES THREE,0.6722,0.0332,0.2946
SPADES TEN SPADES SEVEN,0.6326,0.0434,0.324
SPADES EIGHT DIAMONDS FOUR,0.8338,0.0832,0.083
CLUBS JACK DIAMONDS FOUR,0.6876,0.0388,0.2736
SPADES SEVEN DIAMONDS SEVEN,0.6318,0.1976,0.1706
DIAMONDS THREE CLUBS ACE,0.6556,0.0036,0.3408
SPADES NINE DIAMONDS ACE,0.5496,0.0032,0.4472
SPADES SEVEN DIAMONDS SIX,0.765,0.0806,0.1544
DIAMONDS NINE HEARTS TEN,0.5264,0.0396,0.434
HEARTS THREE SPADES TWO,0.7618,0.0984,0.1398
CLUBS FOUR HEARTS QUEEN,0.6706,0.022,0.3074
CLUBS SEVEN SPADES NINE,0.6644,0.057,0.2786
HEARTS TWO DIAMONDS JACK,0.68,0.0298,0.2902
SPADES SEVEN SPADES FOUR,0.7334,0.0848,0.1818
SPADES JACK DIAMONDS FOUR,0.6774,0.0322,0.2904
HEARTS FIVE SPADES SEVEN,0.7654,0.0818,0.1528
SPADES KING HEARTS FIVE,0.6686,0.0112,0.3202
CLUBS SIX DIAMONDS NINE,0.6694,0.0586,0.272
CLUBS NINE HEARTS TEN,0.5356,0.039,0.4254
DIAMONDS KING DIAMONDS SEVEN,0.6326,0.0098,0.3576
DIAMONDS SEVEN DIAMONDS SIX,0.7302,0.0814,0.1884
DIAMONDS THREE CLUBS NINE,0.694,0.0596,0.2464
SPADES QUEEN CLUBS FIVE,0.6608,0.0212,0.318
CLUBS SIX DIAMONDS SEVEN,0.7666,0.0754,0.158
HEARTS THREE SPADES EIGHT,0.8358,0.094,0.0702
SPADES ACE CLUBS NINE,0.547,0.003,0.45
DIAMONDS TWO CLUBS EIGHT,0.8506,0.0834,0.066
HEARTS SEVEN DIAMONDS SEVEN,0.6414,0.1892,0.1694
CLUBS SEVEN DIAMONDS JACK,0.6618,0.0334,0.3048
CLUBS SEVEN SPADES EIGHT,0.7912,0.0804,0.1284
CLUBS SEVEN SPADES THREE,0.7598,0.0828,0.1574
SPADES TEN DIAMONDS FIVE,0.6874,0.049,0.2636
HEARTS SEVEN HEARTS THREE,0.7542,0.0758,0.17
SPADES TEN CLUBS SEVEN,0.6664,0.042,0.2916
CLUBS SIX DIAMONDS KING,0.6586,0.0092,0.3322
CLUBS FOUR CLUBS TWO,0.7148,0.104,0.1812
SPADES QUEEN HEARTS QUEEN,0.187,0.0642,0.7488
DIAMONDS ACE DIAMONDS JACK,0.5072,0.0046,0.4882
CLUBS FIVE SPADES THREE,0.7476,0.0936,0.1588
CLUBS JACK HEARTS TWO,0.6732,0.0306,0.2962
HEARTS TWO SPADES FOUR,0.7432,0.1108,0.146
CLUBS EIGHT DIAMONDS FOUR,0.8262,0.087,0.0868
HEARTS SEVEN HEARTS ACE,0.6336,0.0048,0.3616
SPADES ACE HEARTS JACK,0.526,0.0032,0.4708
DIAMONDS QUEEN SPADES FIVE,0.6608,0.02,0.3192
CLUBS SIX HEARTS JACK,0.6664,0.0352,0.2984
SPADES QUEEN SPADES FOUR,0.6328,0.0182,0.349
CLUBS ACE DIAMONDS FIVE,0.6464,0.0036,0.35
HEARTS ACE CLUBS KING,0.5262,0.0052,0.4686
SPADES FIVE HEARTS TEN,0.6718,0.0484,0.2798
HEARTS QUEEN HEARTS JACK,0.493,0.014,0.493
HEARTS SEVEN DIAMONDS TWO,0.7986,0.0824,0.119
DIAMONDS ACE CLUBS QUEEN,0.523,0.0034,0.4736
HEARTS FIVE HEARTS JACK,0.6416,0.0316,0.3268
CLUBS SIX DIAMONDS TEN,0.6662,0.0478,0.286
HEARTS TWO HEARTS TEN,0.653,0.0452,0.3018
SPADES KING CLUBS NINE,0.5466,0.0102,0.4432
CLUBS SEVEN CLUBS FIVE,0.7198,0.0808,0.1994
SPADES JACK DIAMONDS TEN,0.5298,0.0224,0.4478
DIAMONDS TWO SPADES EIGHT,0.8412,0.0852,0.0736
HEARTS TWO SPADES TWO,0.6292,0.1878,0.183
HEARTS FIVE CLUBS THREE,0.739,0.098,0.163
DIAMONDS THREE CLUBS TEN,0.678,0.0498,0.2722
SPADES KING HEARTS NINE,0.548,0.0102,0.4418
DIAMONDS THREE CLUBS QUEEN,0.68,0.0268,0.2932
CLUBS JACK DIAMONDS TWO,0.688,0.0264,0.2856
DIAMONDS THREE HEARTS KING,0.678,0.0138,0.3082
DIAMONDS TWO HEARTS FIVE,0.7578,0.1024,0.1398
CLUBS JACK CLUBS SIX,0.6502,0.0306,0.3192
SPADES ACE DIAMONDS SEVEN,0.6544,0.004,0.3416
CLUBS NINE SPADES FOUR,0.6796,0.0576,0.2628
SPADES ACE CLUBS FIVE,0.6454,0.0022,0.3524
SPADES QUEEN CLUBS TWO,0.6666,0.0262,0.3072
SPADES JACK HEARTS TWO,0.6832,0.0322,0.2846
HEARTS SEVEN HEARTS FIVE,0.7382,0.0758,0.186
CLUBS FIVE DIAMONDS FOUR,0.741,0.0952,0.1638
CLUBS NINE DIAMONDS SEVEN,0.6498,0.0616,0.2886
HEARTS TWO CLUBS FOUR,0.7582,0.1044,0.1374
CLUBS TEN CLUBS SIX,0.6328,0.0474,0.3198
DIAMONDS THREE CLUBS THREE,0.6466,0.1734,0.18
CLUBS NINE SPADES NINE,0.1796,0.1638,0.6566
CLUBS FOUR SPADES THREE,0.741,0.095,0.164
SPADES QUEEN CLUBS THREE,0.6852,0.02,0.2948
CLUBS JACK CLUBS FIVE,0.6296,0.0328,0.3376
CLUBS EIGHT SPADES SEVEN,0.7856,0.077,0.1374
HEARTS SEVEN CLUBS TEN,0.6602,0.0462,0.2936
SPADES JACK CLUBS SIX,0.671,0.0342,0.2948
SPADES TEN SPADES FIVE,0.6368,0.04,0.3232
HEARTS JACK CLUBS QUEEN,0.5164,0.0102,0.4734
HEARTS SEVEN DIAMONDS SIX,0.773,0.0856,0.1414
CLUBS TWO CLUBS QUEEN,0.6352,0.02,0.3448
SPADES ACE DIAMONDS NINE,0.5522,0.0022,0.4456
CLUBS JACK HEARTS KING,0.528,0.006,0.466
CLUBS TEN SPADES NINE,0.5408,0.0356,0.4236
HEARTS SIX HEARTS FIVE,0.7158,0.094,0.1902
SPADES ACE SPADES NINE,0.5262,0.003,0.4708
HEARTS ACE CLUBS ACE,0.1926,0.0026,0.8048
HEARTS QUEEN DIAMONDS SIX,0.6752,0.0222,0.3026
HEARTS THREE CLUBS FIVE,0.7406,0.094,0.1654
DIAMONDS THREE SPADES FIVE,0.7388,0.0996,0.1616
DIAMONDS THREE SPADES EIGHT,0.8528,0.09,0.0572
HEARTS FOUR SPADES THREE,0.7376,0.097,0.1654
CLUBS SEVEN DIAMONDS NINE,0.6684,0.062,0.2696
DIAMONDS KING CLUBS TWO,0.6702,0.01,0.3198
CLUBS SIX CLUBS TWO,0.7354,0.086,0.1786
DIAMONDS QUEEN SPADES THREE,0.6716,0.0202,0.3082
CLUBS NINE CLUBS ACE,0.522,0.0024,0.4756
SPADES EIGHT SPADES FIVE,0.7624,0.0792,0.1584
DIAMONDS TWO HEARTS FOUR,0.7556,0.1092,0.1352
DIAMONDS QUEEN CLUBS KING,0.5314,0.0088,0.4598
DIAMONDS THREE SPADES QUEEN,0.6724,0.0224,0.3052
HEARTS SIX CLUBS SIX,0.634,0.1846,0.1814
CLUBS FIVE DIAMONDS NINE,0.6724,0.0588,0.2688
HEARTS SEVEN DIAMONDS FOUR,0.782,0.0832,0.1348
CLUBS JACK SPADES THREE,0.6722,0.031,0.2968
HEARTS ACE SPADES THREE,0.6488,0.0042,0.347
HEARTS TWO DIAMONDS FOUR,0.7522,0.1058,0.142
SPADES FOUR DIAMONDS FIVE,0.7382,0.0966,0.1652
CLUBS SEVEN DIAMONDS FIVE,0.7648,0.0784,0.1568
SPADES NINE CLUBS KING,0.5446,0.0082,0.4472
SPADES FIVE HEARTS KING,0.654,0.0144,0.3316
HEARTS SIX CLUBS KING,0.663,0.0122,0.3248
SPADES EIGHT HEARTS QUEEN,0.6652,0.0288,0.306
HEARTS SIX HEARTS KING,0.637,0.0144,0.3486
SPADES NINE DIAMONDS QUEEN,0.5502,0.0158,0.434
SPADES JACK CLUBS KING,0.5266,0.0078,0.4656
DIAMONDS QUEEN CLUBS QUEEN,0.189,0.0612,0.7498
CLUBS EIGHT SPADES TWO,0.837,0.0874,0.0756
CLUBS TEN DIAMONDS KING,0.5308,0.0058,0.4634
DIAMONDS KING HEARTS NINE,0.5378,0.0112,0.451
HEARTS JACK DIAMONDS FOUR,0.6648,0.0386,0.2966
HEARTS THREE SPADES FIVE,0.7366,0.0954,0.168
SPADES FOUR DIAMONDS TEN,0.6652,0.0484,0.2864
HEARTS SIX CLUBS FOUR,0.7508,0.0918,0.1574
DIAMONDS JACK HEARTS TEN,0.509,0.025,0.466
SPADES TEN HEARTS TWO,0.6732,0.042,0.2848
CLUBS SEVEN HEARTS TEN,0.6632,0.0442,0.2926
CLUBS JACK SPADES KING,0.5398,0.0072,0.453
HEARTS SEVEN DIAMONDS QUEEN,0.679,0.0226,0.2984
HEARTS FIVE CLUBS TWO,0.7528,0.0986,0.1486
DIAMONDS JACK HEARTS QUEEN,0.5196,0.0118,0.4686
HEARTS FIVE CLUBS SIX,0.7488,0.092,0.1592
SPADES QUEEN CLUBS FOUR,0.678,0.02,0.302
DIAMONDS QUEEN SPADES TWO,0.6714,0.0256,0.303
HEARTS THREE DIAMONDS SEVEN,0.788,0.0818,0.1302
CLUBS EIGHT SPADES FOUR,0.8226,0.0866,0.0908
SPADES EIGHT DIAMONDS SEVEN,0.7864,0.0776,0.136
HEARTS SEVEN SPADES JACK,0.6904,0.0286,0.281
SPADES SIX CLUBS ACE,0.656,0.0024,0.3416
SPADES ACE SPADES KING,0.505,0.0036,0.4914
SPADES JACK HEARTS ACE,0.5396,0.0036,0.4568
CLUBS TEN SPADES TEN,0.1832,0.1284,0.6884
HEARTS SIX CLUBS NINE,0.6656,0.0604,0.274
SPADES NINE DIAMONDS KING,0.5476,0.0104,0.442
CLUBS NINE SPADES TWO,0.6744,0.0586,0.267
SPADES EIGHT CLUBS KING,0.6738,0.0224,0.3038
CLUBS FIVE HEARTS KING,0.6618,0.014,0.3242
CLUBS TEN CLUBS TWO,0.6346,0.0478,0.3176
HEARTS SIX HEARTS FOUR,0.7238,0.0846,0.1916
SPADES QUEEN SPADES SEVEN,0.63,0.0266,0.3434
DIAMONDS TWO CLUBS FIVE,0.7502,0.106,0.1438
SPADES NINE DIAMONDS SEVEN,0.6688,0.0592,0.272
HEARTS QUEEN CLUBS KING,0.521,0.0056,0.4734
HEARTS FOUR SPADES TEN,0.6846,0.0468,0.2686
SPADES THREE HEARTS NINE,0.6664,0.0666,0.267
CLUBS TEN HEARTS JACK,0.5212,0.021,0.4578
HEARTS FIVE CLUBS EIGHT,0.8038,0.0872,0.109
HEARTS THREE HEARTS ACE,0.6166,0.005,0.3784
DIAMONDS TWO DIAMONDS JACK,0.6526,0.0302,0.3172
SPADES SEVEN DIAMONDS KING,0.6646,0.0106,0.3248
HEARTS SIX SPADES SIX,0.627,0.1892,0.1838
CLUBS NINE SPADES SEVEN,0.668,0.0584,0.2736
CLUBS JACK DIAMONDS TEN,0.5266,0.0268,0.4466
HEARTS TEN DIAMONDS FOUR,0.6666,0.0464,0.287
CLUBS TEN HEARTS TWO,0.6804,0.0448,0.2748
HEARTS FIVE DIAMONDS FOUR,0.7372,0.105,0.1578
DIAMONDS THREE HEARTS QUEEN,0.6762,0.0282,0.2956
DIAMONDS TWO CLUBS KING,0.671,0.0136,0.3154
CLUBS SIX DIAMONDS FIVE,0.7456,0.0946,0.1598
SPADES ACE SPADES FOUR,0.6142,0.003,0.3828
SPADES FOUR HEARTS JACK,0.6644,0.0326,0.303
HEARTS KING DIAMONDS SIX,0.674,0.0106,0.3154
CLUBS EIGHT DIAMONDS SIX,0.7982,0.089,0.1128
DIAMONDS ACE CLUBS TWO,0.6566,0.004,0.3394
CLUBS JACK HEARTS SEVEN,0.672,0.0382,0.2898
HEARTS FOUR DIAMONDS SIX,0.7588,0.0972,0.144
SPADES KING HEARTS TWO,0.6752,0.0116,0.3132
CLUBS JACK SPADES EIGHT,0.6552,0.0378,0.307
DIAMONDS JACK DIAMONDS NINE,0.5122,0.0316,0.4562
SPADES TEN DIAMONDS JACK,0.5256,0.0242,0.4502
SPADES QUEEN DIAMONDS SIX,0.6662,0.0172,0.3166
CLUBS SEVEN CLUBS THREE,0.7238,0.0794,0.1968
SPADES JACK SPADES EIGHT,0.6208,0.0356,0.3436
SPADES ACE CLUBS SEVEN,0.6694,0.0028,0.3278
DIAMONDS THREE SPADES THREE,0.6344,0.1842,0.1814
HEARTS KING DIAMONDS FIVE,0.662,0.0114,0.3266
HEARTS FOUR SPADES NINE,0.6856,0.0622,0.2522
HEARTS SEVEN HEARTS SIX,0.733,0.0826,0.1844
