opposingHand,winningChance,drawChance,lostChance
SPADES TEN HEARTS TWO,0.64,0.0032,0.3568
SPADES JACK SPADES FOUR,0.5992,0.0034,0.3974
SPADES TEN DIAMONDS EIGHT,0.572,0.0042,0.4238
SPADES JACK HEARTS KING,0.5772,0.0028,0.42
SPADES FIVE DIAMONDS TEN,0.6446,0.0068,0.3486
SPADES QUEEN DIAMONDS TEN,0.562,0.004,0.434
CLUBS NINE SPADES NINE,0.3192,0.0032,0.6776
HEARTS SEVEN SPADES FOUR,0.7272,0.0274,0.2454
SPADES TWO DIAMONDS SIX,0.6848,0.0052,0.31
CLUBS NINE HEARTS SIX,0.6282,0.0038,0.368
HEARTS SIX DIAMONDS EIGHT,0.6154,0.0036,0.381
HEARTS FIVE DIAMONDS NINE,0.626,0.0032,0.3708
SPADES ACE CLUBS KING,0.2418,0.0482,0.71
DIAMONDS KING HEARTS NINE,0.6022,0.0028,0.395
SPADES EIGHT CLUBS TWO,0.6422,0.0054,0.3524
CLUBS THREE CLUBS JACK,0.592,0.0048,0.4032
DIAMONDS KING DIAMONDS QUEEN,0.544,0.0034,0.4526
SPADES QUEEN DIAMONDS SEVEN,0.7412,0.0272,0.2316
DIAMONDS THREE CLUBS NINE,0.6472,0.004,0.3488
DIAMONDS KING HEARTS KING,0.2786,0.0044,0.717
DIAMONDS THREE HEARTS NINE,0.6512,0.003,0.3458
SPADES KING SPADES SIX,0.5996,0.0034,0.397
HEARTS FIVE CLUBS FOUR,0.6256,0.004,0.3704
CLUBS TWO DIAMONDS FOUR,0.6644,0.0052,0.3304
SPADES EIGHT DIAMONDS NINE,0.5694,0.0054,0.4252
DIAMONDS TEN DIAMONDS FIVE,0.6132,0.0046,0.3822
SPADES TEN SPADES TWO,0.612,0.0046,0.3834
CLUBS EIGHT SPADES TEN,0.58,0.0038,0.4162
CLUBS SEVEN SPADES THREE,0.7476,0.0286,0.2238
HEARTS FIVE CLUBS SIX,0.6222,0.004,0.3738
SPADES QUEEN HEARTS JACK,0.558,0.0056,0.4364
SPADES KING CLUBS SEVEN,0.7318,0.0328,0.2354
HEARTS QUEEN DIAMONDS FIVE,0.6426,0.0044,0.353
HEARTS THREE HEARTS EIGHT,0.604,0.0046,0.3914
HEARTS FIVE CLUBS JACK,0.6332,0.0042,0.3626
CLUBS SEVEN CLUBS QUEEN,0.688,0.0252,0.2868
DIAMONDS KING CLUBS QUEEN,0.5794,0.0046,0.416
HEARTS KING HEARTS NINE,0.5598,0.0034,0.4368
DIAMONDS TWO HEARTS FOUR,0.6494,0.006,0.3446
DIAMONDS TWO CLUBS EIGHT,0.647,0.0042,0.3488
SPADES ACE DIAMONDS FIVE,0.4516,0.302,0.2464
CLUBS SEVEN HEARTS JACK,0.722,0.0202,0.2578
HEARTS SIX SPADES TEN,0.63,0.0036,0.3664
SPADES KING DIAMONDS FOUR,0.6372,0.004,0.3588
HEARTS JACK DIAMONDS SIX,0.646,0.0048,0.3492
SPADES EIGHT CLUBS JACK,0.5826,0.0044,0.413
CLUBS ACE DIAMONDS SIX,0.4812,0.3018,0.217
HEARTS SEVEN DIAMONDS THREE,0.7452,0.0284,0.2264
CLUBS QUEEN HEARTS EIGHT,0.6024,0.0016,0.396
HEARTS SIX CLUBS FOUR,0.6306,0.0034,0.366
SPADES KING CLUBS EIGHT,0.604,0.0038,0.3922
HEARTS FIVE CLUBS FIVE,0.4462,0.0044,0.5494
DIAMONDS TWO DIAMONDS FIVE,0.6138,0.0048,0.3814
CLUBS SIX DIAMONDS NINE,0.638,0.0046,0.3574
DIAMONDS KING CLUBS ACE,0.25,0.047,0.703
HEARTS FOUR CLUBS QUEEN,0.6408,0.0038,0.3554
SPADES SIX SPADES FIVE,0.5996,0.0046,0.3958
CLUBS FOUR DIAMONDS FIVE,0.629,0.0048,0.3662
HEARTS TWO CLUBS JACK,0.6428,0.005,0.3522
SPADES TEN DIAMONDS FOUR,0.6252,0.006,0.3688
SPADES TEN SPADES EIGHT,0.5454,0.0052,0.4494
SPADES KING DIAMONDS SEVEN,0.752,0.0274,0.2206
SPADES ACE CLUBS THREE,0.4478,0.3108,0.2414
SPADES KING HEARTS EIGHT,0.593,0.0026,0.4044
SPADES TEN CLUBS FOUR,0.6274,0.0046,0.368
SPADES FIVE CLUBS KING,0.637,0.0046,0.3584
SPADES THREE HEARTS QUEEN,0.6384,0.0054,0.3562
CLUBS SEVEN CLUBS SIX,0.6504,0.0248,0.3248
CLUBS EIGHT DIAMONDS SEVEN,0.69,0.0202,0.2898
