opposingHand,winningChance,drawChance,lostChance
CLUBS KING HEARTS NINE,0.0702,0.9034,0.0264
SPADES QUEEN HEARTS TEN,0.6106,0.0062,0.3832
SPADES ACE HEARTS TEN,0.3798,0.0044,0.6158
SPADES TEN HEARTS NINE,0.703,0.028,0.269
SPADES JACK HEARTS NINE,0.6996,0.0326,0.2678
SPADES TEN HEARTS TEN,0.3424,0.0074,0.6502
SPADES JACK HEARTS TEN,0.5794,0.0058,0.4148
SPADES SIX HEARTS EIGHT,0.6614,0.007,0.3316
SPADES SEVEN HEARTS EIGHT,0.6316,0.0054,0.363
CLUBS THREE HEARTS JACK,0.6476,0.0072,0.3452
SPADES EIGHT HEARTS EIGHT,0.4818,0.0134,0.5048
CLUBS THREE HEARTS TEN,0.6582,0.0066,0.3352
SPADES TWO HEARTS EIGHT,0.6826,0.0078,0.3096
SPADES QUEEN HEARTS NINE,0.7316,0.0274,0.241
SPADES THREE HEARTS EIGHT,0.69,0.0072,0.3028
SPADES FOUR HEARTS EIGHT,0.6686,0.0066,0.3248
SPADES FIVE HEARTS EIGHT,0.6704,0.0058,0.3238
SPADES ACE HEARTS NINE,0.2862,0.0202,0.6936
CLUBS EIGHT HEARTS EIGHT,0.4598,0.0088,0.5314
CLUBS NINE HEARTS EIGHT,0.7138,0.0318,0.2544
CLUBS THREE HEARTS KING,0.6362,0.145,0.2188
CLUBS FOUR HEARTS EIGHT,0.6966,0.0078,0.2956
CLUBS THREE HEARTS QUEEN,0.6572,0.0078,0.335
CLUBS FIVE HEARTS EIGHT,0.6706,0.0076,0.3218
CLUBS SIX HEARTS EIGHT,0.6618,0.006,0.3322
CLUBS THREE HEARTS ACE,0.446,0.0032,0.5508
CLUBS SEVEN HEARTS EIGHT,0.656,0.0064,0.3376
CLUBS THREE HEARTS EIGHT,0.6994,0.0074,0.2932
CLUBS TWO HEARTS EIGHT,0.6854,0.0068,0.3078
SPADES TEN SPADES FOUR,0.6642,0.0084,0.3274
SPADES JACK SPADES FOUR,0.6474,0.0088,0.3438
HEARTS NINE HEARTS EIGHT,0.6854,0.0342,0.2804
SPADES QUEEN SPADES FOUR,0.6546,0.0072,0.3382
SPADES ACE SPADES FOUR,0.3866,0.0082,0.6052
HEARTS KING HEARTS TEN,0.26,0.104,0.636
HEARTS QUEEN HEARTS TEN,0.557,0.0058,0.4372
HEARTS ACE HEARTS TEN,0.3696,0.0048,0.6256
CLUBS JACK HEARTS SEVEN,0.6478,0.0074,0.3448
HEARTS SEVEN CLUBS TEN,0.646,0.005,0.349
CLUBS KING HEARTS SEVEN,0.634,0.1486,0.2174
CLUBS QUEEN HEARTS SEVEN,0.6592,0.0078,0.333
CLUBS ACE HEARTS SEVEN,0.4204,0.0046,0.575
CLUBS SEVEN HEARTS ACE,0.444,0.0038,0.5522
CLUBS SEVEN HEARTS KING,0.6282,0.156,0.2158
CLUBS SEVEN HEARTS QUEEN,0.6606,0.0064,0.333
CLUBS SEVEN HEARTS JACK,0.651,0.007,0.342
CLUBS SEVEN HEARTS TEN,0.642,0.0056,0.3524
CLUBS THREE CLUBS TEN,0.6172,0.0048,0.378
CLUBS THREE CLUBS JACK,0.6304,0.0064,0.3632
CLUBS THREE CLUBS ACE,0.4118,0.0046,0.5836
CLUBS THREE CLUBS QUEEN,0.6268,0.0074,0.3658
CLUBS THREE CLUBS KING,0.5926,0.1512,0.2562
HEARTS JACK HEARTS TEN,0.5568,0.0076,0.4356
SPADES ACE CLUBS ACE,0.1696,0.0048,0.8256
SPADES QUEEN CLUBS ACE,0.4016,0.0048,0.5936
SPADES JACK CLUBS ACE,0.3934,0.0054,0.6012
SPADES TEN CLUBS ACE,0.3858,0.005,0.6092
SPADES EIGHT HEARTS NINE,0.7086,0.03,0.2614
SPADES SIX HEARTS NINE,0.723,0.0334,0.2436
SPADES SEVEN HEARTS NINE,0.7096,0.0356,0.2548
CLUBS SEVEN HEARTS NINE,0.7114,0.0332,0.2554
CLUBS SIX HEARTS NINE,0.731,0.0386,0.2304
CLUBS FIVE HEARTS NINE,0.7204,0.039,0.2406
CLUBS FOUR HEARTS NINE,0.7436,0.0336,0.2228
CLUBS THREE HEARTS NINE,0.7518,0.036,0.2122
CLUBS TWO HEARTS NINE,0.7562,0.0322,0.2116
SPADES FIVE HEARTS NINE,0.7302,0.035,0.2348
SPADES FOUR HEARTS NINE,0.7418,0.0374,0.2208
SPADES THREE HEARTS NINE,0.7358,0.0414,0.2228
SPADES TWO HEARTS NINE,0.754,0.0326,0.2134
CLUBS NINE HEARTS NINE,0.3504,0.0224,0.6272
CLUBS EIGHT HEARTS NINE,0.7142,0.035,0.2508
