opposingHand,winningChance,drawChance,lostChance
SPADES KING DIAMONDS QUEEN
HEARTS FIVE SPADES TEN,0.675,0.0086,0.3164
HEARTS FIVE SPADES JACK,0.685,0.0066,0.3084
SPADES FIVE CLUBS JACK,0.6734,0.005,0.3216
CLUBS TEN SPADES FIVE,0.682,0.0066,0.3114
CLUBS EIGHT CLUBS JACK,0.6074,0.0044,0.3882
CLUBS TEN CLUBS EIGHT,0.6024,0.0056,0.392
CLUBS EIGHT CLUBS KING,0.6626,0.0564,0.281
SPADES FIVE CLUBS ACE,0.4176,0.005,0.5774
CLUBS EIGHT CLUBS QUEEN,0.6924,0.0288,0.2788
SPADES FIVE CLUBS KING,0.699,0.0598,0.2412
SPADES FIVE CLUBS QUEEN,0.7366,0.0278,0.2356
CLUBS EIGHT CLUBS ACE,0.4038,0.0048,0.5914
DIAMONDS TWO DIAMONDS THREE,0.6244,0.005,0.3706
DIAMONDS TWO DIAMONDS FIVE,0.6124,0.0058,0.3818
DIAMONDS TWO DIAMONDS FOUR,0.6222,0.0092,0.3686
HEARTS FIVE SPADES QUEEN,0.743,0.0248,0.2322
DIAMONDS TWO DIAMONDS SEVEN,0.6484,0.0076,0.344
DIAMONDS TWO DIAMONDS SIX,0.6244,0.0056,0.37
SPADES ACE HEARTS FIVE,0.4264,0.0052,0.5684
DIAMONDS TWO DIAMONDS NINE,0.648,0.0054,0.3466
DIAMONDS TWO DIAMONDS EIGHT,0.6364,0.0088,0.3548
DIAMONDS THREE DIAMONDS FOUR,0.6138,0.0112,0.375
SPADES FOUR CLUBS TWO,0.6546,0.0068,0.3386
DIAMONDS THREE DIAMONDS FIVE,0.6072,0.0088,0.384
SPADES FIVE CLUBS TWO,0.6508,0.0066,0.3426
CLUBS TWO SPADES TWO,0.4688,0.0112,0.52
CLUBS TWO SPADES THREE,0.666,0.008,0.326
DIAMONDS THREE DIAMONDS EIGHT,0.6476,0.008,0.3444
SPADES EIGHT CLUBS TWO,0.6738,0.007,0.3192
DIAMONDS THREE DIAMONDS NINE,0.6452,0.0094,0.3454
SPADES NINE CLUBS TWO,0.6784,0.0062,0.3154
DIAMONDS THREE DIAMONDS SIX,0.6098,0.0066,0.3836
SPADES SIX CLUBS TWO,0.661,0.0068,0.3322
DIAMONDS THREE DIAMONDS SEVEN,0.6268,0.0068,0.3664
SPADES SEVEN CLUBS TWO,0.6698,0.0084,0.3218
CLUBS SIX CLUBS TWO,0.6228,0.0054,0.3718
CLUBS SEVEN CLUBS TWO,0.642,0.0054,0.3526
CLUBS FOUR CLUBS TWO,0.6056,0.0072,0.3872
CLUBS FIVE CLUBS TWO,0.5968,0.006,0.3972
CLUBS TEN CLUBS JACK,0.5992,0.0062,0.3946
DIAMONDS FOUR DIAMONDS SIX,0.6148,0.008,0.3772
CLUBS TEN CLUBS QUEEN,0.6818,0.0252,0.293
DIAMONDS FOUR DIAMONDS SEVEN,0.6204,0.0088,0.3708
CLUBS TEN CLUBS KING,0.657,0.0556,0.2874
CLUBS TEN CLUBS ACE,0.3756,0.0044,0.62
CLUBS EIGHT CLUBS TWO,0.627,0.0068,0.3662
DIAMONDS FIVE DIAMONDS FOUR,0.5928,0.0078,0.3994
CLUBS NINE CLUBS TWO,0.635,0.009,0.356
DIAMONDS NINE DIAMONDS FOUR,0.6396,0.0078,0.3526
DIAMONDS EIGHT DIAMONDS FOUR,0.6324,0.0094,0.3582
CLUBS THREE CLUBS TWO,0.6056,0.0108,0.3836
DIAMONDS NINE DIAMONDS FIVE,0.628,0.0054,0.3666
DIAMONDS TWO CLUBS JACK,0.6842,0.007,0.3088
DIAMONDS EIGHT DIAMONDS FIVE,0.6234,0.005,0.3716
CLUBS TEN DIAMONDS TWO,0.6862,0.0058,0.308
DIAMONDS FIVE DIAMONDS SEVEN,0.6016,0.0062,0.3922
DIAMONDS FIVE DIAMONDS SIX,0.5954,0.0048,0.3998
DIAMONDS TWO CLUBS ACE,0.4102,0.0064,0.5834
DIAMONDS TWO CLUBS KING,0.709,0.0672,0.2238
DIAMONDS TWO CLUBS QUEEN,0.753,0.0254,0.2216
DIAMONDS EIGHT DIAMONDS SIX,0.6102,0.0046,0.3852
DIAMONDS NINE DIAMONDS SIX,0.624,0.0062,0.3698
HEARTS ACE SPADES THREE,0.4092,0.0044,0.5864
SPADES THREE HEARTS KING,0.7032,0.0652,0.2316
DIAMONDS SEVEN DIAMONDS SIX,0.5892,0.0064,0.4044
SPADES THREE HEARTS QUEEN,0.7546,0.0246,0.2208
SPADES THREE HEARTS JACK,0.6896,0.0062,0.3042
SPADES THREE HEARTS TEN,0.6774,0.0056,0.317
DIAMONDS EIGHT DIAMONDS SEVEN,0.6164,0.0056,0.378
DIAMONDS NINE DIAMONDS SEVEN,0.6134,0.005,0.3816
DIAMONDS NINE DIAMONDS EIGHT,0.6074,0.0072,0.3854
DIAMONDS KING HEARTS TEN,0.6972,0.0588,0.244
HEARTS THREE HEARTS TEN,0.6322,0.0078,0.36
SPADES JACK CLUBS SIX,0.6884,0.0058,0.3058
DIAMONDS KING HEARTS JACK,0.7002,0.0642,0.2356
HEARTS THREE HEARTS JACK,0.6412,0.008,0.3508
SPADES TEN CLUBS SIX,0.6694,0.0058,0.3248
SPADES JACK SPADES FIVE,0.6552,0.0086,0.3362
SPADES TEN SPADES FIVE,0.6452,0.0072,0.3476
DIAMONDS KING HEARTS ACE,0.231,0.0106,0.7584
HEARTS THREE HEARTS ACE,0.3916,0.0048,0.6036
SPADES ACE CLUBS SIX,0.43,0.004,0.566
DIAMONDS KING HEARTS QUEEN,0.0086,0.975,0.0164
HEARTS THREE HEARTS QUEEN,0.6898,0.025,0.2852
DIAMONDS KING HEARTS KING,0.0956,0.0116,0.8928
HEARTS THREE HEARTS KING,0.6526,0.0628,0.2846
SPADES QUEEN CLUBS SIX,0.7494,0.0266,0.224
SPADES NINE HEARTS TEN,0.6446,0.0066,0.3488
SPADES NINE HEARTS JACK,0.64,0.0084,0.3516
SPADES QUEEN SPADES FIVE,0.7058,0.0322,0.262
SPADES ACE SPADES FIVE,0.391,0.0032,0.6058
SPADES NINE HEARTS QUEEN,0.746,0.0258,0.2282
SPADES NINE HEARTS KING,0.6962,0.0658,0.238
SPADES NINE HEARTS ACE,0.436,0.003,0.561
CLUBS TEN SPADES JACK,0.6494,0.0072,0.3434
CLUBS TEN SPADES TEN,0.4304,0.004,0.5656
SPADES ACE CLUBS TEN,0.3902,0.0044,0.6054
SPADES QUEEN CLUBS TEN,0.7182,0.0284,0.2534
SPADES FIVE HEARTS QUEEN,0.7508,0.0254,0.2238
SPADES FIVE HEARTS KING,0.6898,0.065,0.2452
SPADES FIVE HEARTS ACE,0.4116,0.0048,0.5836
SPADES JACK HEARTS THREE,0.6746,0.0082,0.3172
SPADES JACK DIAMONDS KING,0.701,0.0656,0.2334
SPADES TEN CLUBS EIGHT,0.6524,0.007,0.3406
SPADES JACK CLUBS EIGHT,0.6624,0.0076,0.33
SPADES TEN HEARTS THREE,0.6802,0.0076,0.3122
SPADES TEN DIAMONDS KING,0.6972,0.0664,0.2364
CLUBS SIX HEARTS ACE,0.4254,0.0056,0.569
SPADES ACE CLUBS EIGHT,0.4122,0.0048,0.583
HEARTS FIVE CLUBS JACK,0.6714,0.005,0.3236
HEARTS FIVE CLUBS TEN,0.6732,0.0046,0.3222
CLUBS SIX HEARTS QUEEN,0.7422,0.0244,0.2334
SPADES QUEEN CLUBS EIGHT,0.7508,0.0288,0.2204
CLUBS TEN SPADES THREE,0.6726,0.0064,0.321
CLUBS SIX HEARTS KING,0.6928,0.0624,0.2448
SPADES THREE CLUBS JACK,0.6774,0.0072,0.3154
DIAMONDS TWO HEARTS JACK,0.6902,0.0072,0.3026
SPADES THREE CLUBS QUEEN,0.7588,0.0262,0.215
DIAMONDS TWO HEARTS TEN,0.6846,0.0086,0.3068
SPADES THREE CLUBS KING,0.7126,0.0632,0.2242
HEARTS FIVE CLUBS ACE,0.4156,0.0048,0.5796
SPADES FIVE HEARTS TEN,0.6752,0.0062,0.3186
SPADES THREE CLUBS ACE,0.4272,0.004,0.5688
HEARTS FIVE CLUBS KING,0.6912,0.058,0.2508
SPADES FIVE HEARTS JACK,0.6654,0.0074,0.3272
HEARTS FIVE CLUBS QUEEN,0.7372,0.0226,0.2402
HEARTS THREE CLUBS KING,0.69,0.0664,0.2436
DIAMONDS KING CLUBS KING,0.0918,0.0146,0.8936
HEARTS THREE CLUBS QUEEN,0.753,0.0276,0.2194
DIAMONDS KING CLUBS QUEEN,0.0126,0.967,0.0204
HEARTS FIVE HEARTS JACK,0.6288,0.0058,0.3654
HEARTS FIVE HEARTS TEN,0.628,0.0062,0.3658
HEARTS THREE CLUBS ACE,0.413,0.005,0.582
DIAMONDS KING CLUBS ACE,0.238,0.0142,0.7478
SPADES ACE CLUBS QUEEN,0.2406,0.0114,0.748
HEARTS THREE CLUBS JACK,0.6746,0.0068,0.3186
DIAMONDS KING CLUBS JACK,0.7046,0.0582,0.2372
SPADES QUEEN CLUBS QUEEN,0.317,0.0118,0.6712
CLUBS TEN HEARTS THREE,0.6768,0.0078,0.3154
CLUBS TEN DIAMONDS KING,0.6982,0.0638,0.238
SPADES JACK CLUBS QUEEN,0.7298,0.0244,0.2458
CLUBS SIX CLUBS QUEEN,0.7004,0.0228,0.2768
SPADES TEN CLUBS QUEEN,0.7254,0.0244,0.2502
CLUBS SIX CLUBS KING,0.6458,0.0594,0.2948
CLUBS SIX CLUBS ACE,0.3996,0.0036,0.5968
HEARTS FIVE HEARTS KING,0.6492,0.0648,0.286
HEARTS FIVE HEARTS QUEEN,0.6788,0.0294,0.2918
CLUBS TEN CLUBS SIX,0.6294,0.006,0.3646
HEARTS FIVE HEARTS ACE,0.3762,0.0042,0.6196
CLUBS SIX CLUBS JACK,0.6314,0.0064,0.3622
SPADES SEVEN HEARTS JACK,0.668,0.0062,0.3258
SPADES SEVEN HEARTS TEN,0.6646,0.0042,0.3312
DIAMONDS TWO CLUBS TWO,0.4796,0.01,0.5104
DIAMONDS TWO CLUBS THREE,0.6422,0.0114,0.3464
DIAMONDS TWO HEARTS SIX,0.6544,0.007,0.3386
DIAMONDS TWO HEARTS QUEEN,0.7474,0.0304,0.2222
HEARTS SEVEN DIAMONDS TWO,0.66,0.0074,0.3326
DIAMONDS TWO HEARTS KING,0.7166,0.0668,0.2166
DIAMONDS TWO HEARTS EIGHT,0.6726,0.0074,0.32
DIAMONDS TWO HEARTS ACE,0.4144,0.0052,0.5804
DIAMONDS TWO HEARTS NINE,0.6784,0.0076,0.314
DIAMONDS TWO HEARTS TWO,0.482,0.009,0.509
DIAMONDS TWO DIAMONDS KING,0.6716,0.062,0.2664
DIAMONDS TWO HEARTS THREE,0.6398,0.0086,0.3516
DIAMONDS TWO DIAMONDS ACE,0.4078,0.0054,0.5868
HEARTS FOUR DIAMONDS TWO,0.654,0.009,0.337
HEARTS FIVE DIAMONDS TWO,0.6438,0.01,0.3462
SPADES SEVEN HEARTS ACE,0.4244,0.0054,0.5702
DIAMONDS TWO DIAMONDS TEN,0.6558,0.0072,0.337
SPADES SEVEN HEARTS KING,0.7012,0.0634,0.2354
DIAMONDS TWO DIAMONDS JACK,0.6706,0.0064,0.323
SPADES SEVEN HEARTS QUEEN,0.754,0.0296,0.2164
DIAMONDS TWO SPADES NINE,0.693,0.0084,0.2986
DIAMONDS TWO SPADES EIGHT,0.6922,0.0072,0.3006
DIAMONDS TWO SPADES SEVEN,0.6918,0.007,0.3012
DIAMONDS TWO SPADES SIX,0.6612,0.0066,0.3322
DIAMONDS TWO SPADES FIVE,0.6648,0.0072,0.328
DIAMONDS TWO SPADES FOUR,0.6646,0.0106,0.3248
DIAMONDS TWO SPADES THREE,0.6762,0.0086,0.3152
DIAMONDS TWO SPADES TWO,0.4728,0.0116,0.5156
CLUBS NINE DIAMONDS TWO,0.6598,0.0082,0.332
DIAMONDS TWO CLUBS EIGHT,0.6764,0.0072,0.3164
CLUBS SEVEN DIAMONDS TWO,0.6788,0.0068,0.3144
DIAMONDS TWO CLUBS SIX,0.6714,0.0092,0.3194
DIAMONDS TWO CLUBS FIVE,0.6424,0.0086,0.349
DIAMONDS TWO CLUBS FOUR,0.6412,0.0072,0.3516
CLUBS FOUR SPADES FIVE,0.629,0.0096,0.3614
CLUBS FOUR SPADES FOUR,0.4688,0.0096,0.5216
CLUBS FOUR SPADES THREE,0.6346,0.0092,0.3562
CLUBS FOUR SPADES TWO,0.6526,0.0074,0.34
SPADES NINE CLUBS FOUR,0.672,0.0066,0.3214
SPADES EIGHT CLUBS FOUR,0.666,0.0034,0.3306
SPADES SEVEN CLUBS FOUR,0.6464,0.007,0.3466
SPADES SIX CLUBS FOUR,0.6384,0.0084,0.3532
SPADES ACE DIAMONDS SIX,0.4254,0.0038,0.5708
SPADES QUEEN DIAMONDS SIX,0.752,0.0262,0.2218
SPADES TEN DIAMONDS SIX,0.6818,0.0072,0.311
SPADES JACK DIAMONDS SIX,0.6828,0.006,0.3112
SPADES QUEEN SPADES TWO,0.7366,0.027,0.2364
SPADES ACE SPADES TWO,0.3994,0.0054,0.5952
DIAMONDS JACK CLUBS JACK,0.4264,0.0034,0.5702
CLUBS TEN DIAMONDS JACK,0.6506,0.0084,0.341
DIAMONDS JACK CLUBS KING,0.7064,0.0592,0.2344
DIAMONDS JACK CLUBS QUEEN,0.739,0.0256,0.2354
DIAMONDS THREE DIAMONDS JACK,0.6476,0.0096,0.3428
DIAMONDS THREE DIAMONDS TEN,0.6462,0.0076,0.3462
DIAMONDS JACK CLUBS ACE,0.412,0.0048,0.5832
DIAMONDS THREE DIAMONDS KING,0.6598,0.0632,0.277
DIAMONDS THREE HEARTS THREE,0.484,0.0084,0.5076
DIAMONDS THREE HEARTS TWO,0.659,0.01,0.331
HEARTS FIVE DIAMONDS THREE,0.6316,0.0062,0.3622
DIAMONDS THREE DIAMONDS ACE,0.3978,0.0044,0.5978
HEARTS FOUR DIAMONDS THREE,0.647,0.0086,0.3444
HEARTS SEVEN DIAMONDS THREE,0.6568,0.008,0.3352
SPADES TEN SPADES NINE,0.6102,0.0078,0.382
HEARTS SIX DIAMONDS THREE,0.6542,0.0076,0.3382
SPADES JACK SPADES NINE,0.615,0.0036,0.3814
DIAMONDS THREE HEARTS NINE,0.677,0.0052,0.3178
HEARTS JACK DIAMONDS FOUR,0.6874,0.006,0.3066
HEARTS ACE HEARTS KING,0.234,0.0118,0.7542
SPADES TEN SPADES TWO,0.6514,0.0076,0.341
DIAMONDS THREE HEARTS EIGHT,0.667,0.0062,0.3268
HEARTS TEN DIAMONDS FOUR,0.6842,0.0076,0.3082
SPADES JACK SPADES TWO,0.6452,0.0072,0.3476
HEARTS QUEEN DIAMONDS FOUR,0.7552,0.0292,0.2156
HEARTS KING DIAMONDS FOUR,0.7022,0.0606,0.2372
SPADES ACE SPADES NINE,0.4072,0.005,0.5878
HEARTS ACE DIAMONDS FOUR,0.4188,0.006,0.5752
SPADES QUEEN SPADES NINE,0.7046,0.0272,0.2682
DIAMONDS THREE SPADES NINE,0.6718,0.0082,0.32
DIAMONDS THREE SPADES EIGHT,0.6814,0.0068,0.3118
DIAMONDS THREE SPADES SEVEN,0.6694,0.006,0.3246
DIAMONDS THREE SPADES SIX,0.6576,0.0068,0.3356
DIAMONDS THREE CLUBS SIX,0.6486,0.0072,0.3442
CLUBS FIVE CLUBS SIX,0.5742,0.0072,0.4186
CLUBS ACE DIAMONDS FOUR,0.4144,0.0054,0.5802
CLUBS SEVEN DIAMONDS THREE,0.661,0.0072,0.3318
CLUBS SEVEN CLUBS FIVE,0.5962,0.0068,0.397
DIAMONDS THREE CLUBS FOUR,0.6562,0.007,0.3368
DIAMONDS FOUR CLUBS QUEEN,0.7562,0.0242,0.2196
DIAMONDS THREE CLUBS FIVE,0.639,0.006,0.355
CLUBS KING DIAMONDS FOUR,0.7144,0.0594,0.2262
DIAMONDS THREE CLUBS TWO,0.6634,0.0068,0.3298
CLUBS TEN DIAMONDS FOUR,0.6782,0.0056,0.3162
DIAMONDS THREE CLUBS THREE,0.4884,0.0076,0.504
DIAMONDS FOUR CLUBS JACK,0.6792,0.0066,0.3142
DIAMONDS THREE SPADES FOUR,0.6362,0.0078,0.356
DIAMONDS THREE SPADES FIVE,0.639,0.0076,0.3534
DIAMONDS THREE SPADES TWO,0.6624,0.0086,0.329
DIAMONDS THREE SPADES THREE,0.4718,0.0096,0.5186
CLUBS EIGHT DIAMONDS THREE,0.686,0.0058,0.3082
CLUBS NINE DIAMONDS THREE,0.6742,0.0068,0.319
SPADES SEVEN CLUBS ACE,0.4272,0.0038,0.569
SPADES SEVEN CLUBS QUEEN,0.7452,0.0256,0.2292
SPADES SEVEN CLUBS KING,0.6944,0.0578,0.2478
CLUBS FIVE SPADES SEVEN,0.64,0.008,0.352
CLUBS TEN SPADES SEVEN,0.6542,0.0042,0.3416
CLUBS FIVE SPADES SIX,0.6222,0.005,0.3728
SPADES SEVEN CLUBS JACK,0.6722,0.009,0.3188
SPADES NINE CLUBS FIVE,0.6678,0.0076,0.3246
CLUBS FIVE SPADES EIGHT,0.6498,0.0078,0.3424
CLUBS FIVE SPADES THREE,0.6246,0.0088,0.3666
CLUBS FIVE SPADES TWO,0.648,0.007,0.345
CLUBS FIVE SPADES FIVE,0.4758,0.0068,0.5174
CLUBS FIVE SPADES FOUR,0.6186,0.0084,0.373
CLUBS NINE CLUBS FIVE,0.6152,0.0074,0.3774
CLUBS EIGHT CLUBS FIVE,0.6146,0.0058,0.3796
CLUBS ACE CLUBS QUEEN,0.2404,0.0076,0.752
CLUBS KING CLUBS QUEEN,0.0224,0.904,0.0736
DIAMONDS TEN DIAMONDS FOUR,0.6444,0.0058,0.3498
CLUBS TEN DIAMONDS NINE,0.639,0.0072,0.3538
DIAMONDS JACK DIAMONDS FOUR,0.6528,0.0102,0.337
DIAMONDS NINE CLUBS JACK,0.6578,0.0056,0.3366
SPADES NINE CLUBS JACK,0.6518,0.0092,0.339
CLUBS TEN SPADES NINE,0.6254,0.0066,0.368
DIAMONDS ACE DIAMONDS FOUR,0.3882,0.005,0.6068
HEARTS FOUR DIAMONDS FOUR,0.4646,0.0072,0.5282
DIAMONDS JACK HEARTS TEN,0.6324,0.009,0.3586
SPADES NINE CLUBS KING,0.7108,0.0596,0.2296
DIAMONDS TWO SPADES TEN,0.6984,0.0076,0.294
DIAMONDS NINE CLUBS ACE,0.4138,0.0052,0.581
HEARTS FIVE DIAMONDS FOUR,0.5962,0.0072,0.3966
DIAMONDS JACK HEARTS JACK,0.4316,0.003,0.5654
SPADES NINE CLUBS QUEEN,0.7306,0.0242,0.2452
SPADES JACK DIAMONDS TWO,0.6962,0.0074,0.2964
HEARTS TWO DIAMONDS FOUR,0.653,0.0086,0.3384
DIAMONDS NINE CLUBS QUEEN,0.7326,0.0302,0.2372
DIAMONDS KING DIAMONDS FOUR,0.656,0.0618,0.2822
HEARTS THREE DIAMONDS FOUR,0.633,0.0118,0.3552
SPADES NINE CLUBS ACE,0.4226,0.0044,0.573
DIAMONDS NINE CLUBS KING,0.701,0.0604,0.2386
HEARTS ACE DIAMONDS JACK,0.4118,0.0024,0.5858
SPADES ACE DIAMONDS TWO,0.425,0.0046,0.5704
HEARTS QUEEN DIAMONDS JACK,0.74,0.0264,0.2336
SPADES QUEEN DIAMONDS TWO,0.7582,0.0324,0.2094
DIAMONDS JACK HEARTS KING,0.6872,0.0592,0.2536
SPADES JACK SPADES SEVEN,0.646,0.0078,0.3462
SPADES TEN SPADES SEVEN,0.635,0.0044,0.3606
CLUBS SEVEN CLUBS THREE,0.6178,0.0064,0.3758
CLUBS SIX CLUBS THREE,0.603,0.0058,0.3912
CLUBS FIVE CLUBS THREE,0.5758,0.0062,0.418
CLUBS THREE CLUBS FOUR,0.6068,0.0046,0.3886
CLUBS NINE CLUBS THREE,0.642,0.007,0.351
CLUBS EIGHT CLUBS THREE,0.637,0.006,0.357
CLUBS THREE SPADES FIVE,0.6244,0.0058,0.3698
CLUBS THREE SPADES FOUR,0.649,0.0062,0.3448
CLUBS THREE SPADES THREE,0.4692,0.0114,0.5194
CLUBS THREE SPADES TWO,0.6572,0.0072,0.3356
CLUBS THREE SPADES SIX,0.6378,0.006,0.3562
SPADES SEVEN CLUBS THREE,0.6608,0.0066,0.3326
SPADES EIGHT CLUBS THREE,0.676,0.0082,0.3158
SPADES NINE CLUBS THREE,0.6802,0.0074,0.3124
SPADES TWO DIAMONDS FOUR,0.6512,0.0112,0.3376
SPADES THREE DIAMONDS FOUR,0.6494,0.0076,0.343
SPADES FOUR DIAMONDS FOUR,0.4816,0.0058,0.5126
SPADES FIVE DIAMONDS FOUR,0.6288,0.0098,0.3614
SPADES SIX DIAMONDS FOUR,0.6404,0.0078,0.3518
SPADES SEVEN DIAMONDS FOUR,0.6684,0.0084,0.3232
SPADES EIGHT DIAMONDS FOUR,0.66,0.0088,0.3312
SPADES NINE DIAMONDS FOUR,0.6894,0.0072,0.3034
CLUBS FIVE DIAMONDS FOUR,0.6286,0.0078,0.3636
CLUBS FOUR DIAMONDS FOUR,0.4762,0.009,0.5148
CLUBS SEVEN DIAMONDS FOUR,0.649,0.008,0.343
CLUBS SIX DIAMONDS FOUR,0.6316,0.0052,0.3632
CLUBS NINE DIAMONDS FOUR,0.6802,0.007,0.3128
CLUBS EIGHT DIAMONDS FOUR,0.6602,0.0074,0.3324
HEARTS SEVEN DIAMONDS FOUR,0.664,0.0084,0.3276
HEARTS SIX DIAMONDS FOUR,0.6348,0.006,0.3592
DIAMONDS FOUR HEARTS NINE,0.6824,0.0082,0.3094
DIAMONDS FOUR HEARTS EIGHT,0.6634,0.0064,0.3302
CLUBS THREE DIAMONDS FOUR,0.643,0.0072,0.3498
CLUBS TWO DIAMONDS FOUR,0.6342,0.0086,0.3572
DIAMONDS TEN DIAMONDS FIVE,0.649,0.008,0.343
DIAMONDS JACK DIAMONDS FIVE,0.645,0.0086,0.3464
DIAMONDS NINE HEARTS QUEEN,0.7264,0.0258,0.2478
DIAMONDS NINE HEARTS KING,0.6986,0.0626,0.2388
HEARTS ACE DIAMONDS NINE,0.418,0.004,0.578
DIAMONDS NINE HEARTS TEN,0.6438,0.0076,0.3486
DIAMONDS NINE HEARTS JACK,0.6494,0.0052,0.3454
CLUBS KING DIAMONDS SIX,0.6912,0.0576,0.2512
CLUBS QUEEN DIAMONDS SIX,0.7376,0.0294,0.233
CLUBS ACE DIAMONDS SIX,0.4242,0.0036,0.5722
SPADES ACE SPADES SEVEN,0.41,0.0044,0.5856
SPADES QUEEN DIAMONDS FOUR,0.7686,0.0218,0.2096
SPADES QUEEN SPADES SEVEN,0.7128,0.0234,0.2638
CLUBS JACK DIAMONDS SIX,0.6884,0.0056,0.306
SPADES ACE DIAMONDS FOUR,0.414,0.0064,0.5796
CLUBS TEN DIAMONDS SIX,0.6748,0.0058,0.3194
CLUBS NINE CLUBS FOUR,0.63,0.0046,0.3654
CLUBS EIGHT CLUBS FOUR,0.6104,0.0062,0.3834
SPADES JACK DIAMONDS FOUR,0.6894,0.0072,0.3034
SPADES TEN DIAMONDS FOUR,0.6832,0.0084,0.3084
CLUBS FIVE CLUBS FOUR,0.5762,0.0056,0.4182
CLUBS SEVEN CLUBS FOUR,0.6122,0.0044,0.3834
CLUBS SIX CLUBS FOUR,0.5922,0.0064,0.4014
CLUBS SEVEN SPADES EIGHT,0.6462,0.0054,0.3484
CLUBS SEVEN SPADES NINE,0.6396,0.0052,0.3552
CLUBS SEVEN SPADES SIX,0.626,0.0068,0.3672
CLUBS SEVEN SPADES SEVEN,0.4682,0.0072,0.5246
CLUBS SEVEN SPADES FIVE,0.6266,0.0056,0.3678
CLUBS SEVEN SPADES FOUR,0.6526,0.0058,0.3416
CLUBS SEVEN SPADES THREE,0.6628,0.0056,0.3316
CLUBS SEVEN SPADES TWO,0.6686,0.0082,0.3232
CLUBS NINE CLUBS SEVEN,0.6014,0.0052,0.3934
CLUBS SEVEN CLUBS EIGHT,0.5938,0.0084,0.3978
HEARTS SIX DIAMONDS FIVE,0.6134,0.0084,0.3782
HEARTS SEVEN DIAMONDS FIVE,0.6414,0.0078,0.3508
DIAMONDS FIVE HEARTS EIGHT,0.658,0.0082,0.3338
DIAMONDS FIVE HEARTS NINE,0.6548,0.0082,0.337
HEARTS TWO DIAMONDS FIVE,0.645,0.0084,0.3466
HEARTS KING HEARTS EIGHT,0.6566,0.059,0.2844
DIAMONDS KING DIAMONDS FIVE,0.6524,0.0616,0.286
HEARTS THREE DIAMONDS FIVE,0.6376,0.0068,0.3556
HEARTS QUEEN HEARTS EIGHT,0.6884,0.0248,0.2868
DIAMONDS ACE DIAMONDS FIVE,0.3912,0.0036,0.6052
HEARTS FOUR DIAMONDS FIVE,0.617,0.007,0.376
HEARTS FIVE DIAMONDS FIVE,0.4794,0.0074,0.5132
HEARTS ACE HEARTS EIGHT,0.3916,0.004,0.6044
CLUBS FOUR DIAMONDS FIVE,0.6252,0.0066,0.3682
CLUBS FIVE DIAMONDS FIVE,0.4674,0.009,0.5236
CLUBS SIX DIAMONDS FIVE,0.6236,0.0084,0.368
CLUBS SEVEN DIAMONDS FIVE,0.6376,0.0046,0.3578
CLUBS TWO DIAMONDS FIVE,0.651,0.009,0.34
CLUBS THREE DIAMONDS FIVE,0.6366,0.0068,0.3566
SPADES THREE DIAMONDS FIVE,0.6356,0.0086,0.3558
SPADES TWO DIAMONDS FIVE,0.6548,0.0084,0.3368
SPADES JACK DIAMONDS EIGHT,0.6742,0.008,0.3178
SPADES FIVE DIAMONDS FIVE,0.474,0.0074,0.5186
CLUBS TEN HEARTS JACK,0.6422,0.0048,0.353
SPADES TEN DIAMONDS EIGHT,0.6688,0.0068,0.3244
SPADES FOUR DIAMONDS FIVE,0.6224,0.0064,0.3712
HEARTS JACK CLUBS JACK,0.435,0.0036,0.5614
HEARTS JACK CLUBS QUEEN,0.736,0.0232,0.2408
CLUBS NINE DIAMONDS FIVE,0.6628,0.007,0.3302
CLUBS KING HEARTS JACK,0.6848,0.0612,0.254
CLUBS EIGHT DIAMONDS FIVE,0.664,0.0068,0.3292
CLUBS ACE HEARTS JACK,0.4012,0.0028,0.596
SPADES SEVEN DIAMONDS FIVE,0.647,0.0086,0.3444
SPADES SIX DIAMONDS FIVE,0.6358,0.0074,0.3568
SPADES QUEEN DIAMONDS EIGHT,0.7542,0.0284,0.2174
SPADES NINE DIAMONDS FIVE,0.6598,0.0082,0.332
SPADES EIGHT DIAMONDS FIVE,0.6524,0.0088,0.3388
SPADES ACE DIAMONDS EIGHT,0.4156,0.0046,0.5798
DIAMONDS TEN DIAMONDS SIX,0.649,0.0076,0.3434
HEARTS ACE DIAMONDS SEVEN,0.4212,0.0038,0.575
DIAMONDS JACK DIAMONDS SIX,0.6444,0.0072,0.3484
HEARTS QUEEN DIAMONDS SEVEN,0.7494,0.0222,0.2284
HEARTS KING DIAMONDS SEVEN,0.6966,0.0654,0.238
DIAMONDS ACE DIAMONDS SIX,0.4108,0.006,0.5832
HEARTS FOUR DIAMONDS SIX,0.6346,0.0068,0.3586
SPADES TWO HEARTS JACK,0.6884,0.008,0.3036
HEARTS FIVE DIAMONDS SIX,0.6236,0.0068,0.3696
SPADES TWO HEARTS TEN,0.6808,0.0064,0.3128
HEARTS TWO DIAMONDS SIX,0.6448,0.0076,0.3476
DIAMONDS KING DIAMONDS SIX,0.658,0.0676,0.2744
HEARTS THREE DIAMONDS SIX,0.665,0.007,0.328
HEARTS EIGHT DIAMONDS SIX,0.6396,0.0066,0.3538
HEARTS NINE DIAMONDS SIX,0.6436,0.0044,0.352
HEARTS SIX DIAMONDS SIX,0.4716,0.0076,0.5208
HEARTS SEVEN DIAMONDS SIX,0.624,0.0054,0.3706
HEARTS TEN DIAMONDS SEVEN,0.6552,0.0078,0.337
CLUBS TWO DIAMONDS SIX,0.6478,0.0086,0.3436
HEARTS JACK DIAMONDS SEVEN,0.6666,0.009,0.3244
CLUBS THREE DIAMONDS SIX,0.6546,0.008,0.3374
CLUBS SEVEN DIAMONDS SIX,0.6266,0.007,0.3664
DIAMONDS EIGHT CLUBS JACK,0.6634,0.0068,0.3298
CLUBS SIX DIAMONDS SIX,0.483,0.0056,0.5114
CLUBS TEN DIAMONDS EIGHT,0.6586,0.0066,0.3348
CLUBS FIVE DIAMONDS SIX,0.6236,0.0058,0.3706
CLUBS FOUR DIAMONDS SIX,0.6442,0.007,0.3488
HEARTS ACE HEARTS JACK,0.3592,0.006,0.6348
DIAMONDS EIGHT CLUBS ACE,0.4238,0.0038,0.5724
HEARTS QUEEN HEARTS JACK,0.6944,0.0232,0.2824
DIAMONDS EIGHT CLUBS KING,0.7038,0.06,0.2362
CLUBS NINE DIAMONDS SIX,0.633,0.0066,0.3604
HEARTS KING HEARTS JACK,0.66,0.0616,0.2784
DIAMONDS EIGHT CLUBS QUEEN,0.7552,0.028,0.2168
CLUBS EIGHT DIAMONDS SIX,0.6488,0.0062,0.345
SPADES TEN HEARTS KING,0.6896,0.0668,0.2436
SPADES FIVE DIAMONDS SIX,0.6314,0.0092,0.3594
HEARTS ACE SPADES TWO,0.4186,0.0058,0.5756
SPADES JACK HEARTS KING,0.7092,0.06,0.2308
SPADES FOUR DIAMONDS SIX,0.6348,0.0068,0.3584
SPADES THREE DIAMONDS SIX,0.6714,0.0046,0.324
HEARTS QUEEN SPADES TWO,0.7684,0.0244,0.2072
SPADES TWO HEARTS KING,0.7046,0.0618,0.2336
SPADES TWO DIAMONDS SIX,0.6618,0.0094,0.3288
HEARTS TEN HEARTS EIGHT,0.6066,0.0058,0.3876
SPADES NINE DIAMONDS SIX,0.6634,0.007,0.3296
HEARTS JACK HEARTS EIGHT,0.6086,0.0066,0.3848
SPADES EIGHT DIAMONDS SIX,0.6496,0.0072,0.3432
SPADES SEVEN DIAMONDS SIX,0.6386,0.008,0.3534
SPADES SIX DIAMONDS SIX,0.4802,0.007,0.5128
SPADES QUEEN HEARTS KING,0.02,0.9704,0.0096
CLUBS ACE CLUBS KING,0.2338,0.0118,0.7544
SPADES ACE HEARTS KING,0.2378,0.0128,0.7494
SPADES ACE HEARTS JACK,0.4002,0.0052,0.5946
SPADES QUEEN HEARTS JACK,0.7304,0.0294,0.2402
SPADES TEN DIAMONDS TEN,0.4422,0.0048,0.553
SPADES JACK DIAMONDS TEN,0.6552,0.0058,0.339
SPADES ACE DIAMONDS TEN,0.404,0.0064,0.5896
SPADES JACK HEARTS JACK,0.4278,0.003,0.5692
SPADES TEN HEARTS JACK,0.6418,0.0086,0.3496
SPADES QUEEN DIAMONDS TEN,0.7422,0.0268,0.231
SPADES NINE DIAMONDS SEVEN,0.6438,0.0066,0.3496
SPADES EIGHT DIAMONDS SEVEN,0.6296,0.009,0.3614
SPADES SEVEN DIAMONDS SEVEN,0.4682,0.0056,0.5262
SPADES SIX DIAMONDS SEVEN,0.6148,0.0062,0.379
DIAMONDS KING DIAMONDS SEVEN,0.6582,0.0598,0.282
HEARTS THREE DIAMONDS SEVEN,0.6568,0.006,0.3372
HEARTS KING DIAMONDS FIVE,0.6972,0.0618,0.241
HEARTS TWO DIAMONDS SEVEN,0.6706,0.0082,0.3212
HEARTS QUEEN DIAMONDS FIVE,0.7502,0.0296,0.2202
HEARTS FIVE DIAMONDS SEVEN,0.6332,0.0072,0.3596
DIAMONDS ACE DIAMONDS SEVEN,0.4006,0.0048,0.5946
HEARTS FOUR DIAMONDS SEVEN,0.6414,0.0066,0.352
HEARTS ACE DIAMONDS FIVE,0.4126,0.006,0.5814
HEARTS SEVEN DIAMONDS SEVEN,0.456,0.0056,0.5384
HEARTS SIX DIAMONDS SEVEN,0.6258,0.0052,0.369
DIAMONDS SEVEN HEARTS NINE,0.6478,0.005,0.3472
HEARTS EIGHT DIAMONDS SEVEN,0.639,0.0064,0.3546
DIAMONDS JACK DIAMONDS SEVEN,0.643,0.0102,0.3468
DIAMONDS FIVE HEARTS JACK,0.6762,0.007,0.3168
DIAMONDS TEN DIAMONDS SEVEN,0.6252,0.009,0.3658
HEARTS TEN DIAMONDS FIVE,0.6732,0.0068,0.32
HEARTS KING CLUBS KING,0.101,0.0124,0.8866
CLUBS EIGHT DIAMONDS SEVEN,0.6408,0.0058,0.3534
SPADES QUEEN CLUBS TWO,0.7354,0.0302,0.2344
HEARTS KING CLUBS QUEEN,0.0206,0.9608,0.0186
CLUBS NINE DIAMONDS SEVEN,0.6526,0.0066,0.3408
SPADES TWO CLUBS JACK,0.6926,0.0058,0.3016
SPADES ACE CLUBS TWO,0.4128,0.0056,0.5816
CLUBS TEN SPADES TWO,0.6824,0.0058,0.3118
HEARTS KING CLUBS ACE,0.2416,0.0126,0.7458
CLUBS SEVEN CLUBS SIX,0.58,0.0036,0.4164
SPADES TWO CLUBS KING,0.7088,0.0688,0.2224
SPADES TWO DIAMONDS SEVEN,0.6718,0.0056,0.3226
CLUBS EIGHT CLUBS SIX,0.583,0.0068,0.4102
SPADES THREE DIAMONDS SEVEN,0.6692,0.0112,0.3196
SPADES TWO CLUBS QUEEN,0.7506,0.0252,0.2242
CLUBS NINE CLUBS SIX,0.5982,0.006,0.3958
SPADES FOUR DIAMONDS SEVEN,0.6556,0.0068,0.3376
HEARTS KING CLUBS JACK,0.6942,0.0574,0.2484
SPADES FIVE DIAMONDS SEVEN,0.6326,0.0056,0.3618
SPADES TWO CLUBS ACE,0.4306,0.0044,0.565
CLUBS TEN HEARTS KING,0.692,0.0622,0.2458
CLUBS SIX SPADES TWO,0.6548,0.0078,0.3374
CLUBS SIX SPADES THREE,0.6374,0.0066,0.356
CLUBS TWO DIAMONDS SEVEN,0.6696,0.0056,0.3248
CLUBS SIX SPADES FOUR,0.6332,0.0078,0.359
CLUBS THREE DIAMONDS SEVEN,0.6672,0.006,0.3268
CLUBS SIX SPADES FIVE,0.6258,0.0052,0.369
CLUBS FOUR DIAMONDS SEVEN,0.6482,0.0086,0.3432
CLUBS SIX SPADES SIX,0.4888,0.0056,0.5056
CLUBS FIVE DIAMONDS SEVEN,0.6292,0.0062,0.3646
CLUBS SIX SPADES SEVEN,0.6178,0.005,0.3772
CLUBS SIX DIAMONDS SEVEN,0.6268,0.0066,0.3666
SPADES EIGHT CLUBS SIX,0.6498,0.0052,0.345
SPADES JACK CLUBS TWO,0.6898,0.0076,0.3026
CLUBS SEVEN DIAMONDS SEVEN,0.466,0.0048,0.5292
SPADES NINE CLUBS SIX,0.6442,0.0046,0.3512
SPADES TEN CLUBS TWO,0.6922,0.0088,0.299
CLUBS TWO CLUBS QUEEN,0.7098,0.0256,0.2646
CLUBS TWO CLUBS KING,0.6554,0.0622,0.2824
CLUBS THREE DIAMONDS EIGHT,0.6826,0.008,0.3094
CLUBS TWO CLUBS ACE,0.3896,0.0036,0.6068
CLUBS TWO DIAMONDS EIGHT,0.6804,0.0082,0.3114
HEARTS SEVEN DIAMONDS EIGHT,0.6448,0.006,0.3492
HEARTS SIX DIAMONDS EIGHT,0.6462,0.0056,0.3482
DIAMONDS EIGHT HEARTS NINE,0.637,0.006,0.357
CLUBS TEN CLUBS TWO,0.6448,0.006,0.3492
DIAMONDS EIGHT HEARTS EIGHT,0.4686,0.005,0.5264
CLUBS TWO CLUBS JACK,0.6424,0.0068,0.3508
CLUBS NINE DIAMONDS EIGHT,0.635,0.007,0.358
CLUBS EIGHT DIAMONDS EIGHT,0.4676,0.0044,0.528
CLUBS FIVE DIAMONDS EIGHT,0.6514,0.0074,0.3412
SPADES ACE SPADES THREE,0.3966,0.0048,0.5986
CLUBS FOUR DIAMONDS EIGHT,0.6602,0.0064,0.3334
CLUBS SEVEN DIAMONDS EIGHT,0.6428,0.0068,0.3504
SPADES QUEEN SPADES THREE,0.711,0.0322,0.2568
CLUBS SIX DIAMONDS EIGHT,0.6322,0.0058,0.362
HEARTS TWO DIAMONDS EIGHT,0.6704,0.005,0.3246
DIAMONDS KING DIAMONDS EIGHT,0.6668,0.0594,0.2738
HEARTS THREE DIAMONDS EIGHT,0.6872,0.006,0.3068
DIAMONDS ACE DIAMONDS EIGHT,0.4072,0.0054,0.5874
HEARTS FOUR DIAMONDS EIGHT,0.6614,0.0058,0.3328
HEARTS FIVE DIAMONDS EIGHT,0.6432,0.0074,0.3494
DIAMONDS EIGHT DIAMONDS TEN,0.6166,0.0086,0.3748
DIAMONDS EIGHT DIAMONDS JACK,0.6454,0.0056,0.349
SPADES JACK SPADES THREE,0.6564,0.0062,0.3374
SPADES TEN SPADES THREE,0.6452,0.0072,0.3476
CLUBS FOUR HEARTS ACE,0.419,0.0044,0.5766
CLUBS FOUR HEARTS QUEEN,0.7376,0.0284,0.234
CLUBS FOUR HEARTS KING,0.686,0.0658,0.2482
CLUBS SIX HEARTS TEN,0.6732,0.0044,0.3224
CLUBS SIX HEARTS JACK,0.6694,0.005,0.3256
SPADES FOUR DIAMONDS EIGHT,0.6698,0.0072,0.323
SPADES FIVE DIAMONDS EIGHT,0.6686,0.007,0.3244
DIAMONDS EIGHT SPADES TWO,0.68,0.0066,0.3134
DIAMONDS EIGHT SPADES THREE,0.684,0.0072,0.3088
CLUBS FOUR HEARTS JACK,0.6802,0.0062,0.3136
SPADES EIGHT DIAMONDS EIGHT,0.476,0.0072,0.5168
SPADES JACK HEARTS EIGHT,0.6604,0.0062,0.3334
SPADES TEN HEARTS TWO,0.6738,0.0086,0.3176
CLUBS FOUR HEARTS TEN,0.6792,0.0068,0.314
SPADES NINE DIAMONDS EIGHT,0.6426,0.0062,0.3512
SPADES JACK HEARTS TWO,0.696,0.0066,0.2974
SPADES TEN HEARTS EIGHT,0.6524,0.0074,0.3402
SPADES SIX DIAMONDS EIGHT,0.6404,0.0078,0.3518
SPADES SEVEN DIAMONDS EIGHT,0.6436,0.0072,0.3492
SPADES ACE HEARTS TWO,0.4096,0.006,0.5844
SPADES ACE HEARTS EIGHT,0.4092,0.0032,0.5876
SPADES QUEEN HEARTS TWO,0.753,0.028,0.219
SPADES QUEEN HEARTS EIGHT,0.7444,0.025,0.2306
