opposingHand,winningChance,drawChance,lostChance
DIAMONDS NINE SPADES THREE,0.8396,0.0328,0.1276
DIAMONDS NINE SPADES TWO,0.8456,0.0282,0.1262
SPADES FIVE DIAMONDS NINE,0.8142,0.0296,0.1562
DIAMONDS NINE SPADES FOUR,0.8254,0.0326,0.142
CLUBS NINE DIAMONDS NINE,0.7204,0.1006,0.179
CLUBS EIGHT DIAMONDS NINE,0.7998,0.0324,0.1678
CLUBS SIX DIAMONDS NINE,0.806,0.0278,0.1662
CLUBS SEVEN DIAMONDS NINE,0.797,0.0298,0.1732
SPADES TEN CLUBS FOUR,0.8338,0.0212,0.145
CLUBS FOUR DIAMONDS NINE,0.8392,0.0306,0.1302
CLUBS FIVE DIAMONDS NINE,0.8158,0.0266,0.1576
DIAMONDS NINE CLUBS TWO,0.8456,0.0268,0.1276
CLUBS THREE DIAMONDS NINE,0.8248,0.032,0.1432
DIAMONDS NINE HEARTS EIGHT,0.7974,0.0278,0.1748
DIAMONDS NINE HEARTS NINE,0.7184,0.0974,0.1842
HEARTS SIX DIAMONDS NINE,0.8036,0.0304,0.166
HEARTS SEVEN DIAMONDS NINE,0.7986,0.0302,0.1712
CLUBS NINE CLUBS EIGHT,0.7372,0.033,0.2298
DIAMONDS ACE DIAMONDS NINE,0.6714,0.0062,0.3224
HEARTS FOUR DIAMONDS NINE,0.8346,0.0314,0.134
HEARTS FIVE DIAMONDS NINE,0.813,0.0322,0.1548
HEARTS ACE CLUBS TWO,0.6832,0.004,0.3128
SPADES ACE CLUBS FOUR,0.6672,0.0052,0.3276
DIAMONDS NINE DIAMONDS QUEEN,0.66,0.01,0.33
HEARTS TWO DIAMONDS NINE,0.831,0.0328,0.1362
CLUBS TWO HEARTS KING,0.7,0.0064,0.2936
SPADES KING CLUBS FOUR,0.6944,0.0052,0.3004
DIAMONDS KING DIAMONDS NINE,0.6708,0.0058,0.3234
HEARTS THREE DIAMONDS NINE,0.8334,0.0328,0.1338
CLUBS TWO HEARTS QUEEN,0.7164,0.01,0.2736
SPADES QUEEN CLUBS FOUR,0.7164,0.0104,0.2732
CLUBS EIGHT SPADES NINE,0.7874,0.0306,0.182
DIAMONDS NINE DIAMONDS TEN,0.7824,0.0238,0.1938
CLUBS EIGHT SPADES EIGHT,0.7068,0.105,0.1882
CLUBS EIGHT SPADES SEVEN,0.7852,0.0364,0.1784
CLUBS EIGHT SPADES SIX,0.7848,0.0398,0.1754
CLUBS EIGHT SPADES FIVE,0.804,0.0384,0.1576
CLUBS EIGHT SPADES FOUR,0.8104,0.0418,0.1478
CLUBS EIGHT SPADES THREE,0.8348,0.0356,0.1296
CLUBS EIGHT SPADES TWO,0.8352,0.036,0.1288
HEARTS SIX DIAMONDS TEN,0.8248,0.0244,0.1508
HEARTS SEVEN DIAMONDS TEN,0.8116,0.0224,0.166
DIAMONDS TEN HEARTS EIGHT,0.8218,0.0218,0.1564
CLUBS FOUR CLUBS JACK,0.8224,0.0328,0.1448
DIAMONDS TEN HEARTS NINE,0.8086,0.0242,0.1672
CLUBS TEN CLUBS FOUR,0.787,0.0208,0.1922
CLUBS FOUR CLUBS KING,0.6674,0.0058,0.3268
CLUBS FOUR CLUBS QUEEN,0.6658,0.0124,0.3218
CLUBS TWO DIAMONDS TEN,0.8498,0.023,0.1272
CLUBS THREE DIAMONDS TEN,0.8312,0.0238,0.145
CLUBS FOUR CLUBS ACE,0.6342,0.0032,0.3626
DIAMONDS QUEEN DIAMONDS TEN,0.6616,0.0132,0.3252
HEARTS TWO DIAMONDS TEN,0.84,0.0252,0.1348
DIAMONDS KING DIAMONDS TEN,0.6568,0.0062,0.337
HEARTS THREE DIAMONDS TEN,0.8328,0.0254,0.1418
DIAMONDS ACE DIAMONDS TEN,0.6452,0.0052,0.3496
HEARTS FOUR DIAMONDS TEN,0.8332,0.0238,0.143
CLUBS EIGHT HEARTS JACK,0.8414,0.034,0.1246
HEARTS FIVE DIAMONDS TEN,0.8266,0.024,0.1494
CLUBS EIGHT HEARTS TEN,0.8176,0.0228,0.1596
CLUBS EIGHT HEARTS QUEEN,0.7002,0.0116,0.2882
CLUBS EIGHT HEARTS KING,0.6976,0.004,0.2984
CLUBS EIGHT HEARTS ACE,0.6936,0.0026,0.3038
CLUBS NINE SPADES THREE,0.8296,0.033,0.1374
CLUBS NINE SPADES TWO,0.8394,0.0282,0.1324
CLUBS NINE SPADES FIVE,0.8108,0.03,0.1592
CLUBS NINE SPADES FOUR,0.8324,0.031,0.1366
CLUBS NINE SPADES SEVEN,0.7936,0.03,0.1764
CLUBS NINE SPADES SIX,0.7984,0.0286,0.173
CLUBS NINE SPADES NINE,0.7178,0.0968,0.1854
CLUBS TEN HEARTS EIGHT,0.815,0.022,0.163
CLUBS NINE SPADES EIGHT,0.787,0.0276,0.1854
HEARTS EIGHT CLUBS JACK,0.8484,0.0354,0.1162
CLUBS QUEEN HEARTS EIGHT,0.7074,0.009,0.2836
CLUBS KING HEARTS EIGHT,0.6972,0.0034,0.2994
CLUBS ACE HEARTS EIGHT,0.6914,0.003,0.3056
SPADES KING CLUBS KING,0.1802,0.0386,0.7812
SPADES QUEEN CLUBS KING,0.57,0.0038,0.4262
SPADES ACE CLUBS KING,0.5604,0.0034,0.4362
DIAMONDS ACE HEARTS TEN,0.6902,0.0028,0.307
HEARTS FOUR HEARTS TEN,0.7784,0.0226,0.199
DIAMONDS ACE HEARTS JACK,0.6788,0.016,0.3052
HEARTS FOUR HEARTS JACK,0.8272,0.0412,0.1316
SPADES KING CLUBS FIVE,0.6988,0.0052,0.296
SPADES QUEEN CLUBS FIVE,0.6996,0.01,0.2904
SPADES ACE CLUBS FIVE,0.6728,0.0042,0.323
SPADES ACE SPADES SIX,0.6614,0.0056,0.333
HEARTS ACE SPADES FOUR,0.687,0.0032,0.3098
SPADES QUEEN SPADES SIX,0.6666,0.01,0.3234
SPADES FOUR HEARTS QUEEN,0.7056,0.0102,0.2842
SPADES KING SPADES SIX,0.6728,0.0054,0.3218
SPADES FOUR HEARTS KING,0.7056,0.0046,0.2898
SPADES TEN SPADES SIX,0.782,0.0204,0.1976
SPADES ACE DIAMONDS THREE,0.687,0.0062,0.3068
SPADES QUEEN DIAMONDS THREE,0.7074,0.014,0.2786
SPADES KING DIAMONDS THREE,0.7016,0.0078,0.2906
SPADES TEN CLUBS FIVE,0.8426,0.021,0.1364
SPADES TEN HEARTS SIX,0.8186,0.0218,0.1596
CLUBS SEVEN CLUBS ACE,0.6446,0.0032,0.3522
SPADES TEN DIAMONDS THREE,0.845,0.025,0.13
CLUBS SEVEN CLUBS QUEEN,0.6736,0.0098,0.3166
CLUBS SEVEN CLUBS KING,0.6646,0.0056,0.3298
CLUBS TEN CLUBS SEVEN,0.7724,0.023,0.2046
DIAMONDS ACE HEARTS ACE,0.1952,0.0026,0.8022
HEARTS FOUR HEARTS ACE,0.6418,0.003,0.3552
SPADES ACE HEARTS SIX,0.685,0.0048,0.3102
CLUBS SEVEN CLUBS JACK,0.8082,0.0396,0.1522
DIAMONDS ACE HEARTS KING,0.5656,0.0068,0.4276
HEARTS FOUR HEARTS KING,0.6584,0.0062,0.3354
SPADES KING HEARTS SIX,0.706,0.0042,0.2898
DIAMONDS ACE HEARTS QUEEN,0.5816,0.0032,0.4152
HEARTS FOUR HEARTS QUEEN,0.6774,0.0086,0.314
SPADES QUEEN HEARTS SIX,0.7084,0.0094,0.2822
SPADES TWO DIAMONDS TEN,0.851,0.0222,0.1268
SPADES THREE DIAMONDS TEN,0.8536,0.0238,0.1226
SPADES FOUR DIAMONDS TEN,0.8404,0.027,0.1326
SPADES FIVE DIAMONDS TEN,0.8396,0.0256,0.1348
SPADES SIX DIAMONDS TEN,0.8326,0.0212,0.1462
SPADES SEVEN DIAMONDS TEN,0.817,0.0292,0.1538
SPADES EIGHT DIAMONDS TEN,0.8248,0.0236,0.1516
SPADES NINE DIAMONDS TEN,0.8214,0.0246,0.154
CLUBS FOUR DIAMONDS TEN,0.8284,0.024,0.1476
CLUBS FIVE DIAMONDS TEN,0.8292,0.025,0.1458
CLUBS SIX DIAMONDS TEN,0.828,0.022,0.15
CLUBS SEVEN DIAMONDS TEN,0.816,0.0222,0.1618
CLUBS EIGHT DIAMONDS TEN,0.8052,0.0222,0.1726
CLUBS NINE DIAMONDS TEN,0.82,0.0204,0.1596
DIAMONDS THREE CLUBS JACK,0.8824,0.0392,0.0784
CLUBS TEN DIAMONDS THREE,0.835,0.028,0.137
DIAMONDS THREE CLUBS KING,0.7032,0.005,0.2918
DIAMONDS THREE CLUBS QUEEN,0.7134,0.0112,0.2754
DIAMONDS THREE CLUBS ACE,0.6854,0.0032,0.3114
SPADES FOUR HEARTS JACK,0.8774,0.0364,0.0862
SPADES FOUR HEARTS TEN,0.8316,0.0222,0.1462
SPADES FIVE SPADES TWO,0.7626,0.0488,0.1886
SPADES FOUR SPADES TWO,0.7702,0.05,0.1798
SPADES THREE SPADES TWO,0.7706,0.0504,0.179
SPADES NINE SPADES TWO,0.7944,0.035,0.1706
SPADES EIGHT SPADES TWO,0.801,0.0368,0.1622
SPADES SEVEN SPADES TWO,0.8012,0.0464,0.1524
SPADES SIX SPADES TWO,0.7848,0.0474,0.1678
CLUBS THREE DIAMONDS QUEEN,0.7118,0.0118,0.2764
CLUBS THREE HEARTS TWO,0.8016,0.053,0.1454
CLUBS TWO DIAMONDS QUEEN,0.7076,0.0122,0.2802
HEARTS TWO CLUBS TWO,0.7192,0.0956,0.1852
HEARTS SEVEN DIAMONDS QUEEN,0.6994,0.0112,0.2894
HEARTS SEVEN HEARTS TWO,0.794,0.0438,0.1622
HEARTS SIX DIAMONDS QUEEN,0.6912,0.0106,0.2982
HEARTS SIX HEARTS TWO,0.7704,0.0434,0.1862
DIAMONDS QUEEN HEARTS NINE,0.698,0.0112,0.2908
HEARTS TWO HEARTS NINE,0.791,0.03,0.179
DIAMONDS QUEEN HEARTS EIGHT,0.694,0.0122,0.2938
HEARTS TWO HEARTS EIGHT,0.7822,0.0408,0.177
CLUBS NINE HEARTS TWO,0.835,0.0286,0.1364
CLUBS NINE DIAMONDS QUEEN,0.6962,0.0112,0.2926
CLUBS EIGHT HEARTS TWO,0.8296,0.0372,0.1332
CLUBS EIGHT DIAMONDS QUEEN,0.704,0.0092,0.2868
CLUBS FIVE DIAMONDS QUEEN,0.7014,0.0118,0.2868
CLUBS FIVE HEARTS TWO,0.7872,0.047,0.1658
SPADES EIGHT HEARTS ACE,0.6964,0.005,0.2986
CLUBS FOUR DIAMONDS QUEEN,0.7132,0.0116,0.2752
CLUBS FOUR HEARTS TWO,0.788,0.0536,0.1584
CLUBS SEVEN DIAMONDS QUEEN,0.7078,0.01,0.2822
CLUBS SEVEN HEARTS TWO,0.8254,0.047,0.1276
SPADES EIGHT HEARTS QUEEN,0.712,0.0088,0.2792
CLUBS SIX DIAMONDS QUEEN,0.7024,0.0082,0.2894
CLUBS SIX HEARTS TWO,0.811,0.0482,0.1408
SPADES EIGHT HEARTS KING,0.7148,0.0056,0.2796
SPADES SIX DIAMONDS QUEEN,0.7102,0.0098,0.28
SPADES SIX HEARTS TWO,0.83,0.0424,0.1276
HEARTS FOUR CLUBS QUEEN,0.6854,0.0112,0.3034
DIAMONDS ACE CLUBS QUEEN,0.5596,0.0046,0.4358
SPADES SEVEN DIAMONDS QUEEN,0.7142,0.008,0.2778
SPADES SEVEN HEARTS TWO,0.8286,0.047,0.1244
HEARTS FOUR CLUBS KING,0.6952,0.0048,0.3
DIAMONDS ACE CLUBS KING,0.5604,0.0048,0.4348
SPADES EIGHT DIAMONDS QUEEN,0.7174,0.0132,0.2694
SPADES EIGHT HEARTS TWO,0.8262,0.0398,0.134
HEARTS FOUR CLUBS ACE,0.6766,0.004,0.3194
DIAMONDS ACE CLUBS ACE,0.183,0.0052,0.8118
SPADES NINE DIAMONDS QUEEN,0.7094,0.011,0.2796
SPADES NINE HEARTS TWO,0.8316,0.034,0.1344
HEARTS TWO SPADES TWO,0.7276,0.0948,0.1776
DIAMONDS QUEEN SPADES TWO,0.723,0.0106,0.2664
HEARTS TWO SPADES THREE,0.808,0.0546,0.1374
SPADES THREE DIAMONDS QUEEN,0.7218,0.0132,0.265
HEARTS TWO SPADES FOUR,0.8036,0.0534,0.143
SPADES FOUR DIAMONDS QUEEN,0.6986,0.0088,0.2926
CLUBS TEN HEARTS FOUR,0.8204,0.0238,0.1558
CLUBS TEN DIAMONDS ACE,0.6712,0.0036,0.3252
HEARTS TWO SPADES FIVE,0.797,0.0516,0.1514
SPADES FIVE DIAMONDS QUEEN,0.7104,0.0112,0.2784
HEARTS FOUR CLUBS JACK,0.867,0.0376,0.0954
DIAMONDS ACE CLUBS JACK,0.6724,0.0168,0.3108
CLUBS FIVE CLUBS KING,0.6622,0.0052,0.3326
CLUBS FIVE CLUBS QUEEN,0.668,0.011,0.321
CLUBS FIVE CLUBS ACE,0.6316,0.0038,0.3646
CLUBS FIVE CLUBS JACK,0.8278,0.0348,0.1374
CLUBS TEN CLUBS FIVE,0.7824,0.0252,0.1924
SPADES KING CLUBS JACK,0.6796,0.0184,0.302
SPADES QUEEN CLUBS JACK,0.664,0.0208,0.3152
SPADES ACE CLUBS JACK,0.6786,0.018,0.3034
SPADES SIX CLUBS KING,0.712,0.0048,0.2832
SPADES SIX CLUBS QUEEN,0.7156,0.0106,0.2738
SPADES EIGHT HEARTS JACK,0.8508,0.0334,0.1158
SPADES SIX CLUBS ACE,0.6876,0.0034,0.309
SPADES EIGHT HEARTS TEN,0.816,0.0246,0.1594
SPADES SIX CLUBS JACK,0.8866,0.0386,0.0748
CLUBS TEN SPADES SIX,0.8296,0.0166,0.1538
SPADES TEN CLUBS JACK,0.8248,0.0308,0.1444
SPADES QUEEN CLUBS SEVEN,0.7064,0.0096,0.284
SPADES KING CLUBS SEVEN,0.709,0.0078,0.2832
SPADES ACE CLUBS SEVEN,0.689,0.0026,0.3084
SPADES SIX HEARTS TEN,0.823,0.021,0.156
SPADES SIX HEARTS JACK,0.8794,0.0366,0.084
SPADES SIX HEARTS ACE,0.6998,0.0038,0.2964
SPADES SIX HEARTS KING,0.6994,0.005,0.2956
SPADES SIX HEARTS QUEEN,0.7008,0.0114,0.2878
CLUBS SEVEN SPADES TEN,0.8178,0.025,0.1572
CLUBS TEN HEARTS SIX,0.8176,0.0194,0.163
HEARTS SIX CLUBS JACK,0.8656,0.0396,0.0948
CLUBS ACE CLUBS JACK,0.6322,0.017,0.3508
HEARTS SIX CLUBS QUEEN,0.716,0.0092,0.2748
HEARTS SIX CLUBS KING,0.7032,0.0058,0.291
HEARTS SIX CLUBS ACE,0.7058,0.0026,0.2916
CLUBS QUEEN CLUBS JACK,0.6302,0.0186,0.3512
CLUBS KING CLUBS JACK,0.634,0.0176,0.3484
DIAMONDS THREE HEARTS ACE,0.672,0.0036,0.3244
DIAMONDS THREE HEARTS QUEEN,0.7158,0.009,0.2752
DIAMONDS THREE HEARTS KING,0.7068,0.0042,0.289
CLUBS FIVE HEARTS JACK,0.8654,0.0362,0.0984
HEARTS FOUR SPADES TEN,0.8368,0.0246,0.1386
SPADES TEN DIAMONDS ACE,0.6866,0.0048,0.3086
CLUBS FIVE HEARTS TEN,0.8244,0.0206,0.155
SPADES ACE HEARTS FOUR,0.6762,0.0044,0.3194
SPADES ACE DIAMONDS ACE,0.183,0.0038,0.8132
CLUBS FIVE HEARTS ACE,0.6726,0.0026,0.3248
CLUBS FIVE HEARTS KING,0.6934,0.0052,0.3014
HEARTS FOUR SPADES QUEEN,0.706,0.0112,0.2828
SPADES QUEEN DIAMONDS ACE,0.5556,0.0042,0.4402
SPADES FOUR CLUBS JACK,0.8772,0.0376,0.0852
CLUBS FIVE HEARTS QUEEN,0.7012,0.009,0.2898
SPADES KING DIAMONDS ACE,0.5612,0.0054,0.4334
SPADES KING HEARTS FOUR,0.701,0.0064,0.2926
CLUBS TEN SPADES FOUR,0.8244,0.0248,0.1508
DIAMONDS ACE DIAMONDS QUEEN,0.5356,0.0048,0.4596
DIAMONDS ACE HEARTS TWO,0.6754,0.0054,0.3192
HEARTS FOUR DIAMONDS QUEEN,0.698,0.0088,0.2932
HEARTS FOUR HEARTS TWO,0.751,0.05,0.199
DIAMONDS THREE HEARTS TEN,0.8384,0.0204,0.1412
SPADES FOUR CLUBS KING,0.7116,0.0052,0.2832
HEARTS FIVE DIAMONDS QUEEN,0.693,0.0098,0.2972
HEARTS FIVE HEARTS TWO,0.7486,0.0528,0.1986
DIAMONDS THREE HEARTS JACK,0.8862,0.0408,0.073
SPADES FOUR CLUBS QUEEN,0.7094,0.0078,0.2828
HEARTS TWO DIAMONDS QUEEN,0.7184,0.0104,0.2712
DIAMONDS KING DIAMONDS QUEEN,0.5472,0.0046,0.4482
DIAMONDS KING HEARTS TWO,0.6998,0.007,0.2932
HEARTS THREE DIAMONDS QUEEN,0.718,0.0104,0.2716
HEARTS THREE HEARTS TWO,0.7596,0.049,0.1914
SPADES FOUR CLUBS ACE,0.6788,0.0034,0.3178
HEARTS TWO CLUBS ACE,0.6844,0.0028,0.3128
DIAMONDS QUEEN CLUBS ACE,0.543,0.0068,0.4502
HEARTS TWO CLUBS QUEEN,0.7122,0.0112,0.2766
DIAMONDS QUEEN CLUBS QUEEN,0.1808,0.083,0.7362
HEARTS TWO CLUBS KING,0.7032,0.006,0.2908
DIAMONDS QUEEN CLUBS KING,0.5656,0.0042,0.4302
SPADES EIGHT SPADES FIVE,0.7708,0.0382,0.191
CLUBS TEN HEARTS TWO,0.828,0.024,0.148
CLUBS TEN DIAMONDS QUEEN,0.6864,0.0102,0.3034
SPADES NINE SPADES FIVE,0.7806,0.031,0.1884
HEARTS TWO CLUBS JACK,0.8756,0.0412,0.0832
DIAMONDS QUEEN CLUBS JACK,0.6498,0.0198,0.3304
SPADES SIX SPADES FIVE,0.7388,0.0448,0.2164
SPADES SEVEN SPADES FIVE,0.741,0.0446,0.2144
DIAMONDS FIVE CLUBS QUEEN,0.6956,0.0118,0.2926
SPADES EIGHT CLUBS ACE,0.691,0.0038,0.3052
DIAMONDS FIVE CLUBS KING,0.703,0.0048,0.2922
SPADES EIGHT CLUBS KING,0.706,0.0062,0.2878
CLUBS ACE DIAMONDS FIVE,0.6796,0.0034,0.317
SPADES EIGHT CLUBS QUEEN,0.706,0.0132,0.2808
SPADES EIGHT CLUBS JACK,0.8488,0.0352,0.116
CLUBS TEN SPADES EIGHT,0.8204,0.0212,0.1584
CLUBS TEN DIAMONDS FIVE,0.832,0.0236,0.1444
DIAMONDS FIVE CLUBS JACK,0.867,0.0382,0.0948
DIAMONDS TEN HEARTS JACK,0.824,0.0308,0.1452
DIAMONDS TEN HEARTS TEN,0.7062,0.1104,0.1834
SPADES ACE CLUBS NINE,0.6912,0.0054,0.3034
CLUBS NINE SPADES QUEEN,0.6866,0.0098,0.3036
CLUBS NINE SPADES KING,0.6968,0.007,0.2962
HEARTS SIX HEARTS KING,0.6524,0.0052,0.3424
DIAMONDS KING SPADES SEVEN,0.7078,0.0066,0.2856
SPADES SEVEN HEARTS THREE,0.808,0.0472,0.1448
SPADES KING DIAMONDS SEVEN,0.7038,0.0072,0.289
HEARTS SIX HEARTS QUEEN,0.6714,0.0088,0.3198
DIAMONDS KING SPADES SIX,0.7132,0.0062,0.2806
HEARTS THREE SPADES SIX,0.7972,0.0492,0.1536
SPADES QUEEN DIAMONDS SEVEN,0.7244,0.0102,0.2654
SPADES NINE DIAMONDS KING,0.703,0.0068,0.2902
SPADES NINE HEARTS THREE,0.8314,0.0326,0.136
HEARTS SIX HEARTS ACE,0.6526,0.0042,0.3432
SPADES EIGHT DIAMONDS KING,0.71,0.0062,0.2838
SPADES EIGHT HEARTS THREE,0.8426,0.0322,0.1252
SPADES ACE DIAMONDS SEVEN,0.6954,0.0046,0.3
CLUBS NINE HEARTS THREE,0.8228,0.0348,0.1424
CLUBS NINE DIAMONDS KING,0.6916,0.0054,0.303
CLUBS EIGHT HEARTS THREE,0.8272,0.0382,0.1346
CLUBS EIGHT DIAMONDS KING,0.7038,0.0046,0.2916
HEARTS THREE SPADES THREE,0.7186,0.0954,0.186
DIAMONDS KING SPADES THREE,0.7098,0.008,0.2822
HEARTS THREE SPADES TWO,0.8038,0.054,0.1422
DIAMONDS KING SPADES TWO,0.7052,0.0056,0.2892
HEARTS THREE SPADES FIVE,0.791,0.0462,0.1628
DIAMONDS KING SPADES FIVE,0.6934,0.0076,0.299
HEARTS THREE SPADES FOUR,0.7788,0.0586,0.1626
DIAMONDS KING SPADES FOUR,0.7224,0.0062,0.2714
DIAMONDS KING CLUBS TWO,0.7112,0.008,0.2808
HEARTS THREE CLUBS TWO,0.7966,0.0498,0.1536
DIAMONDS KING CLUBS THREE,0.6992,0.0076,0.2932
CLUBS THREE HEARTS THREE,0.711,0.0896,0.1994
DIAMONDS KING CLUBS FOUR,0.6994,0.0068,0.2938
HEARTS THREE CLUBS FOUR,0.7682,0.0562,0.1756
CLUBS FIVE DIAMONDS KING,0.7024,0.0054,0.2922
CLUBS FIVE HEARTS THREE,0.7776,0.0442,0.1782
CLUBS SIX DIAMONDS KING,0.6938,0.0044,0.3018
CLUBS SIX HEARTS THREE,0.803,0.041,0.156
CLUBS SEVEN DIAMONDS KING,0.7018,0.0046,0.2936
CLUBS SEVEN HEARTS THREE,0.8126,0.0418,0.1456
DIAMONDS KING HEARTS THREE,0.701,0.0056,0.2934
DIAMONDS ACE DIAMONDS KING,0.5272,0.0052,0.4676
DIAMONDS ACE HEARTS THREE,0.6772,0.0048,0.318
HEARTS FOUR DIAMONDS KING,0.6904,0.0072,0.3024
HEARTS FOUR HEARTS THREE,0.7436,0.0512,0.2052
HEARTS FIVE DIAMONDS KING,0.6912,0.0044,0.3044
HEARTS FIVE HEARTS THREE,0.7402,0.0484,0.2114
HEARTS SIX DIAMONDS KING,0.7034,0.005,0.2916
HEARTS SIX HEARTS THREE,0.7732,0.0376,0.1892
HEARTS SEVEN DIAMONDS KING,0.686,0.007,0.307
HEARTS SEVEN HEARTS THREE,0.7734,0.0458,0.1808
DIAMONDS KING HEARTS EIGHT,0.6994,0.0062,0.2944
HEARTS THREE HEARTS EIGHT,0.7988,0.0328,0.1684
HEARTS SIX HEARTS TEN,0.7716,0.025,0.2034
SPADES TEN DIAMONDS SEVEN,0.8214,0.0242,0.1544
DIAMONDS KING HEARTS NINE,0.685,0.0082,0.3068
HEARTS THREE HEARTS NINE,0.779,0.0354,0.1856
HEARTS SIX HEARTS JACK,0.8274,0.0346,0.138
HEARTS FIVE CLUBS FOUR,0.758,0.0498,0.1922
SPADES SIX SPADES FOUR,0.7424,0.0498,0.2078
HEARTS FIVE CLUBS FIVE,0.693,0.0974,0.2096
SPADES SEVEN SPADES FOUR,0.771,0.0416,0.1874
HEARTS FIVE CLUBS SIX,0.761,0.0508,0.1882
SPADES EIGHT SPADES FOUR,0.7722,0.0336,0.1942
HEARTS FIVE CLUBS SEVEN,0.7748,0.0464,0.1788
SPADES NINE SPADES FOUR,0.8008,0.028,0.1712
SPADES QUEEN DIAMONDS FIVE,0.7044,0.0118,0.2838
SPADES KING DIAMONDS FIVE,0.6938,0.0058,0.3004
HEARTS FIVE CLUBS TWO,0.7862,0.0534,0.1604
SPADES ACE DIAMONDS FIVE,0.6704,0.004,0.3256
HEARTS FIVE CLUBS THREE,0.7698,0.0532,0.177
SPADES FIVE SPADES FOUR,0.7302,0.0512,0.2186
HEARTS FIVE SPADES TWO,0.8026,0.0442,0.1532
HEARTS FIVE SPADES THREE,0.7744,0.0574,0.1682
HEARTS FIVE SPADES FOUR,0.7592,0.0544,0.1864
HEARTS FIVE SPADES FIVE,0.725,0.0918,0.1832
HEARTS FIVE CLUBS EIGHT,0.7936,0.0346,0.1718
CLUBS NINE HEARTS FIVE,0.8078,0.0326,0.1596
HEARTS KING DIAMONDS TEN,0.6956,0.0046,0.2998
HEARTS QUEEN DIAMONDS TEN,0.7108,0.0092,0.28
HEARTS ACE DIAMONDS TEN,0.6786,0.0042,0.3172
HEARTS FIVE HEARTS SEVEN,0.7388,0.0396,0.2216
HEARTS FIVE HEARTS SIX,0.7236,0.0446,0.2318
HEARTS FIVE HEARTS NINE,0.7684,0.0308,0.2008
CLUBS NINE SPADES TEN,0.8232,0.0216,0.1552
HEARTS FIVE HEARTS EIGHT,0.756,0.0354,0.2086
DIAMONDS ACE CLUBS SIX,0.706,0.0048,0.2892
HEARTS FOUR CLUBS SIX,0.7884,0.0464,0.1652
SPADES EIGHT SPADES THREE,0.799,0.033,0.168
CLUBS SEVEN DIAMONDS ACE,0.6866,0.003,0.3104
HEARTS FOUR CLUBS SEVEN,0.7874,0.0434,0.1692
SPADES NINE SPADES THREE,0.8052,0.03,0.1648
DIAMONDS ACE CLUBS FOUR,0.6808,0.0024,0.3168
HEARTS FOUR CLUBS FOUR,0.706,0.0936,0.2004
SPADES SIX SPADES THREE,0.7714,0.0442,0.1844
CLUBS FIVE DIAMONDS ACE,0.678,0.0038,0.3182
HEARTS FOUR CLUBS FIVE,0.751,0.0504,0.1986
SPADES SEVEN SPADES THREE,0.7846,0.0426,0.1728
HEARTS FOUR CLUBS EIGHT,0.8022,0.0418,0.156
CLUBS EIGHT DIAMONDS ACE,0.6894,0.003,0.3076
CLUBS NINE HEARTS FOUR,0.8206,0.0258,0.1536
CLUBS NINE DIAMONDS ACE,0.6862,0.0036,0.3102
HEARTS FOUR SPADES FOUR,0.7168,0.0956,0.1876
DIAMONDS ACE SPADES FOUR,0.6746,0.0042,0.3212
HEARTS FOUR SPADES FIVE,0.7608,0.0472,0.192
DIAMONDS ACE SPADES FIVE,0.6828,0.0058,0.3114
HEARTS FOUR SPADES TWO,0.8064,0.0528,0.1408
DIAMONDS ACE SPADES TWO,0.6828,0.0046,0.3126
HEARTS FOUR SPADES THREE,0.7908,0.0468,0.1624
DIAMONDS ACE SPADES THREE,0.6968,0.004,0.2992
DIAMONDS ACE SPADES EIGHT,0.6928,0.0054,0.3018
HEARTS FOUR SPADES EIGHT,0.8128,0.0376,0.1496
SPADES FOUR SPADES THREE,0.7424,0.0552,0.2024
SPADES FIVE SPADES THREE,0.7486,0.0494,0.202
SPADES NINE DIAMONDS ACE,0.6944,0.0044,0.3012
HEARTS FOUR SPADES NINE,0.8426,0.0284,0.129
DIAMONDS ACE SPADES SIX,0.7068,0.0054,0.2878
HEARTS FOUR SPADES SIX,0.7802,0.0524,0.1674
DIAMONDS ACE SPADES SEVEN,0.6886,0.0052,0.3062
HEARTS FOUR SPADES SEVEN,0.8014,0.0442,0.1544
SPADES QUEEN SPADES EIGHT,0.6766,0.0098,0.3136
DIAMONDS TEN CLUBS JACK,0.8172,0.032,0.1508
DIAMONDS SEVEN CLUBS JACK,0.8616,0.038,0.1004
SPADES KING SPADES EIGHT,0.6756,0.006,0.3184
CLUBS TEN DIAMONDS TEN,0.7154,0.101,0.1836
CLUBS TEN DIAMONDS SEVEN,0.8174,0.0236,0.159
SPADES ACE SPADES EIGHT,0.6502,0.0042,0.3456
HEARTS FIVE DIAMONDS ACE,0.665,0.0062,0.3288
HEARTS FIVE HEARTS FOUR,0.7134,0.0482,0.2384
HEARTS FOUR DIAMONDS ACE,0.682,0.0038,0.3142
DIAMONDS TEN CLUBS ACE,0.6982,0.0032,0.2986
CLUBS ACE DIAMONDS SEVEN,0.684,0.0034,0.3126
DIAMONDS TEN CLUBS KING,0.6942,0.0072,0.2986
CLUBS KING DIAMONDS SEVEN,0.7092,0.0042,0.2866
DIAMONDS TEN CLUBS QUEEN,0.699,0.0116,0.2894
CLUBS QUEEN DIAMONDS SEVEN,0.7056,0.01,0.2844
DIAMONDS ACE HEARTS NINE,0.6946,0.0034,0.302
HEARTS FOUR HEARTS NINE,0.796,0.0262,0.1778
CLUBS NINE CLUBS TEN,0.7712,0.0238,0.205
DIAMONDS ACE HEARTS EIGHT,0.69,0.0034,0.3066
HEARTS FOUR HEARTS EIGHT,0.7718,0.0364,0.1918
CLUBS NINE CLUBS JACK,0.796,0.0296,0.1744
HEARTS SEVEN DIAMONDS ACE,0.6918,0.0038,0.3044
HEARTS FOUR HEARTS SEVEN,0.7516,0.0442,0.2042
HEARTS SIX DIAMONDS ACE,0.6926,0.0038,0.3036
HEARTS FOUR HEARTS SIX,0.7386,0.0502,0.2112
HEARTS ACE HEARTS QUEEN,0.5388,0.0042,0.457
DIAMONDS ACE CLUBS THREE,0.6758,0.0038,0.3204
HEARTS FOUR CLUBS THREE,0.7768,0.0556,0.1676
CLUBS NINE CLUBS ACE,0.6556,0.0028,0.3416
DIAMONDS ACE CLUBS TWO,0.6802,0.0056,0.3142
HEARTS FOUR CLUBS TWO,0.7948,0.055,0.1502
SPADES TEN DIAMONDS FIVE,0.8412,0.0238,0.135
SPADES TEN SPADES EIGHT,0.7766,0.0252,0.1982
CLUBS NINE CLUBS QUEEN,0.6596,0.0104,0.33
HEARTS QUEEN HEARTS KING,0.5556,0.003,0.4414
CLUBS NINE CLUBS KING,0.6608,0.0056,0.3336
DIAMONDS QUEEN HEARTS TEN,0.6828,0.0092,0.308
HEARTS TWO HEARTS TEN,0.793,0.0254,0.1816
DIAMONDS QUEEN HEARTS JACK,0.669,0.0188,0.3122
HEARTS TWO HEARTS JACK,0.8402,0.0356,0.1242
DIAMONDS QUEEN HEARTS KING,0.5638,0.0038,0.4324
HEARTS TWO HEARTS KING,0.6692,0.0056,0.3252
HEARTS QUEEN DIAMONDS QUEEN,0.1876,0.0706,0.7418
HEARTS TWO HEARTS QUEEN,0.6798,0.0108,0.3094
HEARTS ACE DIAMONDS QUEEN,0.5646,0.0038,0.4316
HEARTS TWO HEARTS ACE,0.6626,0.0032,0.3342
SPADES ACE HEARTS ACE,0.185,0.0042,0.8108
SPADES KING HEARTS ACE,0.5538,0.0036,0.4426
SPADES QUEEN HEARTS ACE,0.5536,0.0042,0.4422
HEARTS SIX SPADES FOUR,0.784,0.0496,0.1664
SPADES KING SPADES QUEEN,0.5304,0.0054,0.4642
SPADES TEN HEARTS ACE,0.688,0.0032,0.3088
HEARTS SIX SPADES FIVE,0.7558,0.0524,0.1918
SPADES ACE SPADES QUEEN,0.5318,0.0046,0.4636
HEARTS SIX SPADES TWO,0.8154,0.052,0.1326
HEARTS SIX SPADES THREE,0.809,0.0478,0.1432
HEARTS SIX SPADES EIGHT,0.785,0.0362,0.1788
HEARTS SIX SPADES NINE,0.8048,0.0276,0.1676
SPADES TEN CLUBS THREE,0.8324,0.0244,0.1432
SPADES NINE SPADES EIGHT,0.7634,0.0354,0.2012
HEARTS SIX SPADES SIX,0.7274,0.0938,0.1788
HEARTS SIX SPADES SEVEN,0.7686,0.046,0.1854
SPADES ACE CLUBS THREE,0.6804,0.0044,0.3152
SPADES QUEEN CLUBS THREE,0.7088,0.0082,0.283
SPADES KING CLUBS THREE,0.6958,0.0044,0.2998
HEARTS SIX CLUBS FIVE,0.7648,0.042,0.1932
HEARTS SIX CLUBS FOUR,0.7828,0.0416,0.1756
CLUBS SEVEN HEARTS SIX,0.7742,0.0398,0.186
HEARTS SIX CLUBS SIX,0.7128,0.0904,0.1968
CLUBS NINE HEARTS SIX,0.7942,0.0288,0.177
CLUBS EIGHT HEARTS SIX,0.7738,0.038,0.1882
HEARTS SEVEN HEARTS SIX,0.7288,0.042,0.2292
HEARTS SIX HEARTS NINE,0.7536,0.0282,0.2182
HEARTS SIX HEARTS EIGHT,0.7444,0.043,0.2126
HEARTS SIX CLUBS THREE,0.787,0.0488,0.1642
HEARTS SIX CLUBS TWO,0.8264,0.0414,0.1322
HEARTS QUEEN CLUBS JACK,0.6706,0.0178,0.3116
CLUBS TEN HEARTS QUEEN,0.6952,0.0102,0.2946
HEARTS QUEEN CLUBS ACE,0.5658,0.0044,0.4298
CLUBS NINE HEARTS ACE,0.6874,0.0024,0.3102
HEARTS QUEEN CLUBS KING,0.5684,0.0036,0.428
CLUBS NINE HEARTS KING,0.7064,0.004,0.2896
HEARTS QUEEN CLUBS QUEEN,0.1904,0.0668,0.7428
CLUBS NINE HEARTS QUEEN,0.699,0.0098,0.2912
CLUBS NINE HEARTS JACK,0.833,0.0348,0.1322
CLUBS NINE HEARTS TEN,0.8058,0.0228,0.1714
SPADES TEN DIAMONDS NINE,0.8302,0.0246,0.1452
DIAMONDS EIGHT HEARTS TEN,0.8012,0.0222,0.1766
DIAMONDS EIGHT HEARTS JACK,0.852,0.0318,0.1162
HEARTS FIVE SPADES SIX,0.767,0.0528,0.1802
SPADES QUEEN DIAMONDS NINE,0.6968,0.0112,0.292
HEARTS FIVE SPADES SEVEN,0.7836,0.0418,0.1746
SPADES KING DIAMONDS NINE,0.6934,0.0066,0.3
HEARTS FIVE SPADES EIGHT,0.8042,0.0362,0.1596
SPADES EIGHT SPADES SEVEN,0.7478,0.0354,0.2168
SPADES ACE DIAMONDS NINE,0.6918,0.004,0.3042
HEARTS FIVE SPADES NINE,0.8098,0.0322,0.158
SPADES NINE SPADES SEVEN,0.7772,0.029,0.1938
HEARTS SEVEN HEARTS QUEEN,0.669,0.0104,0.3206
DIAMONDS EIGHT HEARTS KING,0.7066,0.0068,0.2866
DIAMONDS EIGHT HEARTS QUEEN,0.7146,0.0128,0.2726
HEARTS SEVEN HEARTS KING,0.6652,0.0056,0.3292
HEARTS SEVEN HEARTS ACE,0.6644,0.0036,0.332
HEARTS ACE DIAMONDS EIGHT,0.6932,0.0036,0.3032
HEARTS SEVEN HEARTS TEN,0.7814,0.0214,0.1972
HEARTS SEVEN HEARTS JACK,0.812,0.0348,0.1532
HEARTS JACK DIAMONDS SIX,0.8824,0.0372,0.0804
HEARTS TEN DIAMONDS SIX,0.8234,0.0212,0.1554
HEARTS ACE HEARTS NINE,0.6494,0.0054,0.3452
HEARTS KING HEARTS NINE,0.657,0.0072,0.3358
HEARTS QUEEN HEARTS NINE,0.6572,0.0104,0.3324
HEARTS JACK HEARTS NINE,0.7976,0.027,0.1754
HEARTS TEN HEARTS NINE,0.7662,0.023,0.2108
HEARTS ACE CLUBS QUEEN,0.5536,0.0042,0.4422
CLUBS NINE HEARTS SEVEN,0.7866,0.032,0.1814
HEARTS ACE CLUBS KING,0.5542,0.0034,0.4424
HEARTS SEVEN CLUBS EIGHT,0.7794,0.0374,0.1832
HEARTS ACE CLUBS ACE,0.1812,0.0038,0.815
SPADES QUEEN HEARTS QUEEN,0.1872,0.0678,0.745
HEARTS SEVEN SPADES THREE,0.82,0.0412,0.1388
SPADES KING HEARTS QUEEN,0.5544,0.0058,0.4398
HEARTS SEVEN SPADES TWO,0.835,0.0398,0.1252
SPADES ACE HEARTS QUEEN,0.5644,0.003,0.4326
HEARTS SEVEN SPADES FIVE,0.7774,0.049,0.1736
CLUBS TEN HEARTS ACE,0.691,0.0038,0.3052
HEARTS SEVEN SPADES FOUR,0.7972,0.0468,0.156
HEARTS ACE CLUBS JACK,0.6684,0.0174,0.3142
HEARTS SEVEN SPADES SEVEN,0.711,0.0974,0.1916
HEARTS SEVEN SPADES SIX,0.7748,0.0394,0.1858
HEARTS SEVEN SPADES NINE,0.795,0.0306,0.1744
SPADES TEN HEARTS QUEEN,0.6912,0.0126,0.2962
HEARTS SEVEN SPADES EIGHT,0.7888,0.0362,0.175
HEARTS QUEEN DIAMONDS SIX,0.7152,0.0108,0.274
HEARTS KING DIAMONDS SIX,0.7004,0.0076,0.292
HEARTS ACE DIAMONDS SIX,0.6954,0.0034,0.3012
SPADES NINE SPADES SIX,0.7688,0.03,0.2012
SPADES EIGHT SPADES SIX,0.755,0.0364,0.2086
SPADES SEVEN SPADES SIX,0.7394,0.0398,0.2208
HEARTS SEVEN HEARTS EIGHT,0.7416,0.0368,0.2216
HEARTS SEVEN HEARTS NINE,0.7554,0.0292,0.2154
HEARTS SEVEN CLUBS SIX,0.7642,0.0432,0.1926
CLUBS SEVEN HEARTS SEVEN,0.713,0.0876,0.1994
HEARTS SEVEN CLUBS FOUR,0.7984,0.0446,0.157
HEARTS SEVEN CLUBS FIVE,0.775,0.0448,0.1802
HEARTS SEVEN CLUBS TWO,0.8328,0.0458,0.1214
SPADES KING SPADES TEN,0.6542,0.0082,0.3376
HEARTS SEVEN CLUBS THREE,0.8106,0.0412,0.1482
SPADES QUEEN SPADES TEN,0.6624,0.0096,0.328
SPADES ACE SPADES TEN,0.647,0.0038,0.3492
SPADES KING HEARTS SEVEN,0.6862,0.007,0.3068
SPADES QUEEN HEARTS SEVEN,0.6988,0.0124,0.2888
SPADES ACE HEARTS SEVEN,0.6756,0.0048,0.3196
HEARTS SEVEN SPADES TEN,0.8176,0.0216,0.1608
CLUBS ACE HEARTS TEN,0.684,0.0026,0.3134
CLUBS TEN HEARTS NINE,0.7998,0.023,0.1772
SPADES ACE HEARTS THREE,0.6868,0.0032,0.31
SPADES ACE DIAMONDS KING,0.5474,0.007,0.4456
CLUBS JACK HEARTS NINE,0.8296,0.0346,0.1358
SPADES KING DIAMONDS KING,0.1696,0.0346,0.7958
SPADES KING HEARTS THREE,0.698,0.0066,0.2954
HEARTS TEN CLUBS QUEEN,0.6938,0.01,0.2962
SPADES QUEEN HEARTS THREE,0.7086,0.01,0.2814
SPADES QUEEN DIAMONDS KING,0.5572,0.0048,0.438
HEARTS TEN CLUBS KING,0.6952,0.0052,0.2996
CLUBS ACE HEARTS NINE,0.6902,0.0048,0.305
CLUBS TEN HEARTS TEN,0.7124,0.0998,0.1878
HEARTS TEN CLUBS JACK,0.8172,0.0312,0.1516
CLUBS QUEEN HEARTS NINE,0.7074,0.01,0.2826
CLUBS KING HEARTS NINE,0.7004,0.0038,0.2958
SPADES QUEEN HEARTS TEN,0.6964,0.0116,0.292
SPADES KING HEARTS TEN,0.6904,0.0044,0.3052
SPADES ACE HEARTS TEN,0.6854,0.0038,0.3108
