opposingHand,winningChance,drawChance,lostChance
SPADES QUEEN HEARTS TEN,0.5714,0.0078,0.4208
SPADES ACE HEARTS TEN,0.3596,0.0058,0.6346
SPADES TEN HEARTS NINE,0.566,0.0068,0.4272
SPADES JACK HEARTS NINE,0.569,0.0076,0.4234
SPADES TEN HEARTS TEN,0.3268,0.0082,0.665
SPADES JACK HEARTS TEN,0.5488,0.0078,0.4434
SPADES SIX HEARTS EIGHT,0.583,0.0054,0.4116
SPADES SEVEN HEARTS EIGHT,0.5758,0.0052,0.419
CLUBS THREE HEARTS JACK,0.6242,0.0096,0.3662
SPADES EIGHT HEARTS EIGHT,0.3468,0.0132,0.64
CLUBS THREE HEARTS TEN,0.6214,0.0064,0.3722
SPADES NINE HEARTS EIGHT,0.5664,0.0066,0.427
SPADES QUEEN HEARTS NINE,0.5902,0.0072,0.4026
SPADES THREE HEARTS EIGHT,0.6204,0.0096,0.37
SPADES FOUR HEARTS EIGHT,0.6192,0.0112,0.3696
SPADES ACE HEARTS NINE,0.3892,0.0054,0.6054
SPADES FIVE HEARTS EIGHT,0.5844,0.0084,0.4072
CLUBS EIGHT HEARTS EIGHT,0.3552,0.014,0.6308
CLUBS NINE HEARTS EIGHT,0.5876,0.009,0.4034
CLUBS THREE HEARTS KING,0.2636,0.4936,0.2428
CLUBS FOUR HEARTS EIGHT,0.6164,0.01,0.3736
CLUBS THREE HEARTS QUEEN,0.6194,0.0066,0.374
CLUBS FIVE HEARTS EIGHT,0.6046,0.0056,0.3898
CLUBS SIX HEARTS EIGHT,0.5878,0.0066,0.4056
CLUBS THREE HEARTS ACE,0.3922,0.0048,0.603
CLUBS SEVEN HEARTS EIGHT,0.5724,0.008,0.4196
CLUBS THREE HEARTS EIGHT,0.6254,0.0084,0.3662
CLUBS TWO HEARTS EIGHT,0.7378,0.0302,0.232
SPADES TEN SPADES FOUR,0.6042,0.0114,0.3844
SPADES JACK SPADES FOUR,0.6082,0.0104,0.3814
HEARTS NINE HEARTS EIGHT,0.545,0.0094,0.4456
SPADES QUEEN SPADES FOUR,0.6038,0.012,0.3842
SPADES ACE SPADES FOUR,0.336,0.0082,0.6558
HEARTS KING HEARTS TEN,0.2594,0.1048,0.6358
HEARTS QUEEN HEARTS TEN,0.5338,0.0064,0.4598
HEARTS ACE HEARTS TEN,0.3646,0.0046,0.6308
CLUBS JACK HEARTS SEVEN,0.6096,0.0096,0.3808
HEARTS SEVEN CLUBS TEN,0.6048,0.006,0.3892
CLUBS KING HEARTS SEVEN,0.2806,0.2858,0.4336
CLUBS QUEEN HEARTS SEVEN,0.6108,0.0072,0.382
CLUBS ACE HEARTS SEVEN,0.3984,0.0036,0.598
CLUBS SEVEN HEARTS ACE,0.388,0.0058,0.6062
CLUBS SEVEN HEARTS KING,0.268,0.2908,0.4412
CLUBS SEVEN HEARTS QUEEN,0.6118,0.0078,0.3804
CLUBS SEVEN HEARTS JACK,0.598,0.0044,0.3976
CLUBS SEVEN HEARTS TEN,0.5936,0.0076,0.3988
CLUBS THREE CLUBS TEN,0.5834,0.01,0.4066
CLUBS THREE CLUBS JACK,0.589,0.0062,0.4048
CLUBS THREE CLUBS ACE,0.3668,0.0062,0.627
CLUBS THREE CLUBS QUEEN,0.5848,0.0086,0.4066
CLUBS THREE CLUBS KING,0.2486,0.473,0.2784
HEARTS JACK HEARTS TEN,0.5338,0.006,0.4602
SPADES ACE CLUBS ACE,0.1474,0.0034,0.8492
SPADES QUEEN CLUBS ACE,0.375,0.0052,0.6198
SPADES JACK CLUBS ACE,0.375,0.005,0.62
SPADES TEN CLUBS ACE,0.3732,0.004,0.6228
SPADES EIGHT HEARTS NINE,0.583,0.0076,0.4094
SPADES NINE HEARTS NINE,0.338,0.0108,0.6512
SPADES SIX HEARTS NINE,0.5938,0.007,0.3992
SPADES SEVEN HEARTS NINE,0.5704,0.007,0.4226
CLUBS SEVEN HEARTS NINE,0.5818,0.0072,0.411
CLUBS SIX HEARTS NINE,0.595,0.0072,0.3978
CLUBS FIVE HEARTS NINE,0.616,0.0066,0.3774
CLUBS FOUR HEARTS NINE,0.6274,0.0108,0.3618
CLUBS THREE HEARTS NINE,0.6306,0.0088,0.3606
CLUBS TWO HEARTS NINE,0.7374,0.0274,0.2352
SPADES FIVE HEARTS NINE,0.601,0.0098,0.3892
SPADES FOUR HEARTS NINE,0.6096,0.0098,0.3806
SPADES THREE HEARTS NINE,0.6136,0.0106,0.3758
CLUBS NINE HEARTS NINE,0.338,0.0096,0.6524
CLUBS EIGHT HEARTS NINE,0.58,0.0074,0.4126
