opposingHand,winningChance,drawChance,lostChance
SPADES ACE HEARTS TEN,0.3164,0.0062,0.6774
SPADES TEN HEARTS NINE,0.2208,0.0716,0.7076
SPADES JACK HEARTS NINE,0.225,0.0594,0.7156
SPADES TEN HEARTS TEN,0.14,0.038,0.822
SPADES JACK HEARTS TEN,0.3088,0.0146,0.6766
SPADES SIX HEARTS EIGHT,0.5438,0.047,0.4092
SPADES SEVEN HEARTS EIGHT,0.52,0.0388,0.4412
CLUBS THREE HEARTS JACK,0.3952,0.0168,0.588
SPADES EIGHT HEARTS EIGHT,0.2658,0.0616,0.6726
CLUBS THREE HEARTS TEN,0.3788,0.0288,0.5924
SPADES KING HEARTS NINE,0.2188,0.033,0.7482
SPADES TWO HEARTS EIGHT,0.597,0.039,0.364
SPADES QUEEN HEARTS NINE,0.2286,0.0468,0.7246
SPADES THREE HEARTS EIGHT,0.6076,0.047,0.3454
SPADES FOUR HEARTS EIGHT,0.6402,0.105,0.2548
SPADES ACE HEARTS NINE,0.225,0.0294,0.7456
SPADES FIVE HEARTS EIGHT,0.563,0.042,0.395
CLUBS EIGHT HEARTS EIGHT,0.2638,0.058,0.6782
CLUBS NINE HEARTS EIGHT,0.2114,0.2294,0.5592
CLUBS THREE HEARTS KING,0.3932,0.0088,0.598
CLUBS THREE HEARTS QUEEN,0.403,0.0112,0.5858
CLUBS FIVE HEARTS EIGHT,0.5586,0.0416,0.3998
CLUBS SIX HEARTS EIGHT,0.5294,0.0406,0.43
CLUBS THREE HEARTS ACE,0.3738,0.0062,0.62
CLUBS SEVEN HEARTS EIGHT,0.5024,0.037,0.4606
CLUBS THREE HEARTS EIGHT,0.6014,0.0436,0.355
CLUBS TWO HEARTS EIGHT,0.6102,0.0432,0.3466
SPADES TEN SPADES FOUR,0.2386,0.0798,0.6816
SPADES JACK SPADES FOUR,0.226,0.0624,0.7116
HEARTS NINE HEARTS EIGHT,0.208,0.2158,0.5762
SPADES QUEEN SPADES FOUR,0.2264,0.0432,0.7304
SPADES KING SPADES FOUR,0.229,0.029,0.742
SPADES ACE SPADES FOUR,0.221,0.0208,0.7582
HEARTS KING HEARTS TEN,0.2946,0.007,0.6984
HEARTS QUEEN HEARTS TEN,0.2972,0.01,0.6928
HEARTS ACE HEARTS TEN,0.2906,0.0038,0.7056
HEARTS SEVEN CLUBS JACK,0.3486,0.0204,0.631
CLUBS TEN HEARTS SEVEN,0.3368,0.0282,0.635
CLUBS KING HEARTS SEVEN,0.3544,0.009,0.6366
CLUBS QUEEN HEARTS SEVEN,0.3548,0.012,0.6332
CLUBS ACE HEARTS SEVEN,0.3438,0.0046,0.6516
CLUBS SEVEN HEARTS ACE,0.355,0.004,0.641
CLUBS SEVEN HEARTS KING,0.3486,0.0082,0.6432
CLUBS SEVEN HEARTS QUEEN,0.3466,0.011,0.6424
CLUBS SEVEN HEARTS JACK,0.3396,0.0156,0.6448
CLUBS SEVEN HEARTS TEN,0.3386,0.0268,0.6346
CLUBS TEN CLUBS THREE,0.3608,0.0284,0.6108
CLUBS THREE CLUBS JACK,0.3762,0.021,0.6028
CLUBS THREE CLUBS ACE,0.352,0.005,0.643
CLUBS THREE CLUBS QUEEN,0.368,0.0116,0.6204
CLUBS THREE CLUBS KING,0.3864,0.0062,0.6074
HEARTS JACK HEARTS TEN,0.2842,0.0142,0.7016
SPADES ACE CLUBS ACE,0.111,0.005,0.884
SPADES KING CLUBS ACE,0.3168,0.006,0.6772
SPADES QUEEN CLUBS ACE,0.3154,0.0046,0.68
SPADES JACK CLUBS ACE,0.3226,0.0058,0.6716
SPADES TEN CLUBS ACE,0.3122,0.0032,0.6846
SPADES EIGHT HEARTS NINE,0.2172,0.224,0.5588
SPADES SIX HEARTS NINE,0.2142,0.381,0.4048
SPADES SEVEN HEARTS NINE,0.2202,0.2966,0.4832
CLUBS SEVEN HEARTS NINE,0.2092,0.2886,0.5022
CLUBS SIX HEARTS NINE,0.22,0.3674,0.4126
CLUBS FIVE HEARTS NINE,0.2148,0.4538,0.3314
CLUBS THREE HEARTS NINE,0.2572,0.5206,0.2222
CLUBS TWO HEARTS NINE,0.2624,0.5312,0.2064
SPADES FIVE HEARTS NINE,0.2106,0.466,0.3234
SPADES FOUR HEARTS NINE,0.0162,0.9738,0.01
SPADES THREE HEARTS NINE,0.2592,0.5174,0.2234
SPADES TWO HEARTS NINE,0.2566,0.5234,0.22
CLUBS NINE HEARTS NINE,0.076,0.0686,0.8554
CLUBS EIGHT HEARTS NINE,0.2196,0.2248,0.5556
