opposingHand,winningChance,drawChance,lostChance
SPADES JACK HEARTS NINE,0.201,0.0632,0.7358
SPADES TEN HEARTS TEN,0.129,0.0374,0.8336
SPADES JACK HEARTS TEN,0.294,0.016,0.69
SPADES SIX HEARTS EIGHT,0.5368,0.042,0.4212
SPADES SEVEN HEARTS EIGHT,0.5114,0.0454,0.4432
CLUBS THREE HEARTS JACK,0.3752,0.0196,0.6052
SPADES EIGHT HEARTS EIGHT,0.2586,0.0602,0.6812
CLUBS THREE HEARTS TEN,0.3756,0.0252,0.5992
SPADES KING HEARTS NINE,0.2148,0.0358,0.7494
SPADES TWO HEARTS EIGHT,0.6062,0.0424,0.3514
SPADES QUEEN HEARTS NINE,0.2166,0.0468,0.7366
SPADES THREE HEARTS EIGHT,0.601,0.0472,0.3518
SPADES FOUR HEARTS EIGHT,0.6568,0.1034,0.2398
SPADES ACE HEARTS NINE,0.2054,0.0324,0.7622
SPADES FIVE HEARTS EIGHT,0.552,0.0426,0.4054
CLUBS EIGHT HEARTS EIGHT,0.2584,0.0572,0.6844
CLUBS NINE HEARTS EIGHT,0.2128,0.2218,0.5654
CLUBS THREE HEARTS KING,0.3796,0.0094,0.611
CLUBS FOUR HEARTS EIGHT,0.6428,0.1058,0.2514
CLUBS THREE HEARTS QUEEN,0.3868,0.0142,0.599
CLUBS FIVE HEARTS EIGHT,0.546,0.0454,0.4086
CLUBS SIX HEARTS EIGHT,0.5274,0.0456,0.427
CLUBS THREE HEARTS ACE,0.3788,0.0046,0.6166
CLUBS SEVEN HEARTS EIGHT,0.5172,0.043,0.4398
CLUBS THREE HEARTS EIGHT,0.6086,0.0456,0.3458
CLUBS TWO HEARTS EIGHT,0.592,0.0458,0.3622
SPADES TEN SPADES FOUR,0.2276,0.0752,0.6972
SPADES JACK SPADES FOUR,0.2342,0.055,0.7108
HEARTS EIGHT HEARTS NINE,0.2032,0.2266,0.5702
SPADES QUEEN SPADES FOUR,0.2282,0.0382,0.7336
SPADES KING SPADES FOUR,0.234,0.031,0.735
SPADES ACE SPADES FOUR,0.22,0.0192,0.7608
HEARTS KING HEARTS TEN,0.2976,0.0072,0.6952
HEARTS QUEEN HEARTS TEN,0.295,0.011,0.694
HEARTS ACE HEARTS TEN,0.301,0.0048,0.6942
HEARTS SEVEN CLUBS JACK,0.347,0.0176,0.6354
CLUBS TEN HEARTS SEVEN,0.3314,0.0316,0.637
HEARTS SEVEN CLUBS KING,0.3532,0.0082,0.6386
HEARTS SEVEN CLUBS QUEEN,0.3542,0.0112,0.6346
HEARTS SEVEN CLUBS ACE,0.357,0.0034,0.6396
CLUBS SEVEN HEARTS ACE,0.3414,0.0038,0.6548
CLUBS SEVEN HEARTS KING,0.3546,0.0066,0.6388
CLUBS SEVEN HEARTS QUEEN,0.3608,0.009,0.6302
CLUBS SEVEN HEARTS JACK,0.3502,0.0188,0.631
CLUBS SEVEN HEARTS TEN,0.3222,0.027,0.6508
CLUBS TEN CLUBS THREE,0.3602,0.0298,0.61
CLUBS THREE CLUBS JACK,0.3666,0.0202,0.6132
CLUBS THREE CLUBS ACE,0.3498,0.0046,0.6456
CLUBS THREE CLUBS QUEEN,0.371,0.0114,0.6176
CLUBS THREE CLUBS KING,0.3582,0.0102,0.6316
HEARTS TEN HEARTS JACK,0.2908,0.0152,0.694
SPADES ACE CLUBS ACE,0.117,0.0048,0.8782
SPADES KING CLUBS ACE,0.3166,0.004,0.6794
SPADES QUEEN CLUBS ACE,0.3248,0.0052,0.67
SPADES JACK CLUBS ACE,0.3134,0.0062,0.6804
SPADES TEN CLUBS ACE,0.3192,0.003,0.6778
SPADES EIGHT HEARTS NINE,0.2084,0.2358,0.5558
SPADES SIX HEARTS NINE,0.2138,0.3744,0.4118
SPADES SEVEN HEARTS NINE,0.2112,0.2996,0.4892
CLUBS SEVEN HEARTS NINE,0.2188,0.295,0.4862
CLUBS SIX HEARTS NINE,0.215,0.3748,0.4102
CLUBS FIVE HEARTS NINE,0.1952,0.4608,0.344
CLUBS FOUR HEARTS NINE,0.0116,0.9702,0.0182
CLUBS THREE HEARTS NINE,0.2498,0.528,0.2222
CLUBS TWO HEARTS NINE,0.257,0.522,0.221
SPADES FIVE HEARTS NINE,0.2116,0.4532,0.3352
SPADES FOUR HEARTS NINE,0.0074,0.9866,0.006
SPADES THREE HEARTS NINE,0.254,0.5306,0.2154
SPADES TWO HEARTS NINE,0.2692,0.529,0.2018
CLUBS NINE HEARTS NINE,0.0748,0.0718,0.8534
CLUBS EIGHT HEARTS NINE,0.2098,0.2302,0.56
