opposingHand,winningChance,drawChance,lostChance
SPADES QUEEN HEARTS TEN,0.367,0.0132,0.6198
SPADES KING HEARTS TEN,0.3738,0.0104,0.6158
SPADES ACE HEARTS TEN,0.3672,0.0052,0.6276
SPADES TEN HEARTS NINE,0.5472,0.0178,0.435
SPADES TEN HEARTS TEN,0.314,0.022,0.664
SPADES SIX HEARTS EIGHT,0.574,0.0188,0.4072
SPADES SEVEN HEARTS EIGHT,0.5648,0.0206,0.4146
CLUBS THREE HEARTS JACK,0.3572,0.4314,0.2114
SPADES EIGHT HEARTS EIGHT,0.3334,0.0346,0.632
CLUBS THREE HEARTS TEN,0.6422,0.019,0.3388
SPADES NINE HEARTS EIGHT,0.5688,0.0154,0.4158
SPADES KING HEARTS NINE,0.378,0.0088,0.6132
SPADES TWO HEARTS EIGHT,0.6486,0.0192,0.3322
SPADES QUEEN HEARTS NINE,0.3826,0.0088,0.6086
SPADES THREE HEARTS EIGHT,0.6398,0.0196,0.3406
SPADES FOUR HEARTS EIGHT,0.6326,0.0194,0.348
SPADES ACE HEARTS NINE,0.3854,0.0058,0.6088
CLUBS EIGHT HEARTS EIGHT,0.3398,0.0318,0.6284
CLUBS NINE HEARTS EIGHT,0.5782,0.0172,0.4046
CLUBS THREE HEARTS KING,0.4494,0.0076,0.543
CLUBS FOUR HEARTS EIGHT,0.6408,0.021,0.3382
CLUBS THREE HEARTS QUEEN,0.4326,0.012,0.5554
CLUBS FIVE HEARTS EIGHT,0.6972,0.0544,0.2484
CLUBS SIX HEARTS EIGHT,0.5902,0.0208,0.389
CLUBS THREE HEARTS ACE,0.436,0.0044,0.5596
CLUBS SEVEN HEARTS EIGHT,0.5878,0.015,0.3972
CLUBS THREE HEARTS EIGHT,0.645,0.0192,0.3358
CLUBS TWO HEARTS EIGHT,0.6416,0.022,0.3364
SPADES TEN SPADES FOUR,0.6356,0.0184,0.346
HEARTS NINE HEARTS EIGHT,0.5294,0.019,0.4516
SPADES QUEEN SPADES FOUR,0.3784,0.0172,0.6044
SPADES KING SPADES FOUR,0.3634,0.0128,0.6238
SPADES ACE SPADES FOUR,0.3666,0.0054,0.628
HEARTS KING HEARTS TEN,0.3666,0.0066,0.6268
HEARTS QUEEN HEARTS TEN,0.3354,0.0102,0.6544
HEARTS ACE HEARTS TEN,0.352,0.0032,0.6448
CLUBS JACK HEARTS SEVEN,0.2704,0.2878,0.4418
HEARTS SEVEN CLUBS TEN,0.5872,0.0168,0.396
CLUBS KING HEARTS SEVEN,0.3986,0.0068,0.5946
CLUBS QUEEN HEARTS SEVEN,0.4084,0.012,0.5796
CLUBS ACE HEARTS SEVEN,0.4052,0.0036,0.5912
CLUBS SEVEN HEARTS ACE,0.3994,0.004,0.5966
CLUBS SEVEN HEARTS KING,0.4004,0.0074,0.5922
CLUBS SEVEN HEARTS QUEEN,0.4106,0.011,0.5784
CLUBS SEVEN HEARTS JACK,0.2758,0.2796,0.4446
CLUBS SEVEN HEARTS TEN,0.5974,0.0182,0.3844
CLUBS THREE CLUBS TEN,0.5962,0.0182,0.3856
CLUBS THREE CLUBS JACK,0.3528,0.4028,0.2444
CLUBS THREE CLUBS ACE,0.4056,0.0076,0.5868
CLUBS THREE CLUBS QUEEN,0.4014,0.0116,0.587
CLUBS THREE CLUBS KING,0.4118,0.0096,0.5786
HEARTS JACK HEARTS TEN,0.2722,0.1158,0.612
SPADES ACE CLUBS ACE,0.16,0.004,0.836
SPADES KING CLUBS ACE,0.3566,0.0048,0.6386
SPADES QUEEN CLUBS ACE,0.356,0.0044,0.6396
SPADES TEN CLUBS ACE,0.3772,0.0054,0.6174
SPADES EIGHT HEARTS NINE,0.5772,0.019,0.4038
SPADES NINE HEARTS NINE,0.3194,0.0302,0.6504
SPADES SIX HEARTS NINE,0.5966,0.018,0.3854
SPADES SEVEN HEARTS NINE,0.5898,0.0168,0.3934
CLUBS SEVEN HEARTS NINE,0.5996,0.0186,0.3818
CLUBS SIX HEARTS NINE,0.6038,0.0166,0.3796
CLUBS FIVE HEARTS NINE,0.7094,0.0576,0.233
CLUBS FOUR HEARTS NINE,0.6466,0.0218,0.3316
CLUBS THREE HEARTS NINE,0.6454,0.0172,0.3374
CLUBS TWO HEARTS NINE,0.6622,0.0172,0.3206
SPADES FOUR HEARTS NINE,0.647,0.0196,0.3334
SPADES THREE HEARTS NINE,0.6448,0.0152,0.34
SPADES TWO HEARTS NINE,0.6328,0.0166,0.3506
CLUBS NINE HEARTS NINE,0.3254,0.0312,0.6434
CLUBS EIGHT HEARTS NINE,0.5804,0.0172,0.4024
