opposingHand,winningChance,drawChance,lostChance
HEARTS TEN CLUBS TEN,0.3688,0.0184,0.6128
HEARTS TEN CLUBS JACK,0.713,0.0154,0.2716
HEARTS NINE CLUBS QUEEN,0.6604,0.0044,0.3352
CLUBS KING HEARTS NINE,0.669,0.0016,0.3294
SPADES QUEEN HEARTS TEN,0.724,0.02,0.256
SPADES KING HEARTS TEN,0.7496,0.019,0.2314
SPADES JACK HEARTS NINE,0.6502,0.0038,0.346
SPADES JACK HEARTS TEN,0.7188,0.0182,0.263
SPADES SIX HEARTS EIGHT,0.6582,0.0062,0.3356
SPADES SEVEN HEARTS EIGHT,0.6316,0.0044,0.364
CLUBS THREE HEARTS JACK,0.6658,0.005,0.3292
SPADES EIGHT HEARTS EIGHT,0.4952,0.0032,0.5016
CLUBS THREE HEARTS TEN,0.765,0.0208,0.2142
SPADES NINE HEARTS EIGHT,0.6492,0.0052,0.3456
SPADES KING HEARTS NINE,0.6558,0.005,0.3392
SPADES TWO HEARTS EIGHT,0.694,0.0046,0.3014
SPADES QUEEN HEARTS NINE,0.6398,0.0068,0.3534
SPADES THREE HEARTS EIGHT,0.6874,0.004,0.3086
SPADES FOUR HEARTS EIGHT,0.685,0.0056,0.3094
SPADES FIVE HEARTS EIGHT,0.6652,0.005,0.3298
CLUBS EIGHT HEARTS EIGHT,0.4894,0.0054,0.5052
CLUBS NINE HEARTS EIGHT,0.6526,0.0038,0.3436
CLUBS THREE HEARTS KING,0.6672,0.0042,0.3286
CLUBS FOUR HEARTS EIGHT,0.6924,0.0018,0.3058
CLUBS THREE HEARTS QUEEN,0.6796,0.0034,0.317
CLUBS FIVE HEARTS EIGHT,0.6636,0.0034,0.333
CLUBS SIX HEARTS EIGHT,0.663,0.0034,0.3336
CLUBS THREE HEARTS ACE,0.6522,0.1194,0.2284
CLUBS SEVEN HEARTS EIGHT,0.6462,0.0036,0.3502
CLUBS THREE HEARTS EIGHT,0.6942,0.004,0.3018
CLUBS TWO HEARTS EIGHT,0.6878,0.0038,0.3084
SPADES JACK SPADES FOUR,0.659,0.005,0.336
HEARTS NINE HEARTS EIGHT,0.6262,0.0052,0.3686
SPADES QUEEN SPADES FOUR,0.666,0.0066,0.3274
SPADES KING SPADES FOUR,0.6654,0.0072,0.3274
HEARTS KING HEARTS TEN,0.695,0.0162,0.2888
HEARTS QUEEN HEARTS TEN,0.6936,0.0174,0.289
HEARTS ACE HEARTS TEN,0.0634,0.864,0.0726
CLUBS JACK HEARTS SEVEN,0.655,0.0028,0.3422
HEARTS SEVEN CLUBS TEN,0.749,0.0206,0.2304
CLUBS KING HEARTS SEVEN,0.656,0.0042,0.3398
CLUBS QUEEN HEARTS SEVEN,0.6612,0.0034,0.3354
CLUBS ACE HEARTS SEVEN,0.6626,0.113,0.2244
CLUBS SEVEN HEARTS ACE,0.6586,0.1186,0.2228
CLUBS SEVEN HEARTS KING,0.6668,0.0038,0.3294
CLUBS SEVEN HEARTS QUEEN,0.6732,0.0032,0.3236
CLUBS SEVEN HEARTS JACK,0.6484,0.0032,0.3484
CLUBS SEVEN HEARTS TEN,0.7496,0.0216,0.2288
CLUBS THREE CLUBS TEN,0.7102,0.0308,0.259
CLUBS THREE CLUBS JACK,0.6344,0.0048,0.3608
CLUBS THREE CLUBS ACE,0.6138,0.1084,0.2778
CLUBS THREE CLUBS QUEEN,0.639,0.0058,0.3552
CLUBS THREE CLUBS KING,0.6342,0.0054,0.3604
HEARTS JACK HEARTS TEN,0.6764,0.0166,0.307
SPADES KING CLUBS ACE,0.2688,0.0506,0.6806
SPADES QUEEN CLUBS ACE,0.271,0.058,0.671
SPADES JACK CLUBS ACE,0.2684,0.0872,0.6444
SPADES EIGHT HEARTS NINE,0.644,0.004,0.352
SPADES NINE HEARTS NINE,0.4832,0.0046,0.5122
SPADES SIX HEARTS NINE,0.6696,0.0038,0.3266
SPADES SEVEN HEARTS NINE,0.6624,0.0054,0.3322
CLUBS SEVEN HEARTS NINE,0.6568,0.0032,0.34
CLUBS SIX HEARTS NINE,0.6662,0.0026,0.3312
CLUBS FIVE HEARTS NINE,0.6866,0.0038,0.3096
CLUBS FOUR HEARTS NINE,0.6904,0.005,0.3046
CLUBS THREE HEARTS NINE,0.7,0.005,0.295
CLUBS TWO HEARTS NINE,0.7056,0.0058,0.2886
SPADES FIVE HEARTS NINE,0.6848,0.0046,0.3106
SPADES FOUR HEARTS NINE,0.6908,0.005,0.3042
SPADES THREE HEARTS NINE,0.6928,0.0042,0.303
SPADES TWO HEARTS NINE,0.693,0.006,0.301
CLUBS NINE HEARTS NINE,0.493,0.0048,0.5022
CLUBS EIGHT HEARTS NINE,0.6512,0.0032,0.3456
