opposingHand,winningChance,drawChance,lostChance
SPADES JACK SPADES FIVE
SPADES TEN HEARTS FIVE,0.7164,0.0578,0.2258
CLUBS EIGHT CLUBS JACK,0.2596,0.201,0.5394
CLUBS EIGHT CLUBS TEN,0.5546,0.014,0.4314
CLUBS EIGHT CLUBS KING,0.3874,0.0074,0.6052
CLUBS EIGHT CLUBS QUEEN,0.3802,0.0106,0.6092
CLUBS EIGHT CLUBS ACE,0.3864,0.0038,0.6098
DIAMONDS TWO DIAMONDS THREE,0.6162,0.0216,0.3622
DIAMONDS TWO DIAMONDS FIVE,0.6538,0.0594,0.2868
SPADES KING HEARTS FIVE,0.2554,0.037,0.7076
DIAMONDS TWO DIAMONDS FOUR,0.6136,0.0214,0.365
SPADES QUEEN HEARTS FIVE,0.2668,0.0532,0.68
DIAMONDS TWO DIAMONDS SEVEN,0.6158,0.0176,0.3666
DIAMONDS TWO DIAMONDS SIX,0.611,0.0188,0.3702
SPADES ACE HEARTS FIVE,0.2722,0.027,0.7008
DIAMONDS TWO DIAMONDS NINE,0.6122,0.0164,0.3714
DIAMONDS TWO DIAMONDS EIGHT,0.608,0.0174,0.3746
DIAMONDS THREE DIAMONDS FOUR,0.6188,0.0182,0.363
CLUBS TWO SPADES FOUR,0.6604,0.0208,0.3188
DIAMONDS THREE DIAMONDS FIVE,0.6386,0.06,0.3014
CLUBS TWO SPADES TWO,0.4436,0.0496,0.5068
CLUBS TWO SPADES THREE,0.6612,0.0184,0.3204
DIAMONDS THREE DIAMONDS EIGHT,0.5998,0.0172,0.383
SPADES EIGHT CLUBS TWO,0.6416,0.0166,0.3418
DIAMONDS THREE DIAMONDS NINE,0.6062,0.0154,0.3784
SPADES NINE CLUBS TWO,0.6292,0.019,0.3518
DIAMONDS THREE DIAMONDS SIX,0.5828,0.0202,0.397
CLUBS TWO SPADES SIX,0.6468,0.0194,0.3338
DIAMONDS THREE DIAMONDS SEVEN,0.605,0.016,0.379
SPADES SEVEN CLUBS TWO,0.6496,0.0186,0.3318
CLUBS SIX CLUBS TWO,0.5972,0.02,0.3828
CLUBS SEVEN CLUBS TWO,0.6076,0.0198,0.3726
CLUBS FOUR CLUBS TWO,0.6312,0.0188,0.35
CLUBS FIVE CLUBS TWO,0.6526,0.0622,0.2852
CLUBS JACK CLUBS TEN,0.2604,0.1078,0.6318
DIAMONDS FOUR DIAMONDS SIX,0.5848,0.0232,0.392
CLUBS QUEEN CLUBS TEN,0.3516,0.0106,0.6378
DIAMONDS FOUR DIAMONDS SEVEN,0.6036,0.0186,0.3778
CLUBS KING CLUBS TEN,0.355,0.0074,0.6376
CLUBS ACE CLUBS TEN,0.359,0.0058,0.6352
CLUBS EIGHT CLUBS TWO,0.612,0.0202,0.3678
DIAMONDS FIVE DIAMONDS FOUR,0.6238,0.0628,0.3134
CLUBS NINE CLUBS TWO,0.606,0.0186,0.3754
DIAMONDS NINE DIAMONDS FOUR,0.609,0.0194,0.3716
DIAMONDS EIGHT DIAMONDS FOUR,0.6,0.0182,0.3818
CLUBS TWO CLUBS THREE,0.6114,0.0196,0.369
DIAMONDS NINE DIAMONDS FIVE,0.673,0.0582,0.2688
DIAMONDS TWO CLUBS JACK,0.35,0.4446,0.2054
DIAMONDS EIGHT DIAMONDS FIVE,0.652,0.0572,0.2908
DIAMONDS TWO CLUBS TEN,0.6604,0.0212,0.3184
DIAMONDS FIVE DIAMONDS SEVEN,0.648,0.0566,0.2954
DIAMONDS FIVE DIAMONDS SIX,0.6316,0.0538,0.3146
DIAMONDS TWO CLUBS ACE,0.4216,0.0084,0.57
DIAMONDS TWO CLUBS KING,0.4298,0.0078,0.5624
DIAMONDS TWO CLUBS QUEEN,0.4454,0.0126,0.542
DIAMONDS EIGHT DIAMONDS SIX,0.5594,0.0176,0.423
DIAMONDS NINE DIAMONDS SIX,0.554,0.017,0.429
SPADES THREE HEARTS ACE,0.4202,0.0054,0.5744
HEARTS KING SPADES THREE,0.438,0.0062,0.5558
DIAMONDS SEVEN DIAMONDS SIX,0.5478,0.018,0.4342
SPADES THREE HEARTS QUEEN,0.43,0.0106,0.5594
SPADES THREE HEARTS JACK,0.3628,0.4306,0.2066
SPADES THREE HEARTS TEN,0.6456,0.0198,0.3346
DIAMONDS EIGHT DIAMONDS SEVEN,0.546,0.0182,0.4358
DIAMONDS NINE DIAMONDS SEVEN,0.5506,0.0178,0.4316
DIAMONDS NINE DIAMONDS EIGHT,0.5482,0.0156,0.4362
DIAMONDS KING HEARTS TEN,0.3896,0.0064,0.604
HEARTS THREE HEARTS TEN,0.6078,0.0156,0.3766
DIAMONDS KING HEARTS JACK,0.2794,0.0306,0.69
HEARTS THREE HEARTS JACK,0.3442,0.409,0.2468
CLUBS SIX SPADES TEN,0.5974,0.0154,0.3872
DIAMONDS KING HEARTS ACE,0.372,0.0046,0.6234
HEARTS THREE HEARTS ACE,0.405,0.0054,0.5896
SPADES ACE CLUBS SIX,0.3904,0.004,0.6056
DIAMONDS KING HEARTS QUEEN,0.3548,0.0058,0.6394
HEARTS THREE HEARTS QUEEN,0.4078,0.0108,0.5814
SPADES KING CLUBS SIX,0.3886,0.0062,0.6052
DIAMONDS KING HEARTS KING,0.1762,0.0078,0.816
HEARTS THREE HEARTS KING,0.3992,0.0086,0.5922
SPADES QUEEN CLUBS SIX,0.391,0.0098,0.5992
SPADES NINE HEARTS TEN,0.562,0.0174,0.4206
SPADES NINE HEARTS JACK,0.2664,0.1642,0.5694
SPADES NINE HEARTS QUEEN,0.3812,0.0124,0.6064
SPADES NINE HEARTS KING,0.39,0.0086,0.6014
SPADES NINE HEARTS ACE,0.3882,0.0066,0.6052
SPADES TEN CLUBS TEN,0.3098,0.0258,0.6644
SPADES ACE CLUBS TEN,0.3758,0.0044,0.6198
SPADES KING CLUBS TEN,0.3722,0.0064,0.6214
SPADES QUEEN CLUBS TEN,0.3664,0.0072,0.6264
CLUBS EIGHT SPADES TEN,0.5714,0.0174,0.4112
HEARTS THREE SPADES TEN,0.642,0.0236,0.3344
SPADES TEN DIAMONDS KING,0.3712,0.0068,0.622
SPADES ACE CLUBS EIGHT,0.3804,0.005,0.6146
HEARTS FIVE CLUBS JACK,0.0728,0.9102,0.017
CLUBS SIX HEARTS ACE,0.4104,0.0044,0.5852
HEARTS FIVE CLUBS TEN,0.7096,0.0638,0.2266
CLUBS EIGHT SPADES QUEEN,0.3926,0.0128,0.5946
SPADES THREE CLUBS TEN,0.644,0.0192,0.3368
CLUBS SIX HEARTS QUEEN,0.4042,0.0084,0.5874
CLUBS EIGHT SPADES KING,0.3906,0.0096,0.5998
SPADES THREE CLUBS JACK,0.3544,0.4316,0.214
CLUBS SIX HEARTS KING,0.4138,0.0076,0.5786
DIAMONDS TWO HEARTS JACK,0.3578,0.4402,0.202
SPADES THREE CLUBS QUEEN,0.425,0.0126,0.5624
DIAMONDS TWO HEARTS TEN,0.6546,0.017,0.3284
SPADES THREE CLUBS KING,0.4244,0.0078,0.5678
HEARTS FIVE CLUBS ACE,0.2824,0.0262,0.6914
SPADES THREE CLUBS ACE,0.4098,0.005,0.5852
HEARTS FIVE CLUBS KING,0.2828,0.037,0.6802
HEARTS FIVE CLUBS QUEEN,0.2906,0.0502,0.6592
HEARTS THREE CLUBS KING,0.434,0.0082,0.5578
DIAMONDS KING CLUBS KING,0.1824,0.0076,0.81
HEARTS THREE CLUBS QUEEN,0.4228,0.0074,0.5698
DIAMONDS KING CLUBS QUEEN,0.3632,0.0088,0.628
HEARTS FIVE HEARTS JACK,0.0688,0.8556,0.0756
HEARTS FIVE HEARTS TEN,0.669,0.0662,0.2648
HEARTS THREE CLUBS ACE,0.418,0.0048,0.5772
DIAMONDS KING CLUBS ACE,0.37,0.0046,0.6254
SPADES ACE CLUBS QUEEN,0.347,0.004,0.649
SPADES KING CLUBS QUEEN,0.343,0.008,0.649
HEARTS THREE CLUBS JACK,0.3668,0.4356,0.1976
DIAMONDS KING CLUBS JACK,0.2916,0.0296,0.6788
SPADES QUEEN CLUBS QUEEN,0.1752,0.011,0.8138
HEARTS THREE CLUBS TEN,0.6414,0.0164,0.3422
DIAMONDS KING CLUBS TEN,0.376,0.0064,0.6176
CLUBS SIX CLUBS QUEEN,0.3726,0.0106,0.6168
SPADES TEN CLUBS QUEEN,0.3628,0.0094,0.6278
CLUBS SIX CLUBS KING,0.3652,0.007,0.6278
CLUBS SIX CLUBS ACE,0.3914,0.0048,0.6038
HEARTS FIVE HEARTS KING,0.2556,0.0404,0.704
HEARTS FIVE HEARTS QUEEN,0.2624,0.0472,0.6904
CLUBS SIX CLUBS TEN,0.5698,0.0152,0.415
HEARTS FIVE HEARTS ACE,0.2596,0.029,0.7114
CLUBS SIX CLUBS JACK,0.2532,0.3504,0.3964
SPADES SEVEN HEARTS JACK,0.2478,0.2986,0.4536
SPADES SEVEN HEARTS TEN,0.578,0.0162,0.4058
DIAMONDS TWO CLUBS TWO,0.4384,0.0508,0.5108
DIAMONDS TWO CLUBS THREE,0.658,0.021,0.321
HEARTS SIX DIAMONDS TWO,0.643,0.0212,0.3358
DIAMONDS TWO HEARTS QUEEN,0.43,0.0128,0.5572
DIAMONDS TWO HEARTS SEVEN,0.6566,0.0192,0.3242
DIAMONDS TWO HEARTS KING,0.4258,0.009,0.5652
DIAMONDS TWO HEARTS EIGHT,0.6568,0.0188,0.3244
DIAMONDS TWO HEARTS ACE,0.4278,0.0072,0.565
DIAMONDS TWO HEARTS NINE,0.649,0.0174,0.3336
DIAMONDS TWO DIAMONDS QUEEN,0.4284,0.01,0.5616
DIAMONDS TWO HEARTS TWO,0.4456,0.05,0.5044
DIAMONDS TWO DIAMONDS KING,0.4106,0.0098,0.5796
HEARTS THREE DIAMONDS TWO,0.6532,0.0224,0.3244
DIAMONDS TWO DIAMONDS ACE,0.407,0.0048,0.5882
HEARTS FOUR DIAMONDS TWO,0.6486,0.0224,0.329
DIAMONDS TWO HEARTS FIVE,0.7,0.0636,0.2364
SPADES SEVEN HEARTS ACE,0.39,0.0032,0.6068
DIAMONDS TWO DIAMONDS TEN,0.611,0.0178,0.3712
SPADES SEVEN HEARTS KING,0.3924,0.0078,0.5998
DIAMONDS TWO DIAMONDS JACK,0.3398,0.417,0.2432
SPADES SEVEN HEARTS QUEEN,0.394,0.0126,0.5934
DIAMONDS TWO SPADES NINE,0.647,0.0204,0.3326
DIAMONDS TWO SPADES EIGHT,0.6348,0.0198,0.3454
DIAMONDS TWO SPADES SEVEN,0.6516,0.022,0.3264
DIAMONDS TWO SPADES SIX,0.6318,0.0234,0.3448
DIAMONDS TWO SPADES FOUR,0.6506,0.0222,0.3272
DIAMONDS TWO SPADES THREE,0.6484,0.0186,0.333
DIAMONDS TWO SPADES TWO,0.4496,0.0516,0.4988
CLUBS NINE DIAMONDS TWO,0.6376,0.0226,0.3398
CLUBS EIGHT DIAMONDS TWO,0.6432,0.0196,0.3372
DIAMONDS TWO CLUBS SEVEN,0.648,0.019,0.333
CLUBS SIX DIAMONDS TWO,0.6444,0.0224,0.3332
DIAMONDS TWO CLUBS FIVE,0.703,0.0598,0.2372
DIAMONDS TWO CLUBS FOUR,0.6582,0.0202,0.3216
CLUBS FOUR SPADES FOUR,0.4304,0.0494,0.5202
CLUBS FOUR SPADES THREE,0.6406,0.0224,0.337
CLUBS FOUR SPADES TWO,0.6524,0.0202,0.3274
SPADES NINE CLUBS FOUR,0.643,0.0176,0.3394
CLUBS FOUR SPADES EIGHT,0.6282,0.021,0.3508
CLUBS FOUR SPADES SEVEN,0.6178,0.02,0.3622
CLUBS FOUR SPADES SIX,0.6194,0.0198,0.3608
SPADES ACE DIAMONDS SIX,0.3954,0.006,0.5986
SPADES QUEEN DIAMONDS SIX,0.3864,0.013,0.6006
SPADES KING DIAMONDS SIX,0.3844,0.0074,0.6082
SPADES TEN DIAMONDS SIX,0.6066,0.0156,0.3778
SPADES QUEEN SPADES TWO,0.3882,0.011,0.6008
SPADES KING SPADES TWO,0.3842,0.0096,0.6062
SPADES ACE SPADES TWO,0.3792,0.0056,0.6152
DIAMONDS JACK CLUBS JACK,0.1486,0.0308,0.8206
DIAMONDS JACK CLUBS TEN,0.3008,0.1102,0.589
DIAMONDS JACK CLUBS KING,0.2754,0.0318,0.6928
DIAMONDS JACK CLUBS QUEEN,0.2946,0.0364,0.669
DIAMONDS THREE DIAMONDS JACK,0.3482,0.402,0.2498
DIAMONDS THREE DIAMONDS TEN,0.6094,0.0174,0.3732
DIAMONDS JACK CLUBS ACE,0.2724,0.0218,0.7058
DIAMONDS THREE DIAMONDS KING,0.4094,0.0082,0.5824
HEARTS THREE DIAMONDS THREE,0.443,0.0484,0.5086
DIAMONDS THREE DIAMONDS QUEEN,0.4012,0.013,0.5858
DIAMONDS THREE HEARTS TWO,0.6502,0.0238,0.326
HEARTS FIVE DIAMONDS THREE,0.6934,0.0642,0.2424
DIAMONDS THREE DIAMONDS ACE,0.4006,0.0058,0.5936
HEARTS FOUR DIAMONDS THREE,0.6356,0.0222,0.3422
DIAMONDS THREE HEARTS SEVEN,0.6474,0.0164,0.3362
SPADES TEN SPADES NINE,0.5434,0.018,0.4386
HEARTS SIX DIAMONDS THREE,0.6452,0.0194,0.3354
DIAMONDS THREE HEARTS NINE,0.6462,0.02,0.3338
HEARTS JACK DIAMONDS FOUR,0.354,0.4384,0.2076
HEARTS KING HEARTS ACE,0.3476,0.0042,0.6482
SPADES TEN SPADES TWO,0.643,0.0202,0.3368
DIAMONDS THREE HEARTS EIGHT,0.6576,0.0194,0.323
HEARTS TEN DIAMONDS FOUR,0.6336,0.0188,0.3476
HEARTS QUEEN DIAMONDS FOUR,0.4248,0.0094,0.5658
HEARTS KING DIAMONDS FOUR,0.426,0.0086,0.5654
SPADES ACE SPADES NINE,0.352,0.005,0.643
HEARTS ACE DIAMONDS FOUR,0.4206,0.0038,0.5756
SPADES KING SPADES NINE,0.3462,0.0088,0.645
SPADES QUEEN SPADES NINE,0.3258,0.0106,0.6636
DIAMONDS THREE SPADES NINE,0.6374,0.017,0.3456
DIAMONDS THREE SPADES EIGHT,0.6414,0.0192,0.3394
DIAMONDS THREE SPADES SEVEN,0.6386,0.0202,0.3412
DIAMONDS THREE SPADES SIX,0.6174,0.02,0.3626
CLUBS SIX DIAMONDS THREE,0.6364,0.017,0.3466
CLUBS ACE DIAMONDS FOUR,0.4212,0.0048,0.574
CLUBS SIX CLUBS FIVE,0.615,0.0648,0.3202
CLUBS SEVEN CLUBS FIVE,0.6472,0.0564,0.2964
CLUBS SEVEN DIAMONDS THREE,0.6316,0.0184,0.35
DIAMONDS THREE CLUBS FOUR,0.6578,0.0198,0.3224
CLUBS QUEEN DIAMONDS FOUR,0.4436,0.0124,0.544
DIAMONDS THREE CLUBS FIVE,0.6772,0.059,0.2638
CLUBS KING DIAMONDS FOUR,0.4368,0.0078,0.5554
DIAMONDS THREE CLUBS TWO,0.6604,0.0186,0.321
DIAMONDS FOUR CLUBS TEN,0.6442,0.017,0.3388
DIAMONDS THREE CLUBS THREE,0.449,0.0464,0.5046
DIAMONDS FOUR CLUBS JACK,0.369,0.4332,0.1978
DIAMONDS THREE SPADES FOUR,0.637,0.0232,0.3398
DIAMONDS THREE SPADES TWO,0.6618,0.0212,0.317
DIAMONDS THREE SPADES THREE,0.4268,0.0508,0.5224
CLUBS EIGHT DIAMONDS THREE,0.6502,0.0176,0.3322
CLUBS NINE DIAMONDS THREE,0.6448,0.0176,0.3376
SPADES SEVEN CLUBS ACE,0.3866,0.0072,0.6062
SPADES SEVEN CLUBS QUEEN,0.399,0.0124,0.5886
SPADES SEVEN CLUBS KING,0.3878,0.0084,0.6038
CLUBS FIVE SPADES SEVEN,0.6726,0.0604,0.267
SPADES SEVEN CLUBS TEN,0.5874,0.0146,0.398
CLUBS FIVE SPADES SIX,0.6652,0.061,0.2738
SPADES SEVEN CLUBS JACK,0.2562,0.2956,0.4482
SPADES NINE CLUBS FIVE,0.7008,0.057,0.2422
SPADES EIGHT CLUBS FIVE,0.6784,0.0622,0.2594
CLUBS FIVE SPADES THREE,0.679,0.0624,0.2586
CLUBS FIVE SPADES TWO,0.6812,0.0704,0.2484
CLUBS FIVE SPADES FOUR,0.6634,0.0616,0.275
CLUBS NINE CLUBS FIVE,0.6702,0.0576,0.2722
CLUBS EIGHT CLUBS FIVE,0.6392,0.0588,0.302
CLUBS ACE CLUBS QUEEN,0.3454,0.0048,0.6498
CLUBS KING CLUBS QUEEN,0.3526,0.0072,0.6402
DIAMONDS TEN DIAMONDS FOUR,0.5992,0.017,0.3838
DIAMONDS NINE CLUBS TEN,0.5822,0.0152,0.4026
DIAMONDS JACK DIAMONDS FOUR,0.3392,0.4144,0.2464
DIAMONDS NINE CLUBS JACK,0.2688,0.163,0.5682
SPADES NINE CLUBS JACK,0.2522,0.1576,0.5902
SPADES NINE CLUBS TEN,0.5588,0.018,0.4232
DIAMONDS ACE DIAMONDS FOUR,0.394,0.0064,0.5996
HEARTS FOUR DIAMONDS FOUR,0.4316,0.046,0.5224
DIAMONDS JACK HEARTS TEN,0.2762,0.1158,0.608
SPADES NINE CLUBS KING,0.3888,0.0074,0.6038
DIAMONDS TWO SPADES TEN,0.6452,0.0172,0.3376
DIAMONDS NINE CLUBS ACE,0.397,0.0064,0.5966
HEARTS FIVE DIAMONDS FOUR,0.6646,0.0614,0.274
HEARTS JACK DIAMONDS JACK,0.1418,0.0364,0.8218
SPADES NINE CLUBS QUEEN,0.3848,0.014,0.6012
DIAMONDS QUEEN DIAMONDS FOUR,0.4156,0.0118,0.5726
HEARTS TWO DIAMONDS FOUR,0.6602,0.0234,0.3164
DIAMONDS NINE CLUBS QUEEN,0.384,0.0108,0.6052
DIAMONDS KING DIAMONDS FOUR,0.4076,0.007,0.5854
HEARTS THREE DIAMONDS FOUR,0.6324,0.0208,0.3468
SPADES NINE CLUBS ACE,0.4008,0.004,0.5952
DIAMONDS NINE CLUBS KING,0.404,0.0078,0.5882
HEARTS ACE DIAMONDS JACK,0.2786,0.0158,0.7056
SPADES ACE DIAMONDS TWO,0.4068,0.0046,0.5886
DIAMONDS JACK HEARTS QUEEN,0.281,0.0364,0.6826
SPADES QUEEN DIAMONDS TWO,0.4276,0.0148,0.5576
HEARTS KING DIAMONDS JACK,0.2884,0.0276,0.684
SPADES KING DIAMONDS TWO,0.4296,0.0106,0.5598
SPADES TEN SPADES SEVEN,0.5722,0.0192,0.4086
CLUBS SEVEN CLUBS THREE,0.6004,0.0202,0.3794
CLUBS SIX CLUBS THREE,0.6042,0.0172,0.3786
CLUBS FIVE CLUBS THREE,0.6338,0.0636,0.3026
CLUBS FOUR CLUBS THREE,0.599,0.0216,0.3794
CLUBS NINE CLUBS THREE,0.622,0.0194,0.3586
CLUBS EIGHT CLUBS THREE,0.6192,0.0166,0.3642
CLUBS THREE SPADES FOUR,0.6458,0.0192,0.335
CLUBS THREE SPADES THREE,0.4408,0.0458,0.5134
CLUBS THREE SPADES TWO,0.6604,0.0224,0.3172
SPADES SIX CLUBS THREE,0.6144,0.0206,0.365
SPADES SEVEN CLUBS THREE,0.6388,0.02,0.3412
SPADES EIGHT CLUBS THREE,0.642,0.0176,0.3404
SPADES NINE CLUBS THREE,0.6538,0.0156,0.3306
SPADES TWO DIAMONDS FOUR,0.6582,0.0206,0.3212
SPADES THREE DIAMONDS FOUR,0.6304,0.0224,0.3472
SPADES FOUR DIAMONDS FOUR,0.4352,0.0486,0.5162
SPADES SIX DIAMONDS FOUR,0.6264,0.0186,0.355
SPADES SEVEN DIAMONDS FOUR,0.6186,0.0174,0.364
SPADES EIGHT DIAMONDS FOUR,0.6378,0.016,0.3462
SPADES NINE DIAMONDS FOUR,0.652,0.0216,0.3264
CLUBS FIVE DIAMONDS FOUR,0.6558,0.063,0.2812
CLUBS FOUR DIAMONDS FOUR,0.4386,0.041,0.5204
CLUBS SEVEN DIAMONDS FOUR,0.642,0.018,0.34
CLUBS SIX DIAMONDS FOUR,0.6314,0.02,0.3486
CLUBS NINE DIAMONDS FOUR,0.6534,0.0138,0.3328
CLUBS EIGHT DIAMONDS FOUR,0.6532,0.0174,0.3294
DIAMONDS FOUR HEARTS SEVEN,0.6294,0.0158,0.3548
HEARTS SIX DIAMONDS FOUR,0.6226,0.0182,0.3592
HEARTS NINE DIAMONDS FOUR,0.6596,0.0178,0.3226
DIAMONDS FOUR HEARTS EIGHT,0.6364,0.0194,0.3442
CLUBS THREE DIAMONDS FOUR,0.6388,0.019,0.3422
CLUBS TWO DIAMONDS FOUR,0.6636,0.023,0.3134
DIAMONDS TEN DIAMONDS FIVE,0.6738,0.06,0.2662
DIAMONDS JACK DIAMONDS FIVE,0.0652,0.8614,0.0734
DIAMONDS NINE HEARTS QUEEN,0.384,0.0112,0.6048
HEARTS KING DIAMONDS NINE,0.392,0.0074,0.6006
DIAMONDS NINE HEARTS ACE,0.4038,0.007,0.5892
DIAMONDS NINE HEARTS TEN,0.5814,0.017,0.4016
DIAMONDS NINE HEARTS JACK,0.2774,0.163,0.5596
CLUBS KING DIAMONDS SIX,0.406,0.0088,0.5852
CLUBS QUEEN DIAMONDS SIX,0.4058,0.01,0.5842
CLUBS ACE DIAMONDS SIX,0.4144,0.0032,0.5824
SPADES KING DIAMONDS FOUR,0.4188,0.0076,0.5736
SPADES ACE SPADES SEVEN,0.3498,0.0058,0.6444
SPADES QUEEN DIAMONDS FOUR,0.4198,0.0128,0.5674
SPADES QUEEN SPADES SEVEN,0.3518,0.0096,0.6386
CLUBS JACK DIAMONDS SIX,0.2824,0.3588,0.3588
SPADES KING SPADES SEVEN,0.3324,0.0074,0.6602
SPADES ACE DIAMONDS FOUR,0.397,0.0066,0.5964
CLUBS TEN DIAMONDS SIX,0.6184,0.0166,0.365
CLUBS NINE CLUBS FOUR,0.6166,0.0186,0.3648
CLUBS EIGHT CLUBS FOUR,0.5842,0.0206,0.3952
SPADES TEN DIAMONDS FOUR,0.6356,0.0224,0.342
CLUBS FOUR CLUBS FIVE,0.6224,0.0636,0.314
CLUBS SEVEN CLUBS FOUR,0.5894,0.0146,0.396
CLUBS SIX CLUBS FOUR,0.5868,0.0156,0.3976
CLUBS SEVEN SPADES EIGHT,0.574,0.0152,0.4108
CLUBS SEVEN SPADES NINE,0.582,0.0166,0.4014
CLUBS SEVEN SPADES SIX,0.571,0.0182,0.4108
CLUBS SEVEN SPADES SEVEN,0.342,0.035,0.623
CLUBS SEVEN SPADES FOUR,0.629,0.021,0.35
CLUBS SEVEN SPADES THREE,0.6144,0.021,0.3646
CLUBS SEVEN SPADES TWO,0.6388,0.0186,0.3426
CLUBS NINE CLUBS SEVEN,0.5512,0.0154,0.4334
CLUBS EIGHT CLUBS SEVEN,0.553,0.0156,0.4314
HEARTS SIX DIAMONDS FIVE,0.6696,0.0624,0.268
DIAMONDS FIVE HEARTS SEVEN,0.668,0.0588,0.2732
DIAMONDS FIVE HEARTS EIGHT,0.685,0.0586,0.2564
HEARTS NINE DIAMONDS FIVE,0.7022,0.0544,0.2434
DIAMONDS QUEEN DIAMONDS FIVE,0.2636,0.0506,0.6858
HEARTS TWO DIAMONDS FIVE,0.7,0.0626,0.2374
HEARTS KING HEARTS EIGHT,0.3846,0.0062,0.6092
DIAMONDS KING DIAMONDS FIVE,0.2684,0.0376,0.694
HEARTS THREE DIAMONDS FIVE,0.6826,0.0668,0.2506
HEARTS QUEEN HEARTS EIGHT,0.3756,0.0104,0.614
DIAMONDS ACE DIAMONDS FIVE,0.2764,0.0292,0.6944
HEARTS FOUR DIAMONDS FIVE,0.668,0.0624,0.2696
HEARTS FIVE DIAMONDS FIVE,0.3338,0.05,0.6162
HEARTS ACE HEARTS EIGHT,0.379,0.0046,0.6164
CLUBS FOUR DIAMONDS FIVE,0.6588,0.0648,0.2764
CLUBS FIVE DIAMONDS FIVE,0.3312,0.041,0.6278
CLUBS SIX DIAMONDS FIVE,0.6728,0.052,0.2752
CLUBS SEVEN DIAMONDS FIVE,0.6716,0.0562,0.2722
CLUBS TWO DIAMONDS FIVE,0.703,0.06,0.237
CLUBS THREE DIAMONDS FIVE,0.681,0.066,0.253
SPADES THREE DIAMONDS FIVE,0.6736,0.0656,0.2608
SPADES TWO DIAMONDS FIVE,0.6896,0.0624,0.248
HEARTS JACK CLUBS TEN,0.2716,0.1172,0.6112
SPADES TEN DIAMONDS EIGHT,0.5736,0.0196,0.4068
SPADES FOUR DIAMONDS FIVE,0.6588,0.0662,0.275
HEARTS JACK CLUBS JACK,0.146,0.0366,0.8174
HEARTS JACK CLUBS QUEEN,0.2834,0.0404,0.6762
CLUBS NINE DIAMONDS FIVE,0.7036,0.0518,0.2446
HEARTS JACK CLUBS KING,0.2822,0.0304,0.6874
CLUBS EIGHT DIAMONDS FIVE,0.7024,0.054,0.2436
HEARTS JACK CLUBS ACE,0.2776,0.023,0.6994
SPADES SEVEN DIAMONDS FIVE,0.673,0.0586,0.2684
SPADES KING DIAMONDS EIGHT,0.4062,0.0064,0.5874
SPADES SIX DIAMONDS FIVE,0.6644,0.0584,0.2772
SPADES QUEEN DIAMONDS EIGHT,0.3848,0.011,0.6042
SPADES NINE DIAMONDS FIVE,0.7042,0.0614,0.2344
SPADES EIGHT DIAMONDS FIVE,0.6856,0.0634,0.251
SPADES ACE DIAMONDS EIGHT,0.3942,0.005,0.6008
DIAMONDS TEN DIAMONDS SIX,0.5742,0.0154,0.4104
HEARTS ACE DIAMONDS SEVEN,0.4048,0.0036,0.5916
DIAMONDS JACK DIAMONDS SIX,0.2468,0.3504,0.4028
HEARTS QUEEN DIAMONDS SEVEN,0.3978,0.0128,0.5894
HEARTS KING DIAMONDS SEVEN,0.401,0.0046,0.5944
DIAMONDS ACE DIAMONDS SIX,0.378,0.005,0.617
HEARTS FOUR DIAMONDS SIX,0.6136,0.0236,0.3628
SPADES TWO HEARTS JACK,0.3562,0.4362,0.2076
HEARTS FIVE DIAMONDS SIX,0.6666,0.0574,0.276
SPADES TWO HEARTS TEN,0.6486,0.0196,0.3318
DIAMONDS QUEEN DIAMONDS SIX,0.376,0.0088,0.6152
HEARTS TWO DIAMONDS SIX,0.6406,0.018,0.3414
DIAMONDS KING DIAMONDS SIX,0.3824,0.0068,0.6108
HEARTS THREE DIAMONDS SIX,0.6308,0.021,0.3482
HEARTS EIGHT DIAMONDS SIX,0.588,0.0176,0.3944
HEARTS NINE DIAMONDS SIX,0.6208,0.0154,0.3638
HEARTS SIX DIAMONDS SIX,0.3584,0.0364,0.6052
HEARTS SEVEN DIAMONDS SIX,0.5934,0.02,0.3866
HEARTS TEN DIAMONDS SEVEN,0.5982,0.0152,0.3866
CLUBS TWO DIAMONDS SIX,0.653,0.0202,0.3268
HEARTS JACK DIAMONDS SEVEN,0.2712,0.287,0.4418
CLUBS THREE DIAMONDS SIX,0.6304,0.0226,0.347
DIAMONDS EIGHT CLUBS JACK,0.273,0.2074,0.5196
CLUBS SEVEN DIAMONDS SIX,0.5974,0.016,0.3866
CLUBS SIX DIAMONDS SIX,0.3464,0.0432,0.6104
DIAMONDS EIGHT CLUBS TEN,0.5798,0.017,0.4032
CLUBS FIVE DIAMONDS SIX,0.6736,0.0602,0.2662
CLUBS FOUR DIAMONDS SIX,0.6212,0.0168,0.362
HEARTS ACE HEARTS JACK,0.2732,0.0184,0.7084
DIAMONDS EIGHT CLUBS ACE,0.3996,0.0028,0.5976
HEARTS JACK HEARTS QUEEN,0.2634,0.0402,0.6964
DIAMONDS EIGHT CLUBS KING,0.4176,0.0068,0.5756
CLUBS NINE DIAMONDS SIX,0.595,0.0174,0.3876
HEARTS KING HEARTS JACK,0.2772,0.0304,0.6924
DIAMONDS EIGHT CLUBS QUEEN,0.3952,0.0112,0.5936
CLUBS EIGHT DIAMONDS SIX,0.5874,0.0198,0.3928
SPADES TEN HEARTS KING,0.3714,0.0074,0.6212
HEARTS ACE SPADES TWO,0.4236,0.005,0.5714
SPADES FOUR DIAMONDS SIX,0.6312,0.0194,0.3494
SPADES THREE DIAMONDS SIX,0.6328,0.0176,0.3496
SPADES TWO HEARTS QUEEN,0.4326,0.0126,0.5548
SPADES ACE SPADES KING,0.3096,0.0074,0.683
HEARTS KING SPADES TWO,0.4294,0.0074,0.5632
SPADES TWO DIAMONDS SIX,0.6468,0.0214,0.3318
HEARTS TEN HEARTS EIGHT,0.5546,0.0158,0.4296
SPADES NINE DIAMONDS SIX,0.5946,0.0136,0.3918
HEARTS JACK HEARTS EIGHT,0.2676,0.2042,0.5282
SPADES EIGHT DIAMONDS SIX,0.5918,0.0176,0.3906
SPADES SEVEN DIAMONDS SIX,0.573,0.0192,0.4078
SPADES SIX DIAMONDS SIX,0.346,0.035,0.619
SPADES KING HEARTS KING,0.1642,0.0082,0.8276
SPADES QUEEN HEARTS KING,0.3492,0.0054,0.6454
CLUBS ACE CLUBS KING,0.3514,0.007,0.6416
SPADES ACE HEARTS KING,0.3674,0.006,0.6266
SPADES ACE HEARTS JACK,0.2596,0.0218,0.7186
SPADES QUEEN HEARTS JACK,0.2634,0.0422,0.6944
SPADES KING HEARTS JACK,0.2672,0.0334,0.6994
SPADES TEN DIAMONDS TEN,0.3026,0.0246,0.6728
SPADES ACE DIAMONDS TEN,0.3834,0.0052,0.6114
SPADES TEN HEARTS JACK,0.256,0.118,0.626
SPADES QUEEN DIAMONDS TEN,0.3578,0.0102,0.632
SPADES KING DIAMONDS TEN,0.3646,0.0076,0.6278
SPADES NINE DIAMONDS SEVEN,0.5836,0.017,0.3994
SPADES EIGHT DIAMONDS SEVEN,0.576,0.0152,0.4088
SPADES SEVEN DIAMONDS SEVEN,0.3322,0.0368,0.631
SPADES SIX DIAMONDS SEVEN,0.5754,0.0192,0.4054
DIAMONDS KING DIAMONDS SEVEN,0.3772,0.008,0.6148
HEARTS THREE DIAMONDS SEVEN,0.6382,0.014,0.3478
HEARTS KING DIAMONDS FIVE,0.2744,0.0428,0.6828
DIAMONDS QUEEN DIAMONDS SEVEN,0.3836,0.0114,0.605
HEARTS TWO DIAMONDS SEVEN,0.657,0.0164,0.3266
HEARTS QUEEN DIAMONDS FIVE,0.289,0.0444,0.6666
HEARTS FIVE DIAMONDS SEVEN,0.6688,0.0594,0.2718
DIAMONDS ACE DIAMONDS SEVEN,0.3832,0.0048,0.612
HEARTS FOUR DIAMONDS SEVEN,0.6342,0.018,0.3478
HEARTS ACE DIAMONDS FIVE,0.2826,0.0296,0.6878
HEARTS SEVEN DIAMONDS SEVEN,0.3492,0.0344,0.6164
HEARTS SIX DIAMONDS SEVEN,0.5882,0.0164,0.3954
HEARTS NINE DIAMONDS SEVEN,0.6084,0.0148,0.3768
DIAMONDS SEVEN HEARTS EIGHT,0.5832,0.0152,0.4016
DIAMONDS JACK DIAMONDS SEVEN,0.273,0.2516,0.4754
HEARTS JACK DIAMONDS FIVE,0.0742,0.9036,0.0222
DIAMONDS TEN DIAMONDS SEVEN,0.5594,0.0166,0.424
DIAMONDS FIVE HEARTS TEN,0.7068,0.0626,0.2306
SPADES KING CLUBS TWO,0.4198,0.009,0.5712
HEARTS KING CLUBS KING,0.1904,0.0094,0.8002
CLUBS EIGHT DIAMONDS SEVEN,0.5842,0.0162,0.3996
SPADES QUEEN CLUBS TWO,0.4354,0.014,0.5506
HEARTS KING CLUBS QUEEN,0.3562,0.0056,0.6382
CLUBS NINE DIAMONDS SEVEN,0.5936,0.0164,0.39
SPADES TWO CLUBS JACK,0.3594,0.4348,0.2058
SPADES ACE CLUBS TWO,0.4132,0.0056,0.5812
SPADES TWO CLUBS TEN,0.6416,0.0186,0.3398
HEARTS KING CLUBS ACE,0.362,0.0044,0.6336
CLUBS SIX CLUBS SEVEN,0.5506,0.0156,0.4338
SPADES TWO CLUBS KING,0.4236,0.009,0.5674
SPADES TWO DIAMONDS SEVEN,0.6566,0.0216,0.3218
CLUBS EIGHT CLUBS SIX,0.5542,0.0188,0.427
SPADES THREE DIAMONDS SEVEN,0.6464,0.0206,0.333
SPADES TWO CLUBS QUEEN,0.4342,0.0108,0.555
CLUBS NINE CLUBS SIX,0.5628,0.0148,0.4224
SPADES FOUR DIAMONDS SEVEN,0.6276,0.0186,0.3538
HEARTS KING CLUBS JACK,0.2792,0.0296,0.6912
SPADES TWO CLUBS ACE,0.4318,0.0054,0.5628
HEARTS KING CLUBS TEN,0.386,0.0064,0.6076
CLUBS SIX SPADES TWO,0.6436,0.0178,0.3386
CLUBS SIX SPADES THREE,0.6312,0.0212,0.3476
CLUBS TWO DIAMONDS SEVEN,0.647,0.0178,0.3352
CLUBS SIX SPADES FOUR,0.6206,0.0162,0.3632
CLUBS THREE DIAMONDS SEVEN,0.6354,0.0176,0.347
CLUBS FOUR DIAMONDS SEVEN,0.6328,0.0178,0.3494
CLUBS SIX SPADES SIX,0.3334,0.0396,0.627
CLUBS FIVE DIAMONDS SEVEN,0.6856,0.0572,0.2572
CLUBS SIX SPADES SEVEN,0.582,0.0196,0.3984
CLUBS SIX DIAMONDS SEVEN,0.5928,0.0182,0.389
CLUBS SIX SPADES EIGHT,0.5834,0.0208,0.3958
CLUBS SIX SPADES NINE,0.6086,0.0194,0.372
SPADES TEN CLUBS TWO,0.6456,0.0188,0.3356
CLUBS SEVEN DIAMONDS SEVEN,0.3238,0.0398,0.6364
CLUBS TWO CLUBS QUEEN,0.4128,0.0116,0.5756
CLUBS TWO CLUBS KING,0.4102,0.0082,0.5816
CLUBS THREE DIAMONDS EIGHT,0.6612,0.0172,0.3216
CLUBS TWO CLUBS ACE,0.4068,0.0054,0.5878
CLUBS TWO DIAMONDS EIGHT,0.6526,0.0158,0.3316
DIAMONDS EIGHT HEARTS SEVEN,0.5694,0.0204,0.4102
HEARTS SIX DIAMONDS EIGHT,0.5968,0.016,0.3872
DIAMONDS EIGHT HEARTS NINE,0.5726,0.0188,0.4086
CLUBS TWO CLUBS TEN,0.6088,0.0176,0.3736
DIAMONDS EIGHT HEARTS EIGHT,0.3334,0.0308,0.6358
CLUBS TWO CLUBS JACK,0.3504,0.4012,0.2484
CLUBS NINE DIAMONDS EIGHT,0.5664,0.014,0.4196
CLUBS EIGHT DIAMONDS EIGHT,0.3416,0.0308,0.6276
CLUBS FIVE DIAMONDS EIGHT,0.695,0.056,0.249
SPADES ACE SPADES THREE,0.3786,0.0054,0.616
CLUBS FOUR DIAMONDS EIGHT,0.6474,0.0192,0.3334
SPADES QUEEN SPADES THREE,0.3698,0.0154,0.6148
CLUBS SEVEN DIAMONDS EIGHT,0.582,0.0138,0.4042
CLUBS SIX DIAMONDS EIGHT,0.5932,0.0188,0.388
SPADES KING SPADES THREE,0.3836,0.0106,0.6058
DIAMONDS QUEEN DIAMONDS EIGHT,0.3794,0.0086,0.612
HEARTS TWO DIAMONDS EIGHT,0.658,0.0176,0.3244
DIAMONDS KING DIAMONDS EIGHT,0.3986,0.0066,0.5948
HEARTS THREE DIAMONDS EIGHT,0.6574,0.0224,0.3202
DIAMONDS ACE DIAMONDS EIGHT,0.3772,0.0048,0.618
HEARTS FOUR DIAMONDS EIGHT,0.6358,0.019,0.3452
HEARTS FIVE DIAMONDS EIGHT,0.69,0.0584,0.2516
DIAMONDS EIGHT DIAMONDS TEN,0.5438,0.0178,0.4384
DIAMONDS EIGHT DIAMONDS JACK,0.2654,0.1986,0.536
SPADES TEN SPADES THREE,0.6358,0.0182,0.346
CLUBS FOUR HEARTS ACE,0.4182,0.0044,0.5774
CLUBS FOUR HEARTS QUEEN,0.4236,0.0126,0.5638
CLUBS FOUR HEARTS KING,0.427,0.0076,0.5654
CLUBS SIX HEARTS TEN,0.6034,0.0174,0.3792
CLUBS SIX HEARTS JACK,0.2794,0.3518,0.3688
SPADES FOUR DIAMONDS EIGHT,0.6332,0.017,0.3498
DIAMONDS EIGHT SPADES TWO,0.6546,0.0176,0.3278
SPADES THREE DIAMONDS EIGHT,0.6428,0.0186,0.3386
CLUBS FOUR HEARTS JACK,0.3546,0.4362,0.2092
SPADES EIGHT DIAMONDS EIGHT,0.3302,0.0318,0.638
SPADES TEN HEARTS TWO,0.6452,0.021,0.3338
SPADES TEN DIAMONDS QUEEN,0.3628,0.011,0.6262
CLUBS FOUR HEARTS TEN,0.6556,0.014,0.3304
SPADES NINE DIAMONDS EIGHT,0.568,0.017,0.415
SPADES TEN HEARTS EIGHT,0.5698,0.0178,0.4124
SPADES SIX DIAMONDS EIGHT,0.588,0.0142,0.3978
SPADES SEVEN DIAMONDS EIGHT,0.5628,0.021,0.4162
SPADES ACE HEARTS TWO,0.4124,0.0054,0.5822
SPADES ACE DIAMONDS QUEEN,0.3474,0.0034,0.6492
SPADES ACE HEARTS EIGHT,0.3832,0.0038,0.613
SPADES KING HEARTS EIGHT,0.3964,0.0054,0.5982
SPADES QUEEN HEARTS TWO,0.4306,0.011,0.5584
SPADES QUEEN DIAMONDS QUEEN,0.1674,0.0128,0.8198
SPADES KING DIAMONDS QUEEN,0.3488,0.0094,0.6418
SPADES KING HEARTS TWO,0.4402,0.0082,0.5516
SPADES QUEEN HEARTS EIGHT,0.3904,0.012,0.5976
CLUBS TWO HEARTS TEN,0.6448,0.017,0.3382
CLUBS TWO HEARTS JACK,0.3686,0.422,0.2094
SPADES SEVEN DIAMONDS NINE,0.5886,0.0208,0.3906
SPADES SIX DIAMONDS NINE,0.6092,0.0156,0.3752
SPADES NINE DIAMONDS NINE,0.3216,0.0276,0.6508
SPADES EIGHT DIAMONDS NINE,0.5622,0.0156,0.4222
SPADES TEN CLUBS KING,0.3868,0.009,0.6042
DIAMONDS NINE SPADES THREE,0.6354,0.0176,0.347
DIAMONDS NINE SPADES TWO,0.6458,0.0168,0.3374
SPADES FOUR DIAMONDS NINE,0.6474,0.0202,0.3324
CLUBS NINE DIAMONDS NINE,0.3192,0.0256,0.6552
CLUBS EIGHT DIAMONDS NINE,0.5692,0.0196,0.4112
CLUBS SIX DIAMONDS NINE,0.6028,0.0182,0.379
SPADES TEN CLUBS FOUR,0.6518,0.0146,0.3336
CLUBS SEVEN DIAMONDS NINE,0.5782,0.0128,0.409
CLUBS FOUR DIAMONDS NINE,0.6464,0.0176,0.336
