opposingHand,winningChance,drawChance,lostChance
SPADES TEN HEARTS NINE,0.816,0.0212,0.1628
SPADES TEN HEARTS TEN,0.7212,0.1032,0.1756
SPADES SIX HEARTS EIGHT,0.7818,0.0382,0.18
SPADES SEVEN HEARTS EIGHT,0.7874,0.0354,0.1772
CLUBS THREE HEARTS JACK,0.8732,0.04,0.0868
SPADES EIGHT HEARTS EIGHT,0.7086,0.1022,0.1892
CLUBS THREE HEARTS TEN,0.825,0.0176,0.1574
SPADES NINE HEARTS EIGHT,0.7982,0.0284,0.1734
SPADES KING HEARTS NINE,0.7124,0.0046,0.283
SPADES TWO HEARTS EIGHT,0.8314,0.0402,0.1284
SPADES QUEEN HEARTS NINE,0.6996,0.0114,0.289
SPADES THREE HEARTS EIGHT,0.8302,0.041,0.1288
SPADES FOUR HEARTS EIGHT,0.82,0.039,0.141
SPADES ACE HEARTS NINE,0.6794,0.0036,0.317
SPADES FIVE HEARTS EIGHT,0.7928,0.0372,0.17
CLUBS EIGHT HEARTS EIGHT,0.7066,0.0942,0.1992
CLUBS NINE HEARTS EIGHT,0.797,0.025,0.178
CLUBS THREE HEARTS KING,0.7114,0.0042,0.2844
CLUBS FOUR HEARTS EIGHT,0.7958,0.0372,0.167
CLUBS THREE HEARTS QUEEN,0.7074,0.0106,0.282
CLUBS FIVE HEARTS EIGHT,0.7936,0.037,0.1694
CLUBS SIX HEARTS EIGHT,0.7866,0.0328,0.1806
CLUBS THREE HEARTS ACE,0.6778,0.0018,0.3204
CLUBS SEVEN HEARTS EIGHT,0.7792,0.0344,0.1864
CLUBS THREE HEARTS EIGHT,0.8314,0.0394,0.1292
CLUBS TWO HEARTS EIGHT,0.8264,0.0356,0.138
SPADES TEN SPADES FOUR,0.8004,0.0224,0.1772
HEARTS EIGHT HEARTS NINE,0.7462,0.0318,0.222
SPADES QUEEN SPADES FOUR,0.6828,0.0104,0.3068
SPADES KING SPADES FOUR,0.668,0.007,0.325
SPADES ACE SPADES FOUR,0.6508,0.0076,0.3416
HEARTS KING HEARTS TEN,0.6536,0.0052,0.3412
HEARTS QUEEN HEARTS TEN,0.6506,0.0106,0.3388
HEARTS ACE HEARTS TEN,0.655,0.0024,0.3426
HEARTS SEVEN CLUBS JACK,0.8614,0.0324,0.1062
CLUBS TEN HEARTS SEVEN,0.808,0.0218,0.1702
HEARTS SEVEN CLUBS KING,0.703,0.0048,0.2922
HEARTS SEVEN CLUBS QUEEN,0.7072,0.011,0.2818
HEARTS SEVEN CLUBS ACE,0.6924,0.0032,0.3044
CLUBS SEVEN HEARTS ACE,0.6942,0.0038,0.302
CLUBS SEVEN HEARTS KING,0.6978,0.0048,0.2974
CLUBS SEVEN HEARTS QUEEN,0.6934,0.012,0.2946
CLUBS SEVEN HEARTS JACK,0.8582,0.0372,0.1046
CLUBS SEVEN HEARTS TEN,0.8218,0.0182,0.16
CLUBS TEN CLUBS THREE,0.791,0.0228,0.1862
CLUBS THREE CLUBS JACK,0.8146,0.039,0.1464
CLUBS THREE CLUBS ACE,0.6402,0.0036,0.3562
CLUBS THREE CLUBS QUEEN,0.6678,0.0104,0.3218
CLUBS THREE CLUBS KING,0.6626,0.006,0.3314
HEARTS TEN HEARTS JACK,0.7622,0.0312,0.2066
SPADES ACE CLUBS ACE,0.194,0.0032,0.8028
SPADES KING CLUBS ACE,0.5604,0.0038,0.4358
SPADES QUEEN CLUBS ACE,0.5574,0.0046,0.438
SPADES TEN CLUBS ACE,0.701,0.0036,0.2954
SPADES EIGHT HEARTS NINE,0.8056,0.033,0.1614
SPADES NINE HEARTS NINE,0.713,0.0994,0.1876
SPADES SIX HEARTS NINE,0.7962,0.0328,0.171
SPADES SEVEN HEARTS NINE,0.8012,0.0306,0.1682
CLUBS SEVEN HEARTS NINE,0.7952,0.0294,0.1754
CLUBS SIX HEARTS NINE,0.8014,0.0316,0.167
CLUBS FIVE HEARTS NINE,0.8084,0.032,0.1596
CLUBS FOUR HEARTS NINE,0.8268,0.0296,0.1436
CLUBS THREE HEARTS NINE,0.8336,0.028,0.1384
CLUBS TWO HEARTS NINE,0.8236,0.0322,0.1442
SPADES FIVE HEARTS NINE,0.8126,0.0312,0.1562
SPADES FOUR HEARTS NINE,0.8322,0.0294,0.1384
SPADES THREE HEARTS NINE,0.826,0.0346,0.1394
SPADES TWO HEARTS NINE,0.8456,0.0292,0.1252
CLUBS NINE HEARTS NINE,0.7126,0.0962,0.1912
CLUBS EIGHT HEARTS NINE,0.7914,0.0338,0.1748
