opposingHand,winningChance,drawChance,lostChance
SPADES ACE DIAMONDS KING,0.5528,0.0044,0.4428
HEARTS NINE CLUBS JACK,0.6872,0.0216,0.2912
SPADES KING DIAMONDS KING,0.1812,0.0412,0.7776
SPADES KING HEARTS THREE,0.696,0.0092,0.2948
HEARTS THREE SPADES QUEEN,0.707,0.0164,0.2766
SPADES QUEEN DIAMONDS KING,0.5624,0.0052,0.4324
CLUBS ACE HEARTS NINE,0.6904,0.0044,0.3052
HEARTS NINE CLUBS QUEEN,0.6994,0.013,0.2876
HEARTS NINE CLUBS KING,0.6994,0.008,0.2926
SPADES JACK HEARTS NINE,0.6962,0.0232,0.2806
SPADES SIX HEARTS EIGHT,0.7902,0.05,0.1598
SPADES SEVEN HEARTS EIGHT,0.7898,0.048,0.1622
CLUBS THREE HEARTS JACK,0.711,0.02,0.269
SPADES EIGHT HEARTS EIGHT,0.6922,0.1304,0.1774
SPADES NINE HEARTS EIGHT,0.8026,0.0438,0.1536
SPADES KING HEARTS NINE,0.6908,0.008,0.3012
SPADES TWO HEARTS EIGHT,0.8394,0.0482,0.1124
SPADES QUEEN HEARTS NINE,0.6962,0.0124,0.2914
SPADES THREE HEARTS EIGHT,0.8246,0.0526,0.1228
SPADES FOUR HEARTS EIGHT,0.811,0.0542,0.1348
SPADES ACE HEARTS NINE,0.6908,0.0036,0.3056
SPADES FIVE HEARTS EIGHT,0.7912,0.0452,0.1636
CLUBS EIGHT HEARTS EIGHT,0.6916,0.1254,0.183
CLUBS NINE HEARTS EIGHT,0.8014,0.0406,0.158
CLUBS THREE HEARTS KING,0.6944,0.0082,0.2974
CLUBS FOUR HEARTS EIGHT,0.8102,0.0498,0.14
CLUBS THREE HEARTS QUEEN,0.6986,0.0158,0.2856
CLUBS FIVE HEARTS EIGHT,0.7878,0.046,0.1662
CLUBS SIX HEARTS EIGHT,0.776,0.0506,0.1734
CLUBS THREE HEARTS ACE,0.6684,0.0032,0.3284
CLUBS SEVEN HEARTS EIGHT,0.7886,0.0472,0.1642
CLUBS THREE HEARTS EIGHT,0.8128,0.0526,0.1346
CLUBS TWO HEARTS EIGHT,0.822,0.0432,0.1348
SPADES JACK SPADES FOUR,0.6646,0.022,0.3134
HEARTS NINE HEARTS EIGHT,0.7574,0.0394,0.2032
SPADES QUEEN SPADES FOUR,0.6674,0.0128,0.3198
SPADES KING SPADES FOUR,0.6512,0.01,0.3388
SPADES ACE SPADES FOUR,0.6452,0.0052,0.3496
HEARTS SEVEN CLUBS JACK,0.7014,0.0196,0.279
CLUBS TEN HEARTS SEVEN,0.8308,0.0524,0.1168
CLUBS KING HEARTS SEVEN,0.708,0.0094,0.2826
CLUBS QUEEN HEARTS SEVEN,0.7112,0.0112,0.2776
CLUBS ACE HEARTS SEVEN,0.6892,0.0018,0.309
CLUBS SEVEN HEARTS ACE,0.67,0.0028,0.3272
CLUBS SEVEN HEARTS KING,0.6868,0.01,0.3032
CLUBS SEVEN HEARTS QUEEN,0.6944,0.0178,0.2878
CLUBS SEVEN HEARTS JACK,0.6852,0.022,0.2928
CLUBS TEN CLUBS THREE,0.8114,0.0548,0.1338
CLUBS THREE CLUBS JACK,0.661,0.024,0.315
CLUBS THREE CLUBS ACE,0.6344,0.0032,0.3624
CLUBS THREE CLUBS QUEEN,0.6622,0.0144,0.3234
CLUBS THREE CLUBS KING,0.657,0.0074,0.3356
SPADES ACE CLUBS ACE,0.2098,0.0032,0.787
SPADES KING CLUBS ACE,0.5552,0.0036,0.4412
SPADES QUEEN CLUBS ACE,0.5428,0.003,0.4542
SPADES JACK CLUBS ACE,0.548,0.0052,0.4468
SPADES EIGHT HEARTS NINE,0.81,0.0382,0.1518
SPADES NINE HEARTS NINE,0.7052,0.131,0.1638
SPADES SIX HEARTS NINE,0.7994,0.042,0.1586
SPADES SEVEN HEARTS NINE,0.799,0.042,0.159
CLUBS SEVEN HEARTS NINE,0.8006,0.0356,0.1638
CLUBS SIX HEARTS NINE,0.8092,0.038,0.1528
CLUBS FIVE HEARTS NINE,0.8078,0.0394,0.1528
CLUBS FOUR HEARTS NINE,0.8146,0.037,0.1484
CLUBS THREE HEARTS NINE,0.8144,0.0442,0.1414
CLUBS TWO HEARTS NINE,0.8288,0.034,0.1372
SPADES FIVE HEARTS NINE,0.7996,0.0446,0.1558
SPADES FOUR HEARTS NINE,0.8204,0.0396,0.14
SPADES THREE HEARTS NINE,0.8276,0.0426,0.1298
SPADES TWO HEARTS NINE,0.8384,0.0376,0.124
CLUBS NINE HEARTS NINE,0.6918,0.1296,0.1786
CLUBS EIGHT HEARTS NINE,0.7996,0.0414,0.159
