opposingHand,winningChance,drawChance,lostChance
CLUBS SEVEN HEARTS SEVEN,0.4556,0.0044,0.54
CLUBS FOUR HEARTS SEVEN,0.6514,0.0042,0.3444
CLUBS FIVE HEARTS SEVEN,0.641,0.0056,0.3534
CLUBS TWO HEARTS SEVEN,0.6794,0.0054,0.3152
SPADES KING SPADES TEN,0.554,0.0066,0.4394
CLUBS THREE HEARTS SEVEN,0.661,0.0032,0.3358
SPADES QUEEN SPADES TEN,0.5474,0.0052,0.4474
SPADES KING HEARTS SEVEN,0.6362,0.0054,0.3584
SPADES QUEEN HEARTS SEVEN,0.6342,0.0052,0.3606
SPADES TEN HEARTS SEVEN,0.6418,0.0048,0.3534
SPADES JACK HEARTS SEVEN,0.6346,0.004,0.3614
CLUBS ACE HEARTS TEN,0.225,0.1212,0.6538
SPADES KING HEARTS THREE,0.6456,0.0066,0.3478
SPADES KING DIAMONDS KING,0.2842,0.0032,0.7126
HEARTS TEN CLUBS QUEEN,0.5728,0.0028,0.4244
SPADES QUEEN DIAMONDS KING,0.59,0.0048,0.4052
SPADES QUEEN HEARTS THREE,0.6432,0.0042,0.3526
HEARTS TEN CLUBS KING,0.5732,0.0048,0.422
CLUBS TEN HEARTS TEN,0.304,0.004,0.692
HEARTS TEN CLUBS JACK,0.5686,0.0058,0.4256
SPADES QUEEN HEARTS TEN,0.5758,0.005,0.4192
SPADES KING HEARTS TEN,0.5804,0.0038,0.4158
SPADES TEN HEARTS TEN,0.311,0.0054,0.6836
SPADES JACK HEARTS TEN,0.5658,0.0062,0.428
SPADES SIX HEARTS EIGHT,0.6466,0.0034,0.35
SPADES SEVEN HEARTS EIGHT,0.6292,0.005,0.3658
CLUBS THREE HEARTS JACK,0.6412,0.0046,0.3542
SPADES EIGHT HEARTS EIGHT,0.4412,0.0042,0.5546
CLUBS THREE HEARTS TEN,0.638,0.0036,0.3584
SPADES NINE HEARTS EIGHT,0.6992,0.0256,0.2752
SPADES TWO HEARTS EIGHT,0.6794,0.0068,0.3138
SPADES THREE HEARTS EIGHT,0.6906,0.0046,0.3048
SPADES FOUR HEARTS EIGHT,0.675,0.006,0.319
SPADES FIVE HEARTS EIGHT,0.6582,0.0046,0.3372
CLUBS EIGHT HEARTS EIGHT,0.4542,0.0038,0.542
CLUBS NINE HEARTS EIGHT,0.7054,0.0204,0.2742
CLUBS THREE HEARTS KING,0.6244,0.005,0.3706
CLUBS FOUR HEARTS EIGHT,0.6618,0.0048,0.3334
CLUBS THREE HEARTS QUEEN,0.626,0.0044,0.3696
CLUBS FIVE HEARTS EIGHT,0.6454,0.003,0.3516
CLUBS SIX HEARTS EIGHT,0.638,0.004,0.358
CLUBS THREE HEARTS ACE,0.5698,0.1788,0.2514
CLUBS SEVEN HEARTS EIGHT,0.6218,0.0028,0.3754
CLUBS THREE HEARTS EIGHT,0.6822,0.0028,0.315
CLUBS TWO HEARTS EIGHT,0.6782,0.0036,0.3182
SPADES TEN SPADES FOUR,0.608,0.005,0.387
SPADES JACK SPADES FOUR,0.6234,0.0052,0.3714
SPADES QUEEN SPADES FOUR,0.6102,0.0056,0.3842
SPADES KING SPADES FOUR,0.6022,0.0054,0.3924
HEARTS KING HEARTS TEN,0.559,0.0044,0.4366
HEARTS QUEEN HEARTS TEN,0.5362,0.0032,0.4606
HEARTS ACE HEARTS TEN,0.2136,0.1114,0.675
HEARTS SEVEN CLUBS JACK,0.6162,0.0054,0.3784
CLUBS TEN HEARTS SEVEN,0.6256,0.0034,0.371
CLUBS KING HEARTS SEVEN,0.6372,0.0052,0.3576
CLUBS QUEEN HEARTS SEVEN,0.643,0.0044,0.3526
CLUBS ACE HEARTS SEVEN,0.5986,0.1718,0.2296
CLUBS SEVEN HEARTS ACE,0.5834,0.176,0.2406
CLUBS SEVEN HEARTS KING,0.6316,0.0036,0.3648
CLUBS SEVEN HEARTS QUEEN,0.6274,0.0034,0.3692
CLUBS SEVEN HEARTS JACK,0.6218,0.0036,0.3746
CLUBS SEVEN HEARTS TEN,0.6076,0.0054,0.387
CLUBS TEN CLUBS THREE,0.5926,0.0042,0.4032
CLUBS THREE CLUBS JACK,0.608,0.0044,0.3876
CLUBS THREE CLUBS ACE,0.5508,0.165,0.2842
CLUBS THREE CLUBS QUEEN,0.5898,0.0048,0.4054
CLUBS THREE CLUBS KING,0.5788,0.0036,0.4176
HEARTS TEN HEARTS JACK,0.5348,0.0036,0.4616
SPADES KING CLUBS ACE,0.2372,0.0432,0.7196
SPADES QUEEN CLUBS ACE,0.2524,0.0632,0.6844
SPADES JACK CLUBS ACE,0.2446,0.0836,0.6718
SPADES TEN CLUBS ACE,0.2358,0.118,0.6462
