opposingHand,winningChance,drawChance,lostChance
SPADES JACK DIAMONDS JACK
HEARTS FIVE SPADES TEN,0.842,0.0206,0.1374
SPADES FIVE CLUBS JACK,0.8838,0.0318,0.0844
CLUBS TEN SPADES FIVE,0.8368,0.0236,0.1396
CLUBS EIGHT CLUBS JACK,0.809,0.0282,0.1628
CLUBS TEN CLUBS EIGHT,0.7676,0.0234,0.209
CLUBS EIGHT CLUBS KING,0.6694,0.008,0.3226
SPADES FIVE CLUBS ACE,0.6806,0.0028,0.3166
CLUBS EIGHT CLUBS QUEEN,0.6774,0.0118,0.3108
SPADES FIVE CLUBS KING,0.7092,0.0052,0.2856
SPADES FIVE CLUBS QUEEN,0.705,0.009,0.286
CLUBS EIGHT CLUBS ACE,0.6502,0.004,0.3458
DIAMONDS TWO DIAMONDS THREE,0.769,0.051,0.18
DIAMONDS TWO DIAMONDS FIVE,0.759,0.0518,0.1892
HEARTS FIVE SPADES KING,0.6916,0.0088,0.2996
DIAMONDS TWO DIAMONDS FOUR,0.7752,0.0498,0.175
HEARTS FIVE SPADES QUEEN,0.6902,0.0094,0.3004
DIAMONDS TWO DIAMONDS SEVEN,0.805,0.0434,0.1516
DIAMONDS TWO DIAMONDS SIX,0.7934,0.044,0.1626
SPADES ACE HEARTS FIVE,0.6762,0.0024,0.3214
DIAMONDS TWO DIAMONDS NINE,0.8096,0.0308,0.1596
DIAMONDS TWO DIAMONDS EIGHT,0.8046,0.0382,0.1572
DIAMONDS THREE DIAMONDS FOUR,0.7538,0.0516,0.1946
SPADES FOUR CLUBS TWO,0.7976,0.05,0.1524
DIAMONDS THREE DIAMONDS FIVE,0.7388,0.05,0.2112
SPADES FIVE CLUBS TWO,0.7938,0.053,0.1532
CLUBS TWO SPADES TWO,0.7242,0.1014,0.1744
CLUBS TWO SPADES THREE,0.8126,0.0566,0.1308
DIAMONDS THREE DIAMONDS EIGHT,0.7988,0.0414,0.1598
SPADES EIGHT CLUBS TWO,0.827,0.0404,0.1326
DIAMONDS THREE DIAMONDS NINE,0.7954,0.0308,0.1738
SPADES NINE CLUBS TWO,0.8478,0.026,0.1262
DIAMONDS THREE DIAMONDS SIX,0.7756,0.0466,0.1778
SPADES SIX CLUBS TWO,0.8242,0.0458,0.13
DIAMONDS THREE DIAMONDS SEVEN,0.7754,0.0394,0.1852
SPADES SEVEN CLUBS TWO,0.8322,0.0442,0.1236
CLUBS SIX CLUBS TWO,0.7716,0.0516,0.1768
CLUBS SEVEN CLUBS TWO,0.7794,0.0488,0.1718
CLUBS FOUR CLUBS TWO,0.765,0.0468,0.1882
CLUBS FIVE CLUBS TWO,0.7554,0.048,0.1966
CLUBS TEN CLUBS JACK,0.7692,0.0268,0.204
DIAMONDS FOUR DIAMONDS SIX,0.7534,0.05,0.1966
CLUBS TEN CLUBS QUEEN,0.6654,0.0106,0.324
DIAMONDS FOUR DIAMONDS SEVEN,0.764,0.0416,0.1944
CLUBS TEN CLUBS KING,0.6408,0.0036,0.3556
CLUBS TEN CLUBS ACE,0.6534,0.0042,0.3424
CLUBS EIGHT CLUBS TWO,0.784,0.037,0.179
DIAMONDS FIVE DIAMONDS FOUR,0.73,0.0456,0.2244
CLUBS NINE CLUBS TWO,0.7838,0.0328,0.1834
DIAMONDS NINE DIAMONDS FOUR,0.7932,0.0318,0.175
DIAMONDS EIGHT DIAMONDS FOUR,0.7884,0.0372,0.1744
CLUBS THREE CLUBS TWO,0.7656,0.0508,0.1836
DIAMONDS NINE DIAMONDS FIVE,0.7784,0.025,0.1966
DIAMONDS TWO CLUBS JACK,0.8856,0.0384,0.076
DIAMONDS EIGHT DIAMONDS FIVE,0.766,0.0356,0.1984
CLUBS TEN DIAMONDS TWO,0.8374,0.0272,0.1354
DIAMONDS FIVE DIAMONDS SEVEN,0.747,0.0408,0.2122
DIAMONDS FIVE DIAMONDS SIX,0.7292,0.0498,0.221
DIAMONDS TWO CLUBS ACE,0.679,0.004,0.317
DIAMONDS TWO CLUBS KING,0.7156,0.0064,0.278
DIAMONDS TWO CLUBS QUEEN,0.7302,0.008,0.2618
DIAMONDS EIGHT DIAMONDS SIX,0.756,0.0352,0.2088
DIAMONDS NINE DIAMONDS SIX,0.7672,0.0318,0.201
HEARTS ACE SPADES THREE,0.691,0.0034,0.3056
SPADES THREE HEARTS KING,0.7132,0.0064,0.2804
DIAMONDS SEVEN DIAMONDS SIX,0.7458,0.0412,0.213
SPADES THREE HEARTS QUEEN,0.7116,0.014,0.2744
SPADES THREE HEARTS JACK,0.879,0.0426,0.0784
SPADES THREE HEARTS TEN,0.8396,0.0232,0.1372
DIAMONDS EIGHT DIAMONDS SEVEN,0.751,0.042,0.207
DIAMONDS NINE DIAMONDS SEVEN,0.769,0.0324,0.1986
DIAMONDS NINE DIAMONDS EIGHT,0.77,0.0292,0.2008
DIAMONDS KING HEARTS TEN,0.6916,0.0052,0.3032
HEARTS THREE HEARTS TEN,0.801,0.0234,0.1756
DIAMONDS KING HEARTS JACK,0.6638,0.02,0.3162
HEARTS THREE HEARTS JACK,0.84,0.0332,0.1268
SPADES TEN CLUBS SIX,0.8284,0.019,0.1526
SPADES TEN SPADES FIVE,0.793,0.0214,0.1856
DIAMONDS KING HEARTS ACE,0.5562,0.004,0.4398
HEARTS THREE HEARTS ACE,0.6422,0.004,0.3538
SPADES ACE CLUBS SIX,0.6904,0.0026,0.307
DIAMONDS KING HEARTS QUEEN,0.5684,0.0026,0.429
HEARTS THREE HEARTS QUEEN,0.668,0.0114,0.3206
SPADES KING CLUBS SIX,0.6984,0.0054,0.2962
DIAMONDS KING HEARTS KING,0.1838,0.0394,0.7768
HEARTS THREE HEARTS KING,0.6684,0.0064,0.3252
SPADES QUEEN CLUBS SIX,0.7152,0.008,0.2768
SPADES NINE HEARTS TEN,0.827,0.0226,0.1504
SPADES NINE HEARTS JACK,0.8428,0.0328,0.1244
SPADES QUEEN SPADES FIVE,0.6728,0.0124,0.3148
SPADES KING SPADES FIVE,0.6596,0.0054,0.335
SPADES ACE SPADES FIVE,0.6288,0.004,0.3672
SPADES NINE HEARTS QUEEN,0.7134,0.0086,0.278
SPADES NINE HEARTS KING,0.7072,0.0054,0.2874
SPADES NINE HEARTS ACE,0.6966,0.0034,0.3
CLUBS TEN SPADES TEN,0.7138,0.1064,0.1798
SPADES ACE CLUBS TEN,0.6844,0.0026,0.313
SPADES KING CLUBS TEN,0.6934,0.0074,0.2992
CLUBS TEN SPADES QUEEN,0.686,0.009,0.305
SPADES FIVE HEARTS QUEEN,0.7074,0.0088,0.2838
SPADES FIVE HEARTS KING,0.7004,0.0072,0.2924
SPADES FIVE HEARTS ACE,0.6794,0.0034,0.3172
SPADES TEN CLUBS EIGHT,0.8144,0.0236,0.162
SPADES TEN HEARTS THREE,0.8372,0.0196,0.1432
SPADES TEN DIAMONDS KING,0.6892,0.0064,0.3044
CLUBS SIX HEARTS ACE,0.6954,0.0024,0.3022
SPADES ACE CLUBS EIGHT,0.6884,0.0034,0.3082
HEARTS FIVE CLUBS JACK,0.8618,0.0354,0.1028
HEARTS FIVE CLUBS TEN,0.8264,0.0202,0.1534
CLUBS SIX HEARTS QUEEN,0.6992,0.0094,0.2914
SPADES QUEEN CLUBS EIGHT,0.6886,0.0092,0.3022
CLUBS TEN SPADES THREE,0.8282,0.0224,0.1494
CLUBS SIX HEARTS KING,0.6916,0.0056,0.3028
SPADES KING CLUBS EIGHT,0.698,0.0064,0.2956
SPADES THREE CLUBS JACK,0.8938,0.0362,0.07
DIAMONDS TWO HEARTS JACK,0.89,0.0362,0.0738
SPADES THREE CLUBS QUEEN,0.7188,0.0092,0.272
DIAMONDS TWO HEARTS TEN,0.8396,0.0222,0.1382
SPADES THREE CLUBS KING,0.7074,0.0058,0.2868
HEARTS FIVE CLUBS ACE,0.6674,0.0046,0.328
SPADES FIVE HEARTS TEN,0.8322,0.022,0.1458
SPADES THREE CLUBS ACE,0.687,0.0042,0.3088
HEARTS FIVE CLUBS KING,0.6934,0.0052,0.3014
SPADES FIVE HEARTS JACK,0.8768,0.0404,0.0828
HEARTS FIVE CLUBS QUEEN,0.7094,0.0084,0.2822
HEARTS THREE CLUBS KING,0.7106,0.0066,0.2828
DIAMONDS KING CLUBS KING,0.1768,0.0376,0.7856
HEARTS THREE CLUBS QUEEN,0.714,0.011,0.275
DIAMONDS KING CLUBS QUEEN,0.5646,0.0036,0.4318
HEARTS FIVE HEARTS JACK,0.8204,0.0358,0.1438
HEARTS FIVE HEARTS TEN,0.7916,0.0236,0.1848
HEARTS THREE CLUBS ACE,0.6926,0.0034,0.304
DIAMONDS KING CLUBS ACE,0.5568,0.0034,0.4398
SPADES ACE CLUBS QUEEN,0.5654,0.0032,0.4314
SPADES KING CLUBS QUEEN,0.5602,0.0026,0.4372
HEARTS THREE CLUBS JACK,0.8746,0.0372,0.0882
DIAMONDS KING CLUBS JACK,0.6716,0.017,0.3114
SPADES QUEEN CLUBS QUEEN,0.1944,0.0714,0.7342
CLUBS TEN HEARTS THREE,0.8306,0.023,0.1464
CLUBS TEN DIAMONDS KING,0.6962,0.0058,0.298
CLUBS SIX CLUBS QUEEN,0.6708,0.0106,0.3186
SPADES TEN CLUBS QUEEN,0.6982,0.0074,0.2944
CLUBS SIX CLUBS KING,0.6626,0.0066,0.3308
CLUBS SIX CLUBS ACE,0.6508,0.0036,0.3456
HEARTS FIVE HEARTS KING,0.6758,0.0046,0.3196
HEARTS FIVE HEARTS QUEEN,0.6688,0.009,0.3222
CLUBS TEN CLUBS SIX,0.7774,0.0234,0.1992
HEARTS FIVE HEARTS ACE,0.6426,0.0032,0.3542
CLUBS SIX CLUBS JACK,0.8338,0.0338,0.1324
SPADES SEVEN HEARTS JACK,0.865,0.0366,0.0984
SPADES SEVEN HEARTS TEN,0.8224,0.0214,0.1562
DIAMONDS TWO CLUBS TWO,0.726,0.0962,0.1778
DIAMONDS TWO CLUBS THREE,0.7926,0.0572,0.1502
DIAMONDS TWO HEARTS SIX,0.8206,0.0476,0.1318
DIAMONDS TWO HEARTS QUEEN,0.712,0.0122,0.2758
HEARTS SEVEN DIAMONDS TWO,0.8382,0.0408,0.121
DIAMONDS TWO HEARTS KING,0.7172,0.0076,0.2752
DIAMONDS TWO HEARTS EIGHT,0.8344,0.0352,0.1304
DIAMONDS TWO HEARTS ACE,0.6882,0.0044,0.3074
DIAMONDS TWO HEARTS NINE,0.8362,0.0364,0.1274
DIAMONDS TWO DIAMONDS QUEEN,0.6828,0.0152,0.302
DIAMONDS TWO HEARTS TWO,0.7232,0.092,0.1848
DIAMONDS TWO DIAMONDS KING,0.6684,0.0052,0.3264
DIAMONDS TWO HEARTS THREE,0.8112,0.0522,0.1366
DIAMONDS TWO DIAMONDS ACE,0.6548,0.005,0.3402
HEARTS FOUR DIAMONDS TWO,0.8062,0.0552,0.1386
HEARTS FIVE DIAMONDS TWO,0.799,0.0476,0.1534
SPADES SEVEN HEARTS ACE,0.7016,0.0044,0.294
DIAMONDS TWO DIAMONDS TEN,0.8168,0.023,0.1602
SPADES SEVEN HEARTS KING,0.7046,0.0066,0.2888
SPADES SEVEN HEARTS QUEEN,0.719,0.0106,0.2704
DIAMONDS TWO SPADES NINE,0.8418,0.032,0.1262
DIAMONDS TWO SPADES EIGHT,0.843,0.0404,0.1166
DIAMONDS TWO SPADES SEVEN,0.8422,0.0492,0.1086
DIAMONDS TWO SPADES SIX,0.8302,0.0472,0.1226
DIAMONDS TWO SPADES FIVE,0.8098,0.0492,0.141
DIAMONDS TWO SPADES FOUR,0.8024,0.0522,0.1454
DIAMONDS TWO SPADES THREE,0.8176,0.0546,0.1278
DIAMONDS TWO SPADES TWO,0.7356,0.0908,0.1736
CLUBS NINE DIAMONDS TWO,0.8398,0.0334,0.1268
DIAMONDS TWO CLUBS EIGHT,0.8426,0.0384,0.119
CLUBS SEVEN DIAMONDS TWO,0.833,0.0462,0.1208
DIAMONDS TWO CLUBS SIX,0.8138,0.0506,0.1356
DIAMONDS TWO CLUBS FIVE,0.7966,0.0506,0.1528
DIAMONDS TWO CLUBS FOUR,0.8108,0.0466,0.1426
CLUBS FOUR SPADES FIVE,0.7604,0.0504,0.1892
CLUBS FOUR SPADES FOUR,0.7144,0.0926,0.193
CLUBS FOUR SPADES THREE,0.79,0.0506,0.1594
CLUBS FOUR SPADES TWO,0.7976,0.0558,0.1466
SPADES NINE CLUBS FOUR,0.8332,0.0306,0.1362
SPADES EIGHT CLUBS FOUR,0.8134,0.0362,0.1504
SPADES SEVEN CLUBS FOUR,0.802,0.0402,0.1578
SPADES SIX CLUBS FOUR,0.7846,0.0466,0.1688
SPADES ACE DIAMONDS SIX,0.6978,0.005,0.2972
SPADES QUEEN DIAMONDS SIX,0.7126,0.0094,0.278
SPADES KING DIAMONDS SIX,0.6986,0.0058,0.2956
SPADES TEN DIAMONDS SIX,0.8144,0.0284,0.1572
SPADES QUEEN SPADES TWO,0.6824,0.0114,0.3062
SPADES KING SPADES TWO,0.6762,0.0088,0.315
SPADES ACE SPADES TWO,0.6604,0.0062,0.3334
DIAMONDS THREE DIAMONDS TEN,0.8126,0.0216,0.1658
DIAMONDS THREE DIAMONDS KING,0.67,0.0056,0.3244
DIAMONDS THREE HEARTS THREE,0.727,0.0844,0.1886
DIAMONDS THREE DIAMONDS QUEEN,0.6782,0.0118,0.31
DIAMONDS THREE HEARTS TWO,0.8152,0.0502,0.1346
HEARTS FIVE DIAMONDS THREE,0.7718,0.0578,0.1704
DIAMONDS THREE DIAMONDS ACE,0.6452,0.0036,0.3512
HEARTS FOUR DIAMONDS THREE,0.7872,0.0516,0.1612
HEARTS SEVEN DIAMONDS THREE,0.8138,0.047,0.1392
SPADES TEN SPADES NINE,0.7818,0.0256,0.1926
HEARTS SIX DIAMONDS THREE,0.8028,0.0442,0.153
DIAMONDS THREE HEARTS NINE,0.8334,0.0286,0.138
HEARTS JACK DIAMONDS FOUR,0.881,0.0362,0.0828
HEARTS ACE HEARTS KING,0.532,0.0036,0.4644
SPADES TEN SPADES TWO,0.8032,0.025,0.1718
DIAMONDS THREE HEARTS EIGHT,0.8252,0.042,0.1328
HEARTS TEN DIAMONDS FOUR,0.827,0.025,0.148
HEARTS QUEEN DIAMONDS FOUR,0.7204,0.0072,0.2724
HEARTS KING DIAMONDS FOUR,0.714,0.0058,0.2802
SPADES ACE SPADES NINE,0.666,0.004,0.33
HEARTS ACE DIAMONDS FOUR,0.6754,0.0042,0.3204
SPADES KING SPADES NINE,0.6594,0.0084,0.3322
SPADES QUEEN SPADES NINE,0.6664,0.0116,0.322
DIAMONDS THREE SPADES NINE,0.8444,0.0304,0.1252
DIAMONDS THREE SPADES EIGHT,0.8386,0.0392,0.1222
DIAMONDS THREE SPADES SEVEN,0.8334,0.0428,0.1238
DIAMONDS THREE SPADES SIX,0.8026,0.0508,0.1466
DIAMONDS THREE CLUBS SIX,0.7986,0.0434,0.158
CLUBS FIVE CLUBS SIX,0.73,0.0466,0.2234
CLUBS ACE DIAMONDS FOUR,0.677,0.0036,0.3194
CLUBS SEVEN DIAMONDS THREE,0.8122,0.04,0.1478
CLUBS SEVEN CLUBS FIVE,0.7422,0.0396,0.2182
DIAMONDS THREE CLUBS FOUR,0.7804,0.0598,0.1598
DIAMONDS FOUR CLUBS QUEEN,0.7108,0.009,0.2802
DIAMONDS THREE CLUBS FIVE,0.782,0.0498,0.1682
CLUBS KING DIAMONDS FOUR,0.7006,0.0048,0.2946
DIAMONDS THREE CLUBS TWO,0.8038,0.0532,0.143
CLUBS TEN DIAMONDS FOUR,0.8306,0.0216,0.1478
DIAMONDS THREE CLUBS THREE,0.7208,0.0892,0.19
DIAMONDS FOUR CLUBS JACK,0.884,0.033,0.083
DIAMONDS THREE SPADES FOUR,0.7864,0.049,0.1646
DIAMONDS THREE SPADES FIVE,0.7912,0.051,0.1578
DIAMONDS THREE SPADES TWO,0.8174,0.0504,0.1322
DIAMONDS THREE SPADES THREE,0.7182,0.098,0.1838
CLUBS EIGHT DIAMONDS THREE,0.8306,0.0322,0.1372
CLUBS NINE DIAMONDS THREE,0.8202,0.0346,0.1452
SPADES SEVEN CLUBS ACE,0.6996,0.0028,0.2976
SPADES SEVEN CLUBS QUEEN,0.7046,0.0102,0.2852
SPADES SEVEN CLUBS KING,0.7034,0.0076,0.289
CLUBS FIVE SPADES SEVEN,0.776,0.0376,0.1864
CLUBS TEN SPADES SEVEN,0.8108,0.0238,0.1654
CLUBS FIVE SPADES SIX,0.7674,0.0436,0.189
SPADES SEVEN CLUBS JACK,0.8644,0.0382,0.0974
SPADES NINE CLUBS FIVE,0.809,0.0316,0.1594
CLUBS FIVE SPADES EIGHT,0.7964,0.0348,0.1688
CLUBS FIVE SPADES THREE,0.7786,0.0536,0.1678
CLUBS FIVE SPADES TWO,0.8058,0.045,0.1492
CLUBS FIVE SPADES FIVE,0.709,0.099,0.192
CLUBS FIVE SPADES FOUR,0.7632,0.0598,0.177
CLUBS NINE CLUBS FIVE,0.779,0.0268,0.1942
CLUBS EIGHT CLUBS FIVE,0.7512,0.037,0.2118
CLUBS ACE CLUBS QUEEN,0.5242,0.004,0.4718
CLUBS KING CLUBS QUEEN,0.5284,0.0038,0.4678
DIAMONDS TEN DIAMONDS FOUR,0.7966,0.0208,0.1826
CLUBS TEN DIAMONDS NINE,0.8162,0.0204,0.1634
DIAMONDS NINE CLUBS JACK,0.8374,0.0344,0.1282
SPADES NINE CLUBS JACK,0.84,0.0348,0.1252
CLUBS TEN SPADES NINE,0.8122,0.0194,0.1684
DIAMONDS ACE DIAMONDS FOUR,0.6498,0.0058,0.3444
HEARTS FOUR DIAMONDS FOUR,0.7114,0.1044,0.1842
SPADES NINE CLUBS KING,0.6914,0.0064,0.3022
DIAMONDS TWO SPADES TEN,0.8542,0.024,0.1218
DIAMONDS NINE CLUBS ACE,0.6878,0.0034,0.3088
HEARTS FIVE DIAMONDS FOUR,0.7672,0.0506,0.1822
SPADES NINE CLUBS QUEEN,0.7036,0.0082,0.2882
DIAMONDS QUEEN DIAMONDS FOUR,0.6782,0.0108,0.311
HEARTS TWO DIAMONDS FOUR,0.7974,0.0558,0.1468
DIAMONDS NINE CLUBS QUEEN,0.696,0.0098,0.2942
DIAMONDS KING DIAMONDS FOUR,0.6802,0.0076,0.3122
HEARTS THREE DIAMONDS FOUR,0.789,0.0478,0.1632
SPADES NINE CLUBS ACE,0.6906,0.0026,0.3068
DIAMONDS NINE CLUBS KING,0.7072,0.0064,0.2864
SPADES ACE DIAMONDS TWO,0.682,0.0036,0.3144
SPADES QUEEN DIAMONDS TWO,0.7144,0.0104,0.2752
SPADES KING DIAMONDS TWO,0.7132,0.007,0.2798
SPADES TEN SPADES SEVEN,0.7854,0.0208,0.1938
CLUBS SEVEN CLUBS THREE,0.7712,0.0432,0.1856
CLUBS SIX CLUBS THREE,0.746,0.0468,0.2072
CLUBS FIVE CLUBS THREE,0.7388,0.046,0.2152
CLUBS THREE CLUBS FOUR,0.7484,0.0462,0.2054
CLUBS NINE CLUBS THREE,0.7956,0.0268,0.1776
CLUBS EIGHT CLUBS THREE,0.7846,0.032,0.1834
CLUBS THREE SPADES FIVE,0.7786,0.051,0.1704
CLUBS THREE SPADES FOUR,0.79,0.048,0.162
CLUBS THREE SPADES THREE,0.7266,0.0844,0.189
CLUBS THREE SPADES TWO,0.8142,0.0536,0.1322
CLUBS THREE SPADES SIX,0.8038,0.0492,0.147
SPADES SEVEN CLUBS THREE,0.823,0.0438,0.1332
SPADES EIGHT CLUBS THREE,0.8362,0.0336,0.1302
SPADES NINE CLUBS THREE,0.825,0.0324,0.1426
SPADES TWO DIAMONDS FOUR,0.8094,0.0524,0.1382
SPADES THREE DIAMONDS FOUR,0.786,0.0614,0.1526
SPADES FOUR DIAMONDS FOUR,0.7312,0.0924,0.1764
SPADES FIVE DIAMONDS FOUR,0.7774,0.0486,0.174
SPADES SIX DIAMONDS FOUR,0.7996,0.0496,0.1508
SPADES SEVEN DIAMONDS FOUR,0.812,0.0412,0.1468
SPADES EIGHT DIAMONDS FOUR,0.8118,0.0416,0.1466
SPADES NINE DIAMONDS FOUR,0.8354,0.0362,0.1284
CLUBS FIVE DIAMONDS FOUR,0.7656,0.049,0.1854
CLUBS FOUR DIAMONDS FOUR,0.7212,0.0888,0.19
CLUBS SEVEN DIAMONDS FOUR,0.7986,0.0426,0.1588
CLUBS SIX DIAMONDS FOUR,0.7858,0.043,0.1712
CLUBS NINE DIAMONDS FOUR,0.8314,0.0314,0.1372
CLUBS EIGHT DIAMONDS FOUR,0.8172,0.0338,0.149
HEARTS SEVEN DIAMONDS FOUR,0.8036,0.0472,0.1492
HEARTS SIX DIAMONDS FOUR,0.781,0.0486,0.1704
DIAMONDS FOUR HEARTS NINE,0.8418,0.0322,0.126
DIAMONDS FOUR HEARTS EIGHT,0.8254,0.0306,0.144
CLUBS THREE DIAMONDS FOUR,0.7826,0.051,0.1664
CLUBS TWO DIAMONDS FOUR,0.7988,0.0562,0.145
DIAMONDS TEN DIAMONDS FIVE,0.7958,0.0224,0.1818
DIAMONDS NINE HEARTS QUEEN,0.7066,0.0126,0.2808
DIAMONDS NINE HEARTS KING,0.706,0.006,0.288
HEARTS ACE DIAMONDS NINE,0.7034,0.0028,0.2938
DIAMONDS NINE HEARTS TEN,0.8232,0.0256,0.1512
DIAMONDS NINE HEARTS JACK,0.8442,0.0316,0.1242
CLUBS KING DIAMONDS SIX,0.7112,0.0042,0.2846
CLUBS QUEEN DIAMONDS SIX,0.7094,0.0106,0.28
CLUBS ACE DIAMONDS SIX,0.6998,0.003,0.2972
SPADES KING DIAMONDS FOUR,0.719,0.005,0.276
SPADES ACE SPADES SEVEN,0.657,0.0044,0.3386
SPADES QUEEN DIAMONDS FOUR,0.7204,0.0112,0.2684
SPADES QUEEN SPADES SEVEN,0.6832,0.0102,0.3066
CLUBS JACK DIAMONDS SIX,0.8788,0.0356,0.0856
SPADES KING SPADES SEVEN,0.675,0.0074,0.3176
SPADES ACE DIAMONDS FOUR,0.6824,0.0044,0.3132
CLUBS TEN DIAMONDS SIX,0.821,0.0204,0.1586
CLUBS NINE CLUBS FOUR,0.7916,0.03,0.1784
CLUBS EIGHT CLUBS FOUR,0.7748,0.033,0.1922
SPADES TEN DIAMONDS FOUR,0.8486,0.0188,0.1326
CLUBS FIVE CLUBS FOUR,0.7344,0.052,0.2136
CLUBS SEVEN CLUBS FOUR,0.752,0.0416,0.2064
CLUBS SIX CLUBS FOUR,0.748,0.0446,0.2074
CLUBS SEVEN SPADES EIGHT,0.782,0.0366,0.1814
CLUBS SEVEN SPADES NINE,0.7948,0.0272,0.178
CLUBS SEVEN SPADES SIX,0.781,0.038,0.181
CLUBS SEVEN SPADES SEVEN,0.7178,0.0906,0.1916
CLUBS SEVEN SPADES FIVE,0.7804,0.0434,0.1762
CLUBS SEVEN SPADES FOUR,0.8062,0.0404,0.1534
CLUBS SEVEN SPADES THREE,0.8154,0.044,0.1406
CLUBS SEVEN SPADES TWO,0.8338,0.0424,0.1238
CLUBS NINE CLUBS SEVEN,0.7582,0.0268,0.215
CLUBS SEVEN CLUBS EIGHT,0.7258,0.0318,0.2424
HEARTS SIX DIAMONDS FIVE,0.7782,0.0424,0.1794
HEARTS SEVEN DIAMONDS FIVE,0.7826,0.0406,0.1768
DIAMONDS FIVE HEARTS EIGHT,0.7874,0.0438,0.1688
DIAMONDS FIVE HEARTS NINE,0.8214,0.0304,0.1482
DIAMONDS QUEEN DIAMONDS FIVE,0.6818,0.0096,0.3086
HEARTS TWO DIAMONDS FIVE,0.808,0.0484,0.1436
HEARTS KING HEARTS EIGHT,0.6658,0.0058,0.3284
DIAMONDS KING DIAMONDS FIVE,0.6716,0.006,0.3224
HEARTS THREE DIAMONDS FIVE,0.7728,0.051,0.1762
HEARTS QUEEN HEARTS EIGHT,0.663,0.0128,0.3242
DIAMONDS ACE DIAMONDS FIVE,0.6562,0.004,0.3398
HEARTS FOUR DIAMONDS FIVE,0.7684,0.0472,0.1844
HEARTS FIVE DIAMONDS FIVE,0.7168,0.088,0.1952
HEARTS ACE HEARTS EIGHT,0.6518,0.003,0.3452
CLUBS FOUR DIAMONDS FIVE,0.7648,0.0506,0.1846
CLUBS FIVE DIAMONDS FIVE,0.7046,0.1016,0.1938
CLUBS SIX DIAMONDS FIVE,0.7672,0.0476,0.1852
CLUBS SEVEN DIAMONDS FIVE,0.787,0.0406,0.1724
CLUBS TWO DIAMONDS FIVE,0.8032,0.0528,0.144
CLUBS THREE DIAMONDS FIVE,0.7776,0.0528,0.1696
SPADES THREE DIAMONDS FIVE,0.785,0.052,0.163
SPADES TWO DIAMONDS FIVE,0.8098,0.0522,0.138
SPADES FIVE DIAMONDS FIVE,0.7154,0.0966,0.188
CLUBS TEN HEARTS JACK,0.8078,0.0356,0.1566
SPADES TEN DIAMONDS EIGHT,0.8152,0.0256,0.1592
SPADES FOUR DIAMONDS FIVE,0.7738,0.048,0.1782
HEARTS JACK CLUBS JACK,0.0194,0.9588,0.0218
HEARTS JACK CLUBS QUEEN,0.6678,0.0136,0.3186
CLUBS NINE DIAMONDS FIVE,0.816,0.0288,0.1552
CLUBS KING HEARTS JACK,0.666,0.0156,0.3184
CLUBS EIGHT DIAMONDS FIVE,0.7988,0.0406,0.1606
CLUBS ACE HEARTS JACK,0.6654,0.017,0.3176
SPADES SEVEN DIAMONDS FIVE,0.7952,0.0452,0.1596
SPADES KING DIAMONDS EIGHT,0.7094,0.0054,0.2852
SPADES SIX DIAMONDS FIVE,0.7672,0.056,0.1768
SPADES QUEEN DIAMONDS EIGHT,0.7118,0.0112,0.277
SPADES NINE DIAMONDS FIVE,0.8294,0.027,0.1436
SPADES EIGHT DIAMONDS FIVE,0.7996,0.0372,0.1632
SPADES ACE DIAMONDS EIGHT,0.6976,0.0048,0.2976
DIAMONDS TEN DIAMONDS SIX,0.7898,0.0236,0.1866
HEARTS ACE DIAMONDS SEVEN,0.6892,0.0036,0.3072
HEARTS QUEEN DIAMONDS SEVEN,0.7206,0.0104,0.269
HEARTS KING DIAMONDS SEVEN,0.6958,0.0064,0.2978
DIAMONDS ACE DIAMONDS SIX,0.6692,0.0036,0.3272
HEARTS FOUR DIAMONDS SIX,0.784,0.048,0.168
SPADES TWO HEARTS JACK,0.8952,0.0366,0.0682
HEARTS FIVE DIAMONDS SIX,0.7678,0.0524,0.1798
SPADES TWO HEARTS TEN,0.8438,0.0206,0.1356
DIAMONDS QUEEN DIAMONDS SIX,0.683,0.0106,0.3064
HEARTS TWO DIAMONDS SIX,0.8252,0.0456,0.1292
DIAMONDS KING DIAMONDS SIX,0.6686,0.0076,0.3238
HEARTS THREE DIAMONDS SIX,0.7996,0.0468,0.1536
HEARTS EIGHT DIAMONDS SIX,0.7892,0.0396,0.1712
HEARTS NINE DIAMONDS SIX,0.7986,0.032,0.1694
HEARTS SIX DIAMONDS SIX,0.7198,0.0914,0.1888
HEARTS SEVEN DIAMONDS SIX,0.7706,0.041,0.1884
HEARTS TEN DIAMONDS SEVEN,0.8228,0.0188,0.1584
CLUBS TWO DIAMONDS SIX,0.8146,0.0476,0.1378
HEARTS JACK DIAMONDS SEVEN,0.8596,0.0346,0.1058
CLUBS THREE DIAMONDS SIX,0.8024,0.0496,0.148
CLUBS SEVEN DIAMONDS SIX,0.7784,0.04,0.1816
DIAMONDS EIGHT CLUBS JACK,0.85,0.0404,0.1096
CLUBS SIX DIAMONDS SIX,0.7206,0.0864,0.193
CLUBS TEN DIAMONDS EIGHT,0.8082,0.021,0.1708
CLUBS FIVE DIAMONDS SIX,0.7792,0.0402,0.1806
CLUBS FOUR DIAMONDS SIX,0.7924,0.0468,0.1608
HEARTS ACE HEARTS JACK,0.6282,0.0164,0.3554
DIAMONDS EIGHT CLUBS ACE,0.6832,0.0032,0.3136
HEARTS QUEEN HEARTS JACK,0.6284,0.0192,0.3524
DIAMONDS EIGHT CLUBS KING,0.709,0.0054,0.2856
CLUBS NINE DIAMONDS SIX,0.7938,0.0326,0.1736
HEARTS KING HEARTS JACK,0.6196,0.0178,0.3626
DIAMONDS EIGHT CLUBS QUEEN,0.7092,0.0108,0.28
CLUBS EIGHT DIAMONDS SIX,0.7958,0.0334,0.1708
SPADES TEN HEARTS KING,0.6952,0.0034,0.3014
SPADES FIVE DIAMONDS SIX,0.774,0.0462,0.1798
HEARTS ACE SPADES TWO,0.686,0.0044,0.3096
SPADES FOUR DIAMONDS SIX,0.7922,0.0492,0.1586
SPADES THREE DIAMONDS SIX,0.8056,0.0544,0.14
HEARTS QUEEN SPADES TWO,0.7184,0.0106,0.271
SPADES ACE SPADES KING,0.5332,0.0044,0.4624
SPADES TWO HEARTS KING,0.716,0.0074,0.2766
SPADES TWO DIAMONDS SIX,0.8224,0.0482,0.1294
HEARTS TEN HEARTS EIGHT,0.7692,0.0198,0.211
SPADES NINE DIAMONDS SIX,0.8136,0.028,0.1584
HEARTS JACK HEARTS EIGHT,0.805,0.0354,0.1596
SPADES EIGHT DIAMONDS SIX,0.7958,0.034,0.1702
SPADES SEVEN DIAMONDS SIX,0.8004,0.0374,0.1622
SPADES SIX DIAMONDS SIX,0.7272,0.0934,0.1794
SPADES KING HEARTS KING,0.1902,0.0374,0.7724
SPADES QUEEN HEARTS KING,0.572,0.0026,0.4254
CLUBS ACE CLUBS KING,0.546,0.0042,0.4498
SPADES ACE HEARTS KING,0.5638,0.0032,0.433
SPADES ACE HEARTS JACK,0.659,0.0164,0.3246
SPADES QUEEN HEARTS JACK,0.6586,0.017,0.3244
SPADES KING HEARTS JACK,0.6582,0.0172,0.3246
SPADES TEN DIAMONDS TEN,0.7282,0.105,0.1668
SPADES ACE DIAMONDS TEN,0.6824,0.0042,0.3134
SPADES TEN HEARTS JACK,0.8162,0.0328,0.151
SPADES QUEEN DIAMONDS TEN,0.6944,0.0136,0.292
SPADES KING DIAMONDS TEN,0.6934,0.0058,0.3008
SPADES NINE DIAMONDS SEVEN,0.8198,0.0292,0.151
SPADES EIGHT DIAMONDS SEVEN,0.7864,0.0362,0.1774
SPADES SEVEN DIAMONDS SEVEN,0.7136,0.097,0.1894
SPADES SIX DIAMONDS SEVEN,0.7824,0.0452,0.1724
DIAMONDS KING DIAMONDS SEVEN,0.6778,0.0054,0.3168
HEARTS THREE DIAMONDS SEVEN,0.817,0.0378,0.1452
HEARTS KING DIAMONDS FIVE,0.7058,0.0064,0.2878
DIAMONDS QUEEN DIAMONDS SEVEN,0.6702,0.0102,0.3196
HEARTS TWO DIAMONDS SEVEN,0.8336,0.0458,0.1206
HEARTS QUEEN DIAMONDS FIVE,0.7062,0.0072,0.2866
HEARTS FIVE DIAMONDS SEVEN,0.7792,0.0434,0.1774
DIAMONDS ACE DIAMONDS SEVEN,0.6606,0.0038,0.3356
HEARTS FOUR DIAMONDS SEVEN,0.7936,0.0452,0.1612
HEARTS ACE DIAMONDS FIVE,0.6834,0.004,0.3126
HEARTS SEVEN DIAMONDS SEVEN,0.72,0.094,0.186
HEARTS SIX DIAMONDS SEVEN,0.7732,0.044,0.1828
DIAMONDS SEVEN HEARTS NINE,0.7978,0.0316,0.1706
HEARTS EIGHT DIAMONDS SEVEN,0.7796,0.0374,0.183
DIAMONDS FIVE HEARTS JACK,0.8782,0.0352,0.0866
DIAMONDS TEN DIAMONDS SEVEN,0.7926,0.0238,0.1836
HEARTS TEN DIAMONDS FIVE,0.8356,0.0244,0.14
SPADES KING CLUBS TWO,0.7128,0.0084,0.2788
HEARTS KING CLUBS KING,0.198,0.0346,0.7674
CLUBS EIGHT DIAMONDS SEVEN,0.7878,0.034,0.1782
SPADES QUEEN CLUBS TWO,0.7176,0.0104,0.272
HEARTS KING CLUBS QUEEN,0.5746,0.0044,0.421
CLUBS NINE DIAMONDS SEVEN,0.7962,0.0294,0.1744
SPADES TWO CLUBS JACK,0.8852,0.0414,0.0734
SPADES ACE CLUBS TWO,0.6736,0.005,0.3214
CLUBS TEN SPADES TWO,0.8352,0.0254,0.1394
HEARTS KING CLUBS ACE,0.5636,0.0032,0.4332
CLUBS SEVEN CLUBS SIX,0.733,0.043,0.224
SPADES TWO CLUBS KING,0.7022,0.0058,0.292
SPADES TWO DIAMONDS SEVEN,0.8428,0.0472,0.11
CLUBS EIGHT CLUBS SIX,0.738,0.0394,0.2226
SPADES THREE DIAMONDS SEVEN,0.8244,0.047,0.1286
SPADES TWO CLUBS QUEEN,0.7162,0.0118,0.272
CLUBS NINE CLUBS SIX,0.762,0.0268,0.2112
SPADES FOUR DIAMONDS SEVEN,0.8066,0.0484,0.145
HEARTS KING CLUBS JACK,0.661,0.0188,0.3202
SPADES FIVE DIAMONDS SEVEN,0.7918,0.0468,0.1614
SPADES TWO CLUBS ACE,0.6848,0.0048,0.3104
CLUBS TEN HEARTS KING,0.6858,0.005,0.3092
CLUBS SIX SPADES TWO,0.8212,0.0514,0.1274
CLUBS SIX SPADES THREE,0.8002,0.05,0.1498
CLUBS TWO DIAMONDS SEVEN,0.8252,0.0438,0.131
CLUBS SIX SPADES FOUR,0.7856,0.0424,0.172
CLUBS THREE DIAMONDS SEVEN,0.8112,0.0406,0.1482
CLUBS SIX SPADES FIVE,0.7758,0.0444,0.1798
CLUBS FOUR DIAMONDS SEVEN,0.801,0.0448,0.1542
CLUBS SIX SPADES SIX,0.7276,0.0914,0.181
CLUBS FIVE DIAMONDS SEVEN,0.7836,0.0446,0.1718
CLUBS SIX SPADES SEVEN,0.7764,0.0386,0.185
CLUBS SIX DIAMONDS SEVEN,0.7706,0.0454,0.184
SPADES EIGHT CLUBS SIX,0.7756,0.0406,0.1838
CLUBS SEVEN DIAMONDS SEVEN,0.725,0.0848,0.1902
SPADES NINE CLUBS SIX,0.8086,0.0288,0.1626
SPADES TEN CLUBS TWO,0.8374,0.0258,0.1368
CLUBS TWO CLUBS QUEEN,0.6886,0.0106,0.3008
CLUBS TWO CLUBS KING,0.6846,0.005,0.3104
CLUBS THREE DIAMONDS EIGHT,0.8372,0.0386,0.1242
CLUBS TWO CLUBS ACE,0.6502,0.0032,0.3466
CLUBS TWO DIAMONDS EIGHT,0.832,0.0404,0.1276
HEARTS SEVEN DIAMONDS EIGHT,0.7712,0.0408,0.188
HEARTS SIX DIAMONDS EIGHT,0.7754,0.0434,0.1812
DIAMONDS EIGHT HEARTS NINE,0.8026,0.0328,0.1646
CLUBS TEN CLUBS TWO,0.8034,0.0196,0.177
DIAMONDS EIGHT HEARTS EIGHT,0.713,0.092,0.195
CLUBS TWO CLUBS JACK,0.835,0.0324,0.1326
CLUBS NINE DIAMONDS EIGHT,0.7932,0.03,0.1768
CLUBS EIGHT DIAMONDS EIGHT,0.7148,0.0982,0.187
CLUBS FIVE DIAMONDS EIGHT,0.801,0.0372,0.1618
SPADES ACE SPADES THREE,0.6528,0.0054,0.3418
CLUBS FOUR DIAMONDS EIGHT,0.8156,0.0348,0.1496
CLUBS SEVEN DIAMONDS EIGHT,0.7852,0.0366,0.1782
SPADES QUEEN SPADES THREE,0.6826,0.0094,0.308
CLUBS SIX DIAMONDS EIGHT,0.778,0.038,0.184
SPADES KING SPADES THREE,0.6654,0.0064,0.3282
DIAMONDS EIGHT DIAMONDS QUEEN,0.6754,0.0098,0.3148
HEARTS TWO DIAMONDS EIGHT,0.8328,0.0386,0.1286
DIAMONDS KING DIAMONDS EIGHT,0.6764,0.0056,0.318
HEARTS THREE DIAMONDS EIGHT,0.8374,0.0386,0.124
DIAMONDS ACE DIAMONDS EIGHT,0.6646,0.0056,0.3298
HEARTS FOUR DIAMONDS EIGHT,0.8072,0.046,0.1468
HEARTS FIVE DIAMONDS EIGHT,0.79,0.0414,0.1686
DIAMONDS EIGHT DIAMONDS TEN,0.7822,0.0232,0.1946
SPADES TEN SPADES THREE,0.7992,0.023,0.1778
CLUBS FOUR HEARTS ACE,0.6716,0.0044,0.324
CLUBS FOUR HEARTS QUEEN,0.707,0.0114,0.2816
CLUBS FOUR HEARTS KING,0.7068,0.0054,0.2878
CLUBS SIX HEARTS TEN,0.8168,0.0208,0.1624
CLUBS SIX HEARTS JACK,0.8694,0.0346,0.096
SPADES FOUR DIAMONDS EIGHT,0.822,0.038,0.14
SPADES FIVE DIAMONDS EIGHT,0.8082,0.0366,0.1552
DIAMONDS EIGHT SPADES TWO,0.8384,0.0418,0.1198
DIAMONDS EIGHT SPADES THREE,0.8516,0.0352,0.1132
CLUBS FOUR HEARTS JACK,0.8762,0.0336,0.0902
SPADES EIGHT DIAMONDS EIGHT,0.7224,0.0956,0.182
SPADES TEN HEARTS TWO,0.8392,0.0242,0.1366
SPADES TEN DIAMONDS QUEEN,0.6992,0.0112,0.2896
CLUBS FOUR HEARTS TEN,0.8206,0.0208,0.1586
SPADES NINE DIAMONDS EIGHT,0.8076,0.0292,0.1632
SPADES TEN HEARTS EIGHT,0.8118,0.0226,0.1656
SPADES SIX DIAMONDS EIGHT,0.7912,0.0394,0.1694
SPADES SEVEN DIAMONDS EIGHT,0.788,0.0402,0.1718
SPADES ACE HEARTS TWO,0.692,0.0052,0.3028
SPADES ACE DIAMONDS QUEEN,0.5664,0.0036,0.43
SPADES ACE HEARTS EIGHT,0.6754,0.0044,0.3202
SPADES KING HEARTS EIGHT,0.6954,0.0052,0.2994
SPADES QUEEN HEARTS TWO,0.7102,0.0114,0.2784
SPADES QUEEN DIAMONDS QUEEN,0.1656,0.08,0.7544
SPADES KING DIAMONDS QUEEN,0.5588,0.0036,0.4376
SPADES KING HEARTS TWO,0.7144,0.0042,0.2814
SPADES QUEEN HEARTS EIGHT,0.699,0.0122,0.2888
CLUBS TWO HEARTS TEN,0.8374,0.0222,0.1404
CLUBS TWO HEARTS JACK,0.8718,0.0384,0.0898
SPADES SEVEN DIAMONDS NINE,0.8048,0.0314,0.1638
SPADES SIX DIAMONDS NINE,0.81,0.0286,0.1614
SPADES NINE DIAMONDS NINE,0.7326,0.0888,0.1786
SPADES EIGHT DIAMONDS NINE,0.8018,0.0364,0.1618
SPADES TEN CLUBS KING,0.6934,0.0072,0.2994
