opposingHand,winningChance,drawChance,lostChance
CLUBS NINE DIAMONDS NINE,0.489,0.0028,0.5082
CLUBS EIGHT DIAMONDS NINE,0.6542,0.0056,0.3402
CLUBS SIX DIAMONDS NINE,0.6798,0.003,0.3172
SPADES JACK CLUBS FOUR,0.6564,0.0046,0.339
CLUBS SEVEN DIAMONDS NINE,0.6658,0.0034,0.3308
CLUBS FOUR DIAMONDS NINE,0.7014,0.0022,0.2964
CLUBS FIVE DIAMONDS NINE,0.6772,0.0034,0.3194
CLUBS TWO DIAMONDS NINE,0.703,0.004,0.293
CLUBS THREE DIAMONDS NINE,0.683,0.005,0.312
DIAMONDS NINE HEARTS EIGHT,0.65,0.0032,0.3468
DIAMONDS NINE HEARTS NINE,0.4744,0.0038,0.5218
HEARTS SIX DIAMONDS NINE,0.6876,0.0026,0.3098
DIAMONDS NINE HEARTS SEVEN,0.673,0.0026,0.3244
CLUBS EIGHT CLUBS NINE,0.6024,0.0052,0.3924
DIAMONDS ACE DIAMONDS NINE,0.6224,0.1096,0.268
HEARTS FOUR DIAMONDS NINE,0.7018,0.0042,0.294
HEARTS FIVE DIAMONDS NINE,0.6914,0.0034,0.3052
CLUBS TWO HEARTS ACE,0.6488,0.117,0.2342
DIAMONDS QUEEN DIAMONDS NINE,0.6194,0.0036,0.377
HEARTS TWO DIAMONDS NINE,0.6942,0.0034,0.3024
CLUBS TWO HEARTS KING,0.673,0.0042,0.3228
SPADES KING CLUBS FOUR,0.6674,0.0032,0.3294
DIAMONDS KING DIAMONDS NINE,0.6166,0.0044,0.379
HEARTS THREE DIAMONDS NINE,0.6844,0.0038,0.3118
CLUBS TWO HEARTS QUEEN,0.6756,0.006,0.3184
SPADES QUEEN CLUBS FOUR,0.6646,0.007,0.3284
DIAMONDS NINE DIAMONDS JACK,0.6114,0.0048,0.3838
CLUBS EIGHT SPADES NINE,0.6552,0.0048,0.34
DIAMONDS NINE DIAMONDS TEN,0.6882,0.0226,0.2892
CLUBS EIGHT SPADES EIGHT,0.4826,0.003,0.5144
CLUBS EIGHT SPADES SEVEN,0.6458,0.0038,0.3504
CLUBS EIGHT SPADES SIX,0.6586,0.0038,0.3376
CLUBS EIGHT SPADES FIVE,0.6692,0.0044,0.3264
CLUBS EIGHT SPADES FOUR,0.6758,0.0058,0.3184
CLUBS EIGHT SPADES THREE,0.6892,0.0046,0.3062
CLUBS EIGHT SPADES TWO,0.6894,0.006,0.3046
HEARTS SIX DIAMONDS TEN,0.7538,0.0226,0.2236
DIAMONDS TEN HEARTS SEVEN,0.7396,0.0178,0.2426
DIAMONDS TEN HEARTS EIGHT,0.7322,0.0206,0.2472
CLUBS FOUR CLUBS JACK,0.6444,0.005,0.3506
DIAMONDS TEN HEARTS NINE,0.735,0.0168,0.2482
CLUBS FOUR CLUBS TEN,0.7196,0.0234,0.257
CLUBS FOUR CLUBS KING,0.6282,0.006,0.3658
CLUBS FOUR CLUBS QUEEN,0.6218,0.0034,0.3748
CLUBS TWO DIAMONDS TEN,0.7682,0.0276,0.2042
CLUBS THREE DIAMONDS TEN,0.7644,0.0228,0.2128
CLUBS FOUR CLUBS ACE,0.6148,0.1114,0.2738
DIAMONDS JACK DIAMONDS TEN,0.684,0.0166,0.2994
DIAMONDS QUEEN DIAMONDS TEN,0.6832,0.017,0.2998
HEARTS TWO DIAMONDS TEN,0.7696,0.0208,0.2096
DIAMONDS KING DIAMONDS TEN,0.708,0.0186,0.2734
HEARTS THREE DIAMONDS TEN,0.7616,0.028,0.2104
DIAMONDS ACE DIAMONDS TEN,0.0684,0.861,0.0706
HEARTS FOUR DIAMONDS TEN,0.7632,0.024,0.2128
CLUBS EIGHT HEARTS JACK,0.6582,0.0042,0.3376
HEARTS FIVE DIAMONDS TEN,0.7608,0.0266,0.2126
CLUBS EIGHT HEARTS TEN,0.7282,0.0182,0.2536
CLUBS EIGHT HEARTS QUEEN,0.6612,0.0034,0.3354
CLUBS EIGHT HEARTS KING,0.6746,0.0052,0.3202
CLUBS EIGHT HEARTS ACE,0.664,0.116,0.22
CLUBS NINE SPADES THREE,0.6964,0.0044,0.2992
CLUBS NINE SPADES TWO,0.6984,0.0038,0.2978
CLUBS NINE SPADES FIVE,0.682,0.0064,0.3116
CLUBS NINE SPADES FOUR,0.7074,0.0038,0.2888
CLUBS NINE SPADES SEVEN,0.6578,0.0036,0.3386
CLUBS NINE SPADES SIX,0.666,0.005,0.329
CLUBS NINE SPADES NINE,0.4834,0.0032,0.5134
CLUBS TEN HEARTS EIGHT,0.7276,0.021,0.2514
CLUBS NINE SPADES EIGHT,0.6308,0.004,0.3652
CLUBS JACK HEARTS EIGHT,0.6426,0.0034,0.354
CLUBS QUEEN HEARTS EIGHT,0.6626,0.0036,0.3338
CLUBS KING HEARTS EIGHT,0.6742,0.0054,0.3204
CLUBS ACE HEARTS EIGHT,0.6638,0.1108,0.2254
SPADES KING CLUBS KING,0.3278,0.0038,0.6684
SPADES QUEEN CLUBS KING,0.6156,0.0054,0.379
DIAMONDS ACE HEARTS TEN,0.0618,0.9178,0.0204
HEARTS FOUR HEARTS TEN,0.7156,0.0244,0.26
DIAMONDS ACE HEARTS JACK,0.2812,0.0858,0.633
HEARTS FOUR HEARTS JACK,0.634,0.0052,0.3608
SPADES KING CLUBS FIVE,0.653,0.0052,0.3418
SPADES QUEEN CLUBS FIVE,0.6614,0.0046,0.334
DIAMONDS JACK HEARTS SEVEN,0.6502,0.0044,0.3454
HEARTS SIX DIAMONDS JACK,0.6626,0.0042,0.3332
DIAMONDS JACK HEARTS NINE,0.6412,0.0044,0.3544
DIAMONDS JACK HEARTS EIGHT,0.6494,0.004,0.3466
DIAMONDS KING DIAMONDS JACK,0.586,0.0054,0.4086
HEARTS THREE DIAMONDS JACK,0.672,0.0048,0.3232
SPADES FOUR HEARTS ACE,0.6462,0.1194,0.2344
DIAMONDS QUEEN DIAMONDS JACK,0.5754,0.0038,0.4208
HEARTS TWO DIAMONDS JACK,0.6716,0.0058,0.3226
HEARTS FIVE DIAMONDS JACK,0.6788,0.0052,0.316
SPADES FOUR HEARTS QUEEN,0.6616,0.0042,0.3342
SPADES QUEEN SPADES SIX,0.6606,0.0058,0.3336
DIAMONDS ACE DIAMONDS JACK,0.268,0.0768,0.6552
HEARTS FOUR DIAMONDS JACK,0.6468,0.0036,0.3496
SPADES FOUR HEARTS KING,0.6612,0.0062,0.3326
SPADES KING SPADES SIX,0.664,0.0052,0.3308
SPADES JACK SPADES SIX,0.6654,0.0046,0.33
SPADES FOUR DIAMONDS JACK,0.6752,0.0054,0.3194
SPADES FIVE DIAMONDS JACK,0.6576,0.0044,0.338
SPADES TWO DIAMONDS JACK,0.6602,0.004,0.3358
SPADES THREE DIAMONDS JACK,0.6794,0.005,0.3156
SPADES QUEEN DIAMONDS THREE,0.6714,0.0044,0.3242
CLUBS EIGHT DIAMONDS JACK,0.651,0.0042,0.3448
SPADES KING DIAMONDS THREE,0.671,0.005,0.324
CLUBS NINE DIAMONDS JACK,0.6448,0.0038,0.3514
CLUBS SIX DIAMONDS JACK,0.6746,0.0032,0.3222
CLUBS SEVEN DIAMONDS JACK,0.6556,0.0034,0.341
CLUBS FOUR DIAMONDS JACK,0.6724,0.004,0.3236
CLUBS FIVE DIAMONDS JACK,0.6698,0.0042,0.326
CLUBS TWO DIAMONDS JACK,0.6794,0.0052,0.3154
CLUBS THREE DIAMONDS JACK,0.6746,0.0044,0.321
SPADES JACK HEARTS SIX,0.6692,0.0048,0.326
SPADES JACK CLUBS FIVE,0.6562,0.0056,0.3382
SPADES JACK DIAMONDS THREE,0.6502,0.0042,0.3456
CLUBS SEVEN CLUBS ACE,0.615,0.1204,0.2646
CLUBS SEVEN CLUBS QUEEN,0.6278,0.0042,0.368
CLUBS SEVEN CLUBS KING,0.6264,0.0056,0.368
SPADES NINE DIAMONDS JACK,0.628,0.0036,0.3684
CLUBS SEVEN CLUBS TEN,0.6884,0.0216,0.29
DIAMONDS ACE HEARTS ACE,0.128,0.0122,0.8598
HEARTS FOUR HEARTS ACE,0.5954,0.1084,0.2962
SPADES EIGHT DIAMONDS JACK,0.65,0.0052,0.3448
CLUBS SEVEN CLUBS JACK,0.6212,0.0046,0.3742
DIAMONDS ACE HEARTS KING,0.2848,0.046,0.6692
HEARTS FOUR HEARTS KING,0.627,0.005,0.368
SPADES SEVEN DIAMONDS JACK,0.6596,0.0052,0.3352
SPADES KING HEARTS SIX,0.6554,0.0034,0.3412
DIAMONDS ACE HEARTS QUEEN,0.2894,0.0602,0.6504
HEARTS FOUR HEARTS QUEEN,0.6272,0.0052,0.3676
SPADES SIX DIAMONDS JACK,0.6608,0.0036,0.3356
SPADES QUEEN HEARTS SIX,0.6704,0.0054,0.3242
SPADES TWO DIAMONDS TEN,0.7648,0.0276,0.2076
SPADES THREE DIAMONDS TEN,0.7676,0.0232,0.2092
SPADES FOUR DIAMONDS TEN,0.7564,0.0248,0.2188
SPADES FIVE DIAMONDS TEN,0.7532,0.0278,0.219
SPADES SIX DIAMONDS TEN,0.7404,0.025,0.2346
SPADES SEVEN DIAMONDS TEN,0.727,0.0264,0.2466
SPADES EIGHT DIAMONDS TEN,0.7118,0.0204,0.2678
SPADES NINE DIAMONDS TEN,0.7388,0.0242,0.237
CLUBS FOUR DIAMONDS TEN,0.7614,0.0238,0.2148
CLUBS FIVE DIAMONDS TEN,0.7626,0.0234,0.214
CLUBS SIX DIAMONDS TEN,0.7518,0.0202,0.228
CLUBS SEVEN DIAMONDS TEN,0.7338,0.0202,0.246
CLUBS EIGHT DIAMONDS TEN,0.7332,0.0196,0.2472
CLUBS NINE DIAMONDS TEN,0.7268,0.0218,0.2514
DIAMONDS THREE CLUBS JACK,0.6638,0.0062,0.33
DIAMONDS THREE CLUBS TEN,0.7714,0.025,0.2036
DIAMONDS THREE CLUBS KING,0.6634,0.0058,0.3308
DIAMONDS THREE CLUBS QUEEN,0.6674,0.0072,0.3254
DIAMONDS THREE CLUBS ACE,0.655,0.1128,0.2322
SPADES FOUR HEARTS JACK,0.6704,0.0048,0.3248
SPADES FOUR HEARTS TEN,0.7516,0.025,0.2234
SPADES FIVE SPADES TWO,0.6688,0.007,0.3242
SPADES FOUR SPADES TWO,0.6758,0.0072,0.317
SPADES THREE SPADES TWO,0.6742,0.0066,0.3192
SPADES NINE SPADES TWO,0.6904,0.0058,0.3038
SPADES EIGHT SPADES TWO,0.6872,0.0054,0.3074
SPADES SEVEN SPADES TWO,0.6926,0.0058,0.3016
SPADES SIX SPADES TWO,0.6828,0.005,0.3122
DIAMONDS QUEEN CLUBS THREE,0.6722,0.0058,0.322
HEARTS TWO CLUBS THREE,0.6766,0.0076,0.3158
DIAMONDS QUEEN CLUBS TWO,0.6812,0.0036,0.3152
CLUBS TWO HEARTS TWO,0.5,0.0048,0.4952
DIAMONDS QUEEN HEARTS SEVEN,0.6542,0.0036,0.3422
HEARTS TWO HEARTS SEVEN,0.6506,0.0054,0.344
HEARTS SIX DIAMONDS QUEEN,0.6704,0.0042,0.3254
HEARTS SIX HEARTS TWO,0.6538,0.0056,0.3406
DIAMONDS QUEEN HEARTS NINE,0.6458,0.0032,0.351
HEARTS TWO HEARTS NINE,0.6752,0.004,0.3208
DIAMONDS QUEEN HEARTS EIGHT,0.6746,0.0026,0.3228
HEARTS TWO HEARTS EIGHT,0.6628,0.005,0.3322
CLUBS NINE HEARTS TWO,0.69,0.0036,0.3064
CLUBS NINE DIAMONDS QUEEN,0.6462,0.0056,0.3482
CLUBS EIGHT HEARTS TWO,0.6972,0.0034,0.2994
CLUBS EIGHT DIAMONDS QUEEN,0.6722,0.004,0.3238
CLUBS FIVE DIAMONDS QUEEN,0.6702,0.0054,0.3244
CLUBS FIVE HEARTS TWO,0.6708,0.0072,0.322
SPADES EIGHT HEARTS ACE,0.6544,0.113,0.2326
CLUBS FOUR DIAMONDS QUEEN,0.6558,0.0046,0.3396
CLUBS FOUR HEARTS TWO,0.6756,0.0056,0.3188
SPADES EIGHT HEARTS QUEEN,0.6536,0.005,0.3414
CLUBS SEVEN HEARTS TWO,0.7066,0.0054,0.288
CLUBS SEVEN DIAMONDS QUEEN,0.6838,0.0028,0.3134
CLUBS SIX DIAMONDS QUEEN,0.667,0.0046,0.3284
CLUBS SIX HEARTS TWO,0.674,0.0048,0.3212
SPADES EIGHT HEARTS KING,0.6708,0.0052,0.324
DIAMONDS QUEEN SPADES SIX,0.6684,0.004,0.3276
SPADES SIX HEARTS TWO,0.6772,0.0078,0.315
HEARTS FOUR CLUBS QUEEN,0.669,0.0034,0.3276
DIAMONDS ACE CLUBS QUEEN,0.2896,0.0648,0.6456
SPADES SEVEN DIAMONDS QUEEN,0.6702,0.0054,0.3244
SPADES SEVEN HEARTS TWO,0.7022,0.0044,0.2934
HEARTS FOUR CLUBS KING,0.6676,0.0038,0.3286
DIAMONDS ACE CLUBS KING,0.3002,0.0494,0.6504
SPADES EIGHT DIAMONDS QUEEN,0.6456,0.0064,0.348
SPADES EIGHT HEARTS TWO,0.6966,0.0064,0.297
HEARTS FOUR CLUBS ACE,0.6516,0.1138,0.2346
DIAMONDS ACE CLUBS ACE,0.123,0.011,0.866
SPADES NINE HEARTS TWO,0.6958,0.0068,0.2974
SPADES NINE DIAMONDS QUEEN,0.6438,0.0062,0.35
HEARTS TWO SPADES TWO,0.5036,0.0064,0.49
DIAMONDS QUEEN SPADES TWO,0.673,0.0038,0.3232
HEARTS TWO SPADES THREE,0.6638,0.0068,0.3294
DIAMONDS QUEEN SPADES THREE,0.6606,0.0064,0.333
HEARTS TWO SPADES FOUR,0.6728,0.0052,0.322
DIAMONDS QUEEN SPADES FOUR,0.6506,0.006,0.3434
HEARTS FOUR CLUBS TEN,0.7654,0.0232,0.2114
DIAMONDS ACE CLUBS TEN,0.0676,0.9118,0.0206
DIAMONDS QUEEN SPADES FIVE,0.6592,0.0048,0.336
HEARTS TWO SPADES FIVE,0.6746,0.007,0.3184
HEARTS FOUR CLUBS JACK,0.6788,0.0042,0.317
DIAMONDS ACE CLUBS JACK,0.2784,0.0944,0.6272
CLUBS FIVE CLUBS KING,0.629,0.0044,0.3666
CLUBS FIVE CLUBS QUEEN,0.6196,0.0058,0.3746
CLUBS FIVE CLUBS ACE,0.6252,0.1022,0.2726
CLUBS FIVE CLUBS JACK,0.6294,0.0072,0.3634
CLUBS FIVE CLUBS TEN,0.7122,0.026,0.2618
SPADES KING CLUBS JACK,0.6128,0.0056,0.3816
SPADES QUEEN CLUBS JACK,0.604,0.0052,0.3908
SPADES SIX CLUBS KING,0.6786,0.0038,0.3176
SPADES SIX CLUBS QUEEN,0.6638,0.004,0.3322
SPADES EIGHT HEARTS JACK,0.6536,0.004,0.3424
SPADES SIX CLUBS ACE,0.6666,0.1072,0.2262
SPADES EIGHT HEARTS TEN,0.716,0.0178,0.2662
SPADES SIX CLUBS JACK,0.6568,0.0044,0.3388
SPADES SIX CLUBS TEN,0.7388,0.0318,0.2294
SPADES JACK CLUBS JACK,0.3314,0.005,0.6636
SPADES QUEEN CLUBS SEVEN,0.666,0.0034,0.3306
SPADES KING CLUBS SEVEN,0.6716,0.0048,0.3236
SPADES SIX HEARTS TEN,0.7508,0.0244,0.2248
SPADES SIX HEARTS JACK,0.676,0.0054,0.3186
SPADES SIX HEARTS ACE,0.6674,0.1072,0.2254
SPADES SIX HEARTS KING,0.6802,0.0032,0.3166
SPADES SIX HEARTS QUEEN,0.6696,0.0044,0.326
SPADES JACK CLUBS SEVEN,0.6462,0.0048,0.349
HEARTS SIX CLUBS TEN,0.7466,0.0208,0.2326
HEARTS SIX CLUBS JACK,0.6642,0.004,0.3318
CLUBS ACE CLUBS JACK,0.2622,0.0782,0.6596
HEARTS SIX CLUBS QUEEN,0.67,0.0038,0.3262
HEARTS SIX CLUBS KING,0.6692,0.0048,0.326
HEARTS SIX CLUBS ACE,0.6642,0.1134,0.2224
CLUBS QUEEN CLUBS JACK,0.563,0.0064,0.4306
CLUBS KING CLUBS JACK,0.5728,0.0046,0.4226
DIAMONDS THREE HEARTS ACE,0.6526,0.1162,0.2312
DIAMONDS THREE HEARTS QUEEN,0.6668,0.0038,0.3294
DIAMONDS THREE HEARTS KING,0.6652,0.0048,0.33
CLUBS FIVE HEARTS JACK,0.681,0.0034,0.3156
CLUBS FIVE HEARTS TEN,0.7464,0.0262,0.2274
HEARTS FOUR SPADES JACK,0.6602,0.0058,0.334
SPADES JACK DIAMONDS ACE,0.2746,0.0854,0.64
CLUBS FIVE HEARTS ACE,0.6318,0.1146,0.2536
CLUBS FIVE HEARTS KING,0.6624,0.006,0.3316
SPADES FOUR CLUBS JACK,0.6628,0.0064,0.3308
SPADES QUEEN DIAMONDS ACE,0.2792,0.057,0.6638
HEARTS FOUR SPADES QUEEN,0.6574,0.0054,0.3372
CLUBS FIVE HEARTS QUEEN,0.6758,0.003,0.3212
SPADES FOUR CLUBS TEN,0.7598,0.0238,0.2164
SPADES KING HEARTS FOUR,0.663,0.0042,0.3328
SPADES KING DIAMONDS ACE,0.2834,0.045,0.6716
DIAMONDS QUEEN DIAMONDS ACE,0.2856,0.0604,0.654
HEARTS TWO DIAMONDS ACE,0.6518,0.1144,0.2338
HEARTS FOUR DIAMONDS QUEEN,0.6652,0.0032,0.3316
HEARTS FOUR HEARTS TWO,0.6372,0.0038,0.359
DIAMONDS THREE HEARTS TEN,0.7668,0.0238,0.2094
SPADES FOUR CLUBS KING,0.68,0.004,0.316
HEARTS FIVE DIAMONDS QUEEN,0.668,0.0046,0.3274
HEARTS FIVE HEARTS TWO,0.6532,0.006,0.3408
DIAMONDS THREE HEARTS JACK,0.6636,0.004,0.3324
SPADES FOUR CLUBS QUEEN,0.662,0.006,0.332
DIAMONDS QUEEN HEARTS TWO,0.67,0.0062,0.3238
DIAMONDS KING DIAMONDS QUEEN,0.5936,0.0036,0.4028
DIAMONDS KING HEARTS TWO,0.6708,0.0036,0.3256
HEARTS THREE DIAMONDS QUEEN,0.6664,0.0044,0.3292
HEARTS THREE HEARTS TWO,0.6266,0.0046,0.3688
SPADES FOUR CLUBS ACE,0.641,0.1158,0.2432
HEARTS TWO CLUBS ACE,0.661,0.1064,0.2326
DIAMONDS QUEEN CLUBS ACE,0.2886,0.0578,0.6536
HEARTS TWO CLUBS QUEEN,0.6742,0.0064,0.3194
DIAMONDS QUEEN CLUBS QUEEN,0.3378,0.0044,0.6578
HEARTS TWO CLUBS KING,0.689,0.0052,0.3058
DIAMONDS QUEEN CLUBS KING,0.6092,0.0044,0.3864
SPADES EIGHT SPADES FIVE,0.6616,0.0056,0.3328
HEARTS TWO CLUBS TEN,0.7578,0.0222,0.22
DIAMONDS QUEEN CLUBS TEN,0.7414,0.019,0.2396
SPADES NINE SPADES FIVE,0.6786,0.005,0.3164
HEARTS TWO CLUBS JACK,0.6764,0.0042,0.3194
DIAMONDS QUEEN CLUBS JACK,0.6208,0.0038,0.3754
SPADES SIX SPADES FIVE,0.6392,0.004,0.3568
SPADES SEVEN SPADES FIVE,0.6506,0.0046,0.3448
DIAMONDS FIVE CLUBS QUEEN,0.6684,0.0044,0.3272
SPADES EIGHT CLUBS ACE,0.661,0.1118,0.2272
CLUBS KING DIAMONDS FIVE,0.6608,0.0048,0.3344
SPADES EIGHT CLUBS KING,0.6614,0.0042,0.3344
CLUBS ACE DIAMONDS FIVE,0.6522,0.111,0.2368
SPADES EIGHT CLUBS QUEEN,0.6502,0.0032,0.3466
SPADES EIGHT CLUBS JACK,0.6478,0.0034,0.3488
SPADES EIGHT CLUBS TEN,0.7122,0.0206,0.2672
DIAMONDS FIVE CLUBS TEN,0.7592,0.0222,0.2186
DIAMONDS FIVE CLUBS JACK,0.6704,0.004,0.3256
HEARTS JACK DIAMONDS TEN,0.7162,0.0132,0.2706
DIAMONDS TEN HEARTS TEN,0.3436,0.02,0.6364
SPADES QUEEN CLUBS NINE,0.6482,0.0056,0.3462
SPADES KING CLUBS NINE,0.6554,0.0054,0.3392
HEARTS SIX HEARTS KING,0.6264,0.0052,0.3684
DIAMONDS KING SPADES SEVEN,0.6568,0.0052,0.338
HEARTS THREE SPADES SEVEN,0.6792,0.0062,0.3146
SPADES KING DIAMONDS SEVEN,0.664,0.0042,0.3318
HEARTS SIX HEARTS QUEEN,0.6312,0.0038,0.365
DIAMONDS KING SPADES SIX,0.6636,0.0072,0.3292
HEARTS THREE SPADES SIX,0.6734,0.005,0.3216
SPADES QUEEN DIAMONDS SEVEN,0.6508,0.0056,0.3436
HEARTS THREE SPADES NINE,0.6898,0.0042,0.306
SPADES NINE DIAMONDS KING,0.6512,0.0068,0.342
HEARTS SIX HEARTS ACE,0.6378,0.101,0.2612
SPADES EIGHT DIAMONDS KING,0.6726,0.0042,0.3232
HEARTS THREE SPADES EIGHT,0.6848,0.0064,0.3088
CLUBS NINE HEARTS THREE,0.6884,0.006,0.3056
CLUBS NINE DIAMONDS KING,0.6626,0.0036,0.3338
CLUBS EIGHT HEARTS THREE,0.702,0.0056,0.2924
CLUBS EIGHT DIAMONDS KING,0.666,0.0048,0.3292
HEARTS THREE SPADES THREE,0.5022,0.0052,0.4926
DIAMONDS KING SPADES THREE,0.6656,0.0046,0.3298
HEARTS THREE SPADES TWO,0.6728,0.007,0.3202
DIAMONDS KING SPADES TWO,0.674,0.0064,0.3196
DIAMONDS KING SPADES FIVE,0.6626,0.006,0.3314
HEARTS THREE SPADES FIVE,0.6604,0.0052,0.3344
HEARTS THREE SPADES FOUR,0.6574,0.0064,0.3362
DIAMONDS KING SPADES FOUR,0.659,0.0054,0.3356
DIAMONDS KING CLUBS TWO,0.6698,0.0044,0.3258
HEARTS THREE CLUBS TWO,0.6806,0.0042,0.3152
DIAMONDS KING CLUBS THREE,0.6688,0.0062,0.325
HEARTS THREE CLUBS THREE,0.5196,0.0048,0.4756
CLUBS FOUR DIAMONDS KING,0.6622,0.0042,0.3336
HEARTS THREE CLUBS FOUR,0.6636,0.0046,0.3318
DIAMONDS KING CLUBS FIVE,0.6714,0.0032,0.3254
HEARTS THREE CLUBS FIVE,0.653,0.004,0.343
CLUBS SIX DIAMONDS KING,0.6616,0.002,0.3364
HEARTS THREE CLUBS SIX,0.6812,0.0048,0.314
HEARTS THREE CLUBS SEVEN,0.6884,0.005,0.3066
CLUBS SEVEN DIAMONDS KING,0.6748,0.0044,0.3208
HEARTS THREE DIAMONDS KING,0.6708,0.007,0.3222
DIAMONDS KING DIAMONDS ACE,0.2778,0.0402,0.682
HEARTS THREE DIAMONDS ACE,0.6648,0.109,0.2262
HEARTS FOUR DIAMONDS KING,0.6668,0.0052,0.328
HEARTS FOUR HEARTS THREE,0.6274,0.0054,0.3672
HEARTS FIVE DIAMONDS KING,0.6648,0.0058,0.3294
HEARTS THREE HEARTS FIVE,0.6278,0.0058,0.3664
HEARTS SIX DIAMONDS KING,0.667,0.004,0.329
HEARTS THREE HEARTS SIX,0.6202,0.005,0.3748
DIAMONDS KING HEARTS SEVEN,0.668,0.0036,0.3284
HEARTS THREE HEARTS SEVEN,0.6488,0.0044,0.3468
DIAMONDS KING HEARTS EIGHT,0.6734,0.0048,0.3218
HEARTS THREE HEARTS EIGHT,0.6474,0.0058,0.3468
HEARTS SIX HEARTS TEN,0.7116,0.0232,0.2652
DIAMONDS KING HEARTS NINE,0.6646,0.003,0.3324
HEARTS THREE HEARTS NINE,0.6672,0.0064,0.3264
HEARTS SIX HEARTS JACK,0.6244,0.0048,0.3708
SPADES JACK DIAMONDS SEVEN,0.6554,0.0048,0.3398
HEARTS FIVE CLUBS FOUR,0.6472,0.0036,0.3492
SPADES SIX SPADES FOUR,0.6662,0.0064,0.3274
HEARTS FIVE CLUBS FIVE,0.5094,0.0038,0.4868
SPADES SEVEN SPADES FOUR,0.664,0.0054,0.3306
CLUBS SIX HEARTS FIVE,0.648,0.0058,0.3462
SPADES EIGHT SPADES FOUR,0.6764,0.0048,0.3188
SPADES NINE SPADES FOUR,0.691,0.0058,0.3032
CLUBS SEVEN HEARTS FIVE,0.6626,0.003,0.3344
SPADES QUEEN DIAMONDS FIVE,0.6574,0.0074,0.3352
SPADES KING DIAMONDS FIVE,0.6632,0.0046,0.3322
HEARTS FIVE CLUBS TWO,0.6724,0.003,0.3246
HEARTS FIVE CLUBS THREE,0.6586,0.005,0.3364
SPADES FIVE SPADES FOUR,0.6436,0.0066,0.3498
HEARTS FIVE SPADES TWO,0.6594,0.0038,0.3368
HEARTS FIVE SPADES THREE,0.6528,0.0064,0.3408
HEARTS FIVE SPADES FOUR,0.6388,0.0058,0.3554
HEARTS FIVE SPADES FIVE,0.5136,0.0046,0.4818
CLUBS EIGHT HEARTS FIVE,0.6836,0.004,0.3124
CLUBS NINE HEARTS FIVE,0.6856,0.0044,0.31
HEARTS KING DIAMONDS TEN,0.7456,0.0146,0.2398
HEARTS QUEEN DIAMONDS TEN,0.735,0.0194,0.2456
HEARTS ACE DIAMONDS TEN,0.0714,0.9074,0.0212
HEARTS FIVE HEARTS SEVEN,0.6242,0.0042,0.3716
HEARTS SIX HEARTS FIVE,0.6202,0.004,0.3758
HEARTS FIVE HEARTS NINE,0.6476,0.0046,0.3478
HEARTS FIVE HEARTS EIGHT,0.6236,0.0046,0.3718
CLUBS NINE SPADES JACK,0.6396,0.0048,0.3556
CLUBS SIX DIAMONDS ACE,0.6744,0.1026,0.223
HEARTS FOUR CLUBS SIX,0.6678,0.0044,0.3278
SPADES EIGHT SPADES THREE,0.695,0.007,0.298
SPADES NINE SPADES THREE,0.693,0.006,0.301
HEARTS FOUR CLUBS SEVEN,0.6586,0.0052,0.3362
CLUBS SEVEN DIAMONDS ACE,0.6656,0.1064,0.228
CLUBS FOUR DIAMONDS ACE,0.6418,0.1162,0.242
HEARTS FOUR CLUBS FOUR,0.505,0.0052,0.4898
SPADES SIX SPADES THREE,0.6602,0.006,0.3338
CLUBS FIVE DIAMONDS ACE,0.6486,0.1074,0.244
HEARTS FOUR CLUBS FIVE,0.6482,0.0054,0.3464
SPADES SEVEN SPADES THREE,0.684,0.0048,0.3112
CLUBS EIGHT HEARTS FOUR,0.6802,0.0048,0.315
CLUBS EIGHT DIAMONDS ACE,0.6562,0.1202,0.2236
HEARTS FOUR CLUBS NINE,0.6922,0.0044,0.3034
CLUBS NINE DIAMONDS ACE,0.6756,0.1156,0.2088
HEARTS FOUR SPADES FOUR,0.5118,0.003,0.4852
DIAMONDS ACE SPADES FOUR,0.6484,0.1196,0.232
SPADES FIVE DIAMONDS ACE,0.6394,0.1068,0.2538
HEARTS FOUR SPADES FIVE,0.6412,0.0052,0.3536
HEARTS FOUR SPADES TWO,0.675,0.007,0.318
DIAMONDS ACE SPADES TWO,0.658,0.1114,0.2306
HEARTS FOUR SPADES THREE,0.656,0.0042,0.3398
DIAMONDS ACE SPADES THREE,0.6448,0.1156,0.2396
SPADES FOUR SPADES THREE,0.6508,0.008,0.3412
SPADES EIGHT DIAMONDS ACE,0.6688,0.1062,0.225
HEARTS FOUR SPADES EIGHT,0.6726,0.0064,0.321
SPADES FIVE SPADES THREE,0.6656,0.0078,0.3266
HEARTS FOUR SPADES NINE,0.7036,0.0036,0.2928
SPADES NINE DIAMONDS ACE,0.6752,0.1196,0.2052
SPADES SIX DIAMONDS ACE,0.6758,0.1036,0.2206
HEARTS FOUR SPADES SIX,0.658,0.0062,0.3358
SPADES SEVEN DIAMONDS ACE,0.6564,0.1194,0.2242
HEARTS FOUR SPADES SEVEN,0.6654,0.005,0.3296
SPADES QUEEN SPADES EIGHT,0.653,0.0064,0.3406
DIAMONDS TEN CLUBS JACK,0.7264,0.0142,0.2594
CLUBS JACK DIAMONDS SEVEN,0.6578,0.0038,0.3384
SPADES KING SPADES EIGHT,0.6734,0.006,0.3206
DIAMONDS TEN CLUBS TEN,0.3504,0.0154,0.6342
DIAMONDS SEVEN CLUBS TEN,0.7274,0.0214,0.2512
HEARTS FIVE DIAMONDS ACE,0.6516,0.1118,0.2366
HEARTS FOUR HEARTS FIVE,0.6156,0.006,0.3784
HEARTS FOUR DIAMONDS ACE,0.6454,0.114,0.2406
CLUBS ACE DIAMONDS TEN,0.0768,0.9014,0.0218
CLUBS ACE DIAMONDS SEVEN,0.665,0.1112,0.2238
DIAMONDS TEN CLUBS KING,0.7478,0.0166,0.2356
CLUBS KING DIAMONDS SEVEN,0.6764,0.004,0.3196
DIAMONDS TEN CLUBS QUEEN,0.7332,0.0198,0.247
CLUBS QUEEN DIAMONDS SEVEN,0.6816,0.0038,0.3146
DIAMONDS ACE HEARTS NINE,0.6712,0.1128,0.216
HEARTS FOUR HEARTS NINE,0.6538,0.0032,0.343
SPADES KING SPADES JACK,0.6054,0.0064,0.3882
CLUBS NINE CLUBS TEN,0.6874,0.0226,0.29
DIAMONDS ACE HEARTS EIGHT,0.6608,0.1172,0.222
HEARTS FOUR HEARTS EIGHT,0.6446,0.0058,0.3496
SPADES QUEEN SPADES JACK,0.6122,0.0036,0.3842
CLUBS NINE CLUBS JACK,0.5996,0.0048,0.3956
DIAMONDS ACE HEARTS SEVEN,0.6578,0.1202,0.222
HEARTS FOUR HEARTS SEVEN,0.6422,0.0048,0.353
HEARTS SIX DIAMONDS ACE,0.6764,0.0994,0.2242
HEARTS FOUR HEARTS SIX,0.6108,0.004,0.3852
HEARTS ACE HEARTS QUEEN,0.2664,0.0612,0.6724
CLUBS THREE DIAMONDS ACE,0.6584,0.1134,0.2282
HEARTS FOUR CLUBS THREE,0.6598,0.0046,0.3356
SPADES JACK DIAMONDS FIVE,0.6754,0.005,0.3196
CLUBS NINE CLUBS ACE,0.6278,0.109,0.2632
CLUBS TWO DIAMONDS ACE,0.6604,0.113,0.2266
HEARTS FOUR CLUBS TWO,0.6656,0.0042,0.3302
CLUBS NINE CLUBS QUEEN,0.605,0.0058,0.3892
HEARTS KING HEARTS QUEEN,0.5852,0.0052,0.4096
SPADES JACK SPADES EIGHT,0.6328,0.006,0.3612
CLUBS NINE CLUBS KING,0.6174,0.0032,0.3794
DIAMONDS QUEEN HEARTS TEN,0.731,0.02,0.249
HEARTS TWO HEARTS TEN,0.7232,0.0222,0.2546
DIAMONDS QUEEN HEARTS JACK,0.6096,0.0042,0.3862
HEARTS TWO HEARTS JACK,0.6392,0.0054,0.3554
DIAMONDS QUEEN HEARTS KING,0.627,0.005,0.368
HEARTS TWO HEARTS KING,0.63,0.0046,0.3654
DIAMONDS QUEEN HEARTS QUEEN,0.3374,0.0042,0.6584
HEARTS TWO HEARTS QUEEN,0.633,0.0058,0.3612
DIAMONDS QUEEN HEARTS ACE,0.277,0.0604,0.6626
HEARTS TWO HEARTS ACE,0.6124,0.1068,0.2808
SPADES KING HEARTS ACE,0.2792,0.046,0.6748
SPADES QUEEN HEARTS ACE,0.2774,0.0646,0.658
SPADES JACK HEARTS ACE,0.2702,0.0816,0.6482
HEARTS SIX SPADES FOUR,0.661,0.0064,0.3326
HEARTS SIX SPADES FIVE,0.6458,0.005,0.3492
SPADES KING SPADES QUEEN,0.6074,0.0036,0.389
HEARTS SIX SPADES TWO,0.6846,0.0034,0.312
HEARTS SIX SPADES THREE,0.6636,0.0046,0.3318
HEARTS SIX SPADES EIGHT,0.6712,0.003,0.3258
SPADES JACK CLUBS THREE,0.6598,0.0078,0.3324
SPADES NINE SPADES EIGHT,0.6426,0.0046,0.3528
HEARTS SIX SPADES NINE,0.6736,0.0044,0.322
HEARTS SIX SPADES SIX,0.5044,0.0048,0.4908
HEARTS SIX SPADES SEVEN,0.649,0.0044,0.3466
SPADES QUEEN CLUBS THREE,0.6698,0.0068,0.3234
SPADES KING CLUBS THREE,0.6714,0.0078,0.3208
HEARTS SIX CLUBS FIVE,0.6566,0.0044,0.339
HEARTS SIX CLUBS FOUR,0.649,0.0034,0.3476
HEARTS SIX CLUBS SEVEN,0.6434,0.004,0.3526
CLUBS SIX HEARTS SIX,0.498,0.0048,0.4972
CLUBS NINE HEARTS SIX,0.6812,0.004,0.3148
CLUBS EIGHT HEARTS SIX,0.6668,0.0032,0.33
HEARTS SIX HEARTS SEVEN,0.6166,0.0034,0.38
HEARTS SIX HEARTS NINE,0.6296,0.0028,0.3676
HEARTS SIX HEARTS EIGHT,0.6324,0.0024,0.3652
HEARTS SIX CLUBS THREE,0.6904,0.0052,0.3044
HEARTS SIX CLUBS TWO,0.685,0.0034,0.3116
HEARTS QUEEN CLUBS JACK,0.615,0.0044,0.3806
HEARTS QUEEN CLUBS TEN,0.7224,0.0204,0.2572
CLUBS ACE HEARTS QUEEN,0.2824,0.0588,0.6588
CLUBS NINE HEARTS ACE,0.6644,0.1138,0.2218
HEARTS QUEEN CLUBS KING,0.6256,0.004,0.3704
CLUBS NINE HEARTS KING,0.6564,0.0038,0.3398
HEARTS QUEEN CLUBS QUEEN,0.3314,0.0052,0.6634
CLUBS NINE HEARTS QUEEN,0.6554,0.0038,0.3408
CLUBS NINE HEARTS JACK,0.6392,0.0024,0.3584
CLUBS NINE HEARTS TEN,0.728,0.0206,0.2514
SPADES JACK DIAMONDS NINE,0.63,0.0054,0.3646
DIAMONDS EIGHT HEARTS TEN,0.7106,0.0202,0.2692
DIAMONDS EIGHT HEARTS JACK,0.6502,0.0034,0.3464
HEARTS FIVE SPADES SIX,0.6384,0.0046,0.357
SPADES QUEEN DIAMONDS NINE,0.6524,0.0044,0.3432
HEARTS FIVE SPADES SEVEN,0.6506,0.0058,0.3436
SPADES KING DIAMONDS NINE,0.642,0.004,0.354
HEARTS FIVE SPADES EIGHT,0.6664,0.0046,0.329
SPADES EIGHT SPADES SEVEN,0.6328,0.0052,0.362
SPADES NINE SPADES SEVEN,0.6518,0.0054,0.3428
SPADES NINE HEARTS FIVE,0.6782,0.0048,0.317
HEARTS QUEEN HEARTS SEVEN,0.6204,0.0046,0.375
HEARTS KING DIAMONDS EIGHT,0.6674,0.0042,0.3284
DIAMONDS EIGHT HEARTS QUEEN,0.6746,0.0038,0.3216
HEARTS KING HEARTS SEVEN,0.6382,0.0032,0.3586
HEARTS ACE HEARTS SEVEN,0.6232,0.1158,0.261
HEARTS ACE DIAMONDS EIGHT,0.6628,0.116,0.2212
HEARTS TEN HEARTS SEVEN,0.6902,0.0234,0.2864
HEARTS JACK HEARTS SEVEN,0.6256,0.006,0.3684
HEARTS JACK DIAMONDS SIX,0.6754,0.004,0.3206
HEARTS TEN DIAMONDS SIX,0.7578,0.023,0.2192
HEARTS ACE HEARTS NINE,0.62,0.1118,0.2682
HEARTS KING HEARTS NINE,0.6158,0.0048,0.3794
HEARTS QUEEN HEARTS NINE,0.6128,0.0052,0.382
HEARTS JACK HEARTS NINE,0.6014,0.0032,0.3954
HEARTS NINE HEARTS TEN,0.6944,0.0196,0.286
HEARTS ACE CLUBS QUEEN,0.28,0.0572,0.6628
CLUBS NINE HEARTS SEVEN,0.6434,0.004,0.3526
HEARTS ACE CLUBS KING,0.3146,0.0408,0.6446
CLUBS EIGHT HEARTS SEVEN,0.6436,0.0042,0.3522
HEARTS ACE CLUBS ACE,0.1254,0.011,0.8636
SPADES QUEEN HEARTS QUEEN,0.3168,0.0036,0.6796
SPADES THREE HEARTS SEVEN,0.6862,0.0038,0.31
SPADES KING HEARTS QUEEN,0.6152,0.0044,0.3804
SPADES TWO HEARTS SEVEN,0.6984,0.004,0.2976
SPADES FIVE HEARTS SEVEN,0.6666,0.0066,0.3268
HEARTS ACE CLUBS TEN,0.0668,0.915,0.0182
SPADES FOUR HEARTS SEVEN,0.6584,0.0038,0.3378
HEARTS ACE CLUBS JACK,0.2798,0.088,0.6322
SPADES SEVEN HEARTS SEVEN,0.491,0.004,0.505
SPADES KING DIAMONDS JACK,0.5972,0.0068,0.396
SPADES SIX HEARTS SEVEN,0.6432,0.0046,0.3522
SPADES QUEEN DIAMONDS JACK,0.61,0.0052,0.3848
SPADES NINE HEARTS SEVEN,0.6518,0.0052,0.343
SPADES EIGHT HEARTS SEVEN,0.6406,0.003,0.3564
SPADES JACK HEARTS QUEEN,0.595,0.0062,0.3988
HEARTS QUEEN DIAMONDS SIX,0.6694,0.0034,0.3272
HEARTS KING DIAMONDS SIX,0.678,0.0024,0.3196
HEARTS ACE DIAMONDS SIX,0.671,0.1118,0.2172
SPADES JACK DIAMONDS JACK,0.333,0.0054,0.6616
SPADES NINE SPADES SIX,0.6692,0.0046,0.3262
SPADES EIGHT SPADES SIX,0.6494,0.0058,0.3448
SPADES SEVEN SPADES SIX,0.6484,0.0056,0.346
HEARTS SEVEN HEARTS EIGHT,0.6206,0.0036,0.3758
HEARTS NINE HEARTS SEVEN,0.6242,0.0044,0.3714
CLUBS SIX HEARTS SEVEN,0.6444,0.0042,0.3514
CLUBS SEVEN HEARTS SEVEN,0.4946,0.0026,0.5028
CLUBS FOUR HEARTS SEVEN,0.6606,0.0052,0.3342
CLUBS FIVE HEARTS SEVEN,0.6626,0.0044,0.333
CLUBS TWO HEARTS SEVEN,0.704,0.0046,0.2914
CLUBS THREE HEARTS SEVEN,0.6858,0.0032,0.311
SPADES KING HEARTS SEVEN,0.6608,0.0048,0.3344
SPADES QUEEN HEARTS SEVEN,0.6614,0.0036,0.335
SPADES JACK HEARTS SEVEN,0.6404,0.0056,0.354
CLUBS ACE HEARTS TEN,0.07,0.9076,0.0224
HEARTS NINE CLUBS TEN,0.7228,0.0228,0.2544
HEARTS NINE CLUBS JACK,0.637,0.0034,0.3596
SPADES KING HEARTS THREE,0.6734,0.0048,0.3218
SPADES KING DIAMONDS KING,0.3208,0.0032,0.676
CLUBS QUEEN HEARTS TEN,0.727,0.0154,0.2576
SPADES QUEEN DIAMONDS KING,0.613,0.005,0.382
SPADES QUEEN HEARTS THREE,0.6672,0.0054,0.3274
CLUBS KING HEARTS TEN,0.7514,0.0164,0.2322
CLUBS ACE HEARTS NINE,0.674,0.1142,0.2118
