opposingHand,winningChance,drawChance,lostChance
SPADES JACK HEARTS TEN,0.6558,0.0072,0.337
SPADES SIX HEARTS EIGHT,0.6348,0.0054,0.3598
SPADES SEVEN HEARTS EIGHT,0.6394,0.006,0.3546
CLUBS THREE HEARTS JACK,0.678,0.006,0.316
SPADES EIGHT HEARTS EIGHT,0.4744,0.0044,0.5212
CLUBS THREE HEARTS TEN,0.672,0.007,0.321
SPADES NINE HEARTS EIGHT,0.6418,0.0062,0.352
SPADES TWO HEARTS EIGHT,0.6804,0.0054,0.3142
SPADES QUEEN HEARTS NINE,0.7444,0.0238,0.2318
SPADES THREE HEARTS EIGHT,0.6794,0.0082,0.3124
SPADES FOUR HEARTS EIGHT,0.675,0.008,0.317
SPADES ACE HEARTS NINE,0.4158,0.0046,0.5796
SPADES FIVE HEARTS EIGHT,0.6538,0.0072,0.339
CLUBS EIGHT HEARTS EIGHT,0.4698,0.0062,0.524
CLUBS NINE HEARTS EIGHT,0.6166,0.0064,0.377
CLUBS THREE HEARTS KING,0.683,0.0642,0.2528
CLUBS FOUR HEARTS EIGHT,0.6508,0.0054,0.3438
CLUBS THREE HEARTS QUEEN,0.7496,0.0266,0.2238
CLUBS FIVE HEARTS EIGHT,0.647,0.0064,0.3466
CLUBS SIX HEARTS EIGHT,0.6294,0.0036,0.367
CLUBS THREE HEARTS ACE,0.414,0.0032,0.5828
CLUBS SEVEN HEARTS EIGHT,0.636,0.004,0.36
CLUBS THREE HEARTS EIGHT,0.6792,0.007,0.3138
CLUBS TWO HEARTS EIGHT,0.6658,0.0078,0.3264
SPADES TEN SPADES FOUR,0.6408,0.0074,0.3518
SPADES JACK SPADES FOUR,0.6408,0.0088,0.3504
HEARTS EIGHT HEARTS NINE,0.5944,0.0068,0.3988
SPADES QUEEN SPADES FOUR,0.7026,0.0292,0.2682
SPADES ACE SPADES FOUR,0.3962,0.0066,0.5972
HEARTS KING HEARTS TEN,0.6418,0.061,0.2972
HEARTS QUEEN HEARTS TEN,0.6726,0.029,0.2984
HEARTS ACE HEARTS TEN,0.3754,0.005,0.6196
HEARTS SEVEN CLUBS JACK,0.6596,0.005,0.3354
CLUBS TEN HEARTS SEVEN,0.6514,0.0038,0.3448
HEARTS SEVEN CLUBS KING,0.6914,0.0664,0.2422
HEARTS SEVEN CLUBS QUEEN,0.7432,0.0312,0.2256
HEARTS SEVEN CLUBS ACE,0.419,0.0036,0.5774
CLUBS SEVEN HEARTS ACE,0.4186,0.0018,0.5796
CLUBS SEVEN HEARTS KING,0.689,0.0614,0.2496
CLUBS SEVEN HEARTS QUEEN,0.7328,0.023,0.2442
CLUBS SEVEN HEARTS JACK,0.6602,0.0048,0.335
CLUBS SEVEN HEARTS TEN,0.6564,0.0066,0.337
CLUBS TEN CLUBS THREE,0.6326,0.0068,0.3606
CLUBS THREE CLUBS JACK,0.6336,0.009,0.3574
CLUBS THREE CLUBS ACE,0.4,0.0044,0.5956
CLUBS THREE CLUBS QUEEN,0.7094,0.0246,0.266
CLUBS THREE CLUBS KING,0.6466,0.0604,0.293
HEARTS TEN HEARTS JACK,0.5954,0.0072,0.3974
SPADES ACE CLUBS ACE,0.1276,0.004,0.8684
SPADES QUEEN CLUBS ACE,0.2598,0.0098,0.7304
SPADES JACK CLUBS ACE,0.4028,0.0038,0.5934
SPADES TEN CLUBS ACE,0.3914,0.0042,0.6044
SPADES EIGHT HEARTS NINE,0.6266,0.0084,0.365
SPADES NINE HEARTS NINE,0.457,0.0034,0.5396
SPADES SIX HEARTS NINE,0.6604,0.004,0.3356
SPADES SEVEN HEARTS NINE,0.6422,0.007,0.3508
CLUBS SEVEN HEARTS NINE,0.6386,0.0038,0.3576
CLUBS SIX HEARTS NINE,0.64,0.0052,0.3548
CLUBS FIVE HEARTS NINE,0.6488,0.0058,0.3454
CLUBS FOUR HEARTS NINE,0.6628,0.008,0.3292
CLUBS THREE HEARTS NINE,0.6764,0.006,0.3176
CLUBS TWO HEARTS NINE,0.6716,0.0052,0.3232
SPADES FIVE HEARTS NINE,0.665,0.0064,0.3286
SPADES FOUR HEARTS NINE,0.6686,0.007,0.3244
SPADES THREE HEARTS NINE,0.674,0.0066,0.3194
SPADES TWO HEARTS NINE,0.6838,0.0054,0.3108
CLUBS NINE HEARTS NINE,0.4462,0.0038,0.55
CLUBS EIGHT HEARTS NINE,0.6298,0.007,0.3632
